date,price,bedrooms,bathrooms,sqft_living,sqft_lot,floors,waterfront,view,condition,grade,sqft_above,sqft_basement,yr_built,yr_renovated,zipcode,lat,long,sqft_living15,sqft_lot15,ren_period,yr_renovated_dt,date_dt
10/13/2014,221900.0,3,1.0,1180,5650,1.0,0.0,0.0,3,7,1180,0.0,1955,1955.0,98178,47.5112,-122.257,1340,5650,60.0,1955,2014-10-13
12/9/2014,538000.0,3,2.25,2570,7242,2.0,0.0,0.0,3,7,2170,400.0,1951,1991.0,98125,47.721000000000004,-122.319,1690,7639,24.0,1991,2014-12-09
2/25/2015,180000.0,2,1.0,770,10000,1.0,0.0,0.0,3,6,770,0.0,1933,1933.0,98028,47.7379,-122.23299999999999,2720,8062,82.0,1933,2015-02-25
12/9/2014,604000.0,4,3.0,1960,5000,1.0,0.0,0.0,5,7,1050,910.0,1965,1965.0,98136,47.5208,-122.39299999999999,1360,5000,50.0,1965,2014-12-09
2/18/2015,510000.0,3,2.0,1680,8080,1.0,0.0,0.0,3,8,1680,0.0,1987,1987.0,98074,47.6168,-122.045,1800,7503,28.0,1987,2015-02-18
5/12/2014,1230000.0,4,4.5,5420,101930,1.0,0.0,0.0,3,11,3890,1530.0,2001,2001.0,98053,47.6561,-122.005,4760,101930,14.0,2001,2014-05-12
6/27/2014,257500.0,3,2.25,1715,6819,2.0,0.0,0.0,3,7,1715,0.0,1995,1995.0,98003,47.3097,-122.32700000000001,2238,6819,20.0,1995,2014-06-27
1/15/2015,291850.0,3,1.5,1060,9711,1.0,0.0,0.0,3,7,1060,0.0,1963,1963.0,98198,47.4095,-122.315,1650,9711,52.0,1963,2015-01-15
4/15/2015,229500.0,3,1.0,1780,7470,1.0,0.0,0.0,3,7,1050,730.0,1960,1960.0,98146,47.5123,-122.337,1780,8113,55.0,1960,2015-04-15
3/12/2015,323000.0,3,2.5,1890,6560,2.0,0.0,0.0,3,7,1890,0.0,2003,2003.0,98038,47.3684,-122.031,2390,7570,12.0,2003,2015-03-12
4/3/2015,662500.0,3,2.5,3560,9796,1.0,0.0,0.0,3,8,1860,1700.0,1965,1965.0,98007,47.6007,-122.145,2210,8925,50.0,1965,2015-04-03
5/27/2014,468000.0,2,1.0,1160,6000,1.0,0.0,0.0,4,7,860,300.0,1942,1942.0,98115,47.69,-122.292,1330,6000,73.0,1942,2014-05-27
5/28/2014,310000.0,3,1.0,1430,19901,1.5,0.0,0.0,4,7,1430,0.0,1927,1927.0,98028,47.7558,-122.229,1780,12697,88.0,1927,2014-05-28
10/7/2014,400000.0,3,1.75,1370,9680,1.0,0.0,0.0,4,7,1370,0.0,1977,1977.0,98074,47.6127,-122.045,1370,10208,38.0,1977,2014-10-07
3/12/2015,530000.0,5,2.0,1810,4850,1.5,0.0,0.0,3,7,1810,0.0,1900,1900.0,98107,47.67,-122.39399999999999,1360,4850,115.0,1900,2015-03-12
1/24/2015,650000.0,4,3.0,2950,5000,2.0,0.0,3.0,3,9,1980,970.0,1979,1979.0,98126,47.5714,-122.375,2140,4000,36.0,1979,2015-01-24
7/31/2014,395000.0,3,2.0,1890,14040,2.0,0.0,0.0,3,7,1890,0.0,1994,1994.0,98019,47.7277,-121.962,1890,14018,21.0,1994,2014-07-31
5/29/2014,485000.0,4,1.0,1600,4300,1.5,0.0,0.0,4,7,1600,0.0,1916,1916.0,98103,47.6648,-122.34299999999999,1610,4300,99.0,1916,2014-05-29
12/5/2014,189000.0,2,1.0,1200,9850,1.0,0.0,0.0,4,7,1200,0.0,1921,1921.0,98002,47.3089,-122.21,1060,5095,94.0,1921,2014-12-05
4/24/2015,230000.0,3,1.0,1250,9774,1.0,0.0,0.0,4,7,1250,0.0,1969,1969.0,98003,47.3343,-122.306,1280,8850,46.0,1969,2015-04-24
5/14/2014,385000.0,4,1.75,1620,4980,1.0,0.0,0.0,4,7,860,760.0,1947,1947.0,98133,47.7025,-122.34100000000001,1400,4980,68.0,1947,2014-05-14
8/26/2014,2000000.0,3,2.75,3050,44867,1.0,0.0,4.0,3,9,2330,720.0,1968,1968.0,98040,47.5316,-122.23299999999999,4110,20336,47.0,1968,2014-08-26
7/3/2014,285000.0,5,2.5,2270,6300,2.0,0.0,0.0,3,8,2270,0.0,1995,1995.0,98092,47.3266,-122.169,2240,7005,20.0,1995,2014-07-03
5/16/2014,252700.0,2,1.5,1070,9643,1.0,0.0,0.0,3,7,1070,0.0,1985,1985.0,98030,47.3533,-122.166,1220,8386,30.0,1985,2014-05-16
11/20/2014,329000.0,3,2.25,2450,6500,2.0,0.0,0.0,4,8,2450,0.0,1985,1985.0,98030,47.3739,-122.17200000000001,2200,6865,30.0,1985,2014-11-20
11/3/2014,233000.0,3,2.0,1710,4697,1.5,0.0,0.0,5,6,1710,0.0,1941,1941.0,98002,47.3048,-122.21799999999999,1030,4705,74.0,1941,2014-11-03
6/26/2014,937000.0,3,1.75,2450,2691,2.0,0.0,0.0,3,8,1750,700.0,1915,1915.0,98119,47.6386,-122.36,1760,3573,100.0,1915,2014-06-26
12/1/2014,667000.0,3,1.0,1400,1581,1.5,0.0,0.0,5,8,1400,0.0,1909,1909.0,98112,47.6221,-122.314,1860,3861,106.0,1909,2014-12-01
6/24/2014,438000.0,3,1.75,1520,6380,1.0,0.0,0.0,3,7,790,730.0,1948,1948.0,98115,47.695,-122.304,1520,6235,67.0,1948,2014-06-24
3/2/2015,719000.0,4,2.5,2570,7173,2.0,0.0,0.0,3,8,2570,0.0,2005,2005.0,98052,47.7073,-122.11,2630,6026,10.0,2005,2015-03-02
11/10/2014,580500.0,3,2.5,2320,3980,2.0,0.0,0.0,3,8,2320,0.0,2003,2003.0,98027,47.5391,-122.07,2580,3980,12.0,2003,2014-11-10
12/1/2014,280000.0,2,1.5,1190,1265,3.0,0.0,0.0,3,7,1190,0.0,2005,2005.0,98133,47.7274,-122.35700000000001,1390,1756,10.0,2005,2014-12-01
6/24/2014,687500.0,4,1.75,2330,5000,1.5,0.0,0.0,4,7,1510,820.0,1929,1929.0,98117,47.6823,-122.368,1460,5000,86.0,1929,2014-06-24
11/10/2014,535000.0,3,1.0,1090,3000,1.5,0.0,0.0,4,8,1090,0.0,1929,1929.0,98117,47.6889,-122.375,1570,5080,86.0,1929,2014-11-10
12/3/2014,322500.0,4,2.75,2060,6659,1.0,0.0,0.0,3,7,1280,780.0,1981,1981.0,98058,47.4276,-122.15700000000001,2020,8720,34.0,1981,2014-12-03
6/13/2014,696000.0,3,2.5,2300,3060,1.5,0.0,0.0,3,8,1510,790.0,1930,2002.0,98115,47.6827,-122.31,1590,3264,13.0,2002,2014-06-13
5/28/2014,550000.0,4,1.0,1660,34848,1.0,0.0,0.0,1,5,930,730.0,1933,1933.0,98052,47.6621,-122.132,2160,11467,82.0,1933,2014-05-28
12/30/2014,640000.0,4,2.0,2360,6000,2.0,0.0,0.0,4,8,2360,0.0,1904,1904.0,98107,47.6702,-122.36200000000001,1730,4700,111.0,1904,2014-12-30
2/13/2015,240000.0,4,1.0,1220,8075,1.0,0.0,0.0,2,7,890,330.0,1969,1969.0,98001,47.3341,-122.28200000000001,1290,7800,46.0,1969,2015-02-13
6/20/2014,605000.0,4,2.5,2620,7553,2.0,0.0,0.0,3,8,2620,0.0,1996,1996.0,98056,47.5301,-122.18,2620,11884,19.0,1996,2014-06-20
7/15/2014,625000.0,4,2.5,2570,5520,2.0,0.0,0.0,3,9,2570,0.0,2000,2000.0,98074,47.6145,-122.027,2470,5669,15.0,2000,2014-07-15
8/11/2014,775000.0,4,2.25,4220,24186,1.0,0.0,0.0,3,8,2600,1620.0,1984,1984.0,98166,47.445,-122.34700000000001,2410,30617,31.0,1984,2014-08-11
7/7/2014,861990.0,5,2.75,3595,5639,2.0,0.0,0.0,3,9,3595,0.0,2014,2014.0,98053,47.6848,-122.016,3625,5639,1.0,2014,2014-07-07
10/28/2014,685000.0,3,1.0,1570,2280,2.0,0.0,0.0,3,7,1570,0.0,1922,1922.0,98119,47.6413,-122.36399999999999,1580,2640,93.0,1922,2014-10-28
7/29/2014,309000.0,3,1.0,1280,9656,1.0,0.0,0.0,4,6,920,360.0,1959,1959.0,98058,47.4485,-122.175,1340,8808,56.0,1959,2014-07-29
7/18/2014,488000.0,3,2.5,3160,13603,2.0,0.0,0.0,3,8,3160,0.0,2003,2003.0,98019,47.7443,-121.977,3050,9232,12.0,2003,2014-07-18
3/25/2015,210490.0,3,1.0,990,8528,1.0,0.0,0.0,3,6,990,0.0,1966,1966.0,98023,47.3066,-122.37100000000001,1228,8840,49.0,1966,2015-03-25
7/16/2014,785000.0,4,2.5,2290,13416,2.0,0.0,0.0,4,9,2290,0.0,1981,1981.0,98007,47.6194,-122.15100000000001,2680,13685,34.0,1981,2014-07-16
4/28/2015,450000.0,3,1.75,1250,5963,1.0,0.0,0.0,4,7,1250,0.0,1953,1953.0,98115,47.6796,-122.301,970,5100,62.0,1953,2015-04-28
3/11/2015,1350000.0,3,2.5,2753,65005,1.0,1.0,2.0,5,9,2165,588.0,1953,1953.0,98070,47.4041,-122.45100000000001,2680,72513,62.0,1953,2015-03-11
9/16/2014,228000.0,3,1.0,1190,9199,1.0,0.0,0.0,3,7,1190,0.0,1955,1955.0,98148,47.4258,-122.322,1190,9364,60.0,1955,2014-09-16
2/17/2015,345000.0,5,2.5,3150,9134,1.0,0.0,0.0,4,8,1640,1510.0,1966,1966.0,98056,47.4934,-122.189,1990,9133,49.0,1966,2015-02-17
12/31/2014,600000.0,3,1.75,1410,4080,1.0,0.0,0.0,4,7,1000,410.0,1950,1950.0,98117,47.6808,-122.384,1410,4080,65.0,1950,2014-12-31
2/5/2015,585000.0,2,1.75,1980,8550,1.0,0.0,0.0,3,7,990,990.0,1981,1981.0,98117,47.6989,-122.369,1480,6738,34.0,1981,2015-02-05
3/3/2015,920000.0,5,2.25,2730,6000,1.5,0.0,0.0,3,8,2130,600.0,1927,1927.0,98105,47.6571,-122.281,2730,6000,88.0,1927,2015-03-03
5/12/2014,885000.0,4,2.5,2830,5000,2.0,0.0,0.0,3,9,2830,0.0,1995,1995.0,98105,47.6597,-122.29,1950,5000,20.0,1995,2014-05-12
8/19/2014,292500.0,4,2.5,2250,4495,2.0,0.0,0.0,3,7,2250,0.0,2008,2008.0,98042,47.3663,-122.11399999999999,2250,4500,7.0,2008,2014-08-19
4/7/2015,301000.0,3,2.5,2420,4750,2.0,0.0,0.0,3,8,2420,0.0,2003,2003.0,98042,47.3663,-122.12200000000001,2690,4750,12.0,2003,2015-04-07
8/27/2014,951000.0,5,3.25,3250,14342,2.0,0.0,4.0,4,8,3250,0.0,1968,1968.0,98008,47.588,-122.116,2960,11044,47.0,1968,2014-08-27
2/23/2015,430000.0,4,3.0,1850,9976,2.0,0.0,0.0,3,8,1850,0.0,1991,1991.0,98059,47.5059,-122.149,2270,8542,24.0,1991,2015-02-23
12/10/2014,650000.0,3,2.25,2150,21235,1.0,0.0,3.0,4,8,1590,560.0,1959,1959.0,98166,47.4336,-122.339,2570,18900,56.0,1959,2014-12-10
8/28/2014,289000.0,3,1.75,1260,8400,1.0,0.0,0.0,3,7,1260,0.0,1954,1954.0,98148,47.4366,-122.335,1290,8750,61.0,1954,2014-08-28
10/21/2014,505000.0,3,1.75,2519,8690,2.0,0.0,0.0,5,8,2519,0.0,1973,1973.0,98166,47.4428,-122.344,2500,9500,42.0,1973,2014-10-21
12/7/2014,549000.0,3,1.75,1540,1044,3.0,0.0,0.0,3,8,1540,0.0,2014,2014.0,98115,47.6765,-122.32,1580,3090,1.0,2014,2014-12-07
6/3/2014,425000.0,3,2.25,1660,6000,1.0,0.0,0.0,3,7,1110,550.0,1979,1979.0,98122,47.6113,-122.29700000000001,1440,4080,36.0,1979,2014-06-03
11/20/2014,317625.0,3,2.75,2770,3809,1.5,0.0,0.0,5,7,1770,1000.0,1925,1925.0,98144,47.5747,-122.304,1440,4000,90.0,1925,2014-11-20
9/9/2014,975000.0,4,2.5,2720,11049,2.0,0.0,0.0,3,10,2720,0.0,1989,1989.0,98004,47.5815,-122.19200000000001,2750,11049,26.0,1989,2014-09-09
10/9/2014,287000.0,4,2.5,2240,4648,2.0,0.0,0.0,3,7,2240,0.0,2005,2005.0,98001,47.3378,-122.257,2221,4557,10.0,2005,2014-10-09
8/25/2014,204000.0,3,1.0,1000,12070,1.0,0.0,0.0,4,7,1000,0.0,1968,1968.0,98042,47.3621,-122.11,1010,12635,47.0,1968,2014-08-25
6/12/2014,1330000.0,5,2.25,3200,20158,1.0,0.0,0.0,3,8,1600,1600.0,1965,1965.0,98004,47.6303,-122.215,3390,20158,50.0,1965,2014-06-12
9/12/2014,1040000.0,5,3.25,4770,50094,1.0,0.0,0.0,4,11,3070,1700.0,1973,1973.0,98005,47.6525,-122.16,3530,38917,42.0,1973,2014-09-12
1/5/2015,325000.0,3,2.0,1260,5612,1.0,0.0,0.0,4,7,1260,0.0,1972,1972.0,98034,47.7362,-122.179,1640,4745,43.0,1972,2015-01-05
6/10/2014,571000.0,4,2.0,2750,7807,1.5,0.0,0.0,5,7,2250,500.0,1916,1916.0,98125,47.7168,-122.287,1510,7807,99.0,1916,2014-06-10
7/10/2014,360000.0,4,2.5,2380,5000,2.0,0.0,0.0,3,8,2380,0.0,2005,2005.0,98038,47.3608,-122.036,2420,5000,10.0,2005,2014-07-10
3/16/2015,349000.0,3,1.75,1790,50529,1.0,0.0,0.0,5,7,1090,700.0,1965,1965.0,98042,47.3511,-122.073,1940,50529,50.0,1965,2015-03-16
11/5/2014,832500.0,4,4.0,3430,35102,2.0,0.0,0.0,4,10,2390,1040.0,1986,1986.0,98075,47.5822,-121.98700000000001,3240,35020,29.0,1986,2014-11-05
10/13/2014,380000.0,4,1.75,1760,7300,1.0,0.0,0.0,3,7,880,880.0,1956,1956.0,98008,47.6034,-122.125,1680,7500,59.0,1956,2014-10-13
4/20/2015,480000.0,3,1.0,1040,5060,1.0,0.0,0.0,3,7,1040,0.0,1941,1941.0,98116,47.5636,-122.39399999999999,890,5060,74.0,1941,2015-04-20
6/9/2014,410000.0,3,1.0,1410,5060,1.0,0.0,0.0,4,7,910,500.0,1956,1956.0,98133,47.7073,-122.34,1130,5693,59.0,1956,2014-06-09
3/23/2015,720000.0,4,2.5,3450,39683,2.0,0.0,0.0,3,10,3450,0.0,2002,2002.0,98010,47.342,-122.025,3350,39750,13.0,2002,2015-03-23
12/2/2014,390000.0,3,2.5,2350,5100,2.0,0.0,0.0,3,8,2350,0.0,2003,2003.0,98038,47.3512,-122.008,2350,5363,12.0,2003,2014-12-02
12/22/2014,360000.0,4,2.5,1900,5889,2.0,0.0,0.0,3,7,1900,0.0,1992,1992.0,98038,47.349,-122.031,1870,6405,23.0,1992,2014-12-22
10/28/2014,355000.0,2,1.0,2020,6720,1.0,0.0,0.0,3,7,1010,1010.0,1948,1948.0,98118,47.5474,-122.291,1720,6720,67.0,1948,2014-10-28
1/28/2015,356000.0,3,1.5,1680,8712,1.0,0.0,0.0,3,8,1680,0.0,1964,1964.0,98059,47.4811,-122.149,1850,8797,51.0,1964,2015-01-28
6/2/2014,315000.0,3,1.0,960,6634,1.0,0.0,0.0,3,6,960,0.0,1952,1952.0,98125,47.7264,-122.31,1570,7203,63.0,1952,2014-06-02
11/14/2014,940000.0,3,1.5,2140,3600,2.0,0.0,0.0,3,9,1900,240.0,1925,1925.0,98119,47.6337,-122.365,2020,4800,90.0,1925,2014-11-14
11/3/2014,305000.0,5,2.25,2660,8400,1.5,0.0,0.0,5,7,2660,0.0,1961,1961.0,98092,47.2909,-122.189,1590,8165,54.0,1961,2014-11-03
6/18/2014,461000.0,3,3.25,2770,6278,2.0,0.0,0.0,3,9,1980,790.0,2006,2006.0,98056,47.5228,-122.199,1900,7349,9.0,2006,2014-06-18
5/19/2014,215000.0,2,2.25,1610,2040,2.0,0.0,0.0,4,7,1610,0.0,1979,1979.0,98056,47.518,-122.194,1950,2025,36.0,1979,2014-05-19
9/4/2014,335000.0,2,1.75,1030,1066,2.0,0.0,0.0,3,7,765,265.0,2006,2006.0,98136,47.5394,-122.387,1030,1106,9.0,2006,2014-09-04
5/22/2014,243500.0,4,2.5,1980,7403,2.0,0.0,0.0,3,7,1980,0.0,1988,1988.0,98023,47.2897,-122.37200000000001,1980,7510,27.0,1988,2014-05-22
3/11/2015,1100000.0,5,2.75,3520,6353,2.0,0.0,0.0,4,10,3520,0.0,2001,2001.0,98199,47.6506,-122.391,2520,6250,14.0,2001,2015-03-11
2/26/2015,153000.0,3,1.0,1200,10500,1.0,0.0,0.0,3,7,1200,0.0,1962,1962.0,98023,47.321999999999996,-122.351,1350,10500,53.0,1962,2015-02-26
7/25/2014,430000.0,3,1.5,1580,5000,1.0,0.0,0.0,3,8,1290,290.0,1939,1939.0,98117,47.687,-122.38600000000001,1570,4500,76.0,1939,2014-07-25
12/23/2014,700000.0,3,1.5,1580,5000,1.0,0.0,0.0,3,8,1290,290.0,1939,1939.0,98117,47.687,-122.38600000000001,1570,4500,76.0,1939,2014-12-23
9/8/2014,905000.0,4,2.5,3300,10250,1.0,0.0,0.0,3,7,2390,910.0,1946,1991.0,98040,47.5873,-122.249,1950,6045,24.0,1991,2014-09-08
3/30/2015,247500.0,3,1.75,1960,15681,1.0,0.0,0.0,3,7,1960,0.0,1967,1967.0,98032,47.3576,-122.277,1750,15616,48.0,1967,2015-03-30
9/12/2014,199000.0,4,1.5,1160,6400,1.0,0.0,0.0,4,7,1160,0.0,1975,1975.0,98023,47.3036,-122.37799999999999,1160,6400,40.0,1975,2014-09-12
7/11/2014,314000.0,3,1.75,1810,41800,1.0,0.0,0.0,5,7,1210,600.0,1980,1980.0,98038,47.4109,-121.958,1650,135036,35.0,1980,2014-07-11
5/16/2014,437500.0,3,2.5,2320,36847,2.0,0.0,2.0,3,9,2320,0.0,1992,1992.0,98045,47.4838,-121.714,2550,35065,23.0,1992,2014-05-16
6/11/2014,850830.0,3,2.5,2070,13241,1.5,0.0,0.0,5,9,1270,800.0,1910,1910.0,98102,47.6415,-122.315,2200,4500,105.0,1910,2014-06-11
10/27/2014,555000.0,3,2.0,1980,3478,1.5,0.0,0.0,4,7,1440,540.0,1929,1929.0,98117,47.6775,-122.37200000000001,1610,3478,86.0,1929,2014-10-27
12/12/2014,699950.0,3,2.25,2190,107593,2.0,0.0,0.0,4,8,2190,0.0,1983,1983.0,98077,47.7731,-122.08,2570,47777,32.0,1983,2014-12-12
10/7/2014,1090000.0,3,2.5,2920,8113,2.0,0.0,0.0,3,8,2920,0.0,1950,2010.0,98004,47.5814,-122.196,2370,8113,5.0,2010,2014-10-07
9/24/2014,290000.0,3,1.0,1210,33919,1.0,0.0,0.0,3,7,1210,0.0,1954,1954.0,98058,47.4375,-122.184,1640,14910,61.0,1954,2014-09-24
4/2/2015,375000.0,3,2.5,2340,10005,1.0,0.0,0.0,4,8,1460,880.0,1978,1978.0,98058,47.4431,-122.133,2250,8162,37.0,1978,2015-04-02
5/23/2014,460000.0,3,1.0,1670,4005,1.5,0.0,0.0,4,7,1170,500.0,1939,1939.0,98117,47.6878,-122.38,1240,4005,76.0,1939,2014-05-23
7/23/2014,188500.0,2,1.75,1240,2493,1.0,0.0,0.0,4,8,1240,0.0,1985,1985.0,98198,47.3813,-122.322,1270,4966,30.0,1985,2014-07-23
3/5/2015,680000.0,4,2.5,3140,28037,2.0,0.0,0.0,4,10,3140,0.0,1991,1991.0,98077,47.7304,-122.08200000000001,2990,35001,24.0,1991,2015-03-05
8/27/2014,470000.0,5,1.75,2030,12342,2.0,0.0,0.0,4,7,2030,0.0,1942,1942.0,98052,47.6417,-122.109,2500,9433,73.0,1942,2014-08-27
7/25/2014,597750.0,4,2.5,2310,9624,2.0,0.0,0.0,3,8,2310,0.0,1984,1984.0,98027,47.5386,-122.053,1940,9636,31.0,1984,2014-07-25
3/4/2015,570000.0,3,1.75,1260,3328,1.0,0.0,0.0,5,6,700,560.0,1905,1905.0,98103,47.6823,-122.34899999999999,1380,3536,110.0,1905,2015-03-04
9/16/2014,272500.0,3,1.75,1540,12600,1.0,0.0,0.0,4,7,1160,0.0,1980,1980.0,98038,47.3624,-122.031,1540,11656,35.0,1980,2014-09-16
11/24/2014,329950.0,3,1.75,2080,5969,1.0,0.0,2.0,3,7,1080,1000.0,1971,1971.0,98108,47.5474,-122.295,2090,5500,44.0,1971,2014-11-24
10/28/2014,480000.0,4,2.5,3230,16171,2.0,0.0,0.0,3,9,2520,710.0,2001,2001.0,98001,47.3183,-122.25299999999999,2640,8517,14.0,2001,2014-10-28
11/21/2014,740500.0,3,3.5,4380,6350,2.0,0.0,0.0,3,8,2780,0.0,1900,1900.0,98117,47.6981,-122.368,1830,6350,115.0,1900,2014-11-21
6/26/2014,518500.0,3,3.5,1590,1102,3.0,0.0,0.0,3,8,1590,0.0,2010,2010.0,98103,47.6824,-122.34700000000001,1620,3166,5.0,2010,2014-06-26
6/23/2014,205425.0,2,1.0,880,6780,1.0,0.0,0.0,4,6,880,0.0,1945,1945.0,98178,47.5009,-122.24799999999999,1190,6780,70.0,1945,2014-06-23
1/8/2015,171800.0,4,2.0,1570,9600,1.0,0.0,0.0,3,6,1570,0.0,1950,1950.0,98168,47.4965,-122.303,1880,9000,65.0,1950,2015-01-08
5/11/2015,535000.0,4,1.0,1610,2982,1.5,0.0,0.0,4,7,1610,0.0,1925,1925.0,98144,47.586999999999996,-122.294,1610,4040,90.0,1925,2015-05-11
1/2/2015,660000.0,3,2.5,2400,6474,1.0,0.0,2.0,3,8,1560,840.0,1964,1964.0,98177,47.7728,-122.38600000000001,2340,10856,51.0,1964,2015-01-02
11/19/2014,391500.0,3,2.0,1450,9132,1.0,0.0,0.0,3,7,1450,0.0,1987,1987.0,98034,47.7288,-122.226,1580,9104,28.0,1987,2014-11-19
4/6/2015,395000.0,2,1.0,770,6000,1.0,0.0,0.0,3,6,770,0.0,1953,1953.0,98117,47.6999,-122.36399999999999,1710,6000,62.0,1953,2015-04-06
11/4/2014,445000.0,4,1.75,2100,4400,1.5,0.0,0.0,5,7,1720,380.0,1924,1924.0,98118,47.5299,-122.266,1850,4400,91.0,1924,2014-11-04
6/18/2014,770000.0,3,2.25,2910,10204,2.0,0.0,0.0,3,9,2910,0.0,1990,1990.0,98052,47.6897,-122.098,2700,13992,25.0,1990,2014-06-18
3/2/2015,1450000.0,4,2.75,2750,17789,1.5,0.0,0.0,3,8,1980,770.0,1914,1992.0,98004,47.6141,-122.212,3060,11275,23.0,1992,2015-03-02
7/17/2014,445000.0,3,2.25,2100,8201,1.0,0.0,2.0,3,8,1620,480.0,1967,1967.0,98178,47.5091,-122.244,2660,8712,48.0,1967,2014-07-17
7/17/2014,260000.0,4,2.25,2160,8811,1.0,0.0,0.0,3,8,1360,800.0,1978,1978.0,98023,47.3129,-122.39,2090,8400,37.0,1978,2014-07-17
6/13/2014,822500.0,5,3.5,2320,4960,2.0,0.0,0.0,5,7,1720,600.0,1926,1926.0,98103,47.6763,-122.352,1700,4960,89.0,1926,2014-06-13
4/6/2015,430000.0,4,2.5,2070,4310,2.0,0.0,0.0,3,7,2070,0.0,2004,2004.0,98065,47.5319,-121.85,1970,3748,11.0,2004,2015-04-06
1/5/2015,212000.0,3,1.75,1060,7875,1.0,0.0,0.0,4,7,1060,0.0,1986,1986.0,98092,47.2761,-122.152,1420,7680,29.0,1986,2015-01-05
4/28/2015,660500.0,4,2.25,2010,9603,1.0,0.0,0.0,3,8,1440,570.0,1986,1986.0,98027,47.5343,-122.054,2060,9793,29.0,1986,2015-04-28
6/12/2014,784000.0,3,3.5,3950,111078,1.5,0.0,0.0,3,9,2460,1490.0,1989,1989.0,98052,47.696999999999996,-122.072,2480,88500,26.0,1989,2014-06-12
5/12/2014,453246.0,3,2.5,2010,2287,2.0,0.0,0.0,3,8,1390,620.0,2014,2014.0,98029,47.5517,-121.99799999999999,1690,1662,1.0,2014,2014-05-12
1/26/2015,675000.0,4,3.5,2140,2278,3.0,0.0,0.0,3,9,2140,0.0,2005,2005.0,98107,47.6734,-122.38,1540,2285,10.0,2005,2015-01-26
8/13/2014,199000.0,3,1.75,1320,17390,1.0,0.0,0.0,4,7,1320,0.0,1956,1956.0,98003,47.3257,-122.296,1550,19265,59.0,1956,2014-08-13
8/5/2014,220000.0,4,1.75,2020,7840,1.0,0.0,0.0,3,7,1010,1010.0,1968,1968.0,98003,47.3309,-122.29899999999999,1750,8140,47.0,1968,2014-08-05
5/29/2014,452000.0,4,2.25,2590,10002,1.0,0.0,0.0,4,8,1340,1250.0,1968,1968.0,98028,47.7689,-122.266,1550,10436,47.0,1968,2014-05-29
7/7/2014,382500.0,2,1.0,1190,4440,1.0,0.0,0.0,3,6,1190,0.0,1981,1981.0,98125,47.7135,-122.287,1060,5715,34.0,1981,2014-07-07
5/7/2014,519950.0,3,2.25,1170,1249,3.0,0.0,0.0,3,8,1170,0.0,2014,2014.0,98107,47.6722,-122.381,1350,1310,1.0,2014,2014-05-07
6/27/2014,665000.0,2,1.0,1110,3200,1.0,0.0,0.0,3,7,1110,0.0,1925,1925.0,98119,47.6338,-122.35799999999999,1170,3600,90.0,1925,2014-06-27
7/8/2014,527700.0,5,2.5,2820,9375,1.0,0.0,0.0,4,8,1550,1270.0,1968,1968.0,98006,47.5707,-122.12799999999999,2820,9375,47.0,1968,2014-07-08
5/8/2015,205000.0,3,1.0,1610,8579,1.0,0.0,0.0,4,7,1010,600.0,1962,1962.0,98058,47.4563,-122.171,1610,8579,53.0,1962,2015-05-08
4/15/2015,420000.0,3,1.0,1060,8097,1.0,0.0,0.0,4,7,940,120.0,1923,1923.0,98133,47.7144,-122.351,1560,7940,92.0,1923,2015-04-15
2/27/2015,500000.0,4,2.25,2030,8517,1.0,0.0,0.0,4,8,1380,650.0,1961,1961.0,98006,47.5495,-122.17399999999999,2230,8824,54.0,1961,2015-02-27
12/3/2014,921500.0,4,2.5,3670,315374,2.0,0.0,0.0,4,9,3670,0.0,1994,1994.0,98077,47.7421,-122.02600000000001,2840,87991,21.0,1994,2014-12-03
6/25/2014,890000.0,4,1.0,2550,4000,2.0,0.0,0.0,3,8,2370,180.0,1905,1905.0,98109,47.6354,-122.353,2200,4000,110.0,1905,2014-06-25
8/6/2014,430000.0,2,2.5,2420,60984,2.0,0.0,0.0,3,7,2420,0.0,2007,2007.0,98027,47.5262,-121.943,1940,193842,8.0,2007,2014-08-06
10/30/2014,258000.0,5,2.0,2260,12500,1.0,0.0,0.0,4,8,1130,1130.0,1960,1960.0,98032,47.3887,-122.286,1360,18000,55.0,1960,2014-10-30
11/4/2014,511000.0,3,1.0,1430,3455,1.0,0.0,0.0,3,7,980,450.0,1947,1947.0,98103,47.6873,-122.336,1450,4599,68.0,1947,2014-11-04
8/20/2014,532170.0,3,2.0,1360,3090,2.0,0.0,0.0,3,8,1360,0.0,1990,1990.0,98103,47.6838,-122.353,1500,3090,25.0,1990,2014-08-20
4/9/2015,560000.0,3,1.0,1110,5000,1.5,0.0,0.0,3,7,1110,0.0,1947,1947.0,98107,47.655,-122.359,1420,5000,68.0,1947,2015-04-09
3/31/2015,282950.0,3,1.0,1250,8200,1.0,0.0,0.0,4,7,1250,0.0,1954,1954.0,98003,47.3255,-122.304,1680,8633,61.0,1954,2015-03-31
4/1/2015,2250000.0,4,3.25,5180,19850,2.0,0.0,3.0,3,12,3540,1640.0,2006,2006.0,98006,47.562,-122.162,3160,9750,9.0,2006,2015-04-01
5/16/2014,350000.0,1,1.0,700,5100,1.0,0.0,0.0,3,7,700,0.0,1942,1942.0,98115,47.678999999999995,-122.3,1010,5100,73.0,1942,2014-05-16
7/28/2014,215000.0,3,1.0,1180,7669,1.0,0.0,0.0,4,7,1180,0.0,1967,1967.0,98058,47.4479,-122.176,1190,7669,48.0,1967,2014-07-28
11/20/2014,650000.0,5,3.5,3960,25245,2.0,0.0,0.0,3,9,2500,1460.0,1996,1996.0,98056,47.525,-122.17200000000001,2640,13675,19.0,1996,2014-11-20
8/7/2014,320000.0,4,2.75,2640,7500,1.0,0.0,0.0,3,8,1620,1020.0,1967,1967.0,98023,47.3135,-122.369,1980,7875,48.0,1967,2014-08-07
11/13/2014,247000.0,3,2.0,1270,7198,1.5,0.0,0.0,3,7,1270,0.0,1916,2013.0,98022,47.2086,-121.99600000000001,1160,7198,2.0,2013,2014-11-13
10/3/2014,320000.0,4,1.75,1760,11180,1.0,0.0,0.0,4,8,1760,0.0,1968,1968.0,98059,47.4715,-122.118,1730,11180,47.0,1968,2014-10-03
5/7/2014,255000.0,5,2.25,2060,8632,1.0,0.0,0.0,3,7,1030,1030.0,1962,1962.0,98146,47.4877,-122.335,1010,11680,53.0,1962,2014-05-07
3/9/2015,438000.0,3,1.75,1780,9660,1.0,0.0,0.0,3,7,1780,0.0,1962,1962.0,98034,47.7171,-122.193,1200,9660,53.0,1962,2015-03-09
3/4/2015,900000.0,3,2.5,3400,16603,2.0,0.0,0.0,3,10,3400,0.0,2000,2000.0,98075,47.6012,-122.023,3400,12601,15.0,2000,2015-03-04
6/20/2014,441000.0,3,2.75,1910,7280,1.0,0.0,0.0,3,7,1160,750.0,1979,1979.0,98034,47.7319,-122.22399999999999,1710,8152,36.0,1979,2014-06-20
8/12/2014,420000.0,3,2.0,2020,38332,1.0,0.0,0.0,4,7,1010,1010.0,1975,1975.0,98027,47.4582,-122.023,2110,36590,40.0,1975,2014-08-12
12/8/2014,370000.0,3,1.75,1580,7000,1.0,0.0,0.0,3,7,1180,400.0,1976,1976.0,98034,47.7209,-122.16799999999999,1640,7500,39.0,1976,2014-12-08
2/19/2015,269950.0,2,1.75,1340,7250,1.0,0.0,0.0,5,5,700,640.0,1949,1949.0,98198,47.408,-122.32700000000001,1830,9750,66.0,1949,2015-02-19
3/24/2015,807100.0,4,2.5,2680,4499,2.0,0.0,0.0,3,9,2680,0.0,1999,1999.0,98006,47.565,-122.125,2920,4500,16.0,1999,2015-03-24
6/5/2014,653000.0,3,2.5,2680,9750,1.0,0.0,0.0,4,8,1610,1070.0,1979,1979.0,98034,47.7028,-122.23100000000001,2480,8750,36.0,1979,2014-06-05
6/11/2014,371500.0,3,2.0,1370,8336,1.0,0.0,0.0,5,7,1370,0.0,1964,1964.0,98133,47.7458,-122.331,1770,7288,51.0,1964,2014-06-11
3/16/2015,284000.0,3,1.75,1560,21000,1.0,0.0,0.0,3,7,1560,0.0,1954,1954.0,98166,47.4776,-122.337,1070,7920,61.0,1954,2015-03-16
1/2/2015,272000.0,3,1.75,2160,7140,1.0,0.0,0.0,4,7,1670,490.0,1978,1978.0,98023,47.3026,-122.374,1930,7350,37.0,1978,2015-01-02
5/2/2014,313000.0,3,1.5,1340,7912,1.5,0.0,0.0,3,7,1340,0.0,1955,1955.0,98133,47.7658,-122.339,1480,7940,60.0,1955,2014-05-02
1/16/2015,917500.0,4,2.5,3880,35003,2.0,0.0,0.0,3,10,2570,1310.0,1984,1984.0,98033,47.6477,-122.182,3740,35230,31.0,1984,2015-01-16
9/29/2014,673000.0,4,2.25,2590,8190,2.0,0.0,0.0,4,8,2590,0.0,1980,1980.0,98006,47.5619,-122.125,2260,8335,35.0,1980,2014-09-29
2/10/2015,425000.0,3,2.5,1120,1100,2.0,0.0,0.0,3,8,820,300.0,2008,2008.0,98122,47.6106,-122.31,1590,1795,7.0,2008,2015-02-10
7/9/2014,399950.0,5,2.75,1970,5400,1.0,0.0,0.0,3,7,1320,650.0,1986,1986.0,98144,47.5868,-122.30799999999999,1280,2150,29.0,1986,2014-07-09
5/30/2014,385000.0,3,1.0,1220,4800,1.0,0.0,0.0,3,6,1220,0.0,1901,1901.0,98122,47.6101,-122.307,1200,4800,114.0,1901,2014-05-30
11/17/2014,269950.0,3,1.5,1950,7560,1.0,0.0,2.0,4,7,1320,630.0,1975,1975.0,98022,47.1976,-121.999,1950,8941,40.0,1975,2014-11-17
1/7/2015,330000.0,2,1.0,1350,8220,1.0,0.0,0.0,3,7,1060,290.0,1949,1949.0,98177,47.7224,-122.35799999999999,1540,8280,66.0,1949,2015-01-07
7/25/2014,260000.0,3,2.5,1670,5797,2.0,0.0,0.0,3,7,1670,0.0,1988,1988.0,98030,47.3505,-122.179,1670,6183,27.0,1988,2014-07-25
4/14/2015,470000.0,4,3.0,2380,5125,1.5,0.0,0.0,4,7,1680,700.0,1925,1925.0,98126,47.5384,-122.376,1410,5375,90.0,1925,2015-04-14
6/13/2014,589000.0,4,3.0,2440,9600,2.0,0.0,0.0,5,7,2440,0.0,1961,1961.0,98034,47.7044,-122.2,2290,9600,54.0,1961,2014-06-13
7/23/2014,163500.0,2,1.5,1050,3419,2.0,0.0,0.0,3,7,1050,0.0,1996,1996.0,98038,47.3848,-122.039,1050,3417,19.0,1996,2014-07-23
9/5/2014,835000.0,4,2.75,3130,13412,2.0,0.0,0.0,3,9,2140,990.0,1993,1993.0,98052,47.6993,-122.102,2260,9984,22.0,1993,2014-09-05
11/21/2014,1100000.0,5,3.0,4090,12850,1.0,0.0,2.0,4,10,2090,2000.0,1986,1986.0,98033,47.6627,-122.18799999999999,2540,10270,29.0,1986,2014-11-21
4/15/2015,269000.0,4,1.75,1490,10000,1.0,0.0,0.0,4,8,1100,390.0,1969,1969.0,98023,47.3099,-122.37899999999999,2190,8910,46.0,1969,2015-04-15
5/5/2014,560000.0,3,2.5,1900,8744,2.0,0.0,0.0,3,8,1900,0.0,1987,1987.0,98074,47.62,-122.04299999999999,2030,8744,28.0,1987,2014-05-05
4/18/2015,615000.0,4,1.0,1330,2400,1.5,0.0,0.0,4,6,1330,0.0,1901,1901.0,98103,47.65,-122.34,1330,4400,114.0,1901,2015-04-18
12/5/2014,585188.0,3,2.25,2230,10026,1.0,0.0,0.0,3,8,1430,800.0,1975,1975.0,98052,47.6647,-122.15299999999999,2230,9340,40.0,1975,2014-12-05
8/18/2014,305000.0,3,1.75,1650,9480,1.0,0.0,0.0,3,7,1220,430.0,1977,1977.0,98034,47.726000000000006,-122.191,1540,8400,38.0,1977,2014-08-18
11/5/2014,166950.0,3,1.0,1190,8820,1.0,0.0,0.0,3,6,1190,0.0,1959,1959.0,98058,47.4616,-122.184,1230,7980,56.0,1959,2014-11-05
9/12/2014,799000.0,3,2.5,2140,9897,1.0,0.0,0.0,4,8,2140,0.0,1959,1959.0,98040,47.5505,-122.219,2680,10083,56.0,1959,2014-09-12
6/25/2014,400000.0,3,2.5,2180,7508,1.0,0.0,0.0,4,7,1420,760.0,1962,1962.0,98133,47.7606,-122.336,1900,7818,53.0,1962,2014-06-25
12/1/2014,230000.0,3,1.0,1060,10228,1.0,0.0,0.0,3,7,1060,0.0,1948,1948.0,98155,47.7481,-122.3,1570,10228,67.0,1948,2014-12-01
5/15/2014,256883.0,3,2.5,1690,5025,2.0,0.0,0.0,3,8,1690,0.0,2003,2003.0,98023,47.2779,-122.34700000000001,2550,5001,12.0,2003,2014-05-15
11/11/2014,423000.0,4,2.0,1970,6480,1.5,0.0,0.0,5,7,1130,840.0,1920,1920.0,98108,47.5511,-122.31200000000001,1500,6480,95.0,1920,2014-11-11
7/23/2014,465000.0,3,2.5,2150,4084,2.0,0.0,0.0,3,8,2150,0.0,2007,2007.0,98126,47.5488,-122.37200000000001,1750,2385,8.0,2007,2014-07-23
1/13/2015,440000.0,3,2.5,1910,66211,2.0,0.0,0.0,3,7,1910,0.0,1997,1997.0,98024,47.5385,-121.911,2330,67268,18.0,1997,2015-01-13
10/14/2014,385000.0,3,1.75,1350,155073,1.0,0.0,0.0,4,7,1350,0.0,1969,1969.0,98038,47.4058,-121.994,1560,50965,46.0,1969,2014-10-14
3/11/2015,210000.0,3,1.0,860,11725,1.0,0.0,0.0,4,6,860,0.0,1943,1943.0,98056,47.5093,-122.184,1300,9514,72.0,1943,2015-03-11
11/12/2014,297000.0,3,2.5,1940,14952,2.0,0.0,0.0,3,8,1940,0.0,1994,1994.0,98042,47.3777,-122.165,2030,10450,21.0,1994,2014-11-12
7/16/2014,470000.0,3,1.0,1010,5000,1.0,0.0,0.0,3,7,1010,0.0,1952,1952.0,98107,47.675,-122.39399999999999,1680,5000,63.0,1952,2014-07-16
8/4/2014,226500.0,3,1.5,1300,7370,1.0,0.0,0.0,4,7,900,400.0,1976,1976.0,98023,47.3025,-122.37,1430,7500,39.0,1976,2014-08-04
3/3/2015,274250.0,3,1.0,910,8450,1.0,0.0,0.0,4,6,910,0.0,1962,1962.0,98059,47.4787,-122.15799999999999,1400,8040,53.0,1962,2015-03-03
8/4/2014,840000.0,4,1.75,2480,11010,1.0,0.0,0.0,4,9,1630,850.0,1966,1966.0,98040,47.5378,-122.219,2770,10744,49.0,1966,2014-08-04
9/19/2014,677900.0,3,2.5,2440,4587,2.0,0.0,0.0,3,8,2440,0.0,2010,2010.0,98052,47.7073,-122.11399999999999,2750,4587,5.0,2010,2014-09-19
2/5/2015,425000.0,3,1.0,1010,5864,1.0,0.0,0.0,3,7,1010,0.0,1915,1915.0,98116,47.5733,-122.381,1290,5000,100.0,1915,2015-02-05
11/23/2014,180250.0,2,0.75,900,9600,1.0,0.0,0.0,3,6,900,0.0,1941,1941.0,98166,47.4604,-122.339,1250,14280,74.0,1941,2014-11-23
7/17/2014,464000.0,6,3.0,2300,3404,2.0,0.0,0.0,3,7,1600,700.0,1920,1994.0,98133,47.7067,-122.34299999999999,1560,1312,21.0,1994,2014-07-17
4/22/2015,320000.0,4,2.25,1550,7579,2.0,0.0,0.0,3,8,1550,0.0,1993,1993.0,98038,47.354,-122.04700000000001,1630,6397,22.0,1993,2015-04-22
7/17/2014,625504.0,3,2.25,1270,1566,2.0,0.0,0.0,3,8,1060,210.0,2014,2014.0,98105,47.6647,-122.28399999999999,1160,1327,1.0,2014,2014-07-17
5/15/2014,592500.0,4,2.5,2240,12032,1.0,0.0,0.0,3,9,2240,0.0,1983,1983.0,98074,47.6143,-122.01700000000001,2520,12368,32.0,1983,2014-05-15
1/14/2015,465000.0,3,2.5,2714,17936,2.0,0.0,0.0,3,9,2714,0.0,2005,2005.0,98001,47.3185,-122.275,2590,18386,10.0,2005,2015-01-14
5/27/2014,477000.0,4,2.75,1720,6270,2.0,0.0,0.0,3,8,1720,0.0,1978,1978.0,98118,47.5458,-122.26799999999999,2130,8700,37.0,1978,2014-05-27
1/15/2015,280000.0,2,1.0,850,16400,1.0,0.0,0.0,3,6,850,0.0,1923,1923.0,98168,47.4889,-122.29899999999999,1100,14459,92.0,1923,2015-01-15
2/21/2015,1510000.0,5,3.0,3300,33474,1.0,0.0,3.0,3,9,1870,1430.0,1957,1991.0,98040,47.5673,-122.21,3836,20953,24.0,1991,2015-02-21
7/3/2014,445838.0,3,2.5,2250,5692,2.0,0.0,0.0,3,8,2250,0.0,2000,2000.0,98146,47.5133,-122.37899999999999,1320,5390,15.0,2000,2014-07-03
8/28/2014,1070000.0,2,2.25,3900,14864,1.0,0.0,3.0,3,8,1950,1950.0,1947,1947.0,98144,47.5884,-122.291,2580,5184,68.0,1947,2014-08-28
10/23/2014,467000.0,2,1.5,1320,10800,1.0,0.0,0.0,4,8,1320,0.0,1947,1947.0,98177,47.7145,-122.367,2120,12040,68.0,1947,2014-10-23
8/22/2014,686000.0,4,2.5,2760,6440,2.0,0.0,0.0,3,10,2760,0.0,1999,1999.0,98075,47.5836,-122.02600000000001,3070,8127,16.0,1999,2014-08-22
6/5/2014,279950.0,3,2.0,1750,9750,1.0,0.0,0.0,3,7,1350,400.0,1961,1961.0,98198,47.398,-122.29899999999999,1900,10125,54.0,1961,2014-06-05
9/4/2014,527000.0,4,2.25,2330,19436,2.0,0.0,0.0,3,8,2330,0.0,1987,1987.0,98011,47.7663,-122.215,1910,10055,28.0,1987,2014-09-04
9/18/2014,325000.0,3,2.25,2220,16020,1.0,0.0,0.0,4,8,1780,440.0,1966,1966.0,98030,47.3758,-122.21700000000001,2080,9583,49.0,1966,2014-09-18
9/3/2014,328000.0,3,2.25,2020,8379,2.0,0.0,0.0,3,7,2020,0.0,1994,1994.0,98038,47.3828,-122.023,2020,8031,21.0,1994,2014-09-03
6/4/2014,390000.0,3,2.25,1250,7500,1.0,0.0,0.0,5,7,1250,0.0,1942,1942.0,98146,47.5123,-122.37299999999999,1280,7392,73.0,1942,2014-06-04
3/9/2015,479950.0,2,2.0,1510,6516,1.0,0.0,0.0,3,8,1510,0.0,2005,2005.0,98053,47.7076,-122.01299999999999,1640,6009,10.0,2005,2015-03-09
5/29/2014,264950.0,4,2.25,1720,9753,1.0,0.0,0.0,4,7,1120,600.0,1978,1978.0,98023,47.2922,-122.37100000000001,1510,9753,37.0,1978,2014-05-29
1/15/2015,235000.0,3,1.0,1430,15246,1.0,0.0,0.0,4,7,980,450.0,1961,1961.0,98031,47.4075,-122.214,1960,13068,54.0,1961,2015-01-15
3/3/2015,516500.0,3,2.5,1480,4729,2.0,0.0,0.0,3,7,1480,0.0,2004,2004.0,98053,47.6794,-122.03399999999999,2250,4729,11.0,2004,2015-03-03
4/13/2015,655000.0,2,1.75,1450,15798,2.0,1.0,4.0,3,7,1230,220.0,1915,1978.0,98166,47.4497,-122.375,2030,13193,37.0,1978,2015-04-13
6/16/2014,500000.0,4,2.75,2280,15347,1.0,0.0,0.0,5,7,2280,0.0,1960,1960.0,98059,47.5218,-122.164,2280,15347,55.0,1960,2014-06-16
11/21/2014,315000.0,6,2.75,2940,7350,1.0,0.0,0.0,3,8,1780,1160.0,1978,1978.0,98023,47.3103,-122.339,2120,8236,37.0,1978,2014-11-21
11/20/2014,213000.0,2,1.0,1000,10200,1.0,0.0,0.0,3,6,1000,0.0,1961,1961.0,98024,47.5687,-121.899,1150,13702,54.0,1961,2014-11-20
9/2/2014,475000.0,3,1.5,2480,5280,1.5,0.0,0.0,5,7,1620,860.0,1947,1947.0,98108,47.5575,-122.303,2090,4800,68.0,1947,2014-09-02
6/10/2014,1030000.0,5,4.0,3760,28040,2.0,0.0,0.0,3,10,3760,0.0,1983,1983.0,98033,47.6489,-122.18299999999999,3430,35096,32.0,1983,2014-06-10
4/9/2015,416000.0,3,2.0,2220,94300,1.0,0.0,0.0,5,7,1640,580.0,1976,1976.0,98010,47.3459,-121.95,2070,80100,39.0,1976,2015-04-09
3/20/2015,410000.0,4,1.0,1970,4740,1.5,0.0,0.0,3,7,1670,300.0,1904,2005.0,98122,47.6136,-122.303,1510,4740,10.0,2005,2015-03-20
7/1/2014,800000.0,3,3.5,3830,221284,2.0,0.0,0.0,3,10,3530,300.0,1993,1993.0,98077,47.7641,-122.023,2920,148539,22.0,1993,2014-07-01
5/29/2014,472000.0,6,2.5,4410,14034,1.0,0.0,2.0,4,9,2350,2060.0,1965,1965.0,98003,47.3376,-122.324,2600,13988,50.0,1965,2014-05-29
12/8/2014,225000.0,3,1.75,1430,8505,1.0,0.0,0.0,4,7,1430,0.0,1968,1968.0,98003,47.3173,-122.319,1190,8640,47.0,1968,2014-12-08
10/1/2014,210000.0,2,1.0,830,6000,1.0,0.0,0.0,3,6,830,0.0,1940,1940.0,98126,47.5308,-122.376,830,4960,75.0,1940,2014-10-01
1/27/2015,455000.0,2,1.0,1430,5000,1.5,0.0,0.0,2,7,1430,0.0,1925,1925.0,98115,47.6727,-122.29899999999999,1450,3750,90.0,1925,2015-01-27
4/27/2015,225000.0,3,1.0,1300,8316,1.0,0.0,0.0,4,6,1300,0.0,1954,1954.0,98002,47.3221,-122.21600000000001,1260,8316,61.0,1954,2015-04-27
8/26/2014,480000.0,2,1.0,1030,3060,1.0,0.0,2.0,4,7,790,240.0,1918,1918.0,98103,47.6779,-122.353,1390,3060,97.0,1918,2014-08-26
2/12/2015,363000.0,3,2.5,2740,11872,2.0,0.0,0.0,3,9,2740,0.0,1990,1990.0,98023,47.3076,-122.395,2570,10377,25.0,1990,2015-02-12
9/29/2014,2400000.0,4,2.5,3650,8354,1.0,1.0,4.0,3,9,1830,1820.0,2000,2000.0,98074,47.6338,-122.072,3120,18841,15.0,2000,2014-09-29
2/26/2015,181000.0,2,1.5,720,5120,1.0,0.0,0.0,3,6,720,0.0,1954,1954.0,98106,47.5218,-122.35700000000001,1150,2566,61.0,1954,2015-02-26
3/14/2015,250000.0,4,2.0,2010,7312,1.0,0.0,0.0,4,7,2010,0.0,1976,1976.0,98002,47.2785,-122.213,2010,7650,39.0,1976,2015-03-14
4/22/2015,481000.0,3,1.75,1560,3000,1.0,0.0,0.0,4,6,770,790.0,1918,1918.0,98103,47.6846,-122.345,1390,3000,97.0,1918,2015-04-22
9/23/2014,260000.0,3,2.0,1810,7209,1.0,0.0,0.0,4,7,1240,570.0,1978,1978.0,98032,47.3656,-122.27799999999999,1750,7209,37.0,1978,2014-09-23
5/13/2014,455000.0,4,2.5,3360,7685,2.0,0.0,0.0,3,9,3360,0.0,2001,2001.0,98058,47.4369,-122.111,3060,6567,14.0,2001,2014-05-13
4/1/2015,415000.0,3,2.25,1510,36224,2.0,0.0,0.0,3,8,1510,0.0,1991,1991.0,98045,47.4616,-121.711,1730,36224,24.0,1991,2015-04-01
4/21/2015,349500.0,3,1.0,1400,3538,1.0,0.0,0.0,3,7,800,600.0,1953,1953.0,98118,47.5405,-122.27,1620,6331,62.0,1953,2015-04-21
9/29/2014,245000.0,3,2.5,1730,7442,2.0,0.0,0.0,3,7,1730,0.0,1987,1987.0,98030,47.3507,-122.178,1630,6458,28.0,1987,2014-09-29
5/19/2014,592500.0,2,2.0,1420,9191,1.5,0.0,2.0,5,7,1420,0.0,1928,1928.0,98115,47.6979,-122.32,1420,6816,87.0,1928,2014-05-19
10/20/2014,385000.0,4,1.75,2360,7620,1.0,0.0,0.0,4,7,1180,1180.0,1955,1955.0,98106,47.5278,-122.345,1910,7620,60.0,1955,2014-10-20
2/11/2015,315000.0,3,1.75,1580,11455,1.0,0.0,0.0,4,7,1200,380.0,1974,1974.0,98059,47.4756,-122.147,1550,10650,41.0,1974,2015-02-11
11/24/2014,255000.0,3,1.0,1230,10170,1.0,0.0,0.0,3,7,1230,0.0,1979,1979.0,98045,47.4437,-121.772,1380,10098,36.0,1979,2014-11-24
8/29/2014,693000.0,4,2.5,2460,4425,2.0,0.0,0.0,3,8,2460,0.0,2006,2006.0,98052,47.7048,-122.109,2990,5659,9.0,2006,2014-08-29
12/2/2014,780000.0,3,1.0,1660,4400,1.5,0.0,0.0,3,8,1460,200.0,1911,1911.0,98112,47.6362,-122.302,1660,4400,104.0,1911,2014-12-02
10/24/2014,237000.0,3,1.75,1270,8470,1.0,0.0,0.0,4,7,1270,0.0,1960,1960.0,98198,47.4207,-122.29,1600,8470,55.0,1960,2014-10-24
12/16/2014,525000.0,3,2.25,2100,40510,2.0,0.0,0.0,3,10,1320,780.0,1979,1979.0,98074,47.6154,-122.04700000000001,2380,33450,36.0,1979,2014-12-16
4/28/2015,425000.0,2,1.0,770,5040,1.0,0.0,0.0,3,5,770,0.0,1930,1930.0,98144,47.5964,-122.29899999999999,1330,2580,85.0,1930,2015-04-28
10/27/2014,369900.0,1,0.75,760,10079,1.0,1.0,4.0,5,5,760,0.0,1936,1936.0,98070,47.4683,-122.43799999999999,1230,14267,79.0,1936,2014-10-27
5/19/2014,290000.0,4,2.5,1700,7280,2.0,0.0,0.0,4,7,1700,0.0,1988,1988.0,98031,47.4045,-122.171,1950,7475,27.0,1988,2014-05-19
9/29/2014,285000.0,3,1.0,1120,10701,1.0,0.0,0.0,3,7,1120,0.0,1954,1954.0,98106,47.5544,-122.35799999999999,1130,6350,61.0,1954,2014-09-29
8/14/2014,415000.0,2,1.0,1070,4500,1.0,0.0,0.0,3,7,1070,0.0,1937,1937.0,98115,47.6802,-122.29,1320,4465,78.0,1937,2014-08-14
4/9/2015,272500.0,3,2.5,2070,9900,1.0,0.0,0.0,3,8,1420,650.0,1979,1979.0,98023,47.2988,-122.37100000000001,2070,8250,36.0,1979,2015-04-09
5/4/2015,2900000.0,4,3.25,5050,20100,1.5,0.0,2.0,3,11,4750,300.0,1982,1982.0,98004,47.6312,-122.223,3890,20060,33.0,1982,2015-05-04
10/7/2014,1370000.0,4,4.75,5310,57346,2.0,0.0,0.0,4,11,5310,0.0,1989,1989.0,98077,47.7285,-122.042,4180,47443,26.0,1989,2014-10-07
5/1/2015,436000.0,2,1.0,1040,7538,1.0,0.0,0.0,4,7,1040,0.0,1939,1939.0,98133,47.7107,-122.352,1440,7530,76.0,1939,2015-05-01
10/17/2014,210000.0,3,1.0,1700,11390,1.0,0.0,0.0,4,7,1700,0.0,1967,1967.0,98003,47.3271,-122.323,1350,8164,48.0,1967,2014-10-17
9/25/2014,236000.0,3,1.0,1300,5898,1.0,0.0,0.0,3,7,1300,0.0,1961,1961.0,98178,47.5053,-122.255,1320,7619,54.0,1961,2014-09-25
11/24/2014,331000.0,3,1.75,1080,1306,1.0,0.0,0.0,3,7,580,500.0,1954,2003.0,98199,47.6601,-122.4,1440,2225,12.0,2003,2014-11-24
3/20/2015,365000.0,3,2.5,2653,4510,2.0,0.0,0.0,3,8,2653,0.0,2006,2006.0,98031,47.4145,-122.166,2653,4927,9.0,2006,2015-03-20
1/27/2015,450000.0,3,2.0,2290,16258,1.0,0.0,0.0,5,8,2290,0.0,1960,1960.0,98058,47.4672,-122.165,1660,10530,55.0,1960,2015-01-27
11/13/2014,770000.0,4,2.75,3820,26300,2.0,0.0,0.0,3,9,2850,970.0,2014,2014.0,98028,47.7618,-122.26100000000001,1860,12136,1.0,2014,2014-11-13
5/5/2015,455000.0,4,2.5,2210,49375,1.0,0.0,0.0,3,8,2210,0.0,1997,1997.0,98038,47.3828,-122.071,2670,49385,18.0,1997,2015-05-05
5/5/2015,405000.0,3,1.75,2390,6000,1.0,0.0,0.0,3,6,1240,1150.0,1908,1908.0,98118,47.5362,-122.26799999999999,2020,6000,107.0,1908,2015-05-05
7/3/2014,304900.0,4,1.75,2600,11325,1.0,0.0,0.0,4,7,1610,990.0,1969,1969.0,98031,47.3954,-122.206,1720,11088,46.0,1969,2014-07-03
2/27/2015,170000.0,2,1.0,860,5265,1.0,0.0,0.0,3,6,860,0.0,1931,1931.0,98178,47.5048,-122.272,1650,8775,84.0,1931,2015-02-27
5/13/2015,2050000.0,5,3.0,3830,8480,2.0,0.0,1.0,5,9,2630,1200.0,1905,1994.0,98122,47.6166,-122.287,3050,7556,21.0,1994,2015-05-13
6/30/2014,780000.0,4,2.5,3500,7048,2.0,0.0,0.0,3,9,3500,0.0,2005,2005.0,98053,47.6811,-122.025,3920,7864,10.0,2005,2014-06-30
4/10/2015,330000.0,3,3.0,2420,13959,1.0,0.0,0.0,4,8,1740,680.0,1988,1988.0,98028,47.7486,-122.23,2570,13300,27.0,1988,2015-04-10
9/5/2014,370000.0,4,2.5,2720,8666,2.0,0.0,0.0,3,9,2720,0.0,1992,1992.0,98030,47.3846,-122.169,2410,8100,23.0,1992,2014-09-05
10/17/2014,467000.0,5,2.25,2500,13500,1.0,0.0,0.0,3,7,1850,650.0,1979,1979.0,98072,47.7564,-122.14399999999999,2300,9750,36.0,1979,2014-10-17
2/9/2015,405000.0,3,1.75,1670,6720,1.0,0.0,0.0,3,7,1140,530.0,1980,1980.0,98034,47.7198,-122.193,1670,7320,35.0,1980,2015-02-09
7/2/2014,675000.0,5,2.25,2900,10300,1.0,0.0,0.0,3,8,1450,1450.0,1985,1985.0,98006,47.5461,-122.15100000000001,2310,10300,30.0,1985,2014-07-02
8/12/2014,500000.0,2,1.0,1640,14100,1.0,0.0,0.0,4,7,1140,500.0,1954,1954.0,98006,47.5712,-122.14299999999999,1520,13527,61.0,1954,2014-08-12
7/23/2014,389999.0,4,2.5,1890,15770,2.0,0.0,0.0,4,7,1890,0.0,1968,1968.0,98166,47.4281,-122.34299999999999,2410,15256,47.0,1968,2014-07-23
2/24/2015,630000.0,4,1.75,2950,9025,1.0,0.0,2.0,4,8,1780,1170.0,1975,1975.0,98034,47.7128,-122.223,2120,9600,40.0,1975,2015-02-24
10/22/2014,360000.0,4,2.5,2160,9528,2.0,0.0,0.0,3,9,2160,0.0,1992,1992.0,98001,47.3341,-122.255,2280,9937,23.0,1992,2014-10-22
10/2/2014,580000.0,4,3.0,3280,11060,2.0,0.0,0.0,3,8,2270,1010.0,1986,1986.0,98056,47.5399,-122.181,2320,11004,29.0,1986,2014-10-02
7/9/2014,550000.0,3,2.0,1970,4166,2.0,0.0,3.0,5,8,1270,700.0,1929,1929.0,98126,47.5717,-122.375,2390,4166,86.0,1929,2014-07-09
7/10/2014,879000.0,4,2.5,3360,22111,2.0,0.0,0.0,3,10,3360,0.0,1994,1994.0,98075,47.5951,-122.01700000000001,3150,11374,21.0,1994,2014-07-10
8/22/2014,265000.0,3,2.0,1320,8959,1.0,0.0,0.0,3,7,1320,0.0,1993,1993.0,98042,47.3536,-122.14399999999999,1740,7316,22.0,1993,2014-08-22
3/4/2015,446500.0,3,2.5,2650,7286,2.0,0.0,0.0,3,8,2650,0.0,1990,1990.0,98059,47.5084,-122.154,2400,7220,25.0,1990,2015-03-04
6/2/2014,404000.0,3,1.5,2030,8880,1.0,0.0,0.0,3,7,1330,700.0,1963,1963.0,98108,47.5586,-122.311,2140,5592,52.0,1963,2014-06-02
5/29/2014,267500.0,3,1.75,1590,11914,1.0,0.0,2.0,3,7,1090,500.0,1957,1957.0,98188,47.4427,-122.274,1630,9052,58.0,1957,2014-05-29
6/24/2014,3080000.0,4,5.0,4550,18641,1.0,1.0,4.0,3,10,2600,1950.0,2002,2002.0,98074,47.6053,-122.07700000000001,4550,19508,13.0,2002,2014-06-24
8/11/2014,335000.0,3,2.5,2440,7632,2.0,0.0,0.0,3,8,2440,0.0,1998,1998.0,98003,47.3494,-122.301,2510,7903,17.0,1998,2014-08-11
6/19/2014,576000.0,3,2.5,1940,9000,1.0,0.0,0.0,4,7,970,970.0,1948,1948.0,98117,47.6933,-122.39299999999999,2190,7310,67.0,1948,2014-06-19
4/1/2015,208633.0,3,2.5,2040,3810,2.0,0.0,0.0,3,8,2040,0.0,2006,2006.0,98038,47.3537,-122.0,2370,4590,9.0,2006,2015-04-01
1/15/2015,315000.0,3,2.25,2200,8750,1.0,0.0,0.0,4,7,1120,1080.0,1964,1964.0,98166,47.476000000000006,-122.337,1460,10139,51.0,1964,2015-01-15
2/17/2015,725000.0,3,1.75,1920,3300,1.0,0.0,0.0,4,8,960,960.0,1913,1913.0,98112,47.6239,-122.29799999999999,1740,4000,102.0,1913,2015-02-17
4/3/2015,550000.0,4,2.75,1800,7750,1.0,0.0,0.0,4,8,1400,400.0,1965,1965.0,98177,47.7776,-122.384,1800,8275,50.0,1965,2015-04-03
6/12/2014,610750.0,4,2.25,2180,7297,2.0,0.0,0.0,3,8,2180,0.0,1984,1984.0,98074,47.6459,-122.05799999999999,2250,9781,31.0,1984,2014-06-12
2/28/2015,550700.0,2,1.0,1010,5000,1.5,0.0,0.0,4,6,1010,0.0,1908,1908.0,98105,47.6692,-122.29700000000001,1460,5000,107.0,1908,2015-02-28
1/8/2015,665000.0,4,2.75,3320,10574,2.0,0.0,0.0,5,8,2220,0.0,1960,1960.0,98056,47.5376,-122.18,2720,8330,55.0,1960,2015-01-08
2/9/2015,834000.0,4,2.5,2370,4000,1.5,0.0,2.0,5,8,1980,390.0,1928,1928.0,98144,47.601000000000006,-122.294,2440,5750,87.0,1928,2015-02-09
10/23/2014,201000.0,5,1.75,1660,78408,1.5,0.0,0.0,3,6,1660,0.0,1915,1915.0,98065,47.528999999999996,-121.837,1660,78408,100.0,1915,2014-10-23
5/2/2014,2380000.0,5,2.5,3650,9050,2.0,0.0,4.0,5,10,3370,280.0,1921,1921.0,98119,47.6345,-122.367,2880,5400,94.0,1921,2014-05-02
6/18/2014,1380000.0,4,3.25,4290,12103,1.0,0.0,3.0,3,11,2690,1600.0,1997,1997.0,98006,47.5503,-122.102,3860,11244,18.0,1997,2014-06-18
12/9/2014,1400000.0,4,3.25,4290,12103,1.0,0.0,3.0,3,11,2690,1600.0,1997,1997.0,98006,47.5503,-122.102,3860,11244,18.0,1997,2014-12-09
11/5/2014,305000.0,4,2.25,1950,7700,1.0,0.0,0.0,3,8,1350,600.0,1979,1979.0,98058,47.4441,-122.125,2150,7350,36.0,1979,2014-11-05
4/8/2015,487000.0,3,2.0,2590,14052,1.0,0.0,0.0,5,8,1720,870.0,1948,1948.0,98133,47.7357,-122.333,1570,8162,67.0,1948,2015-04-08
5/11/2015,390000.0,3,2.5,1930,64904,1.0,0.0,0.0,4,8,1930,0.0,1988,1988.0,98042,47.346000000000004,-122.15700000000001,2350,57500,27.0,1988,2015-05-11
7/23/2014,548000.0,2,1.0,1470,3864,1.0,0.0,0.0,4,7,1170,300.0,1916,1916.0,98103,47.6638,-122.345,1570,3864,99.0,1916,2014-07-23
11/22/2014,268750.0,4,1.0,800,8775,1.0,0.0,0.0,3,6,800,0.0,1943,1943.0,98166,47.48,-122.336,1310,8775,72.0,1943,2014-11-22
5/13/2014,819900.0,5,2.75,3150,7119,2.0,0.0,0.0,3,9,3150,0.0,2013,2013.0,98052,47.6759,-122.15100000000001,1560,8384,2.0,2013,2014-05-13
10/23/2014,520000.0,3,2.25,2030,16200,2.0,0.0,0.0,3,8,2030,0.0,1984,1984.0,98027,47.5162,-122.057,2660,17958,31.0,1984,2014-10-23
7/21/2014,230000.0,3,2.0,1450,11204,1.0,0.0,0.0,3,7,1450,0.0,2003,2003.0,98001,47.2639,-122.25200000000001,1520,9518,12.0,2003,2014-07-21
2/2/2015,240000.0,3,1.75,1510,10248,1.0,0.0,0.0,3,7,1510,0.0,1969,1969.0,98023,47.2929,-122.37100000000001,1510,9753,46.0,1969,2015-02-02
9/5/2014,232000.0,2,1.0,1240,12092,1.0,0.0,0.0,3,6,960,280.0,1922,1984.0,98146,47.4957,-122.352,1820,7460,31.0,1984,2014-09-05
3/11/2015,240500.0,2,1.0,1240,12092,1.0,0.0,0.0,3,6,960,280.0,1922,1984.0,98146,47.4957,-122.352,1820,7460,31.0,1984,2015-03-11
10/27/2014,274975.0,3,2.5,3030,45004,2.0,0.0,0.0,3,9,3030,0.0,1987,1987.0,98077,47.7721,-122.09299999999999,3080,35781,28.0,1987,2014-10-27
9/5/2014,740000.0,4,2.0,2050,4400,1.5,0.0,0.0,4,9,2050,0.0,1922,1922.0,98102,47.644,-122.319,2320,5500,93.0,1922,2014-09-05
4/28/2015,186375.0,3,1.0,1000,7636,1.0,0.0,0.0,2,7,1000,0.0,1952,1952.0,98166,47.472,-122.344,1150,7600,63.0,1952,2015-04-28
7/25/2014,790000.0,3,2.25,2370,10289,1.0,0.0,0.0,4,9,1590,780.0,1977,1977.0,98005,47.592,-122.166,2500,10004,38.0,1977,2014-07-25
9/16/2014,880000.0,4,3.5,2800,6750,2.0,0.0,0.0,3,9,1890,910.0,1951,2002.0,98105,47.669,-122.275,2370,6120,13.0,2002,2014-09-16
4/16/2015,279000.0,6,1.75,2240,11180,2.0,0.0,0.0,4,7,2240,0.0,1955,1955.0,98198,47.42,-122.323,1590,7955,60.0,1955,2015-04-16
7/29/2014,295000.0,3,2.0,1810,10530,1.0,0.0,2.0,3,8,1810,0.0,1991,1991.0,98022,47.1913,-122.012,1910,10450,24.0,1991,2014-07-29
4/8/2015,640000.0,2,1.0,1070,5000,1.0,0.0,0.0,3,7,1070,0.0,1924,1924.0,98103,47.6666,-122.331,1710,5000,91.0,1924,2015-04-08
7/3/2014,940000.0,4,2.0,2490,9525,2.0,0.0,0.0,5,9,2490,0.0,1968,1968.0,98040,47.5639,-122.21700000000001,2770,9525,47.0,1968,2014-07-03
10/7/2014,260000.0,4,2.5,1960,5238,2.0,0.0,0.0,3,7,1960,0.0,2003,2003.0,98038,47.3483,-122.052,1800,5894,12.0,2003,2014-10-07
6/2/2014,559900.0,3,2.75,2930,5569,1.0,0.0,0.0,3,9,1860,1070.0,2004,2004.0,98072,47.7648,-122.164,2580,11045,11.0,2004,2014-06-02
7/22/2014,791500.0,4,2.0,1510,3500,1.5,0.0,0.0,5,7,1510,0.0,1911,1911.0,98103,47.6794,-122.35700000000001,1820,3750,104.0,1911,2014-07-22
8/26/2014,265000.0,3,1.75,1420,8250,1.0,0.0,0.0,3,7,1420,0.0,1954,1954.0,98133,47.7535,-122.354,1740,8000,61.0,1954,2014-08-26
5/1/2015,245000.0,3,1.75,1740,11547,1.0,0.0,0.0,3,7,1740,0.0,1954,1954.0,98178,47.4945,-122.22,880,78408,61.0,1954,2015-05-01
4/24/2015,485000.0,4,1.75,2560,43995,2.0,0.0,0.0,4,7,2560,0.0,1962,1962.0,98052,47.6945,-122.09299999999999,2560,14764,53.0,1962,2015-04-24
11/6/2014,684000.0,4,3.5,3040,8414,2.0,0.0,0.0,3,9,2420,620.0,2010,2010.0,98059,47.5222,-122.15700000000001,3470,8066,5.0,2010,2014-11-06
9/9/2014,425000.0,3,1.75,2500,6840,1.0,0.0,0.0,3,8,1300,1200.0,1957,1957.0,98125,47.7222,-122.32,1580,8691,58.0,1957,2014-09-09
10/17/2014,309600.0,4,1.75,1275,20000,1.0,0.0,0.0,4,6,1275,0.0,1991,1991.0,98070,47.3796,-122.49,1660,20000,24.0,1991,2014-10-17
7/18/2014,552250.0,4,2.5,2580,5823,2.0,0.0,0.0,3,8,2580,0.0,2002,2002.0,98065,47.5374,-121.875,2380,5823,13.0,2002,2014-07-18
7/23/2014,165000.0,4,1.0,1000,7134,1.0,0.0,0.0,3,6,1000,0.0,1943,1943.0,98178,47.4897,-122.24,1020,7138,72.0,1943,2014-07-23
12/29/2014,239900.0,4,1.0,1000,7134,1.0,0.0,0.0,3,6,1000,0.0,1943,1943.0,98178,47.4897,-122.24,1020,7138,72.0,1943,2014-12-29
12/5/2014,320000.0,2,1.0,1070,32633,1.0,0.0,0.0,4,6,1070,0.0,1930,1930.0,98059,47.4716,-122.07799999999999,1360,32156,85.0,1930,2014-12-05
10/21/2014,206600.0,3,2.0,1390,13464,1.0,0.0,0.0,4,7,1390,0.0,1987,1987.0,98030,47.3581,-122.17299999999999,1720,12080,28.0,1987,2014-10-21
4/16/2015,387000.0,4,1.75,2500,7690,1.0,0.0,0.0,3,7,1250,1250.0,1973,1973.0,98155,47.7713,-122.307,2040,8646,42.0,1973,2015-04-16
6/4/2014,299000.0,1,0.75,560,12120,1.0,0.0,0.0,3,4,560,0.0,1967,1967.0,98014,47.675,-121.854,1300,19207,48.0,1967,2014-06-04
9/22/2014,855000.0,4,2.75,2270,10460,2.0,0.0,0.0,3,9,2270,0.0,1965,1965.0,98040,47.5603,-122.22200000000001,2610,10180,50.0,1965,2014-09-22
1/26/2015,315000.0,3,1.0,1900,14400,1.0,0.0,0.0,4,7,1300,600.0,1954,1954.0,98166,47.4147,-122.337,1940,14400,61.0,1954,2015-01-26
12/3/2014,437500.0,2,1.0,990,3120,1.0,0.0,2.0,5,7,790,200.0,1907,1907.0,98103,47.68,-122.353,1930,3120,108.0,1907,2014-12-03
3/24/2015,252000.0,4,1.5,1550,19800,1.0,0.0,0.0,4,7,1050,500.0,1969,1969.0,98001,47.3117,-122.27,1640,22654,46.0,1969,2015-03-24
6/4/2014,375000.0,4,1.75,2200,7475,1.0,0.0,0.0,5,7,1100,1100.0,1955,1955.0,98118,47.543,-122.28,1600,5766,60.0,1955,2014-06-04
8/6/2014,300000.0,4,2.5,1910,4862,2.0,0.0,0.0,3,7,1910,0.0,2005,2005.0,98038,47.3607,-122.03399999999999,2010,5091,10.0,2005,2014-08-06
10/6/2014,420000.0,4,1.0,1750,9600,1.5,0.0,0.0,4,7,1750,0.0,1954,1954.0,98006,47.5759,-122.137,1750,10530,61.0,1954,2014-10-06
5/5/2014,900000.0,3,1.0,1330,77972,1.0,0.0,0.0,3,7,1330,0.0,1928,1954.0,98033,47.6891,-122.15899999999999,1340,17689,61.0,1954,2014-05-05
8/5/2014,679900.0,3,2.5,2440,5750,2.0,0.0,2.0,3,9,1980,460.0,2000,2000.0,98116,47.565,-122.381,1520,5750,15.0,2000,2014-08-05
6/5/2014,463000.0,3,2.5,1640,29970,2.0,0.0,0.0,3,7,1640,0.0,1992,1992.0,98053,47.6359,-121.97399999999999,1580,28399,23.0,1992,2014-06-05
8/28/2014,380000.0,5,2.5,2760,11340,2.0,0.0,0.0,4,9,2760,0.0,1978,1978.0,98059,47.4769,-122.141,2470,11340,37.0,1978,2014-08-28
12/10/2014,329500.0,4,2.5,1820,7912,2.0,0.0,0.0,3,7,1820,0.0,1994,1994.0,98038,47.3845,-122.029,1820,8168,21.0,1994,2014-12-10
8/19/2014,604950.0,3,2.5,2110,5608,1.0,0.0,0.0,3,8,1340,770.0,2013,2013.0,98033,47.6743,-122.184,2040,9363,2.0,2013,2014-08-19
9/17/2014,795000.0,5,2.5,3040,9570,1.0,0.0,2.0,4,8,1640,1400.0,1966,1966.0,98006,47.5651,-122.164,2920,8800,49.0,1966,2014-09-17
1/30/2015,465000.0,3,2.0,1840,40438,2.0,0.0,0.0,3,7,1840,0.0,1994,1994.0,98045,47.4853,-121.709,1380,44049,21.0,1994,2015-01-30
3/26/2015,673000.0,4,2.5,2990,10400,2.0,0.0,0.0,3,9,2990,0.0,2002,2002.0,98166,47.4508,-122.359,2140,17449,13.0,2002,2015-03-26
10/1/2014,810000.0,4,2.5,3520,15420,2.0,0.0,0.0,3,10,3520,0.0,1991,1991.0,98074,47.6375,-122.016,3400,21455,24.0,1991,2014-10-01
4/23/2015,785000.0,4,2.75,2440,69415,1.0,0.0,0.0,4,8,1910,530.0,1989,1989.0,98075,47.5944,-122.042,2770,24361,26.0,1989,2015-04-23
11/20/2014,338000.0,4,3.0,2090,7500,1.0,0.0,0.0,3,7,1370,720.0,1986,1986.0,98056,47.4888,-122.182,1810,7650,29.0,1986,2014-11-20
12/4/2014,280000.0,3,2.25,1430,7222,2.0,0.0,0.0,3,7,1430,0.0,1993,1993.0,98056,47.5112,-122.19,1430,7220,22.0,1993,2014-12-04
10/1/2014,315000.0,4,2.25,2180,10754,1.0,0.0,0.0,5,7,1100,1080.0,1954,1954.0,98133,47.7711,-122.34100000000001,1810,6929,61.0,1954,2014-10-01
3/24/2015,530000.0,4,2.25,2180,10754,1.0,0.0,0.0,5,7,1100,1080.0,1954,1954.0,98133,47.7711,-122.34100000000001,1810,6929,61.0,1954,2015-03-24
12/23/2014,380000.0,5,3.0,3450,9914,2.0,0.0,0.0,3,9,3450,0.0,2004,2004.0,98023,47.2813,-122.345,2860,9721,11.0,2004,2014-12-23
8/11/2014,297000.0,3,2.25,1450,7562,2.0,0.0,0.0,3,7,1450,0.0,1994,1994.0,98056,47.5038,-122.189,1650,7625,21.0,1994,2014-08-11
5/20/2014,730000.0,4,2.5,3230,7331,2.0,0.0,0.0,3,10,3230,0.0,2004,2004.0,98075,47.5823,-121.97,3480,7447,11.0,2004,2014-05-20
6/9/2014,450000.0,3,1.75,1640,13500,1.0,0.0,0.0,3,7,1110,530.0,1940,1940.0,98125,47.7164,-122.304,1770,12600,75.0,1940,2014-06-09
10/27/2014,275000.0,3,3.0,1590,7750,1.0,0.0,0.0,3,7,1060,530.0,1997,1997.0,98038,47.3624,-122.045,1680,7500,18.0,1997,2014-10-27
4/29/2015,595000.0,4,2.0,2020,2849,2.0,0.0,0.0,3,7,2020,0.0,1960,1960.0,98115,47.6831,-122.329,1910,3120,55.0,1960,2015-04-29
4/21/2015,435000.0,3,1.5,1300,3348,1.5,0.0,0.0,3,7,1300,0.0,1904,2014.0,98144,47.592,-122.307,1590,2577,1.0,2014,2015-04-21
9/16/2014,270000.0,2,1.5,1380,209959,1.0,0.0,0.0,1,6,1380,0.0,1954,1954.0,98011,47.7461,-122.195,3130,19868,61.0,1954,2014-09-16
8/5/2014,950000.0,3,3.0,4040,14338,2.0,0.0,0.0,3,10,3030,1010.0,1986,1986.0,98077,47.7268,-122.06,3360,14142,29.0,1986,2014-08-05
3/13/2015,389000.0,4,2.25,2130,5337,2.0,0.0,0.0,3,7,2130,0.0,2001,2001.0,98019,47.7237,-121.959,2300,6930,14.0,2001,2015-03-13
1/21/2015,560000.0,4,2.25,2550,7800,1.0,0.0,0.0,3,8,1580,970.0,1968,1968.0,98052,47.6283,-122.095,2420,8050,47.0,1968,2015-01-21
7/28/2014,1350000.0,5,3.5,4800,14984,2.0,0.0,2.0,3,11,3480,0.0,1998,1998.0,98006,47.5543,-122.148,4050,19009,17.0,1998,2014-07-28
11/11/2014,799000.0,4,2.25,2510,11585,2.0,0.0,0.0,4,8,2510,0.0,1969,1969.0,98040,47.5483,-122.226,2450,9691,46.0,1969,2014-11-11
6/25/2014,365500.0,3,2.0,1410,9600,1.0,0.0,0.0,4,7,1410,0.0,1983,1983.0,98072,47.7591,-122.146,1410,9600,32.0,1983,2014-06-25
5/15/2014,252350.0,3,2.0,1650,7352,1.0,0.0,0.0,3,7,1160,490.0,1979,1979.0,98058,47.4612,-122.169,1710,7350,36.0,1979,2014-05-15
9/5/2014,403950.0,4,2.5,2120,13780,2.0,0.0,0.0,3,8,2120,0.0,1993,1993.0,98146,47.4987,-122.365,1880,12000,22.0,1993,2014-09-05
8/1/2014,385000.0,4,1.5,2040,10726,1.0,0.0,0.0,3,7,1380,660.0,1954,1954.0,98177,47.772,-122.35799999999999,1610,10020,61.0,1954,2014-08-01
12/10/2014,345000.0,4,1.0,1550,7620,1.5,0.0,0.0,3,7,1550,0.0,1957,1957.0,98106,47.5287,-122.35,1450,7620,58.0,1957,2014-12-10
9/17/2014,490000.0,3,2.75,1980,3128,2.0,0.0,0.0,4,9,1980,0.0,1979,1979.0,98008,47.6109,-122.11399999999999,1950,2856,36.0,1979,2014-09-17
6/18/2014,330000.0,3,2.5,1600,26977,2.0,0.0,0.0,3,8,1600,0.0,2005,2005.0,98019,47.7736,-121.90100000000001,1790,27743,10.0,2005,2014-06-18
5/12/2014,927000.0,4,2.75,3300,12090,2.0,0.0,0.0,3,8,3300,0.0,1953,1953.0,98004,47.6294,-122.21799999999999,3180,12239,62.0,1953,2014-05-12
7/28/2014,1120000.0,4,2.5,3840,16619,2.0,0.0,1.0,4,10,3840,0.0,1983,1983.0,98040,47.5634,-122.213,3600,16553,32.0,1983,2014-07-28
4/30/2015,330000.0,2,1.0,1220,10000,1.0,0.0,0.0,5,7,1220,0.0,1950,1950.0,98028,47.7405,-122.241,2000,9600,65.0,1950,2015-04-30
3/9/2015,530000.0,5,2.25,2720,8800,1.0,0.0,0.0,4,7,1500,1220.0,1958,1958.0,98008,47.5976,-122.118,2110,8800,57.0,1958,2015-03-09
6/23/2014,365000.0,4,2.0,1940,25600,1.0,0.0,0.0,1,8,1940,0.0,1962,1962.0,98006,47.5722,-122.12899999999999,2000,10071,53.0,1962,2014-06-23
6/19/2014,378750.0,3,2.5,2160,3000,1.5,0.0,0.0,3,7,1260,900.0,1909,2011.0,98118,47.5644,-122.289,1060,3500,4.0,2011,2014-06-19
6/19/2014,269900.0,4,1.75,1530,8750,1.5,0.0,0.0,4,7,1530,0.0,1968,1968.0,98058,47.4556,-122.15700000000001,1390,8750,47.0,1968,2014-06-19
3/6/2015,557000.0,3,3.5,1710,2096,2.0,0.0,0.0,3,8,1290,420.0,2008,2008.0,98122,47.6055,-122.305,1630,1543,7.0,2008,2015-03-06
8/25/2014,360000.0,4,1.75,3730,16980,1.0,0.0,0.0,4,7,2150,1580.0,1974,1974.0,98022,47.1775,-122.022,1880,16963,41.0,1974,2014-08-25
4/22/2015,352000.0,2,1.0,940,5000,1.0,0.0,0.0,4,7,940,0.0,1937,1937.0,98117,47.6879,-122.385,1560,4500,78.0,1937,2015-04-22
2/24/2015,437000.0,3,2.5,1750,22357,2.0,0.0,0.0,3,8,1750,0.0,1994,1994.0,98045,47.4807,-121.779,2430,22357,21.0,1994,2015-02-24
6/18/2014,322500.0,4,2.5,1820,6753,2.0,0.0,0.0,3,7,1820,0.0,1994,1994.0,98038,47.3845,-122.03200000000001,1820,7107,21.0,1994,2014-06-18
9/12/2014,650000.0,3,3.25,1510,2000,2.0,0.0,0.0,3,9,1330,180.0,2001,2001.0,98116,47.5815,-122.402,1510,1352,14.0,2001,2014-09-12
8/6/2014,450000.0,3,2.0,1290,1213,3.0,0.0,0.0,3,8,1290,0.0,2001,2001.0,98103,47.6609,-122.344,1290,3235,14.0,2001,2014-08-06
4/17/2015,278500.0,3,2.0,1570,5250,1.0,0.0,0.0,3,7,1570,0.0,1998,1998.0,98092,47.3163,-122.18799999999999,1570,5250,17.0,1998,2015-04-17
4/27/2015,364950.0,4,2.5,1930,6957,2.0,0.0,0.0,3,8,1930,0.0,1995,1995.0,98055,47.4309,-122.191,2090,6996,20.0,1995,2015-04-27
9/11/2014,840000.0,4,3.5,2840,40139,1.0,0.0,4.0,4,10,2840,0.0,1986,1986.0,98038,47.401,-122.02600000000001,3180,36852,29.0,1986,2014-09-11
3/18/2015,268000.0,3,2.5,1550,8134,2.0,0.0,0.0,3,7,1550,0.0,1991,1991.0,98031,47.403999999999996,-122.191,1550,8134,24.0,1991,2015-03-18
7/16/2014,517534.0,2,1.0,833,143947,1.0,0.0,0.0,3,5,833,0.0,2006,2006.0,98070,47.3889,-122.48200000000001,1380,143947,9.0,2006,2014-07-16
11/4/2014,632925.0,3,2.5,2990,32239,2.0,0.0,0.0,4,8,2990,0.0,1978,1978.0,98077,47.7718,-122.095,2990,36497,37.0,1978,2014-11-04
7/23/2014,577500.0,3,2.5,2000,7251,2.0,0.0,0.0,3,9,2000,0.0,1995,1995.0,98034,47.7067,-122.2,2450,8118,20.0,1995,2014-07-23
2/12/2015,339000.0,4,1.5,2390,7480,1.5,0.0,2.0,3,7,2390,0.0,1920,1920.0,98178,47.504,-122.227,2850,6867,95.0,1920,2015-02-12
9/9/2014,570000.0,3,1.75,2910,37461,1.0,0.0,0.0,4,7,1530,1380.0,1967,1967.0,98052,47.7015,-122.164,2520,18295,48.0,1967,2014-09-09
6/26/2014,563500.0,4,1.75,2085,174240,1.0,0.0,0.0,3,7,1610,475.0,1964,1964.0,98024,47.5753,-121.95,2690,174240,51.0,1964,2014-06-26
1/5/2015,423000.0,4,2.25,2200,9351,1.0,0.0,0.0,5,7,1290,910.0,1962,1962.0,98133,47.7448,-122.333,1910,8660,53.0,1962,2015-01-05
12/23/2014,355000.0,3,2.25,1860,5028,2.0,0.0,0.0,3,8,1860,0.0,2012,2012.0,98019,47.7318,-121.98200000000001,2320,5465,3.0,2012,2014-12-23
7/10/2014,1550000.0,5,4.25,6070,171626,2.0,0.0,0.0,3,12,6070,0.0,1999,1999.0,98024,47.5954,-121.95,4680,211267,16.0,1999,2014-07-10
12/3/2014,482000.0,2,1.0,950,3960,1.0,0.0,0.0,3,7,950,0.0,1941,1941.0,98103,47.6885,-122.337,1320,4050,74.0,1941,2014-12-03
7/30/2014,625000.0,3,1.75,1600,9135,1.0,0.0,0.0,5,7,1600,0.0,1955,1955.0,98006,47.5724,-122.179,1580,9800,60.0,1955,2014-07-30
12/19/2014,538000.0,3,2.5,2250,11632,2.0,0.0,0.0,3,8,2250,0.0,1988,1988.0,98056,47.5272,-122.169,2360,11632,27.0,1988,2014-12-19
1/7/2015,380000.0,3,2.5,2280,10255,2.0,0.0,0.0,4,8,2280,0.0,1985,1985.0,98058,47.4334,-122.161,2310,10094,30.0,1985,2015-01-07
7/17/2014,375000.0,2,1.0,940,5120,1.0,0.0,0.0,3,7,940,0.0,1909,1909.0,98122,47.6073,-122.30799999999999,1300,5120,106.0,1909,2014-07-17
4/3/2015,245000.0,3,2.5,1530,8500,1.0,0.0,0.0,5,7,1030,500.0,1996,1996.0,98038,47.3592,-122.046,1850,8140,19.0,1996,2015-04-03
11/14/2014,310000.0,5,1.75,2190,27260,1.0,0.0,0.0,4,7,2190,0.0,1947,1947.0,98166,47.4546,-122.337,1620,39480,68.0,1947,2014-11-14
2/25/2015,1300000.0,3,2.0,2350,15021,1.0,0.0,0.0,4,8,1770,580.0,1976,1976.0,98004,47.6408,-122.219,3530,15715,39.0,1976,2015-02-25
5/6/2014,397000.0,4,2.0,1440,7680,1.0,0.0,0.0,3,7,1200,240.0,1971,1971.0,98034,47.7245,-122.2,1460,9660,44.0,1971,2014-05-06
5/12/2015,365000.0,3,2.5,2200,4052,2.0,0.0,0.0,3,8,2200,0.0,2005,2005.0,98058,47.4362,-122.178,2310,5082,10.0,2005,2015-05-12
10/28/2014,328500.0,4,3.0,2290,8250,2.0,0.0,0.0,3,9,2290,0.0,1990,1990.0,98042,47.3739,-122.156,2290,8250,25.0,1990,2014-10-28
9/8/2014,988000.0,4,3.0,4040,19700,2.0,0.0,0.0,3,11,4040,0.0,1987,1987.0,98052,47.7205,-122.12700000000001,3930,21887,28.0,1987,2014-09-08
7/22/2014,1000000.0,4,2.5,2610,3277,1.5,0.0,0.0,5,8,1920,690.0,1922,1922.0,98103,47.6636,-122.33,1810,3277,93.0,1922,2014-07-22
9/3/2014,237000.0,3,2.5,1490,2138,2.0,0.0,0.0,3,7,1490,0.0,2005,2005.0,98055,47.4324,-122.197,1490,2094,10.0,2005,2014-09-03
9/19/2014,525000.0,4,2.5,2450,5280,2.0,0.0,0.0,3,8,2450,0.0,2003,2003.0,98011,47.7734,-122.22399999999999,2300,4674,12.0,2003,2014-09-19
9/16/2014,749000.0,4,2.5,1710,9627,1.0,0.0,0.0,3,9,1440,270.0,1976,2014.0,98006,47.559,-122.164,2140,9131,1.0,2014,2014-09-16
8/21/2014,722500.0,5,2.5,4870,11800,2.0,0.0,0.0,3,10,3470,1400.0,1983,1983.0,98074,47.633,-122.041,3180,11398,32.0,1983,2014-08-21
3/12/2015,843000.0,3,2.5,3130,8750,2.0,0.0,0.0,3,10,3130,0.0,1991,1991.0,98052,47.6954,-122.103,2860,9003,24.0,1991,2015-03-12
7/8/2014,438000.0,2,2.0,1270,1372,3.0,0.0,0.0,3,8,1270,0.0,2000,2000.0,98115,47.6776,-122.318,1610,3090,15.0,2000,2014-07-08
9/16/2014,578000.0,3,1.75,2120,10875,1.0,0.0,2.0,3,8,1540,580.0,1977,1977.0,98146,47.504,-122.382,2460,11760,38.0,1977,2014-09-16
9/23/2014,227950.0,3,1.5,1670,8230,1.0,0.0,0.0,5,7,1670,0.0,1954,1954.0,98001,47.2613,-122.255,2077,4910,61.0,1954,2014-09-23
7/22/2014,196000.0,3,2.25,2070,11576,2.0,0.0,0.0,3,7,2070,0.0,1974,1974.0,98001,47.3417,-122.271,1890,7519,41.0,1974,2014-07-22
7/15/2014,641000.0,2,1.0,1420,5332,1.0,0.0,0.0,3,8,1070,350.0,1953,1953.0,98105,47.6694,-122.275,2400,5406,62.0,1953,2014-07-15
4/22/2015,350000.0,3,1.5,1250,219978,1.0,0.0,0.0,4,6,1250,0.0,1980,1980.0,98038,47.4056,-121.955,1930,210394,35.0,1980,2015-04-22
8/19/2014,205000.0,3,1.0,940,7980,1.0,0.0,0.0,4,7,940,0.0,1960,1960.0,98032,47.3838,-122.289,1150,8050,55.0,1960,2014-08-19
12/2/2014,400000.0,3,1.75,1920,9102,1.0,0.0,0.0,3,7,1920,0.0,1968,1968.0,98072,47.7487,-122.08200000000001,1920,9760,47.0,1968,2014-12-02
11/10/2014,1030000.0,3,2.5,3545,9816,1.0,0.0,0.0,3,10,2610,935.0,2005,2005.0,98027,47.5534,-122.07799999999999,3630,7704,10.0,2005,2014-11-10
3/19/2015,505000.0,3,2.0,1260,5460,1.0,0.0,0.0,3,7,1260,0.0,1972,1972.0,98034,47.7355,-122.18,1510,5460,43.0,1972,2015-03-19
10/9/2014,475000.0,5,2.5,2340,7200,1.0,0.0,0.0,3,7,1300,1040.0,1975,1975.0,98034,47.7206,-122.211,1930,7221,40.0,1975,2014-10-09
11/5/2014,520000.0,3,2.25,2590,9263,1.0,0.0,0.0,5,8,1440,1150.0,1977,1977.0,98028,47.7691,-122.262,2580,9450,38.0,1977,2014-11-05
5/2/2015,1450000.0,3,4.5,3970,24920,2.0,0.0,2.0,3,10,3260,710.0,1977,1977.0,98034,47.7183,-122.258,2610,13838,38.0,1977,2015-05-02
12/31/2014,333500.0,3,1.75,1220,9732,1.0,0.0,0.0,3,7,1220,0.0,1965,1965.0,98011,47.7736,-122.214,1630,10007,50.0,1965,2014-12-31
2/22/2015,232000.0,3,1.0,1400,10403,1.0,0.0,0.0,4,6,1400,0.0,1976,1976.0,98038,47.361999999999995,-122.029,1230,10209,39.0,1976,2015-02-22
4/21/2015,691100.0,3,2.75,2360,16117,1.0,0.0,0.0,4,8,1710,650.0,1983,1983.0,98006,47.5698,-122.12100000000001,2120,16117,32.0,1983,2015-04-21
10/14/2014,811000.0,3,1.75,1870,9897,1.0,0.0,0.0,4,8,1870,0.0,1960,1960.0,98040,47.5505,-122.221,1900,10005,55.0,1960,2014-10-14
5/20/2014,551000.0,3,2.5,2830,5802,2.0,0.0,0.0,3,9,2830,0.0,2001,2001.0,98028,47.7605,-122.234,2500,5788,14.0,2001,2014-05-20
1/8/2015,496500.0,3,2.5,2260,3640,2.0,0.0,0.0,3,8,2260,0.0,1994,1994.0,98072,47.7356,-122.15700000000001,2350,3710,21.0,1994,2015-01-08
11/26/2014,705000.0,3,3.0,1970,20978,2.0,1.0,3.0,4,9,1770,200.0,1980,1980.0,98070,47.3844,-122.43799999999999,2280,75396,35.0,1980,2014-11-26
6/12/2014,578000.0,4,2.5,3140,9225,1.0,0.0,2.0,5,9,1770,1370.0,1966,1966.0,98055,47.4904,-122.226,2460,9600,49.0,1966,2014-06-12
1/28/2015,255000.0,3,1.75,1240,8659,1.0,0.0,0.0,5,7,1240,0.0,1986,1986.0,98042,47.3663,-122.089,1490,8223,29.0,1986,2015-01-28
6/26/2014,1050000.0,4,3.5,3450,7832,2.0,0.0,0.0,3,10,3450,0.0,2007,2007.0,98006,47.5637,-122.12299999999999,3220,8567,8.0,2007,2014-06-26
3/5/2015,348000.0,3,2.25,2570,8491,2.0,0.0,0.0,4,8,2570,0.0,1989,1989.0,98042,47.3759,-122.125,2400,8049,26.0,1989,2015-03-05
11/4/2014,230000.0,3,2.0,1510,3413,2.0,0.0,0.0,3,7,1510,0.0,1985,1985.0,98031,47.3912,-122.167,1570,3777,30.0,1985,2014-11-04
12/9/2014,359500.0,4,2.25,2390,11250,2.0,0.0,0.0,3,9,2390,0.0,1988,1988.0,98023,47.3305,-122.37100000000001,2480,11250,27.0,1988,2014-12-09
11/12/2014,330000.0,3,1.0,980,7000,1.0,0.0,0.0,3,6,980,0.0,1953,1953.0,98133,47.7617,-122.35700000000001,1220,7000,62.0,1953,2014-11-12
5/23/2014,80000.0,1,0.75,430,5050,1.0,0.0,0.0,2,4,430,0.0,1912,1912.0,98014,47.6499,-121.90899999999999,1200,7500,103.0,1912,2014-05-23
12/1/2014,465000.0,3,1.75,1480,6360,1.0,0.0,0.0,3,7,1480,0.0,1954,1954.0,98133,47.7311,-122.353,1480,6360,61.0,1954,2014-12-01
10/15/2014,325000.0,4,2.5,1850,7324,2.0,0.0,0.0,3,8,1850,0.0,1997,1997.0,98042,47.3701,-122.10700000000001,2100,7329,18.0,1997,2014-10-15
1/7/2015,340500.0,3,2.0,2270,28025,1.0,0.0,0.0,4,7,1920,350.0,1947,1947.0,98168,47.4857,-122.318,1770,14833,68.0,1947,2015-01-07
1/6/2015,342500.0,3,2.5,1810,5192,2.0,0.0,0.0,3,8,1810,0.0,1993,1993.0,98038,47.3724,-122.042,1810,6200,22.0,1993,2015-01-06
6/23/2014,290900.0,2,2.0,1610,17600,2.0,0.0,0.0,3,6,1610,0.0,1930,1983.0,98178,47.4855,-122.266,1310,12950,32.0,1983,2014-06-23
2/13/2015,868700.0,3,4.25,3840,6161,2.0,0.0,0.0,3,10,3840,0.0,2000,2000.0,98074,47.6336,-122.064,3230,7709,15.0,2000,2015-02-13
11/13/2014,1200000.0,4,2.75,4110,8400,2.0,0.0,1.0,3,9,3130,980.0,1928,1928.0,98125,47.717,-122.281,2820,8400,87.0,1928,2014-11-13
10/14/2014,1150000.0,4,3.25,4190,10259,2.0,0.0,0.0,3,11,3150,1040.0,2000,2000.0,98074,47.6332,-122.066,4300,11919,15.0,2000,2014-10-14
8/11/2014,859900.0,4,2.75,3390,6298,2.0,0.0,0.0,3,9,3390,0.0,2011,2011.0,98074,47.5906,-122.06200000000001,3390,7111,4.0,2011,2014-08-11
8/8/2014,520000.0,4,2.25,1890,3006,2.0,0.0,0.0,3,7,1890,0.0,2003,2003.0,98029,47.5461,-121.99799999999999,1580,3000,12.0,2003,2014-08-08
7/11/2014,460000.0,3,2.5,1610,2527,2.0,0.0,2.0,3,9,1080,530.0,2005,2005.0,98118,47.5674,-122.29,1610,4173,10.0,2005,2014-07-11
9/1/2014,438924.0,3,1.5,1050,4590,1.0,0.0,0.0,3,7,850,200.0,1949,1949.0,98115,47.6943,-122.29,1770,5400,66.0,1949,2014-09-01
4/6/2015,315000.0,2,1.0,630,6550,1.0,0.0,0.0,3,5,630,0.0,1918,1918.0,98126,47.5486,-122.38,1420,6550,97.0,1918,2015-04-06
7/18/2014,590000.0,4,2.75,2910,10650,1.0,0.0,2.0,3,8,1780,1130.0,1975,1975.0,98033,47.6658,-122.18799999999999,2920,10988,40.0,1975,2014-07-18
11/4/2014,378500.0,4,1.75,1700,8640,1.0,0.0,0.0,3,7,850,850.0,1955,1955.0,98006,47.5772,-122.15299999999999,1620,9000,60.0,1955,2014-11-04
6/3/2014,328500.0,3,2.5,1950,8130,2.0,0.0,0.0,4,9,1950,0.0,1990,1990.0,98042,47.3875,-122.161,2350,7691,25.0,1990,2014-06-03
3/25/2015,849950.0,3,3.0,2990,9773,2.0,0.0,0.0,4,8,2990,0.0,1973,1973.0,98005,47.6344,-122.17399999999999,2230,11553,42.0,1973,2015-03-25
10/27/2014,525000.0,3,1.5,1350,6000,1.0,0.0,2.0,3,7,900,450.0,1950,1950.0,98136,47.5275,-122.391,1730,6012,65.0,1950,2014-10-27
4/10/2015,1390000.0,4,3.25,4860,181319,2.5,0.0,0.0,3,9,4860,0.0,1993,1993.0,98074,47.6179,-122.005,3850,181319,22.0,1993,2015-04-10
4/28/2015,295000.0,4,2.5,2160,7725,1.0,0.0,0.0,4,8,1460,700.0,1978,1978.0,98023,47.3078,-122.37799999999999,2060,8250,37.0,1978,2015-04-28
7/11/2014,1070000.0,6,3.5,4860,11793,2.0,0.0,0.0,3,11,3860,1000.0,1998,1998.0,98006,47.5521,-122.137,3600,11793,17.0,1998,2014-07-11
7/21/2014,207950.0,2,2.0,890,5000,1.0,0.0,0.0,3,6,890,0.0,1917,1917.0,98118,47.5158,-122.264,1860,5000,98.0,1917,2014-07-21
12/16/2014,699900.0,4,2.75,2810,7302,2.0,0.0,0.0,3,9,2810,0.0,2002,2002.0,98075,47.5985,-121.977,2820,7302,13.0,2002,2014-12-16
2/10/2015,1280000.0,5,2.5,3400,9500,2.0,0.0,1.0,4,8,3400,0.0,1977,1977.0,98027,47.5645,-122.08200000000001,3080,11081,38.0,1977,2015-02-10
11/20/2014,452000.0,4,1.5,1580,7350,1.0,0.0,0.0,4,7,960,620.0,1963,1963.0,98052,47.6734,-122.154,1560,7350,52.0,1963,2014-11-20
2/5/2015,370000.0,3,2.0,1680,5036,1.0,0.0,1.0,4,7,1680,0.0,1987,1987.0,98055,47.4734,-122.186,1680,4921,28.0,1987,2015-02-05
1/27/2015,232000.0,3,1.75,1300,11230,1.0,0.0,0.0,5,7,1300,0.0,1968,1968.0,98042,47.3811,-122.087,1300,10794,47.0,1968,2015-01-27
10/30/2014,669950.0,5,2.5,2820,14062,2.0,0.0,0.0,4,7,2380,440.0,1960,1960.0,98034,47.7081,-122.215,1910,10392,55.0,1960,2014-10-30
6/14/2014,397500.0,3,2.0,1510,6710,1.0,0.0,0.0,3,7,1070,440.0,1972,1972.0,98034,47.7193,-122.21600000000001,1660,6600,43.0,1972,2014-06-14
5/12/2014,490000.0,2,2.5,1230,1391,2.0,0.0,0.0,3,8,870,360.0,2004,2004.0,98112,47.6192,-122.301,1240,1350,11.0,2004,2014-05-12
1/28/2015,725000.0,4,2.0,2110,4140,2.0,0.0,0.0,3,9,1710,400.0,1925,2003.0,98116,47.5836,-122.387,1440,4420,12.0,2003,2015-01-28
9/17/2014,299000.0,3,2.75,3080,19635,1.0,0.0,2.0,4,7,1610,1470.0,1958,1958.0,98032,47.3841,-122.28399999999999,2424,12410,57.0,1958,2014-09-17
8/18/2014,625000.0,2,1.5,1490,5750,1.5,0.0,0.0,4,7,1190,300.0,1900,1900.0,98116,47.5872,-122.39,1590,4025,115.0,1900,2014-08-18
11/6/2014,437500.0,3,2.5,2120,4500,2.0,0.0,0.0,3,7,2120,0.0,2000,2000.0,98065,47.5322,-121.88,2530,4816,15.0,2000,2014-11-06
5/10/2015,650000.0,4,2.5,3180,5438,2.0,0.0,0.0,3,9,3180,0.0,2003,2003.0,98065,47.5416,-121.86399999999999,3030,5335,12.0,2003,2015-05-10
5/19/2014,475000.0,2,1.0,1490,3825,1.0,0.0,0.0,3,7,860,630.0,1929,1929.0,98117,47.6799,-122.381,1460,3825,86.0,1929,2014-05-19
5/2/2014,342000.0,3,2.0,1930,11947,1.0,0.0,0.0,4,8,1930,0.0,1966,1966.0,98042,47.3672,-122.15100000000001,2200,12825,49.0,1966,2014-05-02
10/15/2014,1200000.0,4,2.5,2770,7800,2.0,0.0,0.0,3,10,2770,0.0,1999,1999.0,98033,47.684,-122.205,2720,10000,16.0,1999,2014-10-15
2/10/2015,280000.0,3,1.5,1670,11610,1.0,0.0,0.0,4,7,1670,0.0,1963,1963.0,98055,47.4404,-122.191,1930,10200,52.0,1963,2015-02-10
5/21/2014,240000.0,2,1.75,1330,7200,1.0,0.0,0.0,3,7,1330,0.0,1993,1993.0,98188,47.4467,-122.281,1450,11682,22.0,1993,2014-05-21
5/27/2014,529000.0,3,1.0,1210,3328,1.5,0.0,0.0,4,7,1210,0.0,1924,1924.0,98107,47.6729,-122.363,1640,3333,91.0,1924,2014-05-27
2/2/2015,442000.0,3,1.0,1190,5100,1.0,0.0,0.0,4,7,1030,160.0,1941,1941.0,98136,47.5346,-122.385,1690,5100,74.0,1941,2015-02-02
5/8/2014,615000.0,2,1.0,1540,6872,1.0,0.0,0.0,4,7,820,0.0,1946,1946.0,98119,47.6454,-122.37299999999999,1420,5538,69.0,1946,2014-05-08
6/12/2014,1490000.0,4,3.75,4030,10800,2.0,0.0,0.0,3,10,4030,0.0,2006,2006.0,98033,47.6821,-122.196,2160,7200,9.0,2006,2014-06-12
5/5/2015,585000.0,4,1.75,2430,7559,1.0,0.0,0.0,4,8,1580,850.0,1981,1981.0,98052,47.7206,-122.11,1980,8750,34.0,1981,2015-05-05
3/5/2015,480000.0,4,2.5,2600,7787,2.0,0.0,0.0,3,8,2600,0.0,2005,2005.0,98059,47.4877,-122.139,2830,7787,10.0,2005,2015-03-05
7/21/2014,1100000.0,5,3.5,4410,57063,2.0,0.0,0.0,4,9,4410,0.0,1990,1990.0,98053,47.6554,-122.01799999999999,2900,50529,25.0,1990,2014-07-21
11/5/2014,290000.0,4,1.0,1330,8184,1.5,0.0,0.0,3,7,1330,0.0,1949,1949.0,98133,47.7343,-122.34700000000001,1220,660,66.0,1949,2014-11-05
8/20/2014,615000.0,3,1.75,1900,5000,1.0,0.0,0.0,5,7,950,950.0,1951,1951.0,98116,47.5789,-122.39299999999999,1770,5000,64.0,1951,2014-08-20
3/11/2015,300000.0,2,1.0,1100,7680,1.0,0.0,0.0,4,7,1100,0.0,1950,1950.0,98133,47.7439,-122.339,1460,7680,65.0,1950,2015-03-11
10/29/2014,308000.0,3,1.0,1980,39150,1.5,0.0,0.0,3,6,1580,400.0,1932,1932.0,98030,47.3818,-122.225,1860,11811,83.0,1932,2014-10-29
5/7/2015,750000.0,3,2.5,2400,7745,2.0,0.0,0.0,3,9,2400,0.0,2001,2001.0,98033,47.6734,-122.17299999999999,2080,8615,14.0,2001,2015-05-07
11/14/2014,2250000.0,4,2.25,4760,8036,2.5,0.0,0.0,5,9,3390,1370.0,1916,1916.0,98112,47.6415,-122.285,2950,9323,99.0,1916,2014-11-14
8/5/2014,890000.0,4,3.25,3180,194278,2.0,0.0,0.0,3,10,3180,0.0,2005,2005.0,98059,47.4711,-122.084,2200,178160,10.0,2005,2014-08-05
3/25/2015,288000.0,3,1.0,1190,7560,1.0,0.0,0.0,5,6,1190,0.0,1958,1958.0,98058,47.452,-122.177,1190,7560,57.0,1958,2015-03-25
9/6/2014,190000.0,2,1.0,630,6000,1.0,0.0,0.0,3,6,630,0.0,1943,2005.0,98178,47.4973,-122.221,1470,6840,10.0,2005,2014-09-06
3/26/2015,515000.0,5,3.0,2530,5105,1.0,0.0,0.0,3,8,1520,1010.0,2005,2005.0,98133,47.7546,-122.34100000000001,2290,4011,10.0,2005,2015-03-26
11/5/2014,235000.0,4,1.5,1690,11054,1.0,0.0,0.0,4,5,1690,0.0,1930,1930.0,98055,47.4667,-122.215,1690,9040,85.0,1930,2014-11-05
8/18/2014,275000.0,2,1.0,940,5000,1.0,0.0,0.0,3,6,940,0.0,1951,1951.0,98126,47.5186,-122.374,940,5000,64.0,1951,2014-08-18
11/21/2014,727500.0,2,2.0,1240,9119,1.0,0.0,0.0,4,7,1240,0.0,1952,1952.0,98004,47.6221,-122.193,1380,9121,63.0,1952,2014-11-21
6/20/2014,650000.0,4,2.5,3040,6587,2.0,0.0,0.0,3,7,3040,0.0,2003,2003.0,98053,47.683,-122.039,2740,6587,12.0,2003,2014-06-20
6/18/2014,1600000.0,6,5.0,6050,230652,2.0,0.0,3.0,3,11,6050,0.0,2001,2001.0,98024,47.6033,-121.943,4210,233971,14.0,2001,2014-06-18
11/5/2014,365000.0,4,1.0,1590,7085,1.5,0.0,0.0,3,6,1590,0.0,1944,1944.0,98125,47.7315,-122.305,1320,7085,71.0,1944,2014-11-05
10/8/2014,662000.0,3,1.75,2500,36947,1.0,0.0,0.0,3,9,2500,0.0,1984,1984.0,98052,47.6917,-122.084,2590,28837,31.0,1984,2014-10-08
4/29/2015,270500.0,3,2.5,1780,7848,1.0,0.0,0.0,3,7,1320,460.0,1978,1978.0,98038,47.3608,-122.056,1680,7848,37.0,1978,2015-04-29
5/5/2015,200000.0,2,1.5,1360,1898,2.0,0.0,0.0,3,7,1360,0.0,1978,1978.0,98092,47.2852,-122.19,1360,1898,37.0,1978,2015-05-05
2/24/2015,970000.0,4,3.25,4740,76230,2.0,0.0,0.0,3,10,4740,0.0,1987,1987.0,98075,47.5931,-122.071,3340,49206,28.0,1987,2015-02-24
6/24/2014,160000.0,3,1.5,1010,9600,1.0,0.0,0.0,4,7,1010,0.0,1962,1962.0,98198,47.4097,-122.316,1400,9660,53.0,1962,2014-06-24
2/18/2015,204000.0,3,1.0,1040,7405,1.0,0.0,0.0,4,6,1040,0.0,1971,1971.0,98010,47.3105,-122.021,1580,7405,44.0,1971,2015-02-18
2/18/2015,358000.0,3,2.25,1610,6655,2.0,0.0,0.0,4,7,1610,0.0,1985,1985.0,98058,47.4296,-122.161,1780,7529,30.0,1985,2015-02-18
5/1/2015,452000.0,4,1.75,1570,8268,1.0,0.0,0.0,3,7,1570,0.0,1979,1979.0,98011,47.7373,-122.197,1870,8190,36.0,1979,2015-05-01
12/4/2014,595000.0,2,2.0,1510,4000,1.0,0.0,0.0,4,7,1010,500.0,1900,1900.0,98103,47.6582,-122.345,1920,4000,115.0,1900,2014-12-04
4/10/2015,249000.0,3,2.0,1360,6082,1.0,0.0,0.0,3,7,1360,0.0,1994,1994.0,98042,47.3577,-122.16,1360,6987,21.0,1994,2015-04-10
3/10/2015,346900.0,4,2.5,1970,5106,2.0,0.0,0.0,3,8,1970,0.0,1999,1999.0,98055,47.449,-122.205,2230,5109,16.0,1999,2015-03-10
2/18/2015,2130000.0,3,2.5,5403,24069,2.0,1.0,4.0,4,12,5403,0.0,1976,1976.0,98166,47.4169,-122.348,3980,104374,39.0,1976,2015-02-18
10/30/2014,280000.0,4,2.5,1560,4350,2.0,0.0,0.0,3,7,1560,0.0,2003,2003.0,98056,47.5025,-122.186,1560,4350,12.0,2003,2014-10-30
10/13/2014,318888.0,4,1.75,2320,12000,1.0,0.0,0.0,4,8,2270,50.0,1973,1973.0,98032,47.3644,-122.28,2120,9880,42.0,1973,2014-10-13
9/11/2014,530000.0,3,2.25,2120,40518,1.0,0.0,0.0,3,8,2120,0.0,1967,1967.0,98075,47.5896,-122.009,2480,13492,48.0,1967,2014-09-11
11/21/2014,375000.0,3,2.25,2120,18500,2.0,0.0,0.0,4,8,2120,0.0,1983,1983.0,98031,47.3914,-122.169,2120,14479,32.0,1983,2014-11-21
4/22/2015,910000.0,4,2.5,3350,29242,2.0,0.0,0.0,3,11,3350,0.0,1988,1988.0,98052,47.7197,-122.131,3920,24728,27.0,1988,2015-04-22
5/23/2014,782000.0,4,2.5,2380,9614,2.0,0.0,0.0,4,10,2380,0.0,1991,1991.0,98006,47.5623,-122.116,2560,9770,24.0,1991,2014-05-23
3/19/2015,259950.0,2,2.0,1070,649,2.0,0.0,0.0,3,9,720,350.0,2008,2008.0,98106,47.5213,-122.35700000000001,1070,928,7.0,2008,2015-03-19
9/23/2014,315000.0,4,2.75,2300,18360,1.0,0.0,0.0,4,7,1560,740.0,1979,1979.0,98058,47.4518,-122.16,1870,9588,36.0,1979,2014-09-23
5/28/2014,215000.0,2,1.0,1320,8865,1.0,0.0,0.0,4,6,1320,0.0,1943,1943.0,98168,47.4949,-122.3,1190,6490,72.0,1943,2014-05-28
7/23/2014,705000.0,3,1.75,2180,10221,1.0,0.0,2.0,4,7,1140,1040.0,1946,1946.0,98040,47.5885,-122.24799999999999,2180,8535,69.0,1946,2014-07-23
10/13/2014,1450000.0,3,3.0,4380,6320,2.0,0.0,3.0,5,10,3580,800.0,1952,1952.0,98199,47.6452,-122.411,3080,7680,63.0,1952,2014-10-13
5/8/2015,451000.0,3,1.75,1790,9813,2.0,0.0,0.0,3,7,1790,0.0,1949,1949.0,98155,47.748999999999995,-122.305,1520,10125,66.0,1949,2015-05-08
9/2/2014,261000.0,2,1.0,750,8125,1.0,0.0,0.0,4,6,750,0.0,1943,1943.0,98055,47.4727,-122.198,1340,8750,72.0,1943,2014-09-02
11/17/2014,396000.0,3,1.5,1300,8280,1.0,0.0,0.0,5,7,1300,0.0,1956,1956.0,98028,47.7403,-122.256,1570,8692,59.0,1956,2014-11-17
7/22/2014,725000.0,4,2.5,2990,29170,2.0,0.0,3.0,3,9,2990,0.0,1999,1999.0,98059,47.5146,-122.117,3715,29170,16.0,1999,2014-07-22
6/20/2014,1950000.0,7,3.5,4640,15235,2.0,0.0,1.0,3,11,2860,1780.0,1965,2003.0,98040,47.5666,-122.23100000000001,3230,20697,12.0,2003,2014-06-20
7/15/2014,238000.0,4,1.0,1400,7242,1.5,0.0,0.0,3,7,1400,0.0,1959,1959.0,98188,47.4339,-122.291,1310,7314,56.0,1959,2014-07-15
4/27/2015,750000.0,6,1.75,2750,9563,2.0,0.0,0.0,4,8,2750,0.0,1973,1973.0,98052,47.6368,-122.09700000000001,2040,9563,42.0,1973,2015-04-27
10/27/2014,331500.0,4,2.5,2050,10271,2.0,0.0,0.0,3,7,2050,0.0,1998,1998.0,98042,47.3628,-122.075,2050,8103,17.0,1998,2014-10-27
10/28/2014,460000.0,4,3.0,2230,108900,1.0,0.0,0.0,3,7,1410,820.0,1978,1978.0,98065,47.52,-121.845,1960,65340,37.0,1978,2014-10-28
7/7/2014,404950.0,4,2.25,2340,217014,1.0,0.0,0.0,4,8,2340,0.0,1982,1982.0,98092,47.2953,-122.083,2340,107898,33.0,1982,2014-07-07
12/17/2014,880000.0,3,2.5,2870,5163,2.0,0.0,0.0,3,9,2870,0.0,2014,2014.0,98103,47.6935,-122.352,1630,7995,1.0,2014,2014-12-17
6/13/2014,863000.0,4,2.5,4120,22370,2.0,0.0,0.0,3,10,4120,0.0,1997,1997.0,98074,47.6239,-122.023,3180,7257,18.0,1997,2014-06-13
12/16/2014,638700.0,3,1.75,2080,9162,1.0,0.0,0.0,3,7,1370,710.0,1960,1960.0,98005,47.5846,-122.16799999999999,1870,8944,55.0,1960,2014-12-16
7/28/2014,435000.0,3,2.5,1840,5680,2.0,0.0,0.0,3,7,1840,0.0,2008,2008.0,98053,47.6969,-122.02600000000001,1600,4697,7.0,2008,2014-07-28
12/31/2014,260000.0,3,1.0,1180,5350,1.5,0.0,0.0,4,6,1180,0.0,1959,1959.0,98178,47.505,-122.259,1490,5350,56.0,1959,2014-12-31
8/14/2014,671500.0,5,2.75,2160,4000,1.5,0.0,0.0,5,7,1530,630.0,1927,1927.0,98105,47.667,-122.289,2040,4000,88.0,1927,2014-08-14
10/22/2014,610000.0,3,1.0,1180,3400,1.5,0.0,0.0,3,8,1180,0.0,1907,1907.0,98109,47.6376,-122.353,1440,3400,108.0,1907,2014-10-22
12/18/2014,405000.0,2,0.75,1160,15029,1.0,0.0,0.0,4,6,870,290.0,1937,1937.0,98014,47.6929,-121.87,1870,25346,78.0,1937,2014-12-18
7/18/2014,338900.0,4,2.5,1830,5612,2.0,0.0,0.0,3,7,1830,0.0,2003,2003.0,98038,47.3572,-122.015,1830,5998,12.0,2003,2014-07-18
1/23/2015,720000.0,4,4.0,3200,7708,2.0,0.0,0.0,3,10,3200,0.0,2004,2004.0,98075,47.5816,-121.97,3480,7944,11.0,2004,2015-01-23
4/24/2015,442000.0,5,3.0,2560,5445,1.5,0.0,0.0,4,7,1760,800.0,1927,1927.0,98108,47.5502,-122.311,1080,5445,88.0,1927,2015-04-24
6/3/2014,650000.0,5,2.75,2550,5040,1.5,0.0,0.0,5,8,2550,0.0,1902,1902.0,98122,47.6136,-122.29899999999999,1590,3840,113.0,1902,2014-06-03
1/2/2015,263500.0,3,1.75,1330,9917,1.0,0.0,0.0,3,7,1040,290.0,1981,1981.0,98058,47.4478,-122.161,1330,9081,34.0,1981,2015-01-02
12/17/2014,300000.0,2,1.0,1220,75794,1.0,0.0,0.0,4,7,1220,0.0,1963,1963.0,98038,47.4219,-122.007,2010,98010,52.0,1963,2014-12-17
12/9/2014,266000.0,3,2.5,1805,3402,2.0,0.0,0.0,3,7,1805,0.0,2009,2009.0,98002,47.3521,-122.212,2095,3402,6.0,2009,2014-12-09
12/11/2014,930000.0,4,4.0,6050,84942,2.5,0.0,2.0,3,9,4150,1900.0,2009,2009.0,98077,47.7466,-122.029,2700,199504,6.0,2009,2014-12-11
1/27/2015,530000.0,4,2.5,2320,5493,2.0,0.0,0.0,3,8,2320,0.0,2004,2004.0,98028,47.7727,-122.229,2450,5471,11.0,2004,2015-01-27
12/11/2014,180000.0,3,1.0,1384,8960,1.0,0.0,0.0,4,6,1384,0.0,1965,1965.0,98023,47.3062,-122.37100000000001,1000,8470,50.0,1965,2014-12-11
5/16/2014,619000.0,3,2.5,2720,6439,2.0,0.0,0.0,3,9,2720,0.0,2005,2005.0,98065,47.5422,-121.86,3180,7320,10.0,2005,2014-05-16
8/21/2014,264000.0,3,1.5,1820,10608,1.0,0.0,0.0,4,7,1820,0.0,1962,1962.0,98003,47.3366,-122.306,1380,8976,53.0,1962,2014-08-21
7/1/2014,730000.0,2,2.25,2130,4920,1.5,0.0,4.0,4,7,1530,600.0,1941,1941.0,98116,47.573,-122.40899999999999,2130,4920,74.0,1941,2014-07-01
10/22/2014,439000.0,4,2.25,2060,10070,2.0,0.0,0.0,3,7,2060,0.0,1975,1975.0,98034,47.7258,-122.177,2060,8155,40.0,1975,2014-10-22
11/17/2014,268500.0,4,1.75,1420,7500,1.0,0.0,0.0,4,7,1080,340.0,1981,1981.0,98031,47.4025,-122.176,1500,7260,34.0,1981,2014-11-17
7/15/2014,330000.0,3,1.75,1510,15744,1.0,0.0,0.0,3,7,1510,0.0,1985,1985.0,98045,47.476000000000006,-121.755,1470,15744,30.0,1985,2014-07-15
8/19/2014,640000.0,3,2.5,2160,4000,1.5,0.0,0.0,3,8,1960,200.0,1903,2013.0,98122,47.6045,-122.307,2160,5120,2.0,2013,2014-08-19
7/8/2014,900000.0,3,2.5,3180,12600,2.0,0.0,0.0,4,11,3180,0.0,1978,1978.0,98074,47.6366,-122.05799999999999,3030,12835,37.0,1978,2014-07-08
9/30/2014,370000.0,3,2.25,2110,13300,2.0,0.0,0.0,4,8,2110,0.0,1985,1985.0,98038,47.3725,-122.06,2470,14000,30.0,1985,2014-09-30
3/14/2015,685000.0,3,2.0,2060,2900,1.5,0.0,0.0,5,8,1330,730.0,1931,1931.0,98144,47.5897,-122.292,1910,3900,84.0,1931,2015-03-14
9/4/2014,505000.0,3,1.5,1830,217800,1.0,0.0,0.0,3,7,1010,820.0,1981,1981.0,98053,47.6277,-121.97200000000001,2450,165963,34.0,1981,2014-09-04
10/21/2014,265000.0,3,1.75,1820,32666,1.0,0.0,0.0,4,7,1820,0.0,1966,1966.0,98022,47.1803,-121.97399999999999,2050,43560,49.0,1966,2014-10-21
3/24/2015,290000.0,3,2.5,1610,2937,2.0,0.0,0.0,3,8,1610,0.0,2006,2006.0,98055,47.4489,-122.18799999999999,1610,3049,9.0,2006,2015-03-24
9/2/2014,296000.0,4,2.5,1780,3600,2.0,0.0,0.0,3,7,1780,0.0,2006,2006.0,98038,47.3665,-122.01700000000001,2020,3802,9.0,2006,2014-09-02
2/13/2015,360000.0,4,2.5,1840,9611,2.0,0.0,0.0,3,7,1840,0.0,1996,1996.0,98178,47.4964,-122.251,1830,8505,19.0,1996,2015-02-13
6/4/2014,240500.0,3,1.75,1460,10584,1.0,0.0,0.0,3,7,990,470.0,1997,1997.0,98168,47.492,-122.31700000000001,1220,12012,18.0,1997,2014-06-04
7/22/2014,372500.0,2,2.5,1400,2958,2.0,0.0,0.0,3,8,1400,0.0,2007,2007.0,98126,47.5496,-122.37299999999999,1540,2385,8.0,2007,2014-07-22
10/2/2014,595000.0,3,2.5,3370,14402,2.0,0.0,2.0,3,9,3370,0.0,2004,2004.0,98045,47.5008,-121.77600000000001,3330,9691,11.0,2004,2014-10-02
10/17/2014,515000.0,4,3.0,3590,8249,2.0,0.0,0.0,3,9,3590,0.0,1997,1997.0,98023,47.2846,-122.34100000000001,2860,7995,18.0,1997,2014-10-17
8/5/2014,1220000.0,4,2.25,3200,15367,2.0,0.0,0.0,4,9,3200,0.0,1962,1962.0,98040,47.5494,-122.21600000000001,3070,15263,53.0,1962,2014-08-05
10/9/2014,507000.0,2,1.75,1670,6460,1.0,0.0,0.0,3,8,1670,0.0,2004,2004.0,98053,47.7123,-122.027,2170,6254,11.0,2004,2014-10-09
2/4/2015,399950.0,4,2.0,2420,31465,1.0,0.0,0.0,3,9,2420,0.0,1984,1984.0,98092,47.3131,-122.115,2560,32186,31.0,1984,2015-02-04
8/20/2014,185000.0,3,1.75,1430,10816,2.0,0.0,0.0,3,7,1430,0.0,1994,1994.0,98010,47.3122,-121.99600000000001,1560,10816,21.0,1994,2014-08-20
8/25/2014,460000.0,3,1.75,1440,7070,1.0,0.0,0.0,3,7,1440,0.0,1980,1980.0,98052,47.6947,-122.125,1440,7210,35.0,1980,2014-08-25
2/24/2015,435500.0,3,2.25,1450,4789,2.0,0.0,0.0,3,7,1450,0.0,1985,1985.0,98029,47.5665,-122.01799999999999,1560,4490,30.0,1985,2015-02-24
4/8/2015,469000.0,4,2.75,3550,13938,1.0,0.0,0.0,5,8,2100,1450.0,1966,1966.0,98188,47.425,-122.28299999999999,2050,9000,49.0,1966,2015-04-08
5/5/2014,531000.0,2,3.0,1270,1175,2.0,0.0,0.0,3,8,1110,160.0,2000,2000.0,98103,47.6634,-122.34,1290,1800,15.0,2000,2014-05-05
2/6/2015,443500.0,2,1.0,940,6804,1.0,0.0,0.0,3,7,940,0.0,1949,1949.0,98177,47.7047,-122.37299999999999,1150,6930,66.0,1949,2015-02-06
11/26/2014,223000.0,3,2.0,1670,6824,1.0,0.0,0.0,3,7,1300,370.0,1990,1990.0,98042,47.3666,-122.084,1660,7586,25.0,1990,2014-11-26
4/17/2015,590000.0,4,3.5,3100,15842,2.0,0.0,0.0,3,8,2400,700.0,1996,1996.0,98028,47.7466,-122.242,2200,19400,19.0,1996,2015-04-17
12/9/2014,340000.0,2,2.5,1100,1760,3.0,0.0,0.0,3,7,1100,0.0,1997,1997.0,98103,47.6972,-122.35,1200,1415,18.0,1997,2014-12-09
11/5/2014,650000.0,3,2.0,1870,3388,1.0,0.0,0.0,4,8,1230,640.0,1925,1925.0,98199,47.6372,-122.395,1780,4050,90.0,1925,2014-11-05
9/25/2014,533600.0,3,2.5,1930,5080,2.0,0.0,0.0,4,8,1930,0.0,1990,1990.0,98029,47.5694,-122.001,2190,5085,25.0,1990,2014-09-25
6/10/2014,695000.0,3,2.75,2540,4694,2.0,0.0,0.0,3,9,2540,0.0,2005,2005.0,98074,47.6214,-122.024,2600,6344,10.0,2005,2014-06-10
6/17/2014,242000.0,3,1.75,1280,7524,1.5,0.0,0.0,4,7,1280,0.0,1988,1988.0,98031,47.3961,-122.18799999999999,1500,7777,27.0,1988,2014-06-17
1/14/2015,425000.0,3,2.25,1820,8814,1.0,0.0,0.0,3,7,1280,540.0,1967,1967.0,98125,47.7162,-122.309,1810,7515,48.0,1967,2015-01-14
5/6/2015,525000.0,3,2.25,1490,9414,2.0,0.0,0.0,3,7,1490,0.0,1981,1981.0,98052,47.6844,-122.113,1290,10125,34.0,1981,2015-05-06
9/22/2014,485000.0,3,2.5,1880,5502,2.0,0.0,0.0,3,8,1880,0.0,1988,1988.0,98029,47.5737,-122.01799999999999,2040,5411,27.0,1988,2014-09-22
1/13/2015,175000.0,3,1.0,1250,9775,1.0,0.0,0.0,3,7,1250,0.0,1971,1971.0,98045,47.4474,-121.771,1390,9650,44.0,1971,2015-01-13
6/19/2014,210000.0,3,2.0,1440,7210,1.0,0.0,0.0,3,8,1440,0.0,1983,1983.0,98092,47.3128,-122.184,1700,7245,32.0,1983,2014-06-19
4/15/2015,260000.0,3,2.5,1920,7415,2.0,0.0,0.0,3,7,1920,0.0,1989,1989.0,98031,47.4022,-122.171,1930,7536,26.0,1989,2015-04-15
6/23/2014,577000.0,3,2.5,2060,5750,1.0,0.0,0.0,3,7,1330,730.0,1976,1976.0,98116,47.5671,-122.391,1920,5750,39.0,1976,2014-06-23
10/21/2014,200000.0,3,1.5,1210,10588,1.0,0.0,0.0,4,7,1210,0.0,1958,1958.0,98002,47.2876,-122.212,1408,10588,57.0,1958,2014-10-21
2/25/2015,605000.0,2,1.75,1760,5000,1.0,0.0,0.0,4,7,940,820.0,1927,1927.0,98117,47.681999999999995,-122.37200000000001,1530,5000,88.0,1927,2015-02-25
5/21/2014,325000.0,3,1.0,990,6750,1.0,0.0,0.0,4,6,990,0.0,1947,1947.0,98133,47.7125,-122.331,1440,6860,68.0,1947,2014-05-21
8/14/2014,289500.0,3,1.0,960,6400,1.0,0.0,0.0,4,6,820,140.0,1944,1944.0,98178,47.496,-122.23899999999999,1200,6600,71.0,1944,2014-08-14
8/8/2014,559950.0,3,2.5,1660,1458,3.0,0.0,0.0,3,9,1660,0.0,2014,2014.0,98144,47.5876,-122.309,1660,1784,1.0,2014,2014-08-08
4/6/2015,1040000.0,3,1.75,1900,9375,1.0,0.0,1.0,4,8,1330,570.0,1941,1941.0,98115,47.6821,-122.273,2760,9375,74.0,1941,2015-04-06
10/9/2014,543500.0,3,2.25,1270,2790,1.0,0.0,0.0,3,7,990,280.0,1970,1970.0,98199,47.6581,-122.396,1920,4000,45.0,1970,2014-10-09
5/22/2014,480000.0,4,2.25,3250,34293,2.0,0.0,0.0,4,9,3250,0.0,1983,1983.0,98042,47.3496,-122.094,3110,35982,32.0,1983,2014-05-22
5/23/2014,218000.0,3,1.0,960,9633,1.0,0.0,0.0,5,6,960,0.0,1982,1982.0,98022,47.1951,-122.001,1080,8610,33.0,1982,2014-05-23
6/22/2014,565000.0,2,1.75,1330,6000,1.0,0.0,0.0,4,7,960,370.0,1914,1945.0,98199,47.6539,-122.396,1620,6000,70.0,1945,2014-06-22
12/12/2014,426700.0,3,1.75,2080,7700,1.0,0.0,0.0,5,7,1600,480.0,1968,1968.0,98056,47.5375,-122.178,1680,7700,47.0,1968,2014-12-12
9/12/2014,650000.0,3,2.5,2690,11575,1.0,0.0,3.0,3,8,2130,0.0,1957,1957.0,98028,47.7605,-122.26700000000001,2390,11782,58.0,1957,2014-09-12
9/24/2014,542000.0,2,1.0,890,3060,1.0,0.0,0.0,3,7,770,120.0,1910,1910.0,98105,47.6663,-122.32600000000001,1760,4080,105.0,1910,2014-09-24
6/24/2014,415000.0,3,1.75,1070,8000,1.0,0.0,0.0,3,7,1070,0.0,1977,1977.0,98052,47.6978,-122.13,1200,7990,38.0,1977,2014-06-24
8/15/2014,214000.0,3,1.0,1200,8316,1.0,0.0,0.0,4,6,1200,0.0,1953,1953.0,98002,47.3221,-122.215,1200,8316,62.0,1953,2014-08-15
1/21/2015,245000.0,3,1.5,1360,8910,2.0,0.0,0.0,5,7,1360,0.0,1949,1949.0,98188,47.4488,-122.275,1220,8912,66.0,1949,2015-01-21
7/1/2014,314500.0,3,2.0,2050,13303,1.0,0.0,0.0,3,8,2050,0.0,1993,1993.0,98003,47.2681,-122.31,2180,11590,22.0,1993,2014-07-01
4/9/2015,1120000.0,3,1.5,3000,5750,2.0,0.0,0.0,5,9,2000,1000.0,1924,1924.0,98116,47.5821,-122.39,1820,5750,91.0,1924,2015-04-09
3/3/2015,378000.0,2,2.0,1300,3850,1.0,0.0,0.0,3,7,800,500.0,1963,1963.0,98136,47.5395,-122.39,950,5500,52.0,1963,2015-03-03
7/28/2014,305000.0,4,2.5,2250,9091,1.0,0.0,0.0,3,7,1340,910.0,1982,1982.0,98001,47.33600000000001,-122.26899999999999,1540,7802,33.0,1982,2014-07-28
3/20/2015,595000.0,5,2.75,3740,6750,1.0,0.0,0.0,4,8,1980,1760.0,1978,1978.0,98028,47.7679,-122.26100000000001,2620,7920,37.0,1978,2015-03-20
5/12/2015,729500.0,3,2.5,1660,1091,3.0,0.0,1.0,3,9,1530,130.0,2015,2015.0,98116,47.5818,-122.402,1510,1352,0.0,2015,2015-05-12
9/30/2014,430000.0,3,2.5,2360,6699,2.0,0.0,0.0,3,7,2360,0.0,2003,2003.0,98065,47.5317,-121.853,2360,4744,12.0,2003,2014-09-30
4/9/2015,240000.0,3,1.75,1760,6500,1.0,0.0,0.0,3,7,1150,0.0,1987,1987.0,98038,47.3647,-122.05,1760,8125,28.0,1987,2015-04-09
3/20/2015,545000.0,3,1.75,1680,6200,1.5,0.0,0.0,3,7,1680,0.0,1916,1916.0,98136,47.5338,-122.384,1680,5100,99.0,1916,2015-03-20
7/7/2014,530000.0,3,1.75,1320,2500,1.0,0.0,0.0,3,7,870,450.0,1918,1918.0,98105,47.6681,-122.305,1580,2750,97.0,1918,2014-07-07
11/18/2014,157000.0,1,1.0,870,26326,1.0,0.0,0.0,3,6,870,0.0,1939,1939.0,98198,47.4152,-122.3,1250,10608,76.0,1939,2014-11-18
4/7/2015,425000.0,4,1.0,1260,7645,1.5,0.0,0.0,3,6,1260,0.0,1925,1925.0,98146,47.5044,-122.35,1170,7649,90.0,1925,2015-04-07
11/17/2014,220000.0,3,1.0,1000,6020,1.0,0.0,0.0,3,6,1000,0.0,1944,1944.0,98166,47.4793,-122.346,1300,8640,71.0,1944,2014-11-17
11/24/2014,521000.0,4,1.75,2020,36400,1.0,0.0,0.0,4,8,1550,470.0,1976,1976.0,98077,47.7627,-122.07600000000001,2520,38255,39.0,1976,2014-11-24
5/23/2014,325000.0,3,1.0,1920,6862,1.0,0.0,2.0,3,7,1120,800.0,1952,1952.0,98118,47.5193,-122.274,2000,6900,63.0,1952,2014-05-23
4/3/2015,597500.0,3,2.0,2150,5400,1.5,0.0,0.0,4,7,1380,770.0,1911,1911.0,98126,47.555,-122.37899999999999,1940,6500,104.0,1911,2015-04-03
7/23/2014,337000.0,3,2.5,1470,3976,2.0,0.0,0.0,3,7,1470,0.0,1999,1999.0,98065,47.526,-121.82600000000001,1490,4400,16.0,1999,2014-07-23
4/22/2015,1000000.0,3,2.5,3180,10492,2.0,0.0,2.0,3,10,3180,0.0,1991,1991.0,98052,47.655,-122.124,3000,9812,24.0,1991,2015-04-22
11/20/2014,3070000.0,3,2.5,3930,55867,1.0,1.0,4.0,4,8,2330,1600.0,1957,1957.0,98034,47.7022,-122.22399999999999,2730,26324,58.0,1957,2014-11-20
5/7/2014,495000.0,3,1.0,990,6000,1.0,0.0,0.0,3,6,990,0.0,1943,1943.0,98105,47.6718,-122.26700000000001,1250,6000,72.0,1943,2014-05-07
1/2/2015,748000.0,4,3.5,2770,3330,2.0,0.0,0.0,3,8,1970,800.0,2001,2001.0,98052,47.6327,-122.109,2180,3380,14.0,2001,2015-01-02
9/2/2014,888000.0,3,1.5,1250,8710,1.0,0.0,0.0,4,7,1250,0.0,1953,1953.0,98004,47.6245,-122.198,1750,9185,62.0,1953,2014-09-02
3/24/2015,269900.0,3,1.75,1140,22267,1.0,0.0,0.0,3,7,1140,0.0,1986,1986.0,98045,47.4761,-121.758,1150,15625,29.0,1986,2015-03-24
11/13/2014,496500.0,4,2.5,2250,14440,1.0,0.0,0.0,3,7,1550,700.0,1967,1967.0,98027,47.5221,-122.045,2090,11400,48.0,1967,2014-11-13
1/21/2015,475000.0,3,2.5,1640,5097,2.0,0.0,0.0,3,7,1640,0.0,1969,1969.0,98155,47.7522,-122.27799999999999,1880,6000,46.0,1969,2015-01-21
5/27/2014,312000.0,3,1.5,1255,1374,3.0,0.0,0.0,3,7,1255,0.0,2004,2004.0,98125,47.7145,-122.311,1307,1232,11.0,2004,2014-05-27
11/24/2014,323000.0,3,1.0,1290,12231,1.0,0.0,0.0,3,7,1290,0.0,1976,1976.0,98072,47.7404,-122.11,1390,11632,39.0,1976,2014-11-24
11/24/2014,331000.0,3,1.75,1300,9079,1.0,0.0,0.0,3,7,1300,0.0,1986,1986.0,98059,47.4834,-122.15899999999999,1890,7369,29.0,1986,2014-11-24
5/14/2014,306000.0,3,1.5,1220,1086,3.0,0.0,0.0,3,8,1220,0.0,2007,2007.0,98133,47.7049,-122.353,1220,1422,8.0,2007,2014-05-14
9/30/2014,655000.0,4,2.5,2630,4000,3.0,0.0,0.0,3,8,2630,0.0,2002,2002.0,98117,47.6915,-122.381,1640,4000,13.0,2002,2014-09-30
7/9/2014,290000.0,3,1.5,1950,15954,1.0,0.0,0.0,4,8,1950,0.0,1959,1959.0,98003,47.33600000000001,-122.319,1940,12667,56.0,1959,2014-07-09
8/2/2014,1250000.0,4,3.25,3160,5000,2.0,0.0,0.0,5,9,2360,800.0,1965,1965.0,98105,47.6597,-122.274,2220,4000,50.0,1965,2014-08-02
6/16/2014,460000.0,3,1.75,1550,4708,1.0,0.0,0.0,4,7,860,690.0,1949,1949.0,98115,47.6759,-122.286,1880,5600,66.0,1949,2014-06-16
9/12/2014,435000.0,4,2.5,1700,6380,1.0,0.0,0.0,4,7,850,0.0,1940,1940.0,98115,47.6988,-122.319,1380,6380,75.0,1940,2014-09-12
3/16/2015,664000.0,4,2.75,2510,11880,1.0,0.0,0.0,5,8,1630,880.0,1978,1978.0,98006,47.5427,-122.181,2390,11211,37.0,1978,2015-03-16
7/29/2014,865000.0,4,1.75,1800,4180,2.0,0.0,3.0,4,8,1800,0.0,1921,1921.0,98102,47.6462,-122.318,2180,4620,94.0,1921,2014-07-29
8/13/2014,385000.0,3,1.75,1800,18000,1.0,0.0,0.0,3,8,1200,600.0,1968,1968.0,98058,47.4406,-122.146,1800,18000,47.0,1968,2014-08-13
7/18/2014,497000.0,3,2.25,1870,9315,1.0,0.0,0.0,3,7,1350,520.0,1975,1975.0,98034,47.705,-122.20200000000001,2230,9579,40.0,1975,2014-07-18
6/23/2014,280000.0,2,1.0,1010,3000,1.0,0.0,0.0,4,7,1010,0.0,1925,1925.0,98045,47.4965,-121.785,1150,7000,90.0,1925,2014-06-23
1/27/2015,188000.0,2,1.5,1120,17487,1.0,0.0,0.0,3,6,1120,0.0,1924,1924.0,98178,47.5024,-122.271,1690,8056,91.0,1924,2015-01-27
9/30/2014,478500.0,3,1.0,2090,4755,1.0,0.0,2.0,3,8,1200,890.0,1969,1969.0,98136,47.5304,-122.387,1850,5300,46.0,1969,2014-09-30
7/31/2014,1150000.0,4,3.5,4370,18361,2.0,0.0,0.0,3,11,4370,0.0,2001,2001.0,98065,47.544,-121.87200000000001,4190,13641,14.0,2001,2014-07-31
8/15/2014,222000.0,3,2.0,1440,7187,1.0,0.0,0.0,4,7,970,470.0,1981,1981.0,98023,47.291000000000004,-122.368,1440,7187,34.0,1981,2014-08-15
5/28/2014,799000.0,4,3.0,2580,209523,2.0,0.0,0.0,3,8,2580,0.0,1984,1984.0,98053,47.6932,-122.006,3440,213444,31.0,1984,2014-05-28
6/9/2014,609900.0,4,2.5,3190,7399,2.0,0.0,0.0,3,10,3190,0.0,2006,2006.0,98038,47.3558,-122.00399999999999,3250,7323,9.0,2006,2014-06-09
10/16/2014,413000.0,4,3.5,2380,5809,2.0,0.0,0.0,4,7,1750,630.0,1995,1995.0,98106,47.5536,-122.359,1620,5775,20.0,1995,2014-10-16
10/13/2014,400000.0,4,1.0,1420,4875,1.5,0.0,0.0,3,7,1420,0.0,1930,1930.0,98115,47.6942,-122.321,1110,5413,85.0,1930,2014-10-13
1/5/2015,802541.0,5,2.75,2990,6768,2.0,0.0,0.0,3,9,2990,0.0,2014,2014.0,98006,47.5462,-122.182,2870,6768,1.0,2014,2015-01-05
5/19/2014,320000.0,3,2.5,2680,7757,2.0,0.0,0.0,3,8,2680,0.0,1990,1990.0,98023,47.2918,-122.346,2430,8231,25.0,1990,2014-05-19
3/11/2015,507000.0,4,2.5,2730,7649,2.0,0.0,0.0,3,7,2730,0.0,2006,2006.0,98065,47.5441,-121.882,2730,6216,9.0,2006,2015-03-11
9/24/2014,387500.0,3,1.0,1220,8329,1.0,0.0,0.0,3,6,1220,0.0,1946,1946.0,98115,47.6982,-122.29799999999999,1490,8322,69.0,1946,2014-09-24
2/24/2015,396000.0,3,1.0,1500,12616,1.0,0.0,0.0,3,7,1500,0.0,1967,1967.0,98072,47.7415,-122.101,1820,13950,48.0,1967,2015-02-24
8/21/2014,373000.0,3,1.75,1830,11788,1.0,0.0,1.0,3,8,1430,400.0,1958,1958.0,98055,47.4862,-122.22399999999999,2140,11964,57.0,1958,2014-08-21
9/23/2014,1480000.0,5,2.5,4570,19252,2.0,0.0,0.0,5,10,4570,0.0,1965,1965.0,98040,47.5553,-122.22,3180,13314,50.0,1965,2014-09-23
7/21/2014,359900.0,4,2.25,2470,7698,2.0,0.0,0.0,3,8,2470,0.0,1983,1983.0,98058,47.4406,-122.141,2330,7986,32.0,1983,2014-07-21
3/4/2015,410000.0,2,1.0,800,4342,1.0,0.0,0.0,3,6,670,130.0,1927,1927.0,98115,47.6997,-122.316,1210,4343,88.0,1927,2015-03-04
7/12/2014,690000.0,4,2.5,2900,23488,2.0,0.0,0.0,3,9,2900,0.0,1992,1992.0,98053,47.6726,-122.03,2900,34589,23.0,1992,2014-07-12
6/25/2014,245000.0,3,2.0,1410,5760,1.0,0.0,0.0,3,7,1410,0.0,1985,1985.0,98030,47.3702,-122.185,1670,6222,30.0,1985,2014-06-25
12/29/2014,700000.0,5,2.5,2830,25958,1.0,0.0,1.0,5,8,1610,1220.0,1979,1979.0,98075,47.5896,-122.083,2670,21567,36.0,1979,2014-12-29
9/22/2014,268000.0,4,1.75,1680,9966,1.0,0.0,0.0,3,7,1100,580.0,1977,1977.0,98198,47.3923,-122.311,2400,10369,38.0,1977,2014-09-22
6/10/2014,225000.0,3,1.75,1760,26055,1.0,0.0,0.0,3,7,920,840.0,1979,1979.0,98042,47.3664,-122.1,1350,13475,36.0,1979,2014-06-10
10/9/2014,980000.0,4,2.25,2240,11034,2.0,0.0,0.0,3,8,2240,0.0,1976,1976.0,98004,47.5894,-122.195,2300,11550,39.0,1976,2014-10-09
4/7/2015,795000.0,2,1.0,1380,5000,1.5,0.0,2.0,3,5,1380,0.0,1905,1905.0,98106,47.5708,-122.359,1500,5000,110.0,1905,2015-04-07
5/4/2015,195000.0,2,1.0,820,5100,1.0,0.0,0.0,3,6,820,0.0,1953,1953.0,98118,47.5156,-122.262,1170,5304,62.0,1953,2015-05-04
11/3/2014,480000.0,4,2.0,2180,10575,1.0,0.0,0.0,2,6,1730,450.0,1950,1950.0,98005,47.589,-122.177,2180,12010,65.0,1950,2014-11-03
12/19/2014,485000.0,4,2.0,1400,3600,1.0,0.0,0.0,3,7,1100,300.0,1900,1900.0,98119,47.6385,-122.37,1630,2048,115.0,1900,2014-12-19
8/15/2014,130000.0,2,1.0,880,9000,1.0,0.0,0.0,3,5,880,0.0,1928,1928.0,98188,47.4672,-122.291,1410,10000,87.0,1928,2014-08-15
8/4/2014,325000.0,2,1.0,1060,5703,1.0,0.0,2.0,4,6,1060,0.0,1946,1946.0,98198,47.3444,-122.32700000000001,2240,4416,69.0,1946,2014-08-04
4/13/2015,440000.0,3,1.75,1530,7245,1.0,0.0,0.0,4,7,1530,0.0,1984,1984.0,98034,47.731,-122.191,1530,7490,31.0,1984,2015-04-13
10/14/2014,550000.0,4,1.75,2480,14782,1.0,0.0,3.0,3,8,1460,1020.0,1958,1958.0,98155,47.7646,-122.271,2910,10800,57.0,1958,2014-10-14
8/5/2014,310000.0,3,1.75,1490,7150,1.0,0.0,0.0,5,6,1490,0.0,1967,1967.0,98059,47.5015,-122.124,1350,9100,48.0,1967,2014-08-05
7/1/2014,530000.0,3,2.5,3660,39478,2.0,0.0,2.0,4,9,3260,400.0,1989,1989.0,98022,47.2413,-121.97200000000001,2700,38312,26.0,1989,2014-07-01
6/25/2014,390000.0,4,2.5,2340,8548,2.0,0.0,0.0,3,8,2340,0.0,1993,1993.0,98031,47.4206,-122.18299999999999,1970,6818,22.0,1993,2014-06-25
9/8/2014,243000.0,3,1.75,1450,12125,1.0,0.0,0.0,4,7,1450,0.0,1981,1981.0,98001,47.3575,-122.28,1210,12125,34.0,1981,2014-09-08
7/22/2014,639000.0,4,2.5,2210,9875,2.0,0.0,0.0,3,9,2210,0.0,1990,1990.0,98074,47.6285,-122.025,2440,8799,25.0,1990,2014-07-22
9/18/2014,215000.0,4,1.0,1130,7400,1.0,0.0,0.0,4,7,1130,0.0,1969,1969.0,98003,47.3437,-122.316,1540,7379,46.0,1969,2014-09-18
3/4/2015,405000.0,5,1.75,1550,10500,1.0,0.0,0.0,3,7,1100,450.0,1961,1961.0,98011,47.7573,-122.22,1420,9823,54.0,1961,2015-03-04
12/22/2014,250000.0,4,1.75,1710,7140,1.0,0.0,0.0,5,7,1010,700.0,1968,1968.0,98032,47.3745,-122.275,1770,8960,47.0,1968,2014-12-22
7/15/2014,405500.0,3,1.5,1010,8108,1.0,0.0,0.0,5,7,1010,0.0,1954,1954.0,98155,47.7359,-122.309,1300,8108,61.0,1954,2014-07-15
7/28/2014,452000.0,6,2.25,2660,13579,2.0,0.0,0.0,3,7,2660,0.0,1937,1990.0,98125,47.7142,-122.286,1120,8242,25.0,1990,2014-07-28
1/2/2015,730000.0,6,2.25,2660,13579,2.0,0.0,0.0,3,7,2660,0.0,1937,1990.0,98125,47.7142,-122.286,1120,8242,25.0,1990,2015-01-02
4/14/2015,267000.0,3,2.0,1300,9644,1.0,0.0,0.0,3,7,1300,0.0,1994,1994.0,98010,47.3131,-121.99799999999999,1430,9656,21.0,1994,2015-04-14
8/8/2014,289950.0,3,2.5,1670,6186,2.0,0.0,0.0,3,7,1670,0.0,2002,2002.0,98038,47.3668,-122.031,2390,6924,13.0,2002,2014-08-08
7/28/2014,565000.0,2,1.0,960,4080,1.0,0.0,0.0,5,7,960,0.0,1911,1911.0,98103,47.6893,-122.34899999999999,1300,4080,104.0,1911,2014-07-28
8/8/2014,1580000.0,4,3.25,4670,51836,2.0,0.0,0.0,4,12,4670,0.0,1988,1988.0,98005,47.635,-122.164,4230,41075,27.0,1988,2014-08-08
4/20/2015,636000.0,3,2.5,2140,2770,2.0,0.0,0.0,3,8,1770,370.0,2007,2007.0,98052,47.6664,-122.131,2510,2708,8.0,2007,2015-04-20
9/18/2014,350000.0,5,3.0,2520,5500,1.0,0.0,0.0,3,8,1550,970.0,2004,2004.0,98178,47.4938,-122.255,1700,8000,11.0,2004,2014-09-18
6/4/2014,320000.0,3,1.5,1650,9380,1.0,0.0,0.0,5,7,1130,520.0,1978,1978.0,98058,47.4525,-122.162,1720,8856,37.0,1978,2014-06-04
6/13/2014,210000.0,2,1.75,1440,5680,1.0,0.0,0.0,4,8,1440,0.0,1978,1978.0,98198,47.3825,-122.319,1320,3547,37.0,1978,2014-06-13
9/10/2014,245000.0,2,1.0,1050,5900,1.0,0.0,0.0,3,7,1050,0.0,1950,1950.0,98126,47.5326,-122.376,1280,5900,65.0,1950,2014-09-10
11/6/2014,328000.0,3,1.75,1470,7650,1.0,0.0,0.0,3,7,1130,340.0,1983,1983.0,98059,47.4818,-122.161,1590,7500,32.0,1983,2014-11-06
5/9/2014,985000.0,4,2.25,4230,37769,2.0,0.0,0.0,3,11,4230,0.0,1989,1989.0,98077,47.7287,-122.07700000000001,3890,37034,26.0,1989,2014-05-09
6/12/2014,501000.0,3,1.75,1970,7972,1.0,0.0,3.0,5,8,1370,600.0,1976,1976.0,98055,47.4908,-122.225,2460,9796,39.0,1976,2014-06-12
9/17/2014,315000.0,3,2.25,1540,17424,2.0,0.0,0.0,3,7,1540,0.0,1992,1992.0,98045,47.4429,-121.759,1560,11439,23.0,1992,2014-09-17
5/8/2014,403000.0,3,2.75,2090,8354,2.0,0.0,0.0,3,8,2090,0.0,2012,2012.0,98019,47.7336,-121.965,2280,6348,3.0,2012,2014-05-08
7/15/2014,550000.0,3,2.0,2380,17950,2.0,0.0,0.0,4,8,2110,270.0,1934,1934.0,98155,47.7591,-122.28,2030,23900,81.0,1934,2014-07-15
1/13/2015,347500.0,4,2.5,2156,3562,2.0,0.0,0.0,3,9,2156,0.0,2012,2012.0,98030,47.3591,-122.20100000000001,1708,3539,3.0,2012,2015-01-13
10/6/2014,365000.0,4,2.25,2070,8893,2.0,0.0,0.0,4,8,2070,0.0,1986,1986.0,98058,47.4388,-122.162,2390,7700,29.0,1986,2014-10-06
2/24/2015,588000.0,3,1.0,1910,8167,1.0,0.0,0.0,4,8,1270,640.0,1951,1951.0,98117,47.7004,-122.368,1500,6816,64.0,1951,2015-02-24
8/20/2014,605000.0,3,1.75,1920,7400,1.0,0.0,0.0,4,8,1260,660.0,1977,1977.0,98006,47.5633,-122.131,2360,8048,38.0,1977,2014-08-20
11/13/2014,1300000.0,3,3.25,3400,5979,2.0,0.0,0.0,4,9,2290,1110.0,1937,1937.0,98105,47.6585,-122.273,3090,6435,78.0,1937,2014-11-13
11/19/2014,233000.0,3,2.0,1400,9177,1.0,0.0,0.0,3,7,1400,0.0,1974,1974.0,98001,47.3415,-122.272,2020,8547,41.0,1974,2014-11-19
7/28/2014,360000.0,4,2.5,2210,17715,2.0,0.0,0.0,3,8,2210,0.0,1997,1997.0,98030,47.3818,-122.2,2210,16907,18.0,1997,2014-07-28
12/15/2014,459000.0,2,1.75,1170,4887,1.0,0.0,0.0,3,6,1020,150.0,1929,1929.0,98117,47.695,-122.366,1170,5441,86.0,1929,2014-12-15
11/7/2014,740000.0,3,2.0,2100,72745,1.0,0.0,0.0,4,9,2100,0.0,1995,1995.0,98077,47.7479,-122.06200000000001,2290,54885,20.0,1995,2014-11-07
9/17/2014,305000.0,3,1.0,1160,9750,1.0,0.0,0.0,3,7,1160,0.0,1967,1967.0,98077,47.7422,-122.073,1160,9650,48.0,1967,2014-09-17
6/20/2014,395000.0,3,1.0,1500,4000,1.0,0.0,0.0,3,6,900,600.0,1925,1925.0,98117,47.6921,-122.38,950,4000,90.0,1925,2014-06-20
1/23/2015,560000.0,4,2.5,2940,6000,2.0,0.0,0.0,3,8,2940,0.0,2000,2000.0,98011,47.7533,-122.198,2510,6600,15.0,2000,2015-01-23
7/14/2014,650000.0,4,1.75,2010,5070,1.0,0.0,1.0,4,7,1300,710.0,1963,1963.0,98116,47.5793,-122.402,2180,5400,52.0,1963,2014-07-14
6/5/2014,449950.0,3,2.5,2170,4912,2.0,0.0,0.0,3,7,2170,0.0,2003,2003.0,98028,47.7767,-122.23899999999999,2010,4395,12.0,2003,2014-06-05
2/24/2015,517500.0,3,1.5,1430,5200,1.0,0.0,3.0,4,7,1250,180.0,1940,1940.0,98117,47.6988,-122.387,2210,6240,75.0,1940,2015-02-24
9/3/2014,435000.0,4,1.5,1510,6460,1.0,0.0,0.0,3,7,1070,440.0,1970,1970.0,98034,47.7121,-122.214,1450,6630,45.0,1970,2014-09-03
4/9/2015,329999.0,3,1.0,1150,6908,1.0,0.0,0.0,3,6,800,350.0,1952,1952.0,98155,47.7447,-122.31299999999999,1150,6908,63.0,1952,2015-04-09
12/10/2014,950000.0,3,1.75,2150,4200,1.0,0.0,4.0,5,8,1140,1010.0,1960,1960.0,98116,47.5671,-122.405,2510,7500,55.0,1960,2014-12-10
7/30/2014,447000.0,3,1.0,1370,6001,1.0,0.0,0.0,5,7,1230,140.0,1944,1944.0,98108,47.5646,-122.31700000000001,1370,5520,71.0,1944,2014-07-30
8/28/2014,699800.0,2,2.5,2380,6600,1.0,0.0,0.0,3,8,2380,0.0,2010,2010.0,98053,47.717,-122.02,1870,6600,5.0,2010,2014-08-28
6/3/2014,850000.0,3,1.75,1370,3850,1.0,0.0,0.0,5,7,770,600.0,1911,1988.0,98112,47.6374,-122.279,1390,3600,27.0,1988,2014-06-03
9/2/2014,316500.0,3,1.75,1600,14250,1.0,0.0,0.0,3,7,1070,0.0,1979,1979.0,98023,47.3272,-122.355,2140,14960,36.0,1979,2014-09-02
7/15/2014,942500.0,5,3.5,3750,9612,1.0,0.0,2.0,4,9,2030,1720.0,1981,1981.0,98006,47.5511,-122.15700000000001,3270,9688,34.0,1981,2014-07-15
1/21/2015,1310000.0,2,2.25,3950,3938,2.0,0.0,4.0,3,10,2910,1040.0,1991,1991.0,98116,47.5912,-122.384,3220,4500,24.0,1991,2015-01-21
2/2/2015,856600.0,4,2.25,2400,13430,1.0,0.0,0.0,4,9,2400,0.0,1964,1964.0,98005,47.5987,-122.178,2580,10077,51.0,1964,2015-02-02
10/24/2014,405600.0,5,1.5,2830,4000,2.5,0.0,0.0,4,8,2830,0.0,1918,1918.0,98118,47.5132,-122.262,1480,4000,97.0,1918,2014-10-24
5/29/2014,565000.0,4,2.5,2440,22594,2.0,0.0,0.0,3,8,2440,0.0,1996,1996.0,98053,47.6333,-121.97,2560,33341,19.0,1996,2014-05-29
9/11/2014,400000.0,3,2.25,1190,1149,2.0,0.0,0.0,3,8,1050,140.0,2008,2008.0,98116,47.5818,-122.387,1210,1316,7.0,2008,2014-09-11
3/24/2015,330000.0,3,2.0,1400,218252,1.0,0.0,0.0,3,7,1400,0.0,1997,1997.0,98019,47.7576,-121.934,2230,218222,18.0,1997,2015-03-24
2/27/2015,374950.0,4,2.75,2730,4683,2.0,0.0,0.0,3,7,2730,0.0,2005,2005.0,98038,47.3608,-122.04299999999999,2230,4924,10.0,2005,2015-02-27
12/17/2014,405300.0,3,2.75,2390,7939,1.0,0.0,0.0,5,7,1610,780.0,1983,1983.0,98056,47.4987,-122.166,1920,7939,32.0,1983,2014-12-17
11/4/2014,560000.0,3,2.25,2060,31400,2.0,0.0,0.0,3,8,2060,0.0,1984,1984.0,98074,47.6216,-122.056,2160,34500,31.0,1984,2014-11-04
3/24/2015,824000.0,4,2.25,2490,9864,1.0,0.0,0.0,4,8,1290,1200.0,1961,1961.0,98004,47.6051,-122.195,2360,9864,54.0,1961,2015-03-24
7/16/2014,260000.0,3,1.75,1100,10968,1.0,0.0,0.0,5,7,1100,0.0,1984,1984.0,98042,47.363,-122.08,1400,7799,31.0,1984,2014-07-16
1/7/2015,760000.0,4,2.5,2430,6099,1.0,0.0,0.0,5,8,1470,960.0,1965,1965.0,98115,47.6777,-122.287,2180,6099,50.0,1965,2015-01-07
6/24/2014,405000.0,3,2.5,3170,12750,2.0,0.0,0.0,3,10,2360,810.0,1995,1995.0,98023,47.3384,-122.336,2970,13125,20.0,1995,2014-06-24
6/19/2014,429900.0,4,2.5,2640,8625,2.0,0.0,0.0,3,8,2640,0.0,1987,1987.0,98058,47.4598,-122.15,2240,8700,28.0,1987,2014-06-19
11/13/2014,341500.0,3,1.5,1130,7223,1.0,0.0,0.0,4,7,1130,0.0,1961,1961.0,98056,47.5089,-122.189,1320,7356,54.0,1961,2014-11-13
6/12/2014,465250.0,5,2.0,1940,7642,1.5,0.0,0.0,3,7,1940,0.0,1957,1957.0,98177,47.7751,-122.38,1940,8724,58.0,1957,2014-06-12
5/6/2014,450000.0,2,2.0,1100,3000,1.5,0.0,0.0,3,7,1100,0.0,1912,2005.0,98117,47.6797,-122.36200000000001,1390,4000,10.0,2005,2014-05-06
2/9/2015,390000.0,3,1.0,1200,10800,1.0,0.0,0.0,4,7,1200,0.0,1955,1955.0,98006,47.5771,-122.14399999999999,1370,9950,60.0,1955,2015-02-09
5/2/2014,420000.0,3,2.25,2000,8030,1.0,0.0,0.0,4,8,1000,1000.0,1963,1963.0,98008,47.6188,-122.11399999999999,2070,8250,52.0,1963,2014-05-02
6/15/2014,269950.0,3,2.5,1890,4838,2.0,0.0,0.0,3,8,1730,160.0,2002,2002.0,98168,47.4802,-122.279,1910,7409,13.0,2002,2014-06-15
10/16/2014,493000.0,4,2.0,1910,2874,1.0,0.0,0.0,3,7,1060,850.0,1910,1910.0,98122,47.6101,-122.295,1520,2874,105.0,1910,2014-10-16
5/15/2014,370000.0,4,2.5,2710,5880,2.0,0.0,0.0,3,9,2710,0.0,1998,1998.0,98092,47.3314,-122.17200000000001,2520,6000,17.0,1998,2014-05-15
6/12/2014,2250000.0,5,4.25,4860,9453,1.5,0.0,1.0,5,10,3100,1760.0,1905,1905.0,98112,47.6196,-122.286,3150,8557,110.0,1905,2014-06-12
2/25/2015,305000.0,3,1.0,1250,23680,1.0,0.0,0.0,5,7,1250,0.0,1967,1967.0,98059,47.475,-122.11,1450,23680,48.0,1967,2015-02-25
6/12/2014,400000.0,3,1.75,1590,8219,1.5,0.0,0.0,5,6,970,620.0,1938,1938.0,98034,47.7146,-122.21700000000001,2030,7504,77.0,1938,2014-06-12
11/18/2014,320000.0,3,1.5,1240,1221,2.0,0.0,0.0,3,8,1050,190.0,2009,2009.0,98133,47.7073,-122.35600000000001,1180,887,6.0,2009,2014-11-18
1/21/2015,715000.0,4,1.0,2000,4800,2.0,0.0,0.0,4,7,2000,0.0,1911,1911.0,98103,47.6583,-122.351,1260,1452,104.0,1911,2015-01-21
12/2/2014,650000.0,6,2.75,3610,10003,1.5,0.0,0.0,4,8,3610,0.0,1966,1966.0,98008,47.6261,-122.125,2560,10004,49.0,1966,2014-12-02
3/4/2015,218000.0,5,1.75,1930,8040,1.0,0.0,0.0,4,8,1930,0.0,1966,1966.0,98023,47.3109,-122.376,2370,8000,49.0,1966,2015-03-04
4/15/2015,500000.0,2,1.0,1280,5400,1.0,0.0,0.0,3,7,1280,0.0,1964,1964.0,98117,47.6949,-122.37100000000001,1540,5670,51.0,1964,2015-04-15
11/20/2014,460000.0,4,2.0,2090,40419,1.0,0.0,0.0,4,7,2090,0.0,1984,1984.0,98027,47.4691,-121.993,2380,63162,31.0,1984,2014-11-20
7/9/2014,232500.0,3,1.5,1940,9887,1.0,0.0,0.0,4,7,1140,800.0,1969,1969.0,98003,47.3289,-122.32700000000001,1410,9936,46.0,1969,2014-07-09
5/16/2014,408200.0,3,2.5,1800,5761,2.0,0.0,0.0,4,7,1800,0.0,1990,1990.0,98106,47.5293,-122.363,1800,5952,25.0,1990,2014-05-16
6/11/2014,522000.0,3,1.75,1730,8400,1.0,0.0,0.0,4,7,1400,330.0,1980,1980.0,98052,47.6792,-122.115,1830,8636,35.0,1980,2014-06-11
6/23/2014,675000.0,4,2.5,2810,11120,2.0,0.0,0.0,3,9,2810,0.0,1982,1982.0,98074,47.6337,-122.044,3100,12672,33.0,1982,2014-06-23
7/9/2014,1360000.0,4,3.5,3550,11000,1.0,0.0,2.0,3,11,2260,1290.0,1999,1999.0,98006,47.5506,-122.134,4100,10012,16.0,1999,2014-07-09
10/9/2014,249950.0,4,1.0,1330,7980,1.5,0.0,0.0,3,6,1330,0.0,1952,1952.0,98168,47.492,-122.333,1570,8588,63.0,1952,2014-10-09
3/4/2015,210000.0,2,1.0,750,34133,1.0,0.0,0.0,3,6,750,0.0,1950,1950.0,98168,47.4781,-122.294,1460,25792,65.0,1950,2015-03-04
7/11/2014,429950.0,4,1.0,1760,7216,1.0,0.0,0.0,3,7,1090,670.0,1947,1947.0,98133,47.7041,-122.355,1180,3844,68.0,1947,2014-07-11
10/6/2014,737500.0,4,2.5,3200,36276,2.0,0.0,0.0,3,9,3200,0.0,1993,1993.0,98053,47.6304,-121.994,2930,33171,22.0,1993,2014-10-06
9/26/2014,710000.0,4,2.0,1740,9000,1.0,0.0,0.0,5,8,1740,0.0,1958,1958.0,98033,47.6815,-122.198,1850,7700,57.0,1958,2014-09-26
10/20/2014,470000.0,3,2.5,2100,4700,2.0,0.0,0.0,3,8,2100,0.0,1999,1999.0,98065,47.5341,-121.867,2100,4700,16.0,1999,2014-10-20
2/24/2015,1100000.0,4,3.5,4270,40097,1.0,0.0,0.0,4,12,4270,0.0,1993,1993.0,98077,47.7354,-122.07799999999999,3510,36149,22.0,1993,2015-02-24
8/15/2014,650000.0,3,2.0,1340,2720,1.5,0.0,0.0,3,7,1340,0.0,1913,1913.0,98103,47.6518,-122.335,2030,4590,102.0,1913,2014-08-15
5/19/2014,1220000.0,4,2.5,3190,8684,1.0,0.0,3.0,5,9,1680,1510.0,1967,1967.0,98006,47.5619,-122.162,3160,8684,48.0,1967,2014-05-19
1/15/2015,422120.0,3,2.5,1630,4534,2.0,0.0,0.0,3,8,1630,0.0,1987,1987.0,98034,47.7148,-122.205,1380,4779,28.0,1987,2015-01-15
1/7/2015,625000.0,5,2.5,2990,15085,2.0,0.0,0.0,3,9,2990,0.0,2007,2007.0,98011,47.746,-122.21799999999999,3150,13076,8.0,2007,2015-01-07
6/6/2014,385200.0,4,1.0,1550,7740,1.5,0.0,0.0,3,6,1550,0.0,1954,1954.0,98126,47.5222,-122.375,1220,7740,61.0,1954,2014-06-06
4/14/2015,500000.0,3,2.25,1690,4964,2.0,0.0,0.0,3,8,1690,0.0,1989,1989.0,98029,47.5756,-122.01,1800,5036,26.0,1989,2015-04-14
11/18/2014,308000.0,4,2.25,1960,12243,2.0,0.0,0.0,3,8,1960,0.0,1989,1989.0,98042,47.3405,-122.05799999999999,1910,12230,26.0,1989,2014-11-18
6/5/2014,565000.0,3,2.75,2390,9966,1.0,0.0,0.0,5,8,1360,1030.0,1977,1977.0,98006,47.5433,-122.185,2140,10713,38.0,1977,2014-06-05
9/8/2014,581000.0,3,2.5,2600,4438,2.0,0.0,0.0,3,7,2600,0.0,2004,2004.0,98053,47.6799,-122.03399999999999,2600,4904,11.0,2004,2014-09-08
8/6/2014,361000.0,3,2.0,1950,8698,1.0,0.0,0.0,3,8,1950,0.0,1999,1999.0,98042,47.39,-122.15299999999999,2330,7212,16.0,1999,2014-08-06
1/22/2015,345000.0,3,1.0,1250,7210,1.0,0.0,0.0,4,7,1250,0.0,1964,1964.0,98008,47.6329,-122.12100000000001,1530,8800,51.0,1964,2015-01-22
10/16/2014,419000.0,2,2.25,1180,1253,2.0,0.0,0.0,3,8,840,340.0,2008,2008.0,98122,47.6124,-122.309,1310,1963,7.0,2008,2014-10-16
5/12/2015,347000.0,3,2.5,1680,4308,2.0,0.0,0.0,3,7,1680,0.0,2004,2004.0,98056,47.4802,-122.179,2160,4182,11.0,2004,2015-05-12
10/22/2014,625000.0,4,2.25,2220,36085,2.0,0.0,0.0,3,9,2220,0.0,1989,1989.0,98075,47.5839,-121.991,3000,36906,26.0,1989,2014-10-22
3/25/2015,2400000.0,4,4.25,4890,15188,2.0,0.0,2.0,3,11,3090,1800.0,1999,1999.0,98040,47.5602,-122.227,3470,16201,16.0,1999,2015-03-25
12/23/2014,379000.0,3,3.25,2660,17852,2.5,0.0,0.0,3,8,2660,0.0,2014,2014.0,98010,47.3077,-122.01100000000001,1320,11876,1.0,2014,2014-12-23
12/22/2014,310000.0,3,1.5,1150,3323,2.0,0.0,0.0,3,7,1150,0.0,1988,1988.0,98029,47.5707,-122.01700000000001,1150,2980,27.0,1988,2014-12-22
5/13/2015,250000.0,2,2.0,1130,5500,1.0,0.0,0.0,4,6,1130,0.0,1941,1941.0,98030,47.3839,-122.225,1320,6600,74.0,1941,2015-05-13
8/14/2014,682000.0,5,2.75,2760,5000,2.0,0.0,0.0,3,9,2760,0.0,2005,2005.0,98059,47.538999999999994,-122.18799999999999,2870,5030,10.0,2005,2014-08-14
7/21/2014,246500.0,3,2.0,1430,8919,1.0,0.0,0.0,3,7,1430,0.0,1992,1992.0,98022,47.2118,-121.98299999999999,1580,8919,23.0,1992,2014-07-21
10/29/2014,325000.0,3,1.0,1490,57381,1.5,0.0,0.0,4,5,1490,0.0,1932,1932.0,98092,47.2597,-122.228,1580,101529,83.0,1932,2014-10-29
8/6/2014,310950.0,4,2.5,2030,4997,2.0,0.0,0.0,3,8,2030,0.0,2004,2004.0,98031,47.393,-122.184,2095,5500,11.0,2004,2014-08-06
9/1/2014,1100000.0,3,2.0,3010,5000,2.0,0.0,2.0,5,9,1890,1120.0,1931,1931.0,98199,47.6347,-122.396,2688,5000,84.0,1931,2014-09-01
10/2/2014,287500.0,3,1.0,1810,7200,1.0,0.0,0.0,4,7,1130,680.0,1954,1954.0,98133,47.7493,-122.351,1810,8100,61.0,1954,2014-10-02
2/18/2015,431000.0,3,1.0,1810,7200,1.0,0.0,0.0,4,7,1130,680.0,1954,1954.0,98133,47.7493,-122.351,1810,8100,61.0,1954,2015-02-18
8/22/2014,226000.0,3,1.0,970,5000,1.0,0.0,0.0,3,6,970,0.0,1968,1968.0,98118,47.5282,-122.279,1290,5875,47.0,1968,2014-08-22
5/12/2015,825000.0,3,1.75,2010,3090,1.5,0.0,0.0,5,7,1510,500.0,1926,1926.0,98103,47.681999999999995,-122.348,1600,3150,89.0,1926,2015-05-12
9/11/2014,175000.0,4,1.0,1300,6030,1.5,0.0,0.0,3,6,1300,0.0,1947,1947.0,98168,47.4778,-122.286,1240,6900,68.0,1947,2014-09-11
5/15/2014,465750.0,3,1.5,1260,10350,1.0,0.0,0.0,3,7,1260,0.0,1959,1959.0,98008,47.6357,-122.12299999999999,1800,10350,56.0,1959,2014-05-15
3/19/2015,659000.0,4,2.25,2610,24931,2.0,0.0,0.0,3,8,2610,0.0,1983,1983.0,98075,47.5771,-122.05,2550,18306,32.0,1983,2015-03-19
2/10/2015,595000.0,3,1.75,1910,5753,1.0,0.0,3.0,3,8,1110,800.0,1941,1941.0,98115,47.6898,-122.32700000000001,1630,5580,74.0,1941,2015-02-10
6/26/2014,350000.0,3,2.25,1780,16290,2.0,0.0,0.0,4,8,1780,0.0,1987,1987.0,98058,47.4622,-122.12700000000001,1780,8810,28.0,1987,2014-06-26
6/6/2014,270000.0,4,2.25,1900,8600,1.0,0.0,0.0,4,8,1900,0.0,1975,1975.0,98023,47.3102,-122.381,2120,8000,40.0,1975,2014-06-06
9/11/2014,662500.0,6,2.25,2450,25600,1.0,0.0,2.0,3,7,1340,1110.0,1957,1957.0,98008,47.6061,-122.117,1850,10230,58.0,1957,2014-09-11
11/20/2014,249900.0,3,1.75,1380,14000,1.0,0.0,0.0,4,5,1380,0.0,1939,1939.0,98001,47.294,-122.281,1490,18503,76.0,1939,2014-11-20
3/17/2015,324500.0,3,1.75,1920,11340,1.0,0.0,0.0,4,7,1230,690.0,1977,1977.0,98023,47.3272,-122.36200000000001,1980,9638,38.0,1977,2015-03-17
7/18/2014,430000.0,2,1.75,1350,4003,1.0,0.0,0.0,3,8,1350,0.0,2004,2004.0,98053,47.7176,-122.03299999999999,1350,4479,11.0,2004,2014-07-18
5/13/2015,419950.0,2,1.75,1350,4003,1.0,0.0,0.0,3,8,1350,0.0,2004,2004.0,98053,47.7176,-122.03299999999999,1350,4479,11.0,2004,2015-05-13
7/28/2014,285000.0,4,1.75,2510,7440,1.0,0.0,2.0,4,8,1290,1220.0,1962,1962.0,98032,47.3748,-122.27600000000001,1790,8000,53.0,1962,2014-07-28
1/7/2015,332000.0,4,2.5,2470,7780,2.0,0.0,0.0,3,8,2470,0.0,2002,2002.0,98092,47.3337,-122.191,2100,5972,13.0,2002,2015-01-07
12/15/2014,282000.0,4,1.75,1660,10725,1.0,0.0,0.0,3,7,960,700.0,1956,1956.0,98168,47.5033,-122.3,1340,9023,59.0,1956,2014-12-15
11/18/2014,320000.0,3,1.0,1340,5175,1.0,0.0,0.0,3,7,940,400.0,1987,1987.0,98133,47.7321,-122.34,1020,5500,28.0,1987,2014-11-18
5/9/2014,428750.0,3,1.0,1620,30736,1.5,0.0,0.0,4,7,1620,0.0,1911,1977.0,98006,47.5719,-122.119,2440,28826,38.0,1977,2014-05-09
1/14/2015,330000.0,3,2.25,2300,35287,2.0,0.0,0.0,3,8,2300,0.0,1977,1977.0,98022,47.2477,-121.93700000000001,1760,47916,38.0,1977,2015-01-14
12/9/2014,456500.0,4,3.5,2000,2309,3.0,0.0,0.0,3,8,2000,0.0,2008,2008.0,98177,47.7027,-122.361,1440,1548,7.0,2008,2014-12-09
5/9/2014,352000.0,3,2.25,1640,11050,1.0,0.0,0.0,4,8,1640,0.0,1972,1972.0,98059,47.4723,-122.12100000000001,1870,11050,43.0,1972,2014-05-09
11/25/2014,664000.0,4,2.0,1530,4080,1.5,0.0,0.0,4,7,1530,0.0,1912,1912.0,98105,47.6645,-122.325,1860,4080,103.0,1912,2014-11-25
7/22/2014,628000.0,3,1.75,4000,11894,1.0,0.0,0.0,3,9,2190,1810.0,1987,1987.0,98011,47.7738,-122.20299999999999,2530,8650,28.0,1987,2014-07-22
3/4/2015,512000.0,3,1.75,1610,12555,1.0,0.0,0.0,3,7,1080,530.0,1977,1977.0,98052,47.6618,-122.13600000000001,1780,10374,38.0,1977,2015-03-04
12/11/2014,254000.0,3,2.0,2070,9000,1.0,0.0,0.0,4,7,1450,620.0,1969,1969.0,98023,47.3085,-122.376,1630,7885,46.0,1969,2014-12-11
5/21/2014,535800.0,4,2.5,1900,5790,2.0,0.0,0.0,3,8,1900,0.0,1994,1994.0,98029,47.5691,-121.99600000000001,2030,5790,21.0,1994,2014-05-21
10/10/2014,287653.0,3,1.0,1050,16050,1.0,0.0,0.0,4,7,1050,0.0,1960,1981.0,98038,47.3841,-122.006,1610,27600,34.0,1981,2014-10-10
7/31/2014,438000.0,3,2.5,1520,1304,2.0,0.0,0.0,3,8,1180,340.0,2006,2006.0,98136,47.5446,-122.385,1270,1718,9.0,2006,2014-07-31
7/16/2014,450000.0,4,1.75,2390,23899,1.0,0.0,0.0,3,7,1750,640.0,1949,1949.0,98028,47.7557,-122.23700000000001,1840,33900,66.0,1949,2014-07-16
6/27/2014,327000.0,5,2.75,2400,8050,2.0,0.0,0.0,3,8,2400,0.0,1998,1998.0,98092,47.2635,-122.209,2400,8050,17.0,1998,2014-06-27
8/12/2014,370500.0,4,2.5,1790,6120,2.0,0.0,0.0,3,7,1790,0.0,2005,2005.0,98059,47.4829,-122.12799999999999,1950,5660,10.0,2005,2014-08-12
10/22/2014,265000.0,3,2.5,1720,6271,2.0,0.0,0.0,3,7,1720,0.0,1993,1993.0,98038,47.3898,-122.04899999999999,1570,6587,22.0,1993,2014-10-22
3/10/2015,450000.0,4,2.75,2980,13260,1.0,0.0,0.0,4,8,1800,1180.0,1979,1979.0,98056,47.5152,-122.197,1920,10731,36.0,1979,2015-03-10
6/27/2014,425000.0,3,1.0,1520,213444,1.5,0.0,3.0,5,8,1520,0.0,1988,1988.0,98027,47.5081,-122.09299999999999,2640,213444,27.0,1988,2014-06-27
11/13/2014,166600.0,3,1.75,1150,8690,1.0,0.0,0.0,4,7,1150,0.0,1977,1977.0,98042,47.3729,-122.115,1330,7040,38.0,1977,2014-11-13
6/20/2014,245000.0,1,0.75,380,15000,1.0,0.0,0.0,3,5,380,0.0,1963,1963.0,98168,47.481,-122.323,1170,15000,52.0,1963,2014-06-20
5/8/2015,565000.0,3,1.0,910,5212,1.0,0.0,0.0,3,7,910,0.0,1951,1951.0,98115,47.6742,-122.28399999999999,1520,6300,64.0,1951,2015-05-08
8/11/2014,539900.0,3,1.75,1650,10150,1.0,0.0,0.0,3,8,1230,420.0,1976,1976.0,98033,47.6963,-122.169,1930,8958,39.0,1976,2014-08-11
3/3/2015,910000.0,3,3.5,2480,3200,2.0,0.0,0.0,3,10,2480,0.0,2010,2010.0,98144,47.5951,-122.307,1980,3200,5.0,2010,2015-03-03
11/4/2014,280000.0,4,2.5,2050,7416,2.0,0.0,0.0,3,8,2050,0.0,1990,1990.0,98092,47.2658,-122.219,2050,7920,25.0,1990,2014-11-04
3/13/2015,275000.0,3,2.25,1420,8549,2.0,0.0,0.0,4,7,1420,0.0,1989,1989.0,98038,47.3576,-122.039,1560,7471,26.0,1989,2015-03-13
4/27/2015,467000.0,3,2.5,3460,6590,2.0,0.0,0.0,3,7,3460,0.0,2001,2001.0,98056,47.4802,-122.18799999999999,2490,6312,14.0,2001,2015-04-27
7/31/2014,457500.0,3,2.5,1500,4445,2.0,0.0,0.0,3,8,1500,0.0,1996,1996.0,98029,47.5682,-122.005,1730,4408,19.0,1996,2014-07-31
12/26/2014,381156.0,2,1.0,1320,3090,1.0,0.0,0.0,4,7,1320,0.0,1908,1908.0,98118,47.5517,-122.27600000000001,1270,4120,107.0,1908,2014-12-26
4/23/2015,289999.0,5,2.5,2180,8240,1.0,0.0,0.0,4,8,1220,960.0,1977,1977.0,98092,47.3122,-122.191,2050,7590,38.0,1977,2015-04-23
4/22/2015,642450.0,3,1.75,1830,4160,1.0,0.0,0.0,3,7,1230,600.0,1919,1919.0,98144,47.5962,-122.288,1950,4160,96.0,1919,2015-04-22
9/19/2014,469950.0,3,2.25,1620,8701,1.0,0.0,0.0,3,7,1220,400.0,1962,1962.0,98007,47.6071,-122.137,1600,7910,53.0,1962,2014-09-19
3/5/2015,795000.0,3,2.0,2920,13650,1.0,0.0,2.0,5,8,1460,1460.0,1975,1975.0,98033,47.6652,-122.18799999999999,2920,10988,40.0,1975,2015-03-05
2/11/2015,785000.0,4,2.5,3300,10514,2.0,0.0,0.0,3,10,3300,0.0,1984,1984.0,98074,47.6323,-122.036,2820,11462,31.0,1984,2015-02-11
5/30/2014,860000.0,3,2.25,3060,12095,2.0,0.0,0.0,3,10,3060,0.0,1983,1983.0,98006,47.5611,-122.10600000000001,3060,11455,32.0,1983,2014-05-30
2/13/2015,147500.0,3,1.0,1530,8498,1.0,0.0,0.0,3,7,1530,0.0,1959,1959.0,98031,47.403999999999996,-122.20299999999999,1380,8498,56.0,1959,2015-02-13
11/25/2014,390000.0,3,2.0,1910,11576,1.0,0.0,0.0,3,7,1410,500.0,1978,1978.0,98011,47.7356,-122.198,2040,8750,37.0,1978,2014-11-25
12/19/2014,229000.0,3,1.0,1020,8100,1.0,0.0,0.0,3,7,1020,0.0,1954,1954.0,98198,47.3586,-122.314,1020,8100,61.0,1954,2014-12-19
5/15/2014,185000.0,3,1.0,1150,8100,1.0,0.0,0.0,3,6,1150,0.0,1932,1932.0,98168,47.494,-122.307,1120,8100,83.0,1932,2014-05-15
8/26/2014,414900.0,3,1.5,1260,9570,1.0,0.0,0.0,3,7,870,390.0,1941,1941.0,98115,47.7004,-122.305,1620,7000,74.0,1941,2014-08-26
2/12/2015,200000.0,4,2.0,1920,4822,1.0,0.0,0.0,2,6,920,1000.0,1914,1914.0,98136,47.5507,-122.381,1120,4822,101.0,1914,2015-02-12
10/21/2014,225000.0,4,2.25,1800,9350,1.0,0.0,0.0,3,8,1800,0.0,1969,1969.0,98092,47.2959,-122.191,2060,8800,46.0,1969,2014-10-21
9/12/2014,720000.0,3,1.75,2040,4000,2.0,0.0,0.0,5,7,1360,680.0,1924,1924.0,98105,47.6675,-122.289,1610,4000,91.0,1924,2014-09-12
6/3/2014,930000.0,4,2.5,2200,4000,2.0,0.0,0.0,5,8,1430,770.0,1908,1908.0,98119,47.6402,-122.37,2100,4000,107.0,1908,2014-06-03
6/4/2014,1270000.0,5,2.5,3200,17204,1.0,0.0,0.0,3,7,2160,1040.0,1952,1952.0,98004,47.6209,-122.22200000000001,4090,15732,63.0,1952,2014-06-04
11/11/2014,700000.0,5,3.25,2400,3118,2.0,0.0,0.0,4,7,1780,620.0,1928,1928.0,98122,47.6094,-122.291,2100,3941,87.0,1928,2014-11-11
7/15/2014,466000.0,2,1.5,1140,1058,3.0,0.0,0.0,3,7,1140,0.0,2005,2005.0,98103,47.6608,-122.333,1170,1116,10.0,2005,2014-07-15
8/25/2014,374000.0,3,1.5,1330,10640,1.0,0.0,0.0,3,7,1330,0.0,1976,1976.0,98011,47.7364,-122.193,1460,8520,39.0,1976,2014-08-25
7/16/2014,480000.0,3,2.5,1940,10035,2.0,0.0,0.0,4,8,1940,0.0,1994,1994.0,98072,47.7438,-122.17200000000001,2810,8333,21.0,1994,2014-07-16
6/10/2014,740000.0,3,2.5,3000,25341,2.0,0.0,0.0,3,9,3000,0.0,1995,1995.0,98053,47.6724,-122.01299999999999,3000,32417,20.0,1995,2014-06-10
11/10/2014,1010000.0,4,1.0,1820,5400,1.5,0.0,0.0,3,8,1820,0.0,1923,2014.0,98102,47.6476,-122.318,1820,5400,1.0,2014,2014-11-10
5/30/2014,395000.0,4,2.5,2910,5000,2.0,0.0,0.0,3,8,2910,0.0,2002,2002.0,98042,47.3782,-122.12700000000001,2740,5045,13.0,2002,2014-05-30
7/25/2014,340000.0,2,1.0,1090,6771,1.0,0.0,0.0,3,6,1090,0.0,1954,1954.0,98106,47.5185,-122.352,1200,4992,61.0,1954,2014-07-25
8/11/2014,209000.0,3,2.0,1230,1340,2.0,0.0,0.0,3,7,1020,210.0,2003,2003.0,98106,47.526,-122.361,1260,1312,12.0,2003,2014-08-11
11/14/2014,431650.0,5,2.5,1710,7700,1.5,0.0,0.0,3,7,1710,0.0,1962,1962.0,98007,47.5922,-122.146,1530,7700,53.0,1962,2014-11-14
5/8/2014,980000.0,5,2.5,3160,11470,1.0,0.0,0.0,4,9,1780,1380.0,1971,1971.0,98040,47.5368,-122.21600000000001,3260,11470,44.0,1971,2014-05-08
8/5/2014,660000.0,3,2.5,2680,28243,2.0,0.0,0.0,3,9,2680,0.0,1993,1993.0,98077,47.7637,-122.05,2670,32130,22.0,1993,2014-08-05
3/11/2015,730000.0,4,2.25,2190,9009,2.0,0.0,0.0,4,8,1840,350.0,1977,1977.0,98033,47.6916,-122.18799999999999,2190,10251,38.0,1977,2015-03-11
4/14/2015,291500.0,3,1.75,1260,9600,1.0,0.0,0.0,4,7,1260,0.0,1988,1988.0,98042,47.3592,-122.07600000000001,1640,9946,27.0,1988,2015-04-14
6/20/2014,905000.0,4,3.5,2970,14486,2.0,0.0,0.0,3,9,2340,630.0,1997,1997.0,98040,47.5627,-122.215,3680,14486,18.0,1997,2014-06-20
8/11/2014,800000.0,4,2.5,2570,50308,1.5,0.0,0.0,3,10,2570,0.0,1993,1993.0,98077,47.7418,-122.039,3420,37891,22.0,1993,2014-08-11
5/9/2014,839900.0,4,3.5,3810,13592,1.0,0.0,1.0,3,9,2560,1250.0,2013,2013.0,98056,47.5134,-122.2,3230,9311,2.0,2013,2014-05-09
7/14/2014,200000.0,1,1.5,1010,1157,2.0,0.0,0.0,3,8,950,60.0,2007,2007.0,98126,47.5492,-122.37200000000001,1360,1688,8.0,2007,2014-07-14
2/18/2015,300000.0,3,2.0,1480,6698,1.0,0.0,0.0,4,7,1080,400.0,1979,1979.0,98058,47.4614,-122.16799999999999,1850,7348,36.0,1979,2015-02-18
6/3/2014,530000.0,3,1.75,1250,6041,1.5,0.0,0.0,5,7,1250,0.0,1942,1942.0,98115,47.69,-122.304,1180,6042,73.0,1942,2014-06-03
3/26/2015,314950.0,3,2.25,1654,8479,2.0,0.0,0.0,3,7,1654,0.0,1995,1995.0,98038,47.3627,-122.037,1654,8479,20.0,1995,2015-03-26
10/7/2014,255000.0,3,1.75,1410,9315,1.0,0.0,0.0,5,7,1410,0.0,1960,1960.0,98031,47.3969,-122.198,1630,8250,55.0,1960,2014-10-07
10/16/2014,550000.0,5,2.75,2160,5720,1.0,0.0,0.0,5,7,1500,660.0,1950,1950.0,98144,47.5728,-122.304,2160,4996,65.0,1950,2014-10-16
8/6/2014,435000.0,3,1.0,1400,4800,1.0,0.0,0.0,4,6,700,700.0,1917,1917.0,98136,47.5499,-122.391,1470,6000,98.0,1917,2014-08-06
11/24/2014,234000.0,3,1.75,1420,8738,1.0,0.0,0.0,4,7,1420,0.0,1966,1966.0,98002,47.3113,-122.20700000000001,1660,8738,49.0,1966,2014-11-24
10/10/2014,615000.0,4,2.25,2500,10062,1.0,0.0,0.0,3,8,1600,900.0,1975,1975.0,98052,47.638999999999996,-122.1,2500,9750,40.0,1975,2014-10-10
9/10/2014,205000.0,3,2.0,1410,8384,1.0,0.0,0.0,3,7,1410,0.0,1985,1985.0,98001,47.3315,-122.26299999999999,1410,9205,30.0,1985,2014-09-10
9/19/2014,384000.0,4,1.75,2100,7135,1.0,0.0,0.0,4,7,1050,1050.0,1955,1955.0,98106,47.5353,-122.34899999999999,1730,4000,60.0,1955,2014-09-19
5/22/2014,324000.0,3,2.5,1750,7208,2.0,0.0,0.0,3,8,1750,0.0,1994,1994.0,98055,47.4315,-122.19200000000001,2050,7524,21.0,1994,2014-05-22
7/22/2014,645000.0,3,1.75,2070,5500,1.0,0.0,0.0,4,7,1130,940.0,1946,1946.0,98115,47.6733,-122.301,1800,4400,69.0,1946,2014-07-22
10/23/2014,570000.0,3,3.25,1570,1777,2.0,0.0,0.0,3,8,1260,310.0,2007,2007.0,98107,47.6655,-122.369,1000,1777,8.0,2007,2014-10-23
12/10/2014,324000.0,3,2.5,1920,5322,2.0,0.0,0.0,3,8,1920,0.0,1999,1999.0,98031,47.4095,-122.195,1920,5000,16.0,1999,2014-12-10
8/28/2014,270000.0,2,1.0,1000,10320,1.0,0.0,0.0,3,6,1000,0.0,1943,1943.0,98106,47.527,-122.35600000000001,1100,5160,72.0,1943,2014-08-28
5/19/2014,290000.0,5,1.5,2120,7700,1.5,0.0,0.0,5,7,2120,0.0,1962,1962.0,98058,47.4599,-122.17200000000001,1730,7700,53.0,1962,2014-05-19
6/30/2014,250000.0,3,2.0,1440,9220,1.0,0.0,0.0,3,7,1440,0.0,1965,1965.0,98198,47.3702,-122.31700000000001,1390,7830,50.0,1965,2014-06-30
1/20/2015,342000.0,3,1.75,1660,16275,2.0,0.0,0.0,3,7,1660,0.0,1990,1990.0,98014,47.6903,-121.915,1520,16275,25.0,1990,2015-01-20
3/18/2015,255000.0,3,1.5,1340,8450,1.0,0.0,0.0,4,7,1340,0.0,1958,1958.0,98188,47.4405,-122.28,1340,8920,57.0,1958,2015-03-18
6/23/2014,800000.0,3,2.25,2380,11824,1.0,0.0,0.0,4,9,1450,930.0,1972,1972.0,98040,47.5371,-122.21799999999999,2750,11491,43.0,1972,2014-06-23
5/16/2014,451000.0,3,1.75,1560,4049,1.5,0.0,2.0,3,7,1000,560.0,1926,1926.0,98126,47.5666,-122.375,1430,3738,89.0,1926,2014-05-16
12/3/2014,990000.0,4,2.5,2780,10480,1.0,0.0,3.0,3,7,1390,1390.0,1967,1967.0,98033,47.6597,-122.204,2860,10506,48.0,1967,2014-12-03
5/20/2014,288400.0,4,2.5,1860,6687,1.0,0.0,0.0,4,7,1220,640.0,1983,1983.0,98031,47.4046,-122.186,1860,6117,32.0,1983,2014-05-20
3/10/2015,420000.0,3,1.5,2390,4600,2.0,0.0,0.0,3,8,1750,640.0,1920,1995.0,98118,47.5383,-122.26799999999999,1690,5220,20.0,1995,2015-03-10
5/14/2015,359000.0,2,2.75,1370,1140,2.0,0.0,0.0,3,8,1080,290.0,2009,2009.0,98133,47.7052,-122.34299999999999,1370,1090,6.0,2009,2015-05-14
8/8/2014,390000.0,4,3.0,2570,262018,1.0,0.0,0.0,3,7,1420,1150.0,1988,1988.0,98058,47.4417,-122.09,2260,19811,27.0,1988,2014-08-08
9/2/2014,300000.0,3,2.5,1320,2614,2.0,0.0,0.0,3,7,1320,0.0,2005,2005.0,98118,47.5355,-122.28299999999999,1320,2533,10.0,2005,2014-09-02
3/5/2015,545000.0,5,2.5,2520,7863,1.0,0.0,0.0,3,7,1500,1020.0,1981,1981.0,98034,47.7096,-122.199,2030,8580,34.0,1981,2015-03-05
4/8/2015,288349.0,3,1.0,1250,18616,1.0,0.0,0.0,4,6,1250,0.0,1972,1972.0,98010,47.3414,-122.04700000000001,1920,15654,43.0,1972,2015-04-08
2/5/2015,299900.0,3,2.25,1560,35026,1.0,0.0,0.0,3,7,1290,270.0,1985,1985.0,98092,47.3023,-122.069,1660,35160,30.0,1985,2015-02-05
7/17/2014,891000.0,4,2.0,2330,5000,1.5,0.0,0.0,5,7,1720,610.0,1925,1925.0,98117,47.6804,-122.35799999999999,2090,5000,90.0,1925,2014-07-17
3/31/2015,1200000.0,3,2.0,3660,22410,1.0,0.0,3.0,4,9,1830,1830.0,1947,1947.0,98117,47.6972,-122.4,2680,8250,68.0,1947,2015-03-31
2/5/2015,378000.0,4,2.5,2790,4650,2.0,0.0,0.0,3,8,2790,0.0,2004,2004.0,98038,47.3556,-122.02600000000001,2820,4650,11.0,2004,2015-02-05
6/23/2014,299995.0,2,1.0,1060,7200,1.0,0.0,0.0,4,6,1060,0.0,1951,1951.0,98155,47.7463,-122.315,1850,8291,64.0,1951,2014-06-23
10/7/2014,253000.0,3,2.5,2020,6564,1.0,0.0,0.0,3,7,1310,710.0,1994,1994.0,98042,47.3545,-122.15799999999999,1710,5151,21.0,1994,2014-10-07
1/20/2015,350000.0,3,2.25,1580,47916,1.0,0.0,0.0,3,7,1580,0.0,1979,1979.0,98024,47.5583,-121.852,1980,75358,36.0,1979,2015-01-20
3/11/2015,565000.0,4,3.0,2020,4300,1.5,0.0,0.0,3,6,2020,0.0,1900,1900.0,98107,47.6653,-122.37200000000001,1290,3440,115.0,1900,2015-03-11
6/12/2014,315000.0,2,1.0,970,5665,1.0,0.0,0.0,4,6,970,0.0,1908,1908.0,98118,47.5513,-122.273,1490,4429,107.0,1908,2014-06-12
10/22/2014,570000.0,4,3.0,1490,6766,1.5,0.0,1.0,5,7,1490,0.0,1915,1915.0,98136,47.5446,-122.382,1990,6526,100.0,1915,2014-10-22
8/11/2014,971000.0,5,3.5,4390,10140,2.0,0.0,0.0,3,9,3350,1040.0,2005,2005.0,98125,47.7174,-122.28200000000001,2010,8400,10.0,2005,2014-08-11
8/28/2014,915000.0,5,2.5,2750,5589,1.5,0.0,0.0,5,9,1840,910.0,1910,1910.0,98112,47.6364,-122.3,1460,4250,105.0,1910,2014-08-28
1/12/2015,419000.0,4,1.5,2150,23568,1.0,0.0,0.0,4,7,2150,0.0,1950,1950.0,98166,47.4522,-122.355,2150,10125,65.0,1950,2015-01-12
2/9/2015,260000.0,4,1.75,1810,7480,1.0,0.0,0.0,3,7,1230,580.0,1977,1977.0,98023,47.3275,-122.361,1870,9594,38.0,1977,2015-02-09
4/8/2015,1320000.0,3,3.0,2230,12968,2.0,0.0,0.0,3,9,2230,0.0,1990,1990.0,98004,47.6271,-122.197,2260,10160,25.0,1990,2015-04-08
3/6/2015,369950.0,3,1.0,2430,10720,1.0,0.0,0.0,3,7,2430,0.0,1977,1977.0,98045,47.4895,-121.787,1660,11560,38.0,1977,2015-03-06
10/15/2014,1030000.0,3,2.5,3680,13384,2.0,0.0,0.0,3,10,3680,0.0,1994,1994.0,98006,47.5484,-122.119,3600,11306,21.0,1994,2014-10-15
5/6/2015,435000.0,5,1.0,1410,6750,1.5,0.0,0.0,3,6,1410,0.0,1929,1929.0,98118,47.5453,-122.27799999999999,1360,6750,86.0,1929,2015-05-06
3/25/2015,601000.0,3,1.75,1330,6743,1.0,0.0,0.0,3,8,1330,0.0,1958,2002.0,98125,47.7012,-122.286,2600,7350,13.0,2002,2015-03-25
7/16/2014,460500.0,3,1.0,1490,10650,1.0,0.0,0.0,3,7,1150,340.0,1963,1963.0,98033,47.663000000000004,-122.178,1730,9800,52.0,1963,2014-07-16
5/21/2014,720000.0,3,2.5,2020,1159,3.0,0.0,3.0,3,8,2020,0.0,2000,2000.0,98103,47.6617,-122.35600000000001,1920,3600,15.0,2000,2014-05-21
4/21/2015,851000.0,4,2.5,3130,13202,2.0,0.0,0.0,3,10,3130,0.0,1996,1996.0,98075,47.5878,-121.976,2840,10470,19.0,1996,2015-04-21
9/4/2014,550000.0,4,3.0,2670,5000,2.0,0.0,2.0,3,7,2670,0.0,1916,1916.0,98126,47.5784,-122.37700000000001,2300,5000,99.0,1916,2014-09-04
3/23/2015,700000.0,4,1.0,1980,4560,1.5,0.0,0.0,3,7,1980,0.0,1920,1920.0,98103,47.6606,-122.331,1810,3245,95.0,1920,2015-03-23
9/8/2014,323000.0,3,1.75,2100,14850,1.0,0.0,0.0,4,7,2100,0.0,1963,1963.0,98042,47.3622,-122.059,1930,17238,52.0,1963,2014-09-08
9/22/2014,345500.0,3,1.0,1350,8581,1.0,0.0,0.0,5,6,1350,0.0,1944,1944.0,98177,47.7612,-122.36200000000001,2080,8451,71.0,1944,2014-09-22
12/3/2014,378000.0,4,1.5,2140,7920,1.0,0.0,0.0,3,7,1190,950.0,1959,1959.0,98118,47.5491,-122.272,2140,7238,56.0,1959,2014-12-03
11/12/2014,650000.0,4,2.0,2208,5000,3.0,0.0,0.0,5,8,2208,0.0,1917,1917.0,98116,47.5711,-122.383,1760,5000,98.0,1917,2014-11-12
4/13/2015,385000.0,3,2.0,1010,7380,1.0,0.0,0.0,3,7,1010,0.0,1982,1982.0,98074,47.6273,-122.06200000000001,1650,9030,33.0,1982,2015-04-13
9/16/2014,425000.0,2,1.0,970,2970,1.0,0.0,0.0,3,7,970,0.0,1910,1910.0,98102,47.6233,-122.319,1670,3000,105.0,1910,2014-09-16
12/2/2014,210000.0,4,2.0,1520,6174,1.5,0.0,0.0,5,6,1520,0.0,1920,1920.0,98022,47.2105,-121.98899999999999,1390,5407,95.0,1920,2014-12-02
5/28/2014,630000.0,4,2.5,2740,43101,2.0,0.0,0.0,3,9,2740,0.0,1993,1993.0,98077,47.7649,-122.04899999999999,2740,33447,22.0,1993,2014-05-28
7/30/2014,335000.0,3,1.75,1570,7500,1.0,0.0,1.0,3,7,1300,270.0,1953,1953.0,98146,47.4999,-122.368,1590,7660,62.0,1953,2014-07-30
6/25/2014,196500.0,3,1.0,1320,9000,1.0,0.0,0.0,3,7,1320,0.0,1966,1966.0,98001,47.3461,-122.272,1320,9800,49.0,1966,2014-06-25
5/15/2014,582800.0,4,2.75,2550,7636,1.0,0.0,0.0,3,8,1440,1110.0,1986,1986.0,98074,47.6471,-122.06,2290,8223,29.0,1986,2014-05-15
6/23/2014,440000.0,3,1.75,1560,7207,1.0,0.0,0.0,3,7,1250,310.0,1983,1983.0,98034,47.7283,-122.22200000000001,1540,7485,32.0,1983,2014-06-23
8/25/2014,752500.0,4,2.25,2360,8616,2.0,0.0,0.0,4,8,2360,0.0,1974,1974.0,98033,47.6495,-122.198,2360,9337,41.0,1974,2014-08-25
10/28/2014,532500.0,3,1.75,1330,5000,2.0,0.0,0.0,4,7,1210,120.0,1909,1909.0,98116,47.5724,-122.384,1500,4000,106.0,1909,2014-10-28
5/6/2015,265000.0,3,1.0,1070,9000,1.0,0.0,0.0,4,7,1070,0.0,1950,1950.0,98198,47.4061,-122.33,1840,12000,65.0,1950,2015-05-06
2/2/2015,397500.0,3,1.25,1510,13737,1.0,0.0,3.0,4,6,810,700.0,1961,1961.0,98125,47.7289,-122.28299999999999,2560,10202,54.0,1961,2015-02-02
7/24/2014,524250.0,3,2.5,1710,3469,2.0,0.0,0.0,3,8,1710,0.0,1999,1999.0,98029,47.54600000000001,-122.01100000000001,2120,3560,16.0,1999,2014-07-24
5/9/2014,765000.0,4,2.75,2790,10819,2.0,0.0,0.0,3,10,2790,0.0,1996,1996.0,98027,47.5515,-122.08,3080,12603,19.0,1996,2014-05-09
8/6/2014,648000.0,4,2.5,2620,5450,2.0,0.0,0.0,3,9,2620,0.0,2001,2001.0,98074,47.6301,-122.01899999999999,2590,5371,14.0,2001,2014-08-06
8/12/2014,469500.0,5,2.5,2970,24759,1.0,0.0,0.0,4,8,1670,1300.0,1969,1969.0,98031,47.3908,-122.17299999999999,2100,21803,46.0,1969,2014-08-12
3/24/2015,237500.0,3,1.75,1050,7854,1.0,0.0,0.0,4,7,1050,0.0,1975,1975.0,98023,47.3011,-122.369,1360,7668,40.0,1975,2015-03-24
1/21/2015,216000.0,3,1.0,1280,8712,1.0,0.0,0.0,4,7,1280,0.0,1956,1956.0,98003,47.3298,-122.29700000000001,1420,8800,59.0,1956,2015-01-21
3/30/2015,427200.0,3,1.0,1030,8400,1.0,0.0,0.0,4,7,1030,0.0,1963,1963.0,98056,47.5364,-122.17299999999999,1270,8400,52.0,1963,2015-03-30
3/11/2015,280000.0,3,2.25,1900,7800,1.0,0.0,0.0,4,8,1390,510.0,1977,1977.0,98055,47.4545,-122.208,1730,7800,38.0,1977,2015-03-11
4/25/2015,718000.0,5,3.0,3070,9804,1.0,0.0,0.0,4,9,1740,1330.0,1968,1968.0,98006,47.5702,-122.12799999999999,2550,9689,47.0,1968,2015-04-25
3/10/2015,420000.0,2,2.75,1760,4139,2.0,0.0,0.0,3,8,1760,0.0,2010,2010.0,98065,47.5175,-121.87799999999999,1870,3076,5.0,2010,2015-03-10
9/16/2014,379000.0,2,1.0,930,5400,1.0,0.0,0.0,3,7,930,0.0,1952,1952.0,98117,47.6971,-122.37200000000001,1050,5400,63.0,1952,2014-09-16
5/27/2014,326100.0,2,1.0,880,7683,1.0,0.0,0.0,3,6,880,0.0,1942,1942.0,98177,47.7145,-122.361,1370,7695,73.0,1942,2014-05-27
5/29/2014,535000.0,3,2.5,1360,1016,3.0,0.0,0.0,3,7,1310,50.0,2003,2003.0,98115,47.6774,-122.324,1365,1156,12.0,2003,2014-05-29
10/1/2014,283000.0,4,2.75,2130,8560,1.0,0.0,0.0,3,7,1560,570.0,1992,1992.0,98022,47.1949,-122.01,2130,8560,23.0,1992,2014-10-01
8/21/2014,260000.0,3,1.0,1480,7469,1.5,0.0,0.0,3,6,1120,360.0,1940,1940.0,98168,47.5048,-122.301,1460,7379,75.0,1940,2014-08-21
4/13/2015,399000.0,4,1.0,1500,6388,1.5,0.0,0.0,4,7,1500,0.0,1951,1951.0,98126,47.5303,-122.37799999999999,980,5366,64.0,1951,2015-04-13
2/25/2015,484950.0,3,2.25,1670,5004,2.0,0.0,0.0,3,8,1670,0.0,1987,1987.0,98029,47.5688,-122.01700000000001,1850,5276,28.0,1987,2015-02-25
10/13/2014,640000.0,4,1.75,2060,9828,1.0,0.0,0.0,4,8,2060,0.0,1960,1960.0,98005,47.5867,-122.17399999999999,2260,9996,55.0,1960,2014-10-13
3/4/2015,585000.0,4,2.5,2160,8158,1.0,0.0,0.0,4,8,1660,500.0,1952,1952.0,98115,47.6948,-122.32799999999999,1520,7208,63.0,1952,2015-03-04
1/8/2015,645000.0,4,2.0,2780,11583,1.0,0.0,3.0,3,8,1190,1590.0,1955,1955.0,98125,47.7293,-122.28399999999999,2580,10241,60.0,1955,2015-01-08
5/5/2015,253000.0,3,2.0,1490,7651,1.0,0.0,0.0,3,7,1490,0.0,1988,1988.0,98003,47.3211,-122.325,1590,7795,27.0,1988,2015-05-05
7/21/2014,178500.0,2,1.0,740,6460,1.0,0.0,0.0,3,6,740,0.0,1953,1953.0,98146,47.5077,-122.344,1170,6975,62.0,1953,2014-07-21
8/21/2014,291000.0,4,2.5,1860,6325,2.0,0.0,0.0,4,7,1860,0.0,1991,1991.0,98038,47.3492,-122.03,1860,6449,24.0,1991,2014-08-21
9/17/2014,199950.0,2,2.75,1590,20917,1.5,0.0,0.0,3,5,1590,0.0,1920,1920.0,98001,47.2786,-122.25,1310,6000,95.0,1920,2014-09-17
8/4/2014,553500.0,2,1.0,850,2340,1.0,0.0,0.0,3,7,850,0.0,1922,1922.0,98105,47.6707,-122.32799999999999,1300,3000,93.0,1922,2014-08-04
4/15/2015,189950.0,2,1.0,1030,4188,1.0,0.0,0.0,3,8,1030,0.0,1981,1981.0,98038,47.3738,-122.057,1450,3376,34.0,1981,2015-04-15
9/24/2014,289000.0,3,2.0,1850,9550,1.0,0.0,0.0,3,8,1850,0.0,1988,1988.0,98001,47.3225,-122.273,2250,9550,27.0,1988,2014-09-24
4/27/2015,700000.0,4,2.0,1830,4590,2.0,0.0,0.0,3,8,1830,0.0,1908,1908.0,98105,47.6593,-122.32700000000001,1650,4590,107.0,1908,2015-04-27
10/22/2014,270000.0,3,2.0,1560,8853,1.0,0.0,0.0,3,7,1560,0.0,1967,1967.0,98058,47.4312,-122.171,1610,8750,48.0,1967,2014-10-22
5/8/2014,258000.0,4,1.75,1730,8320,1.0,0.0,0.0,3,7,1230,500.0,1977,1977.0,98023,47.327,-122.361,1840,9800,38.0,1977,2014-05-08
6/14/2014,530000.0,3,2.5,1930,7214,2.0,0.0,0.0,3,8,1930,0.0,2005,2005.0,98125,47.7191,-122.309,1930,7266,10.0,2005,2014-06-14
12/18/2014,245000.0,3,2.25,1422,3677,2.0,0.0,0.0,3,7,1422,0.0,2012,2012.0,98092,47.3204,-122.178,1677,3677,3.0,2012,2014-12-18
4/22/2015,563000.0,3,2.0,1380,5000,1.5,0.0,0.0,4,7,1380,0.0,1917,1917.0,98117,47.6807,-122.369,1350,5000,98.0,1917,2015-04-22
11/19/2014,515000.0,3,2.5,2430,4203,2.0,0.0,0.0,3,8,2430,0.0,2001,2001.0,98065,47.5346,-121.875,2500,4798,14.0,2001,2014-11-19
6/17/2014,325000.0,4,2.5,2610,7091,2.0,0.0,0.0,3,9,2610,0.0,1987,1987.0,98023,47.3017,-122.34899999999999,2610,7773,28.0,1987,2014-06-17
4/2/2015,540000.0,3,2.25,2000,217800,2.0,0.0,0.0,3,8,2000,0.0,1996,1996.0,98024,47.5599,-121.911,2220,217800,19.0,1996,2015-04-02
12/10/2014,280300.0,2,1.0,920,5000,1.0,0.0,0.0,4,6,490,430.0,1949,1949.0,98103,47.7008,-122.338,1500,5000,66.0,1949,2014-12-10
5/9/2014,460000.0,4,1.75,1750,5500,1.5,0.0,0.0,5,7,1050,700.0,1926,1926.0,98117,47.6802,-122.38799999999999,1640,5500,89.0,1926,2014-05-09
12/12/2014,475000.0,3,1.75,2020,8970,1.0,0.0,0.0,4,7,1180,840.0,1981,1981.0,98072,47.7571,-122.145,2140,8008,34.0,1981,2014-12-12
6/12/2014,900000.0,4,2.25,2460,44431,1.0,0.0,0.0,4,9,2460,0.0,1957,1957.0,98007,47.6042,-122.147,2830,44431,58.0,1957,2014-06-12
12/30/2014,538200.0,4,3.0,1780,7260,1.0,0.0,0.0,4,8,1780,0.0,1964,1964.0,98008,47.626999999999995,-122.11399999999999,1810,7920,51.0,1964,2014-12-30
9/9/2014,429000.0,2,1.0,1080,3600,1.0,0.0,0.0,3,7,1080,0.0,1922,1922.0,98122,47.6078,-122.291,2230,4500,93.0,1922,2014-09-09
7/25/2014,164808.0,3,1.0,1250,5411,1.0,0.0,0.0,3,7,1250,0.0,1980,1980.0,98178,47.5064,-122.265,1490,6320,35.0,1980,2014-07-25
1/26/2015,520000.0,4,2.25,1870,7700,2.0,0.0,0.0,3,7,1870,0.0,1977,1977.0,98052,47.6937,-122.12700000000001,1970,7700,38.0,1977,2015-01-26
6/18/2014,475000.0,3,1.75,1700,8432,1.0,0.0,0.0,3,8,1230,470.0,1977,1977.0,98125,47.7221,-122.31700000000001,1800,7842,38.0,1977,2014-06-18
9/26/2014,283000.0,4,1.5,1480,47045,1.0,0.0,0.0,5,6,1480,0.0,1942,1942.0,98168,47.4809,-122.3,1530,11000,73.0,1942,2014-09-26
3/31/2015,321500.0,4,2.5,1930,6228,2.0,0.0,0.0,3,8,1930,0.0,2000,2000.0,98030,47.3572,-122.191,1930,6168,15.0,2000,2015-03-31
7/29/2014,840000.0,4,2.75,3130,21810,2.0,0.0,0.0,4,10,3130,0.0,1993,1993.0,98077,47.7083,-122.073,3330,21810,22.0,1993,2014-07-29
4/14/2015,287000.0,3,2.25,1370,6000,2.0,0.0,0.0,4,7,1370,0.0,1992,1992.0,98038,47.3484,-122.03299999999999,1370,6200,23.0,1992,2015-04-14
6/5/2014,375000.0,3,1.75,960,8106,1.0,0.0,0.0,3,7,960,0.0,1962,1962.0,98052,47.6737,-122.156,1650,8035,53.0,1962,2014-06-05
8/25/2014,349500.0,3,1.75,1260,7128,1.0,0.0,0.0,4,7,1260,0.0,1969,1969.0,98034,47.7263,-122.205,1330,7326,46.0,1969,2014-08-25
8/14/2014,446450.0,3,1.5,1480,7749,1.0,0.0,0.0,5,7,1480,0.0,1960,1960.0,98126,47.5144,-122.37899999999999,1140,5320,55.0,1960,2014-08-14
6/10/2014,315000.0,4,2.5,1930,9643,2.0,0.0,0.0,4,7,1930,0.0,1992,1992.0,98031,47.4065,-122.18,1930,7525,23.0,1992,2014-06-10
5/20/2014,271310.0,2,1.0,870,5340,1.5,0.0,0.0,2,6,870,0.0,1906,1906.0,98144,47.5849,-122.302,1190,4440,109.0,1906,2014-05-20
1/22/2015,315000.0,4,1.0,1300,8400,1.5,0.0,0.0,4,7,1300,0.0,1953,1953.0,98133,47.7612,-122.33200000000001,1330,8400,62.0,1953,2015-01-22
5/15/2014,245000.0,3,1.75,1490,6930,1.0,0.0,0.0,4,7,1490,0.0,1990,1990.0,98030,47.3682,-122.179,1880,6861,25.0,1990,2014-05-15
3/5/2015,543115.0,2,1.0,1380,5484,1.0,0.0,0.0,3,8,1030,350.0,1947,1947.0,98199,47.6382,-122.399,1380,5347,68.0,1947,2015-03-05
10/20/2014,900000.0,4,2.0,1190,8190,1.5,0.0,0.0,3,7,1190,0.0,1945,1945.0,98117,47.6908,-122.397,1190,1567,70.0,1945,2014-10-20
4/17/2015,2450000.0,4,4.25,4250,6552,2.0,0.0,3.0,4,10,2870,1380.0,2008,2008.0,98144,47.5747,-122.28299999999999,3640,8841,7.0,2008,2015-04-17
4/29/2015,554000.0,2,2.0,1920,6045,1.0,0.0,0.0,3,8,1920,0.0,2003,2003.0,98053,47.7107,-122.031,1670,5200,12.0,2003,2015-04-29
7/17/2014,249900.0,3,1.75,2080,12522,1.0,0.0,0.0,5,6,2080,0.0,1950,1950.0,98001,47.266999999999996,-122.25,1690,11200,65.0,1950,2014-07-17
8/20/2014,768000.0,3,2.5,3220,54160,2.0,0.0,2.0,4,9,2690,530.0,1981,1981.0,98006,47.5468,-122.109,3460,44374,34.0,1981,2014-08-20
5/23/2014,980000.0,4,3.0,3680,5854,1.0,0.0,3.0,3,10,2060,1620.0,1967,1967.0,98199,47.6327,-122.395,3140,5000,48.0,1967,2014-05-23
4/20/2015,395000.0,5,2.5,2070,9600,1.0,0.0,0.0,3,7,1270,800.0,1962,1962.0,98146,47.4997,-122.36399999999999,1950,7800,53.0,1962,2015-04-20
4/13/2015,415000.0,3,1.75,1480,2200,2.0,0.0,0.0,3,7,1480,0.0,1995,1995.0,98103,47.6969,-122.35,1360,2190,20.0,1995,2015-04-13
2/20/2015,380000.0,4,2.5,2000,6921,2.0,0.0,0.0,3,8,2000,0.0,2003,2003.0,98038,47.3559,-122.014,2430,6339,12.0,2003,2015-02-20
2/26/2015,566000.0,3,2.5,1560,5259,2.0,0.0,0.0,3,8,1560,0.0,1999,1999.0,98075,47.5985,-122.016,2170,5461,16.0,1999,2015-02-26
3/16/2015,218500.0,2,1.0,1600,8961,1.0,0.0,0.0,4,7,1390,210.0,1949,1949.0,98002,47.3098,-122.21,1502,6798,66.0,1949,2015-03-16
5/2/2014,550000.0,4,2.5,1940,10500,1.0,0.0,0.0,4,7,1140,800.0,1976,1976.0,98052,47.683,-122.11399999999999,2200,10500,39.0,1976,2014-05-02
7/2/2014,512031.0,3,1.75,1540,3000,1.0,0.0,2.0,3,7,770,770.0,1920,1920.0,98117,47.6769,-122.36,1420,4200,95.0,1920,2014-07-02
3/17/2015,197500.0,2,1.0,820,8860,1.0,0.0,0.0,3,6,820,0.0,1950,1950.0,98055,47.452,-122.19,1660,15375,65.0,1950,2015-03-17
7/15/2014,470000.0,3,2.25,1780,8784,1.0,0.0,0.0,3,7,1230,550.0,1977,1977.0,98033,47.701,-122.17200000000001,1780,7704,38.0,1977,2014-07-15
3/13/2015,590000.0,3,1.75,1560,242629,1.0,0.0,0.0,3,7,1560,0.0,1981,1981.0,98053,47.6493,-121.956,2320,220654,34.0,1981,2015-03-13
3/18/2015,465000.0,4,2.25,2210,8862,1.0,0.0,0.0,4,8,1270,940.0,1977,1977.0,98011,47.7725,-122.198,2030,8862,38.0,1977,2015-03-18
9/15/2014,499000.0,2,1.75,2040,114562,1.0,0.0,0.0,4,7,2040,0.0,1968,1968.0,98027,47.4985,-122.09200000000001,1850,94960,47.0,1968,2014-09-15
8/25/2014,515000.0,3,2.25,1920,11500,1.0,0.0,0.0,3,8,1920,0.0,1972,2000.0,98006,47.5498,-122.18799999999999,2260,8866,15.0,2000,2014-08-25
11/6/2014,716500.0,3,1.75,1930,5000,1.0,0.0,0.0,3,9,1230,700.0,1936,1936.0,98105,47.6582,-122.27799999999999,2300,6000,79.0,1936,2014-11-06
5/17/2014,410000.0,3,2.0,1700,4250,1.0,0.0,0.0,3,6,890,810.0,1944,1944.0,98199,47.6542,-122.385,1440,4250,71.0,1944,2014-05-17
10/22/2014,850000.0,4,3.25,3450,6500,2.0,0.0,0.0,3,8,2450,1000.0,1994,1994.0,98136,47.5437,-122.38799999999999,1750,6500,21.0,1994,2014-10-22
5/22/2014,1050000.0,4,3.25,3440,35021,2.0,0.0,0.0,3,10,3440,0.0,1983,1983.0,98033,47.6476,-122.184,3440,35021,32.0,1983,2014-05-22
6/9/2014,648000.0,4,2.5,2380,13435,2.0,0.0,0.0,3,10,2380,0.0,1992,1992.0,98075,47.5833,-122.02799999999999,2730,9677,23.0,1992,2014-06-09
6/5/2014,620000.0,4,2.25,2400,5350,1.5,0.0,0.0,4,7,1460,940.0,1929,1929.0,98117,47.6763,-122.37,1250,4880,86.0,1929,2014-06-05
2/2/2015,935000.0,4,4.5,5670,84267,2.0,0.0,2.0,3,11,5670,0.0,2008,2008.0,98010,47.323,-122.044,4100,83729,7.0,2008,2015-02-02
3/19/2015,379000.0,3,1.0,1140,10320,1.0,0.0,0.0,4,7,1140,0.0,1963,1963.0,98034,47.7168,-122.196,1140,10412,52.0,1963,2015-03-19
7/16/2014,699000.0,3,1.75,1670,5375,1.0,0.0,0.0,3,7,1270,400.0,1952,1952.0,98199,47.6416,-122.397,1460,6125,63.0,1952,2014-07-16
12/30/2014,528000.0,4,2.25,1910,8005,1.0,0.0,0.0,3,8,1280,630.0,1960,1960.0,98125,47.7259,-122.29799999999999,1860,8010,55.0,1960,2014-12-30
4/26/2015,425000.0,3,1.75,1560,9452,1.0,0.0,0.0,4,8,1560,0.0,1974,1974.0,98056,47.5197,-122.18,2200,9985,41.0,1974,2015-04-26
6/23/2014,249500.0,2,1.75,1500,8645,1.0,0.0,0.0,4,7,1500,0.0,1963,1963.0,98042,47.3643,-122.115,1220,8645,52.0,1963,2014-06-23
7/16/2014,1040000.0,5,3.25,4475,6642,2.0,0.0,0.0,3,9,4475,0.0,2014,2014.0,98053,47.6849,-122.01799999999999,3720,6633,1.0,2014,2014-07-16
8/13/2014,790000.0,4,2.75,2840,11900,1.0,0.0,3.0,4,9,1640,1200.0,1961,1961.0,98136,47.5271,-122.38600000000001,2790,10070,54.0,1961,2014-08-13
8/18/2014,399950.0,3,1.0,1020,18050,1.0,0.0,0.0,3,7,1020,0.0,1969,1969.0,98027,47.5254,-122.04299999999999,1750,11640,46.0,1969,2014-08-18
10/21/2014,275000.0,3,1.5,1410,9000,1.0,0.0,0.0,3,7,1410,0.0,1953,1953.0,98133,47.7635,-122.35,1910,7214,62.0,1953,2014-10-21
1/23/2015,550000.0,3,1.0,1520,2500,1.5,0.0,0.0,3,8,1520,0.0,1912,1912.0,98109,47.6347,-122.352,1880,3600,103.0,1912,2015-01-23
11/5/2014,140000.0,1,1.0,730,6890,1.0,0.0,0.0,4,4,730,0.0,1926,1926.0,98055,47.467,-122.215,1790,7969,89.0,1926,2014-11-05
7/25/2014,250000.0,3,1.0,1190,6250,1.0,0.0,0.0,3,7,990,200.0,1954,1954.0,98108,47.5658,-122.292,1760,6434,61.0,1954,2014-07-25
9/3/2014,318000.0,3,2.25,1410,8909,2.0,0.0,2.0,3,7,1410,0.0,1988,1988.0,98198,47.3983,-122.31,2050,8909,27.0,1988,2014-09-03
7/10/2014,505000.0,2,1.0,1240,57000,1.0,0.0,0.0,3,7,1240,0.0,1962,1962.0,98075,47.597,-122.059,3050,25545,53.0,1962,2014-07-10
4/17/2015,470500.0,5,2.5,2500,9248,1.0,0.0,0.0,3,8,1300,1200.0,1966,1966.0,98006,47.5415,-122.18,2090,8568,49.0,1966,2015-04-17
5/27/2014,360000.0,3,1.0,1050,9206,1.5,0.0,0.0,3,7,1050,0.0,1954,1954.0,98125,47.7071,-122.301,1380,6384,61.0,1954,2014-05-27
3/19/2015,1240000.0,4,2.75,2680,8500,1.0,0.0,4.0,4,9,1480,1200.0,1962,1962.0,98006,47.5634,-122.156,2940,8650,53.0,1962,2015-03-19
4/10/2015,986000.0,3,2.5,2380,16080,1.0,0.0,2.0,4,9,1340,1040.0,1964,1964.0,98136,47.5262,-122.38600000000001,2560,10070,51.0,1964,2015-04-10
2/5/2015,515000.0,2,1.0,1060,4228,1.0,0.0,0.0,3,7,860,0.0,1906,1906.0,98112,47.6231,-122.29299999999999,1060,4187,109.0,1906,2015-02-05
1/14/2015,320000.0,3,1.75,2300,41900,1.0,0.0,0.0,4,8,1310,990.0,1939,1939.0,98168,47.477,-122.292,1160,8547,76.0,1939,2015-01-14
2/2/2015,310000.0,4,3.0,2010,7426,1.0,0.0,0.0,5,7,1090,920.0,1951,1951.0,98178,47.5042,-122.265,1470,7426,64.0,1951,2015-02-02
5/30/2014,356700.0,2,1.0,1090,5000,1.0,0.0,0.0,4,7,730,360.0,1942,1942.0,98126,47.5258,-122.37799999999999,990,5250,73.0,1942,2014-05-30
4/22/2015,775000.0,4,1.75,2320,5595,1.0,0.0,0.0,3,7,1510,810.0,1956,1956.0,98199,47.6397,-122.38799999999999,1840,5596,59.0,1956,2015-04-22
4/21/2015,325000.0,3,1.0,1040,7541,1.0,0.0,0.0,3,6,1040,0.0,1951,1951.0,98133,47.7565,-122.339,1140,6100,64.0,1951,2015-04-21
10/2/2014,208000.0,4,2.75,1810,8677,1.5,0.0,0.0,3,7,1810,0.0,1962,1962.0,98198,47.3668,-122.31,1740,8677,53.0,1962,2014-10-02
8/27/2014,825000.0,2,1.0,1150,12775,1.0,1.0,4.0,4,6,1150,0.0,1908,1908.0,98178,47.501999999999995,-122.22200000000001,2440,11852,107.0,1908,2014-08-27
7/16/2014,515000.0,3,2.5,2360,11254,1.0,0.0,2.0,3,9,2360,0.0,1990,1990.0,98003,47.3356,-122.333,2390,11254,25.0,1990,2014-07-16
1/27/2015,490000.0,3,1.5,1970,3400,1.5,0.0,0.0,4,8,1420,550.0,1929,1929.0,98122,47.6163,-122.292,1940,4000,86.0,1929,2015-01-27
5/20/2014,675000.0,4,3.0,2690,28300,1.0,0.0,0.0,3,8,2690,0.0,1954,1999.0,98166,47.4458,-122.34299999999999,2820,27100,16.0,1999,2014-05-20
7/17/2014,360000.0,4,2.5,2080,4080,1.0,0.0,0.0,5,7,1040,1040.0,1962,1962.0,98144,47.571999999999996,-122.29,1340,4080,53.0,1962,2014-07-17
4/20/2015,550000.0,4,2.5,2080,4080,1.0,0.0,0.0,5,7,1040,1040.0,1962,1962.0,98144,47.571999999999996,-122.29,1340,4080,53.0,1962,2015-04-20
7/25/2014,225000.0,3,1.5,1370,9000,1.0,0.0,0.0,3,7,1370,0.0,1962,1962.0,98168,47.4973,-122.32799999999999,1400,9075,53.0,1962,2014-07-25
3/17/2015,500000.0,3,2.75,3410,9360,1.5,0.0,0.0,4,8,3410,0.0,1967,1967.0,98058,47.4497,-122.147,2260,10128,48.0,1967,2015-03-17
4/27/2015,385000.0,4,2.0,1850,11700,1.0,0.0,0.0,4,8,1850,0.0,1969,1969.0,98059,47.4702,-122.12,2110,11700,46.0,1969,2015-04-27
6/17/2014,837700.0,5,2.75,3010,12611,2.0,0.0,0.0,3,10,3010,0.0,1994,1994.0,98052,47.69600000000001,-122.102,2890,9456,21.0,1994,2014-06-17
2/10/2015,448000.0,3,2.25,1530,3056,2.0,0.0,0.0,3,7,1530,0.0,2003,2003.0,98053,47.6817,-122.035,1560,3064,12.0,2003,2015-02-10
5/7/2015,730000.0,5,1.75,2690,21357,1.0,0.0,0.0,4,7,1420,1270.0,1952,1952.0,98004,47.5831,-122.191,2600,17539,63.0,1952,2015-05-07
7/14/2014,575000.0,4,1.5,2810,7140,1.0,0.0,2.0,3,8,1490,1320.0,1954,1954.0,98136,47.5252,-122.382,2240,6825,61.0,1954,2014-07-14
11/18/2014,430000.0,3,1.75,1810,7300,1.0,0.0,0.0,4,7,1240,570.0,1976,1976.0,98034,47.7299,-122.19200000000001,1460,7560,39.0,1976,2014-11-18
1/14/2015,435000.0,3,2.5,1560,3987,2.0,0.0,0.0,3,7,1560,0.0,2002,2002.0,98053,47.687,-122.04299999999999,1600,3152,13.0,2002,2015-01-14
12/19/2014,241000.0,3,1.0,1010,9611,1.0,0.0,0.0,4,6,1010,0.0,1973,1973.0,98092,47.3006,-122.066,1200,9611,42.0,1973,2014-12-19
5/13/2015,453500.0,2,1.75,1000,1760,1.0,0.0,0.0,4,6,600,400.0,1924,1924.0,98109,47.6261,-122.355,2120,2802,91.0,1924,2015-05-13
4/6/2015,285000.0,2,1.5,990,1380,3.0,0.0,0.0,3,7,990,0.0,2001,2001.0,98133,47.7218,-122.35600000000001,1050,1380,14.0,2001,2015-04-06
5/28/2014,151000.0,2,1.0,720,4222,1.0,0.0,0.0,4,5,720,0.0,1942,1942.0,98056,47.4965,-122.186,860,4785,73.0,1942,2014-05-28
11/10/2014,1570000.0,5,4.5,6070,14731,2.0,0.0,0.0,3,11,6070,0.0,2004,2004.0,98059,47.5306,-122.134,4750,13404,11.0,2004,2014-11-10
11/5/2014,631000.0,5,2.0,2270,2400,2.0,0.0,0.0,3,7,2270,0.0,1905,1905.0,98122,47.6051,-122.319,1320,2400,110.0,1905,2014-11-05
6/2/2014,285000.0,2,2.5,1380,1073,2.0,0.0,0.0,3,7,1140,240.0,2011,2011.0,98126,47.5462,-122.369,1580,2036,4.0,2011,2014-06-02
2/20/2015,195000.0,3,1.0,1260,8378,1.0,0.0,0.0,4,6,840,420.0,1959,1977.0,98023,47.3274,-122.348,1140,8496,38.0,1977,2015-02-20
4/25/2015,817500.0,4,2.5,2910,35679,2.0,0.0,0.0,4,9,2910,0.0,1987,1987.0,98075,47.5859,-121.991,2720,36728,28.0,1987,2015-04-25
1/9/2015,550000.0,3,2.0,1810,12825,1.0,0.0,0.0,4,7,1810,0.0,1960,1960.0,98007,47.5953,-122.14,1490,10800,55.0,1960,2015-01-09
7/3/2014,1130000.0,4,2.5,3160,8281,2.0,0.0,0.0,4,9,3160,0.0,1995,1995.0,98033,47.6699,-122.195,3000,8281,20.0,1995,2014-07-03
12/30/2014,609850.0,2,2.75,1910,1369,3.0,0.0,0.0,3,9,1910,0.0,2002,2002.0,98119,47.6544,-122.37299999999999,1910,1879,13.0,2002,2014-12-30
1/6/2015,200000.0,3,1.0,1230,4380,1.0,0.0,0.0,3,6,1230,0.0,1947,1947.0,98106,47.5352,-122.361,1525,6026,68.0,1947,2015-01-06
3/6/2015,367000.0,4,2.5,2960,6219,2.0,0.0,0.0,3,9,2960,0.0,2006,2006.0,98038,47.3603,-122.037,2960,5361,9.0,2006,2015-03-06
8/25/2014,285167.0,3,2.25,2200,8375,2.0,0.0,0.0,3,8,2200,0.0,1988,1988.0,98092,47.2626,-122.21799999999999,2200,10002,27.0,1988,2014-08-25
4/2/2015,275000.0,2,1.5,1270,32175,1.0,0.0,0.0,4,7,1270,0.0,1947,1947.0,98003,47.3347,-122.304,1270,10200,68.0,1947,2015-04-02
3/24/2015,350900.0,4,2.5,2540,12843,2.0,0.0,0.0,3,9,2540,0.0,1992,1992.0,98030,47.3866,-122.169,2410,9383,23.0,1992,2015-03-24
6/20/2014,660000.0,4,3.25,3030,9273,2.0,0.0,0.0,5,8,3030,0.0,1988,1988.0,98029,47.5747,-122.014,2360,7632,27.0,1988,2014-06-20
8/19/2014,525000.0,3,1.75,1520,8835,1.0,0.0,0.0,4,7,1520,0.0,1957,1957.0,98008,47.6054,-122.118,1760,8580,58.0,1957,2014-08-19
2/6/2015,262000.0,4,2.5,1560,7800,2.0,0.0,0.0,3,7,1560,0.0,1997,1997.0,98168,47.513999999999996,-122.316,1160,7800,18.0,1997,2015-02-06
6/23/2014,690000.0,2,1.0,970,4560,1.0,0.0,0.0,4,7,970,0.0,1907,1907.0,98103,47.6561,-122.33200000000001,1500,4560,108.0,1907,2014-06-23
3/24/2015,624000.0,5,3.75,3570,14648,2.0,0.0,0.0,3,9,3570,0.0,2005,2005.0,98019,47.7377,-121.97399999999999,3160,7882,10.0,2005,2015-03-24
5/6/2014,353000.0,3,1.0,1350,7740,1.0,0.0,0.0,4,6,860,490.0,1947,1947.0,98125,47.7098,-122.291,1130,7740,68.0,1947,2014-05-06
3/11/2015,552500.0,4,3.5,3710,10400,2.0,0.0,0.0,3,8,2290,1420.0,2002,2002.0,98056,47.5041,-122.186,1720,4276,13.0,2002,2015-03-11
5/9/2014,224500.0,4,1.0,1430,8355,1.5,0.0,0.0,4,7,1430,0.0,1983,1983.0,98092,47.3178,-122.17399999999999,1550,7938,32.0,1983,2014-05-09
4/27/2015,239000.0,3,1.0,940,8571,1.0,0.0,0.0,3,6,940,0.0,1950,1950.0,98146,47.5006,-122.336,1100,8573,65.0,1950,2015-04-27
7/11/2014,975000.0,5,4.5,4300,12250,2.0,0.0,0.0,3,10,4300,0.0,2004,2004.0,98029,47.5557,-122.027,3950,12250,11.0,2004,2014-07-11
6/25/2014,1200000.0,4,1.75,3990,13470,2.0,0.0,0.0,3,11,3990,0.0,2006,2006.0,98059,47.5305,-122.131,5790,13709,9.0,2006,2014-06-25
3/25/2015,505000.0,3,1.0,1380,4000,1.5,0.0,0.0,3,7,1380,0.0,1910,1910.0,98112,47.6261,-122.296,1690,4000,105.0,1910,2015-03-25
5/15/2014,302000.0,4,1.75,2020,7865,1.0,0.0,0.0,4,7,1010,1010.0,1963,1963.0,98059,47.5008,-122.162,1650,7865,52.0,1963,2014-05-15
9/22/2014,170000.0,3,1.0,1480,5670,1.0,0.0,0.0,3,6,780,700.0,1944,1944.0,98106,47.5175,-122.36,760,5040,71.0,1944,2014-09-22
7/7/2014,195000.0,2,1.0,1190,27007,1.0,0.0,0.0,4,5,1190,0.0,1910,1910.0,98027,47.523999999999994,-122.04,1730,12632,105.0,1910,2014-07-07
9/9/2014,272000.0,5,1.5,2550,6300,1.0,0.0,0.0,4,7,1560,990.0,1959,1959.0,98056,47.5014,-122.17200000000001,1380,6300,56.0,1959,2014-09-09
2/13/2015,369000.0,5,1.5,2550,6300,1.0,0.0,0.0,4,7,1560,990.0,1959,1959.0,98056,47.5014,-122.17200000000001,1380,6300,56.0,1959,2015-02-13
1/14/2015,332500.0,3,1.5,1500,6332,1.0,0.0,0.0,3,7,1500,0.0,1953,1953.0,98125,47.7274,-122.31200000000001,1500,6337,62.0,1953,2015-01-14
5/6/2015,515000.0,3,2.5,3000,8250,1.0,0.0,0.0,4,8,1760,1240.0,1963,1963.0,98008,47.6191,-122.11200000000001,2040,8250,52.0,1963,2015-05-06
6/5/2014,269000.0,3,1.0,1690,4250,1.0,0.0,0.0,3,7,1020,670.0,1967,1967.0,98178,47.4945,-122.258,1820,8865,48.0,1967,2014-06-05
7/30/2014,1280000.0,4,4.0,4390,17832,1.0,0.0,0.0,4,11,2430,1960.0,1994,1994.0,98059,47.5283,-122.14299999999999,3090,12369,21.0,1994,2014-07-30
2/6/2015,303000.0,3,2.5,1560,4100,2.0,0.0,0.0,3,7,1560,0.0,1985,1985.0,98055,47.4733,-122.189,1660,4400,30.0,1985,2015-02-06
1/5/2015,420000.0,7,3.0,2940,8624,1.0,0.0,0.0,3,8,1690,1250.0,1977,1977.0,98155,47.7555,-122.307,1850,8031,38.0,1977,2015-01-05
11/10/2014,400000.0,3,1.0,1130,4100,1.0,0.0,0.0,3,7,990,140.0,1941,1941.0,98117,47.6856,-122.385,1800,4100,74.0,1941,2014-11-10
2/4/2015,225000.0,3,1.0,1020,8437,1.0,0.0,0.0,5,6,1020,0.0,1987,1987.0,98022,47.2093,-122.0,1420,8500,28.0,1987,2015-02-04
9/16/2014,219000.0,2,2.0,1310,2550,2.0,0.0,0.0,3,6,1310,0.0,2004,2004.0,98038,47.3496,-122.022,1310,2550,11.0,2004,2014-09-16
12/31/2014,605000.0,3,2.5,2570,9487,2.0,0.0,3.0,3,9,2570,0.0,1989,1989.0,98011,47.7408,-122.21600000000001,2490,9898,26.0,1989,2014-12-31
10/14/2014,625000.0,4,2.0,2020,6867,1.0,0.0,0.0,5,8,1010,1010.0,1942,1942.0,98115,47.7,-122.292,1250,6842,73.0,1942,2014-10-14
2/24/2015,380000.0,5,2.0,1680,3240,1.0,0.0,0.0,3,5,840,840.0,1906,1906.0,98144,47.5965,-122.311,1380,1260,109.0,1906,2015-02-24
4/24/2015,620000.0,4,2.0,1770,7700,1.5,0.0,0.0,4,7,1770,0.0,1962,1962.0,98007,47.5916,-122.146,1710,7700,53.0,1962,2015-04-24
6/27/2014,687500.0,4,2.75,3190,10970,2.0,0.0,0.0,3,10,3190,0.0,1994,1994.0,98075,47.5862,-122.029,2850,8416,21.0,1994,2014-06-27
7/23/2014,225500.0,4,2.0,1440,7950,1.0,0.0,0.0,5,6,1440,0.0,1962,1962.0,98058,47.4517,-122.08200000000001,1530,20037,53.0,1962,2014-07-23
12/15/2014,252500.0,3,2.0,1150,6000,1.0,0.0,0.0,5,7,1150,0.0,1956,1956.0,98178,47.49800000000001,-122.26299999999999,1980,6360,59.0,1956,2014-12-15
10/29/2014,510000.0,3,2.5,1860,3658,2.0,0.0,0.0,3,8,1860,0.0,1994,1994.0,98029,47.5703,-122.00399999999999,1840,3739,21.0,1994,2014-10-29
5/7/2014,510000.0,4,2.5,2430,5203,2.0,0.0,0.0,3,8,2430,0.0,2003,2003.0,98155,47.7402,-122.31700000000001,2260,7474,12.0,2003,2014-05-07
8/8/2014,725000.0,3,2.5,1940,4000,1.5,0.0,0.0,5,7,1940,0.0,1906,1906.0,98109,47.6372,-122.352,1440,4000,109.0,1906,2014-08-08
3/12/2015,492000.0,2,1.0,880,2970,1.0,0.0,0.0,3,7,880,0.0,1927,1927.0,98103,47.6868,-122.34899999999999,1370,3060,88.0,1927,2015-03-12
3/11/2015,425000.0,4,2.5,1930,14196,1.0,0.0,0.0,4,7,1330,600.0,1977,1977.0,98072,47.7407,-122.09700000000001,1470,12852,38.0,1977,2015-03-11
4/21/2015,1960000.0,4,2.75,3120,7898,1.0,1.0,4.0,4,8,1560,1560.0,1963,1963.0,98034,47.7165,-122.259,2630,13868,52.0,1963,2015-04-21
3/9/2015,298900.0,3,2.5,1830,6162,2.0,0.0,0.0,3,8,1830,0.0,1994,1994.0,98092,47.3291,-122.17,1860,7017,21.0,1994,2015-03-09
4/6/2015,699000.0,4,2.5,3230,40319,2.0,0.0,0.0,4,10,3230,0.0,1987,1987.0,98027,47.4856,-122.069,2990,40234,28.0,1987,2015-04-06
7/2/2014,310000.0,2,1.0,700,3000,1.0,0.0,0.0,4,6,700,0.0,1918,1918.0,98103,47.6846,-122.346,1560,4500,97.0,1918,2014-07-02
12/22/2014,350000.0,3,1.75,1010,8580,1.0,0.0,0.0,3,7,1010,0.0,1961,1961.0,98033,47.6703,-122.17399999999999,1500,8580,54.0,1961,2014-12-22
12/29/2014,790000.0,4,1.75,2460,10061,1.0,1.0,4.0,3,7,1410,1050.0,1961,1961.0,98178,47.5105,-122.238,2300,10061,54.0,1961,2014-12-29
7/29/2014,305000.0,4,2.5,2230,5000,2.0,0.0,0.0,3,8,2230,0.0,2003,2003.0,98031,47.3919,-122.184,2230,6137,12.0,2003,2014-07-29
10/2/2014,315000.0,3,2.5,1570,2865,2.0,0.0,0.0,3,7,1570,0.0,2003,2003.0,98118,47.5412,-122.288,1610,2582,12.0,2003,2014-10-02
8/12/2014,267500.0,5,3.5,2390,6600,2.0,0.0,0.0,5,7,2390,0.0,1977,1977.0,98042,47.3737,-122.115,1140,6600,38.0,1977,2014-08-12
8/19/2014,1750000.0,4,3.25,3460,7749,2.0,0.0,1.0,3,10,3020,440.0,1950,1998.0,98115,47.6849,-122.273,3030,8680,17.0,1998,2014-08-19
8/13/2014,435000.0,6,3.5,2400,8620,2.0,0.0,0.0,3,8,1640,760.0,1987,1987.0,98034,47.7152,-122.162,1940,7350,28.0,1987,2014-08-13
9/5/2014,482500.0,6,4.5,2940,7500,1.5,0.0,0.0,4,8,2940,0.0,1966,1966.0,98034,47.7208,-122.182,2010,7500,49.0,1966,2014-09-05
10/20/2014,5110000.0,5,5.25,8010,45517,2.0,1.0,4.0,3,12,5990,2020.0,1999,1999.0,98033,47.6767,-122.211,3430,26788,16.0,1999,2014-10-20
8/28/2014,439995.0,3,1.75,1570,8400,1.0,0.0,0.0,4,7,1570,0.0,1959,1959.0,98133,47.76,-122.34,1860,8639,56.0,1959,2014-08-28
5/8/2015,460000.0,3,3.0,1520,7500,1.0,0.0,0.0,3,7,1180,340.0,1967,1967.0,98034,47.7276,-122.181,2080,8000,48.0,1967,2015-05-08
7/29/2014,194000.0,3,1.0,1070,6440,1.0,0.0,0.0,4,7,1070,0.0,1971,1971.0,98023,47.3186,-122.37299999999999,1190,6532,44.0,1971,2014-07-29
10/9/2014,290000.0,2,0.75,440,8313,1.0,1.0,3.0,4,5,440,0.0,1943,1943.0,98070,47.4339,-122.512,880,26289,72.0,1943,2014-10-09
7/15/2014,274700.0,4,2.0,2440,9600,1.0,0.0,0.0,5,7,1220,1220.0,1963,1963.0,98031,47.4142,-122.179,1370,9600,52.0,1963,2014-07-15
3/17/2015,900000.0,4,2.5,2660,3672,2.0,0.0,0.0,5,8,1800,860.0,1910,1910.0,98105,47.6609,-122.324,1510,3825,105.0,1910,2015-03-17
5/7/2014,1150000.0,4,4.0,4460,103382,2.0,0.0,0.0,3,11,4460,0.0,2001,2001.0,98053,47.63399999999999,-121.99700000000001,3470,88519,14.0,2001,2014-05-07
9/3/2014,605000.0,3,2.5,2010,3667,2.0,0.0,0.0,3,9,2010,0.0,2008,2008.0,98027,47.545,-122.015,2350,3600,7.0,2008,2014-09-03
3/9/2015,359000.0,3,2.5,1450,3850,2.0,0.0,0.0,3,7,1450,0.0,2004,2004.0,98065,47.5318,-121.85,1970,3748,11.0,2004,2015-03-09
10/8/2014,850000.0,3,1.75,1400,9900,1.0,0.0,0.0,3,7,1400,0.0,1951,1951.0,98004,47.6272,-122.209,1810,10796,64.0,1951,2014-10-08
8/21/2014,505000.0,3,2.0,1500,2500,2.0,0.0,0.0,3,8,1500,0.0,2002,2002.0,98107,47.6748,-122.385,1550,5000,13.0,2002,2014-08-21
7/9/2014,565000.0,3,2.5,2500,7394,2.0,0.0,0.0,3,9,2500,0.0,1990,1990.0,98072,47.7441,-122.17299999999999,2790,7642,25.0,1990,2014-07-09
4/29/2015,585000.0,2,1.75,1280,7110,1.0,0.0,0.0,4,7,1000,280.0,1955,1955.0,98118,47.5569,-122.273,1550,6835,60.0,1955,2015-04-29
4/30/2015,328000.0,4,3.25,3380,7500,2.0,0.0,3.0,3,7,2420,960.0,1990,1990.0,98198,47.4092,-122.33,1920,7500,25.0,1990,2015-04-30
7/9/2014,749950.0,4,2.75,2910,18700,1.0,0.0,0.0,3,9,2210,700.0,1957,1957.0,98177,47.7557,-122.368,2420,26140,58.0,1957,2014-07-09
6/26/2014,826000.0,4,2.5,3060,7140,2.0,0.0,0.0,3,9,3060,0.0,2006,2006.0,98027,47.5393,-121.99799999999999,3240,6218,9.0,2006,2014-06-26
9/4/2014,535000.0,3,1.0,1330,40259,1.0,0.0,0.0,4,7,1330,0.0,1977,1977.0,98024,47.552,-121.89,1710,34787,38.0,1977,2014-09-04
8/6/2014,925000.0,4,2.5,3300,101930,2.0,0.0,0.0,4,10,3300,0.0,1991,1991.0,98029,47.576,-121.976,2880,213879,24.0,1991,2014-08-06
6/5/2014,875000.0,3,3.5,3250,6000,2.0,0.0,0.0,3,10,2500,750.0,2001,2001.0,98136,47.5533,-122.391,1650,6000,14.0,2001,2014-06-05
5/23/2014,902000.0,4,2.25,2530,9200,1.0,0.0,0.0,5,9,1570,960.0,1976,1976.0,98006,47.5612,-122.152,3030,9400,39.0,1976,2014-05-23
10/1/2014,423000.0,3,1.0,1830,13900,1.0,0.0,0.0,3,7,1830,0.0,1951,1951.0,98133,47.7654,-122.352,1840,10667,64.0,1951,2014-10-01
6/23/2014,235000.0,3,1.0,1170,11100,1.0,0.0,0.0,4,6,1170,0.0,1968,1968.0,98059,47.4954,-122.164,2080,8481,47.0,1968,2014-06-23
7/10/2014,545000.0,2,2.0,2930,14057,1.0,0.0,2.0,4,8,1680,1250.0,1980,1980.0,98070,47.4025,-122.463,2234,61011,35.0,1980,2014-07-10
10/16/2014,343000.0,2,1.0,1230,7560,1.0,0.0,0.0,3,7,1230,0.0,1961,1961.0,98133,47.7298,-122.34,1270,7560,54.0,1961,2014-10-16
3/24/2015,334950.0,3,2.5,1620,2930,2.0,0.0,0.0,3,8,1620,0.0,2002,2002.0,98058,47.4491,-122.12,1900,2943,13.0,2002,2015-03-24
9/9/2014,405000.0,3,1.75,1760,5355,1.0,0.0,0.0,3,7,1160,600.0,1956,1956.0,98118,47.5368,-122.26700000000001,1790,6225,59.0,1956,2014-09-09
12/15/2014,220000.0,4,1.0,1440,8250,1.0,0.0,0.0,3,7,1440,0.0,1959,1959.0,98188,47.4325,-122.291,1440,8466,56.0,1959,2014-12-15
10/2/2014,173000.0,2,1.0,1740,8100,1.0,0.0,0.0,3,6,1050,690.0,1947,1947.0,98168,47.4942,-122.304,960,8100,68.0,1947,2014-10-02
11/7/2014,655000.0,3,1.0,1270,3600,1.5,0.0,0.0,3,7,1270,0.0,1906,1906.0,98119,47.6368,-122.37,1710,3600,109.0,1906,2014-11-07
1/7/2015,406000.0,2,1.0,880,3000,1.0,0.0,0.0,3,6,880,0.0,1924,1924.0,98115,47.6749,-122.323,890,3000,91.0,1924,2015-01-07
12/17/2014,632000.0,6,2.5,2560,8320,1.0,0.0,0.0,3,7,1370,1190.0,1961,1961.0,98125,47.7021,-122.287,2360,7800,54.0,1961,2014-12-17
11/26/2014,357000.0,5,2.75,1540,4000,1.0,0.0,0.0,3,7,1140,400.0,1990,1990.0,98106,47.533,-122.354,1630,4000,25.0,1990,2014-11-26
12/9/2014,361000.0,3,1.75,1150,17585,1.0,0.0,0.0,3,7,1150,0.0,1964,1964.0,98014,47.6503,-121.90799999999999,1200,7500,51.0,1964,2014-12-09
7/8/2014,277000.0,2,1.0,770,8149,1.0,0.0,0.0,3,6,770,0.0,1948,1948.0,98155,47.7458,-122.29799999999999,1160,8149,67.0,1948,2014-07-08
6/5/2014,630000.0,4,3.75,4610,40202,1.0,0.0,0.0,4,10,2500,2110.0,1980,1980.0,98027,47.4599,-122.0,3050,41056,35.0,1980,2014-06-05
5/9/2014,254000.0,3,2.5,1850,4597,2.0,0.0,0.0,3,8,1850,0.0,2003,2003.0,98042,47.3755,-122.13600000000001,2210,5000,12.0,2003,2014-05-09
11/13/2014,472800.0,3,2.25,1840,8400,1.0,0.0,0.0,3,8,1290,550.0,1961,1961.0,98006,47.5497,-122.17200000000001,2110,8400,54.0,1961,2014-11-13
9/22/2014,263000.0,3,1.75,1490,3800,1.0,0.0,0.0,3,6,700,790.0,1913,1913.0,98118,47.5554,-122.27,2180,4000,102.0,1913,2014-09-22
5/4/2015,510000.0,3,1.75,1490,3800,1.0,0.0,0.0,3,6,700,790.0,1913,1913.0,98118,47.5554,-122.27,2180,4000,102.0,1913,2015-05-04
11/7/2014,179950.0,3,1.0,960,10125,1.0,0.0,0.0,4,7,960,0.0,1952,1952.0,98003,47.3335,-122.305,1250,9769,63.0,1952,2014-11-07
12/3/2014,525000.0,4,2.25,1580,7307,1.0,0.0,0.0,3,8,1160,420.0,1973,1973.0,98027,47.568999999999996,-122.086,2020,7458,42.0,1973,2014-12-03
5/20/2014,479000.0,3,2.5,1260,889,3.0,0.0,0.0,3,8,1260,0.0,2008,2008.0,98109,47.6277,-122.345,1340,1324,7.0,2008,2014-05-20
9/4/2014,651000.0,3,2.0,1940,6440,1.0,0.0,2.0,5,7,970,0.0,1940,1940.0,98116,47.5664,-122.389,1730,4640,75.0,1940,2014-09-04
9/11/2014,949000.0,4,1.75,2490,7834,1.0,0.0,3.0,4,8,1240,1250.0,1958,1958.0,98033,47.6851,-122.209,3210,7834,57.0,1958,2014-09-11
4/21/2015,392400.0,5,2.5,2520,27951,1.5,0.0,0.0,3,7,1890,630.0,1942,1970.0,98155,47.7733,-122.318,1830,14373,45.0,1970,2015-04-21
11/5/2014,585000.0,4,1.75,1760,5356,1.0,0.0,0.0,4,7,920,840.0,1950,1950.0,98115,47.678999999999995,-122.288,1680,5184,65.0,1950,2014-11-05
12/12/2014,460000.0,4,2.5,4190,7504,2.0,0.0,0.0,3,7,4190,0.0,2004,2004.0,98058,47.4394,-122.11399999999999,2480,6727,11.0,2004,2014-12-12
8/13/2014,470000.0,3,1.0,1170,4400,1.0,0.0,0.0,3,7,870,300.0,1951,1951.0,98199,47.6584,-122.391,1240,4400,64.0,1951,2014-08-13
4/6/2015,245000.0,3,2.5,1600,4271,2.0,0.0,0.0,3,7,1600,0.0,2003,2003.0,98038,47.386,-122.036,1520,3225,12.0,2003,2015-04-06
11/25/2014,500000.0,4,2.0,2760,27631,2.0,0.0,0.0,4,8,1800,960.0,1978,1978.0,98155,47.7484,-122.291,2490,13158,37.0,1978,2014-11-25
11/13/2014,455000.0,3,2.5,2090,8653,2.0,0.0,0.0,3,8,2090,0.0,1989,1989.0,98011,47.7498,-122.184,2090,6396,26.0,1989,2014-11-13
4/8/2015,485500.0,4,2.5,2320,3974,2.0,0.0,0.0,3,7,2320,0.0,1999,1999.0,98065,47.532,-121.88,2620,4539,16.0,1999,2015-04-08
12/22/2014,1880000.0,5,3.25,4110,7920,2.0,0.0,3.0,3,9,3150,960.0,1921,1921.0,98122,47.617,-122.28200000000001,3890,7800,94.0,1921,2014-12-22
7/17/2014,100000.0,2,1.0,770,17334,1.0,0.0,0.0,3,7,770,0.0,1978,1978.0,98001,47.2997,-122.26899999999999,1480,17334,37.0,1978,2014-07-17
9/5/2014,307000.0,3,1.75,1410,16105,1.0,0.0,0.0,3,7,1410,0.0,1982,1982.0,98014,47.6927,-121.913,1550,18615,33.0,1982,2014-09-05
10/10/2014,475000.0,4,3.5,3660,14401,2.0,0.0,0.0,3,10,2660,1000.0,1994,1994.0,98023,47.3076,-122.396,2780,10653,21.0,1994,2014-10-10
2/19/2015,330000.0,4,2.5,2180,7210,1.0,0.0,0.0,3,7,1190,990.0,1972,1972.0,98011,47.7419,-122.181,2070,7210,43.0,1972,2015-02-19
2/9/2015,130000.0,3,1.0,1110,7520,1.0,0.0,0.0,4,7,1110,0.0,1960,1960.0,98033,47.683,-122.176,1440,8400,55.0,1960,2015-02-09
6/23/2014,320000.0,3,2.5,2280,7417,2.0,0.0,0.0,3,8,2280,0.0,1998,1998.0,98001,47.3557,-122.27799999999999,2370,6443,17.0,1998,2014-06-23
6/6/2014,735000.0,4,2.5,2820,6180,2.0,0.0,0.0,3,9,2050,770.0,2013,2013.0,98118,47.5529,-122.281,1390,4635,2.0,2013,2014-06-06
3/12/2015,365000.0,4,2.5,1570,9600,1.0,0.0,0.0,3,7,800,770.0,1972,1972.0,98155,47.7757,-122.303,1340,9110,43.0,1972,2015-03-12
4/16/2015,234000.0,3,1.5,1200,11935,1.0,0.0,0.0,4,7,1200,0.0,1968,1968.0,98042,47.3434,-122.08200000000001,1350,11935,47.0,1968,2015-04-16
8/27/2014,211000.0,4,2.0,1710,8288,1.5,0.0,0.0,3,7,1710,0.0,1970,1970.0,98031,47.3947,-122.17399999999999,1710,7200,45.0,1970,2014-08-27
3/30/2015,680000.0,6,3.5,3000,6320,2.0,0.0,2.0,3,8,2400,600.0,1969,1969.0,98118,47.562,-122.279,1720,6360,46.0,1969,2015-03-30
11/12/2014,457000.0,4,3.0,2800,7845,2.0,0.0,0.0,3,8,2800,0.0,2002,2002.0,98038,47.3544,-122.01299999999999,2800,6977,13.0,2002,2014-11-12
10/9/2014,349000.0,3,2.25,1640,7261,2.0,0.0,0.0,3,7,1640,0.0,1989,1989.0,98034,47.7192,-122.176,1640,6789,26.0,1989,2014-10-09
10/24/2014,360000.0,3,2.75,2030,6840,1.0,0.0,0.0,3,7,1210,820.0,1979,1979.0,98108,47.5413,-122.29899999999999,1910,6365,36.0,1979,2014-10-24
4/14/2015,350000.0,4,2.5,2530,10155,2.0,0.0,0.0,3,8,2530,0.0,1998,1998.0,98042,47.351000000000006,-122.146,2330,7205,17.0,1998,2015-04-14
4/30/2015,208000.0,3,1.0,990,7420,1.0,0.0,0.0,5,6,990,0.0,1960,1960.0,98002,47.2898,-122.221,1010,7420,55.0,1960,2015-04-30
6/18/2014,250275.0,2,1.0,790,11234,1.0,0.0,0.0,4,6,790,0.0,1942,1942.0,98166,47.4413,-122.34899999999999,1930,11871,73.0,1942,2014-06-18
4/28/2015,435000.0,2,1.0,790,11234,1.0,0.0,0.0,4,6,790,0.0,1942,1942.0,98166,47.4413,-122.34899999999999,1930,11871,73.0,1942,2015-04-28
12/5/2014,270000.0,3,1.75,1800,7763,1.0,0.0,0.0,3,6,1470,330.0,1984,1984.0,98030,47.3766,-122.184,1440,7483,31.0,1984,2014-12-05
5/27/2014,438000.0,3,1.75,1650,12940,1.0,0.0,0.0,4,7,1650,0.0,1961,1961.0,98028,47.7629,-122.26799999999999,2830,12600,54.0,1961,2014-05-27
11/19/2014,659000.0,4,2.0,1980,23625,2.0,0.0,0.0,3,8,1980,0.0,1938,1984.0,98072,47.7553,-122.09200000000001,2300,24640,31.0,1984,2014-11-19
5/4/2015,645000.0,4,2.75,2340,6350,1.0,0.0,0.0,4,7,1310,1030.0,1974,1974.0,98126,47.5559,-122.37899999999999,2020,6350,41.0,1974,2015-05-04
10/30/2014,685100.0,4,2.5,2790,5423,2.0,0.0,0.0,3,9,2790,0.0,1999,1999.0,98074,47.6085,-122.01700000000001,2450,6453,16.0,1999,2014-10-30
6/23/2014,350000.0,7,3.0,2800,9569,1.0,0.0,2.0,3,7,1400,1400.0,1963,1963.0,98056,47.5102,-122.18299999999999,2150,7333,52.0,1963,2014-06-23
2/27/2015,375000.0,2,1.0,1840,81892,1.0,0.0,0.0,3,6,1840,0.0,1955,1955.0,98072,47.7694,-122.124,2550,40089,60.0,1955,2015-02-27
7/15/2014,170000.0,3,1.5,1350,81549,1.0,0.0,0.0,2,7,1350,0.0,1966,1966.0,98092,47.3099,-122.09,2220,93825,49.0,1966,2014-07-15
6/24/2014,880000.0,4,2.5,3030,3841,3.0,0.0,0.0,3,9,3030,0.0,2005,2005.0,98117,47.6781,-122.369,1080,4922,10.0,2005,2014-06-24
4/19/2015,410500.0,4,2.5,1980,5000,2.0,0.0,0.0,3,8,1980,0.0,2008,2008.0,98014,47.6492,-121.90799999999999,1400,8500,7.0,2008,2015-04-19
10/23/2014,780000.0,4,2.5,3690,13609,2.0,0.0,2.0,3,10,3690,0.0,1996,1996.0,98075,47.5872,-121.97200000000001,3600,13609,19.0,1996,2014-10-23
9/10/2014,1230000.0,5,4.5,3732,4426,2.5,0.0,0.0,3,10,2932,800.0,2001,2001.0,98112,47.6189,-122.288,2950,4000,14.0,2001,2014-09-10
11/13/2014,449000.0,2,1.75,1510,6852,1.0,0.0,0.0,3,8,1510,0.0,2005,2005.0,98053,47.7073,-122.012,1510,5912,10.0,2005,2014-11-13
5/14/2014,546000.0,3,1.75,2000,5000,1.0,0.0,0.0,4,7,1110,890.0,1921,1921.0,98117,47.6859,-122.399,1750,5000,94.0,1921,2014-05-14
5/16/2014,317000.0,3,2.0,1760,11410,1.0,0.0,0.0,5,7,1060,700.0,1977,1977.0,98058,47.4528,-122.163,1680,9165,38.0,1977,2014-05-16
6/25/2014,276900.0,3,1.0,1270,7566,1.0,0.0,0.0,4,7,1270,0.0,1958,1958.0,98056,47.5074,-122.175,1780,7520,57.0,1958,2014-06-25
10/28/2014,399000.0,5,2.0,2620,7030,1.0,0.0,0.0,3,8,1420,1200.0,1965,1965.0,98133,47.7338,-122.352,1360,7964,50.0,1965,2014-10-28
8/8/2014,495000.0,5,2.75,2630,10165,1.0,0.0,0.0,4,8,1690,940.0,1976,1976.0,98027,47.5196,-122.04899999999999,2440,10165,39.0,1976,2014-08-08
8/8/2014,258000.0,3,1.75,2270,9000,1.0,0.0,0.0,4,8,1330,940.0,1978,1978.0,98023,47.3077,-122.381,2090,8400,37.0,1978,2014-08-08
7/10/2014,600000.0,2,2.5,2410,102366,1.0,0.0,0.0,4,7,1940,470.0,1912,1989.0,98024,47.5629,-121.91799999999999,2460,310582,26.0,1989,2014-07-10
11/17/2014,265000.0,3,2.75,1120,881,3.0,0.0,0.0,3,8,1120,0.0,1999,1999.0,98103,47.6914,-122.34299999999999,1120,1087,16.0,1999,2014-11-17
4/24/2015,321000.0,5,2.75,3030,7000,1.0,0.0,0.0,4,7,1540,1490.0,1978,1978.0,98032,47.3661,-122.28,1790,7330,37.0,1978,2015-04-24
8/29/2014,682000.0,5,2.25,2120,4000,1.5,0.0,0.0,4,7,1720,400.0,1910,1910.0,98109,47.644,-122.353,1960,4000,105.0,1910,2014-08-29
11/14/2014,295700.0,4,2.5,1720,5805,2.0,0.0,0.0,3,8,1720,0.0,2000,2000.0,98092,47.3286,-122.208,2360,7700,15.0,2000,2014-11-14
5/6/2014,609000.0,4,2.5,2150,37981,2.0,0.0,0.0,3,9,2150,0.0,1985,1985.0,98052,47.7227,-122.098,2450,37981,30.0,1985,2014-05-06
6/25/2014,995000.0,3,4.5,4380,47044,2.0,1.0,3.0,3,9,3720,660.0,1968,1990.0,98166,47.4734,-122.365,2460,18512,25.0,1990,2014-06-25
8/18/2014,530000.0,3,2.25,2010,11817,2.0,0.0,0.0,4,8,2010,0.0,1986,1986.0,98029,47.5665,-122.023,2190,10168,29.0,1986,2014-08-18
12/29/2014,614000.0,5,2.5,3150,5150,2.0,0.0,0.0,5,8,1870,1280.0,1907,2004.0,98118,47.5506,-122.26899999999999,1550,5150,11.0,2004,2014-12-29
11/24/2014,390000.0,3,2.5,2500,21780,1.0,0.0,0.0,3,8,1770,730.0,1986,1986.0,98092,47.3282,-122.198,2670,23400,29.0,1986,2014-11-24
11/10/2014,467000.0,3,2.5,1690,6642,2.0,0.0,0.0,3,7,1690,0.0,2004,2004.0,98053,47.6793,-122.03299999999999,2120,5080,11.0,2004,2014-11-10
8/13/2014,484000.0,6,2.5,3300,13501,1.0,0.0,0.0,3,8,2060,1240.0,1980,1980.0,98059,47.5116,-122.163,2060,8745,35.0,1980,2014-08-13
11/13/2014,340000.0,3,2.5,1240,1115,3.0,0.0,0.0,3,8,1240,0.0,2003,2003.0,98103,47.6985,-122.34,1410,1355,12.0,2003,2014-11-13
12/23/2014,302495.0,3,2.5,2200,7201,2.0,0.0,0.0,3,8,2200,0.0,1994,1994.0,98030,47.3821,-122.20700000000001,2250,7240,21.0,1994,2014-12-23
9/25/2014,532500.0,3,1.75,1620,3360,1.0,0.0,0.0,5,7,980,640.0,1927,1927.0,98117,47.6886,-122.361,1400,3840,88.0,1927,2014-09-25
9/10/2014,441500.0,3,2.5,2420,9592,2.0,0.0,0.0,3,8,1780,640.0,1993,1993.0,98059,47.5093,-122.15299999999999,2420,9145,22.0,1993,2014-09-10
7/24/2014,470000.0,4,2.5,2680,8062,1.0,0.0,3.0,4,7,1530,1150.0,1967,1967.0,98198,47.4132,-122.32799999999999,1920,8600,48.0,1967,2014-07-24
6/25/2014,2300000.0,4,3.25,4250,8570,2.0,0.0,0.0,3,9,4250,0.0,2004,2004.0,98004,47.6154,-122.21,2830,12821,11.0,2004,2014-06-25
12/17/2014,590000.0,3,2.5,2400,99752,1.0,0.0,0.0,3,9,2400,0.0,1996,1996.0,98058,47.3917,-122.084,2800,98010,19.0,1996,2014-12-17
7/29/2014,320000.0,3,1.75,2300,12000,1.0,0.0,0.0,3,8,1770,530.0,1942,1942.0,98133,47.7599,-122.34299999999999,2030,6000,73.0,1942,2014-07-29
11/3/2014,363000.0,2,2.0,920,1201,2.0,0.0,0.0,3,8,800,120.0,2009,2009.0,98144,47.5926,-122.295,1150,1161,6.0,2009,2014-11-03
7/7/2014,747500.0,4,2.25,2350,18600,2.0,0.0,0.0,4,9,2350,0.0,1977,1977.0,98028,47.7473,-122.257,2880,14400,38.0,1977,2014-07-07
7/23/2014,750000.0,2,2.5,2630,7957,2.0,0.0,0.0,3,8,2630,0.0,2003,2003.0,98053,47.7106,-122.023,2305,7220,12.0,2003,2014-07-23
5/5/2014,831000.0,4,3.0,2170,4000,2.0,0.0,0.0,4,9,1610,560.0,1982,2011.0,98112,47.6196,-122.292,1670,4000,4.0,2011,2014-05-05
4/24/2015,403000.0,3,2.5,1700,4125,2.0,0.0,0.0,3,7,1700,0.0,2004,2004.0,98065,47.5305,-121.854,1970,4105,11.0,2004,2015-04-24
8/8/2014,445000.0,3,2.5,2470,4565,2.0,0.0,0.0,3,7,2470,0.0,2005,2005.0,98056,47.513999999999996,-122.189,2470,5064,10.0,2005,2014-08-08
3/26/2015,345000.0,3,1.0,1250,17380,1.0,0.0,0.0,4,7,1250,0.0,1970,1970.0,98072,47.7502,-122.10799999999999,1410,18200,45.0,1970,2015-03-26
2/9/2015,2260000.0,3,3.5,3110,14872,1.0,0.0,0.0,3,10,3110,0.0,2003,2003.0,98004,47.6178,-122.209,3110,12433,12.0,2003,2015-02-09
6/16/2014,371025.0,3,2.0,1530,8925,1.0,0.0,0.0,3,7,1530,0.0,1977,1977.0,98011,47.736000000000004,-122.199,2040,8856,38.0,1977,2014-06-16
7/30/2014,355000.0,2,1.0,960,6250,1.0,0.0,0.0,3,6,960,0.0,1916,1916.0,98136,47.5491,-122.38600000000001,1350,6250,99.0,1916,2014-07-30
9/9/2014,270000.0,3,1.0,1240,14110,1.0,0.0,0.0,4,7,1240,0.0,1972,1972.0,98058,47.4579,-122.09,2060,19350,43.0,1972,2014-09-09
6/5/2014,425000.0,4,2.75,2440,15349,2.0,0.0,1.0,4,7,2440,0.0,1957,1957.0,98198,47.4117,-122.333,2280,9250,58.0,1957,2014-06-05
3/13/2015,364808.0,3,1.75,2320,7875,1.0,0.0,0.0,3,8,1620,700.0,1967,1967.0,98058,47.4524,-122.146,1990,9720,48.0,1967,2015-03-13
1/13/2015,320000.0,3,2.25,1580,6561,1.0,0.0,0.0,3,8,1200,380.0,1981,1981.0,98058,47.4394,-122.14,1710,7241,34.0,1981,2015-01-13
10/14/2014,325000.0,4,2.5,2963,5797,2.0,0.0,0.0,3,9,2963,0.0,2006,2006.0,98030,47.3831,-122.185,2665,6119,9.0,2006,2014-10-14
9/4/2014,350000.0,3,2.25,2470,10290,2.0,0.0,0.0,3,8,2230,240.0,1984,1984.0,98058,47.4459,-122.124,1970,10150,31.0,1984,2014-09-04
2/19/2015,170000.0,3,1.5,1370,10176,1.0,0.0,0.0,3,6,1370,0.0,1947,1947.0,98168,47.4738,-122.26299999999999,1650,10176,68.0,1947,2015-02-19
5/9/2014,255000.0,2,1.0,960,28717,1.0,0.0,0.0,4,6,960,0.0,1984,1984.0,98070,47.3356,-122.50200000000001,1860,28717,31.0,1984,2014-05-09
12/10/2014,550000.0,3,1.0,1130,7500,1.0,0.0,0.0,3,7,880,250.0,1947,1947.0,98117,47.6973,-122.389,2190,5250,68.0,1947,2014-12-10
7/3/2014,835000.0,4,4.25,4930,25714,2.0,0.0,0.0,3,12,4930,0.0,2005,2005.0,98092,47.3069,-122.148,3620,23035,10.0,2005,2014-07-03
3/10/2015,420000.0,3,1.0,1150,5120,1.0,0.0,0.0,4,6,800,350.0,1946,1946.0,98116,47.5588,-122.39200000000001,1220,5120,69.0,1946,2015-03-10
5/14/2014,925000.0,4,2.5,2190,7350,2.5,0.0,0.0,5,8,2190,0.0,1958,1958.0,98040,47.5786,-122.236,1880,7350,57.0,1958,2014-05-14
6/6/2014,389250.0,2,1.5,1490,4080,1.0,0.0,0.0,3,7,930,560.0,1956,1956.0,98126,47.5344,-122.381,1320,4080,59.0,1956,2014-06-06
5/1/2015,748000.0,3,2.5,2600,10183,1.0,0.0,0.0,3,8,1300,1300.0,2004,2004.0,98033,47.6984,-122.20100000000001,1860,10401,11.0,2004,2015-05-01
3/24/2015,284000.0,3,1.75,1530,9600,1.0,0.0,0.0,3,7,1200,330.0,1988,1988.0,98042,47.3594,-122.07600000000001,1680,9680,27.0,1988,2015-03-24
6/11/2014,588000.0,4,2.0,1680,5000,1.0,0.0,0.0,3,7,980,700.0,1950,1950.0,98115,47.6858,-122.286,1680,6000,65.0,1950,2014-06-11
3/20/2015,372500.0,3,1.75,1680,8648,1.0,0.0,0.0,4,7,1680,0.0,1963,1963.0,98133,47.7338,-122.33200000000001,1290,8147,52.0,1963,2015-03-20
2/18/2015,285000.0,4,3.0,1900,7194,2.0,0.0,0.0,4,7,1900,0.0,1988,1988.0,98042,47.3768,-122.117,1690,7194,27.0,1988,2015-02-18
5/27/2014,360000.0,3,1.0,1570,9467,1.0,0.0,0.0,3,7,1570,0.0,1954,1954.0,98177,47.7683,-122.359,1570,9100,61.0,1954,2014-05-27
11/18/2014,275000.0,3,1.0,1370,17859,1.0,0.0,0.0,4,7,1150,220.0,1930,1930.0,98024,47.5617,-121.859,1460,47044,85.0,1930,2014-11-18
9/16/2014,428000.0,2,2.0,1350,4225,1.0,0.0,0.0,3,8,1350,0.0,2003,2003.0,98053,47.7106,-122.03,1660,4225,12.0,2003,2014-09-16
3/25/2015,847000.0,6,2.5,3010,17864,2.0,0.0,0.0,3,8,3010,0.0,1969,1969.0,98177,47.7209,-122.37200000000001,2560,11532,46.0,1969,2015-03-25
9/26/2014,316000.0,3,1.0,1010,7838,1.0,0.0,0.0,4,6,1010,0.0,1977,1977.0,98019,47.7422,-121.98100000000001,1380,8128,38.0,1977,2014-09-26
5/5/2015,375000.0,3,2.5,2050,7205,2.0,0.0,0.0,3,8,2050,0.0,2000,2000.0,98003,47.3487,-122.304,2050,7264,15.0,2000,2015-05-05
5/8/2014,533000.0,3,1.0,1670,4080,1.0,0.0,0.0,3,7,1170,500.0,1967,1967.0,98115,47.6899,-122.321,1560,4080,48.0,1967,2014-05-08
5/23/2014,556000.0,5,2.5,3840,16905,2.0,0.0,0.0,3,11,3840,0.0,1991,1991.0,98023,47.2996,-122.34200000000001,3270,12133,24.0,1991,2014-05-23
9/15/2014,225000.0,4,2.0,2220,14120,1.0,0.0,0.0,3,7,1200,1020.0,1966,1966.0,98042,47.361000000000004,-122.116,1300,9709,49.0,1966,2014-09-15
10/30/2014,537250.0,4,2.5,2590,9530,1.0,0.0,0.0,4,8,1640,950.0,1978,1978.0,98155,47.7752,-122.285,2710,10970,37.0,1978,2014-10-30
12/17/2014,255000.0,3,1.0,1180,13650,1.0,0.0,0.0,4,7,1180,0.0,1967,1967.0,98058,47.4551,-122.154,1460,11730,48.0,1967,2014-12-17
4/9/2015,530000.0,4,2.5,2950,4836,2.0,0.0,0.0,3,7,2950,0.0,2006,2006.0,98059,47.479,-122.12899999999999,2120,4750,9.0,2006,2015-04-09
4/13/2015,5300000.0,6,6.0,7390,24829,2.0,1.0,0.0,4,12,5000,2390.0,1991,1991.0,98040,47.5631,-122.21,4320,24619,24.0,1991,2015-04-13
3/24/2015,595000.0,3,2.75,2150,31238,2.0,0.0,0.0,3,9,2150,0.0,1996,1996.0,98014,47.6596,-121.96,2650,38307,19.0,1996,2015-03-24
8/14/2014,548000.0,4,2.0,2100,8880,1.0,0.0,0.0,4,7,2100,0.0,1958,1958.0,98008,47.6115,-122.124,1280,9102,57.0,1958,2014-08-14
3/20/2015,234975.0,3,1.75,1650,8073,1.0,0.0,0.0,3,7,1100,550.0,1980,1980.0,98092,47.3187,-122.182,1280,8073,35.0,1980,2015-03-20
8/19/2014,600000.0,3,1.75,1620,1325,2.5,0.0,0.0,3,9,1430,190.0,2005,2005.0,98102,47.6498,-122.321,1750,1572,10.0,2005,2014-08-19
3/24/2015,432000.0,4,1.0,1750,12528,1.0,0.0,0.0,4,7,1750,0.0,1967,1967.0,98072,47.743,-122.09700000000001,1550,14120,48.0,1967,2015-03-24
2/2/2015,455000.0,3,1.5,1380,6657,2.0,0.0,0.0,3,7,1380,0.0,1986,1986.0,98034,47.7085,-122.21700000000001,1420,8187,29.0,1986,2015-02-02
10/24/2014,279950.0,3,1.75,1510,11234,1.0,0.0,0.0,3,7,1210,300.0,1965,1965.0,98155,47.7571,-122.32799999999999,2080,9076,50.0,1965,2014-10-24
10/20/2014,267500.0,3,1.5,1600,9072,1.0,0.0,0.0,4,7,1600,0.0,1963,1963.0,98030,47.3737,-122.21600000000001,1710,8000,52.0,1963,2014-10-20
9/9/2014,620000.0,4,2.5,1840,220308,2.0,0.0,0.0,3,8,1840,0.0,2000,2000.0,98038,47.4306,-122.04899999999999,1890,65340,15.0,2000,2014-09-09
1/27/2015,110000.0,2,1.0,830,7590,1.0,0.0,0.0,2,6,830,0.0,1943,1943.0,98166,47.4784,-122.335,980,7590,72.0,1943,2015-01-27
5/13/2014,625000.0,3,3.5,1810,1846,2.0,0.0,0.0,4,8,1440,370.0,2009,2009.0,98122,47.607,-122.305,1480,3600,6.0,2009,2014-05-13
5/29/2014,389000.0,2,1.0,910,7000,1.0,0.0,0.0,3,7,910,0.0,1952,1952.0,98115,47.6999,-122.305,1260,7528,63.0,1952,2014-05-29
6/30/2014,1200000.0,4,2.0,2120,3360,2.0,0.0,0.0,3,9,2120,0.0,1905,1905.0,98112,47.6227,-122.31,2090,3600,110.0,1905,2014-06-30
4/24/2015,788500.0,4,2.25,2510,133729,2.0,0.0,0.0,4,8,2510,0.0,1977,1977.0,98027,47.4569,-122.02,2510,69696,38.0,1977,2015-04-24
7/25/2014,567000.0,5,2.25,2100,6936,1.0,0.0,0.0,3,8,1600,500.0,1974,1974.0,98033,47.6737,-122.169,2100,8661,41.0,1974,2014-07-25
1/13/2015,515000.0,2,2.25,2690,15000,1.0,0.0,2.0,3,8,1870,820.0,1987,1987.0,98023,47.3361,-122.353,2690,15000,28.0,1987,2015-01-13
9/2/2014,605000.0,4,2.5,2430,11870,1.0,0.0,0.0,5,8,1590,840.0,1968,1968.0,98155,47.7761,-122.285,2430,9600,47.0,1968,2014-09-02
10/27/2014,430000.0,4,3.75,2452,4800,2.0,0.0,0.0,3,7,2452,0.0,1936,1994.0,98055,47.4744,-122.213,1180,4800,21.0,1994,2014-10-27
7/17/2014,805000.0,2,1.75,1550,6000,1.0,0.0,1.0,3,7,1550,0.0,1920,1920.0,98199,47.6712,-122.40899999999999,2360,6000,95.0,1920,2014-07-17
4/13/2015,567500.0,3,2.5,2080,4556,2.0,0.0,0.0,3,8,2080,0.0,1999,1999.0,98074,47.6036,-122.014,1530,5606,16.0,1999,2015-04-13
6/5/2014,647500.0,3,1.75,1290,3870,1.0,0.0,0.0,5,7,1290,0.0,1916,1916.0,98144,47.5873,-122.29,2020,5850,99.0,1916,2014-06-05
11/26/2014,495000.0,2,1.75,1850,2530,2.5,0.0,0.0,4,7,1850,0.0,1903,1903.0,98122,47.6106,-122.31,1500,1795,112.0,1903,2014-11-26
11/4/2014,825000.0,4,2.5,3370,5000,2.0,0.0,0.0,3,9,3370,0.0,2006,2006.0,98027,47.541000000000004,-121.99799999999999,3370,5237,9.0,2006,2014-11-04
3/9/2015,435000.0,4,2.25,2730,7506,2.0,0.0,0.0,4,8,2730,0.0,1987,1987.0,98058,47.4627,-122.152,2390,8015,28.0,1987,2015-03-09
9/9/2014,445950.0,3,1.75,1300,7800,1.0,0.0,0.0,5,7,1300,0.0,1968,1968.0,98034,47.7321,-122.195,1520,7344,47.0,1968,2014-09-09
6/3/2014,960000.0,5,2.75,3040,10257,2.0,0.0,0.0,3,10,3040,0.0,1993,1993.0,98006,47.5531,-122.119,2860,9327,22.0,1993,2014-06-03
9/17/2014,780000.0,4,3.0,2440,3600,1.5,0.0,0.0,5,8,1480,960.0,1929,1929.0,98103,47.6853,-122.331,1770,4000,86.0,1929,2014-09-17
6/18/2014,274500.0,3,2.25,1720,9000,1.0,0.0,0.0,4,8,1320,400.0,1969,1969.0,98023,47.3191,-122.383,1930,8000,46.0,1969,2014-06-18
4/29/2015,729953.0,5,3.0,3230,5167,1.5,0.0,0.0,4,8,2000,1230.0,1909,1909.0,98133,47.7053,-122.34,1509,1626,106.0,1909,2015-04-29
7/28/2014,464950.0,3,1.5,1200,890,2.0,0.0,0.0,3,8,1030,170.0,2008,2008.0,98109,47.6384,-122.34200000000001,1230,2120,7.0,2008,2014-07-28
11/12/2014,620000.0,4,1.75,2350,18800,1.0,0.0,2.0,3,8,2350,0.0,1959,1959.0,98005,47.5904,-122.177,3050,14640,56.0,1959,2014-11-12
1/16/2015,735000.0,4,3.5,3100,5600,2.0,0.0,0.0,3,9,3100,0.0,2005,2005.0,98075,47.5968,-121.978,3080,5600,10.0,2005,2015-01-16
4/21/2015,450000.0,4,2.25,2040,9565,1.0,0.0,0.0,3,8,1400,640.0,1959,1959.0,98133,47.7356,-122.335,1890,8580,56.0,1959,2015-04-21
6/5/2014,450000.0,4,1.0,2000,4676,1.5,0.0,0.0,3,7,1250,750.0,1916,1986.0,98118,47.5529,-122.26799999999999,1140,4676,29.0,1986,2014-06-05
5/11/2014,842500.0,4,2.5,2160,5298,2.5,0.0,0.0,4,9,2160,0.0,1902,1902.0,98122,47.6106,-122.31,1720,2283,113.0,1902,2014-05-11
10/8/2014,360000.0,3,2.0,1970,79714,1.0,0.0,0.0,3,7,1070,900.0,1979,1979.0,98058,47.4674,-122.10700000000001,1890,36626,36.0,1979,2014-10-08
6/24/2014,585000.0,3,2.5,2270,100545,2.0,0.0,0.0,3,8,2270,0.0,1998,1998.0,98070,47.4815,-122.47,1277,100545,17.0,1998,2014-06-24
8/14/2014,461000.0,3,2.25,1850,7923,1.0,0.0,0.0,4,7,1150,700.0,1977,1977.0,98033,47.7011,-122.171,1780,7420,38.0,1977,2014-08-14
8/18/2014,345000.0,2,1.0,1350,4494,1.0,0.0,0.0,3,7,920,430.0,1949,1949.0,98126,47.5315,-122.38,1470,5225,66.0,1949,2014-08-18
7/2/2014,1080000.0,3,2.5,3280,10302,1.0,0.0,0.0,3,10,1680,1600.0,1970,1970.0,98115,47.6948,-122.286,1550,6300,45.0,1970,2014-07-02
2/27/2015,643000.0,4,2.5,2270,8391,2.0,0.0,0.0,3,8,2270,0.0,1988,1988.0,98029,47.574,-122.01299999999999,2420,8391,27.0,1988,2015-02-27
9/29/2014,690000.0,4,2.5,2820,8307,2.0,0.0,0.0,3,9,2820,0.0,1990,1990.0,98074,47.6253,-122.027,2820,8307,25.0,1990,2014-09-29
4/1/2015,282000.0,4,1.0,1200,11111,1.5,0.0,0.0,3,7,1200,0.0,1949,1949.0,98155,47.7529,-122.306,1350,9113,66.0,1949,2015-04-01
11/18/2014,549000.0,3,1.75,2000,6130,1.0,0.0,0.0,4,8,1120,880.0,1951,1951.0,98117,47.6925,-122.38799999999999,2140,7150,64.0,1951,2014-11-18
1/8/2015,815000.0,3,2.0,2310,6000,2.0,0.0,1.0,4,9,1560,750.0,1926,1926.0,98199,47.648,-122.395,2000,6000,89.0,1926,2015-01-08
5/11/2015,2200000.0,5,4.25,4640,22703,2.0,1.0,4.0,5,8,2860,1780.0,1952,1952.0,98052,47.6393,-122.09700000000001,3140,14200,63.0,1952,2015-05-11
4/13/2015,700000.0,3,2.25,2330,11424,2.0,0.0,0.0,4,8,2330,0.0,1984,1984.0,98052,47.6386,-122.11,2050,11448,31.0,1984,2015-04-13
7/14/2014,933399.0,3,2.5,3940,10360,2.0,0.0,0.0,3,9,3110,830.0,1992,1992.0,98052,47.6468,-122.116,2720,11941,23.0,1992,2014-07-14
7/3/2014,290000.0,3,1.0,1440,11250,1.0,0.0,0.0,3,7,1440,0.0,1967,1967.0,98055,47.4627,-122.213,2200,11250,48.0,1967,2014-07-03
5/24/2014,372000.0,4,1.75,1960,9300,1.0,0.0,0.0,5,7,1340,620.0,1979,1979.0,98045,47.4487,-121.772,1500,9752,36.0,1979,2014-05-24
8/19/2014,450000.0,2,1.75,1250,2890,1.0,0.0,0.0,4,7,790,460.0,1920,1920.0,98103,47.6795,-122.353,1500,3225,95.0,1920,2014-08-19
9/5/2014,303700.0,3,2.5,1981,5700,2.0,0.0,0.0,3,8,1981,0.0,2010,2010.0,98030,47.3668,-122.178,1981,5894,5.0,2010,2014-09-05
7/24/2014,672000.0,4,2.5,2440,10049,2.0,0.0,0.0,4,9,2440,0.0,1989,1989.0,98029,47.5744,-121.993,2820,8484,26.0,1989,2014-07-24
6/23/2014,334000.0,4,1.5,1150,9360,1.5,0.0,0.0,3,6,1150,0.0,1970,1970.0,98034,47.7197,-122.17299999999999,1480,8155,45.0,1970,2014-06-23
6/25/2014,260000.0,2,1.0,1120,5650,1.0,0.0,0.0,3,6,1120,0.0,1944,1944.0,98178,47.4979,-122.241,1270,6875,71.0,1944,2014-06-25
7/31/2014,749950.0,3,1.75,1800,5700,1.0,0.0,0.0,4,8,1000,800.0,1941,1941.0,98119,47.6491,-122.367,1680,5350,74.0,1941,2014-07-31
12/23/2014,330000.0,4,2.25,2380,122038,2.0,0.0,0.0,4,8,2380,0.0,1984,1984.0,98022,47.2624,-122.015,2030,48000,31.0,1984,2014-12-23
10/28/2014,830000.0,5,3.0,2920,2808,2.0,0.0,0.0,3,8,2140,780.0,1960,1960.0,98103,47.653999999999996,-122.34200000000001,1620,1544,55.0,1960,2014-10-28
7/8/2014,1130000.0,3,2.25,2790,13791,1.0,0.0,3.0,3,8,2790,0.0,2006,2006.0,98166,47.4389,-122.351,2720,12600,9.0,2006,2014-07-08
7/7/2014,320000.0,3,1.0,1560,7552,1.0,0.0,0.0,4,6,910,650.0,1948,1948.0,98155,47.7552,-122.32700000000001,1200,8152,67.0,1948,2014-07-07
4/14/2015,260000.0,2,1.0,1550,15250,1.5,0.0,0.0,5,7,1550,0.0,1920,1920.0,98038,47.407,-122.045,1520,34929,95.0,1920,2015-04-14
6/26/2014,225000.0,3,2.0,1700,11475,1.0,0.0,0.0,5,6,970,730.0,1945,1945.0,98146,47.4851,-122.338,1560,11475,70.0,1945,2014-06-26
9/17/2014,279200.0,1,1.0,640,6350,1.0,0.0,0.0,3,5,640,0.0,1939,1939.0,98117,47.6976,-122.359,1270,6350,76.0,1939,2014-09-17
5/20/2014,520000.0,4,3.5,2680,10000,2.0,0.0,0.0,3,8,2040,640.0,1942,2014.0,98125,47.726000000000006,-122.296,1530,8000,1.0,2014,2014-05-20
6/25/2014,505000.0,3,2.5,1860,8060,2.0,0.0,0.0,4,8,1860,0.0,1987,1987.0,98029,47.5674,-122.01700000000001,1850,4661,28.0,1987,2014-06-25
5/6/2014,234000.0,3,1.75,1490,8366,1.0,0.0,0.0,4,7,1010,480.0,1975,1975.0,98042,47.375,-122.14,1490,7469,40.0,1975,2014-05-06
9/29/2014,503000.0,4,2.5,2470,5044,2.0,0.0,0.0,3,9,2470,0.0,2005,2005.0,98155,47.7728,-122.271,2790,5583,10.0,2005,2014-09-29
8/6/2014,606000.0,4,2.25,2390,8858,1.0,0.0,0.0,4,8,1740,650.0,1979,1979.0,98033,47.6925,-122.184,2240,8858,36.0,1979,2014-08-06
7/23/2014,433500.0,3,1.0,1230,6000,1.0,0.0,0.0,4,7,780,450.0,1937,1937.0,98115,47.6839,-122.281,1570,5000,78.0,1937,2014-07-23
1/23/2015,250000.0,3,1.5,2840,10182,1.0,0.0,0.0,3,8,1510,1330.0,1951,1951.0,98056,47.523999999999994,-122.2,2210,9669,64.0,1951,2015-01-23
8/5/2014,719000.0,3,2.5,2120,9307,2.0,0.0,0.0,4,9,2120,0.0,1984,1984.0,98006,47.5477,-122.141,2290,11524,31.0,1984,2014-08-05
12/10/2014,381000.0,3,2.0,1770,14400,1.0,0.0,0.0,4,8,1770,0.0,1959,1959.0,98166,47.415,-122.337,1900,14400,56.0,1959,2014-12-10
5/28/2014,267000.0,3,2.5,2495,4400,2.0,0.0,0.0,3,8,2495,0.0,2007,2007.0,98001,47.288000000000004,-122.28299999999999,2434,4400,8.0,2007,2014-05-28
5/22/2014,275000.0,1,0.75,1170,14149,1.0,0.0,0.0,5,7,880,290.0,1962,1962.0,98022,47.2653,-121.91,1130,24513,53.0,1962,2014-05-22
5/13/2014,651000.0,4,2.5,2740,7140,2.0,0.0,0.0,3,8,2740,0.0,1993,1993.0,98074,47.6334,-122.021,2260,7035,22.0,1993,2014-05-13
2/4/2015,439000.0,2,1.0,1050,5671,1.0,0.0,0.0,3,7,850,200.0,1949,1949.0,98115,47.6767,-122.286,1850,5243,66.0,1949,2015-02-04
2/14/2015,325000.0,2,1.0,1130,5070,1.0,0.0,0.0,4,7,1130,0.0,1955,1955.0,98146,47.5141,-122.37700000000001,860,6300,60.0,1955,2015-02-14
5/2/2014,490000.0,2,1.0,880,6380,1.0,0.0,0.0,3,7,880,0.0,1938,1994.0,98115,47.6924,-122.322,1340,6380,21.0,1994,2014-05-02
10/7/2014,519900.0,4,2.5,2403,6172,2.0,0.0,0.0,3,9,2403,0.0,1999,1999.0,98028,47.7361,-122.234,2380,6075,16.0,1999,2014-10-07
7/23/2014,545000.0,4,2.75,3410,35040,2.0,0.0,0.0,3,9,3410,0.0,1984,1984.0,98038,47.4054,-122.03,2580,37263,31.0,1984,2014-07-23
7/14/2014,1060000.0,4,4.0,5320,20041,2.0,0.0,0.0,3,11,5320,0.0,2003,2003.0,98075,47.5852,-121.96600000000001,4640,17268,12.0,2003,2014-07-14
5/14/2014,542000.0,4,1.75,1900,8250,1.0,0.0,0.0,4,7,950,950.0,1955,1955.0,98006,47.5765,-122.147,1480,8360,60.0,1955,2014-05-14
12/8/2014,465000.0,4,1.75,1810,21650,2.0,0.0,0.0,4,7,1810,0.0,1961,1961.0,98077,47.7358,-122.07600000000001,2700,29680,54.0,1961,2014-12-08
3/31/2015,408000.0,2,2.0,1200,3900,1.0,0.0,0.0,3,8,1200,0.0,2006,2006.0,98053,47.72,-122.024,1440,5580,9.0,2006,2015-03-31
12/4/2014,292000.0,4,2.5,2060,5950,2.0,0.0,0.0,3,8,2060,0.0,2000,2000.0,98030,47.3631,-122.19200000000001,2242,6406,15.0,2000,2014-12-04
5/7/2014,253000.0,3,1.75,1250,10122,1.0,0.0,0.0,3,7,1250,0.0,1994,1994.0,98010,47.3277,-122.001,1980,10175,21.0,1994,2014-05-07
9/5/2014,280000.0,2,1.0,910,4662,1.0,0.0,0.0,5,6,910,0.0,1942,1942.0,98106,47.5232,-122.354,890,6050,73.0,1942,2014-09-05
6/4/2014,658588.0,3,2.25,2560,41346,2.0,0.0,0.0,3,10,2560,0.0,1986,1986.0,98027,47.4871,-122.065,3040,35395,29.0,1986,2014-06-04
12/16/2014,635000.0,4,2.25,1920,8910,1.0,0.0,0.0,4,8,1200,720.0,1969,1969.0,98005,47.5897,-122.156,2250,8800,46.0,1969,2014-12-16
10/9/2014,439000.0,4,2.25,2240,8300,2.0,0.0,0.0,3,8,2240,0.0,1978,1978.0,98011,47.7746,-122.197,2340,8500,37.0,1978,2014-10-09
8/6/2014,300000.0,3,2.5,1260,3855,2.0,0.0,0.0,3,8,1260,0.0,1999,1999.0,98059,47.4908,-122.154,1310,3344,16.0,1999,2014-08-06
2/5/2015,345000.0,3,1.5,1360,13496,1.0,0.0,0.0,4,8,1360,0.0,1960,1960.0,98198,47.4032,-122.314,1900,10538,55.0,1960,2015-02-05
8/12/2014,283500.0,4,2.25,2100,8050,2.0,0.0,0.0,3,8,2100,0.0,1978,1978.0,98055,47.4391,-122.193,2190,7700,37.0,1978,2014-08-12
9/24/2014,425000.0,2,1.0,2110,4920,1.5,0.0,0.0,3,7,1460,650.0,1911,1911.0,98103,47.6872,-122.339,1390,4732,104.0,1911,2014-09-24
3/19/2015,685000.0,3,1.75,2210,8955,1.0,0.0,1.0,3,8,1560,650.0,1974,1974.0,98033,47.6621,-122.189,2210,8976,41.0,1974,2015-03-19
4/21/2015,750000.0,3,2.5,2360,12987,2.0,0.0,0.0,3,8,2360,0.0,1983,1983.0,98006,47.5471,-122.149,2480,11665,32.0,1983,2015-04-21
4/16/2015,245000.0,4,1.5,1280,8000,1.0,0.0,0.0,3,6,1280,0.0,1960,1960.0,98178,47.4949,-122.255,1420,8211,55.0,1960,2015-04-16
4/3/2015,585444.0,6,3.75,2740,6924,1.0,0.0,2.0,3,7,1640,1100.0,1962,1962.0,98144,47.5816,-122.296,1940,6000,53.0,1962,2015-04-03
9/17/2014,706000.0,4,2.5,2740,7571,2.0,0.0,0.0,3,9,2740,0.0,2009,2009.0,98033,47.6962,-122.179,2880,7203,6.0,2009,2014-09-17
8/1/2014,445000.0,4,2.0,2630,9099,1.5,0.0,0.0,3,7,1830,800.0,1944,1944.0,98146,47.5067,-122.361,1430,6825,71.0,1944,2014-08-01
2/19/2015,241000.0,3,2.0,1650,6000,1.0,0.0,0.0,3,7,1650,0.0,1990,1990.0,98023,47.2904,-122.353,1870,6000,25.0,1990,2015-02-19
5/3/2015,1180000.0,2,2.5,1770,7155,2.0,1.0,4.0,3,8,1770,0.0,1957,1957.0,98155,47.7345,-122.285,2410,10476,58.0,1957,2015-05-03
2/6/2015,530000.0,3,1.0,1500,5750,1.5,0.0,0.0,4,7,1050,450.0,1927,1927.0,98126,47.5677,-122.376,1500,5060,88.0,1927,2015-02-06
3/2/2015,350000.0,3,1.5,1430,12199,1.0,0.0,0.0,3,7,1130,300.0,1948,1948.0,98133,47.7352,-122.33,1490,8196,67.0,1948,2015-03-02
4/15/2015,1700000.0,4,3.75,3190,17186,2.0,1.0,4.0,3,10,3190,0.0,1999,1999.0,98178,47.5115,-122.24600000000001,2290,13496,16.0,1999,2015-04-15
4/28/2015,389000.0,3,1.0,1280,9630,1.0,0.0,0.0,3,7,1280,0.0,1968,1968.0,98072,47.7677,-122.163,1300,9453,47.0,1968,2015-04-28
11/5/2014,799000.0,4,2.75,2390,6820,2.0,0.0,0.0,4,7,2140,250.0,1945,1945.0,98115,47.6788,-122.27,1980,6820,70.0,1945,2014-11-05
8/4/2014,1400000.0,4,2.5,4040,9630,1.0,0.0,3.0,4,9,2020,2020.0,1951,1951.0,98199,47.6408,-122.41,3160,8025,64.0,1951,2014-08-04
12/29/2014,340895.0,2,1.0,920,8612,1.0,0.0,0.0,5,7,920,0.0,1947,1947.0,98155,47.733999999999995,-122.301,1500,7956,68.0,1947,2014-12-29
5/5/2014,780000.0,4,2.5,2730,10281,2.0,0.0,2.0,3,9,2730,0.0,1996,1996.0,98074,47.6227,-122.029,2750,7220,19.0,1996,2014-05-05
12/4/2014,350000.0,2,1.5,1320,73600,1.0,0.0,0.0,3,7,1320,0.0,1993,1993.0,98001,47.2755,-122.271,1320,33600,22.0,1993,2014-12-04
2/17/2015,470000.0,3,2.5,2620,4874,2.0,0.0,0.0,3,7,2620,0.0,1999,1999.0,98065,47.5328,-121.87899999999999,2360,4231,16.0,1999,2015-02-17
1/28/2015,914600.0,4,3.0,3180,80837,2.0,0.0,0.0,3,11,3180,0.0,1985,1985.0,98072,47.7336,-122.134,3180,38715,30.0,1985,2015-01-28
9/23/2014,354000.0,4,2.5,2900,4762,2.0,0.0,0.0,3,8,2900,0.0,2005,2005.0,98042,47.3663,-122.12899999999999,2900,5173,10.0,2005,2014-09-23
2/26/2015,470000.0,5,2.0,1900,6000,1.5,0.0,0.0,4,6,1900,0.0,1920,1920.0,98033,47.6831,-122.186,2110,8400,95.0,1920,2015-02-26
7/30/2014,715000.0,3,2.0,1760,5400,1.0,0.0,0.0,5,7,1160,600.0,1927,1927.0,98103,47.6558,-122.331,1640,5400,88.0,1927,2014-07-30
10/7/2014,265000.0,2,1.0,760,4000,1.0,0.0,0.0,4,6,760,0.0,1950,1950.0,98108,47.5466,-122.304,1640,4500,65.0,1950,2014-10-07
3/30/2015,2540000.0,4,3.0,3710,20000,2.0,0.0,2.0,5,10,2760,950.0,1936,1936.0,98105,47.6696,-122.26100000000001,3970,20000,79.0,1936,2015-03-30
8/15/2014,640000.0,3,1.0,1530,4944,1.0,0.0,0.0,3,7,1530,0.0,1950,1950.0,98103,47.6857,-122.34100000000001,1500,4944,65.0,1950,2014-08-15
11/20/2014,290000.0,4,1.75,1990,18900,2.0,0.0,0.0,4,7,1870,120.0,1929,1929.0,98168,47.5131,-122.31299999999999,1710,12400,86.0,1929,2014-11-20
5/13/2014,480000.0,5,4.75,3830,35000,1.0,0.0,0.0,3,8,2130,1700.0,1976,1976.0,98077,47.7597,-122.079,2750,36150,39.0,1976,2014-05-13
8/26/2014,535000.0,3,2.0,2040,5600,1.0,0.0,1.0,5,7,1120,920.0,1954,1954.0,98144,47.5959,-122.29299999999999,2120,4958,61.0,1954,2014-08-26
8/29/2014,907000.0,3,1.75,2170,12220,1.0,0.0,0.0,5,8,2170,0.0,1965,1965.0,98033,47.6537,-122.195,1980,9000,50.0,1965,2014-08-29
6/1/2014,459000.0,3,1.75,1620,7330,1.0,0.0,0.0,4,7,1090,530.0,1974,1974.0,98034,47.7148,-122.213,1380,7191,41.0,1974,2014-06-01
4/24/2015,1360000.0,3,2.5,3600,21399,1.0,0.0,3.0,3,9,2310,1290.0,1950,2007.0,98008,47.6191,-122.09899999999999,2830,17559,8.0,2007,2015-04-24
3/5/2015,264950.0,3,1.5,1470,11599,1.0,0.0,0.0,3,7,1070,400.0,1967,1967.0,98030,47.3632,-122.18799999999999,1580,9760,48.0,1967,2015-03-05
11/7/2014,352950.0,3,1.0,1760,3000,1.5,0.0,0.0,1,6,1760,0.0,1900,1900.0,98103,47.6598,-122.348,1320,1266,115.0,1900,2014-11-07
8/22/2014,491500.0,3,2.25,2230,13100,1.0,0.0,0.0,4,8,1510,720.0,1974,1974.0,98006,47.5413,-122.17399999999999,2010,10650,41.0,1974,2014-08-22
6/25/2014,1230000.0,4,3.5,3770,37034,2.0,0.0,0.0,3,10,2830,940.0,1989,1989.0,98007,47.6463,-122.15100000000001,3200,36342,26.0,1989,2014-06-25
4/6/2015,369500.0,3,1.0,1200,9194,1.0,0.0,0.0,4,7,1200,0.0,1952,1952.0,98155,47.7362,-122.319,1330,8650,63.0,1952,2015-04-06
3/18/2015,566000.0,3,2.5,2090,6294,2.0,0.0,0.0,3,9,2090,0.0,2004,2004.0,98052,47.68600000000001,-122.095,2520,5735,11.0,2004,2015-03-18
8/25/2014,290000.0,3,2.25,1500,7308,1.0,0.0,0.0,4,7,1210,290.0,1968,1968.0,98055,47.4621,-122.18700000000001,1480,7400,47.0,1968,2014-08-25
4/13/2015,5350000.0,5,5.0,8000,23985,2.0,0.0,4.0,3,12,6720,1280.0,2009,2009.0,98004,47.6232,-122.22,4600,21750,6.0,2009,2015-04-13
5/22/2014,180000.0,3,1.0,870,5330,1.0,0.0,0.0,3,6,870,0.0,1969,1969.0,98042,47.369,-122.07700000000001,840,5200,46.0,1969,2014-05-22
8/12/2014,215000.0,2,1.0,1010,6000,1.0,0.0,0.0,4,6,1010,0.0,1944,1944.0,98133,47.771,-122.353,1610,7313,71.0,1944,2014-08-12
2/12/2015,302000.0,2,1.0,1010,6000,1.0,0.0,0.0,4,6,1010,0.0,1944,1944.0,98133,47.771,-122.353,1610,7313,71.0,1944,2015-02-12
4/10/2015,352500.0,3,1.75,1860,7881,1.0,0.0,0.0,3,7,1160,700.0,1986,1986.0,98198,47.3855,-122.322,1490,7527,29.0,1986,2015-04-10
6/26/2014,235867.0,4,2.0,1330,5926,1.0,0.0,0.0,4,5,1330,0.0,1942,1942.0,98056,47.496,-122.19,1150,5485,73.0,1942,2014-06-26
7/17/2014,500000.0,3,2.25,1760,11946,2.0,0.0,0.0,3,8,1760,0.0,1978,1978.0,98074,47.623999999999995,-122.05,2080,12068,37.0,1978,2014-07-17
3/26/2015,382000.0,3,2.25,1800,4500,2.0,0.0,0.0,3,7,1800,0.0,1995,1995.0,98019,47.7462,-121.98,1760,6589,20.0,1995,2015-03-26
4/22/2015,515000.0,5,2.5,1690,2402,1.5,0.0,0.0,3,7,990,700.0,1930,1930.0,98117,47.6903,-122.38,1200,4005,85.0,1930,2015-04-22
5/1/2015,250000.0,1,1.0,660,2600,1.0,0.0,0.0,3,6,660,0.0,1919,1919.0,98144,47.5723,-122.304,1560,5445,96.0,1919,2015-05-01
6/27/2014,672500.0,3,2.25,2400,5300,1.5,0.0,0.0,4,7,1250,1150.0,1939,1939.0,98117,47.6876,-122.384,1540,4800,76.0,1939,2014-06-27
10/22/2014,755000.0,3,2.25,3020,13031,2.0,0.0,0.0,3,9,3020,0.0,1989,1989.0,98052,47.6897,-122.098,2480,10204,26.0,1989,2014-10-22
3/20/2015,707500.0,3,1.0,1500,2555,2.0,0.0,2.0,3,7,1500,0.0,1910,1910.0,98109,47.626999999999995,-122.353,1820,2555,105.0,1910,2015-03-20
8/26/2014,459000.0,4,2.0,1560,3840,1.0,0.0,0.0,4,6,960,600.0,1924,1924.0,98117,47.6882,-122.365,1560,4800,91.0,1924,2014-08-26
2/4/2015,140000.0,3,1.0,1090,10620,1.5,0.0,0.0,3,7,1090,0.0,1959,1959.0,98032,47.3748,-122.294,1380,10620,56.0,1959,2015-02-04
8/11/2014,495000.0,2,1.0,970,4284,1.0,0.0,0.0,3,7,970,0.0,1905,1905.0,98103,47.6667,-122.333,2050,4284,110.0,1905,2014-08-11
5/13/2014,757000.0,3,3.25,3190,5283,2.0,0.0,0.0,3,9,3190,0.0,2007,2007.0,98029,47.5534,-122.00200000000001,2950,5198,8.0,2007,2014-05-13
1/7/2015,765000.0,3,3.25,3190,5283,2.0,0.0,0.0,3,9,3190,0.0,2007,2007.0,98029,47.5534,-122.00200000000001,2950,5198,8.0,2007,2015-01-07
9/19/2014,359000.0,4,1.5,1890,6052,1.0,0.0,0.0,4,7,1890,0.0,1955,1955.0,98125,47.7055,-122.3,1510,6072,60.0,1955,2014-09-19
6/5/2014,440000.0,3,1.0,1050,7500,1.0,0.0,0.0,3,6,1050,0.0,1900,1900.0,98136,47.5473,-122.396,1380,7500,115.0,1900,2014-06-05
5/29/2014,400000.0,4,1.5,1390,7200,1.0,0.0,0.0,3,7,1140,250.0,1965,1965.0,98133,47.7224,-122.33200000000001,1630,7702,50.0,1965,2014-05-29
3/25/2015,652000.0,3,2.0,1700,4080,1.0,0.0,0.0,4,7,850,850.0,1941,1941.0,98117,47.6785,-122.39299999999999,1480,5100,74.0,1941,2015-03-25
5/30/2014,260000.0,3,1.75,1050,5850,1.0,0.0,0.0,3,7,1050,0.0,1980,1980.0,98166,47.4574,-122.35799999999999,1220,8880,35.0,1980,2014-05-30
4/20/2015,1330000.0,5,3.0,3340,10796,1.0,0.0,2.0,3,9,2120,1220.0,1964,1990.0,98040,47.5421,-122.229,3290,12955,25.0,1990,2015-04-20
2/20/2015,519500.0,4,2.0,1540,17859,1.0,0.0,0.0,3,6,1540,0.0,1964,1964.0,98027,47.5326,-122.03200000000001,1390,9688,51.0,1964,2015-02-20
10/27/2014,650000.0,3,1.0,1710,5992,1.5,0.0,0.0,4,7,1560,150.0,1928,1928.0,98103,47.6861,-122.354,1240,3001,87.0,1928,2014-10-27
3/24/2015,280000.0,4,2.25,2100,8075,2.0,0.0,0.0,3,8,2100,0.0,1978,1978.0,98003,47.3251,-122.329,2100,7464,37.0,1978,2015-03-24
9/10/2014,515000.0,4,1.75,1730,7980,1.0,0.0,0.0,4,8,1730,0.0,1965,1965.0,98007,47.6219,-122.13799999999999,2080,8400,50.0,1965,2014-09-10
3/18/2015,400000.0,3,2.25,1500,2692,2.0,0.0,0.0,3,7,1500,0.0,1986,1986.0,98034,47.7159,-122.20299999999999,1470,2418,29.0,1986,2015-03-18
4/14/2015,652100.0,3,2.5,2380,5017,2.0,0.0,0.0,3,9,2380,0.0,2003,2003.0,98074,47.6297,-122.021,2670,6066,12.0,2003,2015-04-14
6/23/2014,235000.0,6,3.0,2180,7956,2.0,0.0,0.0,3,7,2180,0.0,1980,1980.0,98003,47.3054,-122.305,2214,7684,35.0,1980,2014-06-23
4/8/2015,701000.0,4,1.5,1840,10080,2.0,0.0,0.0,3,8,1840,0.0,1907,1907.0,98118,47.5575,-122.279,1830,5040,108.0,1907,2015-04-08
6/24/2014,640000.0,4,2.5,2341,9594,2.0,0.0,0.0,3,9,2341,0.0,1997,1997.0,98052,47.6993,-122.115,2850,9421,18.0,1997,2014-06-24
7/28/2014,455800.0,3,2.5,1690,4584,2.0,0.0,0.0,3,7,1690,0.0,2002,2002.0,98053,47.6866,-122.04299999999999,1600,3164,13.0,2002,2014-07-28
12/18/2014,504750.0,3,2.5,2490,21937,2.0,0.0,0.0,3,8,2490,0.0,1993,1993.0,98014,47.6442,-121.898,2450,21937,22.0,1993,2014-12-18
7/11/2014,483000.0,3,3.0,2440,15540,2.0,0.0,0.0,3,9,2440,0.0,1992,1992.0,98074,47.6104,-122.06,2440,15283,23.0,1992,2014-07-11
12/30/2014,530000.0,3,0.75,920,20412,1.0,0.0,2.0,5,6,920,0.0,1950,1950.0,98070,47.4781,-122.49,1162,54705,65.0,1950,2014-12-30
7/11/2014,250000.0,2,1.0,1030,8786,1.0,0.0,0.0,3,6,1030,0.0,1956,1956.0,98146,47.4814,-122.34100000000001,1480,8121,59.0,1956,2014-07-11
9/24/2014,229950.0,5,2.75,2000,5885,1.0,0.0,0.0,3,7,1260,740.0,1994,1994.0,98023,47.3155,-122.34700000000001,1960,6514,21.0,1994,2014-09-24
7/23/2014,884744.0,4,3.5,4210,9414,2.0,0.0,0.0,3,9,4210,0.0,2001,2001.0,98074,47.6067,-122.022,3950,8880,14.0,2001,2014-07-23
4/1/2015,514000.0,3,1.5,1610,9964,1.0,0.0,0.0,3,7,1080,530.0,1977,1977.0,98052,47.6681,-122.14299999999999,1610,9964,38.0,1977,2015-04-01
5/6/2015,532000.0,3,2.25,1910,35015,1.0,0.0,0.0,4,8,1430,480.0,1977,1977.0,98027,47.4672,-122.006,2340,36680,38.0,1977,2015-05-06
9/11/2014,423000.0,4,2.5,2660,5539,2.0,0.0,0.0,3,8,2660,0.0,2004,2004.0,98059,47.4981,-122.162,2380,5539,11.0,2004,2014-09-11
8/26/2014,420000.0,2,1.0,820,4025,1.0,0.0,2.0,5,6,820,0.0,1922,1922.0,98126,47.5649,-122.38,1410,5750,93.0,1922,2014-08-26
11/10/2014,521000.0,3,1.75,1730,18250,1.0,0.0,0.0,3,8,1730,0.0,1988,1988.0,98011,47.736999999999995,-122.20100000000001,2180,10027,27.0,1988,2014-11-10
2/5/2015,577000.0,4,2.25,2360,7490,2.0,0.0,0.0,3,8,2360,0.0,1979,1979.0,98033,47.6988,-122.169,2360,7490,36.0,1979,2015-02-05
9/29/2014,425000.0,3,1.0,970,8040,1.0,0.0,0.0,3,7,970,0.0,1956,1956.0,98007,47.603,-122.132,1250,7000,59.0,1956,2014-09-29
10/31/2014,495000.0,4,2.5,2460,4862,2.0,0.0,0.0,3,8,2460,0.0,2004,2004.0,98028,47.7719,-122.235,2900,4895,11.0,2004,2014-10-31
10/1/2014,340000.0,3,2.5,2690,8577,2.0,0.0,0.0,3,9,2690,0.0,1987,1987.0,98023,47.3026,-122.351,2570,8066,28.0,1987,2014-10-01
9/23/2014,499950.0,3,3.5,1820,1991,2.0,0.0,0.0,3,8,1430,390.0,2014,2014.0,98144,47.596000000000004,-122.29799999999999,1550,1460,1.0,2014,2014-09-23
3/16/2015,1220000.0,4,3.0,3470,4750,2.0,0.0,2.0,3,9,2370,1100.0,2014,2014.0,98116,47.5917,-122.38600000000001,2420,4761,1.0,2014,2015-03-16
2/27/2015,720000.0,4,2.75,3370,7634,1.0,0.0,2.0,5,8,2110,1260.0,1977,1977.0,98056,47.5259,-122.204,2460,7634,38.0,1977,2015-02-27
3/12/2015,249000.0,3,1.5,1700,8247,1.0,0.0,0.0,3,7,1010,690.0,1970,1970.0,98031,47.4216,-122.17399999999999,1440,8400,45.0,1970,2015-03-12
6/13/2014,206135.0,3,1.0,1340,11070,1.0,0.0,0.0,4,7,1340,0.0,1978,1978.0,98030,47.3527,-122.178,1650,7630,37.0,1978,2014-06-13
10/6/2014,300000.0,5,2.75,2000,9276,2.0,0.0,0.0,4,7,2000,0.0,1968,1968.0,98055,47.443999999999996,-122.19,1240,8270,47.0,1968,2014-10-06
3/18/2015,612000.0,6,3.0,3840,14040,1.5,0.0,3.0,3,8,2460,1380.0,1949,1949.0,98178,47.506,-122.241,2170,6765,66.0,1949,2015-03-18
11/6/2014,1100000.0,5,2.5,3890,27311,2.0,0.0,2.0,3,10,3890,0.0,1950,1990.0,98177,47.7291,-122.363,3160,22641,25.0,1990,2014-11-06
2/24/2015,230000.0,4,2.0,1220,9100,1.5,0.0,0.0,4,7,1220,0.0,1970,1970.0,98023,47.2964,-122.376,1160,7700,45.0,1970,2015-02-24
5/4/2015,850000.0,3,1.0,2280,4600,1.0,0.0,2.0,3,8,1250,1030.0,1936,1936.0,98119,47.6378,-122.37200000000001,1910,4000,79.0,1936,2015-05-04
9/25/2014,355000.0,4,2.5,2770,7000,1.0,0.0,0.0,4,7,1940,830.0,1979,1979.0,98001,47.3396,-122.256,2140,7684,36.0,1979,2014-09-25
6/23/2014,442000.0,4,2.5,2520,7253,2.0,0.0,0.0,3,9,2520,0.0,1990,1990.0,98059,47.5148,-122.15899999999999,2570,8359,25.0,1990,2014-06-23
6/26/2014,399000.0,4,3.0,3060,5000,2.0,0.0,0.0,3,8,3060,0.0,2001,2001.0,98042,47.3786,-122.126,3060,5668,14.0,2001,2014-06-26
11/6/2014,360000.0,4,2.5,2390,7115,2.0,0.0,0.0,3,9,2390,0.0,1999,1999.0,98092,47.2593,-122.22200000000001,2600,7916,16.0,1999,2014-11-06
2/13/2015,390000.0,3,1.75,1320,7725,1.0,0.0,0.0,3,8,1320,0.0,1978,1978.0,98058,47.4425,-122.133,2020,7210,37.0,1978,2015-02-13
3/18/2015,413000.0,5,2.5,2900,8711,1.0,0.0,0.0,3,8,1650,1250.0,1977,1977.0,98011,47.7752,-122.197,2340,8869,38.0,1977,2015-03-18
2/11/2015,190000.0,2,1.0,700,9500,1.0,0.0,0.0,3,6,700,0.0,1951,1951.0,98118,47.5294,-122.27600000000001,1020,5617,64.0,1951,2015-02-11
10/13/2014,432900.0,3,2.5,2210,9226,2.0,0.0,0.0,3,8,2210,0.0,1998,1998.0,98045,47.4849,-121.78200000000001,2430,8902,17.0,1998,2014-10-13
5/28/2014,621138.0,3,2.25,2180,7741,2.0,0.0,0.0,3,9,2180,0.0,1986,1986.0,98074,47.6482,-122.072,2300,8581,29.0,1986,2014-05-28
6/4/2014,270000.0,3,2.25,2080,4252,1.5,0.0,0.0,3,7,1550,530.0,2003,2003.0,98042,47.4203,-122.15700000000001,2080,2275,12.0,2003,2014-06-04
1/9/2015,610000.0,4,2.25,2090,35040,1.0,0.0,0.0,3,8,1490,600.0,1980,1980.0,98075,47.5739,-122.03200000000001,2910,21132,35.0,1980,2015-01-09
6/2/2014,500000.0,3,2.0,1720,5525,1.0,0.0,2.0,5,7,960,760.0,1941,1941.0,98108,47.559,-122.29799999999999,1760,5525,74.0,1941,2014-06-02
8/7/2014,715000.0,4,2.25,2460,40635,1.0,0.0,0.0,5,8,2460,0.0,1968,1968.0,98053,47.6627,-122.03200000000001,2250,40635,47.0,1968,2014-08-07
5/29/2014,264000.0,3,1.5,1470,14821,1.0,0.0,0.0,4,7,1470,0.0,1958,1958.0,98042,47.3658,-122.148,1760,15370,57.0,1958,2014-05-29
8/28/2014,550000.0,3,1.75,1650,3200,1.5,0.0,0.0,3,8,1650,0.0,1901,1901.0,98102,47.6209,-122.31700000000001,1500,2400,114.0,1901,2014-08-28
10/15/2014,337000.0,3,2.0,1690,9087,1.0,0.0,0.0,3,8,1690,0.0,1997,1997.0,98042,47.3724,-122.10799999999999,2090,8100,18.0,1997,2014-10-15
5/13/2015,170000.0,3,1.0,970,8710,1.0,0.0,0.0,4,6,970,0.0,1962,1962.0,98198,47.4167,-122.302,1280,11805,53.0,1962,2015-05-13
8/29/2014,405000.0,4,2.5,2030,9095,1.0,0.0,0.0,4,7,1130,900.0,1972,1972.0,98034,47.7321,-122.185,1940,8000,43.0,1972,2014-08-29
9/11/2014,775000.0,4,2.5,2540,28563,1.0,0.0,0.0,3,10,2540,0.0,1984,1984.0,98052,47.7185,-122.11399999999999,2790,20301,31.0,1984,2014-09-11
8/25/2014,425000.0,3,2.25,1570,7475,1.0,0.0,0.0,4,7,1200,370.0,1983,1983.0,98034,47.7223,-122.17399999999999,1700,7230,32.0,1983,2014-08-25
9/22/2014,713000.0,5,2.75,2580,9242,2.0,0.0,2.0,4,8,1720,860.0,1967,1967.0,98007,47.5943,-122.133,2240,9316,48.0,1967,2014-09-22
11/3/2014,555000.0,5,2.5,2090,8712,1.0,0.0,0.0,3,8,1420,670.0,1966,1966.0,98008,47.5968,-122.12700000000001,2490,8712,49.0,1966,2014-11-03
5/6/2015,810000.0,4,2.5,3260,5608,2.0,0.0,0.0,3,9,3260,0.0,2003,2003.0,98029,47.5453,-121.995,3010,5608,12.0,2003,2015-05-06
8/27/2014,1250000.0,4,3.75,3830,41263,2.0,0.0,0.0,4,11,3830,0.0,1990,1990.0,98077,47.7237,-122.042,5600,56568,25.0,1990,2014-08-27
6/24/2014,819000.0,3,3.5,2130,6150,2.0,0.0,2.0,5,8,1530,600.0,1908,1908.0,98199,47.6491,-122.405,2040,5381,107.0,1908,2014-06-24
3/27/2015,409900.0,3,2.5,1690,1200,2.0,0.0,0.0,3,8,1410,280.0,2013,2013.0,98106,47.5389,-122.367,1690,1760,2.0,2013,2015-03-27
6/30/2014,935000.0,2,2.5,1780,2067,2.0,0.0,0.0,5,9,1780,0.0,1974,1974.0,98004,47.6132,-122.21,2320,2067,41.0,1974,2014-06-30
4/20/2015,657500.0,4,1.75,1620,7560,1.0,0.0,3.0,4,7,1380,240.0,1947,1947.0,98117,47.6981,-122.4,2170,8650,68.0,1947,2015-04-20
4/28/2015,900000.0,6,3.75,4210,6105,2.0,0.0,0.0,3,9,3280,930.0,2008,2008.0,98059,47.5211,-122.15700000000001,3820,6368,7.0,2008,2015-04-28
4/2/2015,932800.0,5,3.25,2980,7095,2.5,0.0,0.0,3,9,2980,0.0,1998,2007.0,98115,47.6919,-122.294,1670,7140,8.0,2007,2015-04-02
4/20/2015,391000.0,3,2.0,1490,9000,1.0,0.0,0.0,4,8,1490,0.0,1977,1977.0,98006,47.5455,-122.184,2190,9000,38.0,1977,2015-04-20
12/30/2014,420000.0,4,2.5,2110,9825,2.0,0.0,0.0,3,8,2110,0.0,2000,2000.0,98059,47.4979,-122.15299999999999,1650,9900,15.0,2000,2014-12-30
11/24/2014,1300000.0,6,3.5,6563,32670,2.0,0.0,0.0,3,10,5153,1410.0,2002,2002.0,98005,47.6078,-122.15700000000001,2610,22651,13.0,2002,2014-11-24
4/9/2015,415000.0,3,1.5,1510,16800,1.0,0.0,0.0,5,8,1510,0.0,1956,1956.0,98133,47.75100000000001,-122.338,1560,7276,59.0,1956,2015-04-09
2/25/2015,350000.0,3,1.75,1830,9425,1.0,0.0,0.0,3,8,1590,240.0,1946,1946.0,98146,47.5038,-122.37899999999999,1670,8430,69.0,1946,2015-02-25
6/21/2014,375000.0,2,1.0,1230,1820,2.0,0.0,0.0,4,7,830,400.0,1948,1948.0,98107,47.6684,-122.40100000000001,1660,3056,67.0,1948,2014-06-21
11/17/2014,860000.0,3,1.75,2180,14135,1.0,0.0,2.0,5,8,1300,880.0,1947,1947.0,98033,47.673,-122.18700000000001,3540,10318,68.0,1947,2014-11-17
6/3/2014,495000.0,4,2.25,2220,8872,1.0,0.0,0.0,4,8,1110,1110.0,1961,1961.0,98006,47.5491,-122.17,2220,9106,54.0,1961,2014-06-03
4/14/2015,250000.0,4,2.25,1730,8400,1.0,0.0,0.0,3,7,1730,0.0,1962,1962.0,98001,47.3386,-122.288,1550,7920,53.0,1962,2015-04-14
10/13/2014,365000.0,4,2.25,1990,21312,1.0,0.0,0.0,4,8,1990,0.0,1968,1968.0,98058,47.43899999999999,-122.14399999999999,2400,19210,47.0,1968,2014-10-13
5/7/2014,503000.0,3,2.75,1540,6760,1.0,0.0,0.0,5,7,1210,330.0,1980,1980.0,98034,47.7163,-122.212,1540,7416,35.0,1980,2014-05-07
3/25/2015,150000.0,2,1.0,1100,7200,1.0,0.0,0.0,4,6,1100,0.0,1944,1944.0,98058,47.4752,-122.17200000000001,1390,7200,71.0,1944,2015-03-25
10/8/2014,450000.0,4,1.75,1640,1480,1.0,0.0,0.0,4,7,820,820.0,1912,1912.0,98105,47.6684,-122.314,1420,2342,103.0,1912,2014-10-08
12/8/2014,355000.0,4,3.0,2590,7213,2.0,0.0,0.0,3,8,2590,0.0,2001,2001.0,98001,47.2609,-122.289,2550,6800,14.0,2001,2014-12-08
10/18/2014,245000.0,3,2.0,1450,9333,2.0,0.0,0.0,4,7,1450,0.0,1972,1972.0,98003,47.346000000000004,-122.315,1910,7701,43.0,1972,2014-10-18
7/3/2014,265900.0,3,2.0,1180,7793,1.0,0.0,0.0,4,7,1180,0.0,1992,1992.0,98031,47.4053,-122.181,1720,7793,23.0,1992,2014-07-03
11/25/2014,299000.0,4,2.5,1820,7575,1.0,0.0,0.0,3,7,1220,600.0,1975,1975.0,98058,47.4339,-122.167,1840,7650,40.0,1975,2014-11-25
4/9/2015,957500.0,4,2.25,2360,11523,2.0,0.0,0.0,4,10,2360,0.0,1968,1968.0,98040,47.5318,-122.22399999999999,2850,11362,47.0,1968,2015-04-09
9/8/2014,343000.0,3,1.0,1120,7250,1.0,0.0,0.0,4,7,1120,0.0,1972,1972.0,98034,47.7143,-122.211,1340,7302,43.0,1972,2014-09-08
10/27/2014,307500.0,3,2.25,1646,7364,2.0,0.0,0.0,3,7,1646,0.0,1994,1994.0,98038,47.3646,-122.037,1975,9161,21.0,1994,2014-10-27
1/5/2015,937500.0,5,3.75,4210,14599,2.0,0.0,3.0,3,10,4210,0.0,2004,2004.0,98065,47.5364,-121.85799999999999,3950,13591,11.0,2004,2015-01-05
5/9/2014,610000.0,3,3.0,2480,45302,1.0,0.0,0.0,4,8,1620,860.0,1976,1976.0,98077,47.7591,-122.073,1260,14100,39.0,1976,2014-05-09
9/17/2014,720000.0,3,1.5,1590,7080,1.0,0.0,2.0,3,8,1310,280.0,1952,1952.0,98136,47.5244,-122.38600000000001,2080,7200,63.0,1952,2014-09-17
10/16/2014,610000.0,4,2.0,2130,2620,1.5,0.0,0.0,5,7,1650,0.0,1919,1919.0,98103,47.6515,-122.346,1330,2719,96.0,1919,2014-10-16
3/31/2015,434500.0,3,1.75,1650,7965,1.0,0.0,0.0,4,7,1650,0.0,1967,1967.0,98034,47.7335,-122.193,1560,7350,48.0,1967,2015-03-31
5/12/2015,602500.0,2,2.5,3090,47044,1.0,0.0,0.0,4,10,2250,840.0,1979,1979.0,98058,47.4291,-122.177,1860,62829,36.0,1979,2015-05-12
11/18/2014,607010.0,4,2.5,2180,4000,2.0,0.0,0.0,3,8,1700,480.0,2002,2002.0,98118,47.5553,-122.26899999999999,2180,4000,13.0,2002,2014-11-18
2/4/2015,610000.0,3,1.0,1800,5750,1.0,0.0,0.0,3,7,1040,760.0,1947,1947.0,98117,47.68600000000001,-122.395,1320,5625,68.0,1947,2015-02-04
9/19/2014,828500.0,4,2.5,3720,35000,2.0,0.0,0.0,3,10,3720,0.0,1983,1983.0,98072,47.7582,-122.13,3720,35000,32.0,1983,2014-09-19
7/7/2014,199990.0,3,1.0,1100,8560,1.0,0.0,0.0,3,6,1100,0.0,1961,1961.0,98023,47.32899999999999,-122.338,1120,8470,54.0,1961,2014-07-07
4/1/2015,294000.0,3,1.75,1530,9362,1.0,0.0,0.0,3,7,1530,0.0,1987,1987.0,98038,47.3643,-122.04899999999999,1480,8125,28.0,1987,2015-04-01
6/12/2014,789500.0,4,2.5,3010,6100,2.0,0.0,0.0,3,9,3010,0.0,2005,2005.0,98052,47.6647,-122.08,2890,5176,10.0,2005,2014-06-12
2/12/2015,797000.0,3,3.5,3500,9473,2.0,0.0,0.0,3,10,3500,0.0,2008,2008.0,98075,47.5807,-121.97200000000001,3510,7833,7.0,2008,2015-02-12
8/18/2014,539950.0,5,3.0,3100,5250,2.0,0.0,0.0,3,7,3100,0.0,2006,2006.0,98065,47.5369,-121.88799999999999,2460,5250,9.0,2006,2014-08-18
3/23/2015,284950.0,4,1.5,2000,6778,1.0,0.0,0.0,4,7,1170,830.0,1962,1962.0,98198,47.3708,-122.311,1940,7531,53.0,1962,2015-03-23
4/29/2015,776500.0,4,1.5,2290,10372,1.0,0.0,0.0,3,7,1510,780.0,1965,1987.0,98033,47.6888,-122.199,1900,8109,28.0,1987,2015-04-29
4/24/2015,525000.0,4,2.5,2400,10070,1.0,0.0,0.0,3,7,1510,890.0,1967,1967.0,98034,47.7104,-122.24,2030,9964,48.0,1967,2015-04-24
4/25/2015,303000.0,3,2.5,1850,4957,2.0,0.0,0.0,3,8,1850,0.0,1999,1999.0,98092,47.3311,-122.17,2400,6367,16.0,1999,2015-04-25
3/10/2015,722080.0,3,3.25,3680,7650,2.0,0.0,0.0,3,9,2340,1340.0,1988,1988.0,98074,47.6272,-122.03299999999999,2280,8515,27.0,1988,2015-03-10
6/27/2014,140000.0,3,1.0,1060,7473,1.0,0.0,0.0,3,7,1060,0.0,1959,1959.0,98198,47.3699,-122.309,1320,7912,56.0,1959,2014-06-27
4/1/2015,235000.0,3,1.0,1060,7473,1.0,0.0,0.0,3,7,1060,0.0,1959,1959.0,98198,47.3699,-122.309,1320,7912,56.0,1959,2015-04-01
11/20/2014,440000.0,3,1.0,1610,5500,1.5,0.0,0.0,3,7,1610,0.0,1903,1903.0,98103,47.698,-122.351,1200,5701,112.0,1903,2014-11-20
7/18/2014,605000.0,3,1.75,2330,6000,1.5,0.0,0.0,4,7,1630,700.0,1940,1940.0,98126,47.5765,-122.37799999999999,1600,4000,75.0,1940,2014-07-18
6/2/2014,380000.0,2,1.0,1210,4800,1.0,0.0,0.0,3,8,1060,150.0,1950,1950.0,98108,47.5625,-122.316,1380,4800,65.0,1950,2014-06-02
6/25/2014,352000.0,4,1.0,1530,8890,1.0,0.0,0.0,3,7,980,550.0,1925,1925.0,98106,47.5308,-122.35,1100,5203,90.0,1925,2014-06-25
4/13/2015,420000.0,4,2.25,2270,12000,1.0,0.0,0.0,4,7,1360,910.0,1979,1979.0,98072,47.7559,-122.148,2500,10120,36.0,1979,2015-04-13
4/30/2015,1180000.0,4,2.0,2590,7220,2.0,0.0,2.0,4,10,2590,0.0,1930,1930.0,98199,47.647,-122.41,2530,6380,85.0,1930,2015-04-30
10/22/2014,1380000.0,3,1.5,1850,10572,1.0,0.0,0.0,4,8,1850,0.0,1953,1953.0,98004,47.6194,-122.208,3030,12752,62.0,1953,2014-10-22
9/26/2014,300000.0,3,1.5,1500,14750,1.5,0.0,0.0,4,6,1500,0.0,1933,1933.0,98168,47.495,-122.318,1270,15100,82.0,1933,2014-09-26
11/12/2014,1150000.0,4,3.25,4740,49091,2.0,0.0,0.0,3,11,4740,0.0,1990,1990.0,98053,47.6624,-122.071,4800,42387,25.0,1990,2014-11-12
10/13/2014,453500.0,2,1.5,1710,4189,1.0,0.0,1.0,5,7,1160,550.0,1951,1951.0,98136,47.5286,-122.383,1530,5608,64.0,1951,2014-10-13
10/14/2014,443500.0,3,2.0,1920,7598,1.0,0.0,0.0,4,8,1920,0.0,1972,1972.0,98177,47.7735,-122.363,2220,7598,43.0,1972,2014-10-14
3/26/2015,332000.0,2,1.0,1150,8138,1.0,0.0,0.0,3,7,1150,0.0,1954,1954.0,98155,47.736999999999995,-122.325,1300,8139,61.0,1954,2015-03-26
3/27/2015,655000.0,3,2.5,2320,4721,2.0,0.0,0.0,3,8,2320,0.0,2004,2004.0,98075,47.591,-122.01700000000001,2250,4356,11.0,2004,2015-03-27
9/3/2014,475000.0,4,1.0,1420,6000,1.5,0.0,0.0,3,7,1420,0.0,1950,1950.0,98115,47.6844,-122.302,1420,6180,65.0,1950,2014-09-03
10/24/2014,372500.0,3,1.75,1550,12956,1.0,0.0,0.0,3,7,1210,340.0,1988,1988.0,98045,47.4711,-121.75200000000001,1630,15360,27.0,1988,2014-10-24
5/27/2014,1050000.0,4,2.5,2920,7200,1.0,0.0,3.0,3,8,1470,1450.0,1921,2006.0,98144,47.5947,-122.288,3210,6825,9.0,2006,2014-05-27
6/3/2014,500000.0,3,1.75,1620,4200,1.0,0.0,0.0,5,7,830,790.0,1945,1945.0,98115,47.6743,-122.285,1580,5000,70.0,1945,2014-06-03
5/28/2014,900000.0,6,2.75,2300,24773,1.5,0.0,0.0,4,9,2300,0.0,1950,1985.0,98040,47.5833,-122.242,2720,11740,30.0,1985,2014-05-28
6/4/2014,327500.0,3,1.0,1070,7140,1.0,0.0,0.0,3,7,1070,0.0,1989,1989.0,98118,47.5427,-122.288,1390,2374,26.0,1989,2014-06-04
4/6/2015,390000.0,3,1.75,1790,7123,1.0,0.0,0.0,3,7,1790,0.0,1913,1913.0,98019,47.7429,-121.98100000000001,1660,8128,102.0,1913,2015-04-06
1/13/2015,451101.0,2,1.5,1510,1962,2.0,0.0,0.0,4,8,1510,0.0,1985,1985.0,98007,47.6214,-122.15299999999999,1510,2182,30.0,1985,2015-01-13
10/14/2014,455000.0,4,1.0,1340,5800,1.5,0.0,2.0,3,7,1340,0.0,1914,1914.0,98116,47.5658,-122.389,1900,5800,101.0,1914,2014-10-14
7/1/2014,650000.0,4,2.5,3350,46748,2.0,0.0,0.0,3,10,3350,0.0,2004,2004.0,98010,47.3432,-122.025,3350,39683,11.0,2004,2014-07-01
8/6/2014,895000.0,3,2.5,2500,7746,2.0,0.0,0.0,4,10,1910,590.0,1993,1993.0,98112,47.6393,-122.311,2480,5099,22.0,1993,2014-08-06
3/26/2015,800000.0,4,2.25,2350,10664,1.0,0.0,1.0,2,7,1510,0.0,1952,1952.0,98040,47.5743,-122.238,2350,10140,63.0,1952,2015-03-26
11/13/2014,703770.0,4,2.25,2550,12918,2.0,0.0,0.0,3,9,2550,0.0,1987,1987.0,98006,47.5623,-122.109,2550,11036,28.0,1987,2014-11-13
8/14/2014,249950.0,3,1.75,1320,10454,1.0,0.0,0.0,4,7,1320,0.0,1968,1968.0,98002,47.2844,-122.21600000000001,1680,10183,47.0,1968,2014-08-14
4/28/2015,512000.0,2,2.0,1270,3881,1.0,0.0,0.0,4,6,610,660.0,1926,1926.0,98105,47.6694,-122.29799999999999,1370,5000,89.0,1926,2015-04-28
5/6/2015,780000.0,5,2.5,3480,74052,1.0,0.0,0.0,4,8,1980,1500.0,1972,1972.0,98027,47.4961,-122.06299999999999,2610,65775,43.0,1972,2015-05-06
7/16/2014,336000.0,3,2.25,2820,11625,2.0,0.0,0.0,3,8,2820,0.0,1986,1986.0,98092,47.2621,-122.21799999999999,2290,8488,29.0,1986,2014-07-16
8/22/2014,285000.0,3,2.0,2110,6900,1.5,0.0,0.0,5,6,1220,890.0,1955,1955.0,98178,47.504,-122.26,1350,7683,60.0,1955,2014-08-22
10/21/2014,229900.0,3,1.75,1100,7224,1.0,0.0,0.0,3,7,1100,0.0,1981,1981.0,98032,47.3717,-122.277,1700,8447,34.0,1981,2014-10-21
4/15/2015,667500.0,4,3.0,1920,4000,1.5,0.0,0.0,4,8,1540,380.0,1931,1931.0,98116,47.5718,-122.385,1660,4000,84.0,1931,2015-04-15
6/20/2014,378000.0,4,2.5,1890,12236,1.0,0.0,0.0,3,7,1230,660.0,1978,1978.0,98045,47.4491,-121.78,1390,11360,37.0,1978,2014-06-20
9/5/2014,454000.0,3,2.5,2530,43733,2.0,0.0,0.0,3,8,1530,1000.0,1991,1991.0,98045,47.46,-121.708,1730,43548,24.0,1991,2014-09-05
5/8/2014,537500.0,4,2.5,2550,4630,2.0,0.0,0.0,3,7,2550,0.0,2005,2005.0,98075,47.5928,-122.00399999999999,2550,5151,10.0,2005,2014-05-08
9/3/2014,425000.0,3,1.0,1550,4160,1.5,0.0,0.0,4,6,1550,0.0,1926,1926.0,98118,47.5387,-122.265,1590,5000,89.0,1926,2014-09-03
11/24/2014,290000.0,3,2.0,1760,6600,1.0,0.0,0.0,3,7,1760,0.0,1998,1998.0,98030,47.3836,-122.184,2590,6600,17.0,1998,2014-11-24
7/1/2014,349500.0,3,2.0,1270,3600,1.0,0.0,0.0,3,7,1270,0.0,1963,1963.0,98122,47.6099,-122.29700000000001,1660,3600,52.0,1963,2014-07-01
12/2/2014,370000.0,3,2.75,1250,1655,2.0,0.0,0.0,3,7,830,420.0,2006,2006.0,98136,47.5554,-122.382,1520,3001,9.0,2006,2014-12-02
3/9/2015,549500.0,3,1.75,1620,8438,1.0,0.0,0.0,4,8,1620,0.0,1961,1961.0,98125,47.703,-122.281,2040,9450,54.0,1961,2015-03-09
1/30/2015,245000.0,2,1.0,710,6322,1.0,0.0,0.0,3,6,710,0.0,1942,1942.0,98126,47.5165,-122.376,740,6720,73.0,1942,2015-01-30
7/29/2014,208000.0,3,1.75,1070,7200,1.0,0.0,0.0,3,7,1070,0.0,1994,1994.0,98010,47.3134,-122.023,1480,7200,21.0,1994,2014-07-29
12/20/2014,248000.0,4,2.25,2320,8760,1.0,0.0,0.0,4,8,1160,1160.0,1966,1966.0,98032,47.3627,-122.285,1970,8690,49.0,1966,2014-12-20
10/3/2014,610000.0,4,3.25,5450,37058,1.5,0.0,0.0,5,9,5450,0.0,1984,1984.0,98042,47.351000000000006,-122.087,2800,35716,31.0,1984,2014-10-03
4/1/2015,550000.0,4,2.5,1670,5116,2.0,0.0,0.0,3,8,1670,0.0,1999,1999.0,98155,47.7667,-122.33,1910,7210,16.0,1999,2015-04-01
10/28/2014,750000.0,3,2.75,3010,206910,2.0,0.0,2.0,3,10,3010,0.0,2001,2001.0,98045,47.4881,-121.721,1580,120675,14.0,2001,2014-10-28
10/30/2014,192000.0,2,1.75,1340,7380,1.0,0.0,0.0,3,6,1340,0.0,1940,1940.0,98055,47.4785,-122.229,1980,9600,75.0,1940,2014-10-30
2/18/2015,169317.0,2,1.0,790,4000,1.0,0.0,2.0,3,7,790,0.0,1908,1908.0,98112,47.6248,-122.301,1700,4200,107.0,1908,2015-02-18
7/1/2014,1200000.0,4,3.5,3400,3850,2.5,0.0,0.0,3,10,2790,610.0,2008,2008.0,98112,47.6258,-122.302,2030,4000,7.0,2008,2014-07-01
10/29/2014,880000.0,2,1.0,1530,6350,1.5,0.0,0.0,4,7,1530,0.0,1923,1923.0,98112,47.6325,-122.303,2640,6350,92.0,1923,2014-10-29
6/17/2014,210000.0,1,1.0,930,7129,1.0,0.0,0.0,3,6,930,0.0,1948,1948.0,98133,47.7234,-122.333,1300,8075,67.0,1948,2014-06-17
1/7/2015,180500.0,3,1.5,1540,9800,1.0,0.0,0.0,3,7,1010,530.0,1973,1973.0,98058,47.4676,-122.184,1600,8250,42.0,1973,2015-01-07
7/28/2014,540000.0,4,2.0,1990,29078,2.0,0.0,0.0,3,9,1990,0.0,1984,1984.0,98074,47.6471,-122.057,2310,28353,31.0,1984,2014-07-28
6/24/2014,520000.0,3,1.75,2300,35722,1.0,0.0,0.0,3,9,2300,0.0,1984,1984.0,98072,47.7455,-122.11200000000001,2600,34798,31.0,1984,2014-06-24
6/26/2014,177500.0,3,1.5,1220,6000,1.0,0.0,0.0,3,7,1220,0.0,1968,1968.0,98055,47.4904,-122.22200000000001,1660,6000,47.0,1968,2014-06-26
11/5/2014,415000.0,3,1.75,2380,5650,1.0,0.0,2.0,4,8,1190,1190.0,1956,1956.0,98118,47.5119,-122.255,2350,6554,59.0,1956,2014-11-05
9/9/2014,495000.0,4,2.5,2020,7200,1.0,0.0,0.0,5,7,1010,1010.0,1968,1968.0,98034,47.7289,-122.20100000000001,1620,7275,47.0,1968,2014-09-09
3/4/2015,325000.0,3,2.25,1890,9646,1.0,0.0,0.0,3,8,1890,0.0,1966,1966.0,98168,47.4838,-122.29899999999999,1580,9488,49.0,1966,2015-03-04
2/20/2015,440000.0,2,1.75,1330,4903,1.0,0.0,0.0,3,7,1330,0.0,1985,1985.0,98052,47.6819,-122.161,1470,2735,30.0,1985,2015-02-20
7/23/2014,411000.0,3,1.75,1490,9844,1.0,0.0,0.0,4,7,1190,300.0,1959,1959.0,98155,47.7626,-122.29700000000001,1840,10150,56.0,1959,2014-07-23
10/29/2014,810000.0,5,3.5,3550,9600,2.0,0.0,0.0,3,9,2550,1000.0,1998,1998.0,98118,47.5484,-122.26899999999999,2030,9600,17.0,1998,2014-10-29
10/16/2014,561750.0,5,1.75,2040,8996,1.0,0.0,2.0,4,7,1020,1020.0,1962,1962.0,98008,47.588,-122.118,1950,8270,53.0,1962,2014-10-16
7/22/2014,835100.0,4,2.5,2380,12573,1.0,0.0,0.0,4,9,2380,0.0,1963,1963.0,98005,47.5984,-122.176,2900,10700,52.0,1963,2014-07-22
9/1/2014,450000.0,3,2.25,1780,9969,1.0,0.0,0.0,3,8,1450,330.0,1985,1985.0,98034,47.7286,-122.16799999999999,1950,7974,30.0,1985,2014-09-01
11/4/2014,238000.0,3,2.5,1650,2807,2.0,0.0,0.0,3,7,1650,0.0,2004,2004.0,98055,47.4328,-122.196,1460,1875,11.0,2004,2014-11-04
12/5/2014,299000.0,3,1.0,1510,142803,1.0,0.0,0.0,3,7,1510,0.0,1974,1974.0,98001,47.3192,-122.287,1330,46609,41.0,1974,2014-12-05
10/17/2014,570000.0,2,1.0,1100,6240,1.0,0.0,0.0,4,7,1100,0.0,1941,1941.0,98199,47.6446,-122.40299999999999,1250,6240,74.0,1941,2014-10-17
6/4/2014,340000.0,3,1.75,2190,12626,2.0,0.0,0.0,4,8,2190,0.0,1978,1978.0,98042,47.3845,-122.154,3110,14592,37.0,1978,2014-06-04
4/29/2015,450000.0,2,1.75,1760,2275,1.5,0.0,0.0,3,6,1040,720.0,1912,1912.0,98116,47.5803,-122.39299999999999,1380,3750,103.0,1912,2015-04-29
9/10/2014,272750.0,4,1.5,1800,8786,1.0,0.0,0.0,3,7,1330,470.0,1966,1966.0,98146,47.4982,-122.345,1780,8664,49.0,1966,2014-09-10
7/24/2014,520000.0,4,2.0,2000,6380,2.0,0.0,0.0,4,6,1860,140.0,1949,1949.0,98115,47.6956,-122.303,1600,6380,66.0,1949,2014-07-24
6/18/2014,284950.0,3,1.0,990,10723,1.0,0.0,0.0,5,7,990,0.0,1960,1960.0,98059,47.4887,-122.133,1460,10723,55.0,1960,2014-06-18
4/24/2015,255000.0,2,1.5,1480,9660,1.0,0.0,0.0,3,7,1480,0.0,1949,1949.0,98188,47.4577,-122.289,1990,9660,66.0,1949,2015-04-24
11/12/2014,231500.0,2,1.0,1200,9488,1.0,0.0,0.0,5,7,1200,0.0,1941,1941.0,98168,47.4832,-122.29899999999999,1200,9488,74.0,1941,2014-11-12
12/10/2014,415000.0,1,2.0,3000,204732,2.5,0.0,2.0,3,8,3000,0.0,1979,1979.0,98014,47.6331,-121.945,2330,213008,36.0,1979,2014-12-10
1/5/2015,330000.0,4,2.5,3504,6000,2.0,0.0,0.0,3,7,3504,0.0,2006,2006.0,98001,47.3012,-122.285,2790,5231,9.0,2006,2015-01-05
5/28/2014,365000.0,3,1.5,1300,12240,1.0,0.0,0.0,3,7,1300,0.0,1963,1963.0,98028,47.736999999999995,-122.243,2040,9326,52.0,1963,2014-05-28
10/7/2014,425000.0,4,2.0,1330,9188,1.5,0.0,0.0,3,7,1330,0.0,1928,2004.0,98198,47.401,-122.319,1770,10419,11.0,2004,2014-10-07
11/4/2014,400000.0,4,1.75,1850,6480,1.0,0.0,0.0,4,7,1120,730.0,1958,1958.0,98108,47.5525,-122.31299999999999,1610,5040,57.0,1958,2014-11-04
9/22/2014,335000.0,4,2.5,2240,9701,2.0,0.0,0.0,3,9,2240,0.0,1989,1989.0,98023,47.3086,-122.39200000000001,2240,9410,26.0,1989,2014-09-22
9/30/2014,342000.0,3,3.0,1260,1251,2.0,0.0,0.0,3,7,1040,220.0,2003,2003.0,98144,47.5943,-122.296,1780,7715,12.0,2003,2014-09-30
12/4/2014,490000.0,8,5.0,2800,2580,2.0,0.0,0.0,3,8,1880,920.0,1997,1997.0,98122,47.6086,-122.303,1800,2580,18.0,1997,2014-12-04
11/6/2014,331500.0,4,1.75,1820,14319,1.0,0.0,0.0,4,7,1820,0.0,1969,1969.0,98059,47.4757,-122.148,1440,10018,46.0,1969,2014-11-06
3/30/2015,960000.0,3,2.5,1730,4102,3.0,1.0,4.0,3,8,1730,0.0,1996,1996.0,98074,47.645,-122.084,2340,16994,19.0,1996,2015-03-30
7/9/2014,720500.0,4,2.5,3350,35298,2.0,0.0,0.0,4,9,3350,0.0,1985,1985.0,98053,47.6506,-122.036,2620,35604,30.0,1985,2014-07-09
8/20/2014,830000.0,3,2.5,3370,6550,2.0,0.0,2.0,4,8,2840,0.0,1912,2001.0,98126,47.5442,-122.38,1500,6550,14.0,2001,2014-08-20
5/23/2014,662990.0,3,1.75,1240,3600,1.5,0.0,0.0,5,7,1240,0.0,1926,1926.0,98116,47.5797,-122.405,1660,3600,89.0,1926,2014-05-23
3/30/2015,220000.0,4,2.0,2340,10507,1.5,0.0,0.0,4,6,2340,0.0,1959,1959.0,98030,47.3578,-122.178,990,10507,56.0,1959,2015-03-30
1/8/2015,349950.0,5,2.0,1880,4179,1.0,0.0,0.0,3,7,940,940.0,1952,2000.0,98118,47.5536,-122.28299999999999,1350,5150,15.0,2000,2015-01-08
1/7/2015,550000.0,3,2.0,1810,2159,1.0,0.0,0.0,3,7,1010,800.0,1922,1922.0,98109,47.6273,-122.345,1810,2159,93.0,1922,2015-01-07
9/15/2014,396000.0,3,1.75,2340,5668,1.0,0.0,0.0,4,6,1200,1140.0,1941,1941.0,98106,47.5588,-122.36399999999999,860,4800,74.0,1941,2014-09-15
1/16/2015,635000.0,4,1.5,2820,4000,2.0,0.0,0.0,3,7,2820,0.0,1911,1911.0,98103,47.6638,-122.348,1470,1627,104.0,1911,2015-01-16
11/18/2014,293000.0,3,1.0,1020,7650,1.0,0.0,0.0,3,7,1020,0.0,1940,1940.0,98133,47.7198,-122.352,1440,7650,75.0,1940,2014-11-18
7/11/2014,339000.0,3,2.25,2090,10120,1.0,0.0,0.0,4,7,1290,800.0,1979,1979.0,98058,47.4654,-122.17399999999999,1820,7983,36.0,1979,2014-07-11
6/30/2014,285000.0,4,2.25,1830,8734,2.0,0.0,0.0,4,7,1830,0.0,1991,1991.0,98030,47.3679,-122.179,1870,7212,24.0,1991,2014-06-30
7/10/2014,775000.0,6,2.75,2980,5000,1.5,0.0,0.0,3,7,2480,500.0,1916,1916.0,98103,47.6684,-122.331,1470,5000,99.0,1916,2014-07-10
6/26/2014,224000.0,4,1.5,1600,9289,1.0,0.0,0.0,4,7,1600,0.0,1959,1959.0,98002,47.3107,-122.212,1540,9918,56.0,1959,2014-06-26
10/29/2014,2250000.0,4,3.5,4440,8125,2.0,0.0,3.0,5,10,3140,1300.0,1922,1922.0,98144,47.5744,-122.28299999999999,3990,8505,93.0,1922,2014-10-29
7/1/2014,165050.0,3,1.0,1200,8514,1.0,0.0,0.0,3,7,1200,0.0,1959,1959.0,98022,47.2043,-122.008,1210,8985,56.0,1959,2014-07-01
10/27/2014,275000.0,3,1.25,1230,4500,1.5,0.0,0.0,4,7,1230,0.0,1913,1913.0,98118,47.5301,-122.271,1310,5000,102.0,1913,2014-10-27
9/11/2014,445000.0,5,3.0,2930,5500,1.0,0.0,0.0,3,7,1750,1180.0,1951,1951.0,98118,47.5572,-122.281,1400,5500,64.0,1951,2014-09-11
4/1/2015,510000.0,3,2.25,2370,38639,1.0,0.0,0.0,3,8,1930,440.0,1978,1978.0,98077,47.771,-122.09899999999999,2900,37452,37.0,1978,2015-04-01
6/10/2014,1230000.0,4,2.5,3040,7000,2.0,0.0,0.0,3,9,3040,0.0,2001,2001.0,98040,47.5934,-122.244,2320,17511,14.0,2001,2014-06-10
10/29/2014,390000.0,3,1.5,1610,13500,1.0,0.0,0.0,3,7,1060,550.0,1970,1970.0,98155,47.7674,-122.31,1540,11479,45.0,1970,2014-10-29
5/13/2014,460000.0,3,2.25,2350,10450,1.0,0.0,0.0,3,8,1390,960.0,1977,1977.0,98028,47.7433,-122.259,2250,10450,38.0,1977,2014-05-13
3/27/2015,700000.0,3,1.75,2000,14733,1.0,0.0,0.0,4,8,2000,0.0,1958,1958.0,98005,47.6001,-122.178,2620,14733,57.0,1958,2015-03-27
6/22/2014,874150.0,4,3.5,3530,14406,2.0,0.0,1.0,3,10,2570,960.0,1987,1987.0,98034,47.7073,-122.244,3170,15181,28.0,1987,2014-06-22
7/31/2014,470000.0,3,2.25,2220,9800,2.0,0.0,0.0,3,8,2220,0.0,1987,1987.0,98155,47.7635,-122.286,2420,10232,28.0,1987,2014-07-31
5/21/2014,374000.0,3,1.75,2000,9416,1.0,0.0,0.0,4,6,2000,0.0,1961,1961.0,98033,47.696999999999996,-122.175,1440,9555,54.0,1961,2014-05-21
7/17/2014,510000.0,2,1.75,1210,131115,1.5,0.0,0.0,5,7,1210,0.0,1950,1950.0,98070,47.4599,-122.45,2020,185565,65.0,1950,2014-07-17
7/11/2014,467000.0,2,2.5,1140,1181,3.0,0.0,0.0,3,8,1140,0.0,2007,2007.0,98107,47.6713,-122.383,1220,1189,8.0,2007,2014-07-11
6/16/2014,576000.0,4,2.5,2440,28405,2.0,0.0,0.0,3,8,2440,0.0,2002,2002.0,98028,47.7386,-122.238,2480,11429,13.0,2002,2014-06-16
5/30/2014,196440.0,3,2.0,1560,7352,1.0,0.0,0.0,3,6,1560,0.0,1992,1992.0,98001,47.2804,-122.251,1120,7950,23.0,1992,2014-05-30
12/31/2014,825000.0,4,2.5,3210,18901,2.0,0.0,0.0,3,10,3210,0.0,1993,1993.0,98077,47.708999999999996,-122.073,3330,18901,22.0,1993,2014-12-31
4/8/2015,281000.0,2,1.0,930,2600,1.0,0.0,0.0,3,7,930,0.0,1981,1981.0,98034,47.7242,-122.161,1370,3488,34.0,1981,2015-04-08
8/12/2014,326000.0,3,2.5,1782,1577,3.0,0.0,0.0,3,7,1782,0.0,2000,2000.0,98125,47.7114,-122.301,1550,1744,15.0,2000,2014-08-12
4/10/2015,340000.0,3,1.75,1740,46580,1.0,0.0,0.0,4,7,1740,0.0,1980,1980.0,98010,47.3583,-121.927,1576,54685,35.0,1980,2015-04-10
12/8/2014,440000.0,5,1.75,3690,36036,1.0,0.0,0.0,3,9,1890,1800.0,1985,1985.0,98042,47.3473,-122.085,2680,44131,30.0,1985,2014-12-08
5/22/2014,749000.0,4,2.5,2930,18199,2.0,0.0,0.0,3,9,2930,0.0,1998,1998.0,98075,47.5937,-122.04700000000001,2930,33976,17.0,1998,2014-05-22
2/27/2015,340000.0,4,1.0,1230,8316,1.5,0.0,0.0,3,7,1230,0.0,1963,1963.0,98034,47.7269,-122.24,1490,8316,52.0,1963,2015-02-27
5/6/2014,561000.0,3,2.0,2000,7000,2.0,0.0,0.0,3,7,2000,0.0,1916,1986.0,98136,47.5452,-122.39299999999999,1840,7000,29.0,1986,2014-05-06
10/31/2014,270000.0,3,2.25,1520,7930,1.0,0.0,0.0,3,7,1160,360.0,1988,1988.0,98038,47.3605,-122.04899999999999,1530,7930,27.0,1988,2014-10-31
6/20/2014,600000.0,2,1.0,1040,3600,1.0,0.0,0.0,4,7,1040,0.0,1919,1980.0,98112,47.619,-122.311,2250,4800,35.0,1980,2014-06-20
5/5/2014,219900.0,4,1.5,1120,5427,1.0,0.0,0.0,3,6,1120,0.0,1969,1969.0,98042,47.3628,-122.087,1150,5304,46.0,1969,2014-05-05
12/8/2014,617000.0,3,1.75,3020,360241,2.0,0.0,0.0,3,8,3020,0.0,1992,1992.0,98092,47.2662,-122.088,1890,209959,23.0,1992,2014-12-08
9/4/2014,469000.0,3,2.25,1820,8446,2.0,0.0,0.0,3,8,1820,0.0,1978,1978.0,98034,47.7208,-122.236,1850,8437,37.0,1978,2014-09-04
8/11/2014,229000.0,3,1.0,1370,56628,1.0,0.0,0.0,3,7,1370,0.0,1942,1942.0,98003,47.3058,-122.306,1768,8702,73.0,1942,2014-08-11
4/22/2015,1270000.0,4,3.0,3130,2646,2.5,0.0,0.0,5,9,2290,840.0,1906,1906.0,98102,47.6272,-122.316,2920,4500,109.0,1906,2015-04-22
8/5/2014,365000.0,3,1.5,1640,8301,1.0,0.0,0.0,3,7,1290,350.0,1958,1958.0,98155,47.7443,-122.32700000000001,1640,8955,57.0,1958,2014-08-05
12/12/2014,429000.0,4,2.5,2650,9301,2.0,0.0,0.0,3,9,2650,0.0,2001,2001.0,98001,47.3477,-122.271,2730,8688,14.0,2001,2014-12-12
12/8/2014,550000.0,4,2.5,2850,6809,2.0,0.0,0.0,3,9,2850,0.0,2003,2003.0,98019,47.7353,-121.973,2820,7500,12.0,2003,2014-12-08
1/16/2015,453000.0,3,2.5,1820,16300,1.0,0.0,0.0,4,7,1220,600.0,1955,1955.0,98166,47.4582,-122.365,1870,16300,60.0,1955,2015-01-16
6/17/2014,187500.0,3,1.5,1180,7000,1.0,0.0,0.0,4,7,1180,0.0,1977,1977.0,98023,47.2966,-122.374,1180,7370,38.0,1977,2014-06-17
4/15/2015,520500.0,6,2.5,1880,14350,1.0,0.0,0.0,5,7,1640,240.0,1955,1955.0,98133,47.7556,-122.352,1510,9840,60.0,1955,2015-04-15
2/4/2015,300000.0,3,1.75,1280,12776,1.0,0.0,0.0,4,7,1280,0.0,1977,1977.0,98031,47.4212,-122.199,1680,11704,38.0,1977,2015-02-04
5/16/2014,799000.0,4,3.25,3120,5000,2.0,0.0,0.0,3,9,2370,750.0,2005,2005.0,98115,47.69,-122.29899999999999,2520,6000,10.0,2005,2014-05-16
2/3/2015,338000.0,3,2.5,2470,4948,2.0,0.0,0.0,3,8,2470,0.0,2003,2003.0,98038,47.3438,-122.039,2500,4993,12.0,2003,2015-02-03
5/14/2014,800000.0,3,1.0,1700,4400,1.5,0.0,0.0,4,8,1700,0.0,1906,1906.0,98122,47.611999999999995,-122.292,1610,4180,109.0,1906,2014-05-14
8/25/2014,360000.0,2,2.0,1180,3200,1.0,0.0,1.0,4,6,590,590.0,1945,1945.0,98136,47.5275,-122.383,1350,4000,70.0,1945,2014-08-25
7/28/2014,442500.0,6,2.5,2800,10490,1.0,0.0,0.0,3,7,1400,1400.0,1968,1968.0,98177,47.7735,-122.37799999999999,2290,8716,47.0,1968,2014-07-28
3/27/2015,700000.0,4,1.0,1300,1651359,1.0,0.0,3.0,4,6,1300,0.0,1920,1920.0,98022,47.2313,-122.023,2560,425581,95.0,1920,2015-03-27
5/8/2014,830000.0,5,3.0,3040,9601,1.0,0.0,0.0,5,9,1970,1070.0,1968,1968.0,98040,47.5562,-122.22,3180,12390,47.0,1968,2014-05-08
11/18/2014,360400.0,3,2.5,1630,11592,2.0,0.0,0.0,3,8,1630,0.0,1987,1987.0,98011,47.7574,-122.228,1700,8850,28.0,1987,2014-11-18
11/21/2014,345000.0,3,1.0,1340,9339,1.0,0.0,0.0,5,7,1340,0.0,1960,1960.0,98056,47.5407,-122.177,1310,9350,55.0,1960,2014-11-21
9/9/2014,300000.0,3,1.75,1830,51836,1.0,0.0,0.0,4,7,1430,400.0,1966,1966.0,98059,47.4774,-122.098,1320,51400,49.0,1966,2014-09-09
9/4/2014,350000.0,3,1.0,1240,10800,1.0,0.0,0.0,5,7,1240,0.0,1959,1959.0,98056,47.5233,-122.185,1810,10800,56.0,1959,2014-09-04
10/8/2014,368000.0,4,2.0,2500,36900,1.0,0.0,0.0,3,7,1540,960.0,1972,1972.0,98038,47.3708,-122.04899999999999,1960,36900,43.0,1972,2014-10-08
6/23/2014,264000.0,3,1.75,1760,7482,1.0,0.0,0.0,4,8,1760,0.0,1966,1966.0,98023,47.3129,-122.369,2000,7500,49.0,1966,2014-06-23
3/12/2015,435000.0,3,2.0,2660,16677,1.0,0.0,0.0,3,9,2210,450.0,1990,1990.0,98038,47.3689,-122.055,2660,11355,25.0,1990,2015-03-12
6/4/2014,200000.0,3,1.5,2060,15837,1.5,0.0,0.0,3,6,2060,0.0,1903,1903.0,98055,47.4819,-122.223,2190,8549,112.0,1903,2014-06-04
5/14/2014,620000.0,5,2.5,2540,3832,2.0,0.0,0.0,5,8,1760,780.0,1929,1929.0,98117,47.6848,-122.398,2000,5289,86.0,1929,2014-05-14
11/20/2014,1680000.0,5,4.25,4830,11466,2.0,0.0,0.0,3,10,3720,1110.0,2014,2014.0,98040,47.5774,-122.22200000000001,2180,11017,1.0,2014,2014-11-20
12/9/2014,337000.0,3,1.75,1400,6000,1.0,0.0,0.0,4,7,700,700.0,1919,1919.0,98108,47.5283,-122.321,1030,6000,96.0,1919,2014-12-09
10/1/2014,1930000.0,4,3.25,4280,20296,2.0,0.0,0.0,4,11,4280,0.0,1984,1984.0,98004,47.6377,-122.212,3420,16351,31.0,1984,2014-10-01
5/28/2014,544500.0,4,2.5,2230,10414,1.0,0.0,0.0,5,7,1450,780.0,1974,1974.0,98075,47.5816,-122.0,1960,10240,41.0,1974,2014-05-28
1/2/2015,252000.0,1,1.0,680,1638,1.0,0.0,4.0,1,6,680,0.0,1910,1992.0,98116,47.5832,-122.399,1010,3621,23.0,1992,2015-01-02
6/5/2014,445000.0,4,2.5,2340,3784,2.0,0.0,0.0,3,8,2340,0.0,2008,2008.0,98106,47.535,-122.348,1730,4000,7.0,2008,2014-06-05
7/25/2014,379500.0,3,2.25,2070,14196,2.0,0.0,0.0,3,7,2070,0.0,1989,1989.0,98059,47.4617,-122.07,1550,13860,26.0,1989,2014-07-25
3/11/2015,189950.0,4,2.0,1910,4225,1.0,0.0,0.0,4,6,910,1000.0,1919,1919.0,98001,47.3084,-122.234,1060,4800,96.0,1919,2015-03-11
6/2/2014,469000.0,3,1.0,950,4250,1.5,0.0,0.0,5,6,950,0.0,1948,1948.0,98122,47.608999999999995,-122.307,2130,5120,67.0,1948,2014-06-02
6/11/2014,600000.0,5,2.75,2910,53898,1.0,0.0,0.0,5,7,1510,1400.0,1979,1979.0,98077,47.7201,-122.06200000000001,3210,216928,36.0,1979,2014-06-11
11/7/2014,785000.0,3,2.5,2930,33981,2.0,0.0,2.0,3,9,2930,0.0,2000,2000.0,98059,47.5151,-122.12,3720,35230,15.0,2000,2014-11-07
2/10/2015,372000.0,4,2.75,2610,8967,2.0,0.0,0.0,4,8,2610,0.0,1990,1990.0,98042,47.3747,-122.124,2390,7852,25.0,1990,2015-02-10
2/25/2015,445000.0,5,3.0,3880,7180,2.0,0.0,0.0,3,7,3880,0.0,2004,2004.0,98056,47.4797,-122.179,2160,4793,11.0,2004,2015-02-25
10/14/2014,508000.0,4,2.25,3320,53392,2.0,0.0,0.0,4,8,2000,1320.0,1986,1986.0,98027,47.4724,-122.014,3230,43129,29.0,1986,2014-10-14
3/18/2015,780000.0,5,1.5,1940,4800,2.0,0.0,0.0,3,8,1940,0.0,1905,1905.0,98103,47.6845,-122.33200000000001,1750,4800,110.0,1905,2015-03-18
3/16/2015,541100.0,4,2.25,2510,9800,2.0,0.0,0.0,3,9,2510,0.0,1978,1978.0,98072,47.753,-122.145,2440,11000,37.0,1978,2015-03-16
1/5/2015,729000.0,4,2.5,2660,5608,2.0,0.0,0.0,3,9,2660,0.0,2003,2003.0,98029,47.5449,-121.995,3010,5608,12.0,2003,2015-01-05
11/4/2014,397000.0,3,2.0,1710,134489,1.0,0.0,2.0,5,7,1710,0.0,1952,1952.0,98022,47.2207,-121.984,1700,63823,63.0,1952,2014-11-04
5/15/2014,451555.0,2,1.0,1320,4520,1.0,0.0,1.0,3,6,1320,0.0,1912,1971.0,98116,47.5655,-122.39399999999999,1420,4560,44.0,1971,2014-05-15
6/30/2014,300000.0,2,1.0,960,8153,1.0,0.0,0.0,3,6,960,0.0,1947,1947.0,98155,47.7341,-122.3,1160,8199,68.0,1947,2014-06-30
4/7/2015,416000.0,3,2.5,1790,11542,1.0,0.0,0.0,5,7,1190,600.0,1969,1969.0,98059,47.5124,-122.16,1790,9131,46.0,1969,2015-04-07
10/21/2014,490000.0,2,1.0,950,3060,1.0,0.0,0.0,3,6,810,140.0,1925,1925.0,98105,47.6698,-122.323,1510,3780,90.0,1925,2014-10-21
1/29/2015,480000.0,6,3.75,2940,5054,2.0,0.0,0.0,3,7,2940,0.0,1942,2003.0,98146,47.5122,-122.385,1530,5320,12.0,2003,2015-01-29
2/3/2015,368000.0,2,2.0,930,1662,1.0,0.0,0.0,3,7,670,260.0,2002,2002.0,98199,47.6518,-122.4,1780,2343,13.0,2002,2015-02-03
9/18/2014,1040000.0,3,2.5,4570,10615,2.0,0.0,0.0,3,12,4570,0.0,1991,1991.0,98027,47.5533,-122.09700000000001,3860,11576,24.0,1991,2014-09-18
1/20/2015,545000.0,3,2.5,2370,9000,1.0,0.0,3.0,4,8,1570,800.0,1952,1952.0,98146,47.4922,-122.365,2120,9500,63.0,1952,2015-01-20
3/23/2015,850000.0,5,2.75,3430,15119,2.0,0.0,0.0,3,10,3430,0.0,1998,1998.0,98075,47.5678,-122.03200000000001,3430,12045,17.0,1998,2015-03-23
12/4/2014,550000.0,4,3.5,3540,4750,2.0,0.0,0.0,3,10,3540,0.0,2003,2003.0,98055,47.473,-122.193,3310,5655,12.0,2003,2014-12-04
2/17/2015,600000.0,3,2.25,2240,9314,2.0,0.0,0.0,3,9,2240,0.0,1984,1984.0,98074,47.6216,-122.03200000000001,2240,9314,31.0,1984,2015-02-17
8/27/2014,535000.0,4,2.5,2710,12138,1.0,0.0,0.0,3,8,1700,1010.0,1968,1968.0,98155,47.7657,-122.29,2390,10052,47.0,1968,2014-08-27
5/20/2014,599950.0,3,2.5,2660,4975,2.0,0.0,0.0,3,8,2660,0.0,2014,2014.0,98118,47.5487,-122.272,1840,6653,1.0,2014,2014-05-20
7/18/2014,531000.0,5,2.75,2540,5022,1.0,0.0,0.0,4,8,1540,1000.0,1955,1955.0,98108,47.5593,-122.3,2510,5182,60.0,1955,2014-07-18
6/5/2014,530000.0,4,2.25,2210,7665,2.0,0.0,0.0,4,8,2210,0.0,1968,1968.0,98006,47.5424,-122.16799999999999,1960,7903,47.0,1968,2014-06-05
6/25/2014,597326.0,4,4.0,3570,8250,2.0,0.0,0.0,3,10,2860,710.0,2015,2015.0,98040,47.5784,-122.226,2230,10000,0.0,2015,2014-06-25
4/29/2015,805000.0,4,2.5,3450,33460,2.0,0.0,0.0,3,9,3450,0.0,1997,1997.0,98077,47.7673,-122.1,2820,35250,18.0,1997,2015-04-29
10/27/2014,390000.0,4,1.75,2330,8364,1.0,0.0,0.0,4,8,2330,0.0,1968,1968.0,98058,47.4568,-122.146,2180,9630,47.0,1968,2014-10-27
5/19/2014,487250.0,4,2.0,1690,3250,1.5,0.0,0.0,3,7,1550,140.0,1901,1901.0,98103,47.6637,-122.346,1620,3250,114.0,1901,2014-05-19
9/9/2014,301000.0,3,1.5,1030,8414,1.0,0.0,0.0,4,7,1030,0.0,1967,1967.0,98155,47.7654,-122.29700000000001,1750,8414,48.0,1967,2014-09-09
2/5/2015,1180000.0,5,2.75,2560,5618,1.5,0.0,2.0,3,8,2220,340.0,1923,1923.0,98109,47.6416,-122.355,2740,4000,92.0,1923,2015-02-05
9/26/2014,299000.0,4,2.5,1950,3000,2.0,0.0,0.0,3,7,1950,0.0,2002,2002.0,98178,47.4977,-122.226,1170,6000,13.0,2002,2014-09-26
9/3/2014,2350000.0,4,2.25,4370,22863,2.5,0.0,3.0,4,10,3670,0.0,1907,1994.0,98033,47.6878,-122.215,2980,22863,21.0,1994,2014-09-03
10/14/2014,400000.0,4,2.5,2350,3904,2.5,0.0,0.0,3,7,2350,0.0,1999,1999.0,98106,47.5305,-122.351,1120,4000,16.0,1999,2014-10-14
12/1/2014,467500.0,4,2.5,3160,7210,1.0,0.0,0.0,4,7,1880,1280.0,1969,1969.0,98034,47.7368,-122.18299999999999,2070,7560,46.0,1969,2014-12-01
2/20/2015,305000.0,4,2.5,2430,9103,2.0,0.0,0.0,3,8,2430,0.0,1990,1990.0,98023,47.2939,-122.368,2260,8090,25.0,1990,2015-02-20
5/5/2014,210000.0,3,1.0,1340,306848,1.0,0.0,0.0,3,5,1340,0.0,1953,1953.0,98019,47.7534,-121.912,1800,128066,62.0,1953,2014-05-05
4/28/2015,300000.0,3,1.0,1010,10168,1.0,0.0,0.0,3,6,1010,0.0,1979,1979.0,98014,47.6453,-121.912,1180,10318,36.0,1979,2015-04-28
9/8/2014,327500.0,3,2.25,1770,8755,1.0,0.0,0.0,3,8,1330,440.0,1981,1981.0,98058,47.4464,-122.12299999999999,1910,8710,34.0,1981,2014-09-08
8/5/2014,269000.0,3,2.0,1210,7136,1.0,0.0,0.0,3,7,1210,0.0,2003,2003.0,98031,47.3996,-122.20299999999999,1210,5765,12.0,2003,2014-08-05
3/31/2015,975000.0,4,3.25,3330,17533,1.0,0.0,2.0,3,9,1750,1580.0,1969,1969.0,98033,47.652,-122.2,3340,12798,46.0,1969,2015-03-31
12/10/2014,355000.0,3,1.0,1240,5400,1.0,0.0,0.0,4,7,1060,180.0,1940,1940.0,98133,47.7115,-122.355,1429,5400,75.0,1940,2014-12-10
5/8/2014,712000.0,3,1.0,1250,4620,1.5,0.0,0.0,4,7,1150,100.0,1900,1900.0,98103,47.651,-122.34100000000001,1900,4400,115.0,1900,2014-05-08
6/14/2014,883000.0,4,2.5,2960,41656,2.0,0.0,0.0,3,10,2960,0.0,1985,1985.0,98072,47.7319,-122.132,3900,35104,30.0,1985,2014-06-14
8/15/2014,190000.0,2,1.0,840,12252,1.0,0.0,0.0,3,6,840,0.0,1994,1994.0,98010,47.3069,-122.01299999999999,1010,11876,21.0,1994,2014-08-15
4/6/2015,443000.0,3,1.75,1530,8028,1.0,0.0,0.0,3,7,1200,330.0,1967,1967.0,98177,47.7768,-122.361,1530,8028,48.0,1967,2015-04-06
5/9/2014,920000.0,4,3.0,3750,11025,2.0,0.0,0.0,3,10,3750,0.0,1976,1976.0,98074,47.6367,-122.059,2930,12835,39.0,1976,2014-05-09
12/22/2014,285000.0,4,2.25,2150,8250,1.0,0.0,0.0,4,7,1240,910.0,1978,1978.0,98023,47.3045,-122.37799999999999,2050,7875,37.0,1978,2014-12-22
4/23/2015,901000.0,4,3.25,1560,4080,1.0,0.0,0.0,3,7,1560,0.0,1916,1916.0,98126,47.5347,-122.38,1370,4080,99.0,1916,2015-04-23
3/5/2015,552500.0,3,1.75,2040,5775,1.0,0.0,0.0,3,7,1410,630.0,1958,1958.0,98199,47.6592,-122.39299999999999,1360,4400,57.0,1958,2015-03-05
3/3/2015,256000.0,2,1.0,860,5000,1.0,0.0,0.0,3,6,860,0.0,1915,1945.0,98146,47.5133,-122.35600000000001,1220,5000,70.0,1945,2015-03-03
5/12/2014,341000.0,3,1.5,1720,7119,1.5,0.0,0.0,4,7,1720,0.0,1952,1952.0,98155,47.7535,-122.314,1590,7616,63.0,1952,2014-05-12
3/26/2015,279000.0,4,2.25,2090,8941,2.0,0.0,0.0,3,7,2090,0.0,1975,1975.0,98058,47.4332,-122.167,1890,7946,40.0,1975,2015-03-26
7/26/2014,686000.0,4,2.25,2130,10650,2.0,0.0,0.0,4,8,2130,0.0,1977,1977.0,98006,47.5567,-122.15899999999999,3380,10050,38.0,1977,2014-07-26
5/23/2014,225000.0,2,1.0,1300,11867,1.5,0.0,0.0,4,6,1300,0.0,1975,1975.0,98010,47.3221,-121.90299999999999,820,11867,40.0,1975,2014-05-23
6/27/2014,215500.0,2,1.75,1220,15600,1.0,0.0,0.0,3,6,1220,0.0,1972,1972.0,98001,47.2853,-122.265,1510,17818,43.0,1972,2014-06-27
4/14/2015,950000.0,4,3.0,2420,4800,1.5,0.0,0.0,3,7,1520,900.0,1919,1919.0,98119,47.6453,-122.35799999999999,1090,3800,96.0,1919,2015-04-14
11/5/2014,503000.0,4,2.5,2940,156988,2.0,0.0,2.0,3,9,1870,1070.0,1996,1996.0,98014,47.6214,-121.946,2940,71002,19.0,1996,2014-11-05
1/22/2015,780000.0,3,2.5,2610,7567,2.0,0.0,0.0,3,9,2610,0.0,1997,1997.0,98052,47.6654,-122.137,2610,8458,18.0,1997,2015-01-22
2/23/2015,212000.0,4,2.0,1880,7500,1.0,0.0,0.0,5,6,980,900.0,1946,1946.0,98178,47.495,-122.266,1670,14350,69.0,1946,2015-02-23
7/29/2014,580000.0,4,2.75,2330,6703,1.5,0.0,0.0,3,7,1710,620.0,1983,1983.0,98177,47.7066,-122.359,2060,7500,32.0,1983,2014-07-29
11/11/2014,465000.0,4,2.5,2200,3141,2.0,0.0,0.0,3,7,2060,140.0,1994,1994.0,98144,47.5726,-122.305,1660,3175,21.0,1994,2014-11-11
11/19/2014,206000.0,4,2.0,1720,7560,1.0,0.0,0.0,3,7,1720,0.0,1959,1959.0,98001,47.2845,-122.25,1750,7988,56.0,1959,2014-11-19
2/23/2015,615000.0,3,2.5,2250,10171,2.0,0.0,0.0,3,9,2250,0.0,1987,1987.0,98006,47.5613,-122.11,2440,13390,28.0,1987,2015-02-23
7/19/2014,519000.0,4,1.0,1640,6305,1.5,0.0,0.0,5,6,1640,0.0,1907,1907.0,98118,47.5563,-122.28,1590,4816,108.0,1907,2014-07-19
4/23/2015,1140000.0,4,3.25,4130,11444,2.0,0.0,0.0,3,11,4130,0.0,2001,2001.0,98059,47.5208,-122.15,3720,11431,14.0,2001,2015-04-23
8/8/2014,330000.0,5,2.5,2600,3839,2.0,0.0,0.0,3,7,2600,0.0,2005,2005.0,98058,47.4324,-122.145,2180,4800,10.0,2005,2014-08-08
5/6/2015,240000.0,4,1.5,1920,7973,1.0,0.0,0.0,3,8,1920,0.0,1955,1955.0,98178,47.4961,-122.235,2020,8840,60.0,1955,2015-05-06
11/7/2014,574000.0,3,2.0,2060,7000,1.0,0.0,0.0,4,9,2060,0.0,1988,1988.0,98029,47.5644,-122.012,2110,7000,27.0,1988,2014-11-07
11/3/2014,930000.0,4,4.25,5710,24663,2.0,0.0,0.0,3,11,5710,0.0,2007,2007.0,98092,47.3065,-122.15799999999999,4060,23847,8.0,2007,2014-11-03
7/14/2014,850000.0,4,3.0,2720,183823,2.0,0.0,0.0,3,8,2720,0.0,1975,2007.0,98053,47.6749,-122.00200000000001,2140,173804,8.0,2007,2014-07-14
12/12/2014,415000.0,3,1.5,1490,7275,1.0,0.0,0.0,3,7,1090,400.0,1974,1974.0,98034,47.7148,-122.213,1420,7330,41.0,1974,2014-12-12
11/18/2014,480000.0,3,2.5,2360,9005,1.0,0.0,0.0,5,7,1340,1020.0,1929,1929.0,98133,47.7076,-122.337,1520,9005,86.0,1929,2014-11-18
7/21/2014,300000.0,5,1.0,1940,8875,1.0,0.0,0.0,3,7,1940,0.0,1957,1957.0,98188,47.4407,-122.275,1380,8875,58.0,1957,2014-07-21
7/8/2014,439000.0,4,2.25,2570,9503,2.0,0.0,0.0,3,8,2570,0.0,1980,1980.0,98011,47.763999999999996,-122.167,1950,9600,35.0,1980,2014-07-08
3/27/2015,450000.0,3,1.0,1160,36831,1.0,0.0,0.0,3,7,1160,0.0,1938,1938.0,98028,47.7507,-122.23700000000001,1800,15640,77.0,1938,2015-03-27
4/26/2015,589000.0,3,2.5,2660,206480,1.0,0.0,0.0,3,8,2660,0.0,1989,1989.0,98024,47.6042,-121.956,2660,206736,26.0,1989,2015-04-26
4/7/2015,477000.0,3,2.25,1260,3000,2.0,0.0,0.0,3,7,1260,0.0,2003,2003.0,98029,47.5459,-121.99700000000001,1630,3023,12.0,2003,2015-04-07
9/24/2014,587500.0,4,2.25,1780,6120,1.0,0.0,0.0,3,8,1310,470.0,1951,1951.0,98115,47.6955,-122.287,1780,6120,64.0,1951,2014-09-24
9/24/2014,1320000.0,4,2.25,3180,6105,2.0,0.0,0.0,3,10,3180,0.0,1905,1905.0,98112,47.6255,-122.314,3180,6029,110.0,1905,2014-09-24
9/11/2014,1430000.0,4,2.5,3380,27589,2.0,0.0,0.0,3,10,3380,0.0,1966,1966.0,98004,47.6292,-122.225,3390,20075,49.0,1966,2014-09-11
4/13/2015,700000.0,4,2.25,2690,15000,2.0,0.0,0.0,3,9,1890,800.0,1978,1978.0,98074,47.611999999999995,-122.064,2670,15030,37.0,1978,2015-04-13
6/23/2014,275000.0,2,1.0,1180,6552,1.0,0.0,0.0,4,6,1180,0.0,1949,1949.0,98133,47.7477,-122.34200000000001,1070,7200,66.0,1949,2014-06-23
6/24/2014,367500.0,3,1.0,1660,11783,1.0,0.0,0.0,4,7,1160,500.0,1978,1978.0,98077,47.7563,-122.075,1320,10541,37.0,1978,2014-06-24
5/5/2015,453250.0,4,2.5,2260,6300,2.0,0.0,0.0,3,7,2260,0.0,2001,2001.0,98019,47.7235,-121.958,2300,6300,14.0,2001,2015-05-05
4/17/2015,607000.0,5,1.75,1910,5428,1.0,0.0,0.0,3,8,1390,520.0,1954,1954.0,98136,47.5333,-122.39200000000001,1820,5900,61.0,1954,2015-04-17
7/2/2014,255000.0,4,2.0,2430,8960,1.0,0.0,0.0,3,7,1430,1000.0,1960,1960.0,98178,47.4979,-122.23200000000001,2430,8960,55.0,1960,2014-07-02
5/1/2015,501000.0,2,2.0,1300,2500,1.0,0.0,0.0,4,7,770,530.0,1926,1926.0,98117,47.6831,-122.37299999999999,1160,5000,89.0,1926,2015-05-01
3/31/2015,450000.0,3,1.0,1060,4650,1.0,0.0,0.0,3,7,910,150.0,1950,1950.0,98116,47.5784,-122.39299999999999,1480,4750,65.0,1950,2015-03-31
8/20/2014,360000.0,3,2.25,2200,8000,2.0,0.0,0.0,3,8,2200,0.0,1981,1981.0,98055,47.4522,-122.208,2170,8000,34.0,1981,2014-08-20
11/14/2014,460000.0,4,1.75,1720,3050,1.5,0.0,0.0,5,7,1040,680.0,1929,1929.0,98116,47.5654,-122.384,1570,6100,86.0,1929,2014-11-14
3/3/2015,753000.0,3,1.75,2360,8290,1.0,0.0,0.0,4,7,1180,1180.0,1950,1950.0,98115,47.6738,-122.281,1880,7670,65.0,1950,2015-03-03
5/6/2015,389950.0,2,1.0,820,4234,1.0,0.0,1.0,3,6,820,0.0,1951,1951.0,98136,47.5294,-122.38600000000001,1550,4236,64.0,1951,2015-05-06
5/6/2014,469000.0,2,1.0,1030,4400,1.0,0.0,0.0,3,7,1030,0.0,1924,1924.0,98117,47.681000000000004,-122.361,1400,4200,91.0,1924,2014-05-06
9/12/2014,550000.0,4,1.75,2030,5688,2.0,0.0,4.0,4,9,1730,300.0,1939,1939.0,98146,47.5071,-122.387,2320,11107,76.0,1939,2014-09-12
9/4/2014,565000.0,5,3.5,2700,11675,1.5,0.0,2.0,4,6,1950,750.0,1948,1948.0,98133,47.7172,-122.34899999999999,2160,8114,67.0,1948,2014-09-04
5/21/2014,189650.0,2,1.75,1100,7600,1.0,0.0,0.0,3,6,1100,0.0,1980,1980.0,98198,47.4136,-122.318,1230,7350,35.0,1980,2014-05-21
6/19/2014,1530000.0,4,3.25,3620,5131,2.0,0.0,3.0,4,11,2350,1270.0,1927,1927.0,98119,47.6499,-122.37,2550,5174,88.0,1927,2014-06-19
8/20/2014,260000.0,3,1.75,1340,8000,1.0,0.0,0.0,3,7,1340,0.0,1980,1980.0,98038,47.3651,-122.044,1690,8000,35.0,1980,2014-08-20
6/1/2014,243000.0,3,1.75,1790,12000,1.0,0.0,0.0,3,7,1040,750.0,1960,1960.0,98198,47.3945,-122.31299999999999,1840,12000,55.0,1960,2014-06-01
12/1/2014,1100000.0,4,2.5,3830,13800,1.0,0.0,4.0,4,9,2030,1800.0,1969,1969.0,98006,47.5671,-122.15700000000001,3460,9875,46.0,1969,2014-12-01
8/20/2014,249000.0,3,1.5,1580,7200,1.0,0.0,0.0,4,7,1080,500.0,1976,1976.0,98092,47.2761,-122.152,1580,7470,39.0,1976,2014-08-20
5/16/2014,720000.0,2,1.0,2020,7200,1.0,0.0,3.0,4,7,1700,320.0,1947,1947.0,98146,47.506,-122.384,2020,7200,68.0,1947,2014-05-16
3/25/2015,905000.0,4,2.5,3330,9557,2.0,0.0,0.0,3,10,3330,0.0,1995,1995.0,98006,47.5526,-122.102,3360,9755,20.0,1995,2015-03-25
4/23/2015,824500.0,4,2.5,2610,3500,1.5,0.0,0.0,5,7,1610,1000.0,1927,1927.0,98115,47.6848,-122.32600000000001,1820,3900,88.0,1927,2015-04-23
6/24/2014,762500.0,4,2.75,2610,8760,1.0,0.0,0.0,4,8,1760,850.0,1978,1978.0,98040,47.5875,-122.229,2550,10376,37.0,1978,2014-06-24
4/13/2015,580000.0,3,2.5,1740,1280,3.0,0.0,2.0,3,8,1740,0.0,2008,2008.0,98116,47.589,-122.387,1740,1308,7.0,2008,2015-04-13
8/18/2014,380000.0,3,2.0,1840,8580,1.0,0.0,0.0,3,8,1840,0.0,1990,1990.0,98058,47.4626,-122.132,2190,8580,25.0,1990,2014-08-18
4/1/2015,805000.0,3,1.75,1080,3200,1.0,0.0,0.0,4,7,880,200.0,1926,1926.0,98103,47.6503,-122.338,1780,5200,89.0,1926,2015-04-01
7/16/2014,520000.0,4,1.75,1240,4532,1.5,0.0,0.0,4,7,1240,0.0,1944,1944.0,98117,47.6892,-122.37799999999999,1260,4468,71.0,1944,2014-07-16
2/3/2015,1570000.0,5,4.5,5620,5800,3.0,0.0,3.0,3,11,4700,920.0,1999,1999.0,98199,47.6482,-122.412,2360,5800,16.0,1999,2015-02-03
5/14/2014,175000.0,2,1.0,1170,8925,1.0,0.0,2.0,3,6,1170,0.0,1911,1911.0,98198,47.4017,-122.321,1380,7440,104.0,1911,2014-05-14
6/16/2014,353500.0,4,2.25,1760,9602,2.0,0.0,0.0,3,7,1760,0.0,1987,1987.0,98058,47.4248,-122.15799999999999,1860,9656,28.0,1987,2014-06-16
1/2/2015,500000.0,4,2.5,2230,26989,1.0,0.0,1.0,4,8,1400,830.0,1962,1962.0,98166,47.4285,-122.345,2570,17702,53.0,1962,2015-01-02
2/11/2015,386500.0,3,1.75,1520,7350,1.0,0.0,0.0,4,7,1140,380.0,1972,1972.0,98034,47.7167,-122.17,1380,7350,43.0,1972,2015-02-11
7/16/2014,210000.0,2,1.0,1450,4750,1.0,0.0,0.0,3,7,850,600.0,1950,1950.0,98118,47.5293,-122.272,1190,5000,65.0,1950,2014-07-16
4/23/2015,439500.0,3,2.5,1600,6510,1.0,0.0,0.0,3,7,940,0.0,1983,1983.0,98155,47.7679,-122.30799999999999,1600,10507,32.0,1983,2015-04-23
8/13/2014,315000.0,5,2.5,3220,5751,2.0,0.0,0.0,3,8,3220,0.0,2002,2002.0,98042,47.3717,-122.104,2740,5500,13.0,2002,2014-08-13
5/19/2014,339000.0,4,2.5,1830,8601,2.0,0.0,0.0,3,7,1830,0.0,2003,2003.0,98038,47.3576,-122.016,1830,5184,12.0,2003,2014-05-19
9/24/2014,655000.0,4,2.25,2200,9163,1.0,0.0,0.0,4,8,1430,770.0,1971,1971.0,98006,47.5653,-122.146,2420,9163,44.0,1971,2014-09-24
8/28/2014,740000.0,2,2.5,2170,8678,1.0,0.0,0.0,3,8,2170,0.0,2008,2008.0,98053,47.7161,-122.014,2170,5890,7.0,2008,2014-08-28
3/6/2015,685000.0,5,2.5,1900,7843,2.0,0.0,0.0,5,7,1900,0.0,1966,1966.0,98008,47.6273,-122.12299999999999,1900,7350,49.0,1966,2015-03-06
3/10/2015,550000.0,5,2.5,2960,9877,1.0,0.0,0.0,4,7,1480,1480.0,1960,1960.0,98005,47.5866,-122.171,1900,9877,55.0,1960,2015-03-10
6/2/2014,405000.0,2,1.75,1710,4234,2.0,0.0,0.0,3,7,1330,380.0,1920,1979.0,98136,47.5319,-122.38600000000001,1530,4556,36.0,1979,2014-06-02
4/16/2015,765000.0,4,2.25,2620,17366,1.0,0.0,3.0,3,9,1430,1190.0,1984,1984.0,98075,47.583999999999996,-122.07700000000001,2620,15335,31.0,1984,2015-04-16
3/4/2015,625000.0,3,2.0,2140,3600,2.0,0.0,0.0,3,8,1680,460.0,1911,1997.0,98116,47.5846,-122.383,2340,5400,18.0,1997,2015-03-04
10/6/2014,207000.0,4,2.5,2100,19680,1.5,0.0,0.0,3,6,2100,0.0,1914,1914.0,98055,47.4787,-122.23,1340,12300,101.0,1914,2014-10-06
3/12/2015,370000.0,4,2.5,2100,19680,1.5,0.0,0.0,3,6,2100,0.0,1914,1914.0,98055,47.4787,-122.23,1340,12300,101.0,1914,2015-03-12
12/2/2014,475000.0,3,2.5,1460,4961,1.0,0.0,0.0,4,8,1150,310.0,1988,1988.0,98033,47.6955,-122.18299999999999,1550,5449,27.0,1988,2014-12-02
8/29/2014,365000.0,2,1.0,990,8250,1.0,0.0,0.0,3,7,990,0.0,1955,1955.0,98133,47.7252,-122.331,1080,8168,60.0,1955,2014-08-29
12/22/2014,411800.0,4,2.25,2190,6800,1.0,0.0,0.0,5,7,1340,850.0,1969,1969.0,98011,47.7367,-122.195,1560,7611,46.0,1969,2014-12-22
7/21/2014,668000.0,5,3.5,3990,42436,2.0,0.0,0.0,3,9,2710,1280.0,2002,2002.0,98027,47.46100000000001,-122.0,3030,41684,13.0,2002,2014-07-21
9/11/2014,618000.0,3,2.5,2340,3630,2.0,0.0,0.0,3,9,2340,0.0,1998,1998.0,98122,47.6059,-122.307,1820,5120,17.0,1998,2014-09-11
12/26/2014,247500.0,4,2.0,2460,5921,1.0,0.0,0.0,4,7,1230,1230.0,1948,1948.0,98002,47.308,-122.209,1260,6648,67.0,1948,2014-12-26
7/30/2014,345000.0,5,3.0,2080,6150,1.0,0.0,0.0,3,7,1040,1040.0,1950,1950.0,98116,47.5707,-122.39399999999999,1420,6150,65.0,1950,2014-07-30
3/11/2015,616300.0,3,2.0,1700,8400,2.0,0.0,2.0,3,7,1700,0.0,1927,1927.0,98033,47.6825,-122.19,1820,9000,88.0,1927,2015-03-11
1/16/2015,348000.0,3,1.5,1330,6768,1.0,0.0,0.0,4,7,1330,0.0,1952,1952.0,98155,47.7366,-122.319,1320,6910,63.0,1952,2015-01-16
12/2/2014,425000.0,3,2.5,1630,10762,1.0,0.0,0.0,3,7,1630,0.0,1994,1994.0,98011,47.7508,-122.175,1770,10762,21.0,1994,2014-12-02
6/14/2014,850000.0,5,2.75,2920,11880,1.0,0.0,0.0,5,8,1660,1260.0,1968,1968.0,98027,47.5133,-122.031,3910,14491,47.0,1968,2014-06-14
7/17/2014,820000.0,5,2.75,2830,6137,2.0,0.0,0.0,3,9,2830,0.0,2010,2010.0,98074,47.5932,-122.05799999999999,3170,6285,5.0,2010,2014-07-17
1/13/2015,832000.0,4,2.25,3190,52953,2.0,0.0,0.0,4,10,3190,0.0,1980,1980.0,98075,47.5933,-122.075,3190,51400,35.0,1980,2015-01-13
12/3/2014,835000.0,3,1.75,1490,3840,2.0,0.0,0.0,3,8,1490,0.0,1984,2014.0,98033,47.6916,-122.214,3450,8500,1.0,2014,2014-12-03
4/10/2015,350000.0,3,2.5,1630,3425,2.0,0.0,0.0,3,8,1630,0.0,1999,1999.0,98059,47.4913,-122.154,1420,3425,16.0,1999,2015-04-10
7/22/2014,349000.0,4,2.5,2280,4096,2.0,0.0,0.0,3,7,2280,0.0,2003,2003.0,98056,47.4834,-122.182,2280,3600,12.0,2003,2014-07-22
6/13/2014,1130000.0,6,3.75,3010,4360,2.0,0.0,0.0,3,9,2000,1010.0,2014,2014.0,98103,47.6873,-122.333,1600,5160,1.0,2014,2014-06-13
3/9/2015,320000.0,3,2.5,1590,3480,2.0,0.0,0.0,3,7,1590,0.0,2004,2004.0,98056,47.4805,-122.178,1680,3480,11.0,2004,2015-03-09
3/5/2015,150000.0,3,1.0,1250,7210,1.0,0.0,0.0,4,7,1250,0.0,1968,1968.0,98031,47.4169,-122.16799999999999,1010,7210,47.0,1968,2015-03-05
11/25/2014,340000.0,3,1.0,1710,10190,1.0,0.0,0.0,3,6,1310,400.0,1949,1949.0,98168,47.506,-122.331,1200,6251,66.0,1949,2014-11-25
10/13/2014,785500.0,4,4.0,3280,8448,2.0,0.0,0.0,3,10,3280,0.0,2007,2007.0,98075,47.5818,-121.973,3730,8030,8.0,2007,2014-10-13
2/17/2015,410500.0,4,2.5,3362,8601,2.0,0.0,0.0,3,8,3362,0.0,2004,2004.0,98003,47.2592,-122.304,2770,8601,11.0,2004,2015-02-17
7/1/2014,580000.0,3,2.5,2200,11000,2.0,0.0,2.0,3,9,2200,0.0,1978,1978.0,98008,47.5916,-122.11200000000001,2200,12851,37.0,1978,2014-07-01
4/21/2015,345000.0,2,1.5,830,920,2.0,0.0,0.0,3,7,830,0.0,2005,2005.0,98144,47.5998,-122.306,830,1200,10.0,2005,2015-04-21
9/29/2014,550000.0,3,2.25,2160,37000,1.5,0.0,0.0,4,7,1760,400.0,1933,1933.0,98052,47.7297,-122.139,2540,37000,82.0,1933,2014-09-29
10/21/2014,449500.0,4,3.0,2580,7299,2.0,0.0,0.0,3,8,2580,0.0,1998,1998.0,98058,47.4646,-122.15,2250,6165,17.0,1998,2014-10-21
6/24/2014,300000.0,3,1.0,2150,7007,1.0,0.0,0.0,3,6,2150,0.0,1954,1954.0,98177,47.7615,-122.36200000000001,1720,9000,61.0,1954,2014-06-24
11/11/2014,915000.0,4,2.5,3510,28052,2.0,0.0,0.0,3,10,3510,0.0,1988,1988.0,98053,47.6671,-122.057,2890,28295,27.0,1988,2014-11-11
1/27/2015,1580000.0,4,3.75,3810,9916,2.0,0.0,0.0,3,11,3810,0.0,1989,1989.0,98040,47.5739,-122.234,3040,11250,26.0,1989,2015-01-27
5/28/2014,599000.0,4,2.75,2020,2750,1.0,0.0,0.0,3,8,1010,1010.0,1917,2014.0,98122,47.6053,-122.291,1840,4000,1.0,2014,2014-05-28
5/5/2014,755000.0,4,2.5,2120,10202,1.0,0.0,0.0,4,7,1620,500.0,1960,1960.0,98005,47.5858,-122.17,1570,10762,55.0,1960,2014-05-05
4/2/2015,400000.0,3,1.0,1250,7157,1.0,0.0,0.0,3,7,1250,0.0,1944,2010.0,98125,47.7323,-122.304,1300,6796,5.0,2010,2015-04-02
3/30/2015,133000.0,3,1.0,980,9115,1.0,0.0,0.0,3,7,980,0.0,1968,1968.0,98198,47.3737,-122.31200000000001,1470,8716,47.0,1968,2015-03-30
1/16/2015,330000.0,4,1.5,1250,8400,1.0,0.0,0.0,3,7,960,290.0,1951,1951.0,98155,47.7505,-122.315,1560,8400,64.0,1951,2015-01-16
2/18/2015,330000.0,4,1.0,1100,5000,1.5,0.0,0.0,5,6,1100,0.0,1904,1904.0,98055,47.4868,-122.204,1560,4838,111.0,1904,2015-02-18
9/5/2014,375000.0,3,1.75,1330,9417,1.0,0.0,0.0,5,6,710,620.0,1936,1936.0,98125,47.7231,-122.301,1690,7937,79.0,1936,2014-09-05
12/11/2014,485000.0,4,2.75,2560,8956,1.0,0.0,0.0,4,7,1500,1060.0,1968,1968.0,98034,47.7278,-122.177,2280,9234,47.0,1968,2014-12-11
7/22/2014,470000.0,4,2.5,1850,11250,1.5,0.0,0.0,3,7,1210,640.0,1981,1981.0,98074,47.6264,-122.06200000000001,1650,7623,34.0,1981,2014-07-22
12/21/2014,1050000.0,4,3.0,2790,3600,2.0,0.0,0.0,3,8,1880,910.0,1905,2013.0,98119,47.6362,-122.363,1360,3600,2.0,2013,2014-12-21
7/7/2014,548800.0,4,1.0,1660,4704,1.5,0.0,0.0,3,7,1260,400.0,1930,1930.0,98115,47.6918,-122.32,1360,5413,85.0,1930,2014-07-07
7/8/2014,315000.0,2,1.0,1080,2674,1.0,0.0,0.0,4,6,720,360.0,1919,1919.0,98108,47.5595,-122.31700000000001,1250,5000,96.0,1919,2014-07-08
9/19/2014,590000.0,3,2.0,3030,9374,1.0,0.0,1.0,4,7,2100,930.0,1959,1959.0,98136,47.5289,-122.391,1990,6012,56.0,1959,2014-09-19
5/23/2014,439950.0,4,2.5,2380,12067,2.0,0.0,0.0,3,7,2380,0.0,2002,2002.0,98059,47.4873,-122.14399999999999,2330,8621,13.0,2002,2014-05-23
6/3/2014,325000.0,3,1.75,2250,26337,1.0,0.0,0.0,3,8,2250,0.0,1980,1980.0,98092,47.3032,-122.12299999999999,1830,26337,35.0,1980,2014-06-03
12/8/2014,400000.0,2,1.0,880,5111,1.0,0.0,0.0,3,6,880,0.0,1931,1931.0,98115,47.6997,-122.314,1370,5111,84.0,1931,2014-12-08
12/11/2014,685000.0,4,2.5,2770,10051,2.0,0.0,0.0,3,10,2770,0.0,1987,1987.0,98074,47.6288,-122.04299999999999,2730,10675,28.0,1987,2014-12-11
9/18/2014,339950.0,3,2.0,1340,10200,1.5,0.0,0.0,3,7,1340,0.0,1953,1953.0,98133,47.7756,-122.351,1420,10200,62.0,1953,2014-09-18
10/23/2014,315000.0,3,1.75,1660,8160,1.0,0.0,0.0,4,7,1660,0.0,1951,1951.0,98166,47.4608,-122.35799999999999,1490,8100,64.0,1951,2014-10-23
2/11/2015,411753.0,3,2.5,1710,3795,2.0,0.0,0.0,3,7,1710,0.0,2009,2009.0,98053,47.6968,-122.024,1600,3821,6.0,2009,2015-02-11
8/28/2014,577000.0,2,1.75,1620,4879,1.0,0.0,0.0,3,7,1040,580.0,1924,2011.0,98116,47.5703,-122.385,1500,5000,4.0,2011,2014-08-28
10/17/2014,500000.0,3,1.75,1530,8829,1.0,0.0,0.0,5,8,1530,0.0,1972,1972.0,98006,47.545,-122.171,2060,9226,43.0,1972,2014-10-17
12/2/2014,210000.0,3,2.0,1440,10111,1.0,0.0,0.0,3,7,1440,0.0,1963,1963.0,98001,47.345,-122.28299999999999,1580,10200,52.0,1963,2014-12-02
8/27/2014,640000.0,4,1.75,2020,16120,1.0,0.0,0.0,3,7,2020,0.0,1969,1969.0,98010,47.3413,-122.04799999999999,1940,16350,46.0,1969,2014-08-27
4/17/2015,460000.0,4,1.75,1870,8663,1.0,0.0,0.0,5,7,1870,0.0,1949,1949.0,98133,47.7366,-122.35,1560,7800,66.0,1949,2015-04-17
2/18/2015,265000.0,2,1.0,620,4760,1.0,0.0,0.0,3,6,620,0.0,1941,1941.0,98126,47.5286,-122.376,620,4760,74.0,1941,2015-02-18
5/14/2014,740000.0,5,5.0,5774,31675,1.0,0.0,2.0,3,11,4490,1284.0,1984,1984.0,98003,47.3466,-122.323,3260,13200,31.0,1984,2014-05-14
7/18/2014,230000.0,3,1.0,1240,6195,1.0,0.0,0.0,3,6,1240,0.0,1948,1948.0,98028,47.7681,-122.266,1760,11080,67.0,1948,2014-07-18
2/17/2015,315000.0,3,1.75,1890,10661,1.0,0.0,0.0,5,7,1460,430.0,1978,1978.0,98038,47.3583,-122.056,1680,9604,37.0,1978,2015-02-17
12/23/2014,432000.0,3,1.75,2410,51763,1.0,0.0,0.0,4,8,1410,1000.0,1981,1981.0,98077,47.7429,-122.056,2410,49207,34.0,1981,2014-12-23
2/3/2015,467000.0,3,2.5,1530,3984,2.0,0.0,0.0,3,8,1530,0.0,1995,1995.0,98029,47.568999999999996,-122.007,1720,4005,20.0,1995,2015-02-03
9/25/2014,255000.0,5,3.75,2800,9900,1.0,0.0,0.0,3,7,2800,0.0,1964,1964.0,98023,47.318999999999996,-122.344,1700,13200,51.0,1964,2014-09-25
4/8/2015,316500.0,3,1.75,1460,6360,1.0,0.0,2.0,3,7,1010,450.0,1979,1979.0,98106,47.5311,-122.353,1400,4240,36.0,1979,2015-04-08
4/3/2015,190000.0,4,2.0,1580,6250,1.0,0.0,0.0,3,7,860,720.0,1977,1977.0,98155,47.7659,-122.31,1580,6250,38.0,1977,2015-04-03
5/16/2014,490000.0,3,2.0,1450,2400,1.5,0.0,0.0,3,8,1450,0.0,1900,2003.0,98107,47.6726,-122.381,1450,4275,12.0,2003,2014-05-16
4/17/2015,378000.0,4,1.75,1990,23200,1.0,0.0,0.0,4,7,1990,0.0,1976,1976.0,98059,47.486000000000004,-122.12899999999999,1950,17040,39.0,1976,2015-04-17
2/11/2015,598800.0,6,4.0,4470,17877,3.0,0.0,3.0,3,9,3230,1240.0,2013,2013.0,98188,47.4514,-122.273,1790,18260,2.0,2013,2015-02-11
9/2/2014,333800.0,5,3.0,1980,3868,1.0,0.0,0.0,3,7,1220,760.0,1990,1990.0,98118,47.5173,-122.275,1970,3868,25.0,1990,2014-09-02
5/29/2014,690000.0,4,2.5,2920,9904,2.0,0.0,0.0,4,9,2920,0.0,1990,1990.0,98029,47.5759,-121.995,1810,5617,25.0,1990,2014-05-29
10/21/2014,320000.0,4,1.75,1660,6200,1.0,0.0,0.0,4,6,830,830.0,1948,1948.0,98108,47.56,-122.316,1780,5968,67.0,1948,2014-10-21
4/14/2015,1250000.0,4,3.5,3190,6000,1.5,0.0,3.0,4,9,2410,780.0,1912,1912.0,98144,47.5846,-122.29,2840,4000,103.0,1912,2015-04-14
7/21/2014,335000.0,3,1.5,1560,9600,1.0,0.0,0.0,4,7,1560,0.0,1961,1961.0,98033,47.6918,-122.163,1520,10000,54.0,1961,2014-07-21
8/11/2014,840000.0,3,2.5,3050,33920,1.0,0.0,0.0,3,8,3050,0.0,2004,2004.0,98052,47.7034,-122.072,1970,60984,11.0,2004,2014-08-11
7/14/2014,608250.0,4,2.75,3030,21780,2.0,0.0,0.0,3,8,3030,0.0,1986,1986.0,98166,47.4481,-122.338,3020,28027,29.0,1986,2014-07-14
6/9/2014,550000.0,3,2.5,2260,4165,2.0,0.0,0.0,3,7,2260,0.0,2005,2005.0,98075,47.5922,-122.008,2770,4566,10.0,2005,2014-06-09
4/22/2015,240000.0,3,1.0,1260,7920,1.0,0.0,0.0,3,7,1260,0.0,1966,1966.0,98003,47.3452,-122.30799999999999,1300,7920,49.0,1966,2015-04-22
4/14/2015,998000.0,3,2.25,3370,11757,2.0,0.0,2.0,4,9,3370,0.0,1980,1980.0,98006,47.5573,-122.16,2690,10500,35.0,1980,2015-04-14
8/29/2014,275000.0,3,1.75,1490,8000,1.0,0.0,0.0,3,8,1490,0.0,1978,1978.0,98030,47.3817,-122.166,1740,8165,37.0,1978,2014-08-29
4/24/2015,284200.0,3,2.5,1570,9292,1.0,0.0,0.0,3,7,1110,460.0,1977,1977.0,98001,47.3386,-122.272,1470,9222,38.0,1977,2015-04-24
7/24/2014,1720000.0,4,3.75,4490,7623,2.0,0.0,0.0,4,10,3090,1400.0,1941,1941.0,98112,47.6315,-122.29,3760,7653,74.0,1941,2014-07-24
11/19/2014,2400000.0,4,3.75,4090,24825,2.0,0.0,0.0,4,11,3400,690.0,1926,1926.0,98102,47.6338,-122.319,3910,11500,89.0,1926,2014-11-19
9/5/2014,930800.0,5,2.5,4150,96574,2.0,0.0,0.0,3,10,4150,0.0,1988,1988.0,98053,47.6664,-122.045,3320,40803,27.0,1988,2014-09-05
7/29/2014,930000.0,4,3.0,2900,10400,1.0,0.0,3.0,5,8,1530,1370.0,1959,1959.0,98008,47.5854,-122.11399999999999,2820,10400,56.0,1959,2014-07-29
8/28/2014,215000.0,4,1.5,1430,8775,1.0,0.0,0.0,3,7,1030,400.0,1979,1979.0,98023,47.3034,-122.383,1390,7800,36.0,1979,2014-08-28
4/20/2015,480000.0,2,1.5,1008,26487,1.0,1.0,4.0,4,6,1008,0.0,1943,2002.0,98070,47.3853,-122.479,1132,24079,13.0,2002,2015-04-20
5/20/2014,483945.0,2,1.75,1480,5120,1.0,0.0,0.0,4,6,840,640.0,1951,1951.0,98116,47.558,-122.39200000000001,1090,5120,64.0,1951,2014-05-20
6/9/2014,347000.0,3,1.75,1240,8050,1.0,0.0,0.0,4,7,1240,0.0,1978,1978.0,98074,47.6108,-122.044,1370,9856,37.0,1978,2014-06-09
3/30/2015,232500.0,3,2.0,1370,9760,1.0,0.0,0.0,4,7,1110,260.0,1979,1979.0,98023,47.3009,-122.384,1640,9040,36.0,1979,2015-03-30
5/20/2014,390000.0,4,2.25,1770,33132,1.0,0.0,0.0,4,8,1190,580.0,1965,1965.0,98058,47.4413,-122.15100000000001,2490,20000,50.0,1965,2014-05-20
9/18/2014,550000.0,3,2.25,2160,15360,1.0,0.0,0.0,3,8,1410,750.0,1965,2000.0,98007,47.6232,-122.13799999999999,2180,8480,15.0,2000,2014-09-18
8/12/2014,590000.0,4,2.5,2340,8971,2.0,0.0,0.0,3,9,2340,0.0,1987,1987.0,98029,47.5679,-122.01100000000001,2510,9219,28.0,1987,2014-08-12
5/21/2014,420850.0,1,1.0,960,40946,1.0,0.0,0.0,5,5,960,0.0,1945,1945.0,98014,47.6951,-121.86399999999999,1320,20350,70.0,1945,2014-05-21
2/5/2015,345000.0,4,2.5,2280,8190,1.0,0.0,3.0,3,7,1390,890.0,1983,1983.0,98188,47.4414,-122.272,1990,9000,32.0,1983,2015-02-05
2/27/2015,429800.0,3,2.0,1970,7000,1.0,0.0,0.0,3,8,1970,0.0,1986,1986.0,98038,47.3744,-122.04299999999999,1970,7365,29.0,1986,2015-02-27
6/26/2014,302000.0,4,1.75,1530,17664,1.5,0.0,0.0,3,7,1530,0.0,1968,1968.0,98058,47.4549,-122.155,1530,11625,47.0,1968,2014-06-26
11/4/2014,800000.0,4,1.5,1790,3952,1.5,0.0,0.0,4,8,1790,0.0,1932,1932.0,98103,47.68899999999999,-122.352,1200,3876,83.0,1932,2014-11-04
12/15/2014,250000.0,3,2.5,1700,6000,2.0,0.0,0.0,3,8,1700,0.0,1997,1997.0,98092,47.2615,-122.221,1940,6626,18.0,1997,2014-12-15
7/29/2014,605000.0,3,2.0,2660,4500,1.0,0.0,0.0,4,7,1330,1330.0,1922,1922.0,98199,47.6391,-122.40299999999999,1790,5000,93.0,1922,2014-07-29
5/29/2014,412000.0,3,1.75,1950,52256,1.0,0.0,0.0,4,8,1950,0.0,1985,1985.0,98042,47.3133,-122.07799999999999,2450,51836,30.0,1985,2014-05-29
11/12/2014,252000.0,3,2.0,1340,5670,2.0,0.0,0.0,3,6,1340,0.0,1994,1994.0,98055,47.4498,-122.194,1290,4892,21.0,1994,2014-11-12
9/19/2014,375000.0,3,1.0,1130,12500,1.5,0.0,0.0,3,7,1130,0.0,1954,1954.0,98118,47.5491,-122.26799999999999,2280,8750,61.0,1954,2014-09-19
7/10/2014,725000.0,2,1.75,1950,2719,1.0,0.0,0.0,5,7,1010,940.0,1919,1919.0,98103,47.6513,-122.346,1360,1256,96.0,1919,2014-07-10
10/13/2014,471750.0,5,3.5,3790,8200,1.0,0.0,1.0,3,8,2120,1670.0,2001,2001.0,98056,47.4891,-122.19,1740,8676,14.0,2001,2014-10-13
12/8/2014,490000.0,4,2.25,2020,85813,2.0,0.0,0.0,3,7,2020,0.0,1995,1995.0,98027,47.483000000000004,-122.02600000000001,2120,85813,20.0,1995,2014-12-08
10/1/2014,439000.0,2,1.0,800,5100,1.0,0.0,0.0,3,7,800,0.0,1945,1945.0,98117,47.6775,-122.38799999999999,1330,5100,70.0,1945,2014-10-01
8/22/2014,355000.0,4,2.0,1770,8890,1.0,0.0,0.0,5,6,1770,0.0,1949,1949.0,98166,47.4589,-122.353,1010,7620,66.0,1949,2014-08-22
5/5/2015,250000.0,1,0.75,940,87120,1.0,0.0,0.0,3,6,940,0.0,1944,1944.0,98019,47.7182,-121.956,1930,165528,71.0,1944,2015-05-05
3/26/2015,780000.0,4,2.25,2260,16188,1.0,0.0,0.0,3,10,2260,0.0,1984,1984.0,98006,47.5637,-122.11200000000001,2840,10158,31.0,1984,2015-03-26
11/5/2014,409000.0,2,1.0,890,3271,1.0,0.0,0.0,4,6,890,0.0,1918,1918.0,98116,47.5631,-122.381,1190,5175,97.0,1918,2014-11-05
6/10/2014,420000.0,2,1.0,860,3880,1.0,0.0,0.0,4,6,860,0.0,1916,1916.0,98117,47.6862,-122.391,1230,4260,99.0,1916,2014-06-10
11/13/2014,200000.0,1,0.75,680,9600,1.0,0.0,0.0,3,5,680,0.0,1947,1947.0,98115,47.6964,-122.306,1580,6624,68.0,1947,2014-11-13
1/5/2015,830000.0,2,1.5,2130,35679,1.0,0.0,0.0,4,7,2130,0.0,1963,1963.0,98033,47.6638,-122.171,2670,35679,52.0,1963,2015-01-05
5/29/2014,695000.0,3,2.5,2390,4555,2.0,0.0,0.0,3,9,2390,0.0,2006,2006.0,98074,47.6199,-122.025,2540,4500,9.0,2006,2014-05-29
5/21/2014,815000.0,4,2.75,3488,9614,2.0,0.0,0.0,3,10,3488,0.0,1998,1998.0,98074,47.6055,-122.01299999999999,3600,10891,17.0,1998,2014-05-21
11/13/2014,210000.0,3,1.75,1260,6223,1.0,0.0,0.0,3,7,820,440.0,1983,1983.0,98042,47.3574,-122.15799999999999,1260,6553,32.0,1983,2014-11-13
9/15/2014,635000.0,3,1.75,2940,6000,1.0,0.0,2.0,4,8,1590,1350.0,1957,1957.0,98177,47.7235,-122.369,2880,8100,58.0,1957,2014-09-15
7/21/2014,562500.0,4,2.5,2440,7322,2.0,0.0,0.0,3,9,2440,0.0,1991,1991.0,98056,47.5357,-122.179,2590,9927,24.0,1991,2014-07-21
5/9/2014,402500.0,4,2.5,2600,11951,2.0,0.0,0.0,3,10,2600,0.0,1988,1988.0,98023,47.3053,-122.34,2820,12093,27.0,1988,2014-05-09
12/19/2014,555000.0,3,2.0,2080,7020,1.0,0.0,0.0,4,7,1040,1040.0,1951,1951.0,98115,47.6768,-122.285,1920,7000,64.0,1951,2014-12-19
9/9/2014,310000.0,3,1.0,1990,7173,1.0,0.0,0.0,3,7,1990,0.0,1972,1972.0,98034,47.7116,-122.213,1320,7245,43.0,1972,2014-09-09
9/5/2014,500000.0,4,2.5,2840,18001,2.0,0.0,0.0,3,9,2840,0.0,1994,1994.0,98019,47.7359,-121.962,2500,18001,21.0,1994,2014-09-05
7/23/2014,430000.0,6,3.0,2630,8800,1.0,0.0,0.0,3,7,1610,1020.0,1959,1959.0,98125,47.7166,-122.29299999999999,1220,1173,56.0,1959,2014-07-23
6/28/2014,1600000.0,3,4.25,2820,7200,2.0,0.0,0.0,4,10,2460,360.0,1930,1930.0,98112,47.6298,-122.29,3300,7522,85.0,1930,2014-06-28
10/1/2014,627500.0,4,1.0,1560,4080,1.5,0.0,0.0,3,7,1560,0.0,1923,1923.0,98103,47.6711,-122.331,1890,4080,92.0,1923,2014-10-01
11/24/2014,335000.0,4,2.5,2330,7050,2.0,0.0,0.0,3,8,2330,0.0,1998,1998.0,98178,47.5001,-122.23100000000001,1810,5424,17.0,1998,2014-11-24
3/17/2015,962000.0,4,2.25,3320,20100,1.0,0.0,0.0,4,8,1810,1510.0,1981,1981.0,98006,47.5566,-122.15299999999999,2450,9821,34.0,1981,2015-03-17
7/25/2014,299000.0,3,1.75,1730,14270,1.0,0.0,0.0,3,7,1730,0.0,1959,1959.0,98065,47.5318,-121.833,1600,11232,56.0,1959,2014-07-25
4/14/2015,399950.0,4,2.5,3110,5868,2.0,0.0,0.0,3,8,3110,0.0,2001,2001.0,98042,47.3781,-122.126,2950,5924,14.0,2001,2015-04-14
3/25/2015,322000.0,3,1.0,1230,9660,1.0,0.0,0.0,3,7,1230,0.0,1968,1968.0,98053,47.6829,-122.06,1380,10125,47.0,1968,2015-03-25
6/23/2014,430000.0,2,1.5,950,4625,1.0,0.0,0.0,4,7,950,0.0,1949,1949.0,98103,47.6912,-122.34,1440,4625,66.0,1949,2014-06-23
5/8/2014,307000.0,3,1.75,1890,13860,1.0,0.0,0.0,5,7,1890,0.0,1966,1966.0,98042,47.4156,-122.149,1500,14536,49.0,1966,2014-05-08
11/5/2014,194000.0,3,1.5,1010,5000,1.0,0.0,0.0,3,6,1010,0.0,1943,1943.0,98178,47.4925,-122.27799999999999,980,5000,72.0,1943,2014-11-05
11/14/2014,180000.0,3,1.0,1010,8581,1.0,0.0,0.0,4,6,1010,0.0,1920,1920.0,98002,47.3043,-122.21600000000001,1060,10354,95.0,1920,2014-11-14
7/18/2014,465000.0,4,2.25,2340,13383,1.0,0.0,0.0,3,8,1170,1170.0,1983,1983.0,98074,47.6211,-122.037,1810,12532,32.0,1983,2014-07-18
3/23/2015,722500.0,4,2.5,2460,9296,2.0,0.0,0.0,3,9,2460,0.0,1978,1978.0,98007,47.6125,-122.152,2730,9900,37.0,1978,2015-03-23
9/24/2014,470450.0,2,1.0,1010,3400,1.0,0.0,0.0,3,7,1010,0.0,1921,1921.0,98103,47.6711,-122.329,1800,3600,94.0,1921,2014-09-24
1/27/2015,280000.0,3,2.5,1650,6000,2.0,0.0,0.0,3,7,1650,0.0,1990,1990.0,98030,47.36,-122.194,1750,6000,25.0,1990,2015-01-27
4/10/2015,176250.0,4,2.0,1440,6702,1.0,0.0,0.0,4,7,1440,0.0,1966,1966.0,98002,47.3056,-122.21700000000001,1030,6702,49.0,1966,2015-04-10
6/17/2014,560000.0,5,1.0,1710,9100,1.5,0.0,0.0,4,7,1320,390.0,1926,1926.0,98126,47.5379,-122.37799999999999,1880,9100,89.0,1926,2014-06-17
10/22/2014,830000.0,3,2.5,2760,11287,2.0,0.0,3.0,3,10,2000,760.0,1991,1991.0,98028,47.739,-122.264,2760,13719,24.0,1991,2014-10-22
6/11/2014,276900.0,2,1.0,1350,10096,1.0,0.0,2.0,4,7,1350,0.0,1952,1952.0,98045,47.4967,-121.77799999999999,1280,10095,63.0,1952,2014-06-11
10/1/2014,625000.0,3,1.75,1660,4800,2.0,0.0,0.0,3,7,1660,0.0,1906,1906.0,98112,47.6296,-122.30799999999999,1660,4800,109.0,1906,2014-10-01
3/4/2015,1020000.0,4,2.5,2960,4760,2.0,0.0,0.0,3,8,2160,800.0,1900,1900.0,98102,47.6367,-122.318,1600,4760,115.0,1900,2015-03-04
9/30/2014,463500.0,1,1.0,1090,8750,1.0,0.0,0.0,4,6,1090,0.0,1924,1924.0,98118,47.54,-122.26899999999999,1830,5000,91.0,1924,2014-09-30
9/5/2014,485000.0,3,2.5,3110,9015,2.0,0.0,0.0,3,9,3110,0.0,1990,1990.0,98058,47.4369,-122.147,2650,8960,25.0,1990,2014-09-05
6/17/2014,272000.0,3,2.0,1380,7476,1.0,0.0,0.0,3,7,1380,0.0,1989,1989.0,98001,47.3336,-122.272,1600,7227,26.0,1989,2014-06-17
12/17/2014,305000.0,2,1.0,1290,3140,2.0,0.0,0.0,3,7,1290,0.0,2008,2008.0,98053,47.6971,-122.02600000000001,1290,2628,7.0,2008,2014-12-17
6/26/2014,760000.0,3,2.5,1980,13964,1.0,0.0,0.0,5,7,1980,0.0,1959,1959.0,98040,47.57100000000001,-122.227,2040,13964,56.0,1959,2014-06-26
2/13/2015,387500.0,2,1.0,870,6126,1.0,0.0,0.0,4,7,870,0.0,1938,1938.0,98125,47.7024,-122.322,1620,6126,77.0,1938,2015-02-13
9/8/2014,352000.0,4,2.5,2470,5015,2.0,0.0,0.0,3,8,2470,0.0,2004,2004.0,98038,47.3457,-122.041,2470,5100,11.0,2004,2014-09-08
7/9/2014,507000.0,3,1.75,2140,40098,1.0,0.0,0.0,5,8,1490,650.0,1950,1950.0,98058,47.4296,-122.111,2220,35371,65.0,1950,2014-07-09
7/18/2014,156000.0,3,1.0,770,9750,1.0,0.0,0.0,3,6,770,0.0,1941,1941.0,98188,47.4509,-122.275,1560,10707,74.0,1941,2014-07-18
11/18/2014,580000.0,3,3.25,1490,857,3.0,0.0,0.0,3,8,1220,270.0,2001,2001.0,98102,47.6357,-122.324,1550,1092,14.0,2001,2014-11-18
7/14/2014,630000.0,4,2.5,2510,35020,1.0,0.0,0.0,4,8,1610,900.0,1977,1977.0,98075,47.5834,-122.00299999999999,2080,34398,38.0,1977,2014-07-14
12/18/2014,275000.0,5,1.5,1950,9000,1.0,0.0,0.0,3,7,1130,820.0,1964,1964.0,98146,47.4882,-122.339,1680,9526,51.0,1964,2014-12-18
7/24/2014,835000.0,5,4.0,3600,14720,1.0,0.0,2.0,5,8,1800,1800.0,1960,1960.0,98034,47.7022,-122.227,3600,15358,55.0,1960,2014-07-24
12/5/2014,340000.0,4,2.5,2380,7850,2.0,0.0,0.0,3,8,2380,0.0,1995,1995.0,98055,47.4356,-122.20100000000001,1940,7334,20.0,1995,2014-12-05
5/6/2014,329350.0,2,1.0,720,6687,1.0,0.0,0.0,3,6,720,0.0,1942,1942.0,98117,47.7001,-122.36200000000001,840,6687,73.0,1942,2014-05-06
7/28/2014,1480000.0,3,3.5,4070,26000,2.0,0.0,0.0,3,11,4070,0.0,1991,1991.0,98033,47.659,-122.17399999999999,3770,26000,24.0,1991,2014-07-28
3/25/2015,475000.0,3,1.0,1250,150117,1.0,0.0,0.0,3,7,1250,0.0,1975,1975.0,98075,47.5956,-122.009,3060,50055,40.0,1975,2015-03-25
11/18/2014,719950.0,3,2.25,2190,2416,3.0,0.0,0.0,3,8,2190,0.0,2014,2014.0,98117,47.6758,-122.38,1510,3615,1.0,2014,2014-11-18
5/12/2014,235000.0,1,1.0,810,2451,1.0,0.0,0.0,5,7,810,0.0,1941,1941.0,98126,47.5188,-122.376,980,1198,74.0,1941,2014-05-12
3/31/2015,875000.0,3,1.5,2440,5750,1.0,0.0,0.0,3,8,1320,1120.0,1939,1939.0,98115,47.6991,-122.296,2160,6820,76.0,1939,2015-03-31
4/21/2015,380000.0,4,1.75,1740,9150,1.0,0.0,0.0,3,7,1740,0.0,1974,1974.0,98188,47.4498,-122.28,1540,9147,41.0,1974,2015-04-21
3/9/2015,325000.0,3,2.25,1480,97138,1.5,0.0,0.0,3,7,1480,0.0,1984,1984.0,98010,47.3317,-121.927,1730,176418,31.0,1984,2015-03-09
8/19/2014,475000.0,4,2.5,2120,57050,2.0,0.0,0.0,3,9,2120,0.0,1989,1989.0,98072,47.7611,-122.12799999999999,3320,39082,26.0,1989,2014-08-19
3/24/2015,152900.0,1,1.0,900,4368,1.0,0.0,0.0,5,6,900,0.0,1915,1950.0,98022,47.2107,-121.99,1290,5000,65.0,1950,2015-03-24
8/5/2014,210000.0,2,2.0,1190,7570,1.0,0.0,0.0,3,6,1190,0.0,1939,1939.0,98146,47.5113,-122.338,1190,7635,76.0,1939,2014-08-05
9/26/2014,350000.0,4,1.0,1010,6000,1.0,0.0,0.0,3,6,750,260.0,1925,1925.0,98136,47.5518,-122.383,1450,6000,90.0,1925,2014-09-26
3/23/2015,505000.0,3,2.5,2100,17882,2.0,0.0,0.0,4,8,2100,0.0,1985,1985.0,98059,47.4754,-122.119,2080,16686,30.0,1985,2015-03-23
6/27/2014,464900.0,4,2.25,2020,8424,1.0,0.0,0.0,4,7,1380,640.0,1979,1979.0,98034,47.7262,-122.23299999999999,2030,7236,36.0,1979,2014-06-27
9/22/2014,650000.0,3,2.0,2520,5980,1.0,0.0,0.0,3,8,1790,730.0,1957,1957.0,98116,47.5767,-122.383,1590,5750,58.0,1957,2014-09-22
5/4/2015,369950.0,2,2.75,1370,1140,2.0,0.0,0.0,3,8,1080,290.0,2009,2009.0,98133,47.7053,-122.34200000000001,1370,1090,6.0,2009,2015-05-04
7/28/2014,250000.0,3,2.5,1530,2890,2.0,0.0,0.0,3,7,1530,0.0,2001,2001.0,98108,47.5434,-122.29299999999999,1540,2890,14.0,2001,2014-07-28
4/29/2015,320000.0,3,2.5,1530,2890,2.0,0.0,0.0,3,7,1530,0.0,2001,2001.0,98108,47.5434,-122.29299999999999,1540,2890,14.0,2001,2015-04-29
3/25/2015,2530000.0,4,4.25,5040,16048,1.0,0.0,3.0,3,10,3420,1620.0,1950,1950.0,98105,47.6702,-122.26,3960,14000,65.0,1950,2015-03-25
9/3/2014,340000.0,4,2.25,2530,24700,2.0,0.0,0.0,3,7,2530,0.0,1974,1974.0,98031,47.3939,-122.177,2650,24700,41.0,1974,2014-09-03
5/19/2014,440000.0,2,1.5,1010,1968,1.5,0.0,0.0,5,5,1010,0.0,1906,1906.0,98107,47.6757,-122.385,1760,4200,109.0,1906,2014-05-19
4/2/2015,219950.0,3,1.0,1200,7727,1.0,0.0,0.0,4,7,1200,0.0,1959,1959.0,98022,47.2021,-121.999,1300,7718,56.0,1959,2015-04-02
9/15/2014,940000.0,4,3.0,2720,11740,1.0,0.0,0.0,5,9,2720,0.0,1957,1957.0,98040,47.5833,-122.242,2640,11740,58.0,1957,2014-09-15
7/22/2014,399950.0,4,1.5,1850,6125,1.5,0.0,0.0,3,6,1110,740.0,1945,1945.0,98126,47.5352,-122.37,990,6125,70.0,1945,2014-07-22
1/2/2015,1570000.0,3,2.75,2340,8828,1.0,0.0,0.0,4,9,2340,0.0,1954,1954.0,98112,47.632,-122.289,3480,8526,61.0,1954,2015-01-02
4/1/2015,528000.0,4,1.75,1860,9750,1.0,0.0,0.0,3,7,1460,400.0,1969,1969.0,98034,47.7097,-122.20200000000001,1900,8913,46.0,1969,2015-04-01
8/28/2014,545000.0,4,1.75,1940,8990,1.0,0.0,0.0,4,8,1560,380.0,1956,1956.0,98034,47.7021,-122.241,2310,11745,59.0,1956,2014-08-28
4/27/2015,575000.0,2,2.0,1680,6194,1.0,0.0,0.0,3,8,1680,0.0,2004,2004.0,98053,47.7136,-122.03,1900,5850,11.0,2004,2015-04-27
11/4/2014,235000.0,4,2.75,1770,10184,1.0,0.0,0.0,3,8,1250,520.0,1979,1979.0,98023,47.3074,-122.385,2070,8320,36.0,1979,2014-11-04
7/23/2014,272000.0,3,2.5,1790,6371,2.0,0.0,0.0,3,8,1790,0.0,1998,1998.0,98092,47.3291,-122.16799999999999,1850,6371,17.0,1998,2014-07-23
4/28/2015,380000.0,4,1.75,1720,9600,1.0,0.0,0.0,4,8,1720,0.0,1969,1969.0,98059,47.4764,-122.155,1660,10720,46.0,1969,2015-04-28
4/26/2015,195000.0,3,1.0,1280,6967,1.5,0.0,0.0,3,7,1280,0.0,1949,1949.0,98155,47.7512,-122.329,1280,7245,66.0,1949,2015-04-26
10/14/2014,297000.0,3,2.5,1690,4988,2.0,0.0,0.0,3,7,1690,0.0,2002,2002.0,98038,47.3561,-122.015,1830,4733,13.0,2002,2014-10-14
4/15/2015,349000.0,4,2.5,2190,7294,2.0,0.0,0.0,3,8,2190,0.0,2003,2003.0,98023,47.2923,-122.35700000000001,2240,7379,12.0,2003,2015-04-15
9/29/2014,320000.0,2,1.0,710,5200,1.0,0.0,2.0,4,6,710,0.0,1942,1942.0,98126,47.5376,-122.37100000000001,1610,5200,73.0,1942,2014-09-29
7/25/2014,319990.0,4,1.5,1890,10707,1.0,0.0,0.0,3,7,1890,0.0,1962,1962.0,98148,47.428000000000004,-122.32600000000001,1610,8827,53.0,1962,2014-07-25
6/2/2014,439900.0,2,2.0,1410,12282,1.5,0.0,0.0,5,8,1410,0.0,1909,1909.0,98024,47.5242,-121.926,1410,8931,106.0,1909,2014-06-02
8/11/2014,429000.0,3,3.25,2210,3600,2.0,0.0,0.0,3,8,1820,390.0,1995,1995.0,98125,47.7031,-122.279,2010,6690,20.0,1995,2014-08-11
7/30/2014,272500.0,3,2.0,1540,6250,1.0,0.0,0.0,3,7,1540,0.0,1998,1998.0,98038,47.3539,-122.025,2070,6250,17.0,1998,2014-07-30
9/16/2014,400000.0,4,2.0,1350,7255,1.0,0.0,0.0,4,7,1350,0.0,1959,1959.0,98125,47.7287,-122.31,1050,7288,56.0,1959,2014-09-16
4/2/2015,462000.0,5,2.0,1380,4300,1.5,0.0,0.0,3,7,1380,0.0,1916,1916.0,98103,47.6647,-122.337,1830,3800,99.0,1916,2015-04-02
3/10/2015,510000.0,2,1.0,890,6095,1.0,0.0,0.0,3,7,890,0.0,1947,1947.0,98115,47.6823,-122.29799999999999,1450,5985,68.0,1947,2015-03-10
6/23/2014,550000.0,3,2.5,1900,3255,2.0,0.0,0.0,3,8,1900,0.0,1988,2000.0,98007,47.6075,-122.147,1880,3350,15.0,2000,2014-06-23
4/25/2015,150000.0,3,1.0,1240,5200,1.0,0.0,0.0,3,6,1240,0.0,1969,1969.0,98042,47.3701,-122.079,870,5200,46.0,1969,2015-04-25
6/26/2014,460000.0,3,2.5,1730,8490,1.0,0.0,0.0,3,7,1210,520.0,1969,1969.0,98034,47.7187,-122.219,1870,7400,46.0,1969,2014-06-26
6/20/2014,632500.0,4,2.5,2090,10306,2.0,0.0,0.0,3,10,2090,0.0,1986,1986.0,98074,47.6304,-122.051,2660,11481,29.0,1986,2014-06-20
9/25/2014,361000.0,3,1.75,1650,11220,1.0,0.0,0.0,4,7,1650,0.0,1969,1969.0,98077,47.7567,-122.071,1340,10129,46.0,1969,2014-09-25
8/1/2014,437000.0,3,2.25,1130,1221,2.0,0.0,0.0,3,8,1030,100.0,2004,2004.0,98117,47.6799,-122.375,1300,5000,11.0,2004,2014-08-01
5/5/2015,370000.0,6,2.75,3240,5750,1.0,0.0,0.0,4,6,2160,1080.0,1950,1950.0,98002,47.3054,-122.221,1230,5750,65.0,1950,2015-05-05
4/17/2015,884250.0,4,2.5,3840,12151,2.0,0.0,0.0,3,10,3840,0.0,1998,1998.0,98075,47.5953,-121.986,3560,11044,17.0,1998,2015-04-17
6/3/2014,225000.0,3,1.0,1200,9936,1.0,0.0,0.0,4,6,1200,0.0,1969,1969.0,98038,47.3609,-122.029,1200,10189,46.0,1969,2014-06-03
8/5/2014,235000.0,2,1.0,870,5000,1.0,0.0,0.0,3,6,870,0.0,1949,1949.0,98126,47.5186,-122.375,820,5000,66.0,1949,2014-08-05
7/20/2014,767500.0,6,3.5,2410,6000,2.0,0.0,4.0,3,9,2220,190.0,1916,1990.0,98136,47.54,-122.382,1980,6000,25.0,1990,2014-07-20
5/12/2014,1200000.0,3,1.75,1560,8078,1.5,1.0,4.0,4,6,1560,0.0,1928,1928.0,98040,47.5779,-122.24600000000001,2890,16710,87.0,1928,2014-05-12
12/15/2014,715000.0,3,2.5,2410,46609,2.0,0.0,0.0,3,9,2410,0.0,1989,1989.0,98053,47.6789,-122.04799999999999,3370,40072,26.0,1989,2014-12-15
6/27/2014,417000.0,4,2.25,2300,7700,1.0,0.0,0.0,3,7,1380,920.0,1959,1959.0,98125,47.7137,-122.322,2010,8820,56.0,1959,2014-06-27
7/18/2014,199000.0,3,1.0,1390,12145,1.0,0.0,0.0,4,7,1390,0.0,1964,1964.0,98042,47.4225,-122.15,1030,10800,51.0,1964,2014-07-18
6/5/2014,875000.0,5,2.5,2920,5568,2.0,0.0,0.0,3,8,2320,600.0,1906,1906.0,98112,47.6265,-122.31200000000001,2970,5568,109.0,1906,2014-06-05
11/10/2014,545000.0,4,1.5,1370,3708,1.5,0.0,0.0,3,7,1370,0.0,1926,1926.0,98117,47.6849,-122.363,2030,3708,89.0,1926,2014-11-10
5/20/2014,192500.0,2,1.0,950,7692,1.0,0.0,0.0,3,6,950,0.0,1926,1926.0,98168,47.4909,-122.29799999999999,1820,8221,89.0,1926,2014-05-20
2/10/2015,822500.0,3,2.5,3090,7708,2.0,0.0,0.0,3,10,3090,0.0,1999,1999.0,98052,47.6868,-122.10799999999999,3140,8592,16.0,1999,2015-02-10
12/8/2014,800000.0,4,2.5,2390,10000,1.0,0.0,0.0,3,9,1590,800.0,1975,1975.0,98040,47.5801,-122.229,1900,9752,40.0,1975,2014-12-08
12/15/2014,1250000.0,3,2.5,2070,4944,2.0,0.0,0.0,3,9,2070,0.0,1930,1930.0,98112,47.6256,-122.28399999999999,3300,6179,85.0,1930,2014-12-15
11/14/2014,3850000.0,4,4.25,5770,21300,2.0,1.0,4.0,4,11,5770,0.0,1980,1980.0,98040,47.585,-122.22200000000001,4620,22748,35.0,1980,2014-11-14
10/1/2014,295000.0,3,2.5,1460,7936,2.0,0.0,0.0,3,7,1460,0.0,1995,1995.0,98038,47.3673,-122.01700000000001,1830,7936,20.0,1995,2014-10-01
6/30/2014,419000.0,2,1.75,1510,4980,1.0,0.0,0.0,3,8,1510,0.0,2006,2006.0,98053,47.7191,-122.023,1350,4157,9.0,2006,2014-06-30
9/10/2014,1200000.0,5,3.25,5180,19606,1.0,0.0,0.0,3,11,2610,2570.0,1993,1993.0,98006,47.555,-122.11399999999999,4050,15296,22.0,1993,2014-09-10
12/22/2014,750000.0,4,2.75,3430,13907,2.0,0.0,0.0,3,11,3430,0.0,1995,1995.0,98075,47.5879,-121.993,3250,13851,20.0,1995,2014-12-22
4/28/2015,502000.0,4,1.5,1700,8400,1.0,0.0,0.0,3,7,1700,0.0,1953,1953.0,98177,47.7677,-122.359,1750,8475,62.0,1953,2015-04-28
6/4/2014,1030000.0,3,1.75,2640,8000,1.0,0.0,3.0,4,9,1320,1320.0,1960,1960.0,98040,47.5826,-122.24600000000001,2740,6000,55.0,1960,2014-06-04
3/13/2015,398500.0,3,1.0,1200,15960,1.5,0.0,0.0,3,6,1200,0.0,1945,1945.0,98125,47.7163,-122.29899999999999,1120,7800,70.0,1945,2015-03-13
4/14/2015,700000.0,2,1.5,1850,4945,1.5,0.0,2.0,4,7,1850,0.0,1907,1969.0,98126,47.5742,-122.37899999999999,1850,4950,46.0,1969,2015-04-14
6/11/2014,248000.0,5,1.5,1510,9078,1.0,0.0,0.0,4,7,1510,0.0,1959,1959.0,98168,47.4852,-122.305,1480,9078,56.0,1959,2014-06-11
8/26/2014,800000.0,4,2.0,2130,2800,1.0,0.0,0.0,5,7,1070,1060.0,1922,1922.0,98103,47.6545,-122.333,1990,3990,93.0,1922,2014-08-26
1/21/2015,383000.0,4,2.5,2640,8055,2.0,0.0,0.0,3,9,2640,0.0,2004,2004.0,98092,47.315,-122.193,1650,8055,11.0,2004,2015-01-21
5/27/2014,688000.0,4,3.0,3000,4000,1.5,0.0,3.0,3,8,1970,1030.0,1913,2014.0,98144,47.5744,-122.307,1900,4000,1.0,2014,2014-05-27
10/8/2014,521000.0,3,2.0,1870,5455,1.0,0.0,0.0,5,7,1060,810.0,1926,1926.0,98125,47.7029,-122.29700000000001,1870,7435,89.0,1926,2014-10-08
11/5/2014,365000.0,2,1.0,990,9223,1.0,0.0,0.0,3,7,990,0.0,1949,1949.0,98125,47.72,-122.32,1230,7244,66.0,1949,2014-11-05
10/7/2014,491000.0,3,2.0,2005,7000,1.0,0.0,0.0,3,7,1605,400.0,1980,1980.0,98122,47.6039,-122.29799999999999,1750,4500,35.0,1980,2014-10-07
11/22/2014,643000.0,3,2.75,2030,7700,1.0,0.0,0.0,5,8,1400,630.0,1965,1965.0,98008,47.62600000000001,-122.11200000000001,1780,8160,50.0,1965,2014-11-22
2/2/2015,279000.0,3,2.5,1500,7350,1.0,0.0,0.0,2,7,1060,440.0,1979,1979.0,98023,47.3025,-122.382,1390,7770,36.0,1979,2015-02-02
2/2/2015,583500.0,4,1.0,1530,3900,1.5,0.0,0.0,4,7,1530,0.0,1908,1908.0,98107,47.6748,-122.37899999999999,1300,3900,107.0,1908,2015-02-02
7/23/2014,310000.0,3,2.5,1990,3600,2.0,0.0,0.0,3,7,1990,0.0,2004,2004.0,98038,47.3841,-122.041,1790,3600,11.0,2004,2014-07-23
6/10/2014,310000.0,3,1.75,1420,7650,1.0,0.0,0.0,4,7,1100,320.0,1984,1984.0,98056,47.4892,-122.182,1810,7650,31.0,1984,2014-06-10
3/23/2015,280000.0,3,1.0,1400,13975,1.0,0.0,0.0,4,6,1400,0.0,1956,1956.0,98198,47.4195,-122.33,1260,7500,59.0,1956,2015-03-23
11/17/2014,272000.0,4,2.5,1870,5692,2.0,0.0,0.0,3,7,1870,0.0,2004,2004.0,98058,47.4334,-122.148,2390,5293,11.0,2004,2014-11-17
7/7/2014,870000.0,4,3.0,3040,36246,1.5,0.0,0.0,3,9,2680,360.0,1923,2014.0,98074,47.6093,-122.07,3520,13178,1.0,2014,2014-07-07
11/18/2014,307000.0,3,2.0,1790,7259,1.0,0.0,0.0,3,7,1390,400.0,1980,1980.0,98058,47.4643,-122.171,1790,7700,35.0,1980,2014-11-18
7/17/2014,490000.0,2,1.5,1590,4500,1.0,0.0,0.0,4,7,920,670.0,1946,1946.0,98116,47.5831,-122.39200000000001,1900,4450,69.0,1946,2014-07-17
10/8/2014,399950.0,3,2.0,2050,9396,1.0,0.0,0.0,5,7,1170,880.0,1960,1960.0,98155,47.7447,-122.32799999999999,1680,9391,55.0,1960,2014-10-08
6/9/2014,1640000.0,5,3.5,4220,26784,1.0,0.0,0.0,3,10,2110,2110.0,1958,2006.0,98004,47.6003,-122.206,3450,33945,9.0,2006,2014-06-09
7/9/2014,989000.0,5,4.5,4030,13474,2.0,0.0,0.0,3,11,4030,0.0,2000,2000.0,98075,47.5812,-121.995,3860,12438,15.0,2000,2014-07-09
6/18/2014,264950.0,4,1.75,1770,9011,1.0,0.0,0.0,5,7,1050,720.0,1983,1983.0,98042,47.3646,-122.07600000000001,1410,8530,32.0,1983,2014-06-18
7/25/2014,491500.0,4,2.75,2100,7236,1.0,0.0,0.0,3,8,1400,700.0,1979,1979.0,98034,47.7267,-122.23200000000001,1900,7519,36.0,1979,2014-07-25
5/14/2014,345000.0,3,2.25,2120,15003,2.0,0.0,0.0,3,7,2120,0.0,1984,1984.0,98059,47.4745,-122.12,2070,15203,31.0,1984,2014-05-14
1/19/2015,339900.0,4,1.75,2600,18042,1.0,0.0,0.0,4,8,2020,580.0,1969,1969.0,98092,47.2969,-122.189,2200,9408,46.0,1969,2015-01-19
4/27/2015,852000.0,3,3.0,2400,4000,2.0,0.0,0.0,3,7,1860,540.0,1905,1905.0,98102,47.6288,-122.321,1750,3940,110.0,1905,2015-04-27
12/22/2014,585000.0,5,3.5,3180,40946,1.0,0.0,3.0,3,7,1690,1490.0,1968,1968.0,98075,47.5833,-122.073,2430,29620,47.0,1968,2014-12-22
2/11/2015,723000.0,4,2.0,2790,8793,1.0,0.0,0.0,4,8,1640,1150.0,1977,1977.0,98006,47.5509,-122.16,2400,9286,38.0,1977,2015-02-11
1/26/2015,594000.0,3,2.25,2080,70567,2.0,0.0,0.0,3,8,2080,0.0,1990,1990.0,98072,47.7221,-122.124,3730,43560,25.0,1990,2015-01-26
12/1/2014,405000.0,2,1.5,1370,4102,2.0,0.0,0.0,4,7,1370,0.0,1987,1987.0,98033,47.6943,-122.184,1380,3211,28.0,1987,2014-12-01
8/1/2014,725500.0,4,2.5,2790,74495,2.0,0.0,0.0,3,9,2790,0.0,1997,1997.0,98053,47.6628,-122.056,2790,24643,18.0,1997,2014-08-01
6/25/2014,800000.0,2,1.0,1740,5719,1.0,0.0,0.0,3,8,1740,0.0,1955,1955.0,98103,47.6729,-122.335,1980,5000,60.0,1955,2014-06-25
7/29/2014,1330000.0,3,3.75,6400,76665,1.0,0.0,2.0,4,10,3810,0.0,1966,1966.0,98177,47.7313,-122.37,3430,60548,49.0,1966,2014-07-29
10/15/2014,180500.0,3,2.5,1800,8518,2.0,0.0,0.0,3,7,1800,0.0,1996,1996.0,98030,47.3643,-122.185,1770,7570,19.0,1996,2014-10-15
4/28/2015,325000.0,3,2.5,1800,8518,2.0,0.0,0.0,3,7,1800,0.0,1996,1996.0,98030,47.3643,-122.185,1770,7570,19.0,1996,2015-04-28
6/17/2014,235000.0,3,1.75,1190,7280,1.0,0.0,0.0,4,7,1190,0.0,1968,1968.0,98092,47.3151,-122.19,1250,7800,47.0,1968,2014-06-17
5/20/2014,330000.0,2,1.0,860,8308,1.0,0.0,0.0,4,7,860,0.0,1948,1948.0,98146,47.5075,-122.37700000000001,1310,8308,67.0,1948,2014-05-20
6/12/2014,678500.0,3,2.0,2460,6600,1.0,0.0,2.0,4,8,1370,1090.0,1952,1952.0,98136,47.5215,-122.383,2150,6600,63.0,1952,2014-06-12
7/9/2014,463000.0,4,2.5,1980,6660,2.0,0.0,0.0,4,7,1980,0.0,1974,1974.0,98034,47.7158,-122.167,1980,7150,41.0,1974,2014-07-09
9/12/2014,250000.0,2,1.0,670,4640,1.0,0.0,0.0,3,6,670,0.0,1943,1943.0,98106,47.53,-122.351,870,4501,72.0,1943,2014-09-12
7/16/2014,655000.0,3,2.0,1410,4800,1.5,0.0,0.0,4,8,1410,0.0,1927,1927.0,98118,47.5597,-122.26700000000001,1820,7200,88.0,1927,2014-07-16
5/16/2014,239900.0,4,2.25,1860,7000,1.0,0.0,0.0,3,8,1120,740.0,1979,1979.0,98023,47.3127,-122.339,1990,8937,36.0,1979,2014-05-16
11/17/2014,185000.0,3,1.0,980,9135,1.0,0.0,0.0,3,7,980,0.0,1955,1955.0,98001,47.3496,-122.289,1780,9135,60.0,1955,2014-11-17
6/16/2014,1740000.0,4,2.25,3040,5000,2.0,0.0,3.0,4,9,2080,960.0,1926,1926.0,98105,47.6565,-122.27799999999999,2870,5000,89.0,1926,2014-06-16
9/5/2014,251700.0,3,2.25,1810,11800,1.0,0.0,0.0,3,7,1240,570.0,1977,1977.0,98178,47.4997,-122.23100000000001,1810,5641,38.0,1977,2014-09-05
2/9/2015,400000.0,4,2.0,1560,8250,1.0,0.0,0.0,3,8,1320,240.0,1964,1964.0,98177,47.7565,-122.35799999999999,1870,8258,51.0,1964,2015-02-09
9/4/2014,735000.0,4,1.75,2100,7960,1.0,0.0,0.0,3,8,1340,760.0,1955,1955.0,98004,47.6079,-122.195,2060,7960,60.0,1955,2014-09-04
10/27/2014,1700000.0,5,2.0,2500,15250,2.0,1.0,4.0,5,8,2500,0.0,1942,1942.0,98008,47.5883,-122.111,1880,18782,73.0,1942,2014-10-27
5/8/2014,82500.0,2,1.0,520,22334,1.0,0.0,0.0,2,5,520,0.0,1951,1951.0,98168,47.4799,-122.296,1572,10570,64.0,1951,2014-05-08
7/8/2014,765000.0,4,4.0,3010,7221,2.0,0.0,0.0,3,10,3010,0.0,2004,2004.0,98075,47.5833,-121.97,3490,7518,11.0,2004,2014-07-08
9/23/2014,292500.0,4,1.75,2140,8162,1.0,0.0,0.0,3,7,1420,720.0,1968,1968.0,98023,47.3096,-122.37700000000001,2040,7632,47.0,1968,2014-09-23
3/25/2015,270000.0,3,2.25,2390,7000,1.0,0.0,0.0,4,7,1990,400.0,1970,1970.0,98058,47.4568,-122.169,1610,7000,45.0,1970,2015-03-25
12/24/2014,415000.0,2,1.0,1510,6807,1.0,0.0,0.0,3,7,1090,420.0,1939,1939.0,98133,47.71100000000001,-122.353,1460,6807,76.0,1939,2014-12-24
11/24/2014,950000.0,4,1.75,2210,19025,1.0,0.0,0.0,4,7,1460,750.0,1952,1952.0,98004,47.5927,-122.20299999999999,2640,14999,63.0,1952,2014-11-24
9/16/2014,353000.0,3,2.75,2170,8396,2.0,0.0,0.0,3,7,2170,0.0,1995,1995.0,98038,47.3812,-122.023,2170,8378,20.0,1995,2014-09-16
12/10/2014,670950.0,3,2.5,1790,2375,3.0,0.0,0.0,3,8,1790,0.0,2007,2007.0,98107,47.6726,-122.38,1450,2400,8.0,2007,2014-12-10
5/9/2014,280950.0,3,1.75,1390,8700,1.0,0.0,3.0,4,7,840,550.0,1912,1912.0,98055,47.4725,-122.20200000000001,1390,10875,103.0,1912,2014-05-09
5/27/2014,585000.0,3,1.75,1850,7735,1.0,0.0,0.0,4,8,1850,0.0,1983,1983.0,98027,47.5608,-122.08200000000001,2220,7639,32.0,1983,2014-05-27
12/11/2014,525000.0,2,1.5,1480,43645,1.0,0.0,0.0,3,8,1480,0.0,1974,1974.0,98027,47.5484,-122.045,1600,34326,41.0,1974,2014-12-11
8/1/2014,605000.0,3,1.75,1850,8823,1.0,0.0,0.0,4,8,1370,480.0,1973,1973.0,98008,47.6379,-122.11200000000001,1880,7580,42.0,1973,2014-08-01
11/19/2014,1010000.0,4,3.5,3350,3752,2.0,0.0,0.0,3,9,2550,800.0,2007,2007.0,98117,47.6782,-122.365,1050,4960,8.0,2007,2014-11-19
9/26/2014,245990.0,3,1.0,1040,8410,1.0,0.0,0.0,3,7,1040,0.0,1942,2014.0,98188,47.453,-122.289,1350,8410,1.0,2014,2014-09-26
2/3/2015,535000.0,4,2.25,2810,12607,2.0,0.0,0.0,3,10,2810,0.0,1985,1985.0,98058,47.4585,-122.13,2810,17400,30.0,1985,2015-02-03
6/30/2014,410000.0,1,1.5,1010,5750,1.0,0.0,0.0,3,7,1010,0.0,1911,1948.0,98136,47.5411,-122.39200000000001,1230,5750,67.0,1948,2014-06-30
4/24/2015,550000.0,3,2.5,2250,7752,2.0,0.0,0.0,4,8,2250,0.0,1988,1988.0,98011,47.7489,-122.185,2080,7033,27.0,1988,2015-04-24
9/11/2014,665000.0,3,1.75,1800,8000,1.0,0.0,0.0,3,8,1800,0.0,1972,1972.0,98008,47.6357,-122.119,1950,8500,43.0,1972,2014-09-11
4/27/2015,455000.0,3,1.0,2400,17239,1.0,0.0,0.0,4,7,1890,510.0,1940,1940.0,98028,47.75,-122.245,2390,7350,75.0,1940,2015-04-27
8/26/2014,440000.0,4,1.0,1780,4000,1.5,0.0,0.0,3,7,1780,0.0,1922,1922.0,98103,47.6624,-122.354,1750,4000,93.0,1922,2014-08-26
7/8/2014,332000.0,3,2.25,2120,14915,1.0,0.0,0.0,3,9,1720,400.0,1979,1979.0,98001,47.3524,-122.285,2320,13100,36.0,1979,2014-07-08
6/11/2014,280000.0,3,2.5,1860,6607,2.0,0.0,0.0,3,7,1860,0.0,1989,1989.0,98023,47.2891,-122.351,1760,6766,26.0,1989,2014-06-11
9/15/2014,570000.0,3,3.5,1460,1021,2.0,0.0,0.0,3,8,1150,310.0,2006,2006.0,98122,47.6169,-122.309,1460,1245,9.0,2006,2014-09-15
5/15/2014,250000.0,3,1.0,1230,10350,1.0,0.0,0.0,4,7,1230,0.0,1957,1957.0,98055,47.428000000000004,-122.199,1510,10427,58.0,1957,2014-05-15
5/1/2015,238000.0,2,1.0,1088,8453,1.0,0.0,0.0,3,6,1088,0.0,1952,2009.0,98001,47.2685,-122.23100000000001,1088,8016,6.0,2009,2015-05-01
11/3/2014,265000.0,3,1.0,800,5760,1.0,0.0,0.0,3,6,700,0.0,1949,1949.0,98155,47.7505,-122.31700000000001,1060,6628,66.0,1949,2014-11-03
3/5/2015,306000.0,3,1.0,1190,10350,1.0,0.0,0.0,4,7,1190,0.0,1959,1959.0,98028,47.7428,-122.244,1850,10500,56.0,1959,2015-03-05
5/7/2015,345000.0,5,2.75,1940,4182,1.0,0.0,0.0,3,7,1240,700.0,2002,2002.0,98056,47.4911,-122.17,1950,4182,13.0,2002,2015-05-07
9/4/2014,765000.0,4,2.5,3300,10764,1.0,0.0,0.0,4,9,1720,1580.0,1971,1971.0,98177,47.7119,-122.365,2290,10975,44.0,1971,2014-09-04
4/30/2015,346300.0,4,2.5,2590,11018,2.0,0.0,0.0,3,8,2590,0.0,1998,1998.0,98092,47.2634,-122.211,2400,8042,17.0,1998,2015-04-30
6/12/2014,342500.0,3,2.0,2080,11375,1.0,0.0,0.0,3,8,2080,0.0,2002,2002.0,98022,47.214,-121.993,1080,12899,13.0,2002,2014-06-12
4/24/2015,501000.0,4,2.25,2680,5439,2.0,0.0,0.0,3,7,2680,0.0,2000,2000.0,98011,47.7534,-122.21799999999999,2460,4473,15.0,2000,2015-04-24
6/25/2014,270000.0,3,2.5,1670,8364,1.0,0.0,0.0,4,7,1300,370.0,1990,1990.0,98042,47.369,-122.084,1490,8143,25.0,1990,2014-06-25
4/22/2015,638000.0,3,1.0,1830,4400,1.5,0.0,0.0,4,8,1720,110.0,1930,1930.0,98122,47.6052,-122.3,1650,4400,85.0,1930,2015-04-22
9/12/2014,460000.0,3,1.75,1400,2003,1.0,0.0,0.0,4,8,700,700.0,1908,2006.0,98119,47.6508,-122.368,1370,1281,9.0,2006,2014-09-12
10/15/2014,760000.0,4,1.75,2770,8521,1.0,0.0,0.0,4,7,1470,1300.0,1953,1953.0,98004,47.6255,-122.199,1910,9380,62.0,1953,2014-10-15
3/16/2015,1090000.0,3,2.5,3630,11019,1.0,0.0,0.0,4,9,2150,1480.0,1972,1972.0,98040,47.56100000000001,-122.226,3150,13555,43.0,1972,2015-03-16
6/28/2014,234000.0,3,1.0,1040,8128,1.0,0.0,0.0,3,6,1040,0.0,1983,1983.0,98019,47.7425,-121.98100000000001,1520,7500,32.0,1983,2014-06-28
3/2/2015,1650000.0,3,2.75,2690,8890,2.0,1.0,4.0,4,10,2690,0.0,1975,1975.0,98006,47.5487,-122.197,2940,8890,40.0,1975,2015-03-02
5/6/2014,488000.0,5,2.0,2020,5000,1.5,0.0,0.0,4,7,2020,0.0,1938,1938.0,98117,47.6949,-122.37,1510,6600,77.0,1938,2014-05-06
2/26/2015,1550000.0,5,2.5,2450,20805,2.0,0.0,0.0,4,9,2450,0.0,1963,1963.0,98004,47.6275,-122.227,3020,20324,52.0,1963,2015-02-26
3/27/2015,499000.0,4,3.0,2030,12675,2.0,0.0,0.0,3,7,2030,0.0,1982,1982.0,98177,47.7689,-122.37899999999999,1990,7705,33.0,1982,2015-03-27
9/4/2014,150000.0,3,1.0,1450,6776,1.0,0.0,0.0,3,7,1450,0.0,1952,1952.0,98178,47.5056,-122.244,1680,7200,63.0,1952,2014-09-04
3/26/2015,333000.0,4,2.5,2400,7270,2.0,0.0,0.0,3,8,2400,0.0,1993,1993.0,98003,47.2697,-122.31200000000001,2150,6584,22.0,1993,2015-03-26
2/18/2015,700000.0,4,2.75,2870,8625,1.0,0.0,1.0,4,8,1860,1010.0,1959,1959.0,98155,47.7425,-122.289,2430,8479,56.0,1959,2015-02-18
9/18/2014,275000.0,4,1.0,1340,22500,1.5,0.0,0.0,3,7,1340,0.0,1926,1926.0,98168,47.489,-122.316,1620,10800,89.0,1926,2014-09-18
7/1/2014,330000.0,3,2.5,1680,11312,1.0,0.0,0.0,3,7,1080,600.0,1959,1959.0,98146,47.5051,-122.344,1390,10700,56.0,1959,2014-07-01
11/24/2014,360000.0,4,2.0,1850,8827,1.0,0.0,0.0,3,7,1850,0.0,1969,1969.0,98155,47.7406,-122.31299999999999,1310,6901,46.0,1969,2014-11-24
5/11/2015,467000.0,3,1.0,1220,8040,1.5,0.0,0.0,3,7,1220,0.0,1965,1965.0,98125,47.7133,-122.30799999999999,1360,8040,50.0,1965,2015-05-11
10/29/2014,568000.0,3,2.5,2320,57063,1.0,0.0,0.0,4,9,1790,530.0,1979,1979.0,98074,47.6163,-122.056,3290,7314,36.0,1979,2014-10-29
11/3/2014,605000.0,5,2.25,3220,9603,2.0,0.0,0.0,3,8,3220,0.0,1972,1972.0,98052,47.6474,-122.11,2260,10093,43.0,1972,2014-11-03
10/2/2014,750000.0,4,2.75,3190,9023,2.0,0.0,0.0,3,9,3190,0.0,2005,2005.0,98075,47.5898,-121.98899999999999,3159,5615,10.0,2005,2014-10-02
10/14/2014,760000.0,3,2.75,3530,69834,2.0,0.0,0.0,3,10,3530,0.0,1994,1994.0,98053,47.6377,-121.995,3560,74256,21.0,1994,2014-10-14
8/4/2014,265000.0,3,1.75,2050,10519,1.0,0.0,0.0,3,7,1240,810.0,1979,1979.0,98058,47.4257,-122.146,1770,9605,36.0,1979,2014-08-04
7/18/2014,490000.0,3,1.75,1720,12540,1.0,0.0,0.0,4,7,1720,0.0,1956,1956.0,98006,47.5699,-122.177,1440,11850,59.0,1956,2014-07-18
6/19/2014,360000.0,4,2.5,2850,4650,2.0,0.0,0.0,3,8,2850,0.0,2004,2004.0,98038,47.3552,-122.02600000000001,2850,4650,11.0,2004,2014-06-19
2/6/2015,311750.0,4,2.25,2270,12000,1.0,0.0,0.0,4,7,1290,980.0,1976,1976.0,98023,47.3287,-122.353,2030,23980,39.0,1976,2015-02-06
10/3/2014,399000.0,3,2.25,1880,12473,1.0,0.0,0.0,3,8,1420,460.0,1958,1958.0,98028,47.7623,-122.256,2300,10469,57.0,1958,2014-10-03
7/25/2014,347000.0,4,2.5,2770,9751,2.0,0.0,0.0,3,8,2770,0.0,1989,1989.0,98042,47.3739,-122.126,2370,6950,26.0,1989,2014-07-25
9/4/2014,1680000.0,4,3.75,4490,34982,2.0,0.0,0.0,3,12,4490,0.0,1998,1998.0,98005,47.6406,-122.156,4470,37525,17.0,1998,2014-09-04
9/3/2014,585000.0,4,2.5,3110,6479,2.0,0.0,0.0,3,9,3110,0.0,2005,2005.0,98065,47.5408,-121.861,3110,7075,10.0,2005,2014-09-03
9/12/2014,340000.0,4,2.5,2360,7475,2.0,0.0,0.0,3,8,2360,0.0,1992,1992.0,98031,47.4052,-122.17,2280,7570,23.0,1992,2014-09-12
4/15/2015,612000.0,3,2.5,2180,5496,2.0,0.0,0.0,3,8,2180,0.0,1994,1994.0,98029,47.5723,-122.007,2120,5496,21.0,1994,2015-04-15
6/28/2014,230000.0,2,1.75,1910,3376,2.0,0.0,0.0,3,8,1910,0.0,1980,1980.0,98038,47.3733,-122.057,1470,3623,35.0,1980,2014-06-28
5/9/2014,604000.0,4,2.5,2260,7753,2.0,0.0,0.0,3,9,2260,0.0,1989,1989.0,98029,47.5752,-121.995,2690,8924,26.0,1989,2014-05-09
7/3/2014,250000.0,3,1.75,1770,8868,1.0,0.0,0.0,4,7,1770,0.0,1959,1959.0,98002,47.3188,-122.212,1630,9706,56.0,1959,2014-07-03
3/9/2015,258500.0,3,2.0,1460,7930,1.0,0.0,0.0,3,7,1460,0.0,1989,1989.0,98038,47.358999999999995,-122.04899999999999,1630,7930,26.0,1989,2015-03-09
3/24/2015,783000.0,4,2.75,2080,5000,1.0,0.0,0.0,5,8,1470,610.0,1940,1940.0,98199,47.6422,-122.40299999999999,1970,5000,75.0,1940,2015-03-24
10/30/2014,1050000.0,5,2.25,2960,7680,1.0,0.0,2.0,5,8,1550,1410.0,1958,1958.0,98199,47.6456,-122.389,2860,7680,57.0,1958,2014-10-30
3/18/2015,760000.0,4,2.5,3220,4031,2.0,0.0,0.0,3,9,3220,0.0,2002,2002.0,98033,47.688,-122.163,3150,5083,13.0,2002,2015-03-18
5/26/2014,276000.0,3,1.0,1140,5000,1.0,0.0,0.0,3,7,1140,0.0,1960,1960.0,98106,47.5535,-122.36200000000001,1140,5000,55.0,1960,2014-05-26
3/23/2015,550000.0,4,2.0,1660,12377,1.0,0.0,0.0,3,8,1660,0.0,1966,1966.0,98008,47.6231,-122.102,1820,8968,49.0,1966,2015-03-23
4/28/2015,398000.0,4,1.0,1430,6240,1.5,0.0,0.0,5,7,1430,0.0,1953,1953.0,98125,47.7272,-122.311,1410,6240,62.0,1953,2015-04-28
3/13/2015,775000.0,3,3.0,1820,4300,1.5,0.0,0.0,4,8,1620,200.0,1914,1983.0,98107,47.6711,-122.36399999999999,1440,4300,32.0,1983,2015-03-13
4/9/2015,1030000.0,4,3.0,3540,10202,2.0,0.0,0.0,3,8,2720,820.0,1988,1988.0,98006,47.5471,-122.155,2780,10714,27.0,1988,2015-04-09
10/23/2014,327000.0,4,1.0,1620,6000,1.5,0.0,0.0,5,7,1620,0.0,1905,1905.0,98055,47.4763,-122.206,1310,6000,110.0,1905,2014-10-23
4/21/2015,564500.0,4,2.75,3100,14568,2.0,0.0,0.0,3,8,3100,0.0,1995,1995.0,98019,47.7302,-121.97399999999999,2860,14396,20.0,1995,2015-04-21
10/17/2014,782000.0,4,1.75,1500,6820,1.5,0.0,0.0,5,7,1500,0.0,1905,1905.0,98117,47.6794,-122.37,1360,4125,110.0,1905,2014-10-17
1/28/2015,398000.0,4,2.5,2820,5510,2.0,0.0,0.0,3,9,2820,0.0,2005,2005.0,98038,47.3477,-122.024,2820,5510,10.0,2005,2015-01-28
1/30/2015,257000.0,3,1.75,1850,10920,1.5,0.0,0.0,3,6,1850,0.0,1915,1915.0,98034,47.7244,-122.22200000000001,1510,7871,100.0,1915,2015-01-30
6/25/2014,235000.0,4,2.0,1570,9415,2.0,0.0,0.0,4,7,1570,0.0,1984,1984.0,98092,47.3168,-122.17399999999999,1550,8978,31.0,1984,2014-06-25
6/27/2014,453000.0,4,2.75,2300,37533,1.0,0.0,3.0,5,8,1550,750.0,1979,1979.0,98070,47.3714,-122.431,2130,10092,36.0,1979,2014-06-27
3/16/2015,535000.0,2,1.0,920,9000,1.0,0.0,0.0,1,6,920,0.0,1954,1954.0,98033,47.6831,-122.189,1760,8400,61.0,1954,2015-03-16
5/7/2014,275000.0,3,2.5,1600,7000,2.0,0.0,0.0,4,8,1600,0.0,1993,1993.0,98038,47.3534,-122.057,1700,7000,22.0,1993,2014-05-07
9/15/2014,665000.0,3,2.5,2630,10047,2.0,0.0,0.0,3,9,2630,0.0,1996,1996.0,98027,47.5515,-122.083,2640,10620,19.0,1996,2014-09-15
8/6/2014,670000.0,4,2.75,3020,13530,1.0,0.0,0.0,4,8,1540,1480.0,1977,1977.0,98052,47.6299,-122.09899999999999,2230,11896,38.0,1977,2014-08-06
4/27/2015,465000.0,3,1.75,1490,10757,1.0,0.0,0.0,3,7,1060,430.0,1966,1966.0,98034,47.72,-122.229,1490,10609,49.0,1966,2015-04-27
10/23/2014,210000.0,3,1.5,1160,5200,1.0,0.0,0.0,5,7,1160,0.0,1970,1970.0,98042,47.364,-122.094,1170,5200,45.0,1970,2014-10-23
12/4/2014,265000.0,4,2.5,2040,4443,2.0,0.0,0.0,3,8,2040,0.0,2001,2001.0,98092,47.3182,-122.189,2040,4637,14.0,2001,2014-12-04
4/13/2015,426000.0,2,2.5,1550,2657,2.0,0.0,0.0,4,8,1550,0.0,1987,1987.0,98033,47.7034,-122.18799999999999,1570,2442,28.0,1987,2015-04-13
10/29/2014,529219.0,4,2.25,1990,7610,1.0,0.0,0.0,4,8,1290,700.0,1966,1966.0,98008,47.6236,-122.103,1820,8198,49.0,1966,2014-10-29
7/8/2014,600000.0,3,2.25,1900,46609,1.5,0.0,0.0,4,7,1440,460.0,1969,1969.0,98072,47.7529,-122.116,2460,43560,46.0,1969,2014-07-08
7/1/2014,875000.0,5,3.5,3840,8279,2.0,0.0,0.0,3,9,3840,0.0,2001,2001.0,98074,47.6039,-122.059,3570,8279,14.0,2001,2014-07-01
1/6/2015,608000.0,4,3.0,2400,7680,1.0,0.0,0.0,3,7,1200,1200.0,1956,1956.0,98199,47.6466,-122.389,2670,6342,59.0,1956,2015-01-06
11/12/2014,220000.0,3,1.0,1660,21514,1.0,0.0,0.0,4,7,1660,0.0,1973,1973.0,98022,47.2159,-121.964,1660,21600,42.0,1973,2014-11-12
8/11/2014,1760000.0,4,5.0,6055,21630,1.0,0.0,3.0,4,12,3555,2500.0,1996,1996.0,98006,47.5524,-122.11200000000001,4890,19223,19.0,1996,2014-08-11
8/18/2014,295450.0,3,2.0,2030,17120,1.0,0.0,2.0,4,8,1890,140.0,1966,1966.0,98092,47.2953,-122.185,1870,13662,49.0,1966,2014-08-18
11/11/2014,315000.0,2,1.0,840,5087,1.0,0.0,0.0,3,7,840,0.0,1925,1925.0,98118,47.5557,-122.27799999999999,1590,5087,90.0,1925,2014-11-11
2/13/2015,205000.0,4,2.0,1450,8175,1.0,0.0,0.0,4,7,1450,0.0,1967,1967.0,98031,47.3933,-122.195,1570,9024,48.0,1967,2015-02-13
7/9/2014,310000.0,3,1.5,1460,9908,1.0,0.0,0.0,3,7,1460,0.0,1952,1952.0,98148,47.4275,-122.331,1420,9582,63.0,1952,2014-07-09
5/3/2015,1000000.0,5,1.0,2010,5210,1.5,0.0,0.0,3,9,1890,120.0,1927,1927.0,98119,47.6501,-122.37,2330,5000,88.0,1927,2015-05-03
6/2/2014,525000.0,4,2.5,2910,7631,2.0,0.0,2.0,3,9,2910,0.0,2006,2006.0,98038,47.3552,-122.001,3190,5552,9.0,2006,2014-06-02
7/9/2014,284000.0,4,1.75,1880,8800,1.0,0.0,0.0,3,7,1130,750.0,1960,1960.0,98168,47.5137,-122.333,1340,8733,55.0,1960,2014-07-09
5/14/2014,510000.0,3,1.75,2170,26460,1.0,0.0,0.0,3,8,1450,720.0,1986,1986.0,98074,47.6147,-122.045,2090,29075,29.0,1986,2014-05-14
6/19/2014,405000.0,2,1.0,1260,4377,1.0,0.0,0.0,4,7,1260,0.0,1947,1947.0,98103,47.6988,-122.354,1420,6376,68.0,1947,2014-06-19
9/16/2014,509950.0,3,2.5,1970,9153,2.0,0.0,0.0,3,8,1970,0.0,2007,2007.0,98028,47.7698,-122.26799999999999,1800,9800,8.0,2007,2014-09-16
10/27/2014,600000.0,4,2.25,2090,45738,2.0,0.0,0.0,3,8,2090,0.0,1987,1987.0,98053,47.6876,-122.04899999999999,3420,45738,28.0,1987,2014-10-27
4/23/2015,990000.0,4,3.75,3450,4940,2.0,0.0,0.0,3,10,2570,880.0,2006,2006.0,98103,47.692,-122.338,1880,5387,9.0,2006,2015-04-23
4/14/2015,280005.0,3,1.5,1130,7200,1.0,0.0,0.0,3,7,1130,0.0,1954,1954.0,98178,47.5041,-122.25299999999999,1130,7200,61.0,1954,2015-04-14
9/3/2014,700000.0,3,1.75,2600,7668,1.0,0.0,0.0,4,8,1300,1300.0,1968,1968.0,98010,47.3402,-122.046,1980,13664,47.0,1968,2014-09-03
8/4/2014,330000.0,3,1.0,1030,7620,1.0,0.0,0.0,3,7,1030,0.0,1953,1953.0,98126,47.5281,-122.375,1030,7560,62.0,1953,2014-08-04
2/23/2015,340000.0,2,1.0,1700,6718,1.0,0.0,2.0,3,7,1230,470.0,1956,1956.0,98198,47.4131,-122.331,2040,7500,59.0,1956,2015-02-23
8/18/2014,468000.0,2,2.5,1480,2167,2.0,0.0,0.0,3,8,1390,90.0,2007,2007.0,98052,47.6658,-122.132,2130,2556,8.0,2007,2014-08-18
6/9/2014,1340000.0,4,2.5,4250,19387,2.0,0.0,2.0,4,9,3260,990.0,1972,1972.0,98040,47.5578,-122.212,3690,17024,43.0,1972,2014-06-09
9/19/2014,515000.0,3,1.75,1600,20873,1.0,0.0,0.0,3,8,1600,0.0,1955,1955.0,98006,47.5632,-122.182,2640,18364,60.0,1955,2014-09-19
11/12/2014,245000.0,4,2.0,1870,8750,1.0,0.0,2.0,3,7,1870,0.0,1977,1977.0,98022,47.1985,-122.001,1770,8207,38.0,1977,2014-11-12
5/27/2014,265000.0,3,2.5,1440,7741,1.0,0.0,0.0,4,7,1000,440.0,1983,1983.0,98031,47.4042,-122.194,1680,7316,32.0,1983,2014-05-27
3/17/2015,372400.0,3,2.5,2720,11937,2.0,0.0,0.0,3,9,2720,0.0,1990,1990.0,98031,47.4185,-122.212,2590,9683,25.0,1990,2015-03-17
5/4/2015,390000.0,3,1.5,1240,8410,1.0,0.0,0.0,5,6,1240,0.0,1948,1948.0,98155,47.753,-122.32799999999999,1630,8410,67.0,1948,2015-05-04
2/3/2015,208000.0,3,1.0,1020,6120,1.0,0.0,0.0,4,7,1020,0.0,1967,1967.0,98002,47.278,-122.205,1370,8000,48.0,1967,2015-02-03
10/3/2014,273000.0,2,0.5,1180,7750,1.0,0.0,0.0,4,6,590,590.0,1945,1945.0,98155,47.769,-122.316,1380,8976,70.0,1945,2014-10-03
10/9/2014,455000.0,5,3.5,3080,7759,2.0,0.0,0.0,3,8,2310,770.0,2003,2003.0,98019,47.7454,-121.977,2980,8223,12.0,2003,2014-10-09
3/30/2015,270000.0,4,2.5,1750,6397,2.0,0.0,0.0,3,7,1750,0.0,1988,1988.0,98023,47.3082,-122.35799999999999,1940,6502,27.0,1988,2015-03-30
7/30/2014,618000.0,4,2.25,2530,8736,1.0,0.0,0.0,4,7,1210,1320.0,1958,1958.0,98008,47.6049,-122.126,1720,8500,57.0,1958,2014-07-30
10/21/2014,213550.0,3,2.5,1580,8541,2.0,0.0,0.0,3,7,1580,0.0,1990,1990.0,98001,47.3334,-122.289,1640,7542,25.0,1990,2014-10-21
7/29/2014,210000.0,5,1.75,2340,9148,2.0,0.0,0.0,3,7,2340,0.0,1957,1957.0,98198,47.4232,-122.324,1390,10019,58.0,1957,2014-07-29
1/12/2015,2750000.0,5,4.0,6300,16065,2.0,0.0,1.0,3,12,4360,1940.0,2004,2004.0,98004,47.5922,-122.20700000000001,3260,17287,11.0,2004,2015-01-12
12/15/2014,403500.0,4,2.75,2400,3844,1.0,0.0,0.0,5,7,1200,1200.0,1974,1974.0,98133,47.7027,-122.34700000000001,1100,3844,41.0,1974,2014-12-15
2/25/2015,235000.0,3,1.5,1300,7600,1.0,0.0,0.0,4,7,1300,0.0,1963,1963.0,98022,47.2083,-122.005,1570,7600,52.0,1963,2015-02-25
4/21/2015,287500.0,3,2.0,1760,7147,1.0,0.0,0.0,4,6,880,880.0,1936,1936.0,98055,47.4799,-122.23200000000001,1720,7147,79.0,1936,2015-04-21
9/29/2014,546800.0,4,1.5,1520,5910,1.0,0.0,0.0,3,7,1020,500.0,1946,1946.0,98115,47.6904,-122.295,1710,5910,69.0,1946,2014-09-29
6/16/2014,183000.0,3,1.75,1070,8100,1.0,0.0,0.0,4,6,1070,0.0,1957,1957.0,98002,47.2853,-122.22,1260,8100,58.0,1957,2014-06-16
5/12/2014,560000.0,3,2.0,2560,216777,1.0,0.0,0.0,3,8,2560,0.0,1986,1986.0,98092,47.295,-122.086,2360,108463,29.0,1986,2014-05-12
12/5/2014,299500.0,3,1.0,1280,6726,1.0,0.0,0.0,3,6,1280,0.0,1958,1958.0,98144,47.5724,-122.301,1630,5000,57.0,1958,2014-12-05
10/27/2014,610000.0,4,2.25,1660,7350,1.0,0.0,0.0,3,8,1660,0.0,1965,2014.0,98008,47.6263,-122.124,1790,7455,1.0,2014,2014-10-27
6/9/2014,288350.0,3,1.5,1860,7963,1.0,0.0,0.0,3,7,1200,660.0,1963,1963.0,98188,47.4513,-122.26799999999999,1800,10400,52.0,1963,2014-06-09
7/1/2014,500000.0,2,1.0,950,4500,1.0,0.0,2.0,3,7,850,100.0,1926,1926.0,98103,47.6562,-122.354,1670,4000,89.0,1926,2014-07-01
12/5/2014,625000.0,4,2.75,2140,4000,1.0,0.0,0.0,3,7,1190,950.0,1951,1951.0,98115,47.6792,-122.287,2140,4770,64.0,1951,2014-12-05
4/29/2015,418000.0,2,1.5,1480,1349,2.0,0.0,0.0,3,7,1240,240.0,2007,2007.0,98136,47.5439,-122.38600000000001,1550,1349,8.0,2007,2015-04-29
8/25/2014,660000.0,3,3.0,2260,1825,2.0,0.0,0.0,3,8,1660,600.0,2002,2002.0,98122,47.6108,-122.30799999999999,2260,1834,13.0,2002,2014-08-25
6/23/2014,775000.0,4,2.5,2300,6158,2.0,0.0,0.0,3,9,2300,0.0,1999,1999.0,98115,47.6943,-122.29899999999999,2170,6434,16.0,1999,2014-06-23
1/23/2015,429500.0,3,2.75,1650,7272,1.0,0.0,0.0,4,7,1230,420.0,1972,1972.0,98034,47.7232,-122.17399999999999,1770,7272,43.0,1972,2015-01-23
11/24/2014,569000.0,3,2.0,1990,3000,1.5,0.0,0.0,3,7,1230,760.0,1908,1970.0,98112,47.6272,-122.29,1600,4080,45.0,1970,2014-11-24
5/20/2014,250000.0,4,2.0,1960,7560,1.0,0.0,0.0,5,7,1160,800.0,1978,1978.0,98031,47.4081,-122.178,1950,7560,37.0,1978,2014-05-20
12/9/2014,225000.0,3,1.5,1310,10491,1.0,0.0,0.0,4,7,1310,0.0,1969,1969.0,98042,47.3682,-122.148,1430,9664,46.0,1969,2014-12-09
5/14/2014,530000.0,4,2.75,2450,15002,1.0,0.0,0.0,5,9,2450,0.0,1974,1974.0,98166,47.4268,-122.34299999999999,2650,15055,41.0,1974,2014-05-14
9/5/2014,306000.0,3,1.0,910,8658,1.0,0.0,0.0,3,7,910,0.0,1955,1955.0,98155,47.7586,-122.303,1170,10200,60.0,1955,2014-09-05
4/13/2015,517100.0,3,1.75,1580,9719,1.0,0.0,0.0,5,7,1580,0.0,1962,1962.0,98056,47.5396,-122.18,1760,8539,53.0,1962,2015-04-13
8/22/2014,354950.0,3,1.75,1780,9689,1.0,0.0,0.0,3,7,1130,650.0,1976,1976.0,98072,47.7628,-122.163,1660,9786,39.0,1976,2014-08-22
4/14/2015,348000.0,3,1.5,1040,1824,1.0,0.0,0.0,3,6,1040,0.0,1925,1925.0,98115,47.6793,-122.3,1010,5100,90.0,1925,2015-04-14
7/18/2014,522250.0,4,2.5,2340,41600,1.0,0.0,0.0,3,8,1640,700.0,1977,1977.0,98077,47.7466,-122.07700000000001,2340,34960,38.0,1977,2014-07-18
6/4/2014,275000.0,3,2.5,1720,8755,1.0,0.0,0.0,3,8,1000,720.0,1983,1983.0,98023,47.3186,-122.391,1720,8690,32.0,1983,2014-06-04
12/18/2014,390000.0,3,1.5,1600,10440,1.0,0.0,0.0,3,7,1600,0.0,1954,1954.0,98125,47.7109,-122.311,1600,8816,61.0,1954,2014-12-18
9/10/2014,260000.0,3,1.5,1320,9750,1.0,0.0,0.0,3,7,1320,0.0,1954,1954.0,98148,47.4267,-122.331,1530,9750,61.0,1954,2014-09-10
7/28/2014,585000.0,5,2.75,2350,4178,1.5,0.0,0.0,3,8,1520,830.0,1922,2015.0,98112,47.6388,-122.3,1920,4178,0.0,2015,2014-07-28
6/3/2014,605000.0,5,2.75,2740,5616,1.5,0.0,0.0,5,7,1670,1070.0,1925,1925.0,98115,47.6866,-122.31700000000001,1600,4592,90.0,1925,2014-06-03
7/3/2014,342000.0,4,2.5,2300,6448,2.0,0.0,0.0,3,8,2300,0.0,2001,2001.0,98030,47.3813,-122.204,1860,5872,14.0,2001,2014-07-03
8/27/2014,900000.0,5,3.0,4350,37169,2.0,0.0,0.0,3,10,2950,1400.0,1972,1972.0,98005,47.6518,-122.16,3280,41631,43.0,1972,2014-08-27
3/30/2015,252000.0,3,1.75,1430,7700,1.0,0.0,0.0,4,7,980,450.0,1981,1981.0,98031,47.3993,-122.18299999999999,1430,8625,34.0,1981,2015-03-30
2/19/2015,357000.0,3,1.75,2400,14012,1.0,0.0,0.0,3,9,2400,0.0,1971,1971.0,98003,47.3371,-122.325,2800,13988,44.0,1971,2015-02-19
12/24/2014,370000.0,3,1.0,940,7910,1.0,0.0,0.0,4,6,940,0.0,1959,1959.0,98008,47.6181,-122.117,1000,7700,56.0,1959,2014-12-24
4/6/2015,322500.0,3,1.0,1020,13504,1.0,0.0,0.0,5,7,1020,0.0,1959,1959.0,98056,47.5121,-122.17,1110,11158,56.0,1959,2015-04-06
6/20/2014,210000.0,2,2.0,1680,5756,2.0,0.0,0.0,4,7,1680,0.0,1910,1910.0,98002,47.3065,-122.22200000000001,1340,5447,105.0,1910,2014-06-20
12/8/2014,290000.0,2,1.0,1340,9840,1.0,0.0,0.0,3,7,1340,0.0,1949,1949.0,98133,47.7202,-122.339,1610,8949,66.0,1949,2014-12-08
6/12/2014,860000.0,4,3.25,3960,7012,2.0,0.0,0.0,3,10,3960,0.0,2005,2005.0,98075,47.5854,-122.08,3680,8522,10.0,2005,2014-06-12
2/25/2015,302000.0,6,2.0,2650,4621,1.5,0.0,0.0,3,8,2650,0.0,1911,1911.0,98118,47.5543,-122.275,1640,4879,104.0,1911,2015-02-25
8/21/2014,369160.0,4,2.25,2120,9680,2.0,0.0,2.0,4,8,2120,0.0,1965,1965.0,98003,47.3367,-122.33200000000001,2360,9647,50.0,1965,2014-08-21
5/7/2015,1190000.0,4,2.75,2850,3000,2.5,0.0,0.0,3,9,2530,320.0,2003,2003.0,98112,47.6406,-122.304,2083,4500,12.0,2003,2015-05-07
9/2/2014,993000.0,4,2.0,2850,14810,2.0,0.0,0.0,5,8,2490,360.0,1954,1954.0,98004,47.5892,-122.20299999999999,2430,10454,61.0,1954,2014-09-02
11/14/2014,380000.0,6,2.0,1870,6969,1.0,0.0,0.0,4,7,1870,0.0,1968,1968.0,98027,47.5342,-122.036,1500,6969,47.0,1968,2014-11-14
9/10/2014,635000.0,4,2.0,2660,8160,1.0,0.0,0.0,4,7,1380,1280.0,1949,1949.0,98177,47.7229,-122.359,1660,8160,66.0,1949,2014-09-10
10/30/2014,260000.0,3,1.0,1190,11120,1.0,0.0,0.0,3,6,1190,0.0,1947,1947.0,98024,47.5687,-121.898,1230,12720,68.0,1947,2014-10-30
5/20/2014,243000.0,2,1.0,1770,5522,1.5,0.0,0.0,4,7,960,810.0,1943,1943.0,98178,47.4974,-122.23100000000001,1830,7378,72.0,1943,2014-05-20
4/2/2015,1400000.0,4,2.5,2770,8879,2.0,0.0,0.0,3,9,2770,0.0,2001,2001.0,98004,47.5831,-122.193,2770,8882,14.0,2001,2015-04-02
9/15/2014,665000.0,4,2.5,2080,8100,1.0,0.0,2.0,5,8,1220,860.0,1952,1952.0,98177,47.7228,-122.369,2090,8100,63.0,1952,2014-09-15
9/9/2014,898000.0,5,2.25,2700,9000,2.0,0.0,0.0,5,9,2700,0.0,1987,1987.0,98007,47.6599,-122.146,2630,9000,28.0,1987,2014-09-09
7/25/2014,583000.0,4,2.75,2200,9453,1.0,0.0,0.0,5,8,1100,1100.0,1955,1955.0,98144,47.5744,-122.305,1390,5355,60.0,1955,2014-07-25
12/4/2014,429000.0,4,1.75,2160,7700,2.0,0.0,0.0,2,8,2160,0.0,1977,1977.0,98033,47.6976,-122.169,2080,7700,38.0,1977,2014-12-04
12/16/2014,471000.0,3,2.5,2010,4059,2.0,0.0,0.0,3,8,2010,0.0,1998,1998.0,98034,47.7317,-122.197,2010,5779,17.0,1998,2014-12-16
3/12/2015,1810000.0,3,3.5,3780,8295,2.0,0.0,0.0,3,9,2430,1350.0,1951,1951.0,98112,47.6394,-122.29,3780,9127,64.0,1951,2015-03-12
10/15/2014,739500.0,3,3.25,4460,51177,2.0,0.0,0.0,3,9,4460,0.0,2005,2005.0,98042,47.3648,-122.14299999999999,2670,38925,10.0,2005,2014-10-15
5/12/2014,450000.0,3,1.5,1770,17208,1.0,0.0,0.0,3,8,1160,610.0,1959,1959.0,98006,47.5659,-122.117,2450,17118,56.0,1959,2014-05-12
4/8/2015,552500.0,3,1.0,1430,5000,1.0,0.0,0.0,3,7,1430,0.0,1949,1949.0,98117,47.6895,-122.37,1210,5000,66.0,1949,2015-04-08
2/17/2015,437000.0,4,1.75,1700,10642,1.0,0.0,0.0,4,7,850,850.0,1954,1954.0,98006,47.5674,-122.14200000000001,1610,11200,61.0,1954,2015-02-17
1/9/2015,270000.0,4,2.0,1830,5220,1.5,0.0,0.0,3,7,1830,0.0,1951,1951.0,98118,47.5331,-122.27799999999999,1760,5757,64.0,1951,2015-01-09
7/16/2014,226740.0,3,1.5,1410,8800,1.0,0.0,0.0,4,7,1410,0.0,1965,1965.0,98092,47.2927,-122.18299999999999,2180,10108,50.0,1965,2014-07-16
2/18/2015,446500.0,4,2.5,3060,7920,1.0,0.0,0.0,3,8,1810,0.0,1974,1974.0,98028,47.7675,-122.26100000000001,2690,7767,41.0,1974,2015-02-18
11/25/2014,283000.0,3,2.0,1820,15068,2.0,0.0,2.0,3,7,1520,300.0,1920,1920.0,98022,47.2103,-121.999,1490,9589,95.0,1920,2014-11-25
7/15/2014,445000.0,4,1.75,2430,13211,1.5,0.0,0.0,4,7,2430,0.0,1909,1978.0,98024,47.5245,-121.926,1330,10500,37.0,1978,2014-07-15
8/16/2014,250000.0,2,1.0,740,6840,1.0,0.0,0.0,5,6,740,0.0,1942,1942.0,98126,47.5172,-122.375,740,6840,73.0,1942,2014-08-16
3/9/2015,307000.0,3,1.0,770,6552,1.0,0.0,0.0,3,6,670,100.0,1942,1942.0,98146,47.5133,-122.37200000000001,920,7200,73.0,1942,2015-03-09
7/21/2014,315000.0,4,2.75,2200,8580,1.0,0.0,0.0,3,8,1860,340.0,1991,1991.0,98023,47.295,-122.37,2290,7816,24.0,1991,2014-07-21
1/6/2015,555000.0,3,3.0,2920,23085,1.5,0.0,2.0,3,7,1540,1380.0,1908,1908.0,98136,47.5159,-122.395,2270,18180,107.0,1908,2015-01-06
4/24/2015,264900.0,4,2.5,2040,7000,1.0,0.0,0.0,3,7,1250,790.0,1979,1979.0,98031,47.4056,-122.176,1900,7378,36.0,1979,2015-04-24
9/22/2014,510000.0,3,2.0,1600,4510,1.0,0.0,0.0,3,7,990,610.0,1978,1978.0,98103,47.6939,-122.34,1580,4561,37.0,1978,2014-09-22
8/14/2014,328000.0,4,2.5,1990,3980,2.0,0.0,0.0,3,7,1990,0.0,2002,2002.0,98058,47.4445,-122.17,1990,4373,13.0,2002,2014-08-14
5/4/2015,358000.0,4,2.5,1830,7308,2.0,0.0,0.0,3,7,1830,0.0,2002,2002.0,98038,47.3565,-122.015,1830,5692,13.0,2002,2015-05-04
4/21/2015,325000.0,3,2.5,2540,4260,2.0,0.0,0.0,3,7,2540,0.0,2005,2005.0,98042,47.3989,-122.164,2190,4260,10.0,2005,2015-04-21
7/14/2014,1370000.0,2,3.25,2700,3444,3.0,1.0,3.0,3,9,2700,0.0,1990,1990.0,98075,47.5684,-122.06,2710,3444,25.0,1990,2014-07-14
3/5/2015,230000.0,4,2.0,1440,10800,1.0,0.0,0.0,4,7,1440,0.0,1967,1967.0,98001,47.3417,-122.28299999999999,1190,7380,48.0,1967,2015-03-05
4/23/2015,545000.0,3,2.0,1550,4000,1.0,0.0,0.0,3,7,940,610.0,1955,1955.0,98199,47.6379,-122.387,1880,4000,60.0,1955,2015-04-23
5/5/2014,705380.0,3,2.5,2490,4343,2.0,0.0,0.0,3,9,2490,0.0,2003,2003.0,98029,47.5493,-121.993,2130,4106,12.0,2003,2014-05-05
8/20/2014,459000.0,5,2.5,2650,12987,1.0,0.0,0.0,4,7,1350,1300.0,1979,1979.0,98028,47.7482,-122.244,2160,12726,36.0,1979,2014-08-20
5/28/2014,815000.0,4,2.25,2000,3800,2.0,0.0,0.0,3,8,2000,0.0,2001,2001.0,98115,47.6852,-122.311,1610,3800,14.0,2001,2014-05-28
6/11/2014,495000.0,6,5.0,3440,4500,2.0,0.0,0.0,3,8,3280,160.0,2007,2007.0,98055,47.4871,-122.219,1400,5500,8.0,2007,2014-06-11
11/10/2014,520000.0,3,2.5,2280,58712,2.5,0.0,3.0,3,9,2280,0.0,1987,1987.0,98010,47.3053,-122.0,2240,24332,28.0,1987,2014-11-10
12/17/2014,430000.0,2,1.5,1320,1194,3.0,0.0,0.0,3,7,1320,0.0,2001,2001.0,98107,47.6704,-122.39,1320,1250,14.0,2001,2014-12-17
5/15/2014,255000.0,4,2.5,2070,7800,2.0,0.0,0.0,3,8,2070,0.0,1989,1989.0,98003,47.3487,-122.315,1950,7815,26.0,1989,2014-05-15
7/7/2014,588000.0,3,2.0,1860,4777,2.0,0.0,0.0,5,7,1860,0.0,1908,1908.0,98115,47.6892,-122.311,1580,3822,107.0,1908,2014-07-07
11/10/2014,350000.0,3,1.0,940,7811,1.0,0.0,0.0,3,6,940,0.0,1959,1959.0,98008,47.6195,-122.118,1180,7490,56.0,1959,2014-11-10
3/13/2015,625000.0,4,2.75,2290,21486,1.0,0.0,2.0,5,7,2290,0.0,1963,1963.0,98006,47.5515,-122.189,2540,15936,52.0,1963,2015-03-13
4/24/2015,172500.0,2,2.0,1510,20685,1.0,0.0,0.0,2,6,1250,260.0,1958,1958.0,98059,47.481,-122.116,1490,29527,57.0,1958,2015-04-24
8/25/2014,554000.0,3,2.0,1830,3500,1.5,0.0,0.0,5,7,1290,540.0,1909,1909.0,98116,47.573,-122.383,1530,4000,106.0,1909,2014-08-25
7/28/2014,775000.0,4,2.5,3090,7112,2.0,0.0,0.0,3,9,3090,0.0,2001,2001.0,98052,47.705,-122.118,3050,6000,14.0,2001,2014-07-28
11/7/2014,1190000.0,4,3.5,4340,217800,2.0,0.0,0.0,3,11,4340,0.0,2003,2003.0,98053,47.6471,-122.01299999999999,3430,219106,12.0,2003,2014-11-07
10/28/2014,618000.0,3,2.75,3200,12682,2.0,0.0,1.0,3,9,3200,0.0,1977,1977.0,98028,47.7443,-122.26,2880,10432,38.0,1977,2014-10-28
9/29/2014,305000.0,4,1.0,1560,8450,1.5,0.0,0.0,4,6,1560,0.0,1954,1954.0,98166,47.4552,-122.354,1380,8100,61.0,1954,2014-09-29
12/5/2014,232000.0,3,2.0,1280,13356,1.0,0.0,0.0,3,7,1280,0.0,1994,1994.0,98042,47.3715,-122.074,1590,8071,21.0,1994,2014-12-05
5/8/2014,262000.0,4,2.5,2020,6236,2.0,0.0,0.0,3,7,2020,0.0,2002,2002.0,98001,47.2796,-122.24700000000001,1940,5076,13.0,2002,2014-05-08
3/25/2015,234000.0,3,1.0,1040,8122,1.0,0.0,0.0,5,7,1040,0.0,1971,1971.0,98198,47.3731,-122.31200000000001,1470,8676,44.0,1971,2015-03-25
4/2/2015,500000.0,4,2.75,2260,7209,1.0,0.0,3.0,3,7,1330,930.0,2002,2002.0,98125,47.7088,-122.302,1790,10860,13.0,2002,2015-04-02
8/27/2014,278000.0,3,1.0,860,7632,1.0,0.0,0.0,3,6,860,0.0,1920,1920.0,98166,47.4623,-122.345,890,7632,95.0,1920,2014-08-27
9/4/2014,230000.0,5,1.0,1920,19040,1.0,0.0,0.0,3,7,1160,760.0,1961,1961.0,98168,47.4756,-122.294,1920,11520,54.0,1961,2014-09-04
9/22/2014,500000.0,4,1.75,2290,9215,1.0,0.0,0.0,5,8,1270,1020.0,1969,1969.0,98027,47.5328,-122.051,2290,10200,46.0,1969,2014-09-22
5/19/2014,366500.0,4,2.75,2070,9300,1.0,0.0,0.0,5,7,1120,950.0,1945,1945.0,98155,47.7416,-122.32,1010,8308,70.0,1945,2014-05-19
6/11/2014,665000.0,6,3.0,4250,4400,2.5,0.0,0.0,4,7,3020,1230.0,1902,1902.0,98118,47.5584,-122.28299999999999,1520,4950,113.0,1902,2014-06-11
3/16/2015,1100000.0,3,1.5,2220,4830,2.0,0.0,3.0,3,9,1790,430.0,1928,1928.0,98116,47.5825,-122.4,1670,4830,87.0,1928,2015-03-16
12/1/2014,575000.0,2,1.75,1840,4076,1.0,0.0,0.0,3,8,1140,700.0,1957,1957.0,98117,47.6875,-122.39299999999999,1540,4076,58.0,1957,2014-12-01
11/3/2014,674750.0,4,2.5,2590,9753,2.0,0.0,0.0,3,10,2590,0.0,1993,1993.0,98075,47.5848,-122.027,2800,9917,22.0,1993,2014-11-03
9/16/2014,719000.0,5,2.0,3110,6131,1.0,0.0,0.0,5,7,1560,1550.0,1940,1940.0,98118,47.5615,-122.279,1720,6600,75.0,1940,2014-09-16
9/25/2014,482000.0,3,1.75,2600,105587,1.0,0.0,0.0,4,7,1300,1300.0,1980,1980.0,98070,47.4464,-122.49700000000001,1941,208438,35.0,1980,2014-09-25
5/28/2014,254000.0,2,1.0,1060,8187,1.0,0.0,0.0,4,6,1060,0.0,1952,1952.0,98133,47.7508,-122.34899999999999,1260,8188,63.0,1952,2014-05-28
8/19/2014,443725.0,3,1.75,1250,3880,1.0,0.0,0.0,4,7,750,500.0,1944,1944.0,98117,47.6869,-122.39200000000001,1240,3880,71.0,1944,2014-08-19
11/6/2014,575000.0,4,2.5,2520,35636,2.0,0.0,0.0,3,8,2520,0.0,1980,1980.0,98053,47.652,-122.031,2230,35673,35.0,1980,2014-11-06
1/27/2015,469000.0,3,2.25,2070,9957,1.0,0.0,0.0,3,8,1440,630.0,1977,1977.0,98155,47.7766,-122.277,2070,10158,38.0,1977,2015-01-27
5/23/2014,175000.0,2,1.0,1300,44431,1.0,0.0,0.0,5,6,1300,0.0,1958,1958.0,98001,47.327,-122.26700000000001,1470,14850,57.0,1958,2014-05-23
9/9/2014,437000.0,5,2.0,2190,8316,1.0,0.0,0.0,3,7,1390,800.0,1961,1961.0,98108,47.5488,-122.29799999999999,2010,8316,54.0,1961,2014-09-09
8/20/2014,550000.0,4,3.0,2760,13113,1.0,0.0,0.0,4,8,1760,1000.0,1974,1974.0,98028,47.7669,-122.26799999999999,1900,13113,41.0,1974,2014-08-20
4/20/2015,172040.0,3,2.25,1710,7134,1.0,0.0,0.0,4,7,1130,580.0,1979,1979.0,98031,47.3911,-122.191,1790,7455,36.0,1979,2015-04-20
12/24/2014,363000.0,3,2.0,1750,7000,1.0,0.0,0.0,3,8,1750,0.0,1993,1993.0,98038,47.3693,-122.041,1840,6969,22.0,1993,2014-12-24
4/30/2015,282000.0,3,2.25,1552,3600,2.0,0.0,0.0,3,7,1552,0.0,2012,2012.0,98092,47.3198,-122.178,1677,3600,3.0,2012,2015-04-30
8/14/2014,400000.0,6,2.0,2350,6554,2.0,0.0,1.0,3,8,2000,350.0,1905,1905.0,98178,47.5115,-122.256,1560,6554,110.0,1905,2014-08-14
9/24/2014,650000.0,5,3.5,5110,10018,2.0,0.0,0.0,3,10,3850,1260.0,2003,2003.0,98034,47.7261,-122.17,1790,10018,12.0,2003,2014-09-24
6/3/2014,365000.0,3,2.5,1720,99916,2.0,0.0,0.0,4,7,1720,0.0,1990,1990.0,98042,47.3391,-122.09299999999999,1340,73180,25.0,1990,2014-06-03
10/24/2014,269950.0,4,2.5,1960,7230,2.0,0.0,0.0,3,8,1960,0.0,2002,2002.0,98023,47.2855,-122.36,1850,7208,13.0,2002,2014-10-24
7/18/2014,260000.0,2,1.0,1270,19602,1.0,0.0,0.0,3,6,1270,0.0,1977,1977.0,98010,47.3375,-122.04799999999999,1270,17699,38.0,1977,2014-07-18
10/24/2014,193000.0,3,1.5,1180,7000,1.0,0.0,0.0,4,7,1180,0.0,1977,1977.0,98023,47.2959,-122.37299999999999,1630,7500,38.0,1977,2014-10-24
7/25/2014,340000.0,4,2.25,2230,6791,2.0,0.0,0.0,3,8,2230,0.0,2005,2005.0,98038,47.3769,-122.02799999999999,2420,6297,10.0,2005,2014-07-25
5/12/2014,900000.0,4,3.25,4700,38412,2.0,0.0,0.0,3,10,3420,1280.0,1978,1978.0,98005,47.6445,-122.167,3640,35571,37.0,1978,2014-05-12
10/21/2014,371000.0,3,2.5,2150,8361,2.0,0.0,0.0,3,8,2150,0.0,1991,1991.0,98058,47.4627,-122.12899999999999,2150,9368,24.0,1991,2014-10-21
8/27/2014,592000.0,3,2.5,2400,81892,2.0,0.0,0.0,3,8,2400,0.0,1985,1985.0,98045,47.5028,-121.76899999999999,1370,37270,30.0,1985,2014-08-27
8/15/2014,300000.0,3,2.5,1830,12750,2.0,0.0,0.0,3,7,1830,0.0,1991,1991.0,98168,47.5003,-122.32799999999999,1610,10000,24.0,1991,2014-08-15
8/27/2014,449950.0,4,3.0,2800,6977,2.0,0.0,0.0,3,8,2800,0.0,2003,2003.0,98038,47.3542,-122.014,2800,6600,12.0,2003,2014-08-27
10/22/2014,299500.0,3,2.5,2090,7163,2.0,0.0,0.0,3,8,2090,0.0,1989,1989.0,98003,47.2735,-122.295,2320,8634,26.0,1989,2014-10-22
3/26/2015,995000.0,4,2.25,2340,13406,1.0,0.0,0.0,4,9,2340,0.0,1963,1963.0,98040,47.5377,-122.221,2340,10743,52.0,1963,2015-03-26
9/23/2014,335000.0,4,1.75,1670,9472,1.0,0.0,0.0,3,7,1100,570.0,1960,1960.0,98106,47.5299,-122.35700000000001,1080,5195,55.0,1960,2014-09-23
11/10/2014,280000.0,4,2.25,1990,7350,1.0,0.0,0.0,4,8,1180,810.0,1978,1978.0,98003,47.3258,-122.32799999999999,2030,7210,37.0,1978,2014-11-10
5/16/2014,446000.0,4,2.25,2270,7800,1.0,0.0,0.0,3,7,1290,980.0,1977,1977.0,98034,47.7278,-122.19200000000001,1480,7280,38.0,1977,2014-05-16
9/27/2014,1540000.0,4,2.75,4910,15139,1.0,0.0,0.0,4,10,2560,2350.0,1964,1964.0,98004,47.6444,-122.22,3980,15139,51.0,1964,2014-09-27
4/7/2015,325000.0,3,1.0,950,4500,1.0,0.0,0.0,4,6,950,0.0,1943,1943.0,98118,47.5273,-122.265,1140,4500,72.0,1943,2015-04-07
6/19/2014,450000.0,3,1.75,1610,11200,1.0,0.0,0.0,3,7,1610,0.0,1955,1955.0,98033,47.6641,-122.176,1610,11200,60.0,1955,2014-06-19
10/27/2014,322500.0,4,2.5,1940,7107,2.0,0.0,0.0,3,7,1940,0.0,2000,2000.0,98038,47.3843,-122.03200000000001,1850,5705,15.0,2000,2014-10-27
9/15/2014,453000.0,3,1.0,1210,9473,1.0,0.0,0.0,5,7,1210,0.0,1955,1955.0,98006,47.5637,-122.139,1700,11465,60.0,1955,2014-09-15
10/8/2014,655000.0,4,2.5,2570,4412,2.0,0.0,0.0,3,9,2570,0.0,2001,2001.0,98034,47.7076,-122.23200000000001,2460,5470,14.0,2001,2014-10-08
5/4/2015,603000.0,3,2.25,1700,2800,2.0,0.0,0.0,5,7,1150,550.0,1926,1926.0,98115,47.6819,-122.311,1500,3400,89.0,1926,2015-05-04
9/2/2014,235000.0,4,1.0,1610,24000,1.5,0.0,0.0,3,6,1610,0.0,1947,1947.0,98001,47.2751,-122.25200000000001,1270,9600,68.0,1947,2014-09-02
7/28/2014,968933.0,4,3.5,4120,7304,2.0,0.0,0.0,3,11,3070,1050.0,2006,2006.0,98033,47.681000000000004,-122.167,2470,9600,9.0,2006,2014-07-28
11/14/2014,1020000.0,3,3.5,2880,11340,1.0,0.0,0.0,3,8,1690,1190.0,1980,1980.0,98074,47.6113,-122.05799999999999,2530,11340,35.0,1980,2014-11-14
12/3/2014,435000.0,4,2.25,1990,8548,2.0,0.0,0.0,3,8,1990,0.0,1973,1973.0,98033,47.667,-122.178,2320,8926,42.0,1973,2014-12-03
6/18/2014,242000.0,3,2.0,1260,8092,1.0,0.0,0.0,3,7,1260,0.0,1986,1986.0,98038,47.3635,-122.054,1950,8092,29.0,1986,2014-06-18
10/27/2014,487000.0,6,3.25,4750,248600,2.0,0.0,0.0,4,8,4750,0.0,1947,1947.0,98022,47.1879,-121.973,2230,311610,68.0,1947,2014-10-27
8/1/2014,810000.0,4,2.75,3010,10450,2.0,0.0,0.0,3,9,3010,0.0,1996,1996.0,98052,47.6979,-122.11200000000001,3010,10530,19.0,1996,2014-08-01
6/24/2014,625000.0,3,2.5,2410,64073,1.0,0.0,0.0,4,8,1820,590.0,1976,1976.0,98072,47.7457,-122.141,2980,48760,39.0,1976,2014-06-24
10/23/2014,165000.0,3,1.5,1280,7742,1.0,0.0,0.0,3,7,1280,0.0,1973,1973.0,98001,47.3323,-122.27600000000001,1566,7696,42.0,1973,2014-10-23
4/27/2015,335000.0,3,1.0,2320,6750,1.0,0.0,0.0,3,7,1160,1160.0,1960,1960.0,98118,47.5327,-122.27600000000001,1230,6075,55.0,1960,2015-04-27
7/24/2014,286700.0,3,1.0,1220,6600,1.0,0.0,0.0,3,6,1220,0.0,1958,1958.0,98065,47.5297,-121.82700000000001,1100,6600,57.0,1958,2014-07-24
4/24/2015,699000.0,2,1.5,1400,4050,1.0,0.0,0.0,4,8,1400,0.0,1954,1954.0,98115,47.6768,-122.26899999999999,1900,5940,61.0,1954,2015-04-24
3/27/2015,280000.0,3,1.75,1590,7280,1.0,0.0,0.0,3,7,1140,450.0,1974,1974.0,98058,47.4288,-122.15299999999999,1590,9634,41.0,1974,2015-03-27
6/2/2014,580000.0,4,2.5,2220,7064,2.0,0.0,0.0,3,8,2220,0.0,1988,1988.0,98029,47.5716,-122.022,2220,7451,27.0,1988,2014-06-02
6/20/2014,754800.0,2,2.5,2770,7781,2.0,0.0,0.0,3,8,2770,0.0,2006,2006.0,98053,47.7072,-122.01700000000001,1870,5984,9.0,2006,2014-06-20
2/10/2015,525000.0,4,2.5,2303,16801,2.0,0.0,0.0,3,8,2303,0.0,1995,1995.0,98019,47.7266,-121.96600000000001,2080,14013,20.0,1995,2015-02-10
2/17/2015,562000.0,3,1.75,1600,10530,1.0,0.0,2.0,3,8,1600,0.0,1962,1962.0,98155,47.7437,-122.291,2590,8274,53.0,1962,2015-02-17
5/20/2014,575000.0,4,1.75,1280,6060,1.0,0.0,0.0,3,7,860,420.0,1926,1926.0,98117,47.6805,-122.36399999999999,1490,4680,89.0,1926,2014-05-20
7/11/2014,808900.0,5,2.5,2900,5901,2.0,0.0,0.0,3,9,2900,0.0,2006,2006.0,98027,47.5396,-121.99799999999999,3200,5775,9.0,2006,2014-07-11
3/3/2015,992000.0,3,2.25,2950,15207,1.0,0.0,0.0,4,10,2070,880.0,1966,1966.0,98040,47.5571,-122.21600000000001,2950,22000,49.0,1966,2015-03-03
9/19/2014,335000.0,3,2.5,1700,6698,2.0,0.0,0.0,3,7,1700,0.0,1997,1997.0,98038,47.3826,-122.02799999999999,2190,7346,18.0,1997,2014-09-19
12/26/2014,473000.0,3,2.75,1050,7200,1.0,0.0,0.0,3,7,1050,0.0,1985,1985.0,98125,47.7163,-122.303,1860,9000,30.0,1985,2014-12-26
3/25/2015,350000.0,4,2.75,2990,11210,1.0,0.0,1.0,4,8,1880,1110.0,1977,1977.0,98023,47.3357,-122.336,2790,9858,38.0,1977,2015-03-25
4/24/2015,1600000.0,5,2.5,3100,5374,2.5,0.0,0.0,4,9,3100,0.0,1906,1906.0,98122,47.6154,-122.28299999999999,2180,5800,109.0,1906,2015-04-24
12/17/2014,305500.0,3,1.0,1240,6090,1.0,0.0,0.0,4,7,1240,0.0,1950,1950.0,98155,47.7542,-122.307,1550,9096,65.0,1950,2014-12-17
5/23/2014,306000.0,2,1.0,780,13500,1.0,0.0,0.0,4,7,780,0.0,1946,1989.0,98077,47.7383,-122.074,2200,67518,26.0,1989,2014-05-23
12/2/2014,233000.0,2,2.25,850,1656,2.0,0.0,0.0,3,8,850,0.0,2001,2001.0,98133,47.7064,-122.344,850,1312,14.0,2001,2014-12-02
3/31/2015,490000.0,3,1.75,1540,9000,1.0,0.0,0.0,3,8,1540,0.0,1971,1971.0,98125,47.7152,-122.322,1710,7488,44.0,1971,2015-03-31
7/1/2014,445000.0,4,2.5,2280,42077,2.0,0.0,0.0,3,8,2280,0.0,1994,1994.0,98042,47.3424,-122.07700000000001,2280,36236,21.0,1994,2014-07-01
11/20/2014,355000.0,3,2.25,2550,9674,1.0,0.0,0.0,3,7,1850,700.0,1959,1959.0,98178,47.4856,-122.24700000000001,2240,9674,56.0,1959,2014-11-20
4/2/2015,360000.0,2,2.0,1770,7607,1.0,0.0,0.0,4,8,1770,0.0,1987,1987.0,98058,47.4287,-122.163,2090,7109,28.0,1987,2015-04-02
7/9/2014,737500.0,3,1.75,2320,10900,2.0,0.0,0.0,3,7,2320,0.0,1935,1974.0,98115,47.6877,-122.28299999999999,1610,5800,41.0,1974,2014-07-09
12/15/2014,985000.0,3,3.5,2600,11920,2.0,0.0,0.0,5,8,2600,0.0,1969,1969.0,98004,47.582,-122.194,2430,10050,46.0,1969,2014-12-15
8/6/2014,349950.0,2,3.25,1570,2031,2.0,0.0,0.0,3,8,1310,260.0,2006,2006.0,98126,47.548,-122.375,1570,2039,9.0,2006,2014-08-06
2/20/2015,520000.0,4,2.5,3060,7161,2.0,0.0,0.0,3,8,2860,200.0,2005,2005.0,98065,47.5383,-121.87899999999999,2950,6822,10.0,2005,2015-02-20
12/17/2014,355950.0,4,2.5,1960,8540,1.0,0.0,0.0,3,7,1220,740.0,1955,1955.0,98177,47.7654,-122.359,1910,9120,60.0,1955,2014-12-17
12/29/2014,485000.0,5,2.5,3270,6129,2.0,0.0,0.0,3,9,3270,0.0,2004,2004.0,98055,47.4461,-122.208,2980,5928,11.0,2004,2014-12-29
12/12/2014,143000.0,3,1.0,1090,3315,1.0,0.0,0.0,4,6,1090,0.0,1969,1969.0,98092,47.3159,-122.18299999999999,960,3120,46.0,1969,2014-12-12
12/10/2014,3280000.0,2,1.75,6840,10000,2.5,1.0,4.0,3,11,4350,2490.0,2001,2001.0,98008,47.6042,-122.11200000000001,3120,12300,14.0,2001,2014-12-10
7/23/2014,355000.0,3,1.0,940,8512,1.0,0.0,0.0,4,7,940,0.0,1967,1967.0,98033,47.7002,-122.191,1060,8512,48.0,1967,2014-07-23
6/4/2014,1130000.0,5,3.5,3880,13885,2.0,0.0,3.0,4,9,2540,1340.0,1979,1979.0,98006,47.5696,-122.156,3690,13885,36.0,1979,2014-06-04
8/18/2014,200000.0,5,1.75,1770,15525,1.0,0.0,0.0,4,7,1770,0.0,1959,1959.0,98059,47.5025,-122.14200000000001,1370,10395,56.0,1959,2014-08-18
6/18/2014,913000.0,4,2.5,3640,10576,2.0,0.0,0.0,3,11,3640,0.0,1999,1999.0,98075,47.5899,-121.979,3370,10351,16.0,1999,2014-06-18
5/22/2014,1600000.0,3,2.5,3160,12824,1.0,0.0,2.0,4,9,1820,1340.0,1966,1966.0,98004,47.6151,-122.21600000000001,3390,11985,49.0,1966,2014-05-22
6/25/2014,409900.0,2,2.5,1590,1845,2.0,0.0,0.0,3,9,1590,0.0,1997,1997.0,98033,47.6897,-122.175,2320,3174,18.0,1997,2014-06-25
5/1/2015,265000.0,4,1.0,1290,6034,1.0,0.0,0.0,3,6,1050,240.0,1950,1950.0,98118,47.5223,-122.286,1060,6034,65.0,1950,2015-05-01
4/10/2015,740000.0,5,3.0,3655,51836,1.0,0.0,0.0,5,8,2174,1481.0,1955,1955.0,98008,47.6434,-122.115,2530,8606,60.0,1955,2015-04-10
6/12/2014,306000.0,4,2.5,2490,8124,2.0,0.0,0.0,3,7,2490,0.0,2001,2001.0,98092,47.3347,-122.17,2760,6300,14.0,2001,2014-06-12
10/7/2014,381000.0,3,2.5,1470,3999,2.0,0.0,0.0,3,7,1470,0.0,2003,2003.0,98065,47.5328,-121.87100000000001,1960,4444,12.0,2003,2014-10-07
5/5/2015,1220000.0,3,3.25,3960,6132,2.0,0.0,3.0,3,10,2600,1360.0,1933,1933.0,98199,47.6396,-122.40899999999999,2730,5221,82.0,1933,2015-05-05
3/20/2015,1050000.0,3,3.5,3190,29982,1.0,0.0,3.0,4,8,2630,560.0,1941,1941.0,98166,47.458,-122.368,2600,19878,74.0,1941,2015-03-20
9/3/2014,408000.0,2,1.0,810,7440,1.0,0.0,0.0,5,6,810,0.0,1948,1948.0,98133,47.7346,-122.352,830,7500,67.0,1948,2014-09-03
6/25/2014,739900.0,5,2.5,2980,5377,2.0,0.0,0.0,3,9,2980,0.0,2006,2006.0,98052,47.7074,-122.101,3150,6593,9.0,2006,2014-06-25
11/21/2014,674250.0,4,2.5,2780,35000,1.0,0.0,0.0,4,9,2780,0.0,1985,1985.0,98072,47.7386,-122.09100000000001,2740,35072,30.0,1985,2014-11-21
9/11/2014,438400.0,2,1.0,1340,8100,1.0,0.0,0.0,4,7,1340,0.0,1953,1953.0,98177,47.7218,-122.37,1700,8100,62.0,1953,2014-09-11
12/30/2014,1700000.0,5,5.0,4930,14649,2.0,0.0,3.0,3,11,4160,770.0,2000,2000.0,98040,47.5829,-122.24700000000001,3030,8479,15.0,2000,2014-12-30
6/19/2014,703000.0,3,2.0,1360,5980,1.5,0.0,0.0,3,8,1360,0.0,1945,2008.0,98116,47.5852,-122.38799999999999,1520,4440,7.0,2008,2014-06-19
12/29/2014,262000.0,3,1.75,1320,6530,1.0,0.0,0.0,4,7,1320,0.0,1989,1989.0,98023,47.2871,-122.354,1620,6817,26.0,1989,2014-12-29
4/23/2015,353000.0,3,2.0,1210,14499,1.0,0.0,0.0,3,7,1210,0.0,1984,1984.0,98045,47.4705,-121.75399999999999,1570,15360,31.0,1984,2015-04-23
1/14/2015,500000.0,4,2.5,1940,7607,2.0,0.0,0.0,3,8,1940,0.0,1995,1995.0,98052,47.685,-122.15799999999999,2250,7600,20.0,1995,2015-01-14
7/6/2014,1280000.0,4,2.5,3160,4620,1.5,0.0,4.0,3,9,2020,1140.0,1917,1917.0,98116,47.5875,-122.382,2790,5308,98.0,1917,2014-07-06
4/8/2015,332000.0,4,2.5,1980,6566,2.0,0.0,0.0,3,8,1980,0.0,2004,2004.0,98042,47.3809,-122.09700000000001,2590,6999,11.0,2004,2015-04-08
8/21/2014,824000.0,4,2.5,2320,14240,1.0,0.0,0.0,4,9,1620,700.0,1974,1974.0,98008,47.6269,-122.09,2810,13200,41.0,1974,2014-08-21
2/20/2015,290000.0,4,2.0,1660,4788,1.0,0.0,0.0,3,7,1660,0.0,1968,1968.0,98144,47.5878,-122.31200000000001,1150,5000,47.0,1968,2015-02-20
6/27/2014,700000.0,3,2.5,1660,1545,2.0,0.0,2.0,3,9,1400,260.0,2002,2002.0,98109,47.6268,-122.353,1820,2570,13.0,2002,2014-06-27
10/6/2014,550000.0,2,1.0,1080,3420,1.0,0.0,0.0,4,7,780,300.0,1922,1922.0,98107,47.6715,-122.39299999999999,1380,3656,93.0,1922,2014-10-06
9/3/2014,549000.0,2,1.0,1510,11165,1.5,0.0,0.0,4,7,1510,0.0,1921,1921.0,98133,47.7212,-122.331,2210,8851,94.0,1921,2014-09-03
3/6/2015,1870000.0,4,2.5,2950,43560,1.0,0.0,2.0,4,9,2550,400.0,1951,1951.0,98004,47.5988,-122.20700000000001,3260,41016,64.0,1951,2015-03-06
3/2/2015,858000.0,4,2.25,3070,13720,2.0,0.0,0.0,3,9,3070,0.0,1978,1978.0,98007,47.6133,-122.152,3010,9657,37.0,1978,2015-03-02
10/30/2014,345000.0,2,1.0,970,10423,1.0,0.0,0.0,3,7,970,0.0,1947,1947.0,98133,47.7252,-122.331,1200,7857,68.0,1947,2014-10-30
11/4/2014,340000.0,4,1.75,2140,11651,2.5,0.0,0.0,3,8,2140,0.0,1930,2001.0,98022,47.19600000000001,-122.006,2030,10978,14.0,2001,2014-11-04
4/25/2015,1220000.0,4,2.25,2570,9600,2.5,0.0,0.0,4,9,2570,0.0,1962,1962.0,98040,47.5791,-122.241,2570,13200,53.0,1962,2015-04-25
12/11/2014,275000.0,3,2.25,1260,1488,3.0,0.0,0.0,3,7,1260,0.0,2009,2009.0,98133,47.7071,-122.336,1190,1095,6.0,2009,2014-12-11
8/27/2014,405000.0,3,1.0,1220,7771,1.0,0.0,0.0,3,7,1220,0.0,1963,1963.0,98008,47.6326,-122.119,1420,7674,52.0,1963,2014-08-27
1/16/2015,432500.0,3,2.0,1720,8145,2.0,0.0,0.0,5,7,1720,0.0,1949,1949.0,98155,47.7393,-122.325,1400,8138,66.0,1949,2015-01-16
1/12/2015,236500.0,4,1.0,2140,4217,1.5,0.0,0.0,3,6,1320,820.0,1925,1925.0,98118,47.5484,-122.287,1720,5413,90.0,1925,2015-01-12
7/18/2014,679000.0,4,1.5,1420,4923,1.5,0.0,0.0,4,8,1420,0.0,1928,1928.0,98103,47.6901,-122.339,1470,4923,87.0,1928,2014-07-18
10/31/2014,543000.0,4,2.5,2060,8451,2.0,0.0,0.0,3,8,2060,0.0,1995,1995.0,98133,47.7168,-122.333,2060,9460,20.0,1995,2014-10-31
9/26/2014,294000.0,3,1.0,1320,9520,1.0,0.0,0.0,3,7,990,330.0,1953,1953.0,98178,47.4857,-122.25299999999999,1460,10610,62.0,1953,2014-09-26
4/3/2015,340500.0,3,1.75,1810,10463,1.0,0.0,0.0,4,7,1810,0.0,1969,1969.0,98058,47.4581,-122.162,1620,8551,46.0,1969,2015-04-03
7/3/2014,1010000.0,4,2.5,2980,16263,2.0,0.0,0.0,3,9,2980,0.0,1989,1989.0,98006,47.5457,-122.15299999999999,2730,10018,26.0,1989,2014-07-03
5/2/2014,335000.0,2,2.0,1350,2560,1.0,0.0,0.0,3,8,1350,0.0,1976,1976.0,98052,47.6344,-122.10700000000001,1790,2560,39.0,1976,2014-05-02
7/23/2014,425000.0,3,2.0,1540,8011,1.0,0.0,0.0,3,7,1540,0.0,1988,1988.0,98011,47.7342,-122.20200000000001,1630,7141,27.0,1988,2014-07-23
2/10/2015,353000.0,3,2.5,2510,9240,2.0,0.0,0.0,4,8,2510,0.0,2001,2001.0,98022,47.1896,-122.01299999999999,2690,9240,14.0,2001,2015-02-10
5/4/2015,540000.0,3,2.5,1670,5146,2.0,0.0,0.0,3,8,1670,0.0,1991,1991.0,98029,47.5707,-121.999,1940,5146,24.0,1991,2015-05-04
6/12/2014,640000.0,5,3.5,3690,11928,2.0,0.0,0.0,3,9,2540,1150.0,2006,2006.0,98074,47.6108,-122.06,2640,11928,9.0,2006,2014-06-12
7/22/2014,339950.0,3,1.0,1320,11457,1.0,0.0,0.0,3,8,1320,0.0,1959,1959.0,98028,47.7738,-122.26100000000001,1900,9800,56.0,1959,2014-07-22
11/7/2014,195000.0,3,1.75,1510,8400,1.0,0.0,0.0,2,7,980,530.0,1979,1979.0,98045,47.4476,-121.771,1500,10125,36.0,1979,2014-11-07
2/26/2015,322000.0,3,1.75,1510,8400,1.0,0.0,0.0,2,7,980,530.0,1979,1979.0,98045,47.4476,-121.771,1500,10125,36.0,1979,2015-02-26
4/1/2015,660000.0,4,1.75,1870,10450,1.0,0.0,0.0,3,8,1620,250.0,1978,1978.0,98005,47.5938,-122.154,2060,10450,37.0,1978,2015-04-01
9/16/2014,280000.0,6,3.0,2400,9373,2.0,0.0,0.0,3,7,2400,0.0,1991,1991.0,98002,47.3262,-122.214,2060,7316,24.0,1991,2014-09-16
4/22/2015,300000.0,6,3.0,2400,9373,2.0,0.0,0.0,3,7,2400,0.0,1991,1991.0,98002,47.3262,-122.214,2060,7316,24.0,1991,2015-04-22
8/15/2014,207500.0,3,1.0,1170,8816,1.0,0.0,0.0,4,6,1170,0.0,1966,1966.0,98023,47.3059,-122.368,1200,9108,49.0,1966,2014-08-15
8/25/2014,195000.0,3,1.5,1190,8726,1.0,0.0,0.0,3,7,1190,0.0,1956,1956.0,98146,47.4887,-122.34299999999999,1390,8741,59.0,1956,2014-08-25
6/10/2014,700000.0,3,2.0,2080,3880,1.0,0.0,0.0,5,7,1160,920.0,1954,1954.0,98117,47.68600000000001,-122.391,1330,3880,61.0,1954,2014-06-10
4/17/2015,560000.0,4,1.75,2150,8555,1.0,0.0,2.0,4,7,1460,690.0,1982,1982.0,98106,47.5344,-122.345,1480,7405,33.0,1982,2015-04-17
8/20/2014,260000.0,3,1.75,1580,7344,1.0,0.0,0.0,5,7,1580,0.0,1911,1911.0,98126,47.5256,-122.38,1580,6207,104.0,1911,2014-08-20
2/25/2015,575000.0,3,1.75,1580,7344,1.0,0.0,0.0,5,7,1580,0.0,1911,1911.0,98126,47.5256,-122.38,1580,6207,104.0,1911,2015-02-25
4/17/2015,475000.0,3,2.5,2370,3239,2.0,0.0,0.0,3,8,1950,420.0,2006,2006.0,98072,47.7515,-122.17399999999999,2520,3431,9.0,2006,2015-04-17
6/13/2014,285000.0,3,1.75,1840,8601,1.0,0.0,0.0,3,7,920,920.0,1905,2014.0,98118,47.5359,-122.27600000000001,1390,7452,1.0,2014,2014-06-13
5/8/2014,753888.0,4,2.5,2660,5500,2.0,0.0,2.0,3,9,2660,0.0,2003,2003.0,98029,47.5439,-121.99600000000001,3620,5500,12.0,2003,2014-05-08
4/10/2015,650000.0,3,2.5,2190,3600,2.0,0.0,0.0,3,9,2190,0.0,2003,2003.0,98029,47.5506,-121.993,2300,3600,12.0,2003,2015-04-10
8/7/2014,620000.0,3,2.25,1660,3478,1.5,0.0,0.0,4,7,1100,560.0,1929,1929.0,98117,47.6773,-122.37200000000001,1610,3478,86.0,1929,2014-08-07
3/13/2015,526000.0,3,1.75,1780,37801,1.0,0.0,0.0,3,7,1300,480.0,1977,1977.0,98075,47.5858,-122.015,2380,47480,38.0,1977,2015-03-13
5/14/2014,155000.0,2,1.0,700,5200,1.0,0.0,0.0,5,6,700,0.0,1952,1952.0,98056,47.4924,-122.175,1030,5200,63.0,1952,2014-05-14
8/27/2014,342000.0,4,2.0,1570,11200,1.0,0.0,0.0,3,7,1120,450.0,1959,1959.0,98011,47.7573,-122.21700000000001,1570,11200,56.0,1959,2014-08-27
4/7/2015,390000.0,3,1.75,1220,216332,1.0,0.0,0.0,3,7,1220,0.0,1981,1981.0,98019,47.7224,-121.926,1540,61419,34.0,1981,2015-04-07
6/5/2014,685000.0,3,2.75,3150,219978,2.0,0.0,0.0,4,9,3000,150.0,1990,1990.0,98024,47.553000000000004,-121.946,3180,218235,25.0,1990,2014-06-05
6/25/2014,608000.0,4,2.5,2690,4736,2.0,0.0,0.0,3,7,2690,0.0,2001,2001.0,98053,47.6869,-122.036,2690,4791,14.0,2001,2014-06-25
9/16/2014,179900.0,2,1.0,680,6400,1.0,0.0,0.0,3,6,680,0.0,1943,1943.0,98168,47.5136,-122.316,1240,7800,72.0,1943,2014-09-16
9/4/2014,1250000.0,6,3.25,3750,14150,2.0,0.0,2.0,5,9,2750,1000.0,1936,1968.0,98117,47.6999,-122.39299999999999,2140,7968,47.0,1968,2014-09-04
4/30/2015,166000.0,3,1.0,1010,11675,1.0,0.0,0.0,3,7,1010,0.0,1957,1957.0,98168,47.4849,-122.301,1370,10042,58.0,1957,2015-04-30
5/19/2014,462000.0,3,1.5,1710,4500,1.5,0.0,0.0,3,8,1410,300.0,1928,1928.0,98118,47.5366,-122.26799999999999,1860,6000,87.0,1928,2014-05-19
6/22/2014,545000.0,4,2.5,2090,6023,2.0,0.0,0.0,3,8,2090,0.0,1990,1990.0,98029,47.5713,-121.99700000000001,2090,6023,25.0,1990,2014-06-22
1/16/2015,415000.0,3,1.0,1560,4500,1.5,0.0,0.0,3,7,1560,0.0,1903,1903.0,98122,47.6118,-122.306,1660,4500,112.0,1903,2015-01-16
6/10/2014,269000.0,3,2.5,1560,4200,2.0,0.0,0.0,3,7,1560,0.0,2003,2003.0,98038,47.3838,-122.02600000000001,1560,4200,12.0,2003,2014-06-10
12/12/2014,356500.0,4,2.5,2570,11473,2.0,0.0,0.0,3,8,2570,0.0,2008,2008.0,98003,47.2809,-122.296,2430,5997,7.0,2008,2014-12-12
12/23/2014,225000.0,3,1.0,1010,7633,1.0,0.0,0.0,4,6,1010,0.0,1961,1961.0,98198,47.3781,-122.314,1190,8386,54.0,1961,2014-12-23
6/20/2014,175000.0,2,1.0,1020,5130,1.0,0.0,0.0,4,6,1020,0.0,1948,1948.0,98002,47.301,-122.226,1200,6497,67.0,1948,2014-06-20
8/1/2014,549000.0,5,2.5,1710,9720,2.0,0.0,0.0,4,8,1710,0.0,1974,1974.0,98005,47.5903,-122.15700000000001,2270,9672,41.0,1974,2014-08-01
4/15/2015,535000.0,3,2.75,2300,12197,2.0,0.0,0.0,3,8,2300,0.0,1989,1989.0,98166,47.4369,-122.338,1710,11220,26.0,1989,2015-04-15
5/5/2014,627000.0,4,2.25,1990,7712,1.0,0.0,0.0,3,8,1210,0.0,1973,1973.0,98027,47.5688,-122.087,1720,7393,42.0,1973,2014-05-05
8/22/2014,565000.0,3,2.0,2730,15677,2.5,0.0,3.0,3,9,2730,0.0,1976,1976.0,98166,47.4612,-122.365,2040,12209,39.0,1976,2014-08-22
11/12/2014,392450.0,4,2.0,2195,2681,1.0,0.0,0.0,3,7,1060,1135.0,1912,1912.0,98103,47.6965,-122.34200000000001,1710,1280,103.0,1912,2014-11-12
9/23/2014,509000.0,2,2.0,1560,4675,1.0,0.0,0.0,3,8,1560,0.0,2006,2006.0,98053,47.7086,-122.01899999999999,1870,6361,9.0,2006,2014-09-23
9/12/2014,340000.0,3,2.5,1400,4800,1.0,0.0,0.0,3,7,1200,200.0,1921,1921.0,98117,47.6865,-122.37899999999999,1440,3840,94.0,1921,2014-09-12
3/26/2015,537000.0,3,2.5,1400,4800,1.0,0.0,0.0,3,7,1200,200.0,1921,1921.0,98117,47.6865,-122.37899999999999,1440,3840,94.0,1921,2015-03-26
5/5/2014,865000.0,4,3.0,3690,9892,2.0,0.0,0.0,3,10,3690,0.0,1998,1998.0,98075,47.5937,-121.98200000000001,3430,11294,17.0,1998,2014-05-05
12/14/2014,358000.0,2,1.0,1140,8340,1.0,0.0,0.0,3,7,1140,0.0,1948,1948.0,98155,47.7448,-122.3,1030,8149,67.0,1948,2014-12-14
9/19/2014,595000.0,4,2.25,1920,3225,1.5,0.0,0.0,5,7,1300,620.0,1923,1923.0,98116,47.5848,-122.384,1960,3750,92.0,1923,2014-09-19
6/19/2014,661000.0,4,2.5,2496,8058,2.0,0.0,0.0,3,9,2496,0.0,1998,1998.0,98052,47.6791,-122.149,2496,7757,17.0,1998,2014-06-19
9/16/2014,419950.0,3,2.25,2280,8500,1.0,0.0,0.0,4,7,1680,600.0,1977,1977.0,98034,47.7211,-122.166,1890,7700,38.0,1977,2014-09-16
4/16/2015,490000.0,4,3.5,3200,6420,2.0,0.0,0.0,3,9,3200,0.0,2006,2006.0,98038,47.3545,-122.001,3200,6291,9.0,2006,2015-04-16
9/18/2014,525000.0,2,1.0,880,4000,1.0,0.0,0.0,3,7,880,0.0,1940,1940.0,98117,47.6847,-122.387,1310,4000,75.0,1940,2014-09-18
8/13/2014,350000.0,3,2.0,1320,1298,3.0,0.0,0.0,3,7,1320,0.0,1995,1995.0,98117,47.6959,-122.376,1380,1503,20.0,1995,2014-08-13
5/11/2015,552500.0,3,2.5,2450,3582,2.0,0.0,0.0,3,9,2450,0.0,2008,2008.0,98072,47.7749,-122.15899999999999,2490,5449,7.0,2008,2015-05-11
3/27/2015,210000.0,3,1.0,1040,8970,1.0,0.0,0.0,4,6,1040,0.0,1961,1961.0,98023,47.3283,-122.337,1040,8450,54.0,1961,2015-03-27
3/11/2015,390000.0,3,2.5,2480,53250,2.0,0.0,0.0,3,9,2480,0.0,1990,1990.0,98042,47.3323,-122.079,2510,36549,25.0,1990,2015-03-11
1/29/2015,336800.0,5,1.75,1830,16650,1.5,0.0,0.0,3,7,1610,220.0,1958,1958.0,98155,47.7734,-122.315,1790,12743,57.0,1958,2015-01-29
3/3/2015,465000.0,3,2.5,1440,4473,2.0,0.0,0.0,3,7,1440,0.0,2003,2003.0,98053,47.6825,-122.036,1650,3322,12.0,2003,2015-03-03
12/18/2014,299900.0,4,2.5,1580,3632,2.0,0.0,0.0,3,7,1580,0.0,2011,2011.0,98038,47.3672,-122.01899999999999,1950,3800,4.0,2011,2014-12-18
7/18/2014,715000.0,3,3.25,3230,5000,2.0,0.0,0.0,3,9,3230,0.0,2006,2006.0,98029,47.5558,-122.00200000000001,2670,3977,9.0,2006,2014-07-18
5/23/2014,235000.0,4,2.5,1810,39639,1.0,0.0,0.0,3,7,1230,580.0,1970,1970.0,98042,47.3472,-122.11,1810,44866,45.0,1970,2014-05-23
12/10/2014,276000.0,3,2.5,2495,4400,2.0,0.0,0.0,3,8,2495,0.0,2007,2007.0,98001,47.2877,-122.28299999999999,2434,4400,8.0,2007,2014-12-10
1/12/2015,265000.0,4,1.5,1740,12728,1.0,0.0,0.0,4,7,1180,560.0,1964,1964.0,98003,47.2808,-122.3,1830,11125,51.0,1964,2015-01-12
5/30/2014,425000.0,3,1.75,1680,3000,1.0,0.0,2.0,4,6,840,840.0,1900,1900.0,98103,47.68600000000001,-122.346,1540,3700,115.0,1900,2014-05-30
1/5/2015,313000.0,4,2.5,2460,10320,2.0,0.0,0.0,3,8,2460,0.0,1993,1993.0,98092,47.2599,-122.215,2210,9024,22.0,1993,2015-01-05
4/9/2015,715000.0,3,2.5,3050,6000,1.0,0.0,3.0,3,8,1720,1330.0,1984,1984.0,98177,47.7701,-122.389,2340,7200,31.0,1984,2015-04-09
12/12/2014,265000.0,3,2.25,1630,10969,2.0,0.0,0.0,3,7,1630,0.0,1991,1991.0,98001,47.3305,-122.285,1410,7920,24.0,1991,2014-12-12
3/24/2015,646000.0,3,2.75,2460,6413,2.0,0.0,0.0,3,9,2460,0.0,2004,2004.0,98028,47.7497,-122.245,2440,6092,11.0,2004,2015-03-24
7/21/2014,175000.0,3,1.0,1030,6600,1.0,0.0,0.0,3,7,1030,0.0,1954,1954.0,98146,47.4941,-122.34,1220,9040,61.0,1954,2014-07-21
7/31/2014,649000.0,3,2.5,3410,13809,1.0,0.0,3.0,4,10,2450,960.0,1973,1973.0,98003,47.3424,-122.32600000000001,3410,14245,42.0,1973,2014-07-31
4/23/2015,785000.0,3,2.75,2310,5200,1.0,0.0,0.0,4,7,1520,790.0,1940,1940.0,98199,47.6357,-122.397,2310,5200,75.0,1940,2015-04-23
9/22/2014,890000.0,4,2.75,2610,4400,1.0,0.0,0.0,5,8,1260,1350.0,1920,1920.0,98122,47.6158,-122.29299999999999,1770,4400,95.0,1920,2014-09-22
11/26/2014,612000.0,3,3.0,2330,10327,1.0,0.0,0.0,3,9,2330,0.0,1998,1998.0,98034,47.7239,-122.164,2200,4629,17.0,1998,2014-11-26
12/5/2014,330000.0,4,2.5,2980,5674,2.0,0.0,0.0,3,8,2980,0.0,2003,2003.0,98023,47.277,-122.34700000000001,2610,5495,12.0,2003,2014-12-05
11/12/2014,493000.0,3,2.25,1790,11393,1.0,0.0,0.0,3,8,1790,0.0,1978,1978.0,98052,47.6297,-122.09899999999999,2290,11894,37.0,1978,2014-11-12
4/3/2015,1600000.0,4,2.25,2940,5735,1.0,0.0,0.0,3,9,1470,1470.0,1957,1957.0,98112,47.6381,-122.304,2230,5659,58.0,1957,2015-04-03
6/27/2014,1620000.0,4,3.0,3900,9750,1.0,0.0,4.0,5,10,2520,1380.0,1972,1972.0,98006,47.5605,-122.15799999999999,3410,9450,43.0,1972,2014-06-27
2/11/2015,1650000.0,4,3.0,3900,9750,1.0,0.0,4.0,5,10,2520,1380.0,1972,1972.0,98006,47.5605,-122.15799999999999,3410,9450,43.0,1972,2015-02-11
9/26/2014,499000.0,3,2.5,1750,2150,2.5,0.0,0.0,3,7,1230,520.0,1900,2014.0,98122,47.6037,-122.311,1410,3300,1.0,2014,2014-09-26
6/23/2014,603500.0,6,2.75,2660,8400,1.0,0.0,0.0,5,8,1550,1110.0,1962,1962.0,98006,47.549,-122.17299999999999,2280,8400,53.0,1962,2014-06-23
6/24/2014,530000.0,2,1.5,1580,3680,1.0,0.0,2.0,3,8,1280,300.0,1941,1941.0,98126,47.5762,-122.37700000000001,1730,3680,74.0,1941,2014-06-24
4/6/2015,895000.0,5,2.5,2350,14197,1.0,0.0,0.0,4,8,1220,1130.0,1962,1962.0,98004,47.6005,-122.204,2470,11629,53.0,1962,2015-04-06
5/13/2014,267345.0,4,2.25,2510,8165,1.0,0.0,0.0,4,7,1610,900.0,1972,1972.0,98023,47.3092,-122.37200000000001,1940,8250,43.0,1972,2014-05-13
5/16/2014,275000.0,3,2.5,1480,15639,2.0,0.0,0.0,3,8,1480,0.0,1987,1987.0,98045,47.4723,-121.74600000000001,1480,16454,28.0,1987,2014-05-16
2/25/2015,439950.0,3,1.75,1720,223377,1.0,0.0,0.0,3,7,1240,480.0,1950,1950.0,98019,47.7329,-121.92,2530,221442,65.0,1950,2015-02-25
6/20/2014,455000.0,3,2.25,1470,4653,2.0,0.0,0.0,4,7,1470,0.0,1985,1985.0,98029,47.5667,-122.01799999999999,1560,4119,30.0,1985,2014-06-20
1/13/2015,630000.0,3,1.75,1540,6930,1.0,0.0,0.0,3,7,1250,290.0,1944,1944.0,98115,47.6782,-122.27799999999999,1760,6930,71.0,1944,2015-01-13
11/3/2014,690000.0,3,2.5,2820,5001,2.0,0.0,0.0,3,9,2820,0.0,2004,2004.0,98029,47.5533,-121.992,2660,5001,11.0,2004,2014-11-03
8/26/2014,212000.0,4,1.75,1250,12705,1.0,0.0,0.0,4,7,1250,0.0,1971,1971.0,98023,47.302,-122.382,1390,8550,44.0,1971,2014-08-26
8/13/2014,231500.0,4,2.25,2080,7526,1.0,0.0,0.0,4,7,1280,800.0,1985,1985.0,98030,47.3762,-122.18299999999999,1200,7500,30.0,1985,2014-08-13
4/30/2015,1240000.0,4,3.25,5180,49936,2.0,0.0,0.0,4,10,5180,0.0,1991,1991.0,98053,47.6676,-122.069,4240,35363,24.0,1991,2015-04-30
7/8/2014,378500.0,3,2.5,2860,43821,2.0,0.0,0.0,4,9,2860,0.0,1990,1990.0,98092,47.3163,-122.14200000000001,2370,65340,25.0,1990,2014-07-08
5/2/2014,482000.0,4,2.5,2710,35868,2.0,0.0,0.0,3,9,2710,0.0,1989,1989.0,98038,47.375,-122.022,2780,36224,26.0,1989,2014-05-02
5/5/2015,695000.0,2,1.0,1140,3990,1.0,0.0,0.0,3,7,1140,0.0,1924,1924.0,98103,47.6554,-122.333,1800,5700,91.0,1924,2015-05-05
12/2/2014,965000.0,4,2.5,4070,57587,2.0,0.0,0.0,3,10,4070,0.0,1989,1989.0,98052,47.6908,-122.052,3890,35960,26.0,1989,2014-12-02
2/4/2015,675000.0,3,1.75,1710,5913,1.0,0.0,0.0,4,8,1120,590.0,1941,1941.0,98199,47.6481,-122.406,2920,5922,74.0,1941,2015-02-04
10/27/2014,387000.0,3,1.5,1340,6500,1.0,0.0,0.0,3,7,1340,0.0,1972,1972.0,98034,47.7168,-122.19200000000001,1620,7107,43.0,1972,2014-10-27
3/30/2015,347500.0,4,2.75,2290,7000,2.0,0.0,0.0,3,8,2290,0.0,1977,1977.0,98058,47.4442,-122.12899999999999,2000,7200,38.0,1977,2015-03-30
7/11/2014,385000.0,3,2.0,1860,7400,1.0,0.0,0.0,3,8,930,0.0,1922,2004.0,98166,47.4598,-122.352,1640,8461,11.0,2004,2014-07-11
12/4/2014,265000.0,3,1.0,1080,4930,1.0,0.0,0.0,3,6,1080,0.0,1950,1950.0,98126,47.5209,-122.374,1100,5950,65.0,1950,2014-12-04
4/22/2015,406000.0,3,1.0,960,5264,1.0,0.0,0.0,3,7,960,0.0,1953,1953.0,98115,47.6805,-122.301,1140,5150,62.0,1953,2015-04-22
5/8/2014,134000.0,2,1.5,980,5000,2.0,0.0,0.0,3,7,980,0.0,1922,2003.0,98014,47.7076,-121.359,1040,5000,12.0,2003,2014-05-08
10/20/2014,415000.0,3,1.0,1500,3399,2.0,0.0,0.0,5,7,1300,200.0,1926,1926.0,98103,47.6838,-122.352,1360,3588,89.0,1926,2014-10-20
5/27/2014,375000.0,3,1.75,1440,8775,1.0,0.0,0.0,3,7,1440,0.0,1973,1973.0,98034,47.7231,-122.17,1790,7865,42.0,1973,2014-05-27
12/10/2014,620000.0,4,2.5,2580,7465,2.0,0.0,0.0,3,8,2580,0.0,1993,1993.0,98074,47.6319,-122.022,2350,7596,22.0,1993,2014-12-10
10/28/2014,337500.0,5,2.5,2070,4698,2.0,0.0,0.0,3,7,2070,0.0,1999,1999.0,98038,47.3539,-122.024,2010,4698,16.0,1999,2014-10-28
9/22/2014,565000.0,3,2.5,1880,12368,1.0,0.0,0.0,4,7,1260,620.0,1967,1967.0,98005,47.5901,-122.167,1950,11551,48.0,1967,2014-09-22
5/23/2014,399500.0,3,1.75,2420,12676,2.0,0.0,0.0,3,7,2420,0.0,1911,1986.0,98045,47.4943,-121.789,1210,6769,29.0,1986,2014-05-23
5/21/2014,1070000.0,2,1.75,1890,9466,2.0,0.0,0.0,3,8,1890,0.0,1987,1987.0,98004,47.6144,-122.211,2180,12825,28.0,1987,2014-05-21
8/21/2014,352500.0,3,2.0,1920,33630,1.0,0.0,0.0,3,8,1920,0.0,1992,1992.0,98056,47.4983,-122.167,2080,7505,23.0,1992,2014-08-21
6/17/2014,259000.0,3,2.0,1870,5909,1.0,0.0,0.0,3,7,1270,600.0,1986,1986.0,98030,47.3665,-122.18299999999999,1870,7887,29.0,1986,2014-06-17
4/15/2015,320000.0,2,1.0,900,7620,1.0,0.0,0.0,3,7,900,0.0,1971,1971.0,98106,47.5268,-122.34299999999999,1520,7620,44.0,1971,2015-04-15
8/11/2014,733000.0,3,2.5,2160,9888,2.0,0.0,0.0,4,9,2160,0.0,1989,1989.0,98052,47.6712,-122.14200000000001,3060,7829,26.0,1989,2014-08-11
6/25/2014,381500.0,2,1.0,900,2910,1.0,0.0,0.0,5,7,900,0.0,1924,1924.0,98115,47.6859,-122.322,1320,2910,91.0,1924,2014-06-25
12/2/2014,343000.0,2,1.0,1180,9261,1.0,0.0,0.0,4,7,940,240.0,1957,1957.0,98118,47.5492,-122.274,1700,6325,58.0,1957,2014-12-02
8/18/2014,205500.0,2,1.0,900,6400,1.0,0.0,0.0,5,6,900,0.0,1938,1938.0,98022,47.2113,-121.992,1320,6400,77.0,1938,2014-08-18
9/15/2014,525000.0,3,2.0,1600,16530,1.0,0.0,0.0,5,7,1600,0.0,1967,1967.0,98075,47.5821,-122.016,1850,41006,48.0,1967,2014-09-15
3/19/2015,300000.0,3,1.75,1500,8352,1.0,0.0,2.0,5,6,750,750.0,1943,1943.0,98056,47.4883,-122.191,1500,8447,72.0,1943,2015-03-19
7/22/2014,299000.0,2,1.0,1070,189486,1.0,0.0,0.0,3,6,1070,0.0,1942,1942.0,98077,47.7199,-122.085,1970,60548,73.0,1942,2014-07-22
7/9/2014,561000.0,4,2.5,2570,5250,2.0,0.0,0.0,3,8,2570,0.0,1990,1990.0,98029,47.5763,-122.0,2260,5392,25.0,1990,2014-07-09
2/24/2015,450000.0,3,1.0,1210,4000,1.5,0.0,0.0,3,7,1090,120.0,1928,1928.0,98144,47.5934,-122.30799999999999,1210,4000,87.0,1928,2015-02-24
8/14/2014,540000.0,4,2.5,1850,7850,2.0,0.0,0.0,3,8,1850,0.0,1985,1985.0,98052,47.6914,-122.103,1830,8140,30.0,1985,2014-08-14
6/24/2014,379000.0,3,2.5,1740,30886,2.0,0.0,0.0,3,8,1740,0.0,1992,1992.0,98045,47.46,-121.70700000000001,1740,39133,23.0,1992,2014-06-24
7/24/2014,230000.0,3,1.0,1300,14000,1.0,0.0,0.0,4,7,1300,0.0,1958,1958.0,98198,47.4213,-122.322,1390,8750,57.0,1958,2014-07-24
3/10/2015,399950.0,3,2.5,2000,30605,2.0,0.0,0.0,4,8,2000,0.0,1989,1989.0,98042,47.3442,-122.06200000000001,1930,35350,26.0,1989,2015-03-10
5/7/2015,355000.0,5,2.5,3220,5806,2.0,0.0,0.0,3,8,3220,0.0,2002,2002.0,98042,47.3714,-122.103,2760,5813,13.0,2002,2015-05-07
6/19/2014,580000.0,4,2.25,2160,9593,1.0,0.0,0.0,3,8,2160,0.0,1969,1969.0,98008,47.5883,-122.11200000000001,2820,9628,46.0,1969,2014-06-19
4/27/2015,700000.0,3,2.0,2130,4299,1.5,0.0,0.0,4,7,1680,450.0,1922,1922.0,98144,47.5779,-122.294,2040,4548,93.0,1922,2015-04-27
5/6/2014,279900.0,3,1.75,1580,8151,1.0,0.0,1.0,4,7,1100,480.0,1962,1962.0,98198,47.3672,-122.31200000000001,1650,8151,53.0,1962,2014-05-06
11/13/2014,210000.0,3,1.0,1200,7500,1.0,0.0,0.0,3,6,1200,0.0,1905,1989.0,98178,47.4921,-122.275,1010,7000,26.0,1989,2014-11-13
6/30/2014,1170000.0,3,3.0,3790,5001,2.0,0.0,0.0,3,10,2810,980.0,1989,1989.0,98122,47.6035,-122.285,2500,6286,26.0,1989,2014-06-30
6/11/2014,290300.0,2,1.0,860,3874,1.0,0.0,0.0,4,6,860,0.0,1931,1931.0,98055,47.4836,-122.204,1400,5106,84.0,1931,2014-06-11
10/3/2014,1600000.0,5,4.5,5130,43123,2.0,0.0,0.0,3,11,5130,0.0,1996,1996.0,98006,47.544,-122.126,4670,43560,19.0,1996,2014-10-03
4/16/2015,490000.0,3,1.0,1600,6380,1.5,0.0,0.0,3,7,1400,200.0,1939,1939.0,98125,47.7015,-122.31700000000001,1760,6380,76.0,1939,2015-04-16
5/6/2014,606000.0,4,2.5,2110,13850,2.0,0.0,0.0,3,9,2110,0.0,1987,1987.0,98027,47.5497,-122.07700000000001,2520,10194,28.0,1987,2014-05-06
7/14/2014,359950.0,3,1.0,1400,4980,1.0,0.0,0.0,3,6,950,450.0,1943,1943.0,98133,47.7041,-122.34,990,4980,72.0,1943,2014-07-14
2/12/2015,677100.0,3,2.0,2110,9199,1.0,0.0,0.0,3,10,2110,0.0,1993,1993.0,98074,47.6496,-122.083,3130,8841,22.0,1993,2015-02-12
2/21/2015,465000.0,3,2.0,1430,7125,1.0,0.0,0.0,4,7,1430,0.0,1984,1984.0,98074,47.6256,-122.059,1570,8075,31.0,1984,2015-02-21
8/15/2014,4500000.0,5,5.5,6640,40014,2.0,1.0,4.0,3,12,6350,290.0,2004,2004.0,98155,47.7493,-122.28,3030,23408,11.0,2004,2014-08-15
5/4/2015,500000.0,3,2.0,3040,41072,1.0,0.0,0.0,4,8,1520,1520.0,1978,1978.0,98038,47.3944,-121.97200000000001,2230,54014,37.0,1978,2015-05-04
5/3/2015,455000.0,2,1.0,980,5000,1.0,0.0,0.0,4,7,980,0.0,1950,1950.0,98155,47.7518,-122.279,1600,5965,65.0,1950,2015-05-03
8/18/2014,705000.0,6,2.0,2570,4240,1.5,0.0,0.0,4,7,1970,600.0,1911,1911.0,98115,47.6754,-122.307,2030,4240,104.0,1911,2014-08-18
8/12/2014,420000.0,3,2.5,2060,7020,1.0,0.0,0.0,4,8,1460,600.0,1967,1967.0,98177,47.7575,-122.36399999999999,2150,8400,48.0,1967,2014-08-12
10/5/2014,169575.0,3,1.0,1300,8284,1.0,0.0,0.0,3,7,1300,0.0,1968,1968.0,98003,47.3327,-122.306,1360,7848,47.0,1968,2014-10-05
2/25/2015,250000.0,3,1.0,1300,8284,1.0,0.0,0.0,3,7,1300,0.0,1968,1968.0,98003,47.3327,-122.306,1360,7848,47.0,1968,2015-02-25
3/12/2015,530000.0,3,2.25,1680,7262,1.0,0.0,0.0,5,7,1180,500.0,1973,1973.0,98034,47.713,-122.225,1910,7405,42.0,1973,2015-03-12
2/6/2015,590000.0,5,3.25,4020,40341,1.0,0.0,0.0,5,8,2170,1850.0,1970,1970.0,98027,47.4952,-122.068,2650,53437,45.0,1970,2015-02-06
9/23/2014,257500.0,3,1.75,1530,14087,1.0,0.0,0.0,3,7,1070,460.0,1979,1979.0,98042,47.3146,-122.04299999999999,1770,13660,36.0,1979,2014-09-23
6/26/2014,415000.0,3,1.0,1170,6700,1.0,0.0,0.0,3,8,1170,0.0,1957,1957.0,98125,47.7122,-122.29,2410,7620,58.0,1957,2014-06-26
10/10/2014,536000.0,3,1.75,1580,3764,1.5,0.0,0.0,3,7,1280,300.0,1945,1945.0,98107,47.672,-122.397,1560,3764,70.0,1945,2014-10-10
5/29/2014,246500.0,3,1.5,1270,11600,1.0,0.0,0.0,4,7,1270,0.0,1964,1964.0,98031,47.4075,-122.196,1380,9945,51.0,1964,2014-05-29
7/6/2014,395000.0,3,1.75,1480,7700,1.0,0.0,0.0,3,8,1480,0.0,1975,1975.0,98034,47.7225,-122.20200000000001,1930,8560,40.0,1975,2014-07-06
5/11/2015,739000.0,3,2.25,2220,10530,1.0,0.0,0.0,4,8,1700,520.0,1974,1974.0,98052,47.6383,-122.098,2500,10014,41.0,1974,2015-05-11
9/29/2014,1270000.0,4,2.75,3200,13729,2.0,0.0,0.0,3,11,3200,0.0,1984,1984.0,98005,47.6402,-122.171,4050,16921,31.0,1984,2014-09-29
7/8/2014,190000.0,3,1.0,910,10575,1.0,0.0,0.0,4,7,910,0.0,1968,1968.0,98003,47.2741,-122.301,1470,10425,47.0,1968,2014-07-08
4/10/2015,305000.0,3,1.5,1480,9086,1.0,0.0,0.0,3,7,1480,0.0,1962,1962.0,98168,47.4717,-122.323,1540,9750,53.0,1962,2015-04-10
4/20/2015,925000.0,4,4.25,3770,13058,2.0,0.0,0.0,4,8,3770,0.0,1983,1983.0,98028,47.7517,-122.225,2200,12255,32.0,1983,2015-04-20
8/21/2014,895000.0,4,3.0,3500,13444,2.0,0.0,0.0,3,10,2360,1140.0,1977,1977.0,98040,47.5468,-122.23100000000001,3140,12935,38.0,1977,2014-08-21
7/17/2014,656000.0,3,1.75,1480,7475,1.5,0.0,0.0,3,8,1480,0.0,1943,1943.0,98115,47.6732,-122.272,2120,7216,72.0,1943,2014-07-17
5/19/2014,560000.0,4,1.0,1660,4690,1.5,0.0,0.0,3,7,1260,400.0,1945,1945.0,98117,47.6829,-122.37799999999999,1400,3876,70.0,1945,2014-05-19
10/20/2014,610000.0,5,2.25,2520,11700,2.0,0.0,0.0,3,9,2520,0.0,1977,1977.0,98074,47.6322,-122.053,2530,12000,38.0,1977,2014-10-20
7/8/2014,645000.0,4,2.5,2850,37522,2.0,0.0,0.0,3,9,2850,0.0,1987,1987.0,98075,47.5852,-121.992,2980,35280,28.0,1987,2014-07-08
4/10/2015,259000.0,3,2.5,2153,4400,2.0,0.0,0.0,3,8,2153,0.0,2007,2007.0,98001,47.2872,-122.28299999999999,2434,4400,8.0,2007,2015-04-10
8/18/2014,980000.0,4,2.5,3780,10962,2.0,0.0,0.0,3,10,3780,0.0,1990,1990.0,98033,47.6533,-122.18299999999999,3310,11651,25.0,1990,2014-08-18
7/23/2014,872000.0,4,4.0,3770,9750,1.0,0.0,0.0,4,9,1940,1830.0,1967,1967.0,98177,47.7159,-122.367,2260,9878,48.0,1967,2014-07-23
8/5/2014,1000000.0,6,2.75,3600,9675,1.0,0.0,2.0,4,9,1940,1660.0,1977,1977.0,98040,47.5726,-122.213,2990,9675,38.0,1977,2014-08-05
9/10/2014,900000.0,3,2.75,2980,12600,1.5,0.0,0.0,3,8,1590,1390.0,1941,2012.0,98033,47.674,-122.196,1520,9660,3.0,2012,2014-09-10
4/28/2015,475000.0,4,1.5,2320,5534,1.5,0.0,0.0,4,7,1540,780.0,1915,1915.0,98103,47.6944,-122.355,1670,5913,100.0,1915,2015-04-28
1/7/2015,350000.0,5,2.75,2980,13482,1.0,0.0,0.0,4,8,1730,1250.0,1975,1975.0,98042,47.3774,-122.16,2900,14800,40.0,1975,2015-01-07
5/15/2014,840000.0,4,1.75,2930,11562,1.0,0.0,3.0,3,9,1670,1260.0,1947,1947.0,98117,47.6765,-122.404,2530,6517,68.0,1947,2014-05-15
6/22/2014,500000.0,4,2.5,2040,8400,1.0,0.0,0.0,3,8,1420,620.0,1963,1963.0,98006,47.5512,-122.17,2540,8925,52.0,1963,2014-06-22
4/6/2015,202500.0,3,1.5,1510,9898,1.0,0.0,0.0,3,7,1110,400.0,1954,1954.0,98148,47.4303,-122.334,1420,9250,61.0,1954,2015-04-06
12/23/2014,523000.0,4,2.5,2660,65340,2.0,0.0,0.0,3,8,2660,0.0,1988,1988.0,98027,47.4969,-122.06,2850,74052,27.0,1988,2014-12-23
12/3/2014,225000.0,3,2.5,1740,10050,2.0,0.0,0.0,3,7,1740,0.0,1989,1989.0,98001,47.2671,-122.236,1300,10125,26.0,1989,2014-12-03
3/9/2015,418200.0,3,2.25,2240,9542,1.0,0.0,1.0,3,7,1190,1050.0,1980,1980.0,98198,47.3995,-122.318,2080,9542,35.0,1980,2015-03-09
12/5/2014,356500.0,4,1.75,1570,9670,1.0,0.0,0.0,3,7,1170,400.0,1959,1959.0,98028,47.7432,-122.24799999999999,2080,9100,56.0,1959,2014-12-05
7/16/2014,670000.0,4,3.0,2500,5000,1.5,0.0,0.0,4,7,1460,0.0,1926,1926.0,98103,47.6895,-122.331,1720,4500,89.0,1926,2014-07-16
12/4/2014,456150.0,3,2.25,1750,12408,1.0,0.0,0.0,5,7,1150,600.0,1962,1962.0,98155,47.7509,-122.3,1820,12977,53.0,1962,2014-12-04
6/3/2014,471000.0,4,2.5,3030,9687,2.0,0.0,0.0,3,8,2020,1010.0,1998,1998.0,98045,47.485,-121.79899999999999,2050,10193,17.0,1998,2014-06-03
4/9/2015,558000.0,3,2.5,1680,934,3.0,0.0,0.0,3,8,1680,0.0,2008,2008.0,98116,47.5891,-122.387,1740,1280,7.0,2008,2015-04-09
3/5/2015,1380000.0,6,4.5,5740,10312,2.0,0.0,2.0,3,11,3610,2130.0,2000,2000.0,98006,47.5533,-122.11,4350,11917,15.0,2000,2015-03-05
12/12/2014,161500.0,3,1.0,1220,6000,1.0,0.0,0.0,5,7,1220,0.0,1961,1961.0,98002,47.2811,-122.214,1420,13137,54.0,1961,2014-12-12
10/10/2014,311000.0,3,1.0,1310,8370,1.5,0.0,0.0,3,7,1310,0.0,1962,1962.0,98034,47.7284,-122.241,1310,8370,53.0,1962,2014-10-10
2/24/2015,470000.0,6,1.75,2490,8732,1.5,0.0,0.0,4,8,2490,0.0,1966,1966.0,98034,47.7252,-122.18700000000001,1840,8024,49.0,1966,2015-02-24
7/9/2014,569000.0,3,3.25,2220,8227,1.5,0.0,0.0,5,8,1770,450.0,1929,1929.0,98108,47.5665,-122.316,1750,4800,86.0,1929,2014-07-09
3/18/2015,689000.0,4,2.5,2240,7350,2.0,0.0,0.0,3,9,2240,0.0,1989,1989.0,98029,47.5652,-122.01299999999999,2200,8017,26.0,1989,2015-03-18
7/15/2014,271900.0,3,1.75,1890,11875,1.0,0.0,0.0,3,7,1230,660.0,1979,1979.0,98045,47.4472,-121.774,1580,10920,36.0,1979,2014-07-15
12/10/2014,278000.0,4,2.5,1850,6037,2.0,0.0,0.0,3,7,1850,0.0,1991,1991.0,98030,47.358999999999995,-122.191,1860,6037,24.0,1991,2014-12-10
7/23/2014,820000.0,2,2.5,2210,4440,2.0,0.0,0.0,4,8,1440,770.0,1931,1931.0,98112,47.6305,-122.3,1560,4920,84.0,1931,2014-07-23
2/25/2015,399500.0,3,1.75,1410,7700,1.0,0.0,0.0,4,7,1410,0.0,1967,1967.0,98056,47.5375,-122.176,1560,7700,48.0,1967,2015-02-25
11/5/2014,462000.0,3,2.75,1890,2614,2.0,0.0,0.0,4,9,1890,0.0,1979,1979.0,98008,47.6102,-122.11399999999999,1800,2769,36.0,1979,2014-11-05
4/13/2015,347500.0,3,1.0,1830,12036,1.0,0.0,0.0,3,7,1550,280.0,1977,1977.0,98042,47.3126,-122.04299999999999,1810,12036,38.0,1977,2015-04-13
6/25/2014,562100.0,2,0.75,1440,3700,1.0,0.0,0.0,3,7,1200,240.0,1914,1914.0,98107,47.6707,-122.36399999999999,1440,4300,101.0,1914,2014-06-25
5/29/2014,230000.0,2,1.0,950,7560,1.0,0.0,0.0,3,6,950,0.0,1958,1958.0,98058,47.4499,-122.176,1160,7560,57.0,1958,2014-05-29
6/22/2014,687000.0,4,2.5,2370,10083,2.0,0.0,0.0,5,8,2370,0.0,1966,1966.0,98033,47.6715,-122.166,2370,10133,49.0,1966,2014-06-22
12/9/2014,725786.0,4,2.5,3070,5762,2.0,0.0,0.0,3,10,3070,0.0,2000,2000.0,98075,47.5847,-122.08,3630,6500,15.0,2000,2014-12-09
1/26/2015,315500.0,3,1.0,1300,12600,1.0,0.0,0.0,4,7,1300,0.0,1969,1969.0,98072,47.7422,-122.1,1480,13530,46.0,1969,2015-01-26
5/6/2014,312000.0,4,2.0,1300,7054,1.0,0.0,0.0,3,7,1300,0.0,1950,2013.0,98146,47.5071,-122.369,1560,7100,2.0,2013,2014-05-06
11/6/2014,343000.0,3,3.25,1210,1173,2.0,0.0,0.0,3,8,1000,210.0,2002,2002.0,98133,47.7114,-122.35600000000001,1650,1493,13.0,2002,2014-11-06
10/29/2014,385195.0,1,1.0,710,6000,1.5,0.0,0.0,3,6,710,0.0,2015,2015.0,98144,47.5756,-122.316,1440,4800,0.0,2015,2014-10-29
8/29/2014,415000.0,4,2.25,2240,12650,1.0,0.0,0.0,4,8,1730,510.0,1981,1981.0,98059,47.4777,-122.14200000000001,2150,12650,34.0,1981,2014-08-29
6/30/2014,461000.0,3,1.75,3600,8666,2.0,0.0,0.0,4,6,2400,1200.0,1948,1948.0,98033,47.6893,-122.167,2290,8200,67.0,1948,2014-06-30
6/10/2014,369990.0,4,2.5,1960,7133,2.0,0.0,0.0,3,7,1960,0.0,2002,2002.0,98056,47.4941,-122.19,1960,6705,13.0,2002,2014-06-10
9/29/2014,349950.0,4,2.5,1820,3134,2.0,0.0,0.0,3,7,1820,0.0,1999,1999.0,98019,47.7351,-121.985,1820,3751,16.0,1999,2014-09-29
4/12/2015,285750.0,3,2.25,1960,17126,1.0,0.0,0.0,3,8,1400,560.0,1966,1966.0,98055,47.4436,-122.21,2060,11466,49.0,1966,2015-04-12
4/20/2015,542500.0,4,2.25,1750,10160,1.0,0.0,0.0,3,8,1320,430.0,1972,1972.0,98005,47.5909,-122.15799999999999,2170,11165,43.0,1972,2015-04-20
11/11/2014,830000.0,5,3.5,3700,5400,2.0,0.0,0.0,3,9,2890,810.0,2011,2011.0,98053,47.7085,-122.117,3620,5460,4.0,2011,2014-11-11
12/23/2014,705000.0,4,2.5,2910,20946,2.0,0.0,0.0,4,8,2350,560.0,1976,1976.0,98034,47.7085,-122.24,2020,11342,39.0,1976,2014-12-23
6/24/2014,615000.0,2,1.0,1270,5000,1.0,0.0,0.0,3,8,1090,180.0,1949,1949.0,98117,47.6828,-122.39299999999999,1640,5000,66.0,1949,2014-06-24
1/29/2015,184500.0,2,1.0,720,5880,1.0,0.0,0.0,3,6,720,0.0,1940,1940.0,98178,47.5056,-122.27,1440,7200,75.0,1940,2015-01-29
10/1/2014,412000.0,2,1.0,1040,5120,1.0,0.0,0.0,3,7,1040,0.0,1901,1901.0,98122,47.6048,-122.31200000000001,1250,4000,114.0,1901,2014-10-01
12/15/2014,250000.0,3,1.5,2210,11111,1.5,0.0,0.0,3,7,2210,0.0,1934,1934.0,98168,47.492,-122.309,1250,8422,81.0,1934,2014-12-15
6/12/2014,580000.0,5,2.0,2060,6000,2.0,0.0,0.0,3,7,2060,0.0,1903,1903.0,98105,47.6685,-122.305,1770,5000,112.0,1903,2014-06-12
3/12/2015,220000.0,2,1.0,780,6000,1.0,0.0,0.0,5,6,780,0.0,1923,1923.0,98055,47.4759,-122.208,1080,6000,92.0,1923,2015-03-12
9/16/2014,675000.0,4,2.75,2240,8937,1.0,0.0,0.0,4,8,1460,780.0,1976,1976.0,98033,47.6495,-122.194,2360,9038,39.0,1976,2014-09-16
5/22/2014,373500.0,2,1.0,800,3330,1.0,0.0,0.0,3,7,800,0.0,1918,1918.0,98107,47.6566,-122.35799999999999,1300,4320,97.0,1918,2014-05-22
4/2/2015,662700.0,2,1.5,2440,6900,2.0,0.0,0.0,3,7,1590,850.0,1910,1910.0,98118,47.5568,-122.271,1770,6900,105.0,1910,2015-04-02
5/16/2014,239950.0,5,1.0,1460,6032,2.0,0.0,0.0,4,6,1460,0.0,1941,1941.0,98168,47.486999999999995,-122.28200000000001,1060,10300,74.0,1941,2014-05-16
9/25/2014,383000.0,3,1.0,1150,10196,1.0,0.0,0.0,4,7,1150,0.0,1957,1957.0,98052,47.6788,-122.162,1410,8925,58.0,1957,2014-09-25
1/29/2015,485000.0,3,2.75,2650,12350,1.0,0.0,0.0,4,7,1470,1180.0,1975,1975.0,98028,47.7669,-122.26799999999999,1950,14075,40.0,1975,2015-01-29
7/10/2014,610000.0,4,2.75,2600,36583,1.0,0.0,0.0,5,8,1580,1020.0,1976,1976.0,98075,47.593,-122.054,2300,27820,39.0,1976,2014-07-10
8/8/2014,545000.0,6,1.75,1820,6250,1.0,0.0,0.0,3,7,1130,690.0,1954,1954.0,98116,47.57899999999999,-122.39,1820,5750,61.0,1954,2014-08-08
7/8/2014,780000.0,2,2.5,2560,2500,2.0,0.0,0.0,5,8,1690,870.0,1901,1901.0,98112,47.6233,-122.3,1890,5000,114.0,1901,2014-07-08
4/24/2015,305000.0,3,2.5,1714,3240,2.0,0.0,0.0,3,8,1714,0.0,2005,2005.0,98055,47.4288,-122.19,1714,3240,10.0,2005,2015-04-24
6/12/2014,405000.0,3,1.0,1330,15678,1.0,0.0,0.0,3,7,900,430.0,1984,1984.0,98074,47.6355,-122.037,1330,12696,31.0,1984,2014-06-12
7/30/2014,1110000.0,5,3.5,7350,12231,2.0,0.0,4.0,3,11,4750,2600.0,2001,2001.0,98065,47.5373,-121.865,5380,12587,14.0,2001,2014-07-30
4/2/2015,273000.0,3,1.75,2050,9045,2.0,0.0,0.0,4,6,2050,0.0,1959,1959.0,98058,47.4572,-122.18,1200,9045,56.0,1959,2015-04-02
5/27/2014,326500.0,3,1.0,1810,12375,2.0,0.0,0.0,3,7,1810,0.0,1970,1970.0,98072,47.7427,-122.17200000000001,1420,9357,45.0,1970,2014-05-27
4/24/2015,365000.0,3,1.75,1380,9134,1.0,0.0,0.0,5,7,880,500.0,1981,1981.0,98056,47.5087,-122.193,1400,8190,34.0,1981,2015-04-24
4/8/2015,1000000.0,3,2.75,3070,10739,2.0,0.0,0.0,3,10,2440,630.0,1987,1987.0,98004,47.6444,-122.191,3490,11913,28.0,1987,2015-04-08
3/25/2015,422500.0,2,1.0,800,4046,1.0,0.0,0.0,3,7,800,0.0,1940,1940.0,98117,47.6895,-122.382,1400,4046,75.0,1940,2015-03-25
3/24/2015,354450.0,4,2.75,2140,9920,2.0,0.0,0.0,3,8,2140,0.0,1993,1993.0,98001,47.3529,-122.274,2130,9920,22.0,1993,2015-03-24
12/4/2014,320000.0,3,1.0,1330,9540,1.0,0.0,0.0,4,7,1330,0.0,1971,1971.0,98077,47.758,-122.075,1250,10350,44.0,1971,2014-12-04
6/3/2014,223000.0,3,1.0,1030,9120,1.0,0.0,0.0,3,7,1030,0.0,1961,1961.0,98032,47.3607,-122.291,1470,10220,54.0,1961,2014-06-03
7/24/2014,410000.0,3,2.5,1740,4948,2.0,0.0,0.0,3,7,1740,0.0,2008,2008.0,98053,47.6966,-122.025,1290,3383,7.0,2008,2014-07-24
8/29/2014,438000.0,3,1.0,1200,4000,1.5,0.0,0.0,4,6,1200,0.0,1923,1923.0,98144,47.5881,-122.29899999999999,1390,4000,92.0,1923,2014-08-29
11/6/2014,390000.0,3,3.0,1490,2944,2.0,0.0,0.0,3,7,960,530.0,1993,1993.0,98199,47.6506,-122.384,1590,1600,22.0,1993,2014-11-06
2/19/2015,298500.0,4,2.5,1890,5954,2.0,0.0,0.0,3,7,1890,0.0,2004,2004.0,98092,47.3293,-122.194,2030,5880,11.0,2004,2015-02-19
9/5/2014,749999.0,5,2.25,3060,13630,2.0,0.0,0.0,3,10,3060,0.0,1989,1989.0,98006,47.5585,-122.117,3430,10700,26.0,1989,2014-09-05
8/29/2014,779000.0,6,2.5,3250,12000,1.0,0.0,1.0,3,8,1800,1450.0,1966,1966.0,98115,47.6935,-122.28,3490,10320,49.0,1966,2014-08-29
1/14/2015,570000.0,3,2.75,2730,11936,2.0,0.0,2.0,3,8,1530,1200.0,1978,1978.0,98034,47.6987,-122.23100000000001,2810,12333,37.0,1978,2015-01-14
5/12/2015,385000.0,3,1.0,810,4600,1.0,0.0,0.0,3,6,810,0.0,1918,1918.0,98144,47.5712,-122.316,1520,4800,97.0,1918,2015-05-12
8/18/2014,649000.0,4,2.0,2240,11040,1.0,0.0,0.0,5,8,1120,1120.0,1961,1961.0,98033,47.69300000000001,-122.16799999999999,1790,11040,54.0,1961,2014-08-18
10/1/2014,283000.0,3,1.0,1740,5247,1.0,0.0,0.0,3,7,1270,470.0,1947,1947.0,98168,47.5049,-122.329,1070,5636,68.0,1947,2014-10-01
9/22/2014,699900.0,4,2.25,2380,16236,1.0,0.0,0.0,3,7,1540,840.0,1961,1961.0,98008,47.6126,-122.12,2230,8925,54.0,1961,2014-09-22
2/20/2015,278500.0,4,1.0,1540,8400,1.0,0.0,0.0,3,7,770,770.0,1971,1971.0,98058,47.4278,-122.152,1520,9891,44.0,1971,2015-02-20
11/15/2014,700000.0,4,1.75,2340,9100,1.0,0.0,0.0,3,8,1610,730.0,1975,1975.0,98052,47.6401,-122.10799999999999,2470,11000,40.0,1975,2014-11-15
7/28/2014,535000.0,4,2.75,2710,45963,2.0,0.0,0.0,3,9,2710,0.0,1995,1995.0,98045,47.4745,-121.72399999999999,2710,33955,20.0,1995,2014-07-28
9/23/2014,234500.0,3,1.75,1310,18400,1.0,0.0,0.0,3,7,870,440.0,1954,1954.0,98168,47.5035,-122.302,1840,10790,61.0,1954,2014-09-23
8/6/2014,374150.0,3,1.75,1390,9585,1.0,0.0,0.0,4,7,1390,0.0,1973,1973.0,98133,47.751999999999995,-122.35,1240,8188,42.0,1973,2014-08-06
3/17/2015,397000.0,4,2.5,2201,9542,2.0,0.0,0.0,3,8,2201,0.0,2006,2006.0,98198,47.4002,-122.31700000000001,1990,9542,9.0,2006,2015-03-17
9/18/2014,613000.0,3,2.25,1960,10385,1.0,0.0,0.0,3,8,1960,0.0,1988,1988.0,98008,47.5736,-122.109,2800,12632,27.0,1988,2014-09-18
6/9/2014,1150000.0,3,2.5,2850,10474,1.0,0.0,0.0,4,8,1730,1120.0,1954,1954.0,98004,47.6218,-122.209,2820,10474,61.0,1954,2014-06-09
3/27/2015,595000.0,4,1.75,1880,4080,1.0,0.0,0.0,3,7,940,940.0,1924,1924.0,98115,47.6754,-122.32700000000001,1410,4080,91.0,1924,2015-03-27
9/10/2014,340000.0,5,2.75,2440,6858,2.0,0.0,0.0,3,8,2440,0.0,2003,2003.0,98030,47.3655,-122.17399999999999,2300,6858,12.0,2003,2014-09-10
1/8/2015,388000.0,4,2.5,2560,5800,2.0,0.0,0.0,3,9,2560,0.0,2005,2005.0,98038,47.3474,-122.025,3040,5800,10.0,2005,2015-01-08
9/22/2014,404000.0,3,1.75,1410,15210,1.0,0.0,0.0,3,7,1410,0.0,1950,2014.0,98166,47.4181,-122.339,1970,16290,1.0,2014,2014-09-22
8/29/2014,810000.0,3,2.0,2870,6360,1.5,0.0,1.0,4,8,1790,1080.0,1946,1946.0,98115,47.6813,-122.275,2310,6466,69.0,1946,2014-08-29
4/3/2015,405000.0,4,2.5,2620,9359,2.0,0.0,0.0,3,9,2620,0.0,1987,1987.0,98058,47.438,-122.152,2580,7433,28.0,1987,2015-04-03
7/14/2014,726000.0,5,3.0,2970,10335,2.0,0.0,0.0,3,9,2970,0.0,2000,2000.0,98075,47.598,-122.01899999999999,2970,10335,15.0,2000,2014-07-14
5/14/2014,266000.0,3,2.5,1780,7214,1.0,0.0,0.0,4,7,1400,380.0,1986,1986.0,98030,47.3667,-122.182,1520,7228,29.0,1986,2014-05-14
12/22/2014,722500.0,5,2.25,3700,7207,1.0,0.0,1.0,5,8,1850,1850.0,1970,1970.0,98177,47.7736,-122.37100000000001,2340,7900,45.0,1970,2014-12-22
2/28/2015,352000.0,4,2.5,1252,25002,1.0,0.0,0.0,3,8,992,260.0,1996,1996.0,98001,47.3216,-122.291,1860,25002,19.0,1996,2015-02-28
3/19/2015,265000.0,4,1.5,1240,8158,1.0,0.0,0.0,4,7,1110,130.0,1961,1961.0,98198,47.3716,-122.31,1520,8147,54.0,1961,2015-03-19
2/6/2015,856000.0,3,2.5,2160,3920,2.0,0.0,0.0,3,9,2160,0.0,2014,2014.0,98116,47.5762,-122.415,1500,4920,1.0,2014,2015-02-06
7/24/2014,346950.0,3,2.5,2040,4348,2.0,0.0,0.0,4,8,2040,0.0,2006,2006.0,98038,47.3517,-121.999,2380,4348,9.0,2006,2014-07-24
6/17/2014,866059.0,5,3.5,3130,4797,2.0,0.0,0.0,3,9,2570,560.0,2014,2014.0,98006,47.5664,-122.12899999999999,3440,5439,1.0,2014,2014-06-17
1/29/2015,410000.0,3,2.5,2350,4456,2.0,0.0,0.0,3,7,2350,0.0,2004,2004.0,98065,47.5314,-121.854,2350,4456,11.0,2004,2015-01-29
7/8/2014,370000.0,3,1.75,1570,16817,2.0,0.0,0.0,3,7,1570,0.0,1982,1982.0,98045,47.4716,-121.756,1600,16817,33.0,1982,2014-07-08
6/23/2014,230000.0,3,1.0,1530,389126,1.5,0.0,0.0,4,7,1530,0.0,1919,1919.0,98022,47.1776,-122.01100000000001,1768,42148,96.0,1919,2014-06-23
10/10/2014,400000.0,2,2.0,1520,5010,1.0,0.0,0.0,3,7,1520,0.0,1999,1999.0,98117,47.6948,-122.36399999999999,1110,5040,16.0,1999,2014-10-10
3/11/2015,172000.0,3,1.0,1350,9680,1.0,0.0,0.0,4,7,820,530.0,1959,1959.0,98023,47.3274,-122.346,1320,9225,56.0,1959,2015-03-11
7/14/2014,615000.0,3,1.75,1950,8480,1.0,0.0,0.0,4,8,1250,700.0,1962,1962.0,98007,47.5893,-122.15,1740,8480,53.0,1962,2014-07-14
4/7/2015,860000.0,4,3.5,3950,9600,2.0,0.0,0.0,3,10,3950,0.0,1998,1998.0,98075,47.5945,-121.98100000000001,3110,10213,17.0,1998,2015-04-07
6/18/2014,555000.0,3,1.75,2040,6000,1.0,0.0,0.0,5,7,1120,920.0,1958,1958.0,98116,47.5688,-122.397,1530,6250,57.0,1958,2014-06-18
7/21/2014,579000.0,3,2.5,1990,4040,1.5,0.0,0.0,5,8,1390,600.0,1926,1926.0,98103,47.6867,-122.354,1180,3030,89.0,1926,2014-07-21
6/30/2014,385000.0,3,1.75,1300,7030,1.0,0.0,0.0,3,7,1300,0.0,1968,1968.0,98034,47.721000000000004,-122.179,1450,7650,47.0,1968,2014-06-30
4/14/2015,420000.0,4,2.25,2030,12000,2.0,0.0,0.0,3,7,2030,0.0,1977,1977.0,98011,47.7699,-122.16799999999999,2190,9900,38.0,1977,2015-04-14
7/16/2014,645000.0,3,1.75,2340,6750,1.5,0.0,0.0,5,7,1620,720.0,1914,1914.0,98103,47.6956,-122.335,1410,3388,101.0,1914,2014-07-16
4/28/2015,549950.0,3,2.5,2160,6288,2.0,0.0,0.0,3,8,2160,0.0,1996,1996.0,98133,47.7655,-122.35,1830,7600,19.0,1996,2015-04-28
9/23/2014,678000.0,3,2.75,2770,10000,1.0,0.0,1.0,5,8,1640,1130.0,1962,1962.0,98033,47.7011,-122.206,2450,10000,53.0,1962,2014-09-23
5/21/2014,199000.0,4,2.0,2030,8120,2.0,0.0,0.0,3,7,2030,0.0,1950,1950.0,98178,47.4994,-122.26100000000001,1520,9440,65.0,1950,2014-05-21
2/18/2015,604000.0,3,1.0,1440,13824,1.0,0.0,0.0,4,7,1440,0.0,1957,1957.0,98040,47.5872,-122.241,2540,12092,58.0,1957,2015-02-18
4/3/2015,268000.0,5,1.75,1730,10368,1.0,0.0,0.0,5,7,1010,720.0,1963,1963.0,98059,47.5008,-122.162,1730,7728,52.0,1963,2015-04-03
8/5/2014,960000.0,5,3.5,4510,16305,2.0,0.0,0.0,3,10,2820,1690.0,2003,2003.0,98074,47.6346,-122.01100000000001,4330,18741,12.0,2003,2014-08-05
2/18/2015,509250.0,3,2.5,2100,7600,1.0,0.0,0.0,4,7,1450,650.0,1980,1980.0,98052,47.6968,-122.12700000000001,2010,7600,35.0,1980,2015-02-18
11/18/2014,416000.0,3,2.5,1800,5372,2.0,0.0,0.0,3,8,1800,0.0,1987,1987.0,98034,47.7188,-122.177,1650,6014,28.0,1987,2014-11-18
5/15/2014,190000.0,3,1.0,1090,8520,1.0,0.0,0.0,3,7,1090,0.0,1967,1967.0,98003,47.3364,-122.307,1190,8520,48.0,1967,2014-05-15
4/29/2015,212000.0,3,1.5,1010,10000,1.0,0.0,0.0,4,7,1010,0.0,1973,1973.0,98003,47.2881,-122.294,2420,34637,42.0,1973,2015-04-29
10/29/2014,325900.0,3,2.5,2040,9765,2.0,0.0,0.0,3,8,2040,0.0,1985,1985.0,98023,47.309,-122.34899999999999,2350,10150,30.0,1985,2014-10-29
8/1/2014,560000.0,3,3.5,2270,4088,2.0,0.0,0.0,3,8,1880,390.0,1996,1996.0,98136,47.5356,-122.384,1760,5425,19.0,1996,2014-08-01
9/24/2014,275000.0,3,2.5,1730,5799,2.0,0.0,0.0,4,7,1730,0.0,1987,1987.0,98030,47.3499,-122.177,1710,6490,28.0,1987,2014-09-24
3/9/2015,665000.0,4,2.5,2480,15411,2.0,0.0,2.0,3,8,2480,0.0,1994,1994.0,98059,47.5379,-122.16,2940,14679,21.0,1994,2015-03-09
6/1/2014,1510000.0,4,3.5,3480,7232,2.0,0.0,0.0,3,9,2580,0.0,1926,2010.0,98144,47.5859,-122.291,2380,5642,5.0,2010,2014-06-01
12/3/2014,375000.0,4,2.0,1720,2410,1.0,0.0,0.0,3,7,970,750.0,1930,2006.0,98106,47.5252,-122.361,1160,1404,9.0,2006,2014-12-03
9/9/2014,359950.0,3,1.75,1570,6975,1.0,0.0,0.0,3,7,1040,530.0,1979,1979.0,98126,47.5137,-122.37,1280,7813,36.0,1979,2014-09-09
1/23/2015,340000.0,4,2.75,3527,7200,2.0,0.0,0.0,3,7,3527,0.0,2005,2005.0,98198,47.3823,-122.3,2490,7200,10.0,2005,2015-01-23
10/31/2014,401000.0,2,1.0,840,8100,1.0,0.0,0.0,4,7,840,0.0,1948,1948.0,98177,47.7019,-122.366,1100,8220,67.0,1948,2014-10-31
6/26/2014,669000.0,2,1.75,1950,10766,1.0,0.0,3.0,4,6,1160,790.0,1952,1952.0,98166,47.4504,-122.37700000000001,1780,11721,63.0,1952,2014-06-26
4/29/2015,638500.0,4,2.5,1980,6568,2.0,0.0,0.0,3,8,1980,0.0,2004,2004.0,98052,47.70399999999999,-122.101,2310,6496,11.0,2004,2015-04-29
3/23/2015,545000.0,2,1.5,1620,3760,2.0,0.0,0.0,5,7,1170,450.0,1924,1924.0,98144,47.6012,-122.291,2130,4000,91.0,1924,2015-03-23
12/26/2014,524000.0,4,1.0,1980,7015,1.0,0.0,0.0,3,7,1260,720.0,1973,1973.0,98034,47.7204,-122.18,1570,7626,42.0,1973,2014-12-26
11/8/2014,1610000.0,5,3.75,3530,13260,2.0,0.0,0.0,3,10,3530,0.0,2013,2013.0,98040,47.5761,-122.205,3340,13260,2.0,2013,2014-11-08
9/9/2014,280000.0,2,1.0,1260,4800,1.0,0.0,0.0,3,6,1100,160.0,1947,1947.0,98126,47.5196,-122.376,1260,2435,68.0,1947,2014-09-09
8/25/2014,828000.0,4,2.5,2120,10841,1.0,0.0,0.0,4,8,1500,620.0,1979,1979.0,98006,47.556000000000004,-122.156,3130,10950,36.0,1979,2014-08-25
10/17/2014,223000.0,3,1.75,1360,10573,1.0,0.0,0.0,4,7,1360,0.0,1984,1984.0,98023,47.2983,-122.374,1580,8280,31.0,1984,2014-10-17
1/2/2015,1290000.0,4,3.5,3100,2261,2.0,0.0,2.0,3,9,2250,850.0,1981,1981.0,98033,47.6512,-122.20200000000001,2660,2000,34.0,1981,2015-01-02
5/4/2015,750000.0,2,2.0,2370,155130,1.0,0.0,0.0,3,7,2370,0.0,1970,1970.0,98019,47.7388,-121.97200000000001,1860,14475,45.0,1970,2015-05-04
4/17/2015,430000.0,2,1.0,1460,9207,1.0,0.0,0.0,3,7,1210,250.0,1947,1947.0,98125,47.7195,-122.287,1500,6898,68.0,1947,2015-04-17
6/18/2014,711000.0,4,1.75,1980,10800,1.0,0.0,0.0,5,6,990,990.0,1948,1948.0,98040,47.5768,-122.22200000000001,2180,10800,67.0,1948,2014-06-18
12/4/2014,310000.0,4,2.5,1930,7014,2.0,0.0,0.0,3,8,1930,0.0,1994,1994.0,98042,47.3921,-122.163,1990,7920,21.0,1994,2014-12-04
12/26/2014,415000.0,5,1.75,3700,9140,1.0,0.0,0.0,3,8,1850,1850.0,1957,1957.0,98178,47.5086,-122.258,2190,6720,58.0,1957,2014-12-26
7/1/2014,274900.0,4,2.5,1970,6600,2.0,0.0,0.0,3,7,1970,0.0,1987,1987.0,98030,47.3491,-122.16799999999999,1970,7682,28.0,1987,2014-07-01
6/9/2014,525000.0,3,3.0,2470,36445,2.0,0.0,0.0,4,8,2470,0.0,1980,1980.0,98027,47.4661,-121.99700000000001,2310,35350,35.0,1980,2014-06-09
12/19/2014,179500.0,3,1.0,1180,32214,1.0,0.0,0.0,3,7,1180,0.0,1952,1952.0,98092,47.3313,-122.198,2300,13714,63.0,1952,2014-12-19
5/23/2014,478000.0,3,1.0,1280,2580,1.5,0.0,0.0,3,8,1280,0.0,1910,2014.0,98115,47.6727,-122.32,1410,3150,1.0,2014,2014-05-23
5/21/2014,195000.0,3,1.75,1380,7350,1.0,0.0,0.0,3,7,990,390.0,1981,1981.0,98042,47.369,-122.09299999999999,1660,8400,34.0,1981,2014-05-21
3/5/2015,385000.0,4,3.0,2740,10925,1.0,0.0,0.0,3,8,1670,1070.0,1980,1980.0,98058,47.4538,-122.125,2330,9940,35.0,1980,2015-03-05
12/1/2014,401000.0,3,2.75,2020,9505,1.0,0.0,0.0,3,7,1260,760.0,1969,1969.0,98011,47.7399,-122.197,2080,11901,46.0,1969,2014-12-01
9/26/2014,522000.0,4,2.5,2835,6598,2.0,0.0,0.0,3,8,2835,0.0,2002,2002.0,98038,47.3878,-122.03399999999999,2770,6969,13.0,2002,2014-09-26
2/24/2015,330000.0,4,1.75,1520,14417,1.0,0.0,0.0,4,7,1520,0.0,1968,1968.0,98065,47.526,-121.809,1600,10716,47.0,1968,2015-02-24
6/3/2014,503000.0,3,2.5,2190,4882,2.0,0.0,0.0,3,9,2190,0.0,1999,1999.0,98155,47.7641,-122.306,2190,7055,16.0,1999,2014-06-03
2/12/2015,175000.0,5,1.75,1680,8400,1.0,0.0,0.0,4,7,1680,0.0,1979,1979.0,98003,47.3035,-122.307,1800,8550,36.0,1979,2015-02-12
3/20/2015,963990.0,4,3.5,3915,6364,2.0,0.0,0.0,3,9,3915,0.0,2014,2014.0,98053,47.6844,-122.016,3830,6507,1.0,2014,2015-03-20
9/29/2014,845000.0,5,2.0,1720,9972,1.0,0.0,0.0,4,8,1720,0.0,1951,1951.0,98004,47.6368,-122.21799999999999,2700,9023,64.0,1951,2014-09-29
1/22/2015,157500.0,2,1.0,670,4500,1.0,0.0,0.0,3,5,670,0.0,1905,1905.0,98108,47.5271,-122.32600000000001,1210,4500,110.0,1905,2015-01-22
12/5/2014,450000.0,2,3.0,1790,1709,2.0,0.0,0.0,3,7,1400,390.0,2001,2001.0,98144,47.5926,-122.296,1460,1462,14.0,2001,2014-12-05
9/18/2014,925000.0,4,1.75,2440,11793,1.0,0.0,4.0,3,8,1420,1020.0,1950,1950.0,98115,47.6807,-122.26700000000001,2500,8028,65.0,1950,2014-09-18
1/5/2015,600000.0,2,1.0,920,5029,1.0,0.0,0.0,4,7,920,0.0,1938,1938.0,98115,47.6726,-122.265,1230,5029,77.0,1938,2015-01-05
9/18/2014,709000.0,4,1.0,1680,4087,1.5,0.0,0.0,3,7,1680,0.0,1911,1911.0,98103,47.6667,-122.337,1740,3745,104.0,1911,2014-09-18
11/10/2014,1390000.0,5,3.75,3290,6480,2.0,0.0,0.0,5,10,2190,1100.0,1938,1938.0,98199,47.653,-122.415,2010,7639,77.0,1938,2014-11-10
9/11/2014,248000.0,3,2.5,2120,6840,1.0,0.0,0.0,3,7,1220,900.0,1984,1984.0,98092,47.278,-122.145,1820,8200,31.0,1984,2014-09-11
5/11/2015,245000.0,3,1.0,910,6630,1.0,0.0,0.0,4,6,910,0.0,1912,1912.0,98103,47.6947,-122.346,950,5100,103.0,1912,2015-05-11
5/30/2014,332000.0,2,1.0,1000,4776,1.0,0.0,0.0,4,6,1000,0.0,1942,1942.0,98108,47.5619,-122.315,1500,4800,73.0,1942,2014-05-30
3/13/2015,459950.0,3,2.5,2340,4273,2.0,0.0,0.0,3,7,2340,0.0,2002,2002.0,98065,47.5362,-121.87799999999999,2400,4624,13.0,2002,2015-03-13
4/10/2015,425000.0,3,2.0,1180,1800,2.0,0.0,2.0,3,8,1180,0.0,1994,1994.0,98122,47.6168,-122.301,1500,1948,21.0,1994,2015-04-10
9/3/2014,460000.0,3,2.25,2080,50965,1.0,0.0,0.0,3,8,1590,490.0,1979,1979.0,98077,47.7506,-122.06299999999999,2270,51836,36.0,1979,2014-09-03
9/4/2014,838300.0,6,2.5,3760,12978,1.0,0.0,0.0,3,9,2360,1400.0,1967,1967.0,98117,47.6976,-122.381,2300,7362,48.0,1967,2014-09-04
11/11/2014,256000.0,3,2.5,1480,7200,2.0,0.0,0.0,5,7,1480,0.0,1995,1995.0,98010,47.3126,-122.023,1350,7200,20.0,1995,2014-11-11
1/20/2015,864000.0,3,2.75,3060,13554,2.0,0.0,0.0,3,10,3060,0.0,1984,1984.0,98006,47.5609,-122.10600000000001,3060,11455,31.0,1984,2015-01-20
3/5/2015,900000.0,4,3.5,3070,4440,2.0,0.0,0.0,3,9,2030,1040.0,1922,2007.0,98116,47.5732,-122.411,1780,4800,8.0,2007,2015-03-05
4/1/2015,145600.0,3,1.0,1170,7560,1.0,0.0,0.0,3,6,1170,0.0,1958,1958.0,98058,47.4514,-122.178,1170,7560,57.0,1958,2015-04-01
8/21/2014,865000.0,5,3.0,2900,6730,1.0,0.0,0.0,5,8,1830,1070.0,1977,1977.0,98115,47.6784,-122.285,2370,6283,38.0,1977,2014-08-21
6/9/2014,250250.0,3,2.25,2210,8000,2.0,0.0,0.0,4,8,2210,0.0,1969,1969.0,98023,47.3085,-122.381,1990,8000,46.0,1969,2014-06-09
9/19/2014,162000.0,4,2.0,1440,7641,1.0,0.0,0.0,4,5,1440,0.0,1943,1943.0,98056,47.508,-122.18299999999999,1440,7750,72.0,1943,2014-09-19
7/31/2014,450000.0,4,1.75,1980,7350,1.0,0.0,0.0,3,7,1430,550.0,1973,1973.0,98034,47.7088,-122.20200000000001,1870,7920,42.0,1973,2014-07-31
3/25/2015,675500.0,4,2.75,2060,21344,1.0,0.0,0.0,2,8,1460,600.0,1978,1978.0,98005,47.5934,-122.154,2060,16088,37.0,1978,2015-03-25
11/3/2014,697000.0,3,2.25,2420,5304,1.5,0.0,0.0,5,7,1640,780.0,1947,1947.0,98115,47.6765,-122.285,1560,5304,68.0,1947,2014-11-03
11/11/2014,1320000.0,3,3.25,3440,4080,2.0,0.0,0.0,3,9,2560,880.0,2005,2005.0,98105,47.6644,-122.28,3110,4080,10.0,2005,2014-11-11
12/1/2014,490000.0,3,1.75,1600,16510,1.0,0.0,0.0,3,8,1600,0.0,1984,1984.0,98052,47.6601,-122.135,1510,10407,31.0,1984,2014-12-01
10/21/2014,590000.0,3,2.25,2210,5742,1.0,0.0,0.0,3,8,1460,750.0,1951,1951.0,98115,47.6891,-122.318,1900,4590,64.0,1951,2014-10-21
5/12/2015,280000.0,4,1.75,2250,16000,1.0,0.0,0.0,3,8,1450,800.0,1957,1957.0,98023,47.3303,-122.351,1930,16000,58.0,1957,2015-05-12
5/23/2014,515000.0,2,1.0,1680,6500,1.0,0.0,0.0,4,7,1140,540.0,1941,1941.0,98136,47.55,-122.38799999999999,1610,6500,74.0,1941,2014-05-23
7/14/2014,576000.0,3,1.0,1140,5395,1.0,0.0,0.0,4,7,1010,130.0,1909,1909.0,98115,47.6782,-122.306,1700,5376,106.0,1909,2014-07-14
11/20/2014,375000.0,3,1.75,1430,10574,2.0,0.0,0.0,3,7,1430,0.0,1981,1981.0,98011,47.7668,-122.21799999999999,1900,10450,34.0,1981,2014-11-20
3/20/2015,478000.0,3,1.0,1440,7107,1.0,0.0,0.0,4,7,1000,440.0,1980,1980.0,98052,47.6968,-122.124,1540,7140,35.0,1980,2015-03-20
1/28/2015,282000.0,3,1.0,1670,5200,1.0,0.0,0.0,5,7,1030,640.0,1977,1977.0,98042,47.3659,-122.09200000000001,1620,6696,38.0,1977,2015-01-28
10/31/2014,1400000.0,4,4.5,3080,10550,2.0,0.0,3.0,3,8,1940,1140.0,1976,2007.0,98040,47.5806,-122.244,2780,10550,8.0,2007,2014-10-31
2/10/2015,593500.0,5,3.25,4300,50405,2.0,0.0,0.0,3,8,3220,1080.0,1972,1972.0,98027,47.4615,-122.0,2680,41684,43.0,1972,2015-02-10
10/20/2014,724950.0,4,3.5,3010,174240,2.0,0.0,0.0,3,9,3010,0.0,2004,2004.0,98045,47.4775,-121.691,2720,247856,11.0,2004,2014-10-20
8/29/2014,306000.0,3,1.75,1560,7500,1.0,0.0,0.0,4,8,1560,0.0,1966,1966.0,98056,47.489,-122.18,1600,7904,49.0,1966,2014-08-29
6/9/2014,341000.0,4,1.75,1920,7665,1.0,0.0,0.0,4,8,1500,420.0,1975,1975.0,98058,47.4476,-122.12799999999999,2100,7344,40.0,1975,2014-06-09
11/3/2014,399950.0,3,2.5,1400,4400,1.0,0.0,0.0,3,7,1400,0.0,1930,2014.0,98106,47.553000000000004,-122.365,1060,4400,1.0,2014,2014-11-03
11/20/2014,534000.0,5,2.0,2280,3600,2.0,0.0,0.0,3,7,2280,0.0,1992,1992.0,98122,47.6056,-122.305,1740,1800,23.0,1992,2014-11-20
7/21/2014,635000.0,6,2.5,3880,5700,2.0,0.0,0.0,3,7,3880,0.0,2003,2003.0,98053,47.6816,-122.038,2620,5070,12.0,2003,2014-07-21
3/24/2015,350000.0,2,1.0,1350,3880,1.0,0.0,0.0,3,6,950,400.0,1927,1927.0,98103,47.6842,-122.344,1670,3920,88.0,1927,2015-03-24
2/17/2015,856000.0,3,1.5,1480,2700,1.5,0.0,0.0,3,7,1480,0.0,1928,1928.0,98112,47.62300000000001,-122.304,1970,4200,87.0,1928,2015-02-17
9/23/2014,582000.0,4,3.0,1670,1189,3.0,0.0,0.0,3,8,1427,243.0,2000,2000.0,98122,47.6182,-122.302,1700,1401,15.0,2000,2014-09-23
7/29/2014,799000.0,4,2.5,3400,6742,2.0,0.0,0.0,3,9,3400,0.0,2004,2004.0,98052,47.7067,-122.12899999999999,2970,6909,11.0,2004,2014-07-29
9/8/2014,423700.0,3,2.5,2070,3986,2.0,0.0,0.0,3,8,2070,0.0,1999,1999.0,98065,47.5348,-121.87700000000001,2090,3986,16.0,1999,2014-09-08
1/27/2015,1840000.0,4,3.5,4870,39190,2.0,0.0,0.0,3,12,4870,0.0,1995,1995.0,98006,47.5447,-122.124,5000,33880,20.0,1995,2015-01-27
8/13/2014,322000.0,3,2.0,1760,43575,1.0,0.0,0.0,3,7,1160,600.0,1988,1988.0,98010,47.3565,-121.94,1760,46038,27.0,1988,2014-08-13
11/5/2014,929000.0,4,3.25,4030,57499,2.0,0.0,0.0,3,9,4030,0.0,2002,2002.0,98053,47.6617,-122.02600000000001,3470,57499,13.0,2002,2014-11-05
12/1/2014,443000.0,2,1.0,1130,5413,1.0,0.0,0.0,3,7,880,250.0,1939,1939.0,98115,47.6971,-122.315,1250,5413,76.0,1939,2014-12-01
4/24/2015,441500.0,3,1.75,1510,7700,1.0,0.0,0.0,3,7,1510,0.0,1968,1968.0,98034,47.7283,-122.194,1440,7416,47.0,1968,2015-04-24
7/8/2014,875000.0,4,3.5,3110,108464,2.0,0.0,2.0,4,8,3110,0.0,1979,1979.0,98075,47.592,-122.01799999999999,2340,4938,36.0,1979,2014-07-08
11/18/2014,3600000.0,3,3.25,5020,12431,2.0,1.0,4.0,3,10,3420,1600.0,1941,2002.0,98144,47.5925,-122.287,3680,12620,13.0,2002,2014-11-18
4/27/2015,450000.0,2,1.0,740,5100,1.0,0.0,0.0,4,7,740,0.0,1947,1947.0,98115,47.6787,-122.301,920,5100,68.0,1947,2015-04-27
9/8/2014,425000.0,3,2.25,1630,10500,1.0,0.0,0.0,3,7,1100,530.0,1974,1974.0,98034,47.7176,-122.236,1640,9794,41.0,1974,2014-09-08
6/1/2014,660000.0,4,1.75,2780,9900,2.0,0.0,0.0,4,10,2780,0.0,1978,1978.0,98074,47.6348,-122.06,2600,12000,37.0,1978,2014-06-01
6/16/2014,763101.0,3,1.75,1990,5560,1.0,0.0,0.0,4,7,1100,890.0,1939,1939.0,98105,47.663999999999994,-122.287,1460,3706,76.0,1939,2014-06-16
4/7/2015,499000.0,4,2.75,2250,14149,2.0,0.0,0.0,3,9,2250,0.0,1992,1992.0,98019,47.7353,-121.962,2450,14027,23.0,1992,2015-04-07
3/3/2015,521000.0,3,1.75,1720,37363,1.0,0.0,0.0,4,8,1350,370.0,1974,1974.0,98053,47.6608,-122.035,2740,40635,41.0,1974,2015-03-03
5/29/2014,302000.0,2,1.0,900,423838,1.0,0.0,2.0,5,6,900,0.0,1925,1925.0,98022,47.228,-122.088,1810,94960,90.0,1925,2014-05-29
4/8/2015,293000.0,4,2.25,2360,6260,2.0,0.0,0.0,3,7,2360,0.0,1998,1998.0,98038,47.3882,-122.053,2144,6773,17.0,1998,2015-04-08
7/12/2014,335000.0,3,2.25,1530,4580,2.0,0.0,0.0,3,7,1530,0.0,2011,2011.0,98019,47.7342,-121.96799999999999,2110,4094,4.0,2011,2014-07-12
12/15/2014,499000.0,2,1.0,1450,3090,2.0,0.0,0.0,3,7,1450,0.0,1919,1987.0,98103,47.6853,-122.35600000000001,1450,4635,28.0,1987,2014-12-15
5/5/2015,600000.0,3,1.75,2040,5000,1.5,0.0,0.0,3,7,1780,260.0,1924,1924.0,98115,47.6756,-122.29899999999999,1690,5000,91.0,1924,2015-05-05
9/16/2014,720000.0,4,1.75,2620,11041,1.5,0.0,0.0,4,9,2620,0.0,1962,1962.0,98005,47.5975,-122.17399999999999,2230,11041,53.0,1962,2014-09-16
2/25/2015,195000.0,2,2.0,1180,2553,2.0,0.0,0.0,3,6,1180,0.0,2005,2005.0,98038,47.3501,-122.02,1310,2687,10.0,2005,2015-02-25
5/7/2014,249000.0,3,1.0,1110,8423,1.0,0.0,0.0,3,7,1110,0.0,1952,1952.0,98166,47.4718,-122.34200000000001,1140,9083,63.0,1952,2014-05-07
2/2/2015,334000.0,3,2.25,1840,9781,2.0,0.0,0.0,3,7,1840,0.0,1989,1989.0,98019,47.7347,-121.976,1490,10101,26.0,1989,2015-02-02
11/7/2014,599950.0,4,1.75,2720,7810,1.0,0.0,0.0,3,8,1510,1210.0,1952,1952.0,98115,47.6788,-122.28299999999999,2120,7315,63.0,1952,2014-11-07
2/17/2015,149900.0,2,1.75,1090,1950,1.0,0.0,0.0,4,8,1090,0.0,1982,1982.0,98198,47.3782,-122.319,1360,3426,33.0,1982,2015-02-17
11/25/2014,700000.0,4,1.75,1730,6500,1.0,0.0,0.0,3,7,1250,480.0,1945,1945.0,98115,47.6982,-122.28200000000001,1910,8100,70.0,1945,2014-11-25
8/7/2014,525000.0,4,1.5,1170,6240,1.0,0.0,0.0,4,6,1170,0.0,1960,1960.0,98040,47.5495,-122.23200000000001,2380,8846,55.0,1960,2014-08-07
7/8/2014,1050000.0,4,3.75,4740,126759,2.0,0.0,0.0,4,10,4740,0.0,1991,1991.0,98027,47.4449,-121.979,3060,118047,24.0,1991,2014-07-08
5/8/2014,402000.0,3,2.5,1960,8000,1.0,0.0,0.0,4,7,1290,670.0,1977,1977.0,98034,47.7249,-122.178,1960,8000,38.0,1977,2014-05-08
6/20/2014,450000.0,3,2.0,1430,3480,1.0,0.0,0.0,3,7,980,450.0,1947,1947.0,98103,47.6874,-122.336,1450,4650,68.0,1947,2014-06-20
12/3/2014,520000.0,3,2.25,2510,43995,2.0,0.0,0.0,3,8,2510,0.0,1981,1981.0,98027,47.4545,-121.988,2470,48351,34.0,1981,2014-12-03
12/4/2014,205000.0,3,1.75,1420,6980,1.0,0.0,0.0,5,7,820,600.0,1980,1980.0,98023,47.2873,-122.367,1470,7319,35.0,1980,2014-12-04
9/2/2014,635000.0,3,2.25,2680,175982,1.0,0.0,0.0,3,9,2680,0.0,2004,2004.0,98038,47.4487,-122.03299999999999,3170,215186,11.0,2004,2014-09-02
3/4/2015,210500.0,3,1.0,1220,9600,1.0,0.0,0.0,5,7,1220,0.0,1958,1958.0,98001,47.2622,-122.28200000000001,1310,9600,57.0,1958,2015-03-04
8/12/2014,406650.0,2,1.0,1070,6100,1.0,0.0,0.0,3,6,1070,0.0,1940,1940.0,98126,47.5698,-122.37700000000001,1770,5695,75.0,1940,2014-08-12
4/8/2015,350000.0,3,1.75,1580,19998,1.0,0.0,0.0,4,7,1580,0.0,1968,1968.0,98010,47.3299,-122.046,1860,19998,47.0,1968,2015-04-08
4/23/2015,425000.0,4,1.75,1820,6000,1.0,0.0,0.0,3,7,930,890.0,1942,1942.0,98115,47.6872,-122.296,1590,6000,73.0,1942,2015-04-23
6/5/2014,798000.0,3,3.5,3590,6402,2.0,0.0,0.0,3,10,3590,0.0,1999,1999.0,98074,47.6336,-122.06299999999999,3230,7305,16.0,1999,2014-06-05
12/1/2014,180000.0,3,1.0,1960,9583,2.0,0.0,0.0,2,5,1960,0.0,1908,1908.0,98056,47.505,-122.171,1850,8324,107.0,1908,2014-12-01
6/2/2014,1250000.0,5,3.25,3160,13238,2.0,0.0,0.0,5,8,3160,0.0,1972,1972.0,98040,47.5373,-122.22399999999999,2360,12042,43.0,1972,2014-06-02
3/3/2015,435000.0,4,2.0,2030,4033,2.0,0.0,0.0,4,7,1630,400.0,1925,1925.0,98133,47.7056,-122.34200000000001,1350,1340,90.0,1925,2015-03-03
11/26/2014,355000.0,3,1.5,1240,15867,1.0,0.0,0.0,3,7,1240,0.0,1962,1962.0,98034,47.7167,-122.20200000000001,1570,9600,53.0,1962,2014-11-26
2/2/2015,3000000.0,5,3.25,5370,14091,2.0,0.0,0.0,3,10,3850,1520.0,1918,2008.0,98004,47.6499,-122.21600000000001,2410,12047,7.0,2008,2015-02-02
7/24/2014,685000.0,5,2.5,2670,14455,2.0,0.0,0.0,5,9,2670,0.0,1958,1958.0,98155,47.7565,-122.28399999999999,1810,14455,57.0,1958,2014-07-24
7/25/2014,311000.0,3,1.0,1640,12060,1.0,0.0,0.0,4,7,1640,0.0,1960,1960.0,98059,47.4941,-122.15100000000001,1680,9147,55.0,1960,2014-07-25
9/11/2014,305000.0,4,2.25,2130,9600,1.0,0.0,0.0,4,7,2130,0.0,1966,1966.0,98031,47.4119,-122.211,1710,9600,49.0,1966,2014-09-11
7/25/2014,675000.0,3,2.5,2550,4954,1.5,0.0,0.0,4,7,1850,700.0,1924,1924.0,98144,47.5758,-122.287,1700,4954,91.0,1924,2014-07-25
8/29/2014,769000.0,4,2.75,3630,15405,1.0,0.0,2.0,4,8,1850,1780.0,1968,1968.0,98040,47.566,-122.225,3380,11184,47.0,1968,2014-08-29
8/5/2014,430000.0,3,1.5,1690,9708,1.5,0.0,0.0,5,7,1690,0.0,1954,1954.0,98006,47.5732,-122.13600000000001,1570,9858,61.0,1954,2014-08-05
9/23/2014,516250.0,6,2.0,2390,8660,1.5,0.0,0.0,4,7,2390,0.0,1925,1925.0,98011,47.7589,-122.21600000000001,2250,12942,90.0,1925,2014-09-23
12/12/2014,760000.0,3,3.5,2350,10739,1.0,0.0,2.0,5,7,1340,1010.0,1940,1940.0,98125,47.7288,-122.28399999999999,2580,11026,75.0,1940,2014-12-12
10/7/2014,579950.0,3,3.5,1420,1217,2.0,0.0,0.0,3,8,1180,240.0,2003,2003.0,98115,47.6827,-122.324,1494,1264,12.0,2003,2014-10-07
2/11/2015,476000.0,3,2.25,1570,7187,1.0,0.0,0.0,4,8,1170,400.0,1980,1980.0,98133,47.7604,-122.35600000000001,1660,8775,35.0,1980,2015-02-11
6/12/2014,510000.0,3,1.75,1600,19200,1.0,0.0,0.0,4,7,1600,0.0,1967,1967.0,98034,47.7202,-122.249,2010,14850,48.0,1967,2014-06-12
5/8/2014,205000.0,2,1.0,720,5040,1.0,0.0,0.0,3,6,720,0.0,1955,1955.0,98106,47.5267,-122.36,1357,5120,60.0,1955,2014-05-08
10/7/2014,240000.0,3,1.0,1470,7350,1.0,0.0,0.0,3,7,1470,0.0,1969,1969.0,98032,47.3616,-122.286,1720,8050,46.0,1969,2014-10-07
9/2/2014,738000.0,5,3.5,2790,16952,2.0,0.0,2.0,3,10,1970,820.0,1991,1991.0,98166,47.4384,-122.34700000000001,2980,17281,24.0,1991,2014-09-02
7/28/2014,420000.0,3,1.75,1720,8102,1.0,0.0,0.0,5,6,860,860.0,1940,1940.0,98125,47.7336,-122.29,1440,8106,75.0,1940,2014-07-28
11/14/2014,455000.0,3,1.75,1300,9600,1.0,0.0,0.0,4,7,1300,0.0,1969,1969.0,98052,47.6388,-122.103,2070,9775,46.0,1969,2014-11-14
9/15/2014,765000.0,4,1.0,2520,5500,1.5,0.0,0.0,5,8,1820,700.0,1912,1912.0,98144,47.5785,-122.292,2350,5000,103.0,1912,2014-09-15
12/5/2014,372000.0,4,1.5,1780,7914,1.5,0.0,0.0,4,7,1780,0.0,1962,1962.0,98059,47.5142,-122.163,1350,8069,53.0,1962,2014-12-05
12/4/2014,160000.0,3,1.0,1200,8360,1.0,0.0,0.0,2,6,1200,0.0,1948,1948.0,98118,47.5414,-122.281,1570,6823,67.0,1948,2014-12-04
8/15/2014,772000.0,4,2.5,2990,9643,2.0,0.0,0.0,3,9,2990,0.0,2003,2003.0,98074,47.6292,-122.024,2990,8666,12.0,2003,2014-08-15
11/11/2014,1130000.0,5,1.75,1910,5640,2.0,0.0,0.0,4,9,1910,0.0,1906,1906.0,98112,47.6249,-122.311,2050,5400,109.0,1906,2014-11-11
5/24/2014,479000.0,3,1.0,1370,3000,1.5,0.0,0.0,3,7,1370,0.0,1924,1924.0,98103,47.6619,-122.351,1510,2151,91.0,1924,2014-05-24
5/5/2015,570000.0,3,2.5,1910,4941,2.0,0.0,0.0,3,8,1910,0.0,1999,1999.0,98075,47.5989,-122.016,1910,4941,16.0,1999,2015-05-05
7/10/2014,350000.0,4,1.0,1170,8147,1.5,0.0,0.0,3,6,1170,0.0,1959,1959.0,98125,47.7281,-122.289,1260,8147,56.0,1959,2014-07-10
11/1/2014,353000.0,3,2.5,1250,864,3.0,0.0,0.0,3,8,1250,0.0,2004,2004.0,98115,47.6978,-122.318,1330,2298,11.0,2004,2014-11-01
8/1/2014,699000.0,5,2.5,3340,24755,2.0,0.0,0.0,3,10,3340,0.0,2002,2002.0,98038,47.4565,-122.066,3420,23274,13.0,2002,2014-08-01
7/30/2014,265000.0,3,2.0,1380,8536,2.0,0.0,0.0,4,7,1380,0.0,1955,1955.0,98148,47.4374,-122.335,1260,8750,60.0,1955,2014-07-30
4/30/2015,167000.0,1,1.0,780,10235,1.5,0.0,0.0,3,6,780,0.0,1989,1989.0,98014,47.713,-121.315,930,10165,26.0,1989,2015-04-30
10/20/2014,500000.0,4,2.25,2080,8000,1.0,0.0,0.0,3,8,1390,690.0,1964,1964.0,98008,47.6264,-122.113,1800,7700,51.0,1964,2014-10-20
7/9/2014,700000.0,3,1.0,1410,7200,2.0,0.0,0.0,4,6,1410,0.0,1901,1901.0,98144,47.5924,-122.302,1640,7200,114.0,1901,2014-07-09
11/4/2014,295000.0,1,1.0,520,5600,1.0,0.0,0.0,3,6,520,0.0,1918,1918.0,98116,47.5579,-122.395,1030,5265,97.0,1918,2014-11-04
3/11/2015,1010000.0,4,3.5,3500,4080,2.0,0.0,2.0,3,9,2590,910.0,2004,2004.0,98115,47.6834,-122.292,2430,5100,11.0,2004,2015-03-11
5/8/2015,209000.0,2,1.0,840,5265,1.0,0.0,0.0,5,6,840,0.0,1969,1969.0,98042,47.3644,-122.08200000000001,920,5100,46.0,1969,2015-05-08
1/28/2015,276000.0,3,1.75,2240,9200,1.0,0.0,0.0,4,7,1440,800.0,1968,1968.0,98001,47.2635,-122.28399999999999,1740,9600,47.0,1968,2015-01-28
1/22/2015,380000.0,4,2.5,2100,5857,2.0,0.0,0.0,3,8,2100,0.0,2002,2002.0,98059,47.4956,-122.163,2090,7779,13.0,2002,2015-01-22
6/6/2014,315000.0,3,1.5,1750,12500,1.0,0.0,0.0,3,7,1150,600.0,1954,1954.0,98024,47.5666,-121.902,1680,13000,61.0,1954,2014-06-06
3/10/2015,685530.0,4,2.5,3130,60467,2.0,0.0,0.0,3,9,3130,0.0,1996,1996.0,98014,47.6618,-121.962,2780,44224,19.0,1996,2015-03-10
6/26/2014,254600.0,3,2.0,1470,20000,1.0,0.0,0.0,4,7,1470,0.0,1968,1968.0,98002,47.2973,-122.08,1390,30056,47.0,1968,2014-06-26
6/3/2014,230000.0,3,2.0,1440,5600,1.0,0.0,0.0,4,6,720,720.0,1942,1942.0,98056,47.4947,-122.185,1120,5700,73.0,1942,2014-06-03
7/17/2014,335000.0,3,3.0,1430,1249,3.0,0.0,0.0,3,8,1430,0.0,2003,2003.0,98103,47.6971,-122.34,1020,1112,12.0,2003,2014-07-17
6/3/2014,550000.0,4,2.5,2170,9600,1.0,0.0,0.0,3,7,1460,710.0,1980,1980.0,98052,47.6789,-122.116,1940,8400,35.0,1980,2014-06-03
12/26/2014,123300.0,3,1.0,1150,8050,1.5,0.0,0.0,4,7,1150,0.0,1956,1956.0,98032,47.373999999999995,-122.296,1360,8050,59.0,1956,2014-12-26
9/2/2014,275436.0,4,2.75,2170,9658,1.5,0.0,0.0,3,7,2170,0.0,1966,1966.0,98030,47.3741,-122.189,1490,9731,49.0,1966,2014-09-02
5/25/2014,325000.0,4,3.5,2630,3435,1.5,0.0,3.0,3,7,1640,990.0,1984,1984.0,98188,47.4355,-122.272,1920,2435,31.0,1984,2014-05-25
7/25/2014,635000.0,4,2.5,2490,40608,2.0,0.0,0.0,3,9,2490,0.0,1997,1997.0,98053,47.6507,-122.00399999999999,3170,45441,18.0,1997,2014-07-25
4/23/2015,513000.0,3,1.75,1710,5000,1.0,0.0,0.0,4,7,1110,600.0,1944,1944.0,98107,47.6689,-122.37,920,5000,71.0,1944,2015-04-23
7/8/2014,580000.0,4,2.5,2130,35752,1.0,0.0,0.0,3,8,1490,640.0,1980,1980.0,98075,47.5748,-122.031,3030,34000,35.0,1980,2014-07-08
4/29/2015,225000.0,3,1.0,940,9272,1.0,0.0,0.0,3,7,940,0.0,1954,1954.0,98148,47.4353,-122.335,1270,9375,61.0,1954,2015-04-29
9/22/2014,265000.0,3,1.0,1400,9460,1.0,0.0,0.0,3,7,1060,340.0,1961,1961.0,98168,47.5119,-122.321,1570,7700,54.0,1961,2014-09-22
10/14/2014,313000.0,4,1.75,1630,3000,1.0,0.0,0.0,3,7,930,700.0,1978,1978.0,98144,47.5961,-122.305,1630,3000,37.0,1978,2014-10-14
4/14/2015,296000.0,2,1.0,1370,8400,1.0,0.0,0.0,3,7,1370,0.0,1948,1948.0,98133,47.7344,-122.336,1330,8396,67.0,1948,2015-04-14
10/20/2014,655500.0,4,2.75,2380,15800,1.0,0.0,0.0,3,8,1680,700.0,1957,1957.0,98007,47.5929,-122.133,1950,11751,58.0,1957,2014-10-20
12/10/2014,250750.0,5,1.75,2140,12058,1.0,0.0,0.0,4,8,2140,0.0,1951,1951.0,98002,47.3167,-122.214,1640,10125,64.0,1951,2014-12-10
9/4/2014,438000.0,4,2.5,1970,8545,2.0,0.0,0.0,3,8,1970,0.0,2004,2004.0,98059,47.4893,-122.13799999999999,2590,7200,11.0,2004,2014-09-04
8/1/2014,590000.0,3,2.75,2550,54014,2.0,0.0,0.0,4,8,1980,570.0,1967,1967.0,98072,47.7596,-122.117,2180,21600,48.0,1967,2014-08-01
10/6/2014,329500.0,3,1.0,1080,5250,1.0,0.0,0.0,4,7,1080,0.0,1947,1947.0,98133,47.7309,-122.336,1100,5250,68.0,1947,2014-10-06
3/16/2015,1200000.0,3,2.25,3070,9645,2.0,0.0,0.0,3,10,2110,960.0,1987,1987.0,98006,47.5522,-122.14399999999999,3130,9450,28.0,1987,2015-03-16
3/20/2015,415000.0,2,1.0,1470,6000,1.0,0.0,0.0,3,6,900,570.0,1944,1944.0,98199,47.6527,-122.38600000000001,1670,6000,71.0,1944,2015-03-20
9/22/2014,900000.0,4,2.5,3620,42580,2.0,0.0,0.0,3,10,3620,0.0,1984,1984.0,98052,47.7204,-122.115,2950,33167,31.0,1984,2014-09-22
5/4/2015,378000.0,3,1.5,1050,57499,1.0,0.0,0.0,3,7,1050,0.0,1975,1975.0,98024,47.5602,-121.86,1460,42688,40.0,1975,2015-05-04
8/12/2014,474000.0,2,1.0,1050,403365,1.0,0.0,3.0,5,6,1050,0.0,1905,1905.0,98022,47.2221,-122.059,1760,108900,110.0,1905,2014-08-12
6/19/2014,464000.0,3,1.0,1320,3625,2.0,0.0,0.0,3,7,1320,0.0,1900,1900.0,98122,47.6049,-122.288,1660,5438,115.0,1900,2014-06-19
12/8/2014,310000.0,3,1.0,1210,7649,1.0,0.0,0.0,4,7,1210,0.0,1956,1956.0,98155,47.7693,-122.32,1210,6760,59.0,1956,2014-12-08
9/18/2014,580000.0,3,1.5,1860,7190,2.0,0.0,1.0,5,7,1860,0.0,1952,1952.0,98177,47.7716,-122.39200000000001,1670,5525,63.0,1952,2014-09-18
11/19/2014,999000.0,3,2.75,2830,505166,1.0,1.0,3.0,4,8,1830,1000.0,1962,1962.0,98070,47.3782,-122.514,2120,21988,53.0,1962,2014-11-19
3/17/2015,510000.0,2,1.0,810,6480,1.0,0.0,0.0,5,6,810,0.0,1942,1942.0,98199,47.6493,-122.398,1920,6000,73.0,1942,2015-03-17
5/6/2014,650000.0,3,1.5,1630,7475,1.0,0.0,1.0,3,7,1160,470.0,1940,1940.0,98115,47.6725,-122.272,2320,7475,75.0,1940,2014-05-06
9/12/2014,196000.0,3,1.0,880,19600,1.0,0.0,0.0,4,7,880,0.0,1978,1978.0,98023,47.2707,-122.34,880,10500,37.0,1978,2014-09-12
8/22/2014,220000.0,4,1.75,1660,11664,1.0,0.0,0.0,3,6,1010,650.0,1952,1952.0,98168,47.4943,-122.331,1670,9975,63.0,1952,2014-08-22
10/8/2014,855000.0,3,2.25,3440,10628,2.0,0.0,2.0,3,10,3440,0.0,1985,1985.0,98006,47.5647,-122.10799999999999,3170,11434,30.0,1985,2014-10-08
8/29/2014,483000.0,3,1.75,2110,10454,1.0,0.0,0.0,4,8,1440,670.0,1978,1978.0,98028,47.7344,-122.24600000000001,1990,10890,37.0,1978,2014-08-29
4/7/2015,400000.0,3,1.0,1060,12000,1.0,0.0,0.0,3,7,1060,0.0,1952,1952.0,98133,47.7703,-122.35,1550,10500,63.0,1952,2015-04-07
7/2/2014,435000.0,3,2.5,1900,7984,2.0,0.0,0.0,3,8,1900,0.0,1993,1993.0,98011,47.7433,-122.194,2650,9352,22.0,1993,2014-07-02
9/30/2014,219500.0,1,1.0,820,1060,1.0,0.0,0.0,3,8,760,60.0,2007,2007.0,98126,47.5473,-122.37100000000001,1770,1924,8.0,2007,2014-09-30
8/29/2014,2950000.0,4,3.5,4860,23885,2.0,0.0,0.0,3,12,4860,0.0,1996,1996.0,98039,47.6172,-122.23,3580,16054,19.0,1996,2014-08-29
9/16/2014,427000.0,3,2.5,2050,3218,3.0,0.0,0.0,3,7,2050,0.0,2008,2008.0,98133,47.7612,-122.344,2050,7200,7.0,2008,2014-09-16
12/1/2014,430000.0,2,1.5,1090,4013,1.5,0.0,0.0,3,7,1090,0.0,1900,1900.0,98103,47.6652,-122.338,1390,4013,115.0,1900,2014-12-01
5/12/2015,685000.0,2,1.5,1090,4013,1.5,0.0,0.0,3,7,1090,0.0,1900,1900.0,98103,47.6652,-122.338,1390,4013,115.0,1900,2015-05-12
9/3/2014,495000.0,2,1.5,1920,6250,1.0,0.0,0.0,3,7,1060,860.0,1937,1937.0,98199,47.6497,-122.39299999999999,2070,6250,78.0,1937,2014-09-03
6/25/2014,299950.0,3,2.5,1870,7942,2.0,0.0,0.0,3,7,1870,0.0,1990,1990.0,98001,47.342,-122.279,1870,7392,25.0,1990,2014-06-25
11/21/2014,390000.0,4,1.75,2690,46609,1.5,0.0,0.0,3,7,2690,0.0,1940,1940.0,98146,47.4951,-122.352,1920,7302,75.0,1940,2014-11-21
8/12/2014,385000.0,3,1.75,2160,5863,1.5,0.0,0.0,4,7,1260,900.0,1928,1928.0,98144,47.5729,-122.315,1590,3000,87.0,1928,2014-08-12
6/25/2014,740000.0,4,2.5,3000,10392,2.0,0.0,0.0,3,9,3000,0.0,1995,1995.0,98027,47.535,-122.04899999999999,3140,9213,20.0,1995,2014-06-25
7/23/2014,991700.0,4,3.0,2290,2350,2.0,0.0,1.0,3,9,1610,680.0,1924,1924.0,98116,47.574,-122.415,1610,3820,91.0,1924,2014-07-23
8/13/2014,765000.0,3,2.75,2250,9600,2.5,0.0,0.0,4,9,1830,420.0,1909,1991.0,98122,47.6033,-122.287,2060,4980,24.0,1991,2014-08-13
9/4/2014,802000.0,4,2.25,2130,8734,2.0,0.0,2.0,4,8,2130,0.0,1961,1961.0,98006,47.5672,-122.161,2550,8800,54.0,1961,2014-09-04
11/21/2014,950000.0,4,2.75,2500,20000,1.0,0.0,0.0,4,8,1700,800.0,1969,1969.0,98004,47.5901,-122.198,2650,20000,46.0,1969,2014-11-21
11/4/2014,392000.0,4,2.5,2300,41167,2.0,0.0,0.0,3,7,2300,0.0,1988,1988.0,98042,47.3412,-122.10799999999999,2300,21765,27.0,1988,2014-11-04
12/3/2014,590000.0,3,2.5,3360,218235,1.0,0.0,0.0,3,8,3360,0.0,1989,1989.0,98014,47.6601,-121.946,2650,220849,26.0,1989,2014-12-03
4/10/2015,425000.0,4,2.5,1920,9000,2.0,0.0,0.0,2,7,1920,0.0,1989,1989.0,98126,47.5153,-122.37,1530,10474,26.0,1989,2015-04-10
7/22/2014,765000.0,5,1.75,2440,15143,1.5,0.0,4.0,4,8,1740,700.0,1944,1944.0,98146,47.4948,-122.37,2390,10907,71.0,1944,2014-07-22
8/7/2014,313500.0,3,2.25,1440,3488,2.0,0.0,0.0,4,7,1440,0.0,1983,1983.0,98034,47.7257,-122.162,1390,3488,32.0,1983,2014-08-07
8/20/2014,320000.0,3,1.0,1780,6840,2.0,0.0,0.0,4,6,1780,0.0,1947,1947.0,98125,47.727,-122.3,1410,7200,68.0,1947,2014-08-20
2/10/2015,604000.0,4,1.75,1490,4485,1.0,0.0,0.0,3,8,1350,140.0,1960,1960.0,98199,47.6388,-122.399,1380,4846,55.0,1960,2015-02-10
2/12/2015,570000.0,3,2.0,1400,1657,2.0,0.0,0.0,3,8,1060,340.0,2004,2004.0,98112,47.6196,-122.29799999999999,1540,2275,11.0,2004,2015-02-12
5/20/2014,639000.0,4,2.5,2150,12028,2.0,0.0,0.0,4,8,2150,0.0,1982,1982.0,98052,47.7224,-122.101,1800,11777,33.0,1982,2014-05-20
8/22/2014,335000.0,4,2.0,1910,10200,1.0,0.0,0.0,4,7,1910,0.0,1963,1963.0,98059,47.4804,-122.133,1820,15600,52.0,1963,2014-08-22
10/14/2014,896000.0,4,1.75,2660,3520,2.0,0.0,0.0,4,8,2080,580.0,1917,1917.0,98115,47.6743,-122.30799999999999,2100,4080,98.0,1917,2014-10-14
6/27/2014,259500.0,3,1.75,1650,12349,1.0,0.0,0.0,3,7,1650,0.0,1957,1957.0,98188,47.442,-122.28200000000001,1470,10763,58.0,1957,2014-06-27
8/7/2014,637000.0,3,2.0,1980,6000,1.0,0.0,0.0,4,7,1380,600.0,1958,1958.0,98115,47.6921,-122.28299999999999,1260,6000,57.0,1958,2014-08-07
5/6/2015,307450.0,4,2.75,2690,8874,1.0,0.0,0.0,3,8,1370,1320.0,1980,1980.0,98023,47.3078,-122.383,1990,7875,35.0,1980,2015-05-06
8/25/2014,535000.0,3,1.75,1380,3561,1.0,0.0,0.0,4,7,860,520.0,1925,1925.0,98117,47.6822,-122.399,1820,4593,90.0,1925,2014-08-25
6/30/2014,669500.0,4,2.25,2500,4046,1.5,0.0,0.0,4,7,1520,980.0,1940,1940.0,98117,47.6882,-122.382,1410,4046,75.0,1940,2014-06-30
10/28/2014,259000.0,3,1.75,1590,7148,1.0,0.0,0.0,3,7,1590,0.0,1952,1952.0,98166,47.4713,-122.344,1150,7280,63.0,1952,2014-10-28
12/31/2014,441000.0,4,1.5,1100,3300,1.0,0.0,0.0,1,7,1100,0.0,1919,1919.0,98122,47.6033,-122.295,2020,4000,96.0,1919,2014-12-31
5/12/2015,228800.0,4,2.5,1470,1612,2.0,0.0,0.0,3,7,980,490.0,2003,2003.0,98118,47.5275,-122.271,1460,5027,12.0,2003,2015-05-12
5/13/2014,530000.0,2,2.0,1680,4950,1.0,0.0,0.0,3,8,1680,0.0,2006,2006.0,98053,47.7194,-122.022,1570,4800,9.0,2006,2014-05-13
7/28/2014,524000.0,2,2.0,1450,2272,1.0,0.0,0.0,4,6,750,700.0,1924,1924.0,98112,47.633,-122.28200000000001,2170,4370,91.0,1924,2014-07-28
12/11/2014,430000.0,4,2.25,2020,4840,1.5,0.0,0.0,5,8,1200,820.0,1925,1925.0,98126,47.5576,-122.376,1410,4840,90.0,1925,2014-12-11
10/1/2014,1330000.0,4,3.25,2470,4760,1.5,0.0,0.0,5,9,1890,580.0,1906,1906.0,98112,47.6331,-122.31,2470,4760,109.0,1906,2014-10-01
11/3/2014,210000.0,3,1.0,1230,12201,1.0,0.0,0.0,3,7,1230,0.0,1969,1969.0,98042,47.3285,-122.134,1230,10780,46.0,1969,2014-11-03
6/23/2014,449000.0,4,2.5,1850,5040,1.0,0.0,0.0,3,7,1230,620.0,1930,1930.0,98126,47.5386,-122.37299999999999,1010,5040,85.0,1930,2014-06-23
6/19/2014,945000.0,2,2.5,2540,7089,2.0,0.0,0.0,3,9,2540,0.0,2004,2004.0,98116,47.5747,-122.414,1330,7089,11.0,2004,2014-06-19
3/18/2015,200450.0,3,1.0,970,9130,1.0,0.0,0.0,3,6,970,0.0,1957,1957.0,98188,47.4369,-122.272,1000,8886,58.0,1957,2015-03-18
4/17/2015,219950.0,3,1.5,1070,6601,1.0,0.0,0.0,3,6,1070,0.0,1985,1985.0,98002,47.3115,-122.209,1030,6614,30.0,1985,2015-04-17
6/19/2014,659500.0,4,3.0,2620,18362,1.0,0.0,0.0,4,8,1870,750.0,1956,1956.0,98006,47.5646,-122.184,2630,16792,59.0,1956,2014-06-19
11/26/2014,746000.0,4,2.75,2110,8190,1.5,0.0,0.0,5,8,2110,0.0,1966,1966.0,98008,47.6269,-122.1,2420,8400,49.0,1966,2014-11-26
3/31/2015,540000.0,3,1.75,2110,7129,1.0,0.0,0.0,3,8,1280,830.0,1982,1982.0,98052,47.7219,-122.102,1810,8674,33.0,1982,2015-03-31
9/10/2014,485000.0,5,2.0,1910,5508,1.0,0.0,0.0,3,7,1020,890.0,1968,1968.0,98133,47.7074,-122.34899999999999,1030,7440,47.0,1968,2014-09-10
1/27/2015,202000.0,2,1.0,670,7844,1.0,0.0,0.0,3,6,670,0.0,1942,1942.0,98126,47.5165,-122.37200000000001,740,7218,73.0,1942,2015-01-27
9/29/2014,2530000.0,4,5.5,6930,45100,1.0,0.0,0.0,4,11,4310,0.0,1950,1991.0,98006,47.5547,-122.14399999999999,2560,37766,24.0,1991,2014-09-29
4/1/2015,502000.0,3,2.75,2010,11200,1.0,0.0,0.0,3,8,1360,650.0,1979,1979.0,98028,47.7728,-122.25299999999999,2200,10640,36.0,1979,2015-04-01
2/24/2015,279000.0,2,2.75,1770,10534,1.0,0.0,0.0,3,8,1210,560.0,2003,2003.0,98001,47.2773,-122.27600000000001,1600,17400,12.0,2003,2015-02-24
11/17/2014,409500.0,3,1.0,1340,4120,1.0,0.0,0.0,4,7,1040,300.0,1921,1921.0,98103,47.6916,-122.352,1270,4635,94.0,1921,2014-11-17
7/2/2014,453000.0,3,2.0,1660,15050,1.0,0.0,0.0,3,7,1260,400.0,1983,1983.0,98034,47.7203,-122.194,1660,7320,32.0,1983,2014-07-02
2/27/2015,367000.0,4,1.0,1820,5500,1.5,0.0,0.0,3,6,1820,0.0,1947,1947.0,98106,47.5185,-122.363,1140,5500,68.0,1947,2015-02-27
5/23/2014,550000.0,3,2.5,2510,5400,2.0,0.0,0.0,3,9,2510,0.0,1992,1992.0,98056,47.5204,-122.206,1840,5400,23.0,1992,2014-05-23
1/27/2015,273500.0,3,1.5,1560,8314,1.0,0.0,0.0,3,7,1560,0.0,1962,1962.0,98031,47.4117,-122.209,1820,8925,53.0,1962,2015-01-27
10/7/2014,505000.0,4,3.0,2280,7400,1.0,0.0,0.0,3,7,1340,0.0,1978,1978.0,98125,47.71100000000001,-122.306,1540,7500,37.0,1978,2014-10-07
6/19/2014,770000.0,3,2.5,2650,40705,2.0,0.0,0.0,3,9,2650,0.0,1994,1994.0,98053,47.668,-122.06299999999999,2550,42625,21.0,1994,2014-06-19
5/9/2014,565000.0,4,2.25,2470,7447,2.0,0.0,0.0,3,8,2470,0.0,1984,1984.0,98155,47.7514,-122.286,2270,7400,31.0,1984,2014-05-09
8/20/2014,316000.0,3,0.75,1270,10092,1.0,0.0,0.0,5,7,1270,0.0,1971,1971.0,98077,47.7567,-122.073,1300,10375,44.0,1971,2014-08-20
9/25/2014,160000.0,4,1.0,1520,7298,1.5,0.0,0.0,3,7,1520,0.0,1960,1960.0,98198,47.3706,-122.31,1520,7298,55.0,1960,2014-09-25
10/27/2014,170000.0,3,1.0,1310,9529,1.0,0.0,0.0,3,7,1310,0.0,1956,1956.0,98198,47.4105,-122.295,1330,9529,59.0,1956,2014-10-27
3/19/2015,235000.0,3,1.0,1310,9529,1.0,0.0,0.0,3,7,1310,0.0,1956,1956.0,98198,47.4105,-122.295,1330,9529,59.0,1956,2015-03-19
12/19/2014,1800000.0,4,3.5,3930,39098,2.0,0.0,0.0,3,12,3930,0.0,1999,1999.0,98005,47.6399,-122.15799999999999,4250,38682,16.0,1999,2014-12-19
9/18/2014,310000.0,3,1.0,990,7050,1.0,0.0,0.0,3,7,990,0.0,1967,1967.0,98034,47.7274,-122.20200000000001,1200,8125,48.0,1967,2014-09-18
5/19/2014,285000.0,4,1.75,2080,13629,1.0,0.0,0.0,4,7,1040,1040.0,1955,1955.0,98178,47.4866,-122.23200000000001,1780,14659,60.0,1955,2014-05-19
6/4/2014,280000.0,2,1.0,960,4920,1.0,0.0,0.0,3,6,960,0.0,1942,1942.0,98117,47.6946,-122.36200000000001,1010,5040,73.0,1942,2014-06-04
2/18/2015,2300000.0,4,4.25,4070,13860,2.0,0.0,3.0,3,10,4070,0.0,2004,2004.0,98040,47.59,-122.229,3430,9240,11.0,2004,2015-02-18
8/14/2014,763776.0,4,2.5,2750,16139,2.0,0.0,0.0,3,9,2750,0.0,1989,1989.0,98075,47.5843,-122.06,2810,13093,26.0,1989,2014-08-14
2/17/2015,530000.0,5,2.75,3230,13572,1.0,0.0,2.0,3,8,1880,1350.0,1965,1965.0,98166,47.4393,-122.34700000000001,2910,15292,50.0,1965,2015-02-17
2/11/2015,362000.0,1,1.0,890,211576,1.5,0.0,0.0,3,7,890,0.0,1996,1996.0,98019,47.7216,-121.883,1670,217364,19.0,1996,2015-02-11
7/25/2014,430000.0,2,1.0,990,4920,1.0,0.0,0.0,3,6,990,0.0,1931,1931.0,98117,47.6939,-122.368,990,4960,84.0,1931,2014-07-25
7/25/2014,456500.0,3,1.0,1290,3880,1.5,0.0,0.0,4,7,1290,0.0,1919,1919.0,98117,47.6879,-122.39200000000001,1290,4850,96.0,1919,2014-07-25
9/11/2014,445000.0,4,2.5,2170,5257,2.0,0.0,0.0,3,7,2170,0.0,1989,1989.0,98115,47.6999,-122.305,1430,7528,26.0,1989,2014-09-11
3/10/2015,386900.0,3,1.0,1330,10500,1.0,0.0,0.0,3,7,960,370.0,1963,1963.0,98034,47.7204,-122.196,1460,11550,52.0,1963,2015-03-10
7/8/2014,479000.0,3,1.0,1340,13750,1.0,0.0,0.0,4,7,1340,0.0,1955,1955.0,98006,47.5771,-122.15100000000001,1430,11400,60.0,1955,2014-07-08
3/13/2015,525000.0,3,2.5,2200,4544,2.0,0.0,0.0,3,8,2200,0.0,2000,2000.0,98065,47.5319,-121.867,2400,5431,15.0,2000,2015-03-13
1/6/2015,272000.0,4,1.75,2520,10890,1.0,0.0,0.0,3,7,1260,1260.0,1979,1979.0,98023,47.3224,-122.34299999999999,2090,12375,36.0,1979,2015-01-06
2/26/2015,517000.0,4,1.0,1180,13500,1.5,0.0,0.0,3,7,1180,0.0,1950,1950.0,98125,47.7165,-122.30799999999999,1580,8976,65.0,1950,2015-02-26
2/26/2015,615000.0,3,1.75,2660,7800,1.0,0.0,0.0,4,8,1330,1330.0,1951,1951.0,98117,47.6993,-122.37799999999999,1950,6240,64.0,1951,2015-02-26
8/28/2014,439000.0,3,1.75,1250,7030,1.0,0.0,0.0,3,7,1250,0.0,1965,1965.0,98008,47.6285,-122.118,1460,7210,50.0,1965,2014-08-28
7/24/2014,716000.0,3,2.5,2270,7866,1.0,0.0,0.0,4,10,2270,0.0,1988,1988.0,98029,47.5622,-122.022,2580,8132,27.0,1988,2014-07-24
10/28/2014,308000.0,2,1.0,1080,6250,1.0,0.0,2.0,4,7,1080,0.0,1942,1968.0,98118,47.5128,-122.251,2100,6875,47.0,1968,2014-10-28
6/10/2014,800000.0,3,2.25,1620,4500,2.0,0.0,0.0,4,8,1620,0.0,1926,1926.0,98119,47.643,-122.361,1210,4320,89.0,1926,2014-06-10
5/5/2015,575000.0,3,2.0,940,5000,1.0,0.0,0.0,3,7,880,60.0,1941,1941.0,98117,47.6771,-122.398,1420,5000,74.0,1941,2015-05-05
7/1/2014,219950.0,3,1.5,1620,9310,1.0,0.0,0.0,4,7,1620,0.0,1967,1967.0,98042,47.3665,-122.10700000000001,1610,10640,48.0,1967,2014-07-01
5/22/2014,770000.0,4,2.5,2350,8001,2.0,0.0,0.0,4,8,2350,0.0,1987,1987.0,98006,47.5478,-122.15299999999999,2460,8001,28.0,1987,2014-05-22
12/30/2014,424950.0,3,1.75,2090,7505,1.0,0.0,0.0,3,7,2090,0.0,1967,1967.0,98034,47.7326,-122.194,1510,7416,48.0,1967,2014-12-30
1/8/2015,387000.0,3,2.25,1760,45133,2.0,0.0,0.0,3,7,1760,0.0,1984,1984.0,98065,47.5124,-121.866,1910,51773,31.0,1984,2015-01-08
6/20/2014,790000.0,4,1.75,2050,10920,1.0,0.0,3.0,3,8,1450,600.0,1974,1974.0,98155,47.7431,-122.286,2440,10920,41.0,1974,2014-06-20
1/28/2015,156000.0,2,1.0,600,4000,1.0,0.0,0.0,3,5,600,0.0,1933,1933.0,98146,47.5065,-122.339,1290,6973,82.0,1933,2015-01-28
5/5/2014,580000.0,2,1.0,2540,7000,1.0,0.0,0.0,5,8,1320,1220.0,1942,1942.0,98118,47.5259,-122.26100000000001,2160,6000,73.0,1942,2014-05-05
9/19/2014,490000.0,4,2.25,2090,10869,2.0,0.0,0.0,3,8,2090,0.0,1970,1970.0,98033,47.6715,-122.164,1800,17788,45.0,1970,2014-09-19
7/16/2014,950000.0,5,3.25,2700,3650,2.0,0.0,2.0,3,9,2070,630.0,1926,2014.0,98144,47.5959,-122.291,1940,4000,1.0,2014,2014-07-16
2/13/2015,400000.0,2,2.5,1410,1281,2.0,0.0,0.0,3,8,1090,320.0,2008,2008.0,98126,47.5659,-122.37,1410,2550,7.0,2008,2015-02-13
5/13/2015,325000.0,2,2.5,1170,1638,2.0,0.0,0.0,3,8,1170,0.0,2008,2008.0,98133,47.7041,-122.351,1350,1407,7.0,2008,2015-05-13
9/29/2014,365000.0,4,2.5,2540,6688,2.0,0.0,0.0,3,9,2540,0.0,2002,2002.0,98092,47.3314,-122.18,2810,6776,13.0,2002,2014-09-29
4/7/2015,255000.0,3,1.75,2190,6000,1.5,0.0,0.0,4,7,2190,0.0,1920,1920.0,98002,47.3063,-122.223,1610,6000,95.0,1920,2015-04-07
3/23/2015,985000.0,5,3.5,3890,13261,2.0,0.0,1.0,3,9,2870,1020.0,1984,1984.0,98125,47.7246,-122.28399999999999,3080,13261,31.0,1984,2015-03-23
4/23/2015,595000.0,4,2.5,2030,10722,1.0,0.0,0.0,3,7,1100,930.0,1967,1967.0,98115,47.6955,-122.301,1610,9134,48.0,1967,2015-04-23
7/16/2014,427500.0,3,1.0,1350,7085,1.0,0.0,0.0,5,7,1350,0.0,1944,1944.0,98125,47.7318,-122.305,1350,7085,71.0,1944,2014-07-16
10/16/2014,728000.0,3,1.5,1940,4000,1.5,0.0,0.0,3,8,1310,630.0,1915,1915.0,98112,47.6205,-122.291,1940,4000,100.0,1915,2014-10-16
9/10/2014,549950.0,2,1.0,1260,4000,1.0,0.0,0.0,3,7,1000,260.0,1940,1940.0,98117,47.6898,-122.384,1780,4000,75.0,1940,2014-09-10
12/8/2014,650000.0,3,2.0,2800,10501,1.0,0.0,0.0,3,7,1400,1400.0,1954,1954.0,98125,47.7055,-122.315,2260,6534,61.0,1954,2014-12-08
3/20/2015,1130000.0,5,3.25,3080,13394,1.0,0.0,2.0,4,9,2230,0.0,1968,1968.0,98033,47.6651,-122.19,2810,10720,47.0,1968,2015-03-20
5/4/2015,203000.0,3,1.0,840,6500,1.0,0.0,0.0,5,6,840,0.0,1969,1969.0,98042,47.3637,-122.083,920,4680,46.0,1969,2015-05-04
8/7/2014,311000.0,2,1.0,860,3300,1.0,0.0,0.0,5,6,860,0.0,1903,1903.0,98118,47.5496,-122.279,1380,4400,112.0,1903,2014-08-07
4/28/2015,387500.0,6,2.0,2400,7684,1.0,0.0,0.0,3,6,1200,1200.0,1932,2005.0,98028,47.7705,-122.26899999999999,1290,9800,10.0,2005,2015-04-28
3/18/2015,370000.0,4,2.0,1640,7200,1.0,0.0,0.0,3,7,1640,0.0,1963,1963.0,98155,47.7471,-122.324,1500,9000,52.0,1963,2015-03-18
7/24/2014,228000.0,2,1.0,1060,6100,1.0,0.0,0.0,3,6,1060,0.0,1951,1951.0,98125,47.7317,-122.296,1550,9150,64.0,1951,2014-07-24
5/28/2014,740000.0,2,1.75,2080,4800,1.0,0.0,0.0,5,7,1080,1000.0,1923,1923.0,98117,47.6896,-122.36200000000001,1310,4800,92.0,1923,2014-05-28
7/10/2014,200000.0,4,2.0,2090,6630,1.0,0.0,0.0,3,7,1070,1020.0,1974,1974.0,98178,47.5077,-122.26799999999999,1550,7980,41.0,1974,2014-07-10
7/9/2014,660000.0,3,1.0,1240,3500,1.0,0.0,0.0,4,7,1240,0.0,1927,1927.0,98103,47.6835,-122.34700000000001,1650,3360,88.0,1927,2014-07-09
7/9/2014,275000.0,4,2.0,2030,8426,2.0,0.0,0.0,3,7,2030,0.0,1944,1944.0,98168,47.4806,-122.287,1190,7007,71.0,1944,2014-07-09
4/29/2015,708000.0,2,1.0,1120,5250,1.0,0.0,0.0,3,7,950,170.0,1938,1938.0,98199,47.6496,-122.39200000000001,1510,5250,77.0,1938,2015-04-29
5/19/2014,280000.0,3,2.5,1270,9675,2.0,0.0,0.0,3,8,1270,0.0,1993,1993.0,98045,47.4639,-121.744,1270,11700,22.0,1993,2014-05-19
1/6/2015,325000.0,4,2.5,2260,5702,2.0,0.0,0.0,3,8,2260,0.0,2002,2002.0,98042,47.3488,-122.15100000000001,2450,6381,13.0,2002,2015-01-06
8/20/2014,495000.0,3,2.5,1780,47480,2.0,0.0,0.0,3,7,1780,0.0,1995,1995.0,98045,47.4723,-121.70700000000001,1890,51836,20.0,1995,2014-08-20
9/22/2014,691000.0,2,2.0,1780,3810,1.5,0.0,0.0,3,7,980,800.0,1922,1922.0,98119,47.6474,-122.36200000000001,1690,3810,93.0,1922,2014-09-22
7/2/2014,2290000.0,4,2.5,4080,18362,2.0,0.0,2.0,4,11,4080,0.0,1983,1983.0,98004,47.6344,-122.214,4080,19991,32.0,1983,2014-07-02
4/28/2015,329500.0,3,2.5,2120,22482,1.0,0.0,0.0,5,7,1360,760.0,1979,1979.0,98001,47.341,-122.265,2330,16016,36.0,1979,2015-04-28
8/5/2014,348000.0,3,2.5,2060,7458,2.0,0.0,0.0,3,9,2060,0.0,1989,1989.0,98023,47.3045,-122.351,2480,7743,26.0,1989,2014-08-05
11/14/2014,425000.0,2,1.0,1670,6212,1.0,0.0,0.0,4,7,1670,0.0,1947,1947.0,98125,47.7152,-122.28200000000001,1670,7272,68.0,1947,2014-11-14
5/19/2014,210000.0,3,1.0,1080,21043,1.0,0.0,0.0,3,6,1080,0.0,1942,1942.0,98106,47.5515,-122.35700000000001,1380,7620,73.0,1942,2014-05-19
12/20/2014,285000.0,2,1.0,1210,4895,1.0,0.0,0.0,3,6,710,500.0,1951,1951.0,98126,47.5202,-122.37299999999999,1100,6000,64.0,1951,2014-12-20
4/30/2015,222000.0,3,1.0,990,8840,1.0,0.0,0.0,3,6,990,0.0,1966,1966.0,98023,47.3074,-122.37100000000001,1120,8625,49.0,1966,2015-04-30
5/27/2014,200000.0,4,2.5,1720,9600,1.0,0.0,0.0,3,7,1120,600.0,1961,1961.0,98092,47.2917,-122.18799999999999,1520,9400,54.0,1961,2014-05-27
10/2/2014,247500.0,3,2.0,1530,8749,1.0,0.0,0.0,3,7,1530,0.0,1995,1995.0,98023,47.2974,-122.37200000000001,1750,8749,20.0,1995,2014-10-02
8/20/2014,1500000.0,4,5.5,6550,217374,1.0,0.0,0.0,3,11,5400,1150.0,2006,2006.0,98058,47.4302,-122.095,4110,50378,9.0,2006,2014-08-20
11/20/2014,190000.0,3,1.75,1100,9452,1.0,0.0,0.0,3,6,1100,0.0,1942,1942.0,98146,47.4864,-122.337,1350,9452,73.0,1942,2014-11-20
12/15/2014,975000.0,4,2.5,3020,4950,1.5,0.0,0.0,4,9,2020,1000.0,1921,1921.0,98112,47.6467,-122.304,2300,5450,94.0,1921,2014-12-15
12/23/2014,1130000.0,4,3.0,3180,4649,2.0,0.0,0.0,4,9,2070,1110.0,1925,1925.0,98105,47.6583,-122.273,2720,5980,90.0,1925,2014-12-23
5/4/2015,283200.0,4,1.75,1830,12540,1.0,0.0,0.0,4,8,1130,700.0,1958,1958.0,98003,47.3348,-122.324,2020,12540,57.0,1958,2015-05-04
7/14/2014,650000.0,3,2.5,2540,8073,1.0,0.0,0.0,4,8,1880,660.0,1937,1937.0,98177,47.7176,-122.36,2110,7702,78.0,1937,2014-07-14
5/13/2014,449500.0,3,2.0,1770,6610,1.0,0.0,0.0,4,7,960,810.0,1954,1954.0,98133,47.7703,-122.34299999999999,2010,4361,61.0,1954,2014-05-13
10/22/2014,400000.0,3,1.75,1470,6682,1.0,0.0,0.0,3,7,1470,0.0,1987,1987.0,98034,47.7315,-122.226,1790,7379,28.0,1987,2014-10-22
2/19/2015,89950.0,1,1.0,570,4080,1.0,0.0,0.0,3,5,570,0.0,1942,1942.0,98146,47.5098,-122.334,890,5100,73.0,1942,2015-02-19
11/24/2014,158800.0,3,1.0,960,8291,1.0,0.0,0.0,3,6,960,0.0,1950,1950.0,98146,47.5006,-122.334,1110,8231,65.0,1950,2014-11-24
9/17/2014,870000.0,4,3.0,2940,7108,2.0,0.0,1.0,3,9,2220,720.0,2011,2011.0,98136,47.5437,-122.395,2240,7950,4.0,2011,2014-09-17
3/6/2015,196000.0,3,1.5,1000,18568,1.0,0.0,0.0,3,6,1000,0.0,1989,1989.0,98001,47.2976,-122.271,1610,17420,26.0,1989,2015-03-06
7/31/2014,850000.0,3,1.75,2450,8603,1.0,0.0,0.0,5,8,1340,1110.0,1940,1940.0,98199,47.6536,-122.414,2280,5779,75.0,1940,2014-07-31
9/23/2014,775000.0,4,2.5,3310,5101,2.0,0.0,0.0,3,9,3310,0.0,2005,2005.0,98052,47.6649,-122.08,3010,5176,10.0,2005,2014-09-23
8/1/2014,483500.0,3,2.5,1670,4308,2.0,0.0,0.0,3,8,1670,0.0,2001,2001.0,98027,47.5307,-122.04700000000001,1670,2897,14.0,2001,2014-08-01
4/2/2015,387000.0,3,1.5,1620,21929,2.0,0.0,0.0,3,7,1620,0.0,1990,1990.0,98019,47.766999999999996,-121.90299999999999,1600,21679,25.0,1990,2015-04-02
1/24/2015,900000.0,3,3.0,2990,30869,2.0,0.0,0.0,3,10,2990,0.0,1951,2003.0,98155,47.7602,-122.27799999999999,1750,15802,12.0,2003,2015-01-24
4/7/2015,336000.0,3,1.5,1240,5000,1.0,0.0,2.0,3,7,1240,0.0,1964,1964.0,98106,47.5659,-122.36,1050,5000,51.0,1964,2015-04-07
4/17/2015,415000.0,2,1.0,670,6000,1.0,0.0,0.0,5,6,670,0.0,1949,1949.0,98118,47.56100000000001,-122.275,1240,5040,66.0,1949,2015-04-17
8/11/2014,350000.0,3,1.5,1320,4400,1.0,0.0,0.0,3,6,1320,0.0,1909,1909.0,98112,47.6231,-122.292,1350,4400,106.0,1909,2014-08-11
11/17/2014,1320000.0,4,5.25,6110,10369,2.0,0.0,0.0,3,11,6110,0.0,2005,2005.0,98059,47.5285,-122.135,4190,10762,10.0,2005,2014-11-17
8/6/2014,765000.0,3,1.75,2440,5800,1.0,0.0,3.0,4,8,1320,1120.0,1945,1945.0,98199,47.6474,-122.412,2530,5800,70.0,1945,2014-08-06
10/20/2014,527000.0,4,2.5,2900,6736,2.0,0.0,0.0,3,8,2900,0.0,2013,2013.0,98059,47.4954,-122.152,2900,6736,2.0,2013,2014-10-20
7/18/2014,524000.0,4,2.75,2310,5000,1.5,0.0,0.0,5,8,1480,830.0,1908,1908.0,98118,47.5502,-122.26799999999999,1100,5000,107.0,1908,2014-07-18
7/15/2014,448000.0,2,1.0,1110,5413,1.0,0.0,0.0,3,6,890,220.0,1937,1937.0,98115,47.6925,-122.32,1300,5413,78.0,1937,2014-07-15
7/7/2014,775000.0,4,3.25,4100,241322,2.0,0.0,0.0,3,9,2500,1600.0,1981,1981.0,98072,47.7302,-122.096,3770,87821,34.0,1981,2014-07-07
1/16/2015,176500.0,3,1.0,930,9900,1.5,0.0,0.0,4,5,930,0.0,1910,1910.0,98032,47.3745,-122.23100000000001,930,7200,105.0,1910,2015-01-16
4/16/2015,750000.0,4,2.25,2420,11120,1.0,0.0,2.0,4,8,1620,800.0,1952,1952.0,98146,47.4954,-122.366,2210,8497,63.0,1952,2015-04-16
12/2/2014,1270000.0,4,2.25,2870,6000,1.0,0.0,0.0,5,8,1730,1140.0,1951,1951.0,98112,47.6362,-122.28200000000001,2370,5500,64.0,1951,2014-12-02
2/26/2015,250000.0,3,1.0,1480,6750,1.0,0.0,0.0,3,7,1480,0.0,1958,1958.0,98146,47.505,-122.366,1480,7594,57.0,1958,2015-02-26
10/28/2014,759000.0,3,2.75,1960,6390,1.5,0.0,2.0,5,8,1960,0.0,1900,1900.0,98122,47.6032,-122.285,2440,5870,115.0,1900,2014-10-28
12/11/2014,640000.0,3,2.0,1470,4640,1.5,0.0,0.0,4,7,1470,0.0,1926,1926.0,98199,47.6398,-122.39299999999999,1700,5000,89.0,1926,2014-12-11
4/27/2015,990000.0,3,3.25,2460,4182,2.0,0.0,0.0,5,8,2100,360.0,1910,1910.0,98115,47.6782,-122.311,2370,4284,105.0,1910,2015-04-27
10/8/2014,395000.0,4,1.75,1960,7945,1.0,0.0,0.0,4,7,980,980.0,1946,1946.0,98125,47.7326,-122.291,1290,7945,69.0,1946,2014-10-08
4/21/2015,275000.0,2,1.5,1160,1103,2.0,0.0,0.0,3,7,890,270.0,2006,2006.0,98133,47.7677,-122.315,1160,1086,9.0,2006,2015-04-21
2/5/2015,390000.0,3,2.5,1910,4755,2.0,0.0,0.0,3,8,1910,0.0,1997,1997.0,98059,47.4956,-122.162,2460,6099,18.0,1997,2015-02-05
3/24/2015,752500.0,5,2.75,2720,4680,1.5,0.0,0.0,4,8,1710,0.0,1913,1913.0,98107,47.6612,-122.363,1670,4800,102.0,1913,2015-03-24
2/27/2015,450000.0,2,1.0,1020,5000,1.5,0.0,0.0,4,6,1020,0.0,1906,1906.0,98107,47.6725,-122.396,1490,5000,109.0,1906,2015-02-27
6/17/2014,473000.0,2,1.0,900,5100,1.0,0.0,0.0,4,7,900,0.0,1909,1909.0,98117,47.6804,-122.37799999999999,1400,5100,106.0,1909,2014-06-17
3/23/2015,178500.0,3,1.75,1120,10450,1.0,0.0,0.0,3,7,1120,0.0,1973,1973.0,98045,47.4418,-121.772,1250,10414,42.0,1973,2015-03-23
6/4/2014,485000.0,3,2.5,2340,59058,1.0,0.0,0.0,3,8,2340,0.0,1985,1985.0,98038,47.4052,-122.02799999999999,2700,37263,30.0,1985,2014-06-04
3/27/2015,215000.0,3,1.5,1410,8415,1.0,0.0,0.0,4,7,780,630.0,1982,1982.0,98023,47.2914,-122.368,1440,7361,33.0,1982,2015-03-27
8/12/2014,589000.0,4,1.75,1920,4862,1.0,0.0,0.0,5,7,1060,860.0,1919,1919.0,98116,47.5747,-122.384,1840,4862,96.0,1919,2014-08-12
4/17/2015,325000.0,4,1.75,1370,9993,1.0,0.0,0.0,3,6,1370,0.0,1918,1918.0,98028,47.7572,-122.228,1650,11592,97.0,1918,2015-04-17
8/20/2014,580000.0,3,2.5,1590,1937,2.5,0.0,0.0,3,8,1590,0.0,2004,2004.0,98116,47.5903,-122.38799999999999,1620,2022,11.0,2004,2014-08-20
7/16/2014,181100.0,4,1.75,1850,7500,1.0,0.0,0.0,3,7,1850,0.0,1954,1954.0,98198,47.4217,-122.333,1460,7500,61.0,1954,2014-07-16
2/24/2015,345000.0,3,2.0,1430,4200,1.0,0.0,0.0,4,7,830,600.0,1908,1908.0,98199,47.6462,-122.384,1540,5000,107.0,1908,2015-02-24
3/30/2015,781000.0,3,1.75,1940,8729,1.0,0.0,0.0,3,8,1460,480.0,1960,1960.0,98125,47.7027,-122.28200000000001,2250,9165,55.0,1960,2015-03-30
10/23/2014,402500.0,4,1.0,1270,3630,1.5,0.0,0.0,3,7,1270,0.0,1903,1903.0,98122,47.6135,-122.307,1420,4848,112.0,1903,2014-10-23
4/20/2015,426000.0,3,1.5,1380,7200,1.0,0.0,0.0,3,7,1080,300.0,1948,1948.0,98106,47.5292,-122.348,1220,7200,67.0,1948,2015-04-20
9/5/2014,389000.0,3,2.5,1720,4515,2.0,0.0,0.0,3,7,1720,0.0,2005,2005.0,98065,47.5426,-121.87899999999999,2220,4618,10.0,2005,2014-09-05
7/7/2014,670000.0,6,3.0,4050,36171,2.0,0.0,0.0,4,8,2620,1430.0,1970,1970.0,98027,47.4708,-122.015,3660,42874,45.0,1970,2014-07-07
5/21/2014,1510000.0,4,3.25,3660,5800,2.5,0.0,0.0,3,10,3360,300.0,1909,1995.0,98112,47.6283,-122.31200000000001,3240,5800,20.0,1995,2014-05-21
5/21/2014,288400.0,3,2.25,1870,3230,2.0,0.0,0.0,3,7,1870,0.0,1997,1997.0,98056,47.4915,-122.167,1620,3363,18.0,1997,2014-05-21
2/19/2015,700000.0,4,2.0,2230,4635,1.5,0.0,0.0,5,7,1510,720.0,1908,1908.0,98103,47.681999999999995,-122.34899999999999,1520,4635,107.0,1908,2015-02-19
3/31/2015,830000.0,4,3.0,2020,6000,1.0,0.0,0.0,3,8,1220,800.0,1968,2015.0,98199,47.6563,-122.40100000000001,1400,6000,0.0,2015,2015-03-31
9/11/2014,1900000.0,2,2.75,3690,32044,2.0,1.0,4.0,3,12,3690,0.0,1989,1989.0,98166,47.4485,-122.369,2310,26988,26.0,1989,2014-09-11
10/9/2014,350500.0,2,1.0,1450,6380,1.0,0.0,0.0,3,7,1450,0.0,1967,1967.0,98115,47.6924,-122.321,1240,6380,48.0,1967,2014-10-09
5/3/2015,431000.0,3,1.75,1630,9000,1.0,0.0,0.0,4,7,1630,0.0,1956,1956.0,98166,47.4521,-122.36,1600,11120,59.0,1956,2015-05-03
10/31/2014,485000.0,3,2.5,1840,8250,1.0,0.0,1.0,3,8,1340,500.0,1958,1958.0,98177,47.7767,-122.37799999999999,1970,7920,57.0,1958,2014-10-31
10/10/2014,780000.0,3,1.5,1620,7500,1.0,0.0,2.0,4,8,1620,0.0,1949,1949.0,98117,47.7014,-122.381,2440,7800,66.0,1949,2014-10-10
8/1/2014,720000.0,2,1.5,1840,9000,1.0,0.0,2.0,3,8,1340,500.0,1957,1957.0,98136,47.5281,-122.38799999999999,1880,7560,58.0,1957,2014-08-01
2/20/2015,415000.0,3,1.0,1360,73616,1.0,0.0,0.0,3,7,1360,0.0,1971,1971.0,98072,47.7528,-122.119,2040,50965,44.0,1971,2015-02-20
6/20/2014,480000.0,4,1.0,2080,5500,1.0,0.0,0.0,3,7,1040,1040.0,1941,1941.0,98117,47.6838,-122.38600000000001,1280,4000,74.0,1941,2014-06-20
9/16/2014,452250.0,4,2.25,2550,10000,1.0,0.0,0.0,4,7,1560,990.0,1979,1979.0,98028,47.77,-122.259,2440,10000,36.0,1979,2014-09-16
4/6/2015,316000.0,3,2.5,2550,8170,2.0,0.0,0.0,3,8,2550,0.0,1985,1985.0,98023,47.31100000000001,-122.345,1840,8823,30.0,1985,2015-04-06
10/10/2014,700000.0,2,1.0,1160,17635,1.0,1.0,4.0,3,6,1160,0.0,1945,1945.0,98178,47.5117,-122.24799999999999,1510,13122,70.0,1945,2014-10-10
7/29/2014,285000.0,4,2.0,1760,5500,1.0,0.0,1.0,3,7,780,980.0,1925,2004.0,98118,47.5183,-122.265,1510,5500,11.0,2004,2014-07-29
9/18/2014,575000.0,3,1.75,1720,4050,1.0,0.0,0.0,5,7,860,860.0,1906,1906.0,98115,47.6782,-122.314,1720,4410,109.0,1906,2014-09-18
7/22/2014,590000.0,3,2.25,2300,12430,1.0,0.0,2.0,4,8,1580,720.0,1960,1960.0,98166,47.435,-122.34700000000001,2500,12430,55.0,1960,2014-07-22
2/26/2015,587500.0,4,1.75,2500,20868,1.0,0.0,2.0,3,8,1600,900.0,1956,1956.0,98166,47.431000000000004,-122.338,2170,15026,59.0,1956,2015-02-26
9/22/2014,364000.0,4,2.25,1750,10270,1.5,0.0,0.0,4,8,1750,0.0,1968,1968.0,98155,47.7612,-122.31,1750,10127,47.0,1968,2014-09-22
12/17/2014,490000.0,3,2.5,1890,10190,2.0,0.0,0.0,3,8,1890,0.0,1986,1986.0,98074,47.6478,-122.061,2080,9794,29.0,1986,2014-12-17
5/5/2014,410000.0,3,2.25,1800,36704,1.0,0.0,0.0,4,8,1360,440.0,1978,1978.0,98027,47.4688,-122.01299999999999,2730,36404,37.0,1978,2014-05-05
10/28/2014,520000.0,3,2.5,2160,4297,2.0,0.0,0.0,3,9,2160,0.0,1999,1999.0,98029,47.5476,-122.012,2160,3968,16.0,1999,2014-10-28
10/8/2014,389000.0,3,1.0,1380,6591,1.0,0.0,0.0,4,7,1380,0.0,1947,1947.0,98133,47.7164,-122.351,1610,6594,68.0,1947,2014-10-08
11/18/2014,450000.0,2,1.0,1180,6000,1.0,0.0,0.0,3,7,1180,0.0,1910,1910.0,98119,47.6531,-122.37299999999999,1600,6000,105.0,1910,2014-11-18
12/5/2014,325000.0,3,2.5,2550,4240,2.0,0.0,0.0,3,7,2550,0.0,2006,2006.0,98031,47.3986,-122.169,2550,4240,9.0,2006,2014-12-05
3/13/2015,660000.0,2,1.0,1070,5000,1.0,0.0,0.0,3,7,1070,0.0,1924,1924.0,98103,47.6631,-122.337,1400,4000,91.0,1924,2015-03-13
6/20/2014,850000.0,3,2.25,2870,8170,2.0,0.0,0.0,3,10,2250,620.0,1995,1995.0,98136,47.5363,-122.385,1310,8170,20.0,1995,2014-06-20
8/6/2014,285000.0,3,2.5,1940,9874,2.0,0.0,0.0,3,7,1940,0.0,1990,1990.0,98042,47.3794,-122.113,1860,8875,25.0,1990,2014-08-06
12/11/2014,395000.0,2,1.0,870,3121,1.0,0.0,0.0,4,7,870,0.0,1923,1923.0,98107,47.6659,-122.369,1570,1777,92.0,1923,2014-12-11
7/17/2014,440000.0,3,2.0,1550,2401,2.0,0.0,0.0,3,7,1550,0.0,1996,1996.0,98103,47.6545,-122.348,1550,3446,19.0,1996,2014-07-17
3/13/2015,249000.0,3,1.75,1400,5648,1.5,0.0,0.0,5,6,1400,0.0,1917,1917.0,98056,47.5133,-122.196,2320,9420,98.0,1917,2015-03-13
2/27/2015,635000.0,3,1.75,1210,4400,1.5,0.0,0.0,4,8,1210,0.0,1930,1930.0,98105,47.6621,-122.288,2020,3750,85.0,1930,2015-02-27
8/11/2014,515000.0,3,2.5,3430,48993,2.0,0.0,0.0,3,9,3430,0.0,2001,2001.0,98001,47.2609,-122.27,2460,36256,14.0,2001,2014-08-11
1/30/2015,1400000.0,3,3.25,3020,6073,2.0,0.0,0.0,4,9,3020,0.0,1954,1954.0,98112,47.6332,-122.29,3020,7700,61.0,1954,2015-01-30
3/4/2015,200000.0,2,1.0,950,8100,1.0,0.0,0.0,3,6,950,0.0,1955,1955.0,98166,47.4572,-122.351,1620,7630,60.0,1955,2015-03-04
5/6/2014,1140000.0,4,2.75,3370,8103,1.0,0.0,3.0,3,9,1970,1400.0,1970,2014.0,98136,47.5232,-122.383,2120,6360,1.0,2014,2014-05-06
11/17/2014,445000.0,4,1.0,1460,4600,1.0,0.0,2.0,3,6,780,680.0,1946,1946.0,98126,47.566,-122.38,1560,4600,69.0,1946,2014-11-17
7/7/2014,555000.0,3,1.5,1740,4200,1.5,0.0,0.0,4,7,1640,100.0,1920,1920.0,98117,47.6782,-122.361,1660,3750,95.0,1920,2014-07-07
9/24/2014,537000.0,4,2.0,1720,6413,1.0,0.0,0.0,4,7,860,860.0,1950,1950.0,98116,47.5734,-122.395,1280,6413,65.0,1950,2014-09-24
1/27/2015,315000.0,3,1.75,1480,7500,1.0,0.0,0.0,4,7,1480,0.0,1968,1968.0,98055,47.4629,-122.18700000000001,1480,7500,47.0,1968,2015-01-27
1/29/2015,805000.0,5,2.5,3320,7266,2.0,0.0,0.0,3,9,3320,0.0,2000,2000.0,98075,47.5862,-122.054,3060,10269,15.0,2000,2015-01-29
8/26/2014,414000.0,4,2.5,3490,9030,1.5,0.0,0.0,4,8,3490,0.0,1969,1969.0,98023,47.3198,-122.38600000000001,2540,8400,46.0,1969,2014-08-26
8/15/2014,375000.0,2,1.5,1160,1648,2.0,0.0,0.0,3,7,1160,0.0,2002,2002.0,98144,47.5916,-122.29299999999999,1458,2351,13.0,2002,2014-08-15
3/4/2015,401000.0,4,1.75,3010,12523,1.0,0.0,0.0,3,8,1780,1230.0,1952,1952.0,98125,47.707,-122.316,2040,7560,63.0,1952,2015-03-04
1/28/2015,210000.0,3,1.0,1030,4583,1.0,0.0,0.0,3,7,1030,0.0,1967,1967.0,98198,47.4231,-122.329,1730,8023,48.0,1967,2015-01-28
7/22/2014,365000.0,2,1.0,980,5110,1.0,0.0,0.0,4,7,780,200.0,1939,1939.0,98115,47.7002,-122.314,1430,5110,76.0,1939,2014-07-22
2/24/2015,178000.0,5,1.5,1990,18200,1.0,0.0,0.0,3,7,1990,0.0,1960,1960.0,98178,47.4938,-122.262,1860,8658,55.0,1960,2015-02-24
5/20/2014,710000.0,2,1.0,1790,4000,1.0,0.0,0.0,4,7,1040,750.0,1923,1923.0,98112,47.6405,-122.301,1310,4000,92.0,1923,2014-05-20
5/9/2014,255000.0,2,1.0,810,7980,1.0,0.0,0.0,1,6,810,0.0,1928,1928.0,98146,47.489,-122.337,1440,7980,87.0,1928,2014-05-09
12/4/2014,528000.0,5,2.25,2940,38009,1.0,0.0,0.0,3,8,1700,1240.0,1977,1977.0,98077,47.7653,-122.07700000000001,2620,38300,38.0,1977,2014-12-04
4/7/2015,537000.0,4,4.25,4883,26040,2.0,0.0,3.0,3,10,3859,1024.0,2006,2006.0,98092,47.26300000000001,-122.21600000000001,3736,9870,9.0,2006,2015-04-07
8/4/2014,442000.0,4,1.5,1360,6110,1.0,0.0,0.0,3,7,1010,350.0,1955,1955.0,98116,47.5755,-122.396,1520,6110,60.0,1955,2014-08-04
4/14/2015,375000.0,3,1.75,1370,19550,1.0,0.0,0.0,3,7,1370,0.0,1978,1978.0,98014,47.7002,-121.912,1430,17550,37.0,1978,2015-04-14
11/21/2014,637250.0,4,2.5,2120,3220,2.0,0.0,0.0,3,9,2120,0.0,2005,2005.0,98052,47.6662,-122.083,2120,3547,10.0,2005,2014-11-21
3/30/2015,427500.0,3,1.75,1240,7200,1.0,0.0,0.0,5,7,1240,0.0,1942,1942.0,98136,47.5142,-122.389,1640,7200,73.0,1942,2015-03-30
3/31/2015,700000.0,4,2.5,2770,89298,2.0,0.0,0.0,3,8,2770,0.0,2004,2004.0,98053,47.6624,-122.01,2650,89298,11.0,2004,2015-03-31
3/19/2015,680000.0,3,1.75,1660,5750,1.0,0.0,0.0,4,7,1080,580.0,1909,1909.0,98116,47.5843,-122.385,2060,5560,106.0,1909,2015-03-19
8/28/2014,393820.0,2,2.0,1170,8251,1.0,0.0,0.0,3,7,1170,0.0,1941,1941.0,98115,47.6873,-122.291,1360,6798,74.0,1941,2014-08-28
8/20/2014,525000.0,4,2.75,2470,7200,1.0,0.0,0.0,5,7,1350,1120.0,1940,1940.0,98108,47.5631,-122.31700000000001,1500,6000,75.0,1940,2014-08-20
1/15/2015,505000.0,2,1.75,1310,3816,1.0,0.0,0.0,2,7,1110,200.0,1929,1929.0,98117,47.678999999999995,-122.368,1510,3816,86.0,1929,2015-01-15
11/11/2014,555565.0,3,2.0,1670,11337,1.0,0.0,1.0,4,7,1670,0.0,1959,1959.0,98033,47.6602,-122.18799999999999,2210,11337,56.0,1959,2014-11-11
10/29/2014,650000.0,3,1.75,1660,10819,1.0,0.0,0.0,4,7,1240,420.0,1942,1942.0,98177,47.7045,-122.37899999999999,3110,11853,73.0,1942,2014-10-29
9/17/2014,632500.0,5,3.25,3500,7254,2.0,0.0,0.0,3,8,2760,740.0,2005,2005.0,98065,47.5444,-121.881,2820,6317,10.0,2005,2014-09-17
7/24/2014,269000.0,3,2.5,1440,3800,2.0,0.0,0.0,3,7,1440,0.0,2005,2005.0,98038,47.3606,-122.039,1890,3819,10.0,2005,2014-07-24
11/25/2014,405000.0,4,2.75,2360,7716,1.0,0.0,0.0,3,7,1390,970.0,1978,1978.0,98034,47.7301,-122.223,2160,8794,37.0,1978,2014-11-25
7/24/2014,845000.0,3,3.5,3460,15745,2.0,0.0,0.0,3,10,3460,0.0,1986,1986.0,98077,47.7262,-122.06,3350,14825,29.0,1986,2014-07-24
7/25/2014,234000.0,3,1.0,1750,8820,1.0,0.0,0.0,4,7,1750,0.0,1961,1961.0,98032,47.3608,-122.29,1400,9600,54.0,1961,2014-07-25
4/22/2015,638000.0,4,1.75,1470,4236,1.5,0.0,0.0,4,7,1470,0.0,1946,1946.0,98107,47.6692,-122.399,1480,5400,69.0,1946,2015-04-22
8/4/2014,290000.0,3,1.75,1710,10950,1.0,0.0,0.0,3,7,1060,650.0,1967,1967.0,98045,47.4678,-121.745,1180,10950,48.0,1967,2014-08-04
2/25/2015,262000.0,1,0.75,520,12981,1.0,0.0,0.0,5,3,520,0.0,1920,1920.0,98022,47.2082,-121.995,1340,12233,95.0,1920,2015-02-25
2/18/2015,270000.0,4,2.5,2350,5835,2.0,0.0,0.0,3,8,2350,0.0,2003,2003.0,98042,47.3494,-122.15299999999999,3010,5772,12.0,2003,2015-02-18
11/18/2014,875000.0,4,2.25,2380,4876,2.0,0.0,0.0,4,9,2240,140.0,1948,1948.0,98117,47.6822,-122.4,1780,4559,67.0,1948,2014-11-18
7/17/2014,299000.0,3,2.25,1920,7840,2.0,0.0,0.0,4,8,1920,0.0,1982,1982.0,98032,47.3631,-122.27600000000001,2170,7210,33.0,1982,2014-07-17
3/3/2015,551000.0,3,1.0,1580,6000,1.0,0.0,0.0,5,7,1580,0.0,1947,1947.0,98027,47.5286,-122.03200000000001,1580,6000,68.0,1947,2015-03-03
9/16/2014,350000.0,3,2.75,3070,5280,2.0,0.0,1.0,3,7,2360,710.0,1950,1986.0,98166,47.4486,-122.353,2570,18983,29.0,1986,2014-09-16
6/4/2014,1900000.0,3,2.5,2660,13367,2.0,0.0,2.0,3,10,2660,0.0,1992,1992.0,98004,47.6501,-122.21700000000001,2660,13367,23.0,1992,2014-06-04
10/27/2014,511718.0,2,1.75,1700,5000,1.0,0.0,0.0,3,6,850,850.0,1915,1915.0,98117,47.6787,-122.363,1690,5000,100.0,1915,2014-10-27
10/10/2014,965000.0,4,3.25,5010,49222,2.0,0.0,0.0,5,9,3710,1300.0,1978,1978.0,98027,47.5489,-122.09200000000001,3140,54014,37.0,1978,2014-10-10
12/16/2014,475000.0,4,2.25,2680,4673,2.0,0.0,0.0,3,7,2680,0.0,1999,1999.0,98011,47.7539,-122.219,2460,4645,16.0,1999,2014-12-16
4/15/2015,1060000.0,4,2.75,2720,4000,1.5,0.0,2.0,5,8,1840,880.0,1928,1928.0,98117,47.6797,-122.359,1600,4000,87.0,1928,2015-04-15
7/15/2014,252000.0,2,1.0,940,15450,1.0,0.0,0.0,4,6,940,0.0,1926,1926.0,98070,47.4408,-122.461,1370,34820,89.0,1926,2014-07-15
3/17/2015,580000.0,6,2.5,3596,13700,1.0,0.0,0.0,5,8,1798,1798.0,1964,1964.0,98166,47.4388,-122.339,1894,10500,51.0,1964,2015-03-17
10/20/2014,374950.0,2,2.25,1240,1172,2.0,0.0,0.0,3,8,1000,240.0,2008,2008.0,98144,47.5877,-122.316,1260,1111,7.0,2008,2014-10-20
12/16/2014,739000.0,5,4.0,4660,9900,2.0,0.0,2.0,4,9,2600,2060.0,1979,1979.0,98056,47.5135,-122.2,3380,9900,36.0,1979,2014-12-16
12/17/2014,271000.0,4,1.75,1710,7200,1.0,0.0,0.0,5,7,910,800.0,1975,1975.0,98031,47.3967,-122.17399999999999,1730,7200,40.0,1975,2014-12-17
6/13/2014,230000.0,2,1.0,930,7550,1.0,0.0,0.0,3,6,930,0.0,1986,1986.0,98168,47.4866,-122.303,1370,10176,29.0,1986,2014-06-13
4/27/2015,210000.0,3,2.25,1430,9150,1.0,0.0,0.0,3,7,1070,360.0,1984,1984.0,98023,47.3239,-122.35,1430,6364,31.0,1984,2015-04-27
2/24/2015,350000.0,3,2.75,1650,5700,2.0,0.0,0.0,4,7,1650,0.0,1988,1988.0,98166,47.4563,-122.348,1320,7620,27.0,1988,2015-02-24
5/6/2015,491500.0,3,2.25,1560,12000,1.0,0.0,0.0,4,7,1110,450.0,1968,1968.0,98034,47.7256,-122.166,2190,4612,47.0,1968,2015-05-06
9/9/2014,325000.0,3,2.5,1870,9825,1.0,0.0,0.0,4,7,1250,620.0,1994,1994.0,98045,47.4639,-121.744,1380,11475,21.0,1994,2014-09-09
10/6/2014,190000.0,3,2.0,1320,7625,1.0,0.0,0.0,3,7,1320,0.0,1987,1987.0,98038,47.3635,-122.045,1420,7500,28.0,1987,2014-10-06
5/4/2015,658600.0,4,2.0,1400,4690,1.5,0.0,0.0,4,7,1400,0.0,1945,1945.0,98117,47.6826,-122.37799999999999,1400,4690,70.0,1945,2015-05-04
3/27/2015,299950.0,3,1.5,1940,8951,1.0,0.0,0.0,3,7,1300,640.0,1958,1958.0,98168,47.473,-122.32799999999999,2000,8319,57.0,1958,2015-03-27
3/30/2015,464000.0,5,2.0,2000,3000,1.5,0.0,0.0,3,6,1200,800.0,1931,1931.0,98122,47.6028,-122.29799999999999,1330,4000,84.0,1931,2015-03-30
6/25/2014,308000.0,3,1.0,1640,18144,1.5,0.0,0.0,3,6,1640,0.0,1942,1942.0,98168,47.5027,-122.33,1500,9065,73.0,1942,2014-06-25
1/29/2015,625000.0,3,1.0,1020,7650,1.0,0.0,0.0,3,6,1020,0.0,1919,1919.0,98033,47.6795,-122.20200000000001,1870,5500,96.0,1919,2015-01-29
2/5/2015,240000.0,3,1.75,1630,9450,1.0,0.0,0.0,4,7,1080,550.0,1977,1977.0,98032,47.3729,-122.295,1280,9100,38.0,1977,2015-02-05
5/4/2015,530000.0,4,2.5,2940,35996,2.0,0.0,0.0,3,9,2940,0.0,1995,1995.0,98042,47.3401,-122.06700000000001,2890,35089,20.0,1995,2015-05-04
10/20/2014,1000000.0,5,4.5,2120,8944,2.0,1.0,4.0,5,8,2120,0.0,1939,1963.0,98006,47.5488,-122.197,2870,8944,52.0,1963,2014-10-20
9/25/2014,439000.0,1,1.0,790,2400,1.0,0.0,0.0,3,7,790,0.0,1918,1918.0,98122,47.6178,-122.29899999999999,1580,2566,97.0,1918,2014-09-25
5/11/2015,575000.0,4,1.75,2020,6200,1.0,0.0,0.0,4,6,1010,1010.0,1948,1948.0,98133,47.7013,-122.35,1440,4158,67.0,1948,2015-05-11
10/21/2014,418000.0,3,1.75,1530,7238,1.0,0.0,0.0,3,7,1530,0.0,1959,1959.0,98155,47.7629,-122.315,1580,7238,56.0,1959,2014-10-21
4/28/2015,1210000.0,4,3.75,3250,10949,2.0,0.0,0.0,4,9,2940,310.0,1930,1930.0,98004,47.638999999999996,-122.219,2340,15234,85.0,1930,2015-04-28
6/3/2014,1100000.0,4,3.75,2930,3200,1.5,0.0,0.0,5,9,2130,800.0,1925,1925.0,98119,47.643,-122.359,1900,4320,90.0,1925,2014-06-03
4/15/2015,1900000.0,3,3.75,3150,8550,2.0,0.0,0.0,3,10,3150,0.0,2007,2007.0,98112,47.6387,-122.28399999999999,2510,8550,8.0,2007,2015-04-15
11/26/2014,580000.0,3,2.5,2180,40278,2.0,0.0,0.0,3,9,2180,0.0,1985,1985.0,98072,47.733000000000004,-122.09,2630,40000,30.0,1985,2014-11-26
3/11/2015,380000.0,2,1.0,1040,7372,1.0,0.0,0.0,5,7,840,200.0,1939,1939.0,98126,47.5285,-122.37799999999999,1930,5150,76.0,1939,2015-03-11
7/23/2014,256000.0,3,1.0,880,5375,1.0,0.0,0.0,4,5,880,0.0,1924,1924.0,98055,47.4858,-122.20200000000001,980,4838,91.0,1924,2014-07-23
5/15/2014,349950.0,3,1.0,1400,7066,1.0,0.0,0.0,3,8,1400,0.0,1957,1957.0,98125,47.7127,-122.325,1400,7320,58.0,1957,2014-05-15
7/1/2014,691500.0,4,2.5,2600,7200,2.0,0.0,0.0,3,7,2600,0.0,1962,2002.0,98115,47.6944,-122.274,1790,6175,13.0,2002,2014-07-01
10/31/2014,556000.0,3,1.75,1590,2500,1.5,0.0,0.0,4,7,1190,400.0,1908,1908.0,98105,47.6668,-122.29899999999999,1420,3800,107.0,1908,2014-10-31
11/20/2014,218000.0,3,2.25,1610,7084,1.0,0.0,0.0,4,8,1280,330.0,1968,1968.0,98023,47.3146,-122.384,2170,8505,47.0,1968,2014-11-20
12/5/2014,425000.0,4,2.0,1390,4500,1.5,0.0,0.0,5,7,1390,0.0,1908,1908.0,98108,47.5552,-122.311,1900,5460,107.0,1908,2014-12-05
8/22/2014,935000.0,3,3.25,3710,38509,2.0,0.0,0.0,3,10,3710,0.0,1998,1998.0,98014,47.69300000000001,-121.868,1680,25865,17.0,1998,2014-08-22
10/7/2014,732000.0,4,1.75,2360,11300,1.0,0.0,0.0,4,9,2360,0.0,1974,1974.0,98006,47.5728,-122.163,2290,11951,41.0,1974,2014-10-07
1/27/2015,805500.0,3,1.0,1440,10330,1.0,0.0,0.0,4,7,1440,0.0,1952,1952.0,98004,47.6245,-122.193,2080,10327,63.0,1952,2015-01-27
2/4/2015,507250.0,3,1.75,1400,5750,1.0,0.0,2.0,3,6,1100,300.0,1915,1915.0,98126,47.5659,-122.38,1500,5175,100.0,1915,2015-02-04
12/2/2014,800000.0,4,2.5,4600,67369,2.0,0.0,0.0,3,10,4600,0.0,1990,1990.0,98053,47.6417,-121.992,4600,67369,25.0,1990,2014-12-02
9/3/2014,600000.0,3,2.25,2100,8276,2.0,0.0,1.0,4,8,2100,0.0,1979,1979.0,98008,47.6068,-122.11200000000001,2420,18135,36.0,1979,2014-09-03
3/17/2015,627800.0,4,1.75,2010,12044,1.0,0.0,0.0,3,9,2010,0.0,1982,1982.0,98074,47.6446,-122.068,2200,11144,33.0,1982,2015-03-17
6/24/2014,660000.0,2,2.25,2550,6000,2.0,0.0,0.0,5,7,1860,690.0,1902,1902.0,98115,47.6739,-122.323,2010,4000,113.0,1902,2014-06-24
10/9/2014,153503.0,2,2.5,1240,3649,2.0,0.0,0.0,3,7,1240,0.0,1986,1986.0,98003,47.3241,-122.322,1400,3721,29.0,1986,2014-10-09
1/20/2015,456500.0,3,2.25,2090,9163,1.0,0.0,0.0,3,7,1460,630.0,1975,1975.0,98034,47.7334,-122.167,1960,7713,40.0,1975,2015-01-20
8/1/2014,1310000.0,5,2.5,2770,8100,2.0,0.0,0.0,3,9,2770,0.0,2002,2002.0,98004,47.6341,-122.208,2070,8100,13.0,2002,2014-08-01
12/7/2014,843500.0,3,2.5,3560,11448,2.0,0.0,0.0,3,11,3560,0.0,1997,1997.0,98052,47.7126,-122.104,3290,11506,18.0,1997,2014-12-07
8/18/2014,625000.0,3,1.0,1240,4080,1.0,0.0,0.0,3,7,1240,0.0,1925,1925.0,98103,47.667,-122.333,2060,4080,90.0,1925,2014-08-18
6/11/2014,527000.0,2,1.75,1640,4080,1.0,0.0,0.0,3,7,840,800.0,1921,1921.0,98105,47.6645,-122.32600000000001,1980,4080,94.0,1921,2014-06-11
2/26/2015,1970000.0,5,3.75,3940,13738,1.5,0.0,3.0,4,9,3940,0.0,1951,1951.0,98004,47.6203,-122.212,2370,13320,64.0,1951,2015-02-26
3/26/2015,1000000.0,5,2.5,3150,50094,2.0,0.0,0.0,4,9,3150,0.0,1969,1969.0,98005,47.6387,-122.177,3600,48787,46.0,1969,2015-03-26
2/25/2015,855000.0,4,3.0,2550,5300,2.0,0.0,0.0,3,8,1720,830.0,1908,2013.0,98117,47.6786,-122.367,1590,4505,2.0,2013,2015-02-25
6/20/2014,725000.0,4,3.25,3940,27591,2.0,0.0,3.0,3,9,3440,500.0,2000,2000.0,98059,47.5157,-122.116,3420,29170,15.0,2000,2014-06-20
10/15/2014,315000.0,1,1.0,580,7200,1.0,0.0,0.0,3,6,580,0.0,2000,2000.0,98126,47.5249,-122.37299999999999,1360,7560,15.0,2000,2014-10-15
9/24/2014,180000.0,3,1.75,1330,16000,1.0,0.0,0.0,3,7,1330,0.0,1978,1978.0,98001,47.28,-122.257,1330,14374,37.0,1978,2014-09-24
3/13/2015,700000.0,2,1.0,930,5000,1.0,0.0,3.0,3,7,930,0.0,1926,2013.0,98136,47.5333,-122.38799999999999,1760,5228,2.0,2013,2015-03-13
8/11/2014,476500.0,3,1.0,1060,8625,2.0,0.0,0.0,4,7,1060,0.0,1962,1997.0,98033,47.6615,-122.179,2010,8901,18.0,1997,2014-08-11
6/3/2014,193000.0,3,1.5,1180,9048,1.0,0.0,0.0,3,7,1180,0.0,1960,1960.0,98148,47.4327,-122.32799999999999,1460,8942,55.0,1960,2014-06-03
8/19/2014,295000.0,4,2.5,1850,6663,2.0,0.0,0.0,3,7,1850,0.0,1990,1990.0,98030,47.3618,-122.195,1850,6417,25.0,1990,2014-08-19
7/31/2014,363000.0,2,1.0,820,4880,1.0,0.0,0.0,4,6,820,0.0,1925,1925.0,98136,47.5483,-122.39399999999999,1320,4880,90.0,1925,2014-07-31
1/29/2015,875000.0,4,2.5,3600,21794,2.0,0.0,0.0,4,11,3600,0.0,1990,1990.0,98077,47.7121,-122.072,3410,19864,25.0,1990,2015-01-29
5/14/2014,257200.0,3,2.0,1850,8250,1.0,0.0,0.0,4,7,1150,700.0,1952,1952.0,98002,47.3066,-122.209,1580,7153,63.0,1952,2014-05-14
9/29/2014,555000.0,3,2.0,2240,11250,1.0,0.0,0.0,3,8,2240,0.0,1968,1968.0,98008,47.6371,-122.119,2200,12500,47.0,1968,2014-09-29
6/24/2014,380000.0,3,2.25,1860,15559,2.0,0.0,0.0,4,7,1860,0.0,1963,1963.0,98022,47.1559,-121.646,1110,11586,52.0,1963,2014-06-24
7/25/2014,282000.0,4,2.75,2390,7330,2.0,0.0,0.0,3,7,2390,0.0,1989,1989.0,98023,47.3061,-122.359,1980,6735,26.0,1989,2014-07-25
6/6/2014,545000.0,4,2.5,2040,6034,2.0,0.0,0.0,3,7,2040,0.0,1990,1990.0,98115,47.6952,-122.323,1380,5986,25.0,1990,2014-06-06
6/6/2014,550000.0,3,1.5,1900,5000,1.5,0.0,0.0,3,7,1640,260.0,1926,1926.0,98115,47.6779,-122.294,2090,5000,89.0,1926,2014-06-06
3/13/2015,921500.0,3,1.5,1900,5000,1.5,0.0,0.0,3,7,1640,260.0,1926,1926.0,98115,47.6779,-122.294,2090,5000,89.0,1926,2015-03-13
5/12/2015,885000.0,3,1.5,2200,2880,2.0,0.0,0.0,5,7,1440,760.0,1904,1904.0,98112,47.6308,-122.31200000000001,2440,4640,111.0,1904,2015-05-12
5/29/2014,820000.0,4,2.25,2280,6660,1.5,0.0,2.0,3,8,1960,320.0,1940,1940.0,98119,47.6503,-122.368,1720,5336,75.0,1940,2014-05-29
5/13/2014,289000.0,3,1.0,1090,7315,1.0,0.0,0.0,5,6,1090,0.0,1981,1981.0,98056,47.494,-122.165,1090,5800,34.0,1981,2014-05-13
2/13/2015,334000.0,1,1.0,670,5750,1.0,0.0,0.0,3,7,670,0.0,1942,2011.0,98116,47.5624,-122.39399999999999,1170,5750,4.0,2011,2015-02-13
10/28/2014,206000.0,3,1.0,1050,5233,1.0,0.0,0.0,5,5,1050,0.0,1906,1906.0,98010,47.3106,-121.999,970,7500,109.0,1906,2014-10-28
6/30/2014,491950.0,3,2.25,2090,10733,1.0,0.0,0.0,3,7,1440,650.0,1958,1958.0,98115,47.6971,-122.281,1740,8100,57.0,1958,2014-06-30
11/13/2014,430000.0,3,2.5,2030,7770,2.0,0.0,0.0,3,8,2030,0.0,2003,2003.0,98024,47.5253,-121.93,1360,10782,12.0,2003,2014-11-13
7/18/2014,208000.0,3,2.0,1250,7995,1.0,0.0,0.0,4,7,1250,0.0,1980,1980.0,98042,47.3684,-122.09200000000001,1540,7650,35.0,1980,2014-07-18
7/8/2014,245000.0,4,2.25,2600,6390,1.0,0.0,0.0,3,8,1390,1210.0,1978,1978.0,98023,47.3174,-122.366,2110,6700,37.0,1978,2014-07-08
3/18/2015,426000.0,2,1.0,640,2500,1.0,0.0,0.0,4,6,640,0.0,1918,1918.0,98117,47.6776,-122.361,1460,4200,97.0,1918,2015-03-18
8/1/2014,400000.0,3,2.5,2120,3742,2.0,0.0,0.0,3,7,2120,0.0,2006,2006.0,98059,47.4787,-122.12899999999999,2250,4696,9.0,2006,2014-08-01
4/14/2015,553000.0,3,1.0,1330,5100,1.0,0.0,0.0,3,7,900,430.0,1942,1942.0,98115,47.6837,-122.291,1500,5100,73.0,1942,2015-04-14
3/31/2015,296000.0,2,1.0,750,4680,1.0,0.0,0.0,3,5,750,0.0,1948,1948.0,98117,47.6919,-122.37100000000001,1450,4400,67.0,1948,2015-03-31
2/17/2015,428000.0,3,2.5,2230,32660,1.0,0.0,0.0,4,8,2230,0.0,1977,1977.0,98042,47.3321,-122.105,2400,33120,38.0,1977,2015-02-17
5/6/2014,325000.0,4,2.5,1890,6156,1.0,0.0,0.0,3,7,980,910.0,1980,1980.0,98106,47.551,-122.35600000000001,1590,6954,35.0,1980,2014-05-06
7/21/2014,294000.0,2,1.0,820,6366,1.0,0.0,0.0,5,6,820,0.0,1952,1952.0,98133,47.7512,-122.34,1580,10169,63.0,1952,2014-07-21
3/19/2015,410000.0,3,1.75,1880,8424,1.0,0.0,0.0,4,7,1380,500.0,1977,1977.0,98059,47.5116,-122.161,1970,8523,38.0,1977,2015-03-19
6/3/2014,590000.0,4,4.25,2360,57514,2.0,0.0,0.0,4,8,2360,0.0,1939,1939.0,98003,47.2843,-122.294,2037,35733,76.0,1939,2014-06-03
11/20/2014,445000.0,3,2.25,1850,4050,2.0,0.0,0.0,4,7,1850,0.0,1985,1985.0,98029,47.5669,-122.01700000000001,1650,4468,30.0,1985,2014-11-20
3/25/2015,921000.0,4,2.5,2310,5362,2.0,0.0,4.0,4,8,2010,300.0,1928,1928.0,98122,47.6044,-122.28399999999999,2530,5960,87.0,1928,2015-03-25
3/4/2015,496000.0,3,1.5,2520,37616,1.0,0.0,0.0,3,8,2520,0.0,1955,1955.0,98045,47.4777,-121.76299999999999,1470,33750,60.0,1955,2015-03-04
12/12/2014,95000.0,2,1.0,800,8550,1.0,0.0,0.0,3,7,800,0.0,1947,1947.0,98198,47.4075,-122.294,1490,8550,68.0,1947,2014-12-12
9/25/2014,359000.0,4,1.75,1580,6396,1.0,0.0,0.0,4,6,790,790.0,1945,1945.0,98126,47.5378,-122.369,1180,6396,70.0,1945,2014-09-25
5/2/2014,452500.0,3,2.5,2430,88426,1.0,0.0,0.0,4,7,1570,860.0,1985,1985.0,98045,47.4828,-121.71799999999999,1560,56827,30.0,1985,2014-05-02
12/2/2014,555000.0,4,1.75,2350,6200,1.5,0.0,0.0,4,7,1410,940.0,1946,1946.0,98116,47.559,-122.397,1800,6150,69.0,1946,2014-12-02
9/24/2014,549900.0,5,3.0,3800,42316,1.5,0.0,0.0,4,9,3800,0.0,1984,1984.0,98042,47.3488,-122.095,2580,35775,31.0,1984,2014-09-24
6/10/2014,569000.0,5,3.0,3670,10583,1.0,0.0,0.0,5,8,2060,1610.0,1952,1952.0,98155,47.7589,-122.277,2720,13865,63.0,1952,2014-06-10
7/16/2014,318500.0,4,2.0,1780,7350,1.0,0.0,0.0,5,7,900,880.0,1974,1974.0,98058,47.4562,-122.15799999999999,1480,7350,41.0,1974,2014-07-16
6/11/2014,487028.0,2,1.5,1295,1093,2.0,0.0,0.0,3,9,1105,190.0,2007,2007.0,98112,47.6192,-122.29899999999999,1295,1413,8.0,2007,2014-06-11
10/15/2014,240000.0,3,1.0,1350,7560,1.0,0.0,0.0,4,7,950,400.0,1959,1959.0,98032,47.3784,-122.303,1470,7560,56.0,1959,2014-10-15
2/2/2015,253000.0,3,2.25,1440,9806,1.0,0.0,0.0,3,7,1440,0.0,1965,1965.0,98030,47.3857,-122.212,1590,9782,50.0,1965,2015-02-02
8/31/2014,380000.0,5,1.75,1320,38125,1.0,0.0,0.0,4,7,1120,200.0,1947,1947.0,98198,47.3937,-122.323,2360,15070,68.0,1947,2014-08-31
4/6/2015,250000.0,2,0.75,700,16828,1.0,0.0,0.0,4,6,700,0.0,1958,1958.0,98092,47.3009,-122.125,2010,29316,57.0,1958,2015-04-06
10/10/2014,368500.0,2,1.75,2510,19141,2.0,0.0,0.0,3,9,2510,0.0,1977,1977.0,98092,47.3103,-122.199,2400,13030,38.0,1977,2014-10-10
2/11/2015,340000.0,3,1.0,3180,27586,1.0,0.0,0.0,3,8,1400,1780.0,1969,1969.0,98022,47.1986,-121.96700000000001,2180,27586,46.0,1969,2015-02-11
4/27/2015,400000.0,2,1.0,910,4000,1.0,0.0,0.0,3,7,910,0.0,1918,1918.0,98136,47.5427,-122.38799999999999,1060,1346,97.0,1918,2015-04-27
9/16/2014,835000.0,3,2.0,1570,4625,1.5,0.0,0.0,5,8,1570,0.0,1927,1927.0,98117,47.68,-122.399,1760,4625,88.0,1927,2014-09-16
12/1/2014,299000.0,3,2.5,2450,7062,2.0,0.0,0.0,3,8,2450,0.0,1993,1993.0,98023,47.3061,-122.36,1960,7200,22.0,1993,2014-12-01
11/7/2014,1680000.0,6,2.25,4910,6600,2.5,0.0,0.0,5,10,3580,1330.0,1910,1910.0,98102,47.6458,-122.32,3280,5500,105.0,1910,2014-11-07
5/14/2014,265000.0,3,2.0,1570,5706,1.0,0.0,0.0,3,7,1570,0.0,1998,1998.0,98092,47.3156,-122.18799999999999,1570,5706,17.0,1998,2014-05-14
11/11/2014,437500.0,4,2.5,2680,7513,2.0,0.0,0.0,3,8,2680,0.0,1998,1998.0,98059,47.4956,-122.161,2640,7243,17.0,1998,2014-11-11
6/4/2014,865000.0,3,1.75,2090,4725,2.0,0.0,0.0,3,7,1610,480.0,1947,2013.0,98199,47.657,-122.39399999999999,1280,4725,2.0,2013,2014-06-04
3/11/2015,626000.0,3,2.0,2150,7200,1.0,0.0,0.0,3,8,2150,0.0,1988,1988.0,98029,47.5709,-122.01799999999999,2510,7222,27.0,1988,2015-03-11
10/28/2014,247300.0,2,2.0,1140,1118,2.0,0.0,0.0,3,7,1040,100.0,2009,2009.0,98144,47.596000000000004,-122.311,1140,1118,6.0,2009,2014-10-28
6/23/2014,2080000.0,4,3.5,4230,20377,2.0,0.0,0.0,3,11,4230,0.0,1997,1997.0,98004,47.5954,-122.206,3980,20489,18.0,1997,2014-06-23
10/1/2014,425000.0,3,1.0,1790,6000,1.5,0.0,0.0,2,8,1790,0.0,1937,1937.0,98108,47.5448,-122.32,1060,4000,78.0,1937,2014-10-01
6/25/2014,905000.0,5,3.5,3100,10200,1.0,0.0,4.0,3,9,1660,1440.0,1970,1970.0,98008,47.6134,-122.11200000000001,2700,10455,45.0,1970,2014-06-25
8/27/2014,641250.0,3,2.5,2220,2550,3.0,0.0,2.0,3,10,2220,0.0,1990,1990.0,98117,47.6963,-122.39299999999999,2200,5610,25.0,1990,2014-08-27
3/31/2015,675000.0,4,2.5,2370,9679,2.0,0.0,0.0,3,8,2370,0.0,1984,1984.0,98027,47.5631,-122.085,2290,7944,31.0,1984,2015-03-31
6/13/2014,845000.0,4,2.75,4070,115434,2.0,0.0,0.0,3,9,4070,0.0,2002,2002.0,98045,47.4843,-121.75200000000001,2970,95832,13.0,2002,2014-06-13
9/7/2014,401500.0,4,1.0,1790,8400,1.0,0.0,0.0,4,7,1260,530.0,1954,1954.0,98133,47.7627,-122.353,1470,8400,61.0,1954,2014-09-07
9/23/2014,395000.0,3,2.5,1610,3755,2.0,0.0,0.0,3,7,1610,0.0,1987,1987.0,98052,47.6825,-122.09700000000001,1300,3823,28.0,1987,2014-09-23
3/6/2015,1100000.0,5,2.75,2830,18050,1.0,0.0,0.0,5,7,1630,1200.0,1958,1958.0,98040,47.5773,-122.226,2370,14250,57.0,1958,2015-03-06
5/29/2014,145000.0,3,1.0,1010,5490,1.0,0.0,0.0,3,6,1010,0.0,1954,1954.0,98168,47.4762,-122.29299999999999,1740,10658,61.0,1954,2014-05-29
4/16/2015,900000.0,3,1.0,1560,3825,1.5,0.0,0.0,3,8,1390,170.0,1930,1930.0,98117,47.6803,-122.387,1700,5100,85.0,1930,2015-04-16
1/12/2015,374500.0,3,1.5,1330,8636,1.0,0.0,0.0,4,7,1330,0.0,1968,1968.0,98034,47.7289,-122.20299999999999,1370,7475,47.0,1968,2015-01-12
11/18/2014,850000.0,4,2.25,2330,10451,2.0,0.0,0.0,4,8,2330,0.0,1965,1965.0,98005,47.6044,-122.16799999999999,1880,8400,50.0,1965,2014-11-18
4/25/2015,490000.0,3,1.0,960,5750,1.0,0.0,0.0,3,7,960,0.0,1951,1951.0,98116,47.5689,-122.39299999999999,1520,5750,64.0,1951,2015-04-25
4/27/2015,304000.0,3,2.5,1710,6773,2.0,0.0,0.0,3,8,1710,0.0,1993,1993.0,98003,47.2635,-122.31200000000001,2220,7551,22.0,1993,2015-04-27
7/3/2014,400000.0,4,2.25,2230,7200,1.0,0.0,0.0,4,7,1300,930.0,1963,1963.0,98133,47.7648,-122.33,2010,7752,52.0,1963,2014-07-03
11/14/2014,454000.0,3,2.0,1700,10000,2.0,0.0,0.0,3,8,1700,0.0,1992,1992.0,98011,47.7661,-122.205,1460,9621,23.0,1992,2014-11-14
12/24/2014,160000.0,2,2.0,1040,4750,1.0,0.0,0.0,2,6,850,190.0,1950,1950.0,98118,47.5293,-122.272,1350,5000,65.0,1950,2014-12-24
7/8/2014,542000.0,3,1.75,1070,8030,1.0,0.0,0.0,3,7,1070,0.0,1966,2014.0,98052,47.67,-122.155,1540,7875,1.0,2014,2014-07-08
6/18/2014,403500.0,5,2.5,3600,17300,1.0,0.0,0.0,4,8,2410,1190.0,1968,1968.0,98166,47.4468,-122.34100000000001,2620,30200,47.0,1968,2014-06-18
3/16/2015,418000.0,4,2.5,2750,8471,2.0,0.0,0.0,3,7,2750,0.0,2003,2003.0,98038,47.3671,-122.029,2610,7482,12.0,2003,2015-03-16
3/26/2015,406000.0,4,1.5,1920,6000,2.0,0.0,1.0,3,7,1920,0.0,1951,1951.0,98198,47.4029,-122.321,1920,6000,64.0,1951,2015-03-26
9/23/2014,242500.0,3,2.25,1770,10000,1.0,0.0,0.0,3,7,1340,430.0,1978,1978.0,98198,47.3814,-122.322,1270,5055,37.0,1978,2014-09-23
4/7/2015,425000.0,4,2.5,2460,5440,2.0,0.0,0.0,3,9,2460,0.0,2003,2003.0,98058,47.448,-122.12100000000001,2460,5124,12.0,2003,2015-04-07
5/15/2014,613000.0,4,2.0,1550,4815,1.5,0.0,0.0,3,7,1550,0.0,1909,1909.0,98103,47.667,-122.336,1680,4013,106.0,1909,2014-05-15
12/30/2014,189000.0,3,2.0,1460,11481,1.0,0.0,0.0,2,7,1170,290.0,1995,1995.0,98045,47.4493,-121.777,1540,9680,20.0,1995,2014-12-30
10/30/2014,700000.0,4,2.25,2440,9450,1.5,0.0,0.0,3,7,2440,0.0,1947,1947.0,98125,47.7061,-122.307,1720,7503,68.0,1947,2014-10-30
9/2/2014,750000.0,3,1.0,1640,6516,1.5,0.0,0.0,4,7,1440,200.0,1935,1935.0,98103,47.6693,-122.339,1770,4000,80.0,1935,2014-09-02
7/7/2014,494000.0,2,1.0,1290,4650,1.0,0.0,0.0,4,7,1290,0.0,1906,1906.0,98115,47.6877,-122.325,1640,3900,109.0,1906,2014-07-07
6/9/2014,700000.0,4,3.0,3150,7778,2.0,0.0,0.0,3,9,3150,0.0,2000,2000.0,98075,47.5972,-122.01799999999999,2970,6500,15.0,2000,2014-06-09
4/3/2015,705000.0,2,2.5,2305,5580,1.0,0.0,0.0,3,8,2305,0.0,2007,2007.0,98077,47.7203,-122.024,1440,5748,8.0,2007,2015-04-03
5/22/2014,356000.0,2,1.75,1060,16470,1.0,0.0,0.0,3,7,1060,0.0,1977,1977.0,98072,47.7409,-122.089,1790,16748,38.0,1977,2014-05-22
5/22/2014,625000.0,3,1.75,2060,12558,1.0,0.0,0.0,4,7,1350,710.0,1984,1984.0,98052,47.6659,-122.14399999999999,1850,8722,31.0,1984,2014-05-22
3/12/2015,144975.0,2,1.0,900,7500,1.0,0.0,0.0,3,5,900,0.0,1940,1940.0,98198,47.4177,-122.319,1350,7500,75.0,1940,2015-03-12
7/28/2014,970000.0,4,4.5,3890,5906,2.0,0.0,3.0,3,11,3060,0.0,2004,2004.0,98029,47.5426,-121.995,4170,6052,11.0,2004,2014-07-28
6/6/2014,415000.0,3,1.75,1910,12596,1.0,0.0,0.0,3,7,1340,570.0,1977,1977.0,98072,47.7399,-122.09899999999999,1550,13310,38.0,1977,2014-06-06
5/5/2014,485000.0,4,3.0,2340,7048,1.0,0.0,0.0,4,8,1340,1000.0,1979,1979.0,98034,47.7306,-122.227,1440,8088,36.0,1979,2014-05-05
11/7/2014,799950.0,3,3.0,2900,11769,2.0,0.0,0.0,3,10,2900,0.0,1997,1997.0,98052,47.6993,-122.118,2900,9611,18.0,1997,2014-11-07
4/29/2015,783350.0,4,2.5,3290,35001,2.0,0.0,0.0,3,10,3290,0.0,1991,1991.0,98077,47.7231,-122.038,4090,40371,24.0,1991,2015-04-29
12/19/2014,430000.0,1,1.0,630,1362,1.0,0.0,0.0,3,7,630,0.0,1943,1943.0,98109,47.6342,-122.34200000000001,1090,1376,72.0,1943,2014-12-19
11/24/2014,2540000.0,5,4.75,5410,13431,2.0,0.0,0.0,4,10,5050,360.0,1941,1941.0,98112,47.6306,-122.288,3750,11596,74.0,1941,2014-11-24
6/18/2014,975000.0,4,2.5,4270,43386,1.0,0.0,0.0,3,10,2680,1590.0,1991,1991.0,98053,47.6915,-122.053,3630,36180,24.0,1991,2014-06-18
5/5/2015,950000.0,3,1.5,1700,8050,1.0,0.0,0.0,3,7,1130,570.0,1950,1950.0,98004,47.6304,-122.21799999999999,2920,12239,65.0,1950,2015-05-05
8/6/2014,350000.0,2,1.0,1430,8157,1.5,0.0,0.0,3,7,1150,280.0,1944,1944.0,98177,47.7256,-122.361,1820,8157,71.0,1944,2014-08-06
11/3/2014,637000.0,4,2.75,2850,7510,2.0,0.0,0.0,3,8,2850,0.0,2008,2008.0,98125,47.7097,-122.305,1510,8833,7.0,2008,2014-11-03
2/19/2015,895000.0,3,2.0,2160,105415,1.0,0.0,0.0,3,10,2160,0.0,1991,1991.0,98059,47.4806,-122.152,2760,9620,24.0,1991,2015-02-19
12/5/2014,579000.0,2,2.0,1760,7200,1.0,0.0,0.0,5,7,880,880.0,1946,1946.0,98118,47.5658,-122.27600000000001,1760,7200,69.0,1946,2014-12-05
6/24/2014,314900.0,4,1.75,2700,27072,1.0,0.0,0.0,3,7,1380,1320.0,1958,1958.0,98003,47.2877,-122.29299999999999,2460,34850,57.0,1958,2014-06-24
1/27/2015,122000.0,2,1.0,860,6000,1.0,0.0,0.0,3,6,860,0.0,1945,1945.0,98022,47.2109,-121.985,1300,6000,70.0,1945,2015-01-27
8/8/2014,405000.0,2,1.0,880,3000,1.0,0.0,0.0,5,7,880,0.0,1927,1927.0,98103,47.6868,-122.34899999999999,1300,3000,88.0,1927,2014-08-08
5/8/2014,553650.0,2,2.5,1360,1349,2.0,0.0,0.0,3,8,1050,310.0,1997,1997.0,98112,47.6254,-122.292,1430,4400,18.0,1997,2014-05-08
2/3/2015,369900.0,2,2.5,1770,1853,3.0,0.0,0.0,3,8,1770,0.0,2007,2007.0,98126,47.5472,-122.37100000000001,1770,1924,8.0,2007,2015-02-03
5/28/2014,225000.0,3,2.0,2030,24829,1.0,0.0,0.0,4,7,1220,810.0,1979,1979.0,98001,47.2718,-122.291,1980,15204,36.0,1979,2014-05-28
5/27/2014,160000.0,2,1.0,1180,9350,1.0,0.0,0.0,3,6,1180,0.0,1918,1918.0,98178,47.4889,-122.259,1780,9306,97.0,1918,2014-05-27
10/9/2014,449500.0,4,2.0,2430,199940,1.0,0.0,0.0,3,8,1310,1120.0,1961,1961.0,98038,47.4116,-122.029,2220,150282,54.0,1961,2014-10-09
8/28/2014,650000.0,3,1.0,1300,8266,1.0,0.0,0.0,4,7,1300,0.0,1953,1953.0,98004,47.6337,-122.199,1300,8707,62.0,1953,2014-08-28
7/16/2014,542126.0,4,2.5,2360,43088,2.0,0.0,0.0,3,8,2360,0.0,1977,1977.0,98077,47.7661,-122.071,2850,39216,38.0,1977,2014-07-16
9/19/2014,309950.0,3,1.5,1200,15606,1.0,0.0,0.0,3,7,1200,0.0,1985,1985.0,98045,47.4752,-121.755,1210,15606,30.0,1985,2014-09-19
12/5/2014,115000.0,2,1.0,1000,16524,1.0,0.0,0.0,3,5,1000,0.0,1913,1913.0,98001,47.2841,-122.255,1350,10208,102.0,1913,2014-12-05
12/31/2014,221700.0,2,1.5,1556,20000,1.0,0.0,0.0,4,7,1556,0.0,1957,1957.0,98032,47.3891,-122.28200000000001,2250,17286,58.0,1957,2014-12-31
1/27/2015,726000.0,3,2.5,1890,3880,1.5,0.0,0.0,4,8,1460,430.0,1915,1915.0,98107,47.6642,-122.36200000000001,1010,3880,100.0,1915,2015-01-27
11/19/2014,515000.0,3,1.75,1810,5733,1.0,0.0,0.0,4,7,1010,800.0,1926,1926.0,98116,47.5709,-122.38799999999999,1260,4680,89.0,1926,2014-11-19
8/26/2014,756000.0,4,2.5,2730,10753,2.0,0.0,0.0,3,9,2730,0.0,1991,1991.0,98006,47.5414,-122.133,3090,10740,24.0,1991,2014-08-26
5/27/2014,1570000.0,4,3.75,3070,5850,2.0,0.0,0.0,5,9,2400,670.0,1927,1927.0,98112,47.633,-122.28299999999999,2940,5573,88.0,1927,2014-05-27
5/21/2014,442000.0,4,2.25,2080,12007,1.0,0.0,0.0,4,8,1220,860.0,1979,1979.0,98074,47.6259,-122.051,2110,12459,36.0,1979,2014-05-21
7/2/2014,260000.0,4,2.0,1620,7992,2.0,0.0,0.0,4,7,1620,0.0,1975,1975.0,98031,47.395,-122.176,1710,7500,40.0,1975,2014-07-02
9/10/2014,390000.0,2,1.75,1150,2723,1.0,0.0,0.0,4,7,770,380.0,1923,1923.0,98102,47.6357,-122.322,1440,4000,92.0,1923,2014-09-10
7/1/2014,459500.0,2,1.0,1250,3825,1.0,0.0,0.0,3,7,850,400.0,1929,1929.0,98117,47.6805,-122.38,1370,4998,86.0,1929,2014-07-01
9/30/2014,330000.0,3,1.5,1430,8000,1.0,0.0,0.0,5,7,1430,0.0,1948,1948.0,98155,47.772,-122.322,1410,9820,67.0,1948,2014-09-30
11/3/2014,189000.0,2,1.0,790,7128,1.0,0.0,0.0,3,6,790,0.0,1944,1944.0,98168,47.4873,-122.324,1110,7150,71.0,1944,2014-11-03
12/11/2014,280000.0,3,1.0,1200,9322,1.5,0.0,0.0,4,7,1200,0.0,1954,1954.0,98030,47.3749,-122.225,1540,9677,61.0,1954,2014-12-11
5/5/2014,400000.0,2,1.75,2110,9519,1.0,0.0,0.0,2,7,2110,0.0,1948,1948.0,98155,47.7504,-122.306,1480,9519,67.0,1948,2014-05-05
3/25/2015,368000.0,4,2.0,3160,11193,1.0,0.0,0.0,5,6,2410,750.0,1942,1942.0,98056,47.4937,-122.184,1020,5940,73.0,1942,2015-03-25
6/9/2014,390000.0,4,1.75,2700,7875,1.5,0.0,0.0,4,8,2700,0.0,1968,1968.0,98058,47.45399999999999,-122.14399999999999,2220,7875,47.0,1968,2014-06-09
9/30/2014,245000.0,2,1.0,820,7475,1.0,0.0,0.0,3,6,820,0.0,1945,1945.0,98133,47.7321,-122.34100000000001,1030,5720,70.0,1945,2014-09-30
8/6/2014,375000.0,4,2.5,1800,8432,1.0,0.0,0.0,4,7,1200,600.0,1960,1960.0,98133,47.7463,-122.336,1780,8432,55.0,1960,2014-08-06
1/30/2015,465000.0,5,1.5,1750,12491,1.0,0.0,0.0,3,6,1390,360.0,1961,1961.0,98033,47.6995,-122.17399999999999,1560,12473,54.0,1961,2015-01-30
3/12/2015,445000.0,3,2.0,1540,67953,1.0,0.0,0.0,3,7,1540,0.0,1997,1997.0,98059,47.5018,-122.126,1250,9100,18.0,1997,2015-03-12
3/5/2015,250000.0,3,1.0,1130,7800,1.0,0.0,0.0,3,7,1130,0.0,1952,1952.0,98118,47.5239,-122.288,1170,7800,63.0,1952,2015-03-05
10/3/2014,475500.0,3,1.0,1500,9416,1.0,0.0,0.0,4,8,1500,0.0,1952,1952.0,98133,47.7135,-122.33200000000001,1440,7200,63.0,1952,2014-10-03
8/4/2014,672324.0,2,1.75,1600,5795,1.5,0.0,0.0,3,8,1600,0.0,1940,1940.0,98105,47.6709,-122.27600000000001,2310,6301,75.0,1940,2014-08-04
6/23/2014,420000.0,3,2.0,1200,5029,1.0,0.0,0.0,3,6,880,320.0,1937,1937.0,98115,47.6936,-122.294,1510,5854,78.0,1937,2014-06-23
12/29/2014,515000.0,3,2.0,1690,5100,1.5,0.0,0.0,5,7,1690,0.0,1907,1907.0,98117,47.6801,-122.38,1690,5100,108.0,1907,2014-12-29
11/5/2014,732350.0,4,2.5,2270,7665,2.0,0.0,0.0,3,9,2270,0.0,1986,1986.0,98052,47.6612,-122.148,2450,8706,29.0,1986,2014-11-05
6/5/2014,297500.0,4,2.5,1910,5000,2.0,0.0,0.0,3,7,1910,0.0,2005,2005.0,98038,47.3608,-122.036,2020,5000,10.0,2005,2014-06-05
10/8/2014,475000.0,3,1.5,1640,2720,1.5,0.0,0.0,3,8,1640,0.0,1929,1929.0,98115,47.6869,-122.31700000000001,1490,4375,86.0,1929,2014-10-08
5/5/2015,414000.0,4,2.5,2120,6497,2.0,0.0,0.0,3,7,2120,0.0,2003,2003.0,98019,47.7241,-121.95700000000001,2230,6300,12.0,2003,2015-05-05
6/26/2014,357250.0,3,1.5,1400,8840,1.0,0.0,0.0,4,6,1400,0.0,1952,1952.0,98125,47.7273,-122.309,1260,8840,63.0,1952,2014-06-26
10/30/2014,289950.0,2,1.0,760,6000,1.0,0.0,0.0,4,6,760,0.0,1950,1950.0,98133,47.7168,-122.34,950,6000,65.0,1950,2014-10-30
5/5/2015,550000.0,3,1.0,1070,3713,1.0,0.0,0.0,4,6,1070,0.0,1917,1917.0,98118,47.5683,-122.285,1290,3960,98.0,1917,2015-05-05
4/23/2015,446000.0,3,1.75,1460,9998,1.0,0.0,0.0,3,7,960,500.0,1958,1958.0,98028,47.7434,-122.242,1460,9998,57.0,1958,2015-04-23
10/15/2014,279000.0,3,1.5,1280,16738,1.5,0.0,0.0,4,5,1280,0.0,1932,1932.0,98038,47.3895,-122.023,1590,16317,83.0,1932,2014-10-15
8/21/2014,370000.0,3,2.25,1650,4859,2.0,0.0,0.0,3,7,1650,0.0,1988,1988.0,98011,47.7729,-122.17200000000001,1890,5018,27.0,1988,2014-08-21
10/17/2014,216000.0,3,2.0,1260,4125,1.0,0.0,0.0,3,6,1260,0.0,1998,1998.0,98188,47.4401,-122.279,1300,9091,17.0,1998,2014-10-17
6/21/2014,1100000.0,3,2.5,2200,20000,1.0,0.0,1.0,3,7,1400,800.0,1952,1952.0,98004,47.5809,-122.191,3050,11775,63.0,1952,2014-06-21
10/20/2014,1280000.0,4,2.5,3560,15450,1.0,0.0,1.0,5,8,2060,1500.0,1977,1977.0,98040,47.5657,-122.23,3680,17314,38.0,1977,2014-10-20
2/17/2015,355000.0,2,1.5,1140,2500,1.0,0.0,1.0,3,7,630,510.0,1988,1988.0,98106,47.5707,-122.359,1500,5000,27.0,1988,2015-02-17
9/11/2014,699000.0,4,2.5,2550,7312,2.0,0.0,0.0,3,9,2550,0.0,1988,1988.0,98008,47.6441,-122.113,2330,7480,27.0,1988,2014-09-11
9/2/2014,412000.0,3,2.5,1553,1991,3.0,0.0,0.0,3,8,1553,0.0,2014,2014.0,98133,47.7049,-122.34,1509,2431,1.0,2014,2014-09-02
2/5/2015,276000.0,2,1.0,1140,7200,1.0,0.0,0.0,3,6,1140,0.0,1923,1951.0,98065,47.5265,-121.823,1110,7200,64.0,1951,2015-02-05
9/4/2014,100000.0,2,1.0,790,6426,1.0,0.0,0.0,3,6,790,0.0,1944,1944.0,98178,47.4933,-122.245,1380,6946,71.0,1944,2014-09-04
7/1/2014,955500.0,4,1.75,2130,5080,1.5,0.0,0.0,3,8,2130,0.0,1914,1914.0,98119,47.6427,-122.363,1900,5080,101.0,1914,2014-07-01
3/29/2015,199000.0,3,1.0,1390,21262,1.0,0.0,0.0,3,7,1390,0.0,1958,1958.0,98058,47.4454,-122.185,1560,10800,57.0,1958,2015-03-29
6/25/2014,762000.0,4,3.5,4000,15253,2.0,0.0,0.0,3,9,4000,0.0,2007,2007.0,98065,47.5433,-121.887,3550,8747,8.0,2007,2014-06-25
5/6/2014,425000.0,4,2.0,1520,7983,1.0,0.0,0.0,5,7,1520,0.0,1967,1967.0,98034,47.7357,-122.193,1520,7783,48.0,1967,2014-05-06
11/4/2014,546000.0,2,1.0,1657,5031,2.0,0.0,0.0,3,7,1657,0.0,1910,1910.0,98116,47.5699,-122.389,2050,6201,105.0,1910,2014-11-04
4/20/2015,419600.0,3,1.75,1680,8460,1.0,0.0,0.0,3,7,1180,500.0,1976,1976.0,98133,47.7554,-122.353,1890,9529,39.0,1976,2015-04-20
6/23/2014,735000.0,4,2.25,2270,5102,1.0,0.0,0.0,5,8,1340,930.0,1954,1954.0,98199,47.6528,-122.40799999999999,1800,5102,61.0,1954,2014-06-23
4/22/2015,1230000.0,2,2.5,2470,609,3.0,0.0,0.0,3,11,1910,560.0,2011,2011.0,98112,47.6182,-122.31200000000001,2440,1229,4.0,2011,2015-04-22
7/7/2014,445000.0,2,2.0,1240,2500,2.0,0.0,0.0,3,7,1240,0.0,1985,1985.0,98117,47.6793,-122.395,1660,5000,30.0,1985,2014-07-07
1/6/2015,665000.0,3,2.0,1740,41275,1.0,0.0,0.0,3,8,1740,0.0,1974,1989.0,98045,47.4914,-121.76299999999999,2630,41275,26.0,1989,2015-01-06
3/17/2015,1290000.0,5,3.5,4090,290980,1.0,0.0,0.0,3,11,2920,1170.0,2002,2002.0,98034,47.7161,-122.219,1880,9255,13.0,2002,2015-03-17
12/8/2014,508500.0,4,2.75,2520,12500,2.0,0.0,0.0,3,8,1720,800.0,1979,1979.0,98074,47.6225,-122.064,2520,13000,36.0,1979,2014-12-08
12/10/2014,345950.0,5,1.0,1340,11198,1.5,0.0,0.0,3,8,1340,0.0,1934,1934.0,98155,47.736000000000004,-122.295,1390,8020,81.0,1934,2014-12-10
1/13/2015,207500.0,3,1.0,1640,9750,1.0,0.0,0.0,3,7,1640,0.0,1968,1968.0,98042,47.3256,-122.141,1200,9750,47.0,1968,2015-01-13
12/4/2014,1080000.0,4,2.5,3000,10920,1.0,0.0,0.0,4,8,1550,1450.0,1969,1969.0,98040,47.5347,-122.227,2380,10920,46.0,1969,2014-12-04
11/10/2014,640000.0,3,1.0,1210,3720,2.0,0.0,0.0,4,8,1210,0.0,1930,1930.0,98112,47.6317,-122.301,1560,6000,85.0,1930,2014-11-10
3/23/2015,329500.0,3,1.0,1810,13068,1.0,0.0,0.0,4,7,1360,450.0,1941,1941.0,98070,47.4482,-122.462,1400,13068,74.0,1941,2015-03-23
10/21/2014,460000.0,4,2.75,2200,9676,1.0,0.0,0.0,3,8,1500,700.0,1979,1979.0,98028,47.7713,-122.259,2120,9585,36.0,1979,2014-10-21
6/30/2014,1230000.0,3,1.75,2200,14630,1.5,0.0,1.0,3,8,2200,0.0,1948,2003.0,98004,47.6074,-122.213,2850,15803,12.0,2003,2014-06-30
11/20/2014,805000.0,5,3.0,2350,6480,2.0,0.0,3.0,4,7,1650,700.0,1924,1962.0,98118,47.558,-122.266,1840,7200,53.0,1962,2014-11-20
12/18/2014,200000.0,3,1.5,1090,10454,1.0,0.0,0.0,3,6,1090,0.0,1963,1963.0,98042,47.3425,-122.08200000000001,1230,12196,52.0,1963,2014-12-18
2/17/2015,749700.0,3,1.75,2280,77972,1.0,0.0,0.0,3,8,1460,820.0,1977,1977.0,98059,47.4804,-122.15100000000001,2460,14430,38.0,1977,2015-02-17
12/15/2014,535000.0,2,1.0,1520,3360,1.0,0.0,0.0,4,7,830,690.0,1927,1927.0,98117,47.6815,-122.382,1470,3774,88.0,1927,2014-12-15
10/28/2014,330000.0,3,2.25,1620,7150,1.0,0.0,2.0,4,7,1280,340.0,1950,1950.0,98178,47.5048,-122.241,1620,6930,65.0,1950,2014-10-28
7/30/2014,479200.0,3,2.0,1510,3750,1.5,0.0,0.0,4,7,1510,0.0,1928,1928.0,98116,47.5737,-122.383,1500,5000,87.0,1928,2014-07-30
5/13/2014,373000.0,5,2.5,3001,5710,2.0,0.0,0.0,3,8,3001,0.0,2006,2006.0,98042,47.3727,-122.177,2340,5980,9.0,2006,2014-05-13
3/19/2015,355000.0,4,1.5,2020,6000,1.0,0.0,0.0,4,7,1010,1010.0,1953,1953.0,98178,47.5019,-122.235,1710,6000,62.0,1953,2015-03-19
6/2/2014,275000.0,3,2.0,1380,4500,1.0,0.0,0.0,3,7,1380,0.0,2008,2008.0,98038,47.3661,-122.021,1620,4000,7.0,2008,2014-06-02
6/20/2014,380000.0,3,1.5,1520,4288,1.0,0.0,0.0,3,7,1020,500.0,1949,1949.0,98136,47.5284,-122.387,1660,4288,66.0,1949,2014-06-20
2/9/2015,417000.0,2,1.75,1090,4590,1.0,0.0,0.0,4,7,790,300.0,1915,1915.0,98105,47.6677,-122.324,1390,4080,100.0,1915,2015-02-09
10/21/2014,1170000.0,5,3.75,4220,15959,2.0,0.0,0.0,3,11,4220,0.0,2004,2004.0,98075,47.5869,-121.96700000000001,4630,16531,11.0,2004,2014-10-21
9/26/2014,598500.0,3,2.25,2520,12000,1.0,0.0,0.0,3,10,2520,0.0,1978,1978.0,98074,47.6381,-122.06200000000001,2510,12000,37.0,1978,2014-09-26
6/2/2014,629000.0,3,2.0,1760,5000,1.0,0.0,0.0,5,7,960,800.0,1920,1920.0,98199,47.6408,-122.40299999999999,1380,5000,95.0,1920,2014-06-02
10/9/2014,226950.0,2,1.0,930,6600,1.0,0.0,0.0,3,6,930,0.0,1957,1957.0,98168,47.4868,-122.33,1250,6600,58.0,1957,2014-10-09
12/31/2014,1230000.0,4,2.5,2600,11542,1.5,0.0,0.0,4,9,2200,400.0,1939,1939.0,98177,47.7076,-122.37700000000001,2840,10960,76.0,1939,2014-12-31
2/3/2015,415000.0,3,2.25,2180,11100,1.0,0.0,0.0,5,8,1700,480.0,1979,1979.0,98056,47.5162,-122.176,2350,11397,36.0,1979,2015-02-03
4/22/2015,595000.0,3,2.5,1910,3075,2.0,0.0,0.0,3,8,1910,0.0,2001,2001.0,98029,47.5491,-122.005,1940,3485,14.0,2001,2015-04-22
10/28/2014,209950.0,3,1.75,1100,5525,1.0,0.0,0.0,5,6,1100,0.0,1968,1968.0,98042,47.3625,-122.084,1050,5200,47.0,1968,2014-10-28
5/7/2015,568000.0,3,1.75,1760,235224,1.0,0.0,0.0,3,7,1760,0.0,1973,1973.0,98053,47.6735,-122.041,2320,87120,42.0,1973,2015-05-07
10/21/2014,119900.0,2,1.0,700,3180,1.0,0.0,0.0,3,6,480,220.0,1951,1951.0,98178,47.4976,-122.262,1760,6360,64.0,1951,2014-10-21
8/26/2014,207000.0,3,1.0,1080,10200,1.0,0.0,0.0,4,7,1080,0.0,1962,1962.0,98023,47.3215,-122.351,1230,10400,53.0,1962,2014-08-26
12/15/2014,195000.0,3,1.0,1070,22489,1.0,0.0,0.0,3,7,1070,0.0,1967,1967.0,98001,47.3278,-122.262,1880,20250,48.0,1967,2014-12-15
6/24/2014,324950.0,3,1.5,1460,8710,1.0,0.0,0.0,3,7,1460,0.0,1955,1955.0,98166,47.4561,-122.35700000000001,1400,8645,60.0,1955,2014-06-24
12/22/2014,210000.0,1,1.0,1050,7583,1.0,0.0,0.0,4,6,1050,0.0,1947,1947.0,98133,47.7294,-122.34100000000001,1420,7560,68.0,1947,2014-12-22
4/25/2015,1080000.0,4,2.75,3160,42733,2.0,0.0,0.0,3,9,3160,0.0,1995,1995.0,98053,47.6367,-121.958,1890,24000,20.0,1995,2015-04-25
12/4/2014,325088.0,4,1.0,1400,6739,1.0,0.0,0.0,3,7,1000,400.0,1954,1954.0,98108,47.5402,-122.29799999999999,1500,6380,61.0,1954,2014-12-04
1/16/2015,790000.0,4,3.0,3120,157875,2.0,0.0,0.0,4,8,3120,0.0,1977,1977.0,98058,47.443999999999996,-122.18700000000001,1580,7050,38.0,1977,2015-01-16
11/25/2014,150000.0,2,1.0,720,212137,1.0,0.0,0.0,3,5,720,0.0,1982,1982.0,98058,47.422,-122.066,2010,109642,33.0,1982,2014-11-25
10/30/2014,790000.0,3,3.0,2840,206910,2.0,0.0,0.0,3,10,2840,0.0,1999,1999.0,98059,47.468999999999994,-122.06299999999999,2070,25067,16.0,1999,2014-10-30
5/12/2014,255000.0,2,1.0,1220,2500,1.0,0.0,0.0,3,6,770,450.0,1910,1910.0,98126,47.5727,-122.37200000000001,1540,3000,105.0,1910,2014-05-12
11/7/2014,697000.0,4,3.0,2820,2850,1.5,0.0,0.0,5,7,1860,960.0,1928,1928.0,98117,47.6813,-122.367,1570,4500,87.0,1928,2014-11-07
11/4/2014,457500.0,2,1.0,840,5000,1.0,0.0,0.0,4,7,840,0.0,1908,1908.0,98117,47.6803,-122.37100000000001,1240,5000,107.0,1908,2014-11-04
5/19/2014,690000.0,3,2.0,1610,5100,1.5,0.0,0.0,5,8,1610,0.0,1940,1940.0,98115,47.6825,-122.307,1740,5100,75.0,1940,2014-05-19
3/11/2015,967000.0,4,3.25,1860,4356,2.0,0.0,0.0,3,9,1860,0.0,1917,2005.0,98103,47.6785,-122.351,1860,4356,10.0,2005,2015-03-11
4/29/2015,980000.0,4,1.75,2260,17711,1.0,0.0,1.0,4,9,2260,0.0,1968,1968.0,98040,47.5498,-122.214,2880,16594,47.0,1968,2015-04-29
5/21/2014,619420.0,4,2.75,2450,14803,2.0,0.0,0.0,4,9,2450,0.0,1988,1988.0,98059,47.5261,-122.162,2330,14803,27.0,1988,2014-05-21
10/13/2014,389000.0,2,1.0,850,3276,1.0,0.0,0.0,3,6,850,0.0,1910,1910.0,98103,47.6742,-122.35,1460,4100,105.0,1910,2014-10-13
12/10/2014,500000.0,3,1.0,1800,7200,1.0,0.0,0.0,3,7,1020,780.0,1964,1964.0,98118,47.5616,-122.275,1740,5475,51.0,1964,2014-12-10
9/26/2014,569000.0,4,1.75,1230,7890,1.0,0.0,1.0,4,7,1090,140.0,1950,1950.0,98004,47.5808,-122.189,2380,13176,65.0,1950,2014-09-26
7/28/2014,425000.0,4,2.25,2060,8540,1.0,0.0,0.0,4,7,1540,520.0,1967,1967.0,98034,47.733999999999995,-122.19,1560,7700,48.0,1967,2014-07-28
5/21/2014,635000.0,4,2.25,2750,6180,1.0,0.0,0.0,4,8,1500,1250.0,1948,1948.0,98118,47.5691,-122.28399999999999,1740,6180,67.0,1948,2014-05-21
5/19/2014,256500.0,2,1.0,1120,9912,1.0,0.0,0.0,4,6,1120,0.0,1980,1980.0,98070,47.3735,-122.43,1540,9750,35.0,1980,2014-05-19
1/23/2015,695000.0,4,2.5,3010,11393,2.0,0.0,0.0,3,8,3010,0.0,2005,2005.0,98028,47.7389,-122.221,2810,11282,10.0,2005,2015-01-23
7/30/2014,535000.0,4,1.5,1580,5000,1.5,0.0,0.0,3,7,1390,190.0,1945,1945.0,98107,47.6735,-122.39299999999999,1580,5000,70.0,1945,2014-07-30
4/10/2015,454200.0,4,2.5,2630,5379,2.0,0.0,0.0,3,8,2630,0.0,2004,2004.0,98059,47.4977,-122.163,2630,5379,11.0,2004,2015-04-10
1/23/2015,418500.0,2,1.0,790,5800,1.0,0.0,0.0,3,6,790,0.0,1943,1943.0,98117,47.6973,-122.36,1460,5800,72.0,1943,2015-01-23
6/5/2014,749950.0,4,2.75,3110,35235,2.0,0.0,0.0,4,9,3110,0.0,1983,1983.0,98072,47.7355,-122.095,2790,35445,32.0,1983,2014-06-05
10/19/2014,338500.0,3,1.75,2130,5489,1.0,0.0,0.0,3,8,1370,760.0,1999,1999.0,98070,47.4489,-122.456,1750,7200,16.0,1999,2014-10-19
7/22/2014,1250000.0,4,3.75,4520,9240,1.5,0.0,2.0,3,10,3270,1250.0,1992,1992.0,98040,47.5897,-122.229,3380,9240,23.0,1992,2014-07-22
7/11/2014,299950.0,3,2.5,1600,9830,2.0,0.0,0.0,4,8,1600,0.0,1993,1993.0,98001,47.339,-122.266,1890,8910,22.0,1993,2014-07-11
7/31/2014,325000.0,4,1.75,1950,12500,1.0,0.0,0.0,3,7,1330,620.0,1963,1963.0,98168,47.4999,-122.32700000000001,1760,11520,52.0,1963,2014-07-31
8/26/2014,434000.0,4,3.0,2010,8171,2.0,0.0,0.0,3,8,2010,0.0,1973,1973.0,98011,47.7688,-122.21799999999999,2090,8203,42.0,1973,2014-08-26
7/1/2014,328950.0,4,1.75,2550,8976,1.0,0.0,0.0,5,7,1300,1250.0,1978,1978.0,98058,47.4286,-122.179,2220,9477,37.0,1978,2014-07-01
5/19/2014,2100000.0,5,3.75,5340,10655,2.5,0.0,3.0,4,10,3740,1600.0,1912,1912.0,98144,47.5795,-122.285,3910,9418,103.0,1912,2014-05-19
4/29/2015,570000.0,4,2.0,2000,46902,2.0,0.0,0.0,3,8,2000,0.0,1978,1978.0,98075,47.5851,-122.072,2420,38130,37.0,1978,2015-04-29
9/16/2014,802000.0,3,2.25,2170,5001,2.0,0.0,0.0,3,8,2170,0.0,2014,2014.0,98103,47.6937,-122.338,1700,6991,1.0,2014,2014-09-16
10/24/2014,525000.0,3,1.0,1550,6840,1.5,0.0,0.0,3,7,1550,0.0,1918,1918.0,98103,47.6572,-122.335,2370,4560,97.0,1918,2014-10-24
2/2/2015,700000.0,6,3.0,2790,4550,2.5,0.0,0.0,4,8,2790,0.0,1907,1907.0,98119,47.626999999999995,-122.361,2590,4550,108.0,1907,2015-02-02
3/19/2015,350000.0,3,1.75,1980,273556,1.0,0.0,0.0,3,6,1040,940.0,1956,1999.0,98042,47.4012,-122.11,2180,217799,16.0,1999,2015-03-19
2/18/2015,277500.0,2,1.5,1190,1236,3.0,0.0,0.0,3,7,1190,0.0,2005,2005.0,98133,47.7274,-122.35700000000001,1390,1756,10.0,2005,2015-02-18
5/12/2014,1580000.0,5,2.75,3650,20150,1.0,0.0,0.0,4,10,2360,1290.0,1975,1975.0,98004,47.6215,-122.22399999999999,3220,19800,40.0,1975,2014-05-12
9/19/2014,195000.0,3,1.0,1510,4350,1.5,0.0,0.0,5,6,1510,0.0,1913,1913.0,98022,47.2052,-121.98700000000001,1210,5500,102.0,1913,2014-09-19
8/21/2014,222000.0,3,2.0,1200,6074,1.0,0.0,0.0,3,7,1200,0.0,1968,1968.0,98002,47.325,-122.205,1430,6338,47.0,1968,2014-08-21
4/16/2015,865000.0,5,3.0,2830,8854,1.0,0.0,0.0,4,8,1500,1330.0,1979,1979.0,98040,47.5743,-122.209,2260,8604,36.0,1979,2015-04-16
5/9/2014,445000.0,4,2.0,1650,6000,1.0,0.0,0.0,5,7,1000,650.0,1959,1959.0,98144,47.5834,-122.307,1540,6000,56.0,1959,2014-05-09
12/9/2014,495800.0,4,1.5,1710,4600,1.5,0.0,0.0,3,7,1710,0.0,1924,1924.0,98115,47.6847,-122.318,1740,4455,91.0,1924,2014-12-09
4/3/2015,548500.0,3,1.0,1740,4400,1.5,0.0,0.0,3,7,1740,0.0,1924,1924.0,98122,47.6059,-122.3,1720,4400,91.0,1924,2015-04-03
5/7/2014,310000.0,3,1.75,1840,10723,1.0,0.0,0.0,4,7,1220,620.0,1974,1974.0,98058,47.428999999999995,-122.154,1590,9820,41.0,1974,2014-05-07
7/11/2014,205000.0,3,1.5,1820,8585,1.0,0.0,0.0,4,7,1820,0.0,1962,1962.0,98055,47.4479,-122.213,1740,10088,53.0,1962,2014-07-11
9/10/2014,470000.0,5,3.75,3860,6901,2.0,0.0,0.0,3,7,3860,0.0,2003,2003.0,98038,47.3694,-122.03200000000001,3000,8584,12.0,2003,2014-09-10
4/23/2015,430000.0,3,1.5,1810,349351,1.5,0.0,0.0,3,7,1810,0.0,2002,2002.0,98010,47.3392,-121.897,2480,339332,13.0,2002,2015-04-23
5/1/2015,310000.0,2,2.0,1030,2271,3.0,0.0,0.0,3,7,1030,0.0,1999,1999.0,98125,47.7263,-122.314,1439,1387,16.0,1999,2015-05-01
3/25/2015,355000.0,4,1.0,1410,7693,1.5,0.0,0.0,4,7,1410,0.0,1953,1953.0,98133,47.7604,-122.331,1330,8395,62.0,1953,2015-03-25
1/27/2015,621500.0,5,2.5,2140,15950,1.0,0.0,2.0,4,8,1370,770.0,1968,1968.0,98166,47.4797,-122.35799999999999,2600,14273,47.0,1968,2015-01-27
6/10/2014,175000.0,6,1.5,1930,8400,1.0,0.0,0.0,3,7,1030,900.0,1971,1971.0,98146,47.4869,-122.34,1780,9520,44.0,1971,2014-06-10
1/7/2015,326000.0,6,1.5,1930,8400,1.0,0.0,0.0,3,7,1030,900.0,1971,1971.0,98146,47.4869,-122.34,1780,9520,44.0,1971,2015-01-07
9/12/2014,690000.0,4,3.5,1930,5400,1.5,0.0,2.0,3,7,1930,0.0,1920,1920.0,98116,47.5679,-122.40899999999999,1500,3340,95.0,1920,2014-09-12
8/19/2014,335000.0,4,2.5,2210,7214,2.0,0.0,0.0,3,8,2210,0.0,2003,2003.0,98003,47.3554,-122.29799999999999,2270,7246,12.0,2003,2014-08-19
2/24/2015,197000.0,4,1.0,1360,11175,1.0,0.0,0.0,3,7,1360,0.0,1961,1961.0,98188,47.4551,-122.272,1340,9702,54.0,1961,2015-02-24
7/3/2014,312500.0,3,1.75,1830,7969,1.0,0.0,0.0,3,7,930,900.0,1950,2008.0,98055,47.4667,-122.214,1790,7425,7.0,2008,2014-07-03
10/29/2014,436000.0,3,2.25,2120,6710,1.0,0.0,0.0,5,7,1420,700.0,1959,1959.0,98155,47.7461,-122.324,1880,6960,56.0,1959,2014-10-29
10/1/2014,1020000.0,4,2.5,2700,4590,2.0,0.0,0.0,3,8,2700,0.0,2002,2002.0,98103,47.6734,-122.329,2080,3570,13.0,2002,2014-10-01
8/26/2014,805000.0,4,2.5,3160,35225,2.0,0.0,1.0,3,9,2250,910.0,1992,1992.0,98006,47.5672,-122.111,3460,17223,23.0,1992,2014-08-26
1/5/2015,652427.0,4,2.25,2770,13129,2.0,0.0,0.0,4,8,2770,0.0,1979,1979.0,98074,47.6268,-122.05,2400,13129,36.0,1979,2015-01-05
10/18/2014,1010000.0,3,2.5,2240,41339,1.0,0.0,0.0,4,9,2240,0.0,1945,1992.0,98005,47.6483,-122.163,2900,45738,23.0,1992,2014-10-18
11/6/2014,355000.0,4,2.5,2570,6466,2.0,0.0,0.0,3,9,2570,0.0,1999,1999.0,98092,47.3324,-122.17,2520,6667,16.0,1999,2014-11-06
7/29/2014,334550.0,2,1.0,880,12000,1.0,0.0,0.0,3,7,880,0.0,1939,1939.0,98133,47.7436,-122.35600000000001,1960,9395,76.0,1939,2014-07-29
7/8/2014,557500.0,3,2.25,1820,9670,2.0,0.0,0.0,3,8,1820,0.0,1984,1984.0,98052,47.6382,-122.11,2160,11424,31.0,1984,2014-07-08
11/3/2014,277500.0,4,2.25,1660,7184,1.0,0.0,0.0,3,7,1110,550.0,1963,1963.0,98188,47.4678,-122.294,1640,7200,52.0,1963,2014-11-03
7/7/2014,300000.0,4,3.0,2200,10800,1.0,0.0,0.0,3,6,2200,0.0,1960,1960.0,98058,47.4476,-122.169,1430,10800,55.0,1960,2014-07-07
2/25/2015,325000.0,4,1.0,1640,3844,1.5,0.0,0.0,4,7,1460,180.0,1928,1928.0,98133,47.7017,-122.354,1230,3844,87.0,1928,2015-02-25
3/19/2015,402500.0,4,2.0,1650,3504,1.0,0.0,0.0,3,7,760,890.0,1951,2013.0,98144,47.5803,-122.294,1480,3504,2.0,2013,2015-03-19
8/20/2014,461000.0,3,1.75,1420,5170,1.0,0.0,0.0,4,7,1420,0.0,1963,1963.0,98007,47.6151,-122.145,2250,7700,52.0,1963,2014-08-20
3/27/2015,540000.0,3,1.0,1270,3840,1.5,0.0,0.0,3,7,1270,0.0,1926,1926.0,98103,47.6896,-122.35700000000001,1270,4175,89.0,1926,2015-03-27
3/16/2015,385000.0,3,1.0,1070,4000,1.0,0.0,0.0,4,7,1070,0.0,1971,1971.0,98108,47.5529,-122.305,1090,4000,44.0,1971,2015-03-16
7/8/2014,480000.0,2,1.0,1060,3040,1.0,0.0,0.0,3,7,860,200.0,1924,1924.0,98103,47.6725,-122.329,1470,3814,91.0,1924,2014-07-08
6/9/2014,539950.0,3,2.25,2190,7149,1.0,0.0,1.0,4,8,1240,950.0,1963,1963.0,98056,47.5243,-122.204,3500,7149,52.0,1963,2014-06-09
7/18/2014,529000.0,3,2.25,1940,217800,2.0,0.0,0.0,3,9,1940,0.0,1990,1990.0,98024,47.5636,-121.932,2580,83558,25.0,1990,2014-07-18
8/20/2014,417000.0,3,2.5,1300,877,2.0,0.0,0.0,3,7,1060,240.0,2008,2008.0,98199,47.6591,-122.39200000000001,1320,1414,7.0,2008,2014-08-20
2/17/2015,405000.0,3,1.5,1330,12500,1.0,0.0,0.0,3,7,1330,0.0,1966,1966.0,98027,47.5263,-122.051,2310,12500,49.0,1966,2015-02-17
7/23/2014,299000.0,3,2.25,1940,9100,1.0,0.0,0.0,4,8,1630,310.0,1966,1966.0,98023,47.3133,-122.36399999999999,2080,9100,49.0,1966,2014-07-23
8/13/2014,299000.0,3,1.75,2100,15480,1.0,0.0,0.0,3,7,2100,0.0,1983,1983.0,98001,47.2924,-122.271,1330,15657,32.0,1983,2014-08-13
5/14/2014,372220.0,3,1.0,1290,5500,1.0,0.0,0.0,3,7,980,310.0,1951,1951.0,98136,47.5266,-122.39200000000001,1680,5000,64.0,1951,2014-05-14
5/22/2014,494400.0,2,1.75,1560,1750,1.0,0.0,0.0,4,6,780,780.0,1904,1904.0,98109,47.6347,-122.355,1850,3600,111.0,1904,2014-05-22
9/24/2014,280000.0,3,1.75,2630,6500,1.0,0.0,0.0,3,7,1330,1300.0,1958,1958.0,98055,47.4878,-122.221,2520,6500,57.0,1958,2014-09-24
11/21/2014,277950.0,3,2.5,2100,6021,2.0,0.0,0.0,3,7,2100,0.0,1992,1992.0,98023,47.2917,-122.375,2091,7547,23.0,1992,2014-11-21
12/19/2014,770000.0,3,2.75,2070,54557,2.0,0.0,0.0,3,8,2070,0.0,1996,1996.0,98058,47.4659,-122.116,2190,49658,19.0,1996,2014-12-19
10/8/2014,760000.0,4,2.5,2960,28005,2.0,0.0,0.0,3,10,2960,0.0,1989,1989.0,98072,47.7477,-122.117,3510,35248,26.0,1989,2014-10-08
1/26/2015,230000.0,2,2.0,1300,3608,1.0,0.0,0.0,3,7,1300,0.0,2004,2004.0,98198,47.3623,-122.309,1510,3608,11.0,2004,2015-01-26
10/2/2014,525000.0,4,2.5,2520,7731,2.0,0.0,0.0,3,9,2520,0.0,1994,1994.0,98155,47.7709,-122.29700000000001,2000,7704,21.0,1994,2014-10-02
7/1/2014,307000.0,3,1.0,1150,6000,1.5,0.0,0.0,3,7,1150,0.0,1927,1927.0,98045,47.4963,-121.787,1210,7700,88.0,1927,2014-07-01
6/18/2014,253779.0,4,2.0,2030,9600,1.5,0.0,0.0,3,6,1430,600.0,1947,1947.0,98188,47.4459,-122.272,1820,14600,68.0,1947,2014-06-18
6/17/2014,405000.0,3,1.5,1880,7400,1.0,0.0,0.0,3,8,1480,400.0,1968,1968.0,98155,47.7743,-122.27,1820,8660,47.0,1968,2014-06-17
3/12/2015,360000.0,2,1.0,2320,11250,2.0,0.0,0.0,4,6,2320,0.0,1942,1942.0,98146,47.504,-122.36200000000001,1620,11250,73.0,1942,2015-03-12
5/11/2015,521000.0,2,1.0,1050,7500,1.5,0.0,3.0,4,6,1050,0.0,1910,1910.0,98116,47.5577,-122.399,2540,13680,105.0,1910,2015-05-11
9/26/2014,680000.0,4,2.5,3030,13068,2.0,0.0,0.0,3,9,3030,0.0,1978,1978.0,98005,47.6313,-122.17200000000001,2940,11999,37.0,1978,2014-09-26
12/3/2014,355000.0,1,0.75,530,33278,1.0,0.0,2.0,4,4,530,0.0,1950,1950.0,98074,47.6412,-122.079,2830,14311,65.0,1950,2014-12-03
6/23/2014,200000.0,3,1.5,1090,9600,1.0,0.0,0.0,4,7,1090,0.0,1968,1968.0,98042,47.3639,-122.109,1240,9620,47.0,1968,2014-06-23
7/8/2014,330000.0,3,2.25,2220,4060,1.0,0.0,0.0,3,7,1330,890.0,1993,1993.0,98118,47.5188,-122.265,1930,5625,22.0,1993,2014-07-08
8/12/2014,221000.0,3,2.25,1430,5999,2.0,0.0,0.0,3,7,1430,0.0,1987,1987.0,98023,47.3116,-122.35799999999999,1600,5999,28.0,1987,2014-08-12
2/4/2015,1600000.0,4,4.5,3780,6000,2.0,0.0,4.0,4,11,2770,1010.0,1910,1977.0,98116,47.5922,-122.38799999999999,2660,6000,38.0,1977,2015-02-04
7/23/2014,310000.0,2,1.0,1560,4920,1.0,0.0,0.0,4,6,780,780.0,1947,1947.0,98125,47.7248,-122.325,1760,7510,68.0,1947,2014-07-23
4/9/2015,862000.0,4,2.25,2220,4200,1.5,0.0,0.0,5,8,1310,910.0,1932,1932.0,98199,47.6418,-122.39399999999999,2020,4940,83.0,1932,2015-04-09
6/19/2014,200000.0,3,1.5,1140,8340,1.0,0.0,0.0,3,7,1140,0.0,1960,1960.0,98168,47.4773,-122.28,1140,8340,55.0,1960,2014-06-19
9/30/2014,630000.0,4,2.5,2540,11100,1.0,0.0,0.0,5,7,2540,0.0,1957,1957.0,98008,47.6317,-122.124,1560,11100,58.0,1957,2014-09-30
3/20/2015,432250.0,3,2.25,1440,6232,2.0,0.0,0.0,3,7,1440,0.0,1985,1985.0,98029,47.5658,-122.01799999999999,1740,5999,30.0,1985,2015-03-20
1/23/2015,478000.0,3,2.25,1570,9500,1.0,0.0,0.0,4,7,1070,500.0,1977,1977.0,98033,47.6843,-122.185,2250,9583,38.0,1977,2015-01-23
7/23/2014,249000.0,4,2.25,1860,9576,1.0,0.0,0.0,3,7,1400,460.0,1962,1962.0,98032,47.3612,-122.28399999999999,1860,9576,53.0,1962,2014-07-23
6/5/2014,495000.0,5,3.0,2440,4750,1.0,0.0,0.0,3,9,1450,990.0,2006,2006.0,98108,47.5485,-122.302,1420,5940,9.0,2006,2014-06-05
11/13/2014,630000.0,4,2.5,2100,8800,1.0,0.0,2.0,4,7,1240,860.0,1960,1960.0,98008,47.6146,-122.11399999999999,2000,8800,55.0,1960,2014-11-13
6/26/2014,550000.0,4,2.5,2150,27540,2.0,0.0,0.0,3,8,2150,0.0,1997,1997.0,98053,47.637,-121.969,2150,27540,18.0,1997,2014-06-26
9/19/2014,350000.0,3,2.5,2440,18674,2.0,0.0,0.0,4,8,2440,0.0,1994,1994.0,98042,47.3672,-122.126,2530,10603,21.0,1994,2014-09-19
12/2/2014,270000.0,5,1.5,1930,7480,2.0,0.0,0.0,3,7,1930,0.0,1966,1966.0,98058,47.4503,-122.15700000000001,1480,7705,49.0,1966,2014-12-02
10/7/2014,488250.0,4,2.0,1830,9610,1.0,0.0,0.0,3,7,1830,0.0,1963,1963.0,98033,47.695,-122.176,1970,10754,52.0,1963,2014-10-07
5/16/2014,248000.0,4,3.5,1850,6519,2.0,0.0,0.0,3,7,1130,720.0,1986,1986.0,98023,47.3087,-122.354,1280,6664,29.0,1986,2014-05-16
8/14/2014,889000.0,4,3.5,3210,5000,3.0,0.0,0.0,3,9,3210,0.0,2014,2014.0,98136,47.5203,-122.39299999999999,1360,5000,1.0,2014,2014-08-14
8/27/2014,375000.0,1,1.0,1090,5250,1.0,0.0,0.0,3,6,980,110.0,1927,1927.0,98117,47.6999,-122.391,2160,5250,88.0,1927,2014-08-27
11/26/2014,933000.0,3,1.5,1870,3300,2.0,0.0,2.0,3,7,1870,0.0,1906,1906.0,98102,47.6221,-122.325,1820,2460,109.0,1906,2014-11-26
1/2/2015,625000.0,3,2.25,1920,8412,1.0,0.0,2.0,3,8,1460,460.0,1977,1977.0,98006,47.5578,-122.132,2490,8700,38.0,1977,2015-01-02
7/28/2014,328000.0,2,1.0,700,4350,1.0,0.0,0.0,3,6,700,0.0,1943,1943.0,98116,47.5577,-122.391,1620,5100,72.0,1943,2014-07-28
7/18/2014,470000.0,4,2.25,3380,9900,1.0,0.0,2.0,4,8,1690,1690.0,1969,1969.0,98166,47.4438,-122.34,2390,9900,46.0,1969,2014-07-18
2/13/2015,502500.0,5,2.5,2430,6168,2.0,0.0,0.0,3,8,2430,0.0,2007,2007.0,98056,47.5237,-122.199,2150,8400,8.0,2007,2015-02-13
4/7/2015,484000.0,3,1.75,1950,17400,1.0,0.0,0.0,3,7,1210,740.0,1976,1976.0,98072,47.7424,-122.09100000000001,1900,17250,39.0,1976,2015-04-07
8/7/2014,252500.0,2,1.0,900,7500,1.0,0.0,0.0,4,6,900,0.0,1961,1961.0,98014,47.6481,-121.916,1190,10000,54.0,1961,2014-08-07
8/21/2014,610000.0,3,2.5,2060,8893,2.0,0.0,0.0,3,8,2060,0.0,1987,1987.0,98006,47.5615,-122.165,2650,8500,28.0,1987,2014-08-21
7/25/2014,419000.0,4,2.0,2180,10447,1.0,0.0,0.0,4,8,1280,900.0,1969,1969.0,98155,47.7675,-122.279,2190,10987,46.0,1969,2014-07-25
7/17/2014,322500.0,4,2.25,2140,9377,2.0,0.0,0.0,4,8,2140,0.0,1986,1986.0,98092,47.2649,-122.21799999999999,2030,7846,29.0,1986,2014-07-17
1/6/2015,563000.0,6,1.0,1730,2760,1.5,0.0,0.0,3,7,1250,480.0,1918,1918.0,98109,47.6342,-122.353,1630,3200,97.0,1918,2015-01-06
3/24/2015,464000.0,4,2.5,3140,12591,2.0,0.0,0.0,3,9,3140,0.0,1993,1993.0,98042,47.3826,-122.146,2650,11720,22.0,1993,2015-03-24
6/17/2014,870000.0,4,4.25,3010,4887,2.0,0.0,3.0,4,10,1940,1070.0,1951,1951.0,98115,47.6933,-122.272,2540,9375,64.0,1951,2014-06-17
2/3/2015,280000.0,2,1.5,800,1196,2.0,0.0,0.0,3,8,800,0.0,2003,2003.0,98103,47.6972,-122.34100000000001,1020,1087,12.0,2003,2015-02-03
9/12/2014,850000.0,3,2.5,3300,11570,2.0,0.0,0.0,3,9,3300,0.0,1994,1994.0,98006,47.5599,-122.12100000000001,3280,11446,21.0,1994,2014-09-12
10/22/2014,458950.0,2,1.0,1530,4370,1.0,0.0,0.0,3,7,1130,400.0,1946,1946.0,98115,47.6888,-122.30799999999999,1580,4275,69.0,1946,2014-10-22
4/22/2015,122000.0,2,1.0,760,5280,1.0,0.0,0.0,3,6,760,0.0,1946,1946.0,98168,47.483000000000004,-122.33,1710,6594,69.0,1946,2015-04-22
5/13/2014,525000.0,5,3.0,2450,4591,2.0,0.0,0.0,3,7,2450,0.0,1994,1994.0,98117,47.6828,-122.38799999999999,1060,5500,21.0,1994,2014-05-13
7/16/2014,286300.0,2,1.0,1000,31838,1.0,0.0,0.0,3,7,1000,0.0,1962,1962.0,98045,47.4789,-121.779,1490,39747,53.0,1962,2014-07-16
7/18/2014,218450.0,2,1.0,840,7425,1.0,0.0,0.0,4,6,840,0.0,1952,1952.0,98166,47.4749,-122.339,1300,11674,63.0,1952,2014-07-18
9/5/2014,525000.0,3,1.5,1380,4290,1.0,0.0,0.0,3,7,1080,300.0,1955,1955.0,98107,47.674,-122.37899999999999,1510,3900,60.0,1955,2014-09-05
12/22/2014,650000.0,3,1.5,1380,4290,1.0,0.0,0.0,3,7,1080,300.0,1955,1955.0,98107,47.674,-122.37899999999999,1510,3900,60.0,1955,2014-12-22
6/25/2014,356000.0,4,2.0,2020,48693,1.5,0.0,0.0,3,7,2020,0.0,1949,1949.0,98045,47.4646,-121.759,1610,34900,66.0,1949,2014-06-25
5/29/2014,436500.0,2,1.0,1260,5000,1.0,0.0,0.0,3,7,1040,220.0,1951,1951.0,98117,47.6782,-122.397,1510,5000,64.0,1951,2014-05-29
8/7/2014,410000.0,3,1.75,1440,7112,1.0,0.0,0.0,3,7,1180,260.0,1979,1979.0,98034,47.7304,-122.227,1570,9152,36.0,1979,2014-08-07
9/11/2014,512500.0,4,1.75,1540,8311,1.0,0.0,0.0,4,7,1540,0.0,1950,1950.0,98125,47.7046,-122.29299999999999,1890,7996,65.0,1950,2014-09-11
8/18/2014,510000.0,4,1.0,1060,7200,1.0,0.0,1.0,3,6,880,180.0,1925,1925.0,98118,47.5591,-122.26799999999999,1910,7200,90.0,1925,2014-08-18
9/18/2014,566000.0,4,1.75,1900,10297,1.0,0.0,0.0,4,8,1900,0.0,1966,1966.0,98005,47.5944,-122.155,2220,9612,49.0,1966,2014-09-18
9/10/2014,525000.0,3,1.75,2870,26500,1.5,0.0,1.0,3,8,2870,0.0,1948,1981.0,98166,47.4485,-122.355,2420,20500,34.0,1981,2014-09-10
8/7/2014,435000.0,3,1.0,1050,5500,1.0,0.0,0.0,3,6,930,120.0,1920,1920.0,98126,47.5402,-122.38,1410,5834,95.0,1920,2014-08-07
12/31/2014,406500.0,3,2.75,1840,68479,1.0,0.0,2.0,3,8,1340,500.0,1989,1989.0,98014,47.6802,-121.90799999999999,2060,61903,26.0,1989,2014-12-31
10/7/2014,550000.0,5,2.75,3000,9473,1.0,0.0,0.0,3,8,1500,1500.0,1966,1966.0,98052,47.6567,-122.13,2050,8820,49.0,1966,2014-10-07
2/26/2015,251000.0,3,2.0,1200,10212,1.5,0.0,0.0,5,6,1200,0.0,1949,1949.0,98022,47.206,-121.99799999999999,1280,10212,66.0,1949,2015-02-26
12/11/2014,830000.0,3,1.5,1840,10125,1.0,0.0,0.0,4,8,1220,620.0,1959,1959.0,98040,47.5607,-122.21700000000001,2320,10160,56.0,1959,2014-12-11
4/14/2015,803000.0,4,2.5,2790,7673,2.0,0.0,0.0,3,9,2790,0.0,1989,1989.0,98052,47.6692,-122.13600000000001,2740,7837,26.0,1989,2015-04-14
4/7/2015,206000.0,3,1.0,970,9360,1.0,0.0,0.0,4,5,970,0.0,1942,1942.0,98002,47.2808,-122.225,1050,11348,73.0,1942,2015-04-07
7/30/2014,200000.0,4,1.0,1070,7467,1.5,0.0,0.0,3,7,1070,0.0,1944,1944.0,98178,47.4942,-122.235,1160,7467,71.0,1944,2014-07-30
5/6/2014,219000.0,2,1.0,900,5160,1.0,0.0,0.0,3,6,900,0.0,1952,1952.0,98106,47.525,-122.35600000000001,900,5160,63.0,1952,2014-05-06
9/5/2014,777000.0,4,4.0,2680,6000,1.0,0.0,0.0,3,7,1380,1300.0,1962,2014.0,98199,47.6557,-122.38799999999999,1930,6000,1.0,2014,2014-09-05
2/18/2015,593700.0,3,2.5,2000,22000,2.0,0.0,0.0,3,8,2000,0.0,1979,1979.0,98075,47.59,-122.081,2180,19800,36.0,1979,2015-02-18
6/3/2014,712500.0,3,1.5,1660,8797,1.0,0.0,0.0,4,7,1660,0.0,1956,1956.0,98004,47.5892,-122.20200000000001,2350,10053,59.0,1956,2014-06-03
7/14/2014,600000.0,4,1.5,1770,6014,1.5,0.0,0.0,4,7,1240,530.0,1946,1946.0,98116,47.5773,-122.39299999999999,1740,6014,69.0,1946,2014-07-14
3/30/2015,554663.0,3,2.0,1230,6802,1.5,0.0,0.0,3,7,1230,0.0,1940,1940.0,98105,47.6712,-122.279,1850,6398,75.0,1940,2015-03-30
7/3/2014,267000.0,3,1.0,1740,10875,1.0,0.0,0.0,4,7,1020,720.0,1962,1962.0,98188,47.4682,-122.28299999999999,1470,8532,53.0,1962,2014-07-03
9/24/2014,390000.0,3,2.0,1710,8910,1.0,0.0,0.0,5,7,1710,0.0,1953,1953.0,98133,47.7719,-122.338,1430,8493,62.0,1953,2014-09-24
4/1/2015,335000.0,6,2.0,2020,7071,1.0,0.0,0.0,3,7,1010,1010.0,1979,1979.0,98108,47.5329,-122.294,2020,5000,36.0,1979,2015-04-01
4/23/2015,938000.0,4,2.5,2410,9886,1.0,0.0,0.0,5,8,1990,420.0,1975,1975.0,98040,47.5351,-122.223,2530,10658,40.0,1975,2015-04-23
4/7/2015,370000.0,4,2.75,2310,14745,1.0,0.0,0.0,3,7,1410,900.0,1993,1993.0,98198,47.376999999999995,-122.31,2060,9678,22.0,1993,2015-04-07
4/2/2015,335000.0,5,2.5,2400,4548,2.0,0.0,0.0,3,7,2400,0.0,2003,2003.0,98042,47.371,-122.12700000000001,2200,4465,12.0,2003,2015-04-02
4/21/2015,695000.0,5,2.0,3160,3990,1.5,0.0,0.0,3,7,1870,1290.0,1923,1923.0,98103,47.653999999999996,-122.337,1780,4240,92.0,1923,2015-04-21
6/6/2014,387500.0,3,1.0,1560,14333,1.0,0.0,0.0,4,7,1560,0.0,1953,1953.0,98166,47.431999999999995,-122.348,1640,14333,62.0,1953,2014-06-06
3/18/2015,245000.0,3,2.5,1770,6187,2.0,0.0,0.0,3,7,1770,0.0,1992,1992.0,98031,47.4034,-122.189,1650,7200,23.0,1992,2015-03-18
7/29/2014,308550.0,3,2.0,1600,13200,1.0,0.0,0.0,3,7,1600,0.0,1990,1990.0,98045,47.4656,-121.756,1360,11520,25.0,1990,2014-07-29
6/24/2014,225000.0,3,1.75,1330,13102,1.0,0.0,0.0,3,7,1330,0.0,1968,1968.0,98003,47.3172,-122.322,1270,11475,47.0,1968,2014-06-24
9/3/2014,715000.0,4,2.5,2970,29163,2.0,0.0,0.0,3,9,2970,0.0,1993,1993.0,98053,47.6717,-122.025,3100,31105,22.0,1993,2014-09-03
5/6/2015,335000.0,3,1.0,1020,10200,1.0,0.0,0.0,4,7,1020,0.0,1954,1954.0,98133,47.7503,-122.348,1170,8188,61.0,1954,2015-05-06
8/21/2014,634000.0,3,2.5,2490,4904,2.0,0.0,0.0,3,9,2490,0.0,2003,2003.0,98029,47.5451,-122.014,2370,4050,12.0,2003,2014-08-21
5/14/2014,337500.0,5,2.0,1700,7314,1.0,0.0,0.0,3,7,1000,700.0,1956,1956.0,98108,47.549,-122.305,2000,7176,59.0,1956,2014-05-14
9/4/2014,440000.0,1,1.0,850,6567,1.0,0.0,0.0,4,6,850,0.0,1940,1940.0,98010,47.327,-122.039,2160,9794,75.0,1940,2014-09-04
7/17/2014,350000.0,3,1.75,1250,13775,1.0,0.0,2.0,3,7,1250,0.0,1990,1990.0,98045,47.4981,-121.772,1260,13707,25.0,1990,2014-07-17
1/14/2015,400000.0,2,1.0,610,4560,1.0,0.0,0.0,3,5,610,0.0,1918,1918.0,98136,47.5498,-122.383,930,1392,97.0,1918,2015-01-14
8/15/2014,1290000.0,4,3.5,3700,13175,2.0,0.0,0.0,4,11,3700,0.0,1989,1989.0,98006,47.5471,-122.133,3880,15508,26.0,1989,2014-08-15
4/6/2015,435000.0,3,1.0,950,10080,1.0,0.0,0.0,4,7,950,0.0,1954,1954.0,98006,47.571999999999996,-122.139,1060,10000,61.0,1954,2015-04-06
9/29/2014,681000.0,4,2.5,3860,5130,2.0,0.0,0.0,3,8,2930,930.0,2004,2004.0,98065,47.5387,-121.87899999999999,3130,6163,11.0,2004,2014-09-29
6/29/2014,397000.0,3,3.5,1360,1275,2.0,0.0,0.0,3,8,1240,120.0,2007,2007.0,98144,47.5904,-122.315,1360,1275,8.0,2007,2014-06-29
9/26/2014,775000.0,4,2.5,3890,34513,2.0,0.0,0.0,3,10,3890,0.0,1996,1996.0,98077,47.7749,-122.04799999999999,3600,28435,19.0,1996,2014-09-26
7/7/2014,480000.0,3,2.25,1680,9090,1.0,0.0,0.0,4,7,1130,550.0,1959,1959.0,98008,47.6068,-122.13,1960,9090,56.0,1959,2014-07-07
9/9/2014,158000.0,3,2.5,1520,7200,2.0,0.0,0.0,4,7,1520,0.0,1985,1985.0,98030,47.3679,-122.182,1780,7210,30.0,1985,2014-09-09
7/23/2014,590000.0,3,2.0,2420,208652,1.5,0.0,0.0,3,8,2420,0.0,2005,2005.0,98010,47.3666,-121.978,3180,212137,10.0,2005,2014-07-23
9/2/2014,772500.0,5,2.75,3890,9130,2.0,0.0,0.0,3,9,3890,0.0,2004,2004.0,98065,47.5407,-121.86,3450,8361,11.0,2004,2014-09-02
2/17/2015,464500.0,5,1.5,2940,13425,1.0,0.0,0.0,3,8,1470,1470.0,1955,1955.0,98155,47.7632,-122.29,1580,8200,60.0,1955,2015-02-17
4/24/2015,281000.0,3,1.75,1350,8737,1.0,0.0,0.0,3,7,1350,0.0,1966,1966.0,98188,47.4378,-122.279,1600,8928,49.0,1966,2015-04-24
7/22/2014,620000.0,3,2.25,2190,45738,1.0,0.0,0.0,3,8,2190,0.0,1990,1990.0,98052,47.7108,-122.12,2970,4496,25.0,1990,2014-07-22
6/17/2014,475000.0,3,2.25,2280,5750,1.0,0.0,1.0,4,7,1150,1130.0,1985,1985.0,98116,47.5641,-122.39299999999999,1500,5060,30.0,1985,2014-06-17
10/17/2014,245000.0,2,2.0,1070,4500,1.0,0.0,0.0,4,6,910,160.0,1932,1932.0,98055,47.4896,-122.204,1280,4500,83.0,1932,2014-10-17
7/29/2014,660000.0,5,2.25,2540,3750,1.5,0.0,0.0,4,7,1510,1030.0,1925,1925.0,98115,47.6729,-122.29899999999999,1780,3750,90.0,1925,2014-07-29
12/4/2014,527500.0,4,2.25,2270,8480,1.0,0.0,0.0,5,8,1310,960.0,1973,1973.0,98006,47.5448,-122.17399999999999,1910,9050,42.0,1973,2014-12-04
10/27/2014,135000.0,2,1.0,1220,7250,1.0,0.0,0.0,4,6,1220,0.0,1914,1914.0,98010,47.3585,-121.975,1350,20250,101.0,1914,2014-10-27
5/6/2015,275000.0,3,1.75,1890,5000,1.0,0.0,0.0,3,7,1890,0.0,2003,2003.0,98092,47.3357,-122.175,2960,5421,12.0,2003,2015-05-06
2/10/2015,430000.0,4,2.0,1990,4740,1.0,0.0,0.0,3,7,1080,910.0,1926,1926.0,98122,47.6112,-122.303,1560,2370,89.0,1926,2015-02-10
8/25/2014,213500.0,3,1.0,1220,6000,1.0,0.0,0.0,4,7,1220,0.0,1968,1968.0,98002,47.3245,-122.209,1420,6000,47.0,1968,2014-08-25
9/12/2014,535000.0,3,3.0,2640,5978,2.0,0.0,0.0,3,9,2640,0.0,2012,2012.0,98045,47.4759,-121.735,2680,6060,3.0,2012,2014-09-12
2/13/2015,641000.0,3,1.75,1480,9603,1.0,0.0,0.0,3,7,1480,0.0,1952,1952.0,98004,47.5915,-122.20200000000001,2660,10766,63.0,1952,2015-02-13
10/28/2014,436300.0,3,2.0,2320,9420,1.0,0.0,0.0,5,7,2320,0.0,1952,1952.0,98056,47.5133,-122.196,2030,9420,63.0,1952,2014-10-28
10/14/2014,1440000.0,4,1.75,2410,6000,1.5,0.0,0.0,3,8,2410,0.0,1911,1911.0,98109,47.6369,-122.355,1280,4000,104.0,1911,2014-10-14
3/27/2015,830000.0,4,2.75,2090,13500,1.0,0.0,0.0,4,8,2090,0.0,1949,1949.0,98040,47.573,-122.225,2130,13500,66.0,1949,2015-03-27
7/22/2014,380000.0,3,1.0,920,3532,1.0,0.0,0.0,3,6,920,0.0,1910,1910.0,98118,47.5539,-122.26799999999999,1250,4000,105.0,1910,2014-07-22
2/20/2015,132500.0,3,0.75,850,8573,1.0,0.0,0.0,3,6,600,250.0,1945,1945.0,98146,47.503,-122.35600000000001,850,8382,70.0,1945,2015-02-20
12/1/2014,179950.0,3,1.0,1130,9907,1.0,0.0,0.0,3,7,1130,0.0,1954,1954.0,98188,47.4362,-122.286,1320,9907,61.0,1954,2014-12-01
4/20/2015,188200.0,3,1.0,1260,7265,1.0,0.0,0.0,4,7,1260,0.0,1954,1954.0,98002,47.2979,-122.22399999999999,940,7200,61.0,1954,2015-04-20
7/2/2014,659000.0,4,2.0,2090,10800,1.0,0.0,0.0,4,7,2090,0.0,1951,1951.0,98040,47.5759,-122.223,2090,10800,64.0,1951,2014-07-02
10/22/2014,317000.0,3,2.0,2020,7260,1.5,0.0,0.0,3,7,1180,840.0,1926,1926.0,98108,47.5496,-122.311,1400,5950,89.0,1926,2014-10-22
11/24/2014,625000.0,3,2.25,1970,4564,1.0,0.0,0.0,3,8,1470,500.0,1959,1959.0,98199,47.6703,-122.41,1980,5000,56.0,1959,2014-11-24
6/13/2014,350000.0,3,1.75,1820,9545,1.0,0.0,0.0,3,7,1230,590.0,1976,1976.0,98155,47.7772,-122.296,1790,9530,39.0,1976,2014-06-13
6/25/2014,750000.0,3,1.5,1840,5000,1.5,0.0,0.0,5,7,1340,500.0,1915,1915.0,98107,47.6652,-122.36200000000001,1840,5000,100.0,1915,2014-06-25
8/27/2014,457000.0,4,1.75,2100,10358,1.0,0.0,0.0,5,8,1280,820.0,1959,1959.0,98133,47.7478,-122.338,2080,9000,56.0,1959,2014-08-27
3/4/2015,632500.0,4,2.0,1770,5000,2.0,0.0,0.0,4,7,1770,0.0,1906,1906.0,98107,47.6748,-122.38600000000001,1550,5000,109.0,1906,2015-03-04
7/2/2014,223000.0,3,2.0,1110,7231,1.0,0.0,0.0,4,7,1110,0.0,1991,1991.0,98031,47.4036,-122.191,1550,7245,24.0,1991,2014-07-02
9/2/2014,610000.0,4,2.75,2090,8400,1.0,0.0,0.0,4,8,1240,850.0,1976,1976.0,98052,47.6872,-122.12299999999999,2340,9000,39.0,1976,2014-09-02
10/24/2014,385000.0,4,1.75,2080,8215,2.0,0.0,0.0,4,7,2080,0.0,1948,1948.0,98155,47.736999999999995,-122.305,1550,8215,67.0,1948,2014-10-24
3/24/2015,367500.0,3,3.25,1400,1343,2.0,0.0,0.0,3,7,1160,240.0,2005,2005.0,98118,47.5483,-122.277,1400,1326,10.0,2005,2015-03-24
8/4/2014,385100.0,3,1.0,1060,8040,1.0,0.0,0.0,4,6,1060,0.0,1949,1949.0,98125,47.7121,-122.287,1300,7620,66.0,1949,2014-08-04
12/29/2014,230000.0,2,1.0,720,5913,1.0,0.0,0.0,3,6,720,0.0,1920,1920.0,98118,47.5447,-122.27,1560,6600,95.0,1920,2014-12-29
6/23/2014,286000.0,3,2.75,1100,750,2.0,0.0,0.0,3,7,780,320.0,2008,2008.0,98106,47.5601,-122.363,1170,4800,7.0,2008,2014-06-23
3/26/2015,201700.0,3,1.0,1010,9576,1.0,0.0,0.0,4,7,1010,0.0,1967,1967.0,98001,47.2956,-122.272,1540,9576,48.0,1967,2015-03-26
4/23/2015,1350000.0,4,4.75,5230,89298,2.5,0.0,0.0,3,11,5230,0.0,2002,2002.0,98038,47.4097,-122.06299999999999,4110,107153,13.0,2002,2015-04-23
5/19/2014,525000.0,4,1.75,2420,7672,1.0,0.0,0.0,3,8,1480,940.0,1979,1979.0,98027,47.5637,-122.085,2370,7699,36.0,1979,2014-05-19
2/2/2015,361000.0,3,1.5,1200,7236,1.0,0.0,0.0,3,7,1200,0.0,1975,1975.0,98011,47.739,-122.194,1680,7800,40.0,1975,2015-02-02
9/23/2014,530000.0,3,1.5,1950,1963,3.0,0.0,0.0,3,8,1950,0.0,2002,2002.0,98117,47.6904,-122.397,1590,2028,13.0,2002,2014-09-23
10/8/2014,455000.0,3,2.25,1870,7403,1.0,0.0,0.0,3,7,1870,0.0,1950,1950.0,98125,47.7171,-122.32,1630,7440,65.0,1950,2014-10-08
11/20/2014,421000.0,4,2.25,1310,8400,1.0,0.0,0.0,4,7,1310,0.0,1966,1966.0,98034,47.7317,-122.181,1600,8400,49.0,1966,2014-11-20
5/2/2014,640000.0,4,2.0,1520,6200,1.5,0.0,0.0,3,7,1520,0.0,1945,1945.0,98115,47.678000000000004,-122.26899999999999,1910,6200,70.0,1945,2014-05-02
3/31/2015,240000.0,3,1.0,1270,12733,1.0,0.0,0.0,3,7,1270,0.0,1955,1955.0,98188,47.445,-122.27600000000001,1660,11536,60.0,1955,2015-03-31
10/24/2014,360000.0,2,1.0,840,7414,1.0,0.0,0.0,4,6,840,0.0,1928,1928.0,98033,47.6771,-122.17200000000001,1740,9784,87.0,1928,2014-10-24
3/24/2015,157340.0,2,1.0,900,23000,1.0,0.0,0.0,2,7,900,0.0,1953,1953.0,98042,47.3576,-122.156,1460,8265,62.0,1953,2015-03-24
4/15/2015,1240000.0,4,3.0,3010,6139,2.0,0.0,4.0,5,8,2560,450.0,1950,1950.0,98115,47.6799,-122.26799999999999,2100,6798,65.0,1950,2015-04-15
5/6/2014,250000.0,3,1.0,1050,6874,1.0,0.0,0.0,3,6,1050,0.0,1954,1954.0,98133,47.762,-122.355,1500,8954,61.0,1954,2014-05-06
2/25/2015,735000.0,6,2.75,3360,84506,1.0,0.0,0.0,5,7,2040,1320.0,1962,1962.0,98052,47.715,-122.12100000000001,2190,43124,53.0,1962,2015-02-25
1/15/2015,884900.0,7,4.75,5370,10800,1.5,0.0,0.0,3,8,5370,0.0,1967,1967.0,98040,47.538000000000004,-122.223,2310,10910,48.0,1967,2015-01-15
10/23/2014,775000.0,3,3.5,2690,104544,2.0,0.0,0.0,3,8,2690,0.0,1948,1990.0,98072,47.7717,-122.11200000000001,2300,81698,25.0,1990,2014-10-23
5/2/2014,463000.0,3,1.75,1710,7320,1.0,0.0,0.0,3,7,1710,0.0,1948,1948.0,98155,47.7512,-122.281,2260,8839,67.0,1948,2014-05-02
6/23/2014,579000.0,3,2.5,1640,1269,3.0,0.0,0.0,3,8,1640,0.0,2009,2009.0,98112,47.6197,-122.3,1590,1231,6.0,2009,2014-06-23
7/9/2014,570000.0,6,3.75,4000,6015,2.0,0.0,2.0,3,10,3080,920.0,2004,2004.0,98058,47.453,-122.118,3180,5700,11.0,2004,2014-07-09
3/31/2015,1060000.0,5,4.5,4140,7924,2.0,0.0,0.0,3,10,4140,0.0,2005,2005.0,98074,47.6102,-121.993,3960,8410,10.0,2005,2015-03-31
9/9/2014,375000.0,4,2.75,3140,24800,1.0,0.0,0.0,4,8,2080,1060.0,1971,1971.0,98042,47.3782,-122.161,2850,12900,44.0,1971,2014-09-09
12/9/2014,422000.0,2,1.75,1320,2609,1.0,0.0,0.0,4,7,920,400.0,1938,1938.0,98117,47.6878,-122.366,1200,4220,77.0,1938,2014-12-09
2/9/2015,866500.0,4,3.5,3080,4945,2.0,0.0,0.0,3,9,2010,1070.0,2014,2014.0,98126,47.5662,-122.37899999999999,1220,4945,1.0,2014,2015-02-09
4/13/2015,705000.0,3,2.5,2500,10359,2.0,0.0,0.0,3,10,2500,0.0,1986,1986.0,98074,47.6286,-122.051,2580,10142,29.0,1986,2015-04-13
10/29/2014,470000.0,4,2.5,2520,9684,2.0,0.0,0.0,3,8,2520,0.0,1994,1994.0,98045,47.4848,-121.801,2090,10133,21.0,1994,2014-10-29
12/18/2014,360000.0,3,1.25,2350,6200,1.0,0.0,0.0,4,7,1320,1030.0,1966,1966.0,98007,47.5979,-122.135,2140,9543,49.0,1966,2014-12-18
4/29/2015,795000.0,4,2.5,2570,13450,1.0,0.0,4.0,3,8,1510,1060.0,1948,1948.0,98155,47.7429,-122.285,3470,12615,67.0,1948,2015-04-29
3/30/2015,800000.0,4,2.5,3100,7807,2.0,0.0,0.0,3,9,3100,0.0,2003,2003.0,98034,47.7151,-122.227,3100,7807,12.0,2003,2015-03-30
5/29/2014,2450000.0,4,3.5,4730,13586,1.5,0.0,0.0,5,10,4270,460.0,1935,1935.0,98112,47.6319,-122.288,3710,8828,80.0,1935,2014-05-29
4/8/2015,277284.0,3,1.75,1030,4800,1.0,0.0,0.0,3,6,930,100.0,1927,1927.0,98126,47.566,-122.37299999999999,1540,4800,88.0,1927,2015-04-08
4/13/2015,460000.0,2,1.0,1020,4002,1.0,0.0,0.0,5,7,1020,0.0,1953,1953.0,98116,47.5828,-122.395,1780,5000,62.0,1953,2015-04-13
5/4/2015,898888.0,3,2.5,2080,3729,2.0,0.0,0.0,3,9,2080,0.0,1996,1996.0,98033,47.6731,-122.199,2080,4000,19.0,1996,2015-05-04
8/6/2014,211000.0,3,1.0,1410,47916,1.0,0.0,0.0,3,7,1410,0.0,1981,1981.0,98019,47.7149,-121.96,1810,215622,34.0,1981,2014-08-06
8/28/2014,222000.0,2,2.0,1360,3300,2.0,0.0,0.0,3,6,1360,0.0,2004,2004.0,98038,47.3489,-122.022,1310,3300,11.0,2004,2014-08-28
5/29/2014,672000.0,3,2.5,2620,21587,2.0,0.0,0.0,3,7,2620,0.0,1992,1992.0,98053,47.6384,-121.959,2570,23650,23.0,1992,2014-05-29
10/20/2014,778000.0,3,2.25,2260,33080,1.0,0.0,0.0,5,9,1690,570.0,1974,1974.0,98005,47.6386,-122.18299999999999,3020,35291,41.0,1974,2014-10-20
1/21/2015,312500.0,3,1.75,1490,9493,1.0,0.0,0.0,4,8,1490,0.0,1976,1976.0,98058,47.4514,-122.134,2440,9600,39.0,1976,2015-01-21
7/14/2014,650000.0,4,2.5,2530,6500,1.5,0.0,0.0,3,8,1720,810.0,1975,1975.0,98115,47.6737,-122.28399999999999,2150,5280,40.0,1975,2014-07-14
8/26/2014,740000.0,6,2.25,3140,10250,1.0,0.0,0.0,4,8,1570,1570.0,1959,1959.0,98005,47.6116,-122.169,2320,10250,56.0,1959,2014-08-26
8/26/2014,320000.0,3,2.0,1820,17600,1.0,0.0,0.0,5,7,1820,0.0,1972,1972.0,98059,47.4703,-122.11200000000001,2190,17440,43.0,1972,2014-08-26
5/8/2015,455000.0,4,2.5,1770,13168,2.0,0.0,0.0,3,7,1770,0.0,1990,1990.0,98019,47.7306,-121.96600000000001,2050,14859,25.0,1990,2015-05-08
5/13/2014,2450000.0,5,4.0,4430,9000,2.0,0.0,0.0,3,10,4430,0.0,2013,2013.0,98004,47.6168,-122.21600000000001,2470,9490,2.0,2013,2014-05-13
12/3/2014,500000.0,3,3.25,1490,902,3.0,0.0,0.0,3,8,1220,270.0,2001,2001.0,98102,47.6357,-122.324,1550,1092,14.0,2001,2014-12-03
6/11/2014,325000.0,3,1.75,1790,27427,1.0,0.0,0.0,3,7,1130,660.0,1978,1978.0,98065,47.532,-121.76100000000001,1610,16684,37.0,1978,2014-06-11
9/12/2014,416000.0,3,2.5,1710,1296,3.0,0.0,0.0,3,8,1510,200.0,2004,2004.0,98103,47.6963,-122.34200000000001,1610,1282,11.0,2004,2014-09-12
3/18/2015,495000.0,4,2.25,2070,20280,2.0,0.0,0.0,4,7,2070,0.0,1968,1968.0,98072,47.773999999999994,-122.134,2190,21560,47.0,1968,2015-03-18
5/5/2014,549000.0,2,1.0,1140,5400,1.0,0.0,0.0,5,7,1140,0.0,1908,1908.0,98112,47.6205,-122.294,1520,4800,107.0,1908,2014-05-05
8/25/2014,589000.0,5,2.0,3930,10150,1.5,0.0,0.0,4,8,3070,860.0,1968,1968.0,98008,47.6317,-122.11399999999999,2200,8190,47.0,1968,2014-08-25
11/21/2014,194820.0,3,1.5,1100,32700,1.0,0.0,0.0,3,7,1100,0.0,1967,1967.0,98001,47.3186,-122.289,1616,32700,48.0,1967,2014-11-21
12/16/2014,405000.0,3,2.5,2260,5500,1.5,0.0,0.0,3,7,1280,980.0,1910,1910.0,98117,47.681000000000004,-122.38799999999999,1790,5355,105.0,1910,2014-12-16
4/8/2015,625000.0,3,2.5,2260,5500,1.5,0.0,0.0,3,7,1280,980.0,1910,1910.0,98117,47.681000000000004,-122.38799999999999,1790,5355,105.0,1910,2015-04-08
11/13/2014,205000.0,3,1.0,1130,7014,1.0,0.0,0.0,3,7,1130,0.0,1954,1954.0,98168,47.4743,-122.274,1440,9350,61.0,1954,2014-11-13
6/23/2014,345100.0,3,3.75,1950,8625,1.0,0.0,0.0,3,8,1360,590.0,1959,1959.0,98178,47.505,-122.258,1950,6670,56.0,1959,2014-06-23
10/20/2014,200000.0,3,1.0,960,7500,1.0,0.0,0.0,3,6,960,0.0,1953,1953.0,98178,47.4966,-122.255,1250,6000,62.0,1953,2014-10-20
2/12/2015,1910000.0,4,3.5,4210,18564,2.0,0.0,0.0,3,11,4210,0.0,2001,2001.0,98039,47.6206,-122.225,3520,18564,14.0,2001,2015-02-12
10/29/2014,524500.0,3,1.5,3430,264844,1.0,0.0,2.0,3,7,2230,1200.0,1988,1988.0,98045,47.4476,-121.723,1660,145926,27.0,1988,2014-10-29
8/26/2014,598600.0,4,2.75,3470,212639,2.0,0.0,0.0,3,7,2070,1400.0,1993,1993.0,98019,47.7066,-121.96799999999999,2370,233917,22.0,1993,2014-08-26
12/9/2014,367777.0,5,3.0,2140,5937,1.0,0.0,0.0,3,7,1280,860.0,1978,1978.0,98118,47.5459,-122.27,1820,6710,37.0,1978,2014-12-09
5/7/2014,750000.0,3,2.75,2520,5401,1.0,0.0,0.0,4,7,1360,1160.0,1946,1946.0,98119,47.6452,-122.37299999999999,1800,5036,69.0,1946,2014-05-07
11/5/2014,575000.0,5,2.25,3550,7992,2.0,0.0,0.0,3,8,3550,0.0,1968,1968.0,98034,47.7285,-122.179,2110,7992,47.0,1968,2014-11-05
4/30/2015,84000.0,2,1.0,700,20130,1.0,0.0,0.0,3,6,700,0.0,1949,1949.0,98168,47.4752,-122.271,1490,18630,66.0,1949,2015-04-30
12/18/2014,255000.0,2,1.0,740,5000,1.0,0.0,0.0,4,6,740,0.0,1926,1926.0,98118,47.5298,-122.273,1170,4968,89.0,1926,2014-12-18
5/20/2014,1740000.0,4,3.75,3300,4545,1.5,0.0,4.0,3,10,2600,700.0,1926,1999.0,98105,47.6561,-122.274,3300,5000,16.0,1999,2014-05-20
5/13/2015,415000.0,3,2.25,1640,5880,1.0,0.0,0.0,3,7,1240,400.0,1977,1977.0,98106,47.5323,-122.351,1200,4760,38.0,1977,2015-05-13
5/7/2015,449900.0,3,2.5,2780,8225,2.0,0.0,1.0,3,9,2780,0.0,1990,1990.0,98198,47.3509,-122.323,720,9736,25.0,1990,2015-05-07
9/19/2014,220000.0,5,1.5,1830,94960,1.5,0.0,0.0,3,7,1830,0.0,1929,1929.0,98031,47.4218,-122.21799999999999,1440,16365,86.0,1929,2014-09-19
4/10/2015,899000.0,4,2.5,3540,9349,2.0,0.0,0.0,3,10,3540,0.0,2003,2003.0,98052,47.7046,-122.10700000000001,3280,7546,12.0,2003,2015-04-10
7/14/2014,430000.0,3,2.5,1440,7320,1.0,0.0,0.0,5,7,1440,0.0,1954,1954.0,98125,47.7179,-122.316,1160,6941,61.0,1954,2014-07-14
1/30/2015,472500.0,4,2.5,2960,223462,2.0,0.0,0.0,3,10,2960,0.0,2001,2001.0,98030,47.3646,-122.211,2770,16482,14.0,2001,2015-01-30
12/29/2014,680000.0,6,2.5,3180,9375,1.0,0.0,0.0,4,8,1590,1590.0,1967,1967.0,98006,47.5707,-122.12899999999999,2670,9625,48.0,1967,2014-12-29
3/5/2015,1650000.0,5,4.0,3310,8400,2.0,0.0,0.0,3,10,3310,0.0,2000,2000.0,98033,47.6914,-122.214,3430,8400,15.0,2000,2015-03-05
11/18/2014,810000.0,3,2.0,2390,8025,2.0,0.0,0.0,5,7,2390,0.0,1921,1921.0,98105,47.6707,-122.288,1920,5350,94.0,1921,2014-11-18
3/5/2015,605000.0,3,2.5,2460,138085,2.0,0.0,0.0,4,9,2460,0.0,1977,1977.0,98027,47.4572,-122.007,2090,219542,38.0,1977,2015-03-05
7/25/2014,522000.0,3,1.75,1630,15600,1.0,0.0,0.0,3,7,1630,0.0,1958,1958.0,98033,47.68,-122.165,1830,10850,57.0,1958,2014-07-25
2/3/2015,759000.0,5,2.75,3490,8230,2.0,0.0,0.0,3,10,3490,0.0,2005,2005.0,98075,47.5825,-121.97,3480,7331,10.0,2005,2015-02-03
5/19/2014,411000.0,4,2.75,2500,5257,2.0,0.0,0.0,3,8,2500,0.0,1966,1966.0,98118,47.5293,-122.287,1660,5970,49.0,1966,2014-05-19
3/6/2015,286950.0,4,2.5,2080,9846,1.0,0.0,0.0,3,7,1240,840.0,1984,1984.0,98001,47.3338,-122.26799999999999,1890,7977,31.0,1984,2015-03-06
6/10/2014,440000.0,3,1.5,1290,1286,3.0,0.0,0.0,3,7,1290,0.0,2000,2000.0,98103,47.6617,-122.34899999999999,1720,1286,15.0,2000,2014-06-10
5/23/2014,149000.0,3,1.0,1700,8645,1.0,0.0,0.0,3,6,1700,0.0,1955,1955.0,98146,47.4899,-122.337,1500,7980,60.0,1955,2014-05-23
11/12/2014,284700.0,3,1.0,1700,8645,1.0,0.0,0.0,3,6,1700,0.0,1955,1955.0,98146,47.4899,-122.337,1500,7980,60.0,1955,2014-11-12
9/9/2014,374950.0,3,2.5,2540,11562,1.0,0.0,1.0,3,8,1290,1250.0,1964,1964.0,98028,47.7614,-122.229,2230,10310,51.0,1964,2014-09-09
9/16/2014,816000.0,3,1.5,1180,8545,1.0,0.0,0.0,3,8,1180,0.0,1952,1952.0,98004,47.623999999999995,-122.2,1660,9000,63.0,1952,2014-09-16
11/21/2014,533250.0,4,1.75,1520,15398,1.0,0.0,0.0,4,7,1370,150.0,1960,1960.0,98027,47.5265,-122.05,1840,12500,55.0,1960,2014-11-21
6/3/2014,689800.0,3,2.75,2390,9313,1.0,0.0,0.0,5,8,1390,1000.0,1942,1942.0,98133,47.7209,-122.331,2390,12712,73.0,1942,2014-06-03
8/13/2014,775000.0,4,2.75,2740,6200,1.5,0.0,3.0,4,8,1820,920.0,1947,1947.0,98125,47.7084,-122.277,2430,6000,68.0,1947,2014-08-13
5/6/2015,702000.0,3,2.5,2190,8528,1.0,0.0,0.0,3,8,1760,430.0,1991,1991.0,98033,47.6943,-122.209,2060,9811,24.0,1991,2015-05-06
7/8/2014,160000.0,3,1.0,1350,8700,1.5,0.0,0.0,3,6,1350,0.0,1942,1942.0,98188,47.4497,-122.289,1300,8700,73.0,1942,2014-07-08
3/9/2015,255500.0,3,1.0,1350,8700,1.5,0.0,0.0,3,6,1350,0.0,1942,1942.0,98188,47.4497,-122.289,1300,8700,73.0,1942,2015-03-09
12/2/2014,949000.0,4,2.75,2980,42253,1.0,0.0,0.0,4,9,1860,1120.0,1973,1973.0,98005,47.6392,-122.163,2980,42253,42.0,1973,2014-12-02
7/31/2014,169500.0,2,1.0,790,7450,1.0,0.0,0.0,4,6,790,0.0,1944,1944.0,98058,47.4743,-122.17,800,7450,71.0,1944,2014-07-31
9/15/2014,586000.0,4,2.25,2130,9000,2.0,0.0,0.0,4,8,2130,0.0,1965,1965.0,98006,47.5716,-122.15899999999999,2110,10431,50.0,1965,2014-09-15
2/3/2015,680000.0,4,2.5,2700,37431,1.0,0.0,0.0,4,8,1600,1100.0,1978,1978.0,98072,47.7258,-122.117,2290,37431,37.0,1978,2015-02-03
12/8/2014,851500.0,3,2.0,3200,18184,1.0,0.0,0.0,5,8,2000,1200.0,1977,1977.0,98005,47.6034,-122.17200000000001,1670,7416,38.0,1977,2014-12-08
5/14/2014,582500.0,2,1.5,1159,4800,1.0,0.0,0.0,3,7,1159,0.0,1948,1948.0,98199,47.6592,-122.399,1640,4800,67.0,1948,2014-05-14
8/26/2014,637000.0,4,3.5,3080,118918,2.0,0.0,0.0,3,9,3080,0.0,2008,2008.0,98019,47.7721,-121.92399999999999,1830,434728,7.0,2008,2014-08-26
1/28/2015,225000.0,3,1.0,1000,9295,1.0,0.0,0.0,3,7,1000,0.0,1955,1955.0,98146,47.483999999999995,-122.346,1320,13500,60.0,1955,2015-01-28
12/31/2014,795000.0,3,3.25,2260,3727,2.0,0.0,0.0,3,8,1880,380.0,2003,2003.0,98119,47.6422,-122.361,1600,4800,12.0,2003,2014-12-31
8/18/2014,304999.0,4,2.25,2270,9600,1.0,0.0,0.0,3,7,1290,980.0,1976,1976.0,98023,47.3261,-122.355,1930,15000,39.0,1976,2014-08-18
5/5/2015,95000.0,1,0.75,760,5746,1.0,0.0,0.0,4,5,760,0.0,1915,1915.0,98002,47.3046,-122.215,970,6696,100.0,1915,2015-05-05
10/16/2014,240000.0,4,1.75,1420,5382,1.0,0.0,0.0,5,5,1040,380.0,1942,1942.0,98056,47.4946,-122.18700000000001,1150,5382,73.0,1942,2014-10-16
8/13/2014,772000.0,4,2.5,2500,8680,1.0,0.0,0.0,4,7,1250,1250.0,1958,1958.0,98004,47.6073,-122.19200000000001,2140,8680,57.0,1958,2014-08-13
11/13/2014,245000.0,2,1.5,1450,6258,1.0,0.0,0.0,4,8,1450,0.0,1983,1983.0,98198,47.3785,-122.322,1460,5375,32.0,1983,2014-11-13
12/5/2014,430000.0,5,3.0,2500,5750,1.0,0.0,0.0,3,8,1430,1070.0,1999,1999.0,98126,47.551,-122.369,1980,7130,16.0,1999,2014-12-05
6/11/2014,799000.0,3,1.5,2210,6300,1.5,0.0,0.0,5,8,2210,0.0,1916,1916.0,98144,47.5892,-122.29,2700,6300,99.0,1916,2014-06-11
4/17/2015,880000.0,5,2.75,3020,9187,2.0,0.0,0.0,3,9,3020,0.0,2007,2007.0,98033,47.6806,-122.167,2250,9675,8.0,2007,2015-04-17
12/8/2014,750000.0,4,2.5,3290,7538,2.0,0.0,0.0,3,9,3290,0.0,2004,2004.0,98075,47.598,-121.97200000000001,3450,7538,11.0,2004,2014-12-08
